id,user_id,screen_name,source,created_at,retweet_count,favorite_count,text,in_reply_to_screen_name,in_reply_to_status_id,retweeted_status_id,retweeted_status_user_id,retweeted_status_screen_name
625724066331275264,24183358,congculberson,Twitter Web Client,2015-07-27 17:46:57,4,2,Let's keep it simple and lower our taxes! RT if you agree &amp; check out my op-ed at @FairTaxOfficial to learn more http://t.co/Tdbf8Fb0VI,,,,,
623533042552958976,24183358,congculberson,Twitter Web Client,2015-07-21 16:40:36,3,4,"We pray 4 the fallen Chattanooga Marines, Navy Petty Officer &amp; their families Our freedom is their precious gift 2 us http://t.co/cQcN83btXN",,,,,
620995751603249153,24183358,congculberson,Twitter Web Client,2015-07-14 16:38:19,5,8,Culberson amendment prevents release of dangerous illegal aliens - staff http://t.co/iGYUVoPGQV http://t.co/eIcZsQ5SHh,,,,,
619589413467762688,24183358,congculberson,Twitter Web Client,2015-07-10 19:30:02,4,2,ICYMI: @HoustonChron talked about my efforts to protect churches from IRS bullying http://t.co/2jwmGNvoqq,,,,,
619230904897175552,24183358,congculberson,Twitter Web Client,2015-07-09 19:45:27,1,1,"Education bill passed by House last night contains Culberson language restoring parental rights, local control -staff http://t.co/7Iv0RdbV0m",,,,,
614477181729832960,24183358,congculberson,Twitter Web Client,2015-06-26 16:55:51,2,3,Here is my statement on today's Supreme Court ruling regarding marriage:  http://t.co/yD8lPHm8YA,,,,,
614476360057257984,24183358,congculberson,Twitter Web Client,2015-06-26 16:52:35,1,2,Here is my statement on yesterday's Supreme Court ruling on Obamacare: http://t.co/p5sdNR3qQS,,,,,
611245763180523520,24183358,congculberson,Twitter Web Client,2015-06-17 18:55:20,3,2,My amendment protecting churches from IRS bullying was adopted by the @HouseAppropsGOP Committee today http://t.co/goeaS4KO1t.,,,,,
610499412683571200,24183358,congculberson,Twitter Web Client,2015-06-15 17:29:37,1,2,The 7th District's 2015 Service Academy nominees are some the best &amp; brightest    http://t.co/XrdovgDWlB http://t.co/ZYBs7XRnDH,,,,,
610488768685043713,24183358,congculberson,Twitter Web Client,2015-06-15 16:47:19,2,1,ICYMI: @ThisIsFusion article on why NASA's #Europa mission is so important  http://t.co/p03ogMUBG6 - staff,,,,,
606879222473355264,24183358,congculberson,Twitter Web Client,2015-06-05 17:44:16,5,4,Spoke w/ @CamEdwrds about how my CJS bill stops Obama's backdoor gun control using power of the purse @NRA http://t.co/7C9iDde6II,,,,,
606487259353870336,24183358,congculberson,Twitter Web Client,2015-06-04 15:46:45,3,3,"CJS Bill approved by House prioritizes law enforcement, supports scientific research &amp; space exploration http://t.co/6xj6n7T1tf -staff",,,,,
606239047527317504,24183358,congculberson,Twitter Web Client,2015-06-03 23:20:26,7,0,"RT @HouseAppropsGOP: The House just approved the FY16 Commerce, Justice, Science Appropriations Bill on a vote of 242-183. http://t.co/zzHK…",,,606235684089806848,301549400,HouseAppropsGOP
606239009048809472,24183358,congculberson,Twitter Web Client,2015-06-03 23:20:17,4,0,"RT @HouseAppropsGOP: .@RepHalRogers applauds passage of H.R. 2578, the FY16 Commerce, Justice, Science Appropriations Bill http://t.co/FOJ0…",,,606236569608044544,301549400,HouseAppropsGOP
606143432474656768,24183358,congculberson,Twitter Web Client,2015-06-03 17:00:30,2,0,RT @HouseAppropsGOP: .@CongCulberson: The bottom line with this bill is that we want to ensure that the law enacted by Congress is enforced.,,,605799629704167424,301549400,HouseAppropsGOP
605800606905692160,24183358,congculberson,Twitter Web Client,2015-06-02 18:18:14,2,0,"RT @HouseAppropsGOP: .@CongCulberson is presenting HR 2578, the FY16 Commerce, Justice, Science funding bill. Watch floor debate live: http…",,,605797054577713154,301549400,HouseAppropsGOP
603301131889025026,24183358,congculberson,Twitter Web Client,2015-05-26 20:46:13,2,1,So glad the rain stopped and water levels are dropping! Here is the link to emergency alerts: http://t.co/REeLY2OBgs,,,,,
602919029385363456,24183358,congculberson,Twitter Web Client,2015-05-25 19:27:52,2,4,Today we honor the sacrifice of America's best &amp; bravest &amp; pray for their families. #fallensoldiers #MemorialDay http://t.co/CeavI34RWA,,,,,
601090352200753153,24183358,congculberson,Twitter Web Client,2015-05-20 18:21:22,3,0,"RT @HoustonMatters: ""@METROHouston has agreed to do what I had asked all along which was walk away from building rail on Richmond."" @CongCu…",,,600709546676461569,1267854704,HoustonMatters
601083714408427521,24183358,congculberson,Twitter Web Client,2015-05-20 17:54:59,2,0,"RT @HouseAppropsGOP: .@CongCulberson: CJS bill provides $51.4B (2.5% over FY15). Within its wide range of programs, we had to prioritize. h…",,,601034226180423680,301549400,HouseAppropsGOP
601083595126665216,24183358,congculberson,Twitter Web Client,2015-05-20 17:54:31,1,0,RT @HouseAppropsGOP: .@CongCulberson: bill includes numerous oversight provisions to protect hard-earned tax dollars.,,,601036251882459136,301549400,HouseAppropsGOP
600346241206214656,24183358,congculberson,Twitter Web Client,2015-05-18 17:04:32,3,0,RT @HouseAppropsGOP: .@CongCulberson: Bill increases funds for 55 new immigration judge teams to reduce immigration case backlog.,,,598863044303843329,301549400,HouseAppropsGOP
600346213171523585,24183358,congculberson,Twitter Web Client,2015-05-18 17:04:25,1,0,RT @HouseAppropsGOP: .@CongCulberson: We found an additional $50M for @NSF - above the historically high fiscal year 2015 level.,,,598863898113093632,301549400,HouseAppropsGOP
600346170658029568,24183358,congculberson,Twitter Web Client,2015-05-18 17:04:15,1,0,"RT @HouseAppropsGOP: .@CongCulberson: we eliminated unnecessary or unauthorized progs, froze or reduced $ for more than 12 agencies that ca…",,,598864361340403712,301549400,HouseAppropsGOP
599266293771018240,24183358,congculberson,Twitter Web Client,2015-05-15 17:33:12,2,2,"CJS bill makes law enforcement, space exploration, research top priorities while protecting taxpayer dollars: http://t.co/pN3mT4fHaI -staff",,,,,
599209656641257472,24183358,congculberson,Twitter Web Client,2015-05-15 13:48:09,96,71,Thank you to the men and women in law enforcement who risk their lives to protect ours. #PoliceWeek http://t.co/LbRCsL8qRi,,,,,
595972361343639552,24183358,congculberson,Twitter Web Client,2015-05-06 15:24:18,3,2,Congrats Amber Wang of Taylor HS on winning Congressional Art Competition @THS_Mustangs http://t.co/JjFZaKps0R -staff http://t.co/RNePgwQYFZ,,,,,
593830892331769856,24183358,congculberson,Twitter Web Client,2015-04-30 17:34:52,9,4,Good meeting with @ConcernedVets @RDuerstine. Working together to reduce the wait list ASAP. http://t.co/1VWFcUggqg,,,,,
593812554545295360,24183358,congculberson,Twitter Web Client,2015-04-30 16:22:00,1,1,Rep. Culberson introduced Space Leadership Preservation Act yesterday to change business as usual at #NASA http://t.co/wZJv2tXja0 -staff,,,,,
591230125406089216,24183358,congculberson,Twitter Web Client,2015-04-23 13:20:21,2,1,Introduced bill with @SenatorWicker to protect our individual liberty &amp; restore States’ rights http://t.co/E34d6yGC5A #10thAmendment,,,,,
591227981437267969,24183358,congculberson,Twitter Web Client,2015-04-23 13:11:49,2,0,RT @SenatorWicker: Introduced legislation w/@CongCulberson today to restore 10thAmdt rights for states &amp; the American ppl: http://t.co/9y6G…,,,590978919123316736,264219447,SenatorWicker
590538806195003394,24183358,congculberson,Twitter Web Client,2015-04-21 15:33:17,2,0,"RT @inewsource: “As I told Director Saldaña today, when something says ‘shall’ it’s not optional,”  - @CongCulberson http://t.co/WH44crFzOx",,,589171587498188800,343702505,inewsource
590538368045490178,24183358,congculberson,Twitter Web Client,2015-04-21 15:31:33,1,0,"Last week, Rep. Culberson voted for two bills aimed at reducing your tax burden - staff http://t.co/5Ul8Np7I0j http://t.co/iR7jcrTxCK",,,,,
588762791001071616,24183358,congculberson,Twitter Web Client,2015-04-16 17:56:02,6,0,ICE Dir. confirmed they will not use 34K detention beds as law requires &amp; will not deport criminal aliens as required http://t.co/QhBSoMie4G,,,,,
588003433849950208,24183358,congculberson,Twitter Web Client,2015-04-14 15:38:37,2,1,Rep. John Culberson went to the House floor last night to mark the birthday of Thomas Jefferson -staff    http://t.co/AFgjLE5FwR,,,,,
587614754144919552,24183358,congculberson,Twitter Web Client,2015-04-13 13:54:09,2,1,Thank you @KinkaidSchool for hosting me last week. Enjoyed our talk. You have some very bright students. http://t.co/2s8XqAowc5,,,,,
586165928741711872,24183358,congculberson,Twitter Web Client,2015-04-09 13:57:02,1,3,Rep. Culberson enjoyed listening to constituents Tuesday at Wolfe Elementary. Thanks to all those who came. -staff http://t.co/NKg4RzlMFj,,,,,
585789440758525952,24183358,congculberson,Twitter Web Client,2015-04-08 13:01:00,7,0,RT @CrimeStopHOU: @theraniareport and @CongCulberson discussing Crime Stoppers of Houston's important work in the community http://t.co/Sda…,,,585580609982062593,350940396,CrimeStopHOU
582541260646428673,24183358,congculberson,Twitter Web Client,2015-03-30 13:53:54,6,3,"FBI Dir. says he never had a problem w/ a concealed carry permit holder, properly licensed &amp; using good judgment http://t.co/PcxjxkDRep",,,,,
581447012924715008,24183358,congculberson,Twitter Web Client,2015-03-27 13:25:45,6,2,"Culberson bill holds Obama to his word: ""If you like your plan, you can keep your plan.”-Staff http://t.co/rLg7tLRjpc http://t.co/2I5sT2F092",,,,,
580797073156624384,24183358,congculberson,Twitter Web Client,2015-03-25 18:23:07,6,0,"RT @HouseAppropsGOP: .@CongCulberson welcomes @CongPalazzo to the Commerce, Justice, Science Subcommittee at today's #FBI budget hearing. h…",,,580777620909985792,301549400,HouseAppropsGOP
580775481307492352,24183358,congculberson,Twitter Web Client,2015-03-25 16:57:19,2,0,RT @HouseAppropsGOP: Tune in at 1 PM: @CongCulberson chairs subcommittee hearing on the @FBI's FY16 #budget request. http://t.co/AHoUFua2vj…,,,580774703775641600,301549400,HouseAppropsGOP
580760479208984576,24183358,congculberson,Twitter Web Client,2015-03-25 15:57:42,4,3,Obamacare 5 yrs later=millions dropped from plans. I'm working on a bill restoring states rights 2 regulate insurance http://t.co/y1UYoMBkdQ,,,,,
577864233490243585,24183358,congculberson,Twitter Web Client,2015-03-17 16:09:04,3,1,Rep. Culberson to Co-Chair R&amp;D Congressional Caucus -staff http://t.co/Lq3h4BqbCU,,,,,
576066321865117696,24183358,congculberson,Twitter Web Client,2015-03-12 17:04:48,2,1,Yesterday I spoke with @IngrahamAngle about ATF’s decision to drop the #ammoban and what it means for our country: http://t.co/Gt6VwbbwH6,,,,,
575424651624648704,24183358,congculberson,Twitter Web Client,2015-03-10 22:35:02,5,0,"RT @penguinponders: @CongCulberson gave a detailed Washington update to United Republicans last night, inc 2 scoops which will soon be quit…",,,575286019756453889,15676749,penguinponders
575354933584723969,24183358,congculberson,Twitter Web Client,2015-03-10 17:58:00,56,79,I truly appreciate the ATF for hearing us out &amp; commend them for making the right decision today on the #ammoban http://t.co/yj3a7dRwGK,,,,,
573494990418132994,24183358,congculberson,Twitter Web Client,2015-03-05 14:47:15,4,0,RT @UTMSI: Thank you Megan Olmstead and Team @CongCulberson for talking with us about the latest and greatest science happening on our nati…,,,573236346736807936,3030402067,UTMSI
573491427637862400,24183358,congculberson,Twitter Web Client,2015-03-05 14:33:05,1,1,I recently asked NASA's Gen Bolden about Pres. cancelling Constellation Program &amp; US dependence on Russian transport  http://t.co/AzdaSJRsuF,,,,,
573160050333786112,24183358,congculberson,Twitter Web Client,2015-03-04 16:36:19,4,0,RT @HouseAppropsGOP: Watch live at 10:30 AM: @CongCulberson chairs hearing on @NASA's FY16 #budget request. http://t.co/Erbmyc2WTr,,,573139609279832064,301549400,HouseAppropsGOP
572901690606792705,24183358,congculberson,Twitter Web Client,2015-03-03 23:29:41,8,5,Today I voted 'no' on the Senate DHS funding bill. My statement here: http://t.co/BcIpgSlSuB,,,,,
572476718885298177,24183358,congculberson,Twitter Web Client,2015-03-02 19:21:00,2,3,"Happy 179th Birthday Texas! My mission: Restore the 10th Amend, get the fed. gov. out of our way #LetTexansRunTexas http://t.co/Ucueict5th",,,,,
570656108534083584,24183358,congculberson,Twitter Web Client,2015-02-25 18:46:33,3,1,"Chaired my 1st CJS @HouseAppropsGOP hearing today and discussed ways to cut spending, make agencies more efficient. http://t.co/DrGgCBHgtX",,,,,
570644106218749952,24183358,congculberson,Twitter Web Client,2015-02-25 17:58:51,1,0,"RT @HouseAppropsGOP: .@CongCulberson at his first hearing as CJS Chairman, oversight of @TheJusticeDept, @CommerceGov &amp; @NASA spending. htt…",,,570614602934972417,301549400,HouseAppropsGOP
570594484888719360,24183358,congculberson,Twitter Web Client,2015-02-25 14:41:40,3,0,RT @gcvpphm: The Texas group with Chris Buki of @congculberson  's office - great meeting! #museumsadvocacy http://t.co/0HeDEIBlHs,,,570249885850738688,22797281,gcvpphm
567850793862356993,24183358,congculberson,Twitter Web Client,2015-02-18 00:59:14,4,0,"RT @penguinponders: Monday, March 9, 2015 United Republicans of Harris County presents @CongCulberson, giving a Washington Update. http://t…",,,567531319693811713,15676749,penguinponders
567352025491726336,24183358,congculberson,Twitter Web Client,2015-02-16 15:57:18,4,1,My latest statement calling on Senate Dems to end their filibuster of the DHS Approps bill: http://t.co/Jom0o5otEt http://t.co/c9x7JSryJW,,,,,
564793957545414658,24183358,congculberson,Twitter Web Client,2015-02-09 14:32:27,3,1,Enjoyed speaking with the @kwteaparty last Thursday night. Thank you for hosting me. http://t.co/pEazUB7srV,,,,,
563763945056763904,24183358,congculberson,Twitter Web Client,2015-02-06 18:19:33,3,0,ICYMI: This week's newsletter on supporting scientific research: http://t.co/q1gdAg3KPB,,,,,
563699123334152192,24183358,congculberson,Twitter Web Client,2015-02-06 14:01:58,5,5,"Pres #Reagan, born today in 1911, said ""As government expands, liberty contracts."" Words of wisdom that still apply. http://t.co/hc50vYjoD9",,,,,
557749154873888769,24183358,congculberson,TweetDeck,2015-01-21 03:58:55,3,0,My response to President Obama's State of the Union address: http://t.co/7WXmIEp0DO,,,,,
553679169104916480,24183358,congculberson,TweetDeck,2015-01-09 22:26:15,5,4,I hope you'll take a minute to read about legislation I introduced to limit the role of the federal government: http://t.co/CP8Pgyrs01,,,,,
551029136979165184,24183358,congculberson,TweetDeck,2015-01-02 14:55:58,0,1,Took a few minutes this morning to talk with the good folks at the Laura Ingraham show. It'll air at 9:30 CT on KSEV 700--tune in!,,,,,
549577849108058114,24183358,congculberson,TweetDeck,2014-12-29 14:49:04,4,4,Proud to support Gov-elect Abbott as Texas challenges Obama's unconstitutional executive amnesty.  http://t.co/YLWh7ytF7I…,,,,,
548157018154889217,24183358,congculberson,TweetDeck,2014-12-25 16:43:12,0,2,"From my family to yours, have a safe, blessed, and very merry Christmas",,,,,
546743184861061121,24183358,congculberson,TweetDeck,2014-12-21 19:05:07,2,3,MT @GregAbbott_TX: Texas is better than the other 49 states: Texas job growth outpaces rest of U.S. combined http://t.co/S5MGQA2oRH,,,,,
545334943665364992,24183358,congculberson,TweetDeck,2014-12-17 21:49:17,1,1,"For my most recent e-newsletter, I wrote about the ""cromnibus"" and how it advances our conservative principles. http://t.co/NcGlMR7ze3",,,,,
544962720269750273,24183358,congculberson,TweetDeck,2014-12-16 21:10:12,1,4,Belinda and I wish a safe and happy Hanukkah to all those celebrating tonight!,,,,,
544551075169456128,24183358,congculberson,TweetDeck,2014-12-15 17:54:28,0,0,.@jdh_av8r You can call or email too! 713-682-8828 for the Houston office.,jdh_av8r,544547675895373824,,,
543909381596000257,24183358,congculberson,TweetDeck,2014-12-13 23:24:36,6,0,RT @RepDianeBlack: Happy Birthday to the @USNationalGuard! http://t.co/Jp0pf8ZCRX,,,543844162962223106,110545675,RepDianeBlack
543028422679986176,24183358,congculberson,Echofon,2014-12-11 13:03:59,0,0,I'm on KNTH with Sam Malone in a few. Tune in!,,,,,
542665008300429312,24183358,congculberson,Echofon,2014-12-10 12:59:54,1,2,I'm on KSEV 700 in a few minutes to talk with Chris Salcedo. Tune in!,,,,,
542514852296540163,24183358,congculberson,TweetDeck,2014-12-10 03:03:14,3,2,Late night in the office talking with constituents about the news from DC. Questions? Comments? Call at 202-225-2571. http://t.co/33tXTv6TFA,,,,,
542432168748662785,24183358,congculberson,TweetDeck,2014-12-09 21:34:41,1,1,I'm down on the House floor with the Texas delegation as we honor @RalphHallPress for his service. Watch live: http://t.co/VVEmcS8gzD,,,,,
542336494367940608,24183358,congculberson,TweetDeck,2014-12-09 15:14:31,1,1,Worth a watch: Obamacare architect Jonathan Gruber is testifying before the House Oversight Committee. http://t.co/JBydoPvVgx,,,,,
540591003577905153,24183358,congculberson,TweetDeck,2014-12-04 19:38:33,3,2,"RT @edatpost: JUST IN: House votes 219 to 197, 3 voted present, to block Obama from changing immigration laws by executive authority",,,,,
540540817015062528,24183358,congculberson,TweetDeck,2014-12-04 16:19:08,1,0,@conserv_chicky Sorry to hear that! Call my DC office at 202-225-2571 and ask for Corey. He should be able to help.,conserv_chicky,,,,
540293600501055488,24183358,congculberson,TweetDeck,2014-12-03 23:56:47,1466,0,RT @NASA: Tonight set your alarm to be up to watch #Orion launch at 7:05am ET! NASA TV starts at 4:30am http://t.co/RxASWP1qU4 http://t.co/…,,,540282334793445378,11348282,NASA
539909157626056704,24183358,congculberson,TweetDeck,2014-12-02 22:29:08,468,0,RT @uscapitol: The 2014 Capitol Christmas Tree has been lit! http://t.co/ANO8f8wE1Y,,,539907122432331777,17539497,uscapitol
539905259658035201,24183358,congculberson,TweetDeck,2014-12-02 22:13:39,35,0,RT @cspan: .@USCapitol #ChristmasTree Lighting Ceremony – LIVE online here: http://t.co/XJdzdaw3TH #CCT2014 (photo from 2013) http://t.co/P…,,,539903496259371008,15675138,cspan
539845892925575169,24183358,congculberson,TweetDeck,2014-12-02 18:17:45,0,0,"@scottyTucker The Senate approves nominations, so I didn't get a vote. Both Texas Senators voted no, though.",scottyTucker,539844351728181251,,,
539824807559565314,24183358,congculberson,TweetDeck,2014-12-02 16:53:58,292,0,"RT @markknoller: Without fanfare yesterday, US Treasury posted National Debt topping record $18-trillion. Up $7.379-trillion since Pres Oba…",,,539810531935539200,31127446,markknoller
538037051409453056,24183358,congculberson,TweetDeck,2014-11-27 18:30:03,0,2,"From my family to yours, have a safe, blessed, and happy Thanksgiving!",,,,,
536948907688067072,24183358,congculberson,TweetDeck,2014-11-24 18:26:10,2,2,I'll be on KSEV 700 to talk with @LanceRoberts about Obama's executive amnesty. 5:30 CT - tune in!,,,,,
536685904979456001,24183358,congculberson,TweetDeck,2014-11-24 01:01:05,0,1,"ICYMI: This week's e-newsletter, on stopping President Obama's executive amnesty: http://t.co/SybWk5aH8z",,,,,
536233964210364416,24183358,congculberson,TweetDeck,2014-11-22 19:05:14,0,0,Enjoyed talking with Laura Ingraham yesterday. Conservatives will fight this executive amnesty tooth and nail http://t.co/YObCGnQDmX,,,,,
535961149343145985,24183358,congculberson,TweetDeck,2014-11-22 01:01:10,0,1,"This week's e-newsletter, on stopping President Obama's executive amnesty: http://t.co/SybWk5aH8z",,,,,
535920147253297153,24183358,congculberson,TweetDeck,2014-11-21 22:18:14,1,1,.@BarbaraComstock Thank you Barbara! I'm looking forward to working with you soon.,BarbaraComstock,535845921599135744,,,
535881851240734722,24183358,congculberson,TweetDeck,2014-11-21 19:46:04,1,0,RT @tweetsoutloud: @CongCulberson Glad you like it as much as we do! Come by anytime!,,,535879697356177408,61306578,tweetsoutloud
535878471164370945,24183358,congculberson,TweetDeck,2014-11-21 19:32:38,1,6,.@tweetsoutloud I am a fan! Y'all are doing great work out at JPL and I'm excited to help.,tweetsoutloud,535873375927676929,,,
535837604957003779,24183358,congculberson,TweetDeck,2014-11-21 16:50:15,0,4,RT @SpaceNews_Inc: Culberson To Chair @NASA House Appropriations Subcommittee http://t.co/o5Iz4SVKeh http://t.co/FG4IGIseqv,,,,,
535806898784989185,24183358,congculberson,TweetDeck,2014-11-21 14:48:14,90,0,"RT @IngrahamAngle: LIVE NOW-- @CongCulberson on the idea of working w/ Obama on immig: ""You can't do business w/ ppl who lie to you and ins…",,,535806856657375232,50769180,IngrahamAngle
535797028513918976,24183358,congculberson,TweetDeck,2014-11-21 14:09:00,3,1,I'm on with @IngrahamAngle this morning to talk about President Obama's executive amnesty. Tune in to KSEV 700 at 9.,,,,,
535613267436380160,24183358,congculberson,TweetDeck,2014-11-21 01:58:48,2,2,I'll be talking about President Obama's executive amnesty with @IngrahamAngle tomorrow morning. Tune in!,,,,,
535609745273790464,24183358,congculberson,TweetDeck,2014-11-21 01:44:49,24,13,"It's simple: the legislative branch legislates, and the executive branch executes those laws. Obama's action ignores the Constitution.",,,,,
535608099454070784,24183358,congculberson,TweetDeck,2014-11-21 01:38:16,19,4,President Obama’s executive amnesty shows an unprecedented disregard for the rule of law.,,,,,
535556968593645568,24183358,congculberson,TweetDeck,2014-11-20 22:15:06,1,0,#tbt to all the times President Obama argued against executive amnesty: http://t.co/znYOHVdInq,,,,,
535539196111638528,24183358,congculberson,TweetDeck,2014-11-20 21:04:28,2,3,"Honored and humbled to chair the @HouseAppropsGOP Commerce, Justice, Science Subcommittee: http://t.co/ZFCW1ewayA",,,,,
534805750359818241,24183358,congculberson,TweetDeck,2014-11-18 20:30:01,0,0,"There's a spirit that can ne'er be told, it's the spirit of Aggieland RT @TAMU: http://t.co/engunaL4BF",,,,,
534748091027832832,24183358,congculberson,TweetDeck,2014-11-18 16:40:54,4,5,My thoughts and prayers are with those affected by the terrorist attack in Jerusalem. America must continue to stand with Israel.,,,,,
534498779160772609,24183358,congculberson,TweetDeck,2014-11-18 00:10:14,0,1,RT @uscapitol: Capitol Dome Restoration scaffold construction is now complete. View six months of work in 30 seconds. http://t.co/uFFjDQjMGN,,,,,
534449306829606912,24183358,congculberson,TweetDeck,2014-11-17 20:53:38,2,1,A new low for Obamacare: only 37% approve. http://t.co/7eKxF93Vfw,,,,,
534438440012881922,24183358,congculberson,TweetDeck,2014-11-17 20:10:28,7,0,RT @RepKevinBrady: Middle class families need to be on the lookout. Another Affordable Care Act tax is headed their way. http://t.co/cpDasq…,,,534434340294230016,19926675,RepKevinBrady
533374318470627329,24183358,congculberson,TweetDeck,2014-11-14 21:42:01,3,4,"Voted to approve the Keystone XL pipeline. Businesses, labor unions, Republicans, and now Senate Democrats are on board. Mr. President?",,,,,
533287146334220290,24183358,congculberson,TweetDeck,2014-11-14 15:55:38,1,2,"""The so-called 'Texas Miracle' does not show any signs of slowing down"" - @Forbes  http://t.co/gFRmAvigYQ",,,,,
533083698837483520,24183358,congculberson,TweetDeck,2014-11-14 02:27:12,0,1,"ICYMI: Just introduced HR 5686, which makes it easier for doctors to volunteer at the VA. You can read about it here: http://t.co/sF8XuTVi38",,,,,
533000064269303808,24183358,congculberson,TweetDeck,2014-11-13 20:54:52,2,2,"Just introduced HR 5686, which makes it easier for doctors to volunteer at the VA. You can read about it here &gt;&gt;&gt; http://t.co/jQtF3pXUU4",,,,,
532939661715734528,24183358,congculberson,TweetDeck,2014-11-13 16:54:51,277,0,RT @HouseGOP: Pelosi today: Gruber who? http://t.co/HGa6eprNOG  Pelosi in 2009: Jonathan Gruber is so right about #ObamaCare. #TBT http://t…,,,532938479140102144,15207668,HouseGOP
532610697294016513,24183358,congculberson,TweetDeck,2014-11-12 19:07:40,180,0,RT @SpeakerBoehner: Retweet to agree: the #EPA's job-crushing policies are bad #4jobs &amp; bad for American workers. http://t.co/oAY8SadqVN,,,532603887631745025,7713202,SpeakerBoehner
532579355671924736,24183358,congculberson,TweetDeck,2014-11-12 17:03:07,1,2,European Space Agency has lifted boundaries of human knowledge to whole new level with first successful landing on a comet! Congratulations!,,,,,
532241367091937280,24183358,congculberson,Echofon,2014-11-11 18:40:05,3,0,Great to see Houston schools honoring our veterans today! My staff sent this picture from Spring Forest Middle School http://t.co/H6lSLlaJ2i,,,,,
532183979743772673,24183358,congculberson,Echofon,2014-11-11 14:52:02,0,2,Happy Veterans Day! To the men and women who serve and have served: our country cannot thank you enough.,,,,,
531828469219721216,24183358,congculberson,TweetDeck,2014-11-10 15:19:22,3,1,"Happy 239th, @USMC. Thank you, and Semper Fi. http://t.co/UeCsWPw1EW",,,,,
530114241509216256,24183358,congculberson,TweetDeck,2014-11-05 21:47:38,3,0,"RT @OlsonPressShop: In 2013, Texas added more than 19,000 private sector jobs in oil &amp; natural gas production! #Yes2Energy #4jobs  http://t…",,,530091790549155841,20053279,OlsonPressShop
529450247894745089,24183358,congculberson,TweetDeck,2014-11-04 01:49:10,1,0,Honored to receive a perfect 100% on the @FRCAction Congressional report card for my support of the family. http://t.co/q3qfIzTfgW,,,,,
529407215438798849,24183358,congculberson,TweetDeck,2014-11-03 22:58:10,0,0,I'll be live on KSEV 700 with @LanceRoberts in a few minutes. Tune in or listen online at http://t.co/jpwT6Ccbxd,,,,,
