id,user_id,screen_name,source,created_at,retweet_count,favorite_count,text,in_reply_to_screen_name,in_reply_to_status_id,retweeted_status_id,retweeted_status_user_id,retweeted_status_screen_name
112160411176026112,24183358,congculberson,Twitter Web Client,2011-09-09 13:48:20,0,1,@GOPLeader's op-ed discusses the GOP jobs plan. It is time to take action and get Americans back to work. #4jobs http://t.co/xp1DBSd,EricCantor,,,,
111502285066092544,24183358,congculberson,Twitter Web Client,2011-09-07 18:13:11,0,0,Great article by the Houston Business Journal stating expanded drilling means more #jobs http://t.co/kRf4znM,,,,,
111446206617624576,24183358,congculberson,Twitter Web Client,2011-09-07 14:30:20,2,0,"""The simple fact is that Obama has put politics before job creation..."" Great piece by @GOPWhip http://t.co/HKVWNIR",,,,,
111431377911676929,24183358,congculberson,Twitter Web Client,2011-09-07 13:31:25,24,0,RT @GOPLeader: Read the House #GOP's plan #4jobs: http://t.co/aAiMapd Track the #jobs plan: http://t.co/cxf4IxT,,,111430215846211585,18891923,GOPLeader
111184799598776321,24183358,congculberson,Twitter Web Client,2011-09-06 21:11:36,0,0,"The Astros will host one veteran and their guest for all remaining home game. For more information, visit here: http://t.co/2yvBF5e",,,,,
111155065603108865,24183358,congculberson,Twitter Web Client,2011-09-06 19:13:27,3,1,@SpeakerBoehner & @GOPLeader have written a letter to the WH noting   #jobs bills that are stalled in Dem Senate: http://t.co/9lBw7Ee,SpeakerBoehner,,,,
110533202992578560,24183358,congculberson,Twitter for BlackBerry®,2011-09-05 02:02:23,20,0,RT @gopconference: WATCH @RepGoodlatte deliver the Weekly Republican Address on the need for a balanced budget http://t.co/jItVKPD #BBA4jobs,,,109965183425847296,15207668,gopconference
108933764368973824,24183358,congculberson,Twitter Web Client,2011-08-31 16:06:47,0,0,I would like to thank General Petraeus for his dedicated service to our nation. I wish him all the best as he begins his tenure at the CIA.,,,,,
106384251846533121,24183358,congculberson,Twitter Web Client,2011-08-24 15:15:56,2,0,"""In his 31 months in office, Obama has added to the national debt at an average monthly rate of $129 billion."" http://t.co/Pp6Fse1",,,,,
106060202498994176,24183358,congculberson,Twitter Web Client,2011-08-23 17:48:17,10,0,"RT @GOPWhip: While POTUS vacations, our national debt grows $2.95 million a minute & the economy & American ppl cont to suffer. http://t ...",,,106053001088729088,19739126,GOPWhip
104191138872832000,24183358,congculberson,Twitter Web Client,2011-08-18 14:01:17,0,0,My interview yesterday on @ABC's Top Line: http://t.co/iY278Ii,,,,,
103818207336472576,24183358,congculberson,Twitter Web Client,2011-08-17 13:19:24,0,0,Looking forward to speaking on @ABC's Top Line at 12:00pm EST today. Remember to tune in!,,,,,
101662544611123200,24183358,congculberson,Twitter Web Client,2011-08-11 14:33:34,0,1,Another great town hall last night at the King Street Patriots' Headquarters. Thanks to everyone who came out!,,,,,
101385158095142912,24183358,congculberson,Twitter Web Client,2011-08-10 20:11:19,0,0,Looking forward to another town hall tonight to discuss our current fiscal crisis. Location will be the King Street Patriots Headquarters.,,,,,
101353094830505984,24183358,congculberson,Twitter Web Client,2011-08-10 18:03:55,5,0,The time is now to balance the federal budget. #BBA http://t.co/TI94h7F,,,,,
101316156798939137,24183358,congculberson,Twitter Web Client,2011-08-10 15:37:08,0,0,Thanks to everyone who came out for the town hall last night. Great crowd.,,,,,
100648606494756864,24183358,congculberson,Twitter Web Client,2011-08-08 19:24:32,1,0,My thoughts and prayers are with the families of the 31 American soldiers killed in Afghanistan over the weekend. http://t.co/P5VsHo9,,,,,
99200397171884032,24183358,congculberson,Twitter Web Client,2011-08-04 19:29:52,2,0,"@GOPWhip just released this video. Mr, President, Where Are The Jobs? http://t.co/zOE4T4m",GOPLeader,,,,
99149288000598017,24183358,congculberson,Twitter Web Client,2011-08-04 16:06:47,8,0,RT @GOPWhip: #GOP priority is getting Americans back to work and creating #jobs.  http://t.co/b0Xie1p,,,99149197634318336,19739126,GOPWhip
98075576962781184,24183358,congculberson,Twitter Web Client,2011-08-01 17:00:14,0,0,Honoring the life of First Lieutenant Dimitri del Castillo. http://t.co/bBXSQ7n,,,,,
97050375974162433,24183358,congculberson,Twitter Web Client,2011-07-29 21:06:27,1,1,"My second letter to VA Secretary Eric Shinseki, http://t.co/lVeJJUN",,,,,
97028675224088577,24183358,congculberson,Twitter Web Client,2011-07-29 19:40:13,1,0,"Today, I introduced H.R. 2694, the Medicare Firewall Act of 2011. http://t.co/BaiEOsX",,,,,
96575901080363010,24183358,congculberson,Twitter Web Client,2011-07-28 13:41:03,0,0,"My thoughts on the debt ceiling discussions, http://t.co/I9ik0nA",,,,,
95485701021384704,24183358,congculberson,Twitter Web Client,2011-07-25 13:28:59,1,0,Religious censorship at the funerals of our national heroes has to stop. My interview on FOX & Friends: http://t.co/QLl2AS2,,,,,
94823678218477568,24183358,congculberson,Twitter Web Client,2011-07-23 17:38:21,3,1,"Tomorrow, I will be on FOX & Friends at 8:50am EST to further discuss the religious censorship taking place at Houston National Cemetery.",,,,,
94459087475052544,24183358,congculberson,Twitter Web Client,2011-07-22 17:29:36,0,0,I was very disappointed to learn the Senate had rejected #CutCapBalance http://t.co/gjnHiHB,,,,,
94423085062696960,24183358,congculberson,Twitter Web Client,2011-07-22 15:06:32,0,0,President Obama is not Ronald Reagan. Watch here for the facts: http://t.co/K5B0v6I,,,,,
93671988035452928,24183358,congculberson,Twitter Web Client,2011-07-20 13:21:56,0,0,"At 10:30, I will be joined by Rep. Kevin Brady & members of the Texas media to discuss the debt ceiling. Watch live, http://t.co/dSXCXNR",,,,,
93442011805396992,24183358,congculberson,Twitter Web Client,2011-07-19 22:08:06,3,0,RT @RepublicanStudy: Check out this video by @gopconference on the #CutCapBalance Act: http://t.co/y64hZz1,,,93441602118352896,22528309,RepublicanStudy
93368784521400320,24183358,congculberson,Twitter Web Client,2011-07-19 17:17:07,2,0,I'm on the floor now discussing legislation I have cosponsored to get our country back on the right fiscal track. #CutCapBalance,,,,,
93325369146486784,24183358,congculberson,Twitter Web Client,2011-07-19 14:24:36,2,1,"By the end of the year, our national debt will grow larger than our entire economy. #CutCapBalance",,,,,
93068283737149440,24183358,congculberson,Twitter Web Client,2011-07-18 21:23:02,2,1,President Obama says he'll veto #CutCapBalance. http://t.co/fxXZR76 Why hasn't he given us a debt reduction plan of his own?,,,,,
93020746569359360,24183358,congculberson,Twitter Web Client,2011-07-18 18:14:08,2,0,"RT @TexasGOPVote: John Culberson Discusses the Cut, Cap, and Balance Act - http://t.co/o0H8WQy  #texasgop",,,93019996803973120,36101055,TexasGOPVote
91954219032121344,24183358,congculberson,Twitter Web Client,2011-07-15 19:36:08,0,0,Proud to be an original cosponsor of #CutCapBalance http://t.co/Diu1E1N,,,,,
91903672296013825,24183358,congculberson,Twitter Web Client,2011-07-15 16:15:17,1,0,"Republicans have a plan to #CutCapBalance. President Obama, where is yours?",,,,,
91162201888538624,24183358,congculberson,Twitter Web Client,2011-07-13 15:08:57,56,0,"RT @EricCantor: Next week, the House will vote on a balanced budget amendment.",,,91161924389175296,5561412,EricCantor
90888207671099393,24183358,congculberson,Twitter Web Client,2011-07-12 21:00:11,1,0,"Today, the House Appropriations Committee adopted my amendment to help stop BOEMRE's de facto moratorium in the Gulf. http://t.co/89vgKZ1",,,,,
90777858473078784,24183358,congculberson,Twitter Web Client,2011-07-12 13:41:42,4,0,RT @katieharbath: I'm hosting today's @facebookdclive w/ guests @GOPNMC co-chairs @boblatta @cathymcmorris  @RobWittman @johnculberson h ...,,,90774700212502528,2232041,katieharbath
90765429366198272,24183358,congculberson,Twitter Web Client,2011-07-12 12:52:19,1,0,RT @GOPNMC: Today at 4p ET: @GOPNMC Co-Chairs @boblatta @cathymcmorris @RobWittman @johnculberson on #@facebookdclive http://on.fb.me/pG1O55,,,90764597216296960,60984835,GOPNMC
90520187048181760,24183358,congculberson,Twitter Web Client,2011-07-11 20:37:49,0,0,Will be on @hardball at 5:10pm EST to discuss the debt ceiling negotiations. Don't forget to tune in!,,,,,
90478287926730752,24183358,congculberson,Twitter Web Client,2011-07-11 17:51:19,5,0,"RT @GOPNMC: RT @facebookdclive on Tues., July 12 4p ET: @GOPNMC Co-Chairs @boblatta @cathymcmorris @RobWittman @johnculberson. http://on ...",,,89064959409012737,60984835,GOPNMC
65208240157372417,24183358,congculberson,Twitter Web Client,2011-05-03 00:17:10,2,0,Please tune in to my live broadcast on @Ustream! Please send me your questions via Twitter  http://ustre.am/ykiI !,,,,,
55327888546861057,24183358,congculberson,Twitter for Websites,2011-04-05 17:56:11,3,0,"Rep. John Culberson on Will Obama help or hurt Tim Kaine?Plus, Paul Ryan\'s budget hard-headed or... http://t.co/nglgkba via @politicoarena",,,,,
44798673372200960,24183358,congculberson,Twitter Web Client,2011-03-07 16:36:50,51,0,"RT @SpeakerBoehner: Obama Admin issues more than 1,000 waivers for job-destroying health care law http://bit.ly/fxt3jS #hcrcostsjobs via ...",,,44798370258239488,7713202,SpeakerBoehner
43362909874692096,24183358,congculberson,Twitter for Websites,2011-03-03 17:31:38,4,1,Are two-week budgets the new normal? My response. http://t.co/rDPB4b8 via @politicoarena,,,,,
37200346036047872,24183358,congculberson,Twitter Web Client,2011-02-14 17:23:48,3,1,My message to liberals in an op-ed for The Hill: The spending spree is over. Read it here: http://tinyurl.com/6jxy8f7,,,,,
36546908533039104,24183358,congculberson,Twitter Web Client,2011-02-12 22:07:16,1,0,RT @rickdunham: I'll be doing a live chat with @CongCulberson on the @BarackObama budget Monday at noon CST (1 pm EST) on @TxPotomac. Yo ...,,,36173447730036736,14884201,rickdunham
36144847777697792,24183358,congculberson,Twitter Web Client,2011-02-11 19:29:37,0,0,Holding a webchat next Monday at 12 PM (CST) with @rickdunham. Please him your questions.,,,,,
36088652752891904,24183358,congculberson,Twitter Web Client,2011-02-11 15:46:19,0,0,"I will be doing a live video chat with @houstonchron on Monday, 2/14 at 12pm CST. Tweet @rickdunham to ask questions.",,,,,
35803388717305856,24183358,congculberson,Twitter Web Client,2011-02-10 20:52:47,1,0,Great WSJ Op-Ed on the ongoing piece by piece dismantle of Obamacare http://tinyurl.com/4n3tnbb,,,,,
35411411177832448,24183358,congculberson,Twitter Web Client,2011-02-09 18:55:12,2,0,RT @proud2bTexan: @CongCulberson has a good way to block the Czars from doing too much harm. He will try to curb funding them.,,,30076030467182592,72175800,proud2bTexan
35399749427265536,24183358,congculberson,Twitter Web Client,2011-02-09 18:08:52,2,0,"1st 4 wks of the Repub Maj, House cut spndg by $656 bil. Compare to 1st 4 wks of 111th Cong: Dem-led House had pssd $682 bil of new spending",,,,,
29721935780773888,24183358,congculberson,Twitter Web Client,2011-01-25 02:07:16,0,0,Thank you for all who tuned in tonight. I apologize for not getting to all the questions.,,,,,
29692303023013888,24183358,congculberson,Twitter Web Client,2011-01-25 00:09:31,1,0,Looking forward to answering your questions. The #teletownhall starts in 20 mins. http://tinyurl.com/4ofzmp4,,,,,
29681901555945472,24183358,congculberson,Twitter Web Client,2011-01-24 23:28:11,0,1,Looks great! RT @bflores Our replacement flag arrived! Thanks @CongCulberson http://twitpic.com/3pj5u0,,,,,
29649350690865152,24183358,congculberson,Twitter Web Client,2011-01-24 21:18:50,0,1,Pls join me this eve 6:30 CST for a live telephone town hall mtg. Tweet @CongCulberson or post a ? on my FB wall. http://tinyurl.com/4ofzmp4,,,,,
23442836082925571,24183358,congculberson,Twitter Web Client,2011-01-07 18:16:22,2,0,I am honored to be selected to chair the subcommittee on Military Construction and Veterans Affairs http://bit.ly/h1yU2k,,,,,
23080919682252801,24183358,congculberson,Twitter Web Client,2011-01-06 18:18:14,1,1,"Voting now to cut 5% from Congress's budget. Washington should downsize its budget, not ask American families to downsize theirs.",,,,,
17615330440388608,24183358,congculberson,Twitter Web Client,2010-12-22 16:19:56,59,0,RT @GOPLeader: Keeping our pledge: New House GOP rules require all bills to be posted online three days before a vote #pledge,,,17584517178986496,7713202,GOPLeader
12956499684888576,24183358,congculberson,Twitter Web Client,2010-12-09 19:47:24,1,1,"Last night, I spoke with Neil Cavuto about tax cuts and other pending legislation.  Please watch the video here: http://bit.ly/fvPfJR #GOP",,,,,
9628343926259712,24183358,congculberson,Twitter Web Client,2010-11-30 15:22:30,0,0,"Earlier this week, I appeared on KHOU to talk about the successes of Operation Streamline along the southern border: http://bit.ly/g1QL9a",,,,,
4535291087949824,24183358,congculberson,Twitter Web Client,2010-11-16 14:04:32,2,0,"Last night I was on Hardball to discuss tax cuts. It's not gov't's money to compromise, it's the American people's: http://bit.ly/9nqiQh",,,,,
28431159336,24183358,congculberson,Twitter Web Client,2010-10-22 18:57:07,0,0,"ObamaCare, 7 months later: shrinking coverage and rising costs  http://bit.ly/cHofmR",,,,,
27140535821,24183358,congculberson,Twitter Web Client,2010-10-12 13:57:38,4,0,Byron York endorses read-the-bill rule I co-authored. It's outrageous that Members of Congress aren't reading bills: http://bit.ly/dz6OmW,,,,,
26583674914,24183358,congculberson,Twitter Web Client,2010-10-06 20:47:39,0,0,"Taxpayer report on debts, deficits, and looming tax hikes:  http://bit.ly/dwdcD7",,,,,
25802301883,24183358,congculberson,Twitter Web Client,2010-09-28 16:57:04,3,0,RT @ConfPolicy: CBO says tax increases will hinder recovery http://bit.ly/dyqFCZ. Congress shouldn't adjourn w/o giving extension of cur ...,,,25801747075,154591966,ConfPolicy
25308386166,24183358,congculberson,Twitter Web Client,2010-09-23 13:48:42,2,2,"House Republicans pledge to repeal healthcare, cut spending and cut taxes. Read more here http://pledge.gop.gov #pledge",,,,,
25213292562,24183358,congculberson,TweetDeck,2010-09-22 13:55:25,0,1,Very honored to receive the Tax Fighter Award from the National Tax Limitation Committee. http://bit.ly/biENV5,,,,,
25127743283,24183358,congculberson,TweetDeck,2010-09-21 15:22:31,0,1,Please take a moment to subscribe to my email list for regular updates on what I'm working on in Congress:  http://bit.ly/burxs4,,,,,
24766415644,24183358,congculberson,Twitter Web Client,2010-09-17 15:13:05,3,1,Happy Constitution Day!  Pick up a free copy of our Constitution at my district office: http://bit.ly/9b3afE #gop,,,,,
24688058709,24183358,congculberson,Twitter Web Client,2010-09-16 18:43:45,0,1,I will be appearing on the Fox Business Channel at 5pm CDT tonight to talk w/ Neil Cavuto about the need to extend the '01 & '03 tax cuts.,,,,,
24412333097,24183358,congculberson,Twitter Web Client,2010-09-13 20:22:39,66,0,"RT @GOPLeader: Attn @presssec: Republicans are unified: to boost our economy, we need to stop ALL tax hikes and cut spending now",,,24411255237,7713202,GOPLeader
23257665575,24183358,congculberson,Twitter Web Client,2010-09-07 17:46:14,0,0,"Last Friday I appeared on ""Cavuto"" to discuss the economy & fiscal disciple. We need to spend within our means.  Video: http://bit.ly/cgFEwU",,,,,
20709571886,24183358,congculberson,Twitter Web Client,2010-08-09 13:55:10,1,0,"I'll be having two town hall meetings in Houston next week, looking forward to hearing from the great people of Dist. 7 http://bit.ly/cwISk6",,,,,
19911653777,24183358,congculberson,Twitter Web Client,2010-07-30 14:03:04,0,0,RT @GOPConference New Analysis: Letting tax cuts expire will kill economic recovery http://bit.ly/9CupTW,,,,,
19827655096,24183358,congculberson,Twitter Web Client,2010-07-29 13:57:34,0,0,"RT @GOPConference President’s advisor, Christina Romer, has said “tax cuts have positive output effects.” http://bit.ly/bbYC2y",,,,,
19741229395,24183358,congculberson,Twitter Web Client,2010-07-28 13:39:51,0,0,RT @GOPConference Joint Cmte on Tax says half of small biz income will face higher taxes under Obama plan  http://bit.ly/9q5dEU,,,,,
19677360435,24183358,congculberson,Twitter Web Client,2010-07-27 18:34:29,0,0,"""Our Biggest National Security Threat"" - http://bit.ly/aKpvyI",,,,,
19573410666,24183358,congculberson,Twitter Web Client,2010-07-26 13:29:39,1,0,RT @GOPConference Obama admin says raising taxes “will not affect growth” & that we shouldn’t keep tax cuts in place. http://nyti.ms/bIAG7o,,,,,
19343307561,24183358,congculberson,Twitter Web Client,2010-07-23 14:27:21,1,0,RT @GOPConference Caution: Tax Increases Ahead - The Largest In American History http://bit.ly/9RaK0d,,,,,
19254905578,24183358,congculberson,Twitter Web Client,2010-07-22 13:35:47,0,0,RT @GOPConference Empty promises wrapped in $3.7 trillion debt: When will we see jobs? http://bit.ly/co5XTs,,,,,
18996281234,24183358,congculberson,Twitter Web Client,2010-07-20 14:11:14,1,0,RT @GOPConference State unemployment numbers to be released later this morning – Where are the jobs? (VIDEO) http://bit.ly/bB3pcU,,,,,
18922502984,24183358,congculberson,Twitter Web Client,2010-07-19 15:06:40,0,0,"RT @GOPConference With 9.5% unemployment, will President Obama answer ""Where are the jobs?” in his speech today? http://bit.ly/bWCC4B",,,,,
18686806808,24183358,congculberson,Twitter Web Client,2010-07-16 13:48:45,0,0,"RT @GOPConference As Obama’s economic and spending agenda fails, the US lags far behind other nations in creating jobs http://bit.ly/9nwD29",,,,,
18528912560,24183358,congculberson,Twitter Web Client,2010-07-14 15:48:02,0,0,RT @gopconference Report: Continuing Dems’ record deficits “would...increase the probability of a fiscal crisis” http://bit.ly/90muTv,,,,,
18448949135,24183358,congculberson,Twitter Web Client,2010-07-13 16:21:22,1,0,"RT @gopconference ""This debt will be like a cancer...definitely destroy this country from within."" - Obama Debt Comis. http://bit.ly/cmbEda",,,,,
18356586407,24183358,congculberson,Twitter Web Client,2010-07-12 14:06:43,2,0,My Op-Ed in Roll Call regarding FCC Regulation of the Internet. http://bit.ly/b4ljwM,,,,,
18126010600,24183358,congculberson,Twitter Web Client,2010-07-09 15:21:57,7,1,"Once again, the federal government encroaches on the State of Texas’ sovereign authority. http://bit.ly/bdk6zi",,,,,
16861082633,24183358,congculberson,Twitter Web Client,2010-06-23 16:33:06,0,0,This is completely unacceptable and detrimental to the American people...http://culberson.house.gov/a-failure-to-govern/,,,,,
16409236502,24183358,congculberson,Twitter Web Client,2010-06-17 18:46:31,1,0,I have co-sponsored a bill to end the President's six month drilling moratorium. http://bit.ly/90nNg6,,,,,
15783811018,24183358,congculberson,Twitter Web Client,2010-06-09 14:04:29,1,0,Letter to President Obama: Lift Drilling Moratorium. http://culberson.house.gov/letter-to-president-obama-lift-drilling-moratorium/,,,,,
15636607961,24183358,congculberson,Twitter Web Client,2010-06-07 15:26:14,1,0,Why are Houston's NASA facilities and employees being ignored? http://www.chron.com/disp/story.mpl/editorial/7039839.html,,,,,
14698891891,24183358,congculberson,Twitter Web Client,2010-05-25 15:11:16,0,0,Help us change the way Congress operates - http://www.americaspeakingout.com/,,,,,
14227684626,24183358,congculberson,Twitter Web Client,2010-05-18 13:31:34,0,0,Houston and Austin Business Journal published my Op-Ed regarding the BP oil spill. http://bit.ly/9iOHkm,,,,,
13928009569,24183358,congculberson,Twitter Web Client,2010-05-13 18:30:22,0,0,Please tell us what spending YOU would like Congress to cut: http://bit.ly/cnE9yc,,,,,
13498177770,24183358,congculberson,Twitter Web Client,2010-05-06 17:14:06,0,0,@ACUConservative hereby designates Representative Culberson a Defender of Liberty for the 111th Congress First Session.,ACUConservative,,,,
13366352285,24183358,congculberson,Twitter Web Client,2010-05-04 14:08:10,0,0,Great Op-Ed by Fred Barnes... http://bit.ly/dtQuwn,,,,,
13007227198,24183358,congculberson,Twitter Web Client,2010-04-28 13:47:07,0,0,Please take a look at the new NASA section of my website. We must do everything we can to save the manned space program.http://bit.ly/9gQ62O,,,,,
12711793646,24183358,congculberson,Twitter Web Client,2010-04-23 16:32:23,2,0,HHS confirms national health care costs will increase significantly over the next decade under the new law. http://bit.ly/cjKPKr,,,,,
12580630061,24183358,congculberson,Twitter Web Client,2010-04-21 14:53:46,0,0,"Yesterday, we invited president Obama to join us at the Johnson Space Center in Houston. I hope he accepts. http://bit.ly/dc50l9",,,,,
12219584495,24183358,congculberson,Twitter Web Client,2010-04-15 12:24:54,2,0,Op-Ed on President's decision to end America's leadership in space. Russians and Chinese will now be leaders. http://tiny.cc/lgiw8,,,,,
10786880178,24183358,congculberson,Twitter Web Client,2010-03-20 19:37:02,2,0,Great to see the thousands of Americans at the Capitol today protesting the health care bill!,,,,,
10786841633,24183358,congculberson,Twitter Web Client,2010-03-20 19:35:56,5,0,The bill includes $569.2 billion in job-killing tax hikes during the worst recession in a generation http://bit.ly/bOtfdx,,,,,
10784278528,24183358,congculberson,Twitter Web Client,2010-03-20 18:26:14,4,0,WP reporting House Dems will not use deem and pass to jam health care through,,,,,
10780293132,24183358,congculberson,Twitter Web Client,2010-03-20 16:44:52,12,0,RT @GOPWhip: The #Dems #HealthCare Take-Over calls for $1.2 Trillion in gross total spending #handsoff #teaparty #hcr #hc #tcot,,,10777858479,18891923,GOPWhip
10780235987,24183358,congculberson,Twitter Web Client,2010-03-20 16:43:28,19,0,RT @ByronYork: Dreier: Rules Cmte has debated 90 mins--50% longer than will be allowed for final passage of HCR rule. Shouldn't there be ...,,,10777256487,47739450,ByronYork
10777291610,24183358,congculberson,Twitter Web Client,2010-03-20 15:33:52,2,1,"RT CBO says that if $208 billion is added back in for the doc fix, the bill will create a $59 billion deficit http://bit.ly/8Yiwhq",,,,,
10687616453,24183358,congculberson,Twitter Web Client,2010-03-18 20:19:33,2,0,Health Care bill contains more power for the IRS - http://culberson.house.gov/irs-intrusions/,,,,,
10637368755,24183358,congculberson,Twitter Web Client,2010-03-17 20:30:49,0,0,Just signed on to H.Res.1188 Ensuring an up-or-down vote on certain health care legislation #tcot,,,,,
10522574550,24183358,congculberson,Twitter Web Client,2010-03-15 15:40:16,0,0,I'll be on Fox Business today at 12:20 discussing health care.,,,,,
9976519295,24183358,congculberson,Twitter Web Client,2010-03-04 14:56:00,4,0,"Hours to review a $15 billion ""Jobs Bill""? American people should have at least 72 hours to review legislation http://tinyurl.com/yb9bgdw",,,,,
9832593863,24183358,congculberson,Twitter Web Client,2010-03-01 16:57:15,1,1,RT @RepTomPrice: The RSC is having a Twitter Day today. Follow members here http://twitter.com/#/list/RepublicanStudy/twitter-day #RSC,,,,,
9824863091,24183358,congculberson,Twitter Web Client,2010-03-01 13:37:15,0,0,"RT @DrCassidy My commitment is to advance hcr that lowers costs for the good, hardworking uninsured patients he's seeing this morning #RSC",,,,,
9824585956,24183358,congculberson,Twitter Web Client,2010-03-01 13:29:34,1,0,"My commitment is to Thomas Jefferson’s vision of limited government, individual liberty, and states’ rights. #RSC",,,,,
9581946697,24183358,congculberson,Twitter Web Client,2010-02-24 16:13:47,1,0,I'll be on Foxbusiness.com Live tomorrow morning starting at 7:40 (EDT) discussing health care. Watch live here http://tinyurl.com/y8n2ho5,,,,,
9234590708,24183358,congculberson,Twitter Web Client,2010-02-17 14:00:43,0,0,Only in DC:More than $3.5 bl in stimulus $ are going to programs that Pres wants to eliminate or trim in new budget. http://bit.ly/agZXRR,,,,,
8544990315,24183358,congculberson,Twitter Web Client,2010-02-02 14:53:07,1,0,Please join me today at 1 PM (CDT) for a live web townhall with the Houston Chronicle. You can watch here: http://tinyurl.com/yf7hebg,,,,,
8507259768,24183358,congculberson,Twitter Web Client,2010-02-01 17:49:41,2,0,Please join me tmw at 1 PM (CDT) for a live discussion about the president's budget with @rickdunham. Watch here http://tinyurl.com/yf7hebg,,,,,
8194875438,24183358,congculberson,Twitter Web Client,2010-01-25 15:11:48,0,0,"3 different answers from the White House on how many jobs have been ""created or saved"" by Spendulus http://bit.ly/8g8clZ",,,,,
7986025724,24183358,congculberson,Twitter Web Client,2010-01-20 13:56:04,0,0,Please tune in to KSEV this morning at 8 CDT. I'll be on discussing the MA Sen victory.,,,,,
7674199717,24183358,congculberson,Twitter Web Client,2010-01-12 16:28:50,0,0,RT @GOPLeader: Join us on Facebook in offering tributes to our long time friend and colleague Paula Nowakowski http://bit.ly/8axYXr,,,,,
7480429217,24183358,congculberson,Twitter Web Client,2010-01-07 14:36:58,0,0,Looking forward to speaking at Cy-Falls High School today. I'll be on KSEV this evening at 5 PM. Hope you can tune in.,,,,,
7480154452,24183358,congculberson,Twitter Web Client,2010-01-07 14:27:30,1,0,Obama Reneges on Health Care Transparency http://tinyurl.com/yeegpqq,,,,,
6733619275,24183358,congculberson,Twitter Web Client,2009-12-16 15:48:49,4,0,Culberson calls on Speaker Pelosi to cancel her flight to Copenhagen and read the bills before voting http://tinyurl.com/yejqf7w,,,,,
