id,user_id,screen_name,source,created_at,retweet_count,favorite_count,text,in_reply_to_screen_name,in_reply_to_status_id,retweeted_status_id,retweeted_status_user_id,retweeted_status_screen_name
358704786876534786,24183358,congculberson,Echofon,2013-07-20 21:47:40,2,0,"RT @BeschlossDC: On the moon, Nixon is still US President--plaque left there on 1st Apollo landing, today 1969: http://t.co/WKP7cMv7b0",,,,,
358245547469058049,24183358,congculberson,Echofon,2013-07-19 15:22:49,2,3,House conservatives want to restore state and parental control in education. My amendment was a big step toward that. http://t.co/eapzPL2M2Z,,,,,
358213465032237057,24183358,congculberson,TweetDeck,2013-07-19 13:15:20,3,3,Headed to the House floor to speak in favor of my amendment to HR 5 that would restore local control over education. http://t.co/JV2MgP130c,,,,,
357956023211917312,24183358,congculberson,TweetDeck,2013-07-18 20:12:21,0,0,"Thanks, Dana! RT @DanaTColeman: Blessed to have @JohnCornyn and @SenTedCruz as my senators and @congculberson as my representative.",,,,,
357670384729985025,24183358,congculberson,TweetDeck,2013-07-18 01:17:19,0,0,Voted to delay Obamacare implementation. Americans are facing higher taxes &amp; a stagnant economy and shouldn’t be further hurt by Obamacare.,,,,,
357498245863309312,24183358,congculberson,TweetDeck,2013-07-17 13:53:18,0,0,Democrats are calling Obamacare a “train wreck.” Today House conservatives are doing something about it.,,,,,
357166604838109184,24183358,congculberson,TweetDeck,2013-07-16 15:55:29,0,1,"I'm looking for smart, motivated college students or recent grads to intern in my DC or Houston offices. Apply here: http://t.co/0KqLyO7QrO",,,,,
357124272814161922,24183358,congculberson,TweetDeck,2013-07-16 13:07:16,0,0,Pleased to stand with the Texas Congressional delegation in protecting medical centers for kids in our state. http://t.co/hunCr8Y7kX,,,,,
356945590657089536,24183358,congculberson,TweetDeck,2013-07-16 01:17:15,2,0,I spoke on Friday with @KPFT on the Senate’s immigration bill and my goals for immigration reform: http://t.co/hm1XMRHu2s,,,,,
356907086522748928,24183358,congculberson,TweetDeck,2013-07-15 22:44:15,3,0,"When union leaders are saying Obamacare will lead to ""nightmare scenarios,"" you know it's time for full repeal. http://t.co/SOdkjPROU6",,,,,
356797688903254017,24183358,congculberson,TweetDeck,2013-07-15 15:29:32,2,0,"RT @BJPolitics: Texas @CongCulberson: Senate Immigration Bill is a publicity stunt, unconstitutional, and illegal http://t.co/u0TVG66TlT #i…",,,356773304469684226,68203907,BJPolitics
354681546852147200,24183358,congculberson,TweetDeck,2013-07-09 19:20:45,1,1,I'm on the House floor to speak against letting the EPA regulate dust and mud puddles. Watch live here: http://t.co/JV2MgP130c,,,,,
354567041786720258,24183358,congculberson,TweetDeck,2013-07-09 11:45:44,2,0,I'm talking to @radiomattrick about immigration on KTRH 740 in Houston. Listen live here: http://t.co/l9yZIzyikW,,,,,
354248214658027521,24183358,congculberson,TweetDeck,2013-07-08 14:38:50,3,1,I'm on @MyFoxHouston talking about what Congress is doing to help veterans. Watch live here: http://t.co/mw5b19n2yn,,,,,
352821998453407746,24183358,congculberson,TweetDeck,2013-07-04 16:11:34,1,0,"What defines us as Texans and Americans—love of country, pride in our history, and individual liberty—make ours the best country the world.",,,,,
352803375550701572,24183358,congculberson,TweetDeck,2013-07-04 14:57:34,2,0,237 years ago our founding fathers signed their names to one of the greatest documents in history--Happy Birthday America!,,,,,
352417676418748416,24183358,congculberson,Echofon,2013-07-03 13:24:56,0,0,I'm talking this morning on KSEV 700. Listen live here: http://t.co/N5ITeQO4pf,,,,,
351805839830560770,24183358,congculberson,TweetDeck,2013-07-01 20:53:43,1,1,Student loan rates double today. I supported the House conservative plan to prevent that. It's time for the Senate to act.,,,,,
350274571783516160,24183358,congculberson,TweetDeck,2013-06-27 15:29:00,3,0,"RT @RepKayGranger: Today is National #PTSD Awareness Day.  If you know someone suffering, please reach out.  Make a difference.  http://t.c…",,,350271924640813057,161743731,RepKayGranger
349694538211786753,24183358,congculberson,TweetDeck,2013-06-26 01:04:09,18,2,"Here's a test to tell if Obama's war on coal will affect you: Do you use electricity? If so, then yes.",,,,,
349638921484906498,24183358,congculberson,TweetDeck,2013-06-25 21:23:09,6,1,"In his speech this afternoon, Obama laid out an energy plan that ensures you'll have higher electricity bills and will pay more at the pump.",,,,,
347815099530113024,24183358,congculberson,TweetDeck,2013-06-20 20:35:56,0,1,".@rickdunham Despite worthy reforms of our farm programs, I cannot support nearly $1 trillion in new spending and new debt.",rickdunham,347782614050021376,,,
347380740608106497,24183358,congculberson,TweetDeck,2013-06-19 15:49:57,2,0,RT @DarrellIssa: 74% of Americans want to see the #IRS investigated. ReTweet if you're one of them. http://t.co/nVmpIWH91B,,,,,
347064057699917824,24183358,congculberson,TweetDeck,2013-06-18 18:51:34,0,0,.@sustain05 I agree. We need to stay out of Syria and support our allies.,sustain05,347045306514411520,,,
346319720540168192,24183358,congculberson,Echofon,2013-06-16 17:33:50,1,0,Happy Father's Day!,,,,,
345639473545101313,24183358,congculberson,Echofon,2013-06-14 20:30:46,0,1,Enjoyed having you! RT @Yoest: Just wrapped up my senior experience in @CongCulberson 's office! Truly an incredible internship. #TX07,,,,,
345603819729731584,24183358,congculberson,TweetDeck,2013-06-14 18:09:06,2,0,RT @rosetexas: Tks @CongCulberson for always being there for #diabetes &amp; advocating advancement of artificial pancreas at #FDA @JDRFAdvocac…,,,345562969033289729,23354596,rosetexas
345579564409430017,24183358,congculberson,TweetDeck,2013-06-14 16:32:43,0,0,"Thanks for 238 years service to our country. Happy birthday, @USArmy",,,,,
345543157225779202,24183358,congculberson,Twitter Web Client,2013-06-14 14:08:03,0,1,"On this day in 1777, Congress adopted the Stars and Stripes as our national flag. Happy Flag Day! http://t.co/dDFZz0FsPv",,,,,
345218295181488128,24183358,congculberson,TweetDeck,2013-06-13 16:37:10,0,0,"Glad to see my amendment—which would remove waste, fraud, and abuse from the SNAP program—approved in @HouseAppropsGOP today.",,,,,
344987098836774913,24183358,congculberson,TweetDeck,2013-06-13 01:18:28,1,0,MT @GOPLeader: George HW Bush served in House from '67 to '71 and was first Republican from Houston. #TX7 now represented by @CongCulberson.,,,,,
344941129910853633,24183358,congculberson,TweetDeck,2013-06-12 22:15:48,0,1,Great to see you! MT @JanineTurner: Day 4 of my #TruthAct campaign! Spent day on #CapitolHill http://t.co/93nl5l88ge,,,,,
344901282714238976,24183358,congculberson,TweetDeck,2013-06-12 19:37:28,0,0,A great op-ed from my friend @RepPaulRyan: We need to rein in government through the appropriations process. http://t.co/aN5OD9UegD,,,,,
344854945771700225,24183358,congculberson,TweetDeck,2013-06-12 16:33:20,1,0,Happy birthday President George H.W. Bush! #TX7 is proud of your service to Houston and this great country.,,,,,
344830860731756544,24183358,congculberson,TweetDeck,2013-06-12 14:57:38,1,0,Pleased to see my language requiring the Dept. of Defense to move to an integrated health record with the VA pass @HouseAppropsGOP today.,,,,,
344255740560699392,24183358,congculberson,TweetDeck,2013-06-11 00:52:19,1,0,"The NSA revelations, along with the IRS, the DOJ, and Benghazi show that this government is out of control.",,,,,
344188207426060288,24183358,congculberson,TweetDeck,2013-06-10 20:23:58,7,0,It’s time to end the Administration’s culture of cover-ups and intimidation. RT if you think the federal government needs to be reined in.,,,,,
342690358213361664,24183358,congculberson,TweetDeck,2013-06-06 17:12:02,1,0,RT @AHIPCoverage: Thank you for supporting repeal of the health insurance tax @ConawayTX11 @CongCulberson @farenthold @RepBillFlores #repea…,,,342668192042319873,22797378,AHIPCoverage
342641703620063232,24183358,congculberson,Echofon,2013-06-06 13:58:42,9,1,Today is the 69th anniversary of D-Day. The courage shown by our soldiers that day is still inspiring to us all. http://t.co/LTftvUJJj6,,,,,
342389261510799360,24183358,congculberson,Twitter Web Client,2013-06-05 21:15:36,1,2,Enjoyed meeting with the Greater Houston Builders to talk about reining in EPA regulations affecting the industry. http://t.co/wGNtIJrDJB,,,,,
342354894126186497,24183358,congculberson,TweetDeck,2013-06-05 18:59:02,0,2,Texans are the best. Thousands turned out to honor Houston's four fallen firefighters today: http://t.co/BFMTTHN8Nv,,,,,
342072158614331392,24183358,congculberson,TweetDeck,2013-06-05 00:15:32,0,0,Honored that 420 of my colleagues joined me in supporting HR 2216 to provide our veterans the support they deserve. http://t.co/6GkNCR9O7s,,,,,
341990063363723264,24183358,congculberson,TweetDeck,2013-06-04 18:49:19,1,0,I’m on the House floor speaking for the MilCon/VA bill to protect our veterans. Watch live here: http://t.co/JV2MgP130c,,,,,
341989634571636736,24183358,congculberson,TweetDeck,2013-06-04 18:47:37,1,0,"RT @HouseAppropsGOP: FY14 MilCon/VA bill makes sure ""our men and women in uniform have everything they need to do their job,"" says @CongCul…",,,341989342803288064,301549400,HouseAppropsGOP
341644259700645888,24183358,congculberson,TweetDeck,2013-06-03 19:55:13,2,1,MT @farenthold: The #IRS spent $50 MILL on lavish conferences from '10-'12. RT if you're also insulted http://t.co/6zPDjXvEE9,,,,,
340541529057792001,24183358,congculberson,TweetDeck,2013-05-31 18:53:22,1,0,"Business Insider published the ""17 Reasons Why Houston is the Best City in America."" Why stop at 17 reasons? http://t.co/oFfldbkWp8",,,,,
340519883139842049,24183358,congculberson,TweetDeck,2013-05-31 17:27:21,0,0,"Rate Shock: In California, Obamacare To Increase Individual Health Insurance Premiums By 64-146% - Forbes http://t.co/2RwkkT08ck",,,,,
340480375996440577,24183358,congculberson,TweetDeck,2013-05-31 14:50:22,0,0,.@latimes asks: Should the U.S. include China in its naval exercises? I voted no. http://t.co/AWH3oetaKr,,,,,
340240863445786625,24183358,congculberson,Echofon,2013-05-30 22:58:37,1,0,RT @cathymcmorris: Still waiting for answers... What really happened in #Benghazi? Where was the #President during the attack?,,,,,
339799427164274690,24183358,congculberson,TweetDeck,2013-05-29 17:44:31,1,0,Great op-ed in the Cypress Creek Mirror on the Keystone XL pipeline and its benefits for Houston: http://t.co/NN1naGc75a,,,,,
339546053424590848,24183358,congculberson,Echofon,2013-05-29 00:57:42,1,2,Great crowd at the town hall tonight. Thanks to all those who came out and asked questions. http://t.co/ne0OdbFo8u,,,,,
339491840438976512,24183358,congculberson,TweetDeck,2013-05-28 21:22:16,0,0,Join me at 6 PM this evening for a town hall @ Nottingham Country Elementary. 20500 Kingsland Blvd. in Katy.,,,,,
339375727638085634,24183358,congculberson,TweetDeck,2013-05-28 13:40:53,2,0,"REMINDER: I'm having a town hall meeting TONIGHT at 6:00. Nottingham Country Elementary, 20500 Kingsland Blvd in Katy. Hope you can make it.",,,,,
339173169686528000,24183358,congculberson,TweetDeck,2013-05-28 00:15:59,2,1,Tomorrow night at 6:00 I'm having a town hall meeting at Nottingham Country Elementary. 20500 Kingsland Blvd in Katy. Hope to see you there,,,,,
339083073922691072,24183358,congculberson,TweetDeck,2013-05-27 18:17:59,1,0,On Memorial Day we're reminded of this country’s blessings and humbled by those who have given their lives to defend it.,,,,,
339057830076231682,24183358,congculberson,Echofon,2013-05-27 16:37:40,0,0,Remembering &amp; honoring our fallen military heroes this morning at the Houston National Cemetery. http://t.co/USR8oAEccE,,,,,
338359895269183488,24183358,congculberson,Echofon,2013-05-25 18:24:20,14,0,"RT @Houstorian: Today in 1961, JFK proposes to Congress, ""landing a man on the Moon and returning him safely to the Earth."" #HoustonHistory…",,,338344307201290240,151336717,Houstorian
337669310757609473,24183358,congculberson,TweetDeck,2013-05-23 20:40:11,2,1,.@benfirstpro I'm signed on to the Massie letter. I've never voted to raise taxes and don't plan on starting.,benfirstpro,337656815842119680,,,
337354470512009216,24183358,congculberson,TweetDeck,2013-05-22 23:49:08,0,1,"#KeystoneXL pipeline will create 20,000 American jobs. It’s a no-brainer; the Senate and Obama should approve it too.",,,,,
337353719597395968,24183358,congculberson,TweetDeck,2013-05-22 23:46:09,1,0,Voted tonight in favor of #KeystoneXL. Energy production is the key to America's economic future.,,,,,
337297366006775808,24183358,congculberson,TweetDeck,2013-05-22 20:02:13,3,1,Has the IRS targeted you or a group you belong to for political reasons? Share your story here: http://t.co/lKivgXtQeS,,,,,
337224468210520065,24183358,congculberson,TweetDeck,2013-05-22 15:12:33,0,0,".@HouseAppropsGOP is now marking up the FY14 Homeland Security bill, which strengthens our border and increases government accountability.",,,,,
337214834213019648,24183358,congculberson,TweetDeck,2013-05-22 14:34:16,0,0,"What we expected from the ""most transparent administration in history"" RT @RepThomasMassie: Lerner takes the Fifth http://t.co/o6ya2HYJcj",,,,,
337202225925472258,24183358,congculberson,TweetDeck,2013-05-22 13:44:10,1,2,.@GOPoversight hearing on IRS political targeting is happening now. Watch live: http://t.co/9JsJGcnYX5,,,,,
336931416141070337,24183358,congculberson,TweetDeck,2013-05-21 19:48:04,2,0,Great news for Houston--would love to see the Texans play in it RT @KPRCLocal2: Houston Wins Bid for Super Bowl LI http://t.co/8fCPGL8xnG,,,,,
336866802707603457,24183358,congculberson,TweetDeck,2013-05-21 15:31:19,1,0,"RT @HouseAppropsGOP: .@CongCulberson notes chief priorities included addressing the veterans disability claims backlog, creating a unified …",,,336866005697568769,301549400,HouseAppropsGOP
336864407944568833,24183358,congculberson,TweetDeck,2013-05-21 15:21:48,2,0,We have a long history of bipartisan support for our military and veterans. This bill continues that support in a fiscally responsible way.,,,,,
336863447792881664,24183358,congculberson,TweetDeck,2013-05-21 15:17:59,1,0,The MilCon/VA bill we're marking up now provides funding to ensure that our military and our veterans have the resources that they need.,,,,,
336598277787090945,24183358,congculberson,TweetDeck,2013-05-20 21:44:17,1,0,Truly devastating images coming out of Oklahoma. Thoughts and prayers go out to those affected.,,,,,
335832330079985664,24183358,congculberson,Echofon,2013-05-18 19:00:41,3,0,Today is Armed Forces Day--please take a minute to thank a soldier or veteran for all they do for our country,,,,,
335502755147960320,24183358,congculberson,TweetDeck,2013-05-17 21:11:04,0,0,".@Chocolataman HR 1062, Regulatory Accountability Act. Requires analysis &amp; review of new &amp; existing regs. More info http://t.co/XoDGslP8Uk",Chocolataman,335500355242717184,,,
335488598554050560,24183358,congculberson,TweetDeck,2013-05-17 20:14:49,0,0,I spoke on the House floor yesterday about Democrats' hypocrisy on enrolling in the Obamacare trainwreck: http://t.co/VN37b9mSQJ,,,,,
335457190175449088,24183358,congculberson,TweetDeck,2013-05-17 18:10:01,1,1,I voted today to force the SEC to use common-sense principles in making regulations affecting small businesses.,,,,,
335408452711088128,24183358,congculberson,TweetDeck,2013-05-17 14:56:21,3,2,"I wrote a little bit on the recent Obama scandals. If you can, please take a minute to read: http://t.co/lgJjzS0L5T",,,,,
335193685132201985,24183358,congculberson,Echofon,2013-05-17 00:42:56,3,1,Unbelievable. The IRS official in charge of targeting conservatives is now running the IRS Obamacare office. http://t.co/XuoshNLtgD,,,,,
335160771963150336,24183358,congculberson,TweetDeck,2013-05-16 22:32:09,8,10,Voted to repeal. #ObamacareInThreeWords,,,,,
335131835505991680,24183358,congculberson,TweetDeck,2013-05-16 20:37:10,3,4,This week has shown us the IRS is not following the law. Let’s not put them in charge of healthcare. I’m voting to repeal Obamacare.,,,,,
335121766655590401,24183358,congculberson,TweetDeck,2013-05-16 19:57:10,1,1,Did you know Sec. Sebelius is soliciting donations to help implement Obamacare? Here's what I'm doing about it: http://t.co/1nYe712ulj,,,,,
335095039627780096,24183358,congculberson,TweetDeck,2013-05-16 18:10:57,0,0,The FY14 DHS Approps bill we marked up today forces the DHS to report its justification for ammunition purchases to Congress every 3 months.,,,,,
335093023941738499,24183358,congculberson,TweetDeck,2013-05-16 18:02:57,0,0,"With @JudgeCarter's lead, the FY14 DHS bill we marked up today is strong on border security and gov't accountability: http://t.co/d64eoTTmXv",,,,,
335030177358815232,24183358,congculberson,TweetDeck,2013-05-16 13:53:13,20,0,"RT @RepHensarling: This morning, my thoughts &amp; prayers are with my fellow Texans who were impacted by last night's devastating storm. #GodB…",,,335009817032802307,18566912,RepHensarling
334836348575952896,24183358,congculberson,TweetDeck,2013-05-16 01:03:01,2,0,"True! RT @connorobrienNH: At #MilCon Appropriations subcommittee meeting, @CongCulberson revealed he is an amateur astronomer. #funfact",,,,,
334791458118844416,24183358,congculberson,TweetDeck,2013-05-15 22:04:38,1,0,Arrested Development fans: GOB Bluth and Senate Dems feel the same way about Obamacare--“I’ve made a huge mistake.” http://t.co/NKo3BkjkSm,,,,,
334740259835359233,24183358,congculberson,TweetDeck,2013-05-15 18:41:11,0,0,Happy to! Thanks for taking the lead on this. RT @RepThomasMassie: Thx @CongCulberson for signing my letter against #InternetTax #NoNetTax,,,,,
334684647554437120,24183358,congculberson,TweetDeck,2013-05-15 15:00:12,0,1,Excited to chair the FY 2014 MilCon markup to ensure that our military and veterans get the support they deserve. http://t.co/waqYbX5Vy1,,,,,
334323444177063937,24183358,congculberson,TweetDeck,2013-05-14 15:04:55,15,4,"""Using the salad fork for the entree is inappropriate. Using the IRS for political purposes is a criminal offense."" http://t.co/2BvS1JU6iy",,,,,
334028844631732225,24183358,congculberson,TweetDeck,2013-05-13 19:34:17,123,0,RT @GOPLeader: I’m grateful justice has been served. Many families still recovering from the horror &amp; pain. Pray for them and for all human…,,,334026876316180480,18891923,GOPLeader
333625766132723712,24183358,congculberson,Echofon,2013-05-12 16:52:35,0,0,Happy Mother's Day!,,,,,
332952500967710720,24183358,congculberson,TweetDeck,2013-05-10 20:17:16,60,0,"RT @GOPWhip: The White House said today House GOP is attempting to ""politicize"" #Benghazi. Americans lost their lives, and we want facts. T…",,,332945622036537344,19739126,GOPWhip
332945595914416129,24183358,congculberson,TweetDeck,2013-05-10 19:49:50,5,1,The IRS intimidating organizations based on ideology is unacceptable. The House will begin investigating immediately.,,,,,
332921300467212288,24183358,congculberson,TweetDeck,2013-05-10 18:13:18,1,0,"Talking pts were changed 12x, we need 1 RT @penguinponders During @CongCulberson's town hall last week, he called for select com on Benghazi",,,,,
332902004739407872,24183358,congculberson,TweetDeck,2013-05-10 16:56:37,4,0,RT @RepKevinBrady: IRS apologizes for targeting conservative groups http://t.co/iCGeoRlbrx,,,332880963698823168,19926675,RepKevinBrady
332612859127291906,24183358,congculberson,TweetDeck,2013-05-09 21:47:39,1,2,"Texas’s economy is booming, so we're a great model for the President to learn how to do things right in the other 49 states.",,,,,
332592562332377088,24183358,congculberson,Twitter Web Client,2013-05-09 20:27:01,1,0,Great to meet with Paulette and Diane Bennett of Houston advocating for ALS research in my DC office today http://t.co/7V9EzQA6ye,,,,,
332261837817147392,24183358,congculberson,TweetDeck,2013-05-08 22:32:49,0,0,The Working Families Flexibility Act I cosponsored passed the House today. This bill helps parents balance the demands of work and family.,,,,,
332156563773087744,24183358,congculberson,TweetDeck,2013-05-08 15:34:30,0,2,.@GOPoversight is kicking off an important hearing on Benghazi. Watch live here: http://t.co/WVT7fDQmPb,,,,,
331878299259240448,24183358,congculberson,TweetDeck,2013-05-07 21:08:47,0,1,Texas is ranked as the most competitive state for business--our pro-growth policies should be a model for the nation. http://t.co/hltU6jpomD,,,,,
331479555963486208,24183358,congculberson,TweetDeck,2013-05-06 18:44:19,0,0,"On Wed., the TX Medical Center is holding a hiring event for veterans. Please share this with the vets in your life: http://t.co/JvAE4lC8Er",,,,,
330404561988751360,24183358,congculberson,Twitter Web Client,2013-05-03 19:32:41,0,0,.@CyChristian visited DC this week. If your school is making a DC trip we can help plan here: http://t.co/M8od6qpI8F http://t.co/WiqIaebyY5,,,,,
330392240415453184,24183358,congculberson,Twitter Web Client,2013-05-03 18:43:43,0,0,"Great that students from @DuchesneHouston came to DC this week, I hope y'all had a memorable trip. http://t.co/OidBc3ZXzQ",,,,,
329980533922725889,24183358,congculberson,Twitter Web Client,2013-05-02 15:27:44,0,0,"Congrats to Betsy Goodman of Episcopal HS for winning the Congressional Art Competition for #TX7 with ""Lily Pond."" http://t.co/x2vT5okIu1",,,,,
329776978418880512,24183358,congculberson,TweetDeck,2013-05-02 01:58:53,1,0,.@cjnapoli Thanks for coming out to the town hall tonight; I enjoyed talking with #TX7 folks about how to reign in the federal government.,cjnapoli,329733569486405634,,,
329766388384276483,24183358,congculberson,Echofon,2013-05-02 01:16:48,0,0,Great turnout at the town hall meeting tonight! Thanks to everyone who came to talk about what I'm working on in DC. http://t.co/wQQ2t2DBYP,,,,,
329676951574949888,24183358,congculberson,TweetDeck,2013-05-01 19:21:25,2,0,MT @penguinponders: Reminder: @congculberson is holding a Town Hall meeting tonight. 6:00PM at Memorial Middle School. I'll save you a seat.,,,,,
329329925221933057,24183358,congculberson,TweetDeck,2013-04-30 20:22:27,0,1,I'm talking with @Radiomattrick on KPRC 950 in Houston about what's going on in Washington. Listen here: http://t.co/O89sk9AvI0,,,,,
328980104489349120,24183358,congculberson,TweetDeck,2013-04-29 21:12:23,1,0,I'm having a town hall meeting to discuss Washington's spending problem at Memorial Middle School at 6:00 Wednesday. Hope to see you there.,,,,,
327502236966076418,24183358,congculberson,TweetDeck,2013-04-25 19:19:52,7,0,"RT @PeteSessions: My thoughts are with West, #TX as they honor the victims of last week’s tragic explosion. View the memorial LIVE: http://…",,,327496000983932928,24735461,PeteSessions
327439555923951617,24183358,congculberson,TweetDeck,2013-04-25 15:10:48,0,0,"Since GOP control started in 2011, smart changes to House operations have saved taxpayers more than $400 million http://t.co/34UsauVdgu",,,,,
327131967059529728,24183358,congculberson,TweetDeck,2013-04-24 18:48:33,7,0,"Air traffic controllers are furloughed, but Obamacare officials aren't. Read about it during your flight delay: http://t.co/HYL734ijJ2",,,,,
326488968168366080,24183358,congculberson,Echofon,2013-04-23 00:13:30,0,2,MT @USACEGALVESTON: Col. Sallese briefs @CongCulberson about FY14 projects; Sallese sits in 36th US Pres. LBJs chair http://t.co/pQeToqspsm,,,,,
325427047805632512,24183358,congculberson,Echofon,2013-04-20 01:53:48,3,0,Tonight in Boston we saw the bravery and resolve of our first responders. We should be thankful for them today and every day.,,,,,
325408185630470145,24183358,congculberson,Echofon,2013-04-20 00:38:51,0,1,RT @rosetexas: Thank you @CongCulberson for support of diabetes research &amp; for sharing your time with @JDRFAdvocacy http://t.co/edVdEy97vB,,,,,
324924456092983296,24183358,congculberson,TweetDeck,2013-04-18 16:36:41,1,0,"At 2:00 ET, I'm questioning Attorney General Eric Holder in a House Approps hearing. What would you like to hear him discuss this afternoon?",,,,,
324897537301565441,24183358,congculberson,Echofon,2013-04-18 14:49:43,0,0,I'm chairing a @HouseAppropsGOP hearing with VA Sec. Shinseki on veteran's issues and claims backlogs. Live feed: http://t.co/Fu9LILwS0p,,,,,
324850022162251776,24183358,congculberson,Echofon,2013-04-18 11:40:55,0,0,RT @Pontifex: Please join me in praying for the victims of the explosion in Texas and their families.,,,,,
324841619964694528,24183358,congculberson,Echofon,2013-04-18 11:07:32,1,0,"RT @tedcruz: How to Help the West, TX Victims: http://t.co/PlPgOfD9Mp",,,,,
324669873571655680,24183358,congculberson,Echofon,2013-04-17 23:45:04,0,0,"RT @JanineTurner: @CongCulberson on my show now re: Jeffersonian Republicans, our 2nd Amendment Rights &amp; more! Call me 855-952-6463 or XM166",,,,,
324663219920715776,24183358,congculberson,Echofon,2013-04-17 23:18:38,0,1,I'm talking with @JanineTurner on KPRC 950 in Houston at 6:30 CT. Listen live here: http://t.co/DADxFeufqg,,,,,
324638932102959104,24183358,congculberson,TweetDeck,2013-04-17 21:42:07,0,0,I'll be talking with Paul Bettencourt on KSEV 720 in Houston at 5:00 CT. Listen live here: http://t.co/kdOSGrt7lE,,,,,
324593153313239041,24183358,congculberson,TweetDeck,2013-04-17 18:40:13,1,1,"Yet another member of the President's party realizes that Obamacare will be a ""huge train wreck."" http://t.co/9jOgVPqW7c",,,,,
323886176157171714,24183358,congculberson,TweetDeck,2013-04-15 19:50:56,2,0,"My thoughts and prayers are with the victims, families, and first responders in Boston today.",,,,,
