id,user_id,screen_name,source,created_at,retweet_count,favorite_count,text,in_reply_to_screen_name,in_reply_to_status_id,retweeted_status_id,retweeted_status_user_id,retweeted_status_screen_name
489488991314788352,24183358,congculberson,TweetDeck,2014-07-16 19:17:24,0,0,ICYMI: I spoke yesterday at an @exploreplanets event on the importance of a mission to Europa. You can watch here: https://t.co/yQcIzmv2ke,,,,,
489389953869029376,24183358,congculberson,Echofon,2014-07-16 12:43:52,550,0,RT @BeschlossDC: Apollo 11 was launched 45 years ago today at 9:32 EDT:  #NASA http://t.co/KpobhKX6BK,,,489387655809863680,874916178,BeschlossDC
489128417942863873,24183358,congculberson,Echofon,2014-07-15 19:24:37,16,14,Great turnout at the @exploreplanets Europa event! Exciting to see so many people interested in planetary science. http://t.co/ni1vGSvwsX,,,,,
489068957383819264,24183358,congculberson,TweetDeck,2014-07-15 15:28:20,5,2,If only... http://t.co/4q4J2s9PvZ,,,,,
488807167839850499,24183358,congculberson,TweetDeck,2014-07-14 22:08:05,1,0,"In case you missed it, my e-newsletter from last week on President Obama's border crisis: http://t.co/O0q7IAwMmI",,,,,
488786987772837888,24183358,congculberson,TweetDeck,2014-07-14 20:47:53,5,0,"RT @CaseyDreier: Tomorrow! Come one, come all for Europa, @TheScienceGuy, @EllenStofan, @LamarSmithTX21, @CongCulberson, more: http://t.co/…",,,488784226721230848,18309133,CaseyDreier
488763169238577154,24183358,congculberson,TweetDeck,2014-07-14 19:13:14,4,1,"It's been 2,124 days since the application to build the Keystone XL Pipeline was submitted. Remember that when you're at the pump today.",,,,,
488703203236904960,24183358,congculberson,TweetDeck,2014-07-14 15:14:57,19,17,"Today and every day, I stand with Israel. http://t.co/BR1aJzA8Qu",,,,,
488053210527965184,24183358,congculberson,TweetDeck,2014-07-12 20:12:07,0,0,Great read. RT @NatGeo: One of the oldest questions may be answered in our lifetimes. Is there life beyond Earth? http://t.co/rbylSgdzh9,,,,,
487992279005937664,24183358,congculberson,Echofon,2014-07-12 16:10:00,1,0,"RT @FredReitman: Thanks, @CongCulberson This outrage on the border has to be stopped and right away. It'll only getting worse w/ time. http…",,,487743514663337984,754108322,FredReitman
487622120445194243,24183358,congculberson,TweetDeck,2014-07-11 15:39:07,2,0,RT @SpeakerBoehner: Thought the score in the #GERvsBRA game was bad? http://t.co/rglevlcnGs http://t.co/nQVw8NXNzG,,,,,
487595206863097857,24183358,congculberson,TweetDeck,2014-07-11 13:52:11,1,0,ICYMI: I spoke with Lou Dobbs about President Obama's border crisis last night. https://t.co/5IUT7EFG79,,,,,
487396570816872449,24183358,congculberson,TweetDeck,2014-07-11 00:42:52,3,1,I spoke with @loudobbsnews about President Obama's border crisis tonight. WATCH: https://t.co/ua9zcYMrNn,,,,,
487370117681270784,24183358,congculberson,Echofon,2014-07-10 22:57:45,0,0,Behind the scenes at the Capitol. I'm on Fox Business in a few minutes to talk with @loudobbsnews about the border http://t.co/l36fAJWrLY,,,,,
487259192743718912,24183358,congculberson,TweetDeck,2014-07-10 15:36:59,1,0,"I'll be on @loudobbsnews on Fox Business tonight at 7 ET, 6 CT to talk about the situation at the border. Tune in!",,,,,
487255196939337728,24183358,congculberson,TweetDeck,2014-07-10 15:21:06,1,1,.@fam_Denn A Lamar and Rice grad? Of course I'll #VoteRendon,fam_Denn,487245535204495360,,,
486860302399832064,24183358,congculberson,TweetDeck,2014-07-09 13:11:56,4,1,"Great story! Victoria, TX police officers buy groceries for family in need. http://t.co/BCKKDgGTs1",,,,,
486581039091826688,24183358,congculberson,TweetDeck,2014-07-08 18:42:14,0,0,"Be sure to ""like"" my Facebook page to stay updated on the latest from Washington and Houston! https://t.co/b4LdtYORUk",,,,,
486536976737513474,24183358,congculberson,TweetDeck,2014-07-08 15:47:09,0,0,Inspired by Anita Bullers and her grandson Nicholas in Houston. They're leading the fight against Duchenne MD. http://t.co/3UOBqngsxB,,,,,
486228889463963648,24183358,congculberson,TweetDeck,2014-07-07 19:22:55,0,0,"""If states are truly laboratories of democracy, Texas' pro-growth policies serve as an example of the way forward"" http://t.co/6y0l9vN2oH",,,,,
485122048432562176,24183358,congculberson,Echofon,2014-07-04 18:04:44,0,3,"Great time at the Villages Independence Day parade. Unfortunately, they wouldn't let me keep the car. Happy 4th! http://t.co/xdPfZLO3q5",,,,,
485046667603750912,24183358,congculberson,TweetDeck,2014-07-04 13:05:11,1,0,Happy 4th of July! Looking forward to the Villages Independence Festival this morning. Hope to see you there!,,,,,
484505058751434753,24183358,congculberson,TweetDeck,2014-07-03 01:13:02,1,1,"Thanks for coming by! RT @Easter_Seals: @CongCulberson, thank you for meeting and listening to us during #CapHill14",,,,,
484446714619637760,24183358,congculberson,TweetDeck,2014-07-02 21:21:12,1,0,Want to hear the latest from Washington? Sign up for email updates today: http://t.co/ssLqgiRTEO,,,,,
484127873276473344,24183358,congculberson,TweetDeck,2014-07-02 00:14:14,0,0,"Business Insider released the ""18 Reasons Houston is the Best City in America."" One question...why limit it to 18?  http://t.co/1m5oMQO756",,,,,
484007803305340928,24183358,congculberson,TweetDeck,2014-07-01 16:17:07,1,1,Good luck to the #USMNT today! #IBelieveThatWeWillWin,,,,,
483953171312562176,24183358,congculberson,TweetDeck,2014-07-01 12:40:02,2,1,I'll be on KSEV 700 in Houston in a few minutes to talk border security and presidential overreach. Tune in!,,,,,
483673243602419712,24183358,congculberson,TweetDeck,2014-06-30 18:07:42,0,1,"From the @HOUBizJournal, ""Texas rules the oil and gas world with one-quarter of all drilling rigs on earth""  http://t.co/xv9jeaHCZq",,,,,
483629559674597376,24183358,congculberson,TweetDeck,2014-06-30 15:14:07,2,1,Today's Hobby Lobby ruling was a victory for religious freedom. Glad to see the Supreme Court uphold this fundamental American right.,,,,,
483036401647095808,24183358,congculberson,TweetDeck,2014-06-28 23:57:07,3,1,Very cool RT @astro_reid: Houston under a #LightningStorm as seen from #SpaceVine https://t.co/pgn6S5dc82,,,,,
482945311845806080,24183358,congculberson,TweetDeck,2014-06-28 17:55:09,1,0,"RT @WestUExaminer: Culberson: U.S. House fighting to keep energy accessible, affordable http://t.co/Awngx5HONK",,,,,
482610325250785280,24183358,congculberson,TweetDeck,2014-06-27 19:44:02,9,1,Did you know the House passed three bills this week that will create jobs and lower energy prices? Learn more: http://t.co/9RVN2yoQJe,,,,,
482518973960183808,24183358,congculberson,TweetDeck,2014-06-27 13:41:02,1,0,ICYMI: my e-newsletter from last night on American energy independence: http://t.co/94cjb6XyHE,,,,,
482327744009613313,24183358,congculberson,TweetDeck,2014-06-27 01:01:10,1,2,"Great to have Samantha Kim, the #TX07 Congressional Art Competition winner, in DC today. Congrats! http://t.co/lWnP00wpOo",,,,,
482242394574684160,24183358,congculberson,Echofon,2014-06-26 19:22:01,0,0,Of course! Ready for the next game RT @OddFangirl: @CongCulberson Happy my rep supports America in everything #1N1T http://t.co/24jJc8qohX,,,,,
482187495212605440,24183358,congculberson,TweetDeck,2014-06-26 15:43:52,5,2,Cheering on the #USMNT today. I believe that we will win! http://t.co/96TceSKGC6,,,,,
482173589840756736,24183358,congculberson,TweetDeck,2014-06-26 14:48:36,2,1,Good. Checks and balances matter. RT @DRUDGE_REPORT: SCOTUS strikes down Obama recess appointments... http://t.co/a1u3oKJIfd,,,,,
481885974507823104,24183358,congculberson,TweetDeck,2014-06-25 19:45:43,0,1,Joined my @HouseAppropsGOP  colleagues in advancing a bill that cuts IRS funds and blocks bonuses. http://t.co/QtGtFH3Fd6,,,,,
481822643914829824,24183358,congculberson,TweetDeck,2014-06-25 15:34:04,0,0,Thanks! RT @KoontzOncology: Wonderful mtg today w @CongCulberson to advocate for #ChildhoodCancer research.Thank you! http://t.co/lQqk0UF7Sg,,,,,
481607739093708801,24183358,congculberson,TweetDeck,2014-06-25 01:20:07,1,1,"""Houston's Economy Shows No Signs of Slowing Down"" --Washington could learn a thing or two. http://t.co/oOi3kq3VFY",,,,,
481545361753116673,24183358,congculberson,TweetDeck,2014-06-24 21:12:15,0,0,Are you signed up to receive my e-newsletters? http://t.co/OQk0LHpPsd,,,,,
481242603191431168,24183358,congculberson,TweetDeck,2014-06-24 01:09:12,2,1,Missing emails? Doubtful. The American people deserve to know the truth about what happened at the IRS. http://t.co/0wccx49Z0A,,,,,
481166991928340480,24183358,congculberson,TweetDeck,2014-06-23 20:08:45,1,0,ICYMI: My e-newsletter from this weekend on holding the IRS accountable http://t.co/QtGtFH3Fd6,,,,,
480422153863438339,24183358,congculberson,TweetDeck,2014-06-21 18:49:01,3,4,The DC office got in on it too! #ENDALZ http://t.co/iTxDOFbaQ7,,,,,
480421414579625984,24183358,congculberson,TweetDeck,2014-06-21 18:46:05,4,1,"Yesterday, my Houston office wore purple in support of The Longest Day and Alzheimer's research. #ENDALZ http://t.co/INAJdOSalm",,,,,
480040037154041856,24183358,congculberson,TweetDeck,2014-06-20 17:30:38,454,0,"RT @FoxNews: ""Nobody believes you"": @PRyan takes on #IRS head over missing Lerner emails. WATCH: http://t.co/uo9s6OVT2e http://t.co/2yfkcAI…",,,480010471022809088,1367531,FoxNews
479762806376366080,24183358,congculberson,TweetDeck,2014-06-19 23:09:01,0,2,The bill also provides funding for Israel's Iron Dome system--one of the most critical pieces of Israel's defenses. http://t.co/BgT7tLiHxR,,,,,
479762090626789376,24183358,congculberson,TweetDeck,2014-06-19 23:06:10,1,0,"The House is voting on the DOD appropriations bill tonight, which ensures our men and women in uniform have the support they deserve.",,,,,
479442964863672321,24183358,congculberson,TweetDeck,2014-06-19 01:58:05,1,0,I hosted a reception for the TX-07 service academy appointees this week. Great group of young men and women! http://t.co/GXoKAHlhxH,,,,,
479330623321276416,24183358,congculberson,TweetDeck,2014-06-18 18:31:40,1,0,I spoke out against President Obama's war on affordable energy during the House Appropriations markup today: https://t.co/RCTdNmz9ch,,,,,
478977638728343552,24183358,congculberson,TweetDeck,2014-06-17 19:09:02,10,6,Today in history: the Statue of Liberty arrives in New York from France. http://t.co/EFtuL4qxlm,,,,,
478889813089595392,24183358,congculberson,TweetDeck,2014-06-17 13:20:03,0,1,RT @BrendaStardig: Attended the West Houston Association Transportation Forum. Pic w/ Rep. Bohac and @CongCulberson http://t.co/9Gmds4i6sF,,,,,
478655761510592512,24183358,congculberson,TweetDeck,2014-06-16 21:50:01,1,3,Best of luck to the #USMNT and the Houston Dynamo's @Brad_Davis11 tonight!,,,,,
478654573436207105,24183358,congculberson,TweetDeck,2014-06-16 21:45:17,0,0,Enjoyed meeting with our #TX07 service academy appointees this afternoon. They are some of the best and brightest Houston has to offer.,,,,,
478610741344616449,24183358,congculberson,TweetDeck,2014-06-16 18:51:07,4,0,RT @TxDOTHoustonPIO: West Hou Assoc. &amp; TxDOT celebrate the leadership of Cong. Culberson in solving West Houston transportation issues. htt…,,,478600643045646336,32470142,TxDOTHoustonPIO
478290542149636096,24183358,congculberson,Echofon,2014-06-15 21:38:46,1,0,There is no greater joy than the joy of being a dad! Happy Fathers Day!,,,,,
477841025772580864,24183358,congculberson,Echofon,2014-06-14 15:52:33,20,0,RT @RepublicanStudy: RT if you’re celebrating this symbol of freedom today. #FlagDay2014 http://t.co/QGEWTKFcbF,,,477811073756971009,22528309,RepublicanStudy
477109943267778560,24183358,congculberson,TweetDeck,2014-06-12 15:27:29,4,0,"Happy birthday, Mr. President! RT @FoxNews: @GeorgeHWBush marks 90th birthday with parachute jump http://t.co/aqwuM6mTGk",,,,,
477080741285994497,24183358,congculberson,TweetDeck,2014-06-12 13:31:27,0,1,"On this day in 1987, Reagan gave his ""Tear Down This Wall"" speech at the Brandenburg Gate in Berlin: https://t.co/tPDXwjqBH3",,,,,
476834769963995136,24183358,congculberson,TweetDeck,2014-06-11 21:14:02,1,0,Enjoyed meeting with Johnson Space Center director Ellen Ochoa today to talk about our human spaceflight programs.,,,,,
476513648563982336,24183358,congculberson,TweetDeck,2014-06-10 23:58:01,0,0,Culberson Statement on Passage of House THUD bill: http://t.co/UhW2Ql9YUx,,,,,
476423870132396033,24183358,congculberson,TweetDeck,2014-06-10 18:01:16,2,0,"The House just unanimously passed the Veterans Access to Care Act, giving vets options for private healthcare &amp; stopping bonuses to admin.",,,,,
476395174902632449,24183358,congculberson,TweetDeck,2014-06-10 16:07:15,0,0,"Honored to be named a ""Taxpayer Hero"" by Citizens Against Government Waste. They do great work fighting wasteful federal spending.",,,,,
475698327619522561,24183358,congculberson,TweetDeck,2014-06-08 17:58:14,2,0,Enjoyed speaking with @IngrahamAngle on border security. https://t.co/LFFUWfemEw,,,,,
475380959240417281,24183358,congculberson,TweetDeck,2014-06-07 20:57:07,2,0,ICYMI: I spoke with Laura Ingraham yesterday on border security. Listen here: https://t.co/LFFUWfemEw,,,,,
474978809075085312,24183358,congculberson,TweetDeck,2014-06-06 18:19:07,3,1,RT @charlescwcooke: An AP photograph of a religious service aboard a landing craft. http://t.co/FMANhU3S5N,,,,,
474935701642182657,24183358,congculberson,TweetDeck,2014-06-06 15:27:49,0,0,"We honor the soldiers of D-Day, who fought to answer the ""hopes and prayers of liberty-loving people everywhere."" http://t.co/WxsUSsVeG0",,,,,
474908453300092928,24183358,congculberson,TweetDeck,2014-06-06 13:39:33,0,0,Talking with @IngrahamAngle this morning. Listen on KSEV 700 in Houston or online at http://t.co/7FAHARDgXx,,,,,
474907271085195264,24183358,congculberson,TweetDeck,2014-06-06 13:34:51,28,0,RT @DaleLezon: USS Texas blasted German defenses as Allied troops stormed ashore on D-Day 70 years ago today. http://t.co/iRCuHBURQT http:/…,,,474901267563966464,1603914259,DaleLezon
474562399216091137,24183358,congculberson,TweetDeck,2014-06-05 14:44:27,2,0,"It's been ten years since Reagan's passing. His message of limited government, liberty, and American exceptionalism will always live on.",,,,,
474209542235254784,24183358,congculberson,TweetDeck,2014-06-04 15:22:19,24,0,RT @GOPLeader: The reality of the EPA's latest proposal: an increase in families' home electricity bills.,,,474202831881527296,18891923,GOPLeader
473869988705890304,24183358,congculberson,TweetDeck,2014-06-03 16:53:04,1,1,"From the @USNavy, a great video interview with the veterans  from the USS Texas on D-Day: http://t.co/m5NOT1FF69",,,,,
473819587054936065,24183358,congculberson,TweetDeck,2014-06-03 13:32:47,2,0,"RT @farenthold: Today in 1965, Texan Ed White was the first American to walk in space from Gemini 4. Love my @NASA",,,473819321789984768,17896154,farenthold
473485763624321024,24183358,congculberson,TweetDeck,2014-06-02 15:26:17,2,0,"A campaign promise fulfilled: Obama said electricity rates will ""necessarily skyrocket"" with his energy plan. https://t.co/rY11l0IXT5",,,,,
472821416489132032,24183358,congculberson,Echofon,2014-05-31 19:26:24,13,6,RT @Martin_Dempsey: It is our ethos that we never leave a fallen comrade. Welcome home SGT Bowe Bergdahl.,,,,,
472468521952104448,24183358,congculberson,TweetDeck,2014-05-30 20:04:08,5,2,"Shinseki's gone, but problems at the VA remain. I spoke about about getting our vets the care they've earned: http://t.co/GE7HcXf3g9",,,,,
472420377696944128,24183358,congculberson,TweetDeck,2014-05-30 16:52:49,3,0,My statement on Sec. Shinseki's resignation: http://t.co/y8ti3oJgvX,,,,,
471759614346686466,24183358,congculberson,TweetDeck,2014-05-28 21:07:11,2,0,Joined @RepJoeBarton and a bipartisan Texas group in opposing EPA overregulation:  http://t.co/QPSlD4SWwB,,,,,
471719243407695873,24183358,congculberson,TweetDeck,2014-05-28 18:26:46,6,0,"RT @HouseAppropsGOP: Later today, the House will consider the FY15 bill funding @CommerceGov, @TheJusticeDept, @NSF, @NASA and related agen…",,,471686107344547841,301549400,HouseAppropsGOP
471647963933339648,24183358,congculberson,TweetDeck,2014-05-28 13:43:32,0,0,"RT @Houstorian: Today in 1965, Dr. Michael DeBakey is featured on the cover of Time Magazine. @Time http://t.co/OeNbOPMEnh",,,,,
471458631011946497,24183358,congculberson,TweetDeck,2014-05-28 01:11:11,0,0,ICYMI: I spoke with Fox &amp; Friends this weekend on the VA scandal. WATCH: https://t.co/xD7GUoKrpX,,,,,
471368304137736192,24183358,congculberson,TweetDeck,2014-05-27 19:12:15,0,0,"Are you signed up to receive my e-newsletters? If not, sign up here: http://t.co/ssLqgiRTEO",,,,,
471295784348954625,24183358,congculberson,TweetDeck,2014-05-27 14:24:05,0,0,ICYMI: I spoke with Fox &amp; Friends this weekend about the VA scandal and the Senate's inaction. https://t.co/xD7GUoKrpX,,,,,
471046659359522816,24183358,congculberson,TweetDeck,2014-05-26 21:54:09,4,2,Freedom is never free. Our country owes a debt of gratitude to all the men and women who serve and have served in the armed forces.,,,,,
471032001798352896,24183358,congculberson,Echofon,2014-05-26 20:55:55,4,1,It was an honor to attend the Memorial Day ceremony at the Houston National Cemetery this morning. http://t.co/7pSnRGRts5,,,,,
470940970628816896,24183358,congculberson,TweetDeck,2014-05-26 14:54:11,2,1,"This Memorial Day, join me in remembering the brave men and women who made the ultimate sacrifice for our country.",,,,,
470736364586012672,24183358,congculberson,TweetDeck,2014-05-26 01:21:09,2,0,ICYMI: I spoke with the folks at Fox &amp; Friends this morning about what Congress needs to do to fix the VA. WATCH: http://t.co/ArKnIWn0t0,,,,,
470645535037075457,24183358,congculberson,TweetDeck,2014-05-25 19:20:14,4,0,Happy that @foxandfriends is bringing attention to the Senate's inaction on VA reform. WATCH my interview here: http://t.co/ArKnIWn0t0,,,,,
470542341019664384,24183358,congculberson,Echofon,2014-05-25 12:30:11,55,0,RT @airandspace: Today in 1961: President John F Kennedy announced goal of landing a man on the Moon before joint session of Congress: http…,,,470520099032821760,14848513,airandspace
470506076308140032,24183358,congculberson,Echofon,2014-05-25 10:06:04,2,3,I'm on @foxandfriends in just a few minutes to talk about the VA. Tune in!,,,,,
470293699356663808,24183358,congculberson,TweetDeck,2014-05-24 20:02:10,3,0,Are you an early riser? I'll be on @foxandfriends tomorrow morning at 6:15 am ET to talk about the VA. Set an alarm (or a DVR)!,,,,,
469467138617790464,24183358,congculberson,TweetDeck,2014-05-22 13:17:42,1,0,ICYMI: I spoke with @Radiomattrick yesterday about the latest with the VA. Listen here: http://t.co/DC7OKMkLDI,,,,,
469236974344089600,24183358,congculberson,TweetDeck,2014-05-21 22:03:07,0,2,Voted tonight on a bill to hold the VA accountable. Our vets deserve better.,,,,,
469085451249516544,24183358,congculberson,TweetDeck,2014-05-21 12:01:01,1,1,I'll be live on KTRH 740 in Houston with @Radiomattrick in just a few minutes to discuss the latest with the VA. Tune in!,,,,,
468922374071808000,24183358,congculberson,TweetDeck,2014-05-21 01:13:00,2,4,Proud to stand with an overwhelming bipartisan majority in the House to fight human trafficking and end this modern-day slavery.,,,,,
468889194694443008,24183358,congculberson,TweetDeck,2014-05-20 23:01:10,0,0,We can no longer think of human trafficking as a far-off problem in a third-world country. http://t.co/TxjrQrGgmQ,,,,,
468814136747786240,24183358,congculberson,TweetDeck,2014-05-20 18:02:55,1,1,Enjoyed it! RT @BP_America: Thanks Congressman @CongCulberson for visiting our employees at our Houston headquarters. http://t.co/NgLZKxhPIf,,,,,
468535567207374848,24183358,congculberson,TweetDeck,2014-05-19 23:35:58,1,1,"Proud to support H.R. 685, awarding a Congressional Gold Medal to our American Fighter Aces.",,,,,
467757007185780737,24183358,congculberson,TweetDeck,2014-05-17 20:02:15,1,1,Honored to be speaking at the West Houston Home Educators graduation ceremony this afternoon.,,,,,
467710514320392192,24183358,congculberson,TweetDeck,2014-05-17 16:57:30,20,0,"RT @RandyNeugebauer: Today on U.S. Armed Forces day, and everyday, I'm thankful to those who selflessly defend our nation. http://t.co/puH7…",,,467709355127631872,34340464,RandyNeugebauer
467033472574296064,24183358,congculberson,TweetDeck,2014-05-15 20:07:11,1,1,Today is Peace Officers Memorial Day. Please take a minute to pause and remember those who gave their lives in the protection of others.,,,,,
466980272861626368,24183358,congculberson,TweetDeck,2014-05-15 16:35:47,11,0,"RT @JohnCornyn: ""Were we directed from Washington when to sow and when to reap, we should soon want bread."" -- Thomas Jefferson (1743-1826)",,,466977928874848256,13218102,JohnCornyn
466662079773278209,24183358,congculberson,TweetDeck,2014-05-14 19:31:24,2,1,"The Washington Monument reopened this week. If you're planning a trip to DC, I can help: http://t.co/JGjuDiPfpN http://t.co/6a3iD1cZWq",,,,,
466314485289201666,24183358,congculberson,TweetDeck,2014-05-13 20:30:11,3,3,“Texas is the best state for business and I don’t see anything slowing it down”  Read more: http://t.co/Un7F8RsPPa,,,,,
465978642590605313,24183358,congculberson,TweetDeck,2014-05-12 22:15:40,5,0,RT @RepKevinBrady: Pretty cool --&gt; Watch the Washington Monument renovated - in 80 seconds http://t.co/qrC1hZYUVR,,,465950995386597376,19926675,RepKevinBrady
465519968075804672,24183358,congculberson,TweetDeck,2014-05-11 15:53:03,0,1,Happy Mother's Day to the women with the toughest and most important job in the world!,,,,,
465218475460272128,24183358,congculberson,TweetDeck,2014-05-10 19:55:02,3,1,ICYMI: @SenTedCruz and I introduced a bill to fight against IRS targeting: http://t.co/S1I2DJQwux,,,,,
464805711521017857,24183358,congculberson,TweetDeck,2014-05-09 16:34:51,3,2,RELEASE: Culberson and Cruz Introduce Bill to Fight IRS Targeting http://t.co/WZ7OncbOB9,,,,,
464587553463881728,24183358,congculberson,TweetDeck,2014-05-09 02:07:59,0,1,Voted tonight to establish a select committee to investigate Benghazi. The victims' families and the American people deserve answers.,,,,,
464533801805578241,24183358,congculberson,TweetDeck,2014-05-08 22:34:23,3,5,Presided as we voted to establish a select committee to investigate the Benghazi attack. Resolution passed 232-186 http://t.co/hpr5bbEsdv,,,,,
464485596002803712,24183358,congculberson,Twitter Web Client,2014-05-08 19:22:50,1,0,Brittany in my Houston office stopped by @3brothersbakery for their 65th anniversary celebration today #3BBmemories http://t.co/DhvmmgFyRo,,,,,
464416405560258560,24183358,congculberson,TweetDeck,2014-05-08 14:47:54,4,0,RT @HouseAppropsGOP: Chairman @RepHalRogers just gaveled in today's full committee markup. Watch live online at http://t.co/0Ej6dwon1i. htt…,,,464408605228531712,301549400,HouseAppropsGOP
464183508504969216,24183358,congculberson,TweetDeck,2014-05-07 23:22:27,9,7,Voted to hold Lois Lerner in contempt of Congress and create a special counsel to investigate IRS targeting. Americans deserve the truth.,,,,,
464162292322795520,24183358,congculberson,TweetDeck,2014-05-07 21:58:08,0,0,Great to see y'all! RT @NicoleBellLLS: Great meeting with Congressman Culberson.  #ideclare4LLS http://t.co/QUDdcJ9KY9,,,,,
464112595524669440,24183358,congculberson,TweetDeck,2014-05-07 18:40:40,1,0,Thanks for coming by! RT @Tomzzzdoc: Sitting in LBJ's Oval Office chair in @CongCulberson's office. http://t.co/CEt9OmQuoM,,,,,
463799243715530753,24183358,congculberson,TweetDeck,2014-05-06 21:55:31,4,2,Always a treat to have my friend Bill Nye stop by the office to talk science. #FundPlanetary http://t.co/s0FSa4Yms6,,,,,
462347273402597376,24183358,congculberson,TweetDeck,2014-05-02 21:45:54,1,0,"Congrats to Seoyoung Kim from Memorial HS, 2014 Congressional Art Competition winner for ""Riding the Texas Range."" http://t.co/hxke3m7IpI",,,,,
462339447447879680,24183358,congculberson,Echofon,2014-05-02 21:14:48,1,1,We've got a great group of talented young artists here at my Congressional Art Competition reception in Houston. http://t.co/f9JJqAk50E,,,,,
462262380425412609,24183358,congculberson,TweetDeck,2014-05-02 16:08:34,933,0,RT @SpeakerBoehner: RT to share the news: The House will vote to establish a new #SelectCommittee on #Benghazi. http://t.co/zpKW4b4Cap,,,462261065477132288,7713202,SpeakerBoehner
462253922959515649,24183358,congculberson,TweetDeck,2014-05-02 15:34:58,0,0,I am an original coauthor of @RepWOLFPress resolution calling for a select House committee on Benghazi &amp; WH emails show it is now urgent,,,,,
462047506746982400,24183358,congculberson,TweetDeck,2014-05-02 01:54:44,1,0,ICYMI: I wrote an op-ed in The Hill on the need for the VA and DoD to develop an interoperable health records system. http://t.co/trh8fbVRzl,,,,,
462004365881262081,24183358,congculberson,TweetDeck,2014-05-01 23:03:19,1,1,RT @RepStutzman: May God continue to bless America. #NationalPrayerDay http://t.co/JNob6YOh2b,,,,,
461942645884190720,24183358,congculberson,Echofon,2014-05-01 18:58:03,0,0,Duchesne Academy is up in DC from Houston today. I had a great time talking with this bright group of young women. http://t.co/jnuwPtwXVQ,,,,,
461647544372985856,24183358,congculberson,TweetDeck,2014-04-30 23:25:26,6,4,"By a 416-1 vote, the House passed my bill to fund, streamline, and modernize the VA. http://t.co/bwVczJWcB1",,,,,
461562974264512512,24183358,congculberson,TweetDeck,2014-04-30 17:49:23,2,0,My VA bill the House will vote on today makes sure that the agency is accountable to both taxpayers and the veterans that they serve.,,,,,
461562728545812480,24183358,congculberson,TweetDeck,2014-04-30 17:48:24,0,1,Down on the House floor managing debate for my VA funding bill that we're voting on today. Watch live: http://t.co/73w7sUU0xg,,,,,
