id,user_id,screen_name,source,created_at,retweet_count,favorite_count,text,in_reply_to_screen_name,in_reply_to_status_id,retweeted_status_id,retweeted_status_user_id,retweeted_status_screen_name
497490642919251970,37094727,mariodb,Mobile Web (M5),2014-08-07 21:13:06,23,10,Un placer reunirme @CubaSindicatos. Trabajamos para #libertad #democracia en Cuba @RosLehtinen @LincolnDBalart http://t.co/gxrTJuFStY,,,,,
497472361273516032,37094727,mariodb,Twitter for iPhone,2014-08-07 20:00:28,5,2,.@iflymia's commitment to safety has been recognized by @WeAreALPA. #MIA is the Airport of the Year. Congrats! http://t.co/WaSMLouNmf,,,,,
496409547360468993,37094727,mariodb,Mobile Web (M5),2014-08-04 21:37:13,5,0,Thanks @MayelaRosales &amp; the team at Univision SWFL for having me over today to discuss issues imp to the community! http://t.co/HS7yQ2iPa2,,,,,
496383387503198208,37094727,mariodb,TweetDeck,2014-08-04 19:53:16,3,0,Met with Collier County administrators today to discuss updated flood maps + other FEMA issues #FL25 http://t.co/iu5Q0Nctpk,,,,,
496300589924757504,37094727,mariodb,TweetDeck,2014-08-04 14:24:16,3,3,U.S. Will Continue Pro-Democracy Work in Cuba and Wherever Freedom is Under Attack http://t.co/8EGUKPftnZ,,,,,
496050603295260672,37094727,mariodb,Mobile Web (M5),2014-08-03 21:50:54,50,24,Please keep the Tahmooressi family in your thoughts. Andrew has another hearing tomorrow. #MarineHeldinMexico http://t.co/eh2BVfPaQw,,,,,
495307332918984704,37094727,mariodb,TweetDeck,2014-08-01 20:37:25,5,2,DC summer interns are wrapping up. Interested in applying for DC or #FL25 office? Click here: http://t.co/dtdX3EU8Tp http://t.co/tBJMCFtJSo,,,,,
495213966306852864,37094727,mariodb,TweetDeck,2014-08-01 14:26:24,2,0,.@ananavarro is at it again -- tune in to @theviewtv at 11a as she brings her Miami heat as a guest host! ¡Prepárate!,,,,,
494866971755024385,37094727,mariodb,TweetDeck,2014-07-31 15:27:34,4,2,It has been an honor serving alongside @GOPLeader Eric Cantor http://t.co/c7wr8j3hpp,,,,,
494597189914886145,37094727,mariodb,TweetDeck,2014-07-30 21:35:33,351,51,EE.UU. debe imponer ya saciones contundentes contra el régimen de Maduro #SOSVzla https://t.co/LrNm6DTOZb,,,,,
494518571507400704,37094727,mariodb,TweetDeck,2014-07-30 16:23:09,82,21,U.S. must immediately impose more robust sanctions against the Maduro regime #SOSVzla http://t.co/sOZeIXQABx,,,,,
494512064678080513,37094727,mariodb,TweetDeck,2014-07-30 15:57:18,1,1,UN Security Council must hold Cuban officials accountable in Chong Chon Gang Incident http://t.co/HNzEnZyiEG,,,,,
494238785815969793,37094727,mariodb,TweetDeck,2014-07-29 21:51:23,13,6,Met w/ @YrisCuba today as she continued to share her story in fight for democracy in #Cuba @RosLehtinen http://t.co/PdDybWM9k0,,,,,
493839338598588417,37094727,mariodb,TweetDeck,2014-07-28 19:24:08,3,5,"The Magic City turns 118 today! ¡Felicidades, @CityofMiami!",,,,,
493795558038196224,37094727,mariodb,TweetDeck,2014-07-28 16:30:09,3,1,"Happy Independence Day to Peru and the Peruvian community in #SFL, as they celebrate 193 years of freedom today.",,,,,
492801355774693376,37094727,mariodb,Mobile Web (M5),2014-07-25 22:39:33,9,9,Naples was ranked as the top city for jobs this yr. Proud 2 represent a city w/ such a booming economy + job market!  http://t.co/o654uPiyUJ,,,,,
492774287523454976,37094727,mariodb,TweetDeck,2014-07-25 20:52:00,3,3,Met with #FL25 students @TWCInternships this am to discuss the importance of public service and different issues http://t.co/U9BClIEE6X,,,,,
492738116969840640,37094727,mariodb,TweetDeck,2014-07-25 18:28:16,2,1,Thanks to @UmaPemmaraju for having me on today to discuss the border crisis. Watch here in case you missed it: https://t.co/2aQDuvgRqP,,,,,
492728739491770368,37094727,mariodb,Twitter for iPhone,2014-07-25 17:51:00,2,1,Spoke w @UmaPemmaraju @FoxNews re: border; humanitarian crisis that needs to be dealt w while adhering to rule of law http://t.co/c0Pe1jCUhf,,,,,
492699972098613248,37094727,mariodb,TweetDeck,2014-07-25 15:56:41,5,0,"Driven &amp; strong women like @RosLehtinen are paving the way for the future of our nation by loving their ""firstness"" http://t.co/hNN2bw8zQ2",,,,,
492392170918531073,37094727,mariodb,TweetDeck,2014-07-24 19:33:36,5,0,RT @FIUdc: Thanks to @MarioDB for meeting with @FIU leaders to discuss student issues &amp; future plans for @FIUSGA !#pantherpride http://t.co…,,,492389835479715840,139730062,FIUdc
492342759358205952,37094727,mariodb,TweetDeck,2014-07-24 16:17:15,3,1,Spoke to the Peruvian American Political Organization this morning about free trade and immigration http://t.co/lah7AzTFKs,,,,,
492313052738768896,37094727,mariodb,TweetDeck,2014-07-24 14:19:13,2,0,Grateful for Capitol Police &amp; all they do to protect Congress. Officer Chesnut &amp; Det. Gibson live on in our hearts http://t.co/2KWWa9lK7N,,,,,
492018565953101824,37094727,mariodb,TweetDeck,2014-07-23 18:49:02,1,1,"My office recognizes a familiar #SFL furry friend, Maya! cc @RosLehtinen #MayaAndFriends http://t.co/xkRD16E7z4",,,,,
491755554071924736,37094727,mariodb,Mobile Web (M5),2014-07-23 01:23:55,4,4,Spoke to students in DC tonight @AIPAC Summer Saban Leadership Seminar about the importance public service #Saban2014 http://t.co/eci1jbCU5C,,,,,
491658096847376384,37094727,mariodb,TweetDeck,2014-07-22 18:56:39,0,1,"@JoeAmericandude Hi Jose, if you have an issue, my office can connect you with your Member of Congress.",JoeAmericandude,491656454416257025,,,
491653221241614336,37094727,mariodb,TweetDeck,2014-07-22 18:37:17,1,1,"Today, my office launched ""Share Your VA Story"" for #FL25. Learn more: http://t.co/ACj4oHgSiY #ShareYourVAStory http://t.co/9mjKkRbryF",,,,,
491600390702784512,37094727,mariodb,TweetDeck,2014-07-22 15:07:21,3,1,"Since the implementation of Obamacare, #FL25 seniors have seen a 13% cut in MA benefits. How is this affecting you? http://t.co/2kKBaeO2xz",,,,,
491574231508217856,37094727,mariodb,TweetDeck,2014-07-22 13:23:24,2,2,@HammarOlivia Thank YOU for meeting with us. I will continue to work with @RosLehtinen &amp; other colleagues to #BringBackOurMarine,HammarOlivia,491348170987667456,,,
491573748827684864,37094727,mariodb,TweetDeck,2014-07-22 13:21:29,36,0,RT @HammarOlivia: Sgt Tahmooressi's mother &amp; I met with @RosLehtinen &amp; @MarioDB today. They continue to advocate for our USMC'S expedient r…,,,491348170987667456,1472322680,HammarOlivia
491301603786248192,37094727,mariodb,TweetDeck,2014-07-21 19:20:05,38,4,.@leopoldolopez remains behind bars for fighting for #freedom #democracy. His wife @liliantintori is brave #SOSVzla http://t.co/NJlPH8lFzP,,,,,
491290403937980416,37094727,mariodb,TweetDeck,2014-07-21 18:35:34,8,2,ICYMI: @liliantintori's moving op-ed in @washingtonpost: http://t.co/BsMX0Hl8Lz,,,,,
490907683361275906,37094727,mariodb,Mobile Web (M5),2014-07-20 17:14:47,4,4,Wishing the Colombian community around the world a happy Independence Day!,,,,,
490271233481900032,37094727,mariodb,Twitter for iPhone,2014-07-18 23:05:45,2,0,RT @KeithRothfus: #FF @MarioDB @RepRickCrawford @HerreraBeutler @USRepDavidJolly. Thanks for signing onto HR 2453 to help #MedicareAdvantag…,,,490215725915971584,1155212191,KeithRothfus
490227162130436097,37094727,mariodb,TweetDeck,2014-07-18 20:10:38,8,10,It was great to speak at @AIPAC's 10th Annual Emerging Leaders Luncheon this afternoon! http://t.co/rXLNmhJ92W,,,,,
489905434849845248,37094727,mariodb,Mobile Web (M5),2014-07-17 22:52:12,6,4,Congrats to Amy Travieso &amp; Jeff Moorehouse for being recognized by @TheCHLI this evening! @RepCuellar @RepBillFlores http://t.co/WOgQrjIDBo,,,,,
489809075652546561,37094727,mariodb,TweetDeck,2014-07-17 16:29:18,2,0,RT @marineband: @MarioDB #SemperFi Sir!,,,489803530471886849,22172940,marineband
489808294719270912,37094727,mariodb,TweetDeck,2014-07-17 16:26:12,58,17,"My prayers go out to those on board the Malaysian Airlines flight, as well as their families. #MH17",,,,,
489795206917939201,37094727,mariodb,TweetDeck,2014-07-17 15:34:11,6,1,.@HouseGOP has passed 7 appropriations bills. How many has the Senate passed? 0. House continues to work #4jobs http://t.co/YZGwMf66UG,,,,,
489503911737585664,37094727,mariodb,TweetDeck,2014-07-16 20:16:41,2,4,Financial Svcs @HouseAppropsGOP bill prioritizes funds for programs that encourage job growth and help #smallbiz http://t.co/rE0R1JuJD4,,,,,
489460261317640194,37094727,mariodb,TweetDeck,2014-07-16 17:23:14,2,2,".@TheCHLI's annual Future Leaders Conference is this Friday. Student, intern, or young professional in DC? RSVP here: http://t.co/VUiNm4Gy3Z",,,,,
489408927164301312,37094727,mariodb,TweetDeck,2014-07-16 13:59:15,26,15,Praying for #Israel and a peaceful resolution of the ongoing violence #PrayForIsrael #StandWithIsrael http://t.co/Wvk5ihjRw7,,,,,
489120769151361024,37094727,mariodb,TweetDeck,2014-07-15 18:54:13,1,0,Informative trip to Guatemala and Honduras last weekend. Thx to @RepKayGranger for her leadership in working group. http://t.co/Im3feFl6gw,,,,,
489084077925236736,37094727,mariodb,TweetDeck,2014-07-15 16:28:25,0,0,Thx to Jill for continuing to share your story. We must continue to press the Admin for an answer #BringBackOurMarine http://t.co/NHi0gtmWkH,,,,,
489035974849359873,37094727,mariodb,TweetDeck,2014-07-15 13:17:16,8,6,Happy Birthday to my legislative hermana @RosLehtinen! Join me in wishing her another fantastic year! http://t.co/EpQNX8o5aH,,,,,
488753262741692416,37094727,mariodb,Twitter for iPhone,2014-07-14 18:33:53,10,4,"During this weekend's trip, we met with Guatemala's president @ottoperezmolina to discuss the border crisis http://t.co/hNJboknz93",,,,,
488752086948257792,37094727,mariodb,TweetDeck,2014-07-14 18:29:12,5,1,Glad to join @RepKayGranger on trip to Central America to get more info as we continue to work on a solution to border humanitarian crisis,,,,,
488356576802373632,37094727,mariodb,TweetDeck,2014-07-13 16:17:35,10,2,Thinking of those lost during the #13deMarzo attack http://t.co/GYfTPbd9Hc,,,,,
487769074173108225,37094727,mariodb,Twitter for iPhone,2014-07-12 01:23:04,4,4,Happy 216th bday 2 the @USMarineCorps band! One of my staffers was lucky to attend the summer parade 2night #SemperFi http://t.co/RwSvWeVKLx,,,,,
487685961338605568,37094727,mariodb,TweetDeck,2014-07-11 19:52:48,108,91,I strongly support Israel's right to protect itself &amp; its citizens against terrorism. Praying for Israelis all over the world #PrayForIsrael,,,,,
487636492530245632,37094727,mariodb,TweetDeck,2014-07-11 16:36:14,25,24,Hamas bears sole responsibility for the escalation.  They must end their terror campaign. Congress will #StandWithIsrael,,,,,
487583680941277185,37094727,mariodb,TweetDeck,2014-07-11 13:06:23,0,1,Still proud of @MiamiHeat! MT @RepCuellar: @MarioDB presented me with #SFL key lime pie to settle our NBA Finals bet http://t.co/2Ssv7dsFe2,,,,,
487308175914582017,37094727,mariodb,TweetDeck,2014-07-10 18:51:37,18,6,ICYMI: Mi declaración de hoy sobre la #reformamigratoria: http://t.co/lVOIJ8AoIr,,,,,
487307733285498880,37094727,mariodb,TweetDeck,2014-07-10 18:49:52,25,2,ICYMI: My remarks on #immigration reform from today's press conference: http://t.co/LisHXi0z7J,,,,,
487259471496761345,37094727,mariodb,TweetDeck,2014-07-10 15:38:05,2,3,Can it be any clearer? Lerner and #IRS were covering their tracks! http://t.co/C2P3NsOkP9,,,,,
487257772204240896,37094727,mariodb,TweetDeck,2014-07-10 15:31:20,7,0,Can it be any clearer? Lerner and #IRS were covering their tracks! http://t.co/OuEivzKAcF,,,,,
487241982650372096,37094727,mariodb,TweetDeck,2014-07-10 14:28:35,9,3,Thinking of Tahmooressi family as the battle to get their son released goes on + continue to offer my support #MarineHeldInMexico,,,,,
486959860802916352,37094727,mariodb,TweetDeck,2014-07-09 19:47:32,2,0,RT @FIUdc: .@MarioDB gives his welcome remarks @TheCHLI briefing on #netneutrality @FIUdc @FIU @fiu_sipa http://t.co/Hk8FghcpoR,,,486959808508350464,139730062,FIUdc
486868940996755456,37094727,mariodb,TweetDeck,2014-07-09 13:46:15,0,0,Gas prices have doubled since 2009. When will Senate Dems join @HouseGOP to say #Yes2Energy? http://t.co/rBIW2y00f6,,,,,
486568507518517248,37094727,mariodb,TweetDeck,2014-07-08 17:52:26,3,2,Looking forward to joining @TheCHLI's congressional briefing on #netneutrality this Wednesday 7/8 @ 3:30. More here: http://t.co/5NYm4EgOlB,,,,,
486522492388139008,37094727,mariodb,TweetDeck,2014-07-08 14:49:35,4,1,Stay connected by signing up for my e-newsletter: http://t.co/GMcBNsyRpH #fl25 #sayfie,,,,,
485831289162203136,37094727,mariodb,Mobile Web (M5),2014-07-06 17:03:00,22,13,"Happy Birthday to our 43rd President and great American, George W. Bush! http://t.co/i8gIAa62GO",,,,,
485442893273108481,37094727,mariodb,TweetDeck,2014-07-05 15:19:39,7,2,Celebrating with the #VZ people today and looking to a time when they can once again enjoy prosperity and honest gov http://t.co/tmQxmMkgvc,,,,,
485054691349635072,37094727,mariodb,Mobile Web (M5),2014-07-04 13:37:04,7,4,"Happy 4th of July! For 238 yrs, this country has been an example of democracy, freedom, &amp; independence for the world. http://t.co/9TGPxZCxLU",,,,,
484375177300811776,37094727,mariodb,Twitter Web Client,2014-07-02 16:36:56,4,0,"With the first named storm of the #hurricaneseason, make sure your family is ready with these helpful tips: http://t.co/hQ6YrINFbG",,,,,
484132573010866176,37094727,mariodb,Twitter Web Client,2014-07-02 00:32:54,9,8,I join Israel in mourning the death of #EyalNaftaliGilad. https://t.co/nkYlcAAcm7,,,,,
484103255853506561,37094727,mariodb,Twitter for iPhone,2014-07-01 22:36:25,14,4,"Proud of @ussoccer, a team that has certainly proved folks wrong and put their hearts into every game. I still believe!",,,,,
484033172296847360,37094727,mariodb,TweetDeck,2014-07-01 17:57:55,2,0,Congratulations to @USNavy Adm. Michelle Howard for being the first woman promoted to become a four-star admiral! http://t.co/vL6CGSIm40,,,,,
484005308613009409,37094727,mariodb,TweetDeck,2014-07-01 16:07:12,12,5,Looking forward to the next @ussoccer #USMNT game this afternoon against Belgium! #IBelieve http://t.co/5uywWJ7Dx6,,,,,
483976594453569536,37094727,mariodb,Mobile Web (M5),2014-07-01 14:13:06,45,9,Did you see my op-ed in @MiamiHerald  @RosLehtinen? Obama must join us in standing in solidarity with #VZ #SOSVzla http://t.co/cHPHWuihXH,,,,,
482222853585387521,37094727,mariodb,Twitter for iPhone,2014-06-26 18:04:22,8,5,.@ussoccer advances out of the group round! #ibelieve #usmnt (photo credit: @espn) http://t.co/XqTsZQaKpV,,,,,
482192910868553730,37094727,mariodb,TweetDeck,2014-06-26 16:05:23,1,3,Best of luck to the @ussoccer! #IBelieveThatWeWillWin #USMNT,,,,,
481923250210209792,37094727,mariodb,Mobile Web (M5),2014-06-25 22:13:51,6,1,"Speaking at @fiu event on disaster resilience with @NOAA, esp cutting-edge tech like FIU's Wall of Wind http://t.co/VgUpnLNvkp",,,,,
481900636561502208,37094727,mariodb,Twitter for iPhone,2014-06-25 20:43:59,2,3,Gaia from @Doral_Prep came to DC for #CongressionalArtComp Winner Reception. Nice to meet both her &amp; her mom. #fl25 http://t.co/NH6nlQEmeU,,,,,
481895204816191488,37094727,mariodb,TweetDeck,2014-06-25 20:22:24,1,0,@ClawsonOutsider was just sworn in on the House floor! Welcome to the Florida delegation! #SWFL http://t.co/TAGKa4cWrY,ClawsonOutsider,,,,
481580675372290048,37094727,mariodb,Twitter for iPhone,2014-06-24 23:32:35,5,1,Congrats to the newest member of Congress @ClawsonOutsider. I look forward to working with him on issues that matter to our SWFL community.,,,,,
481570380487086080,37094727,mariodb,TweetDeck,2014-06-24 22:51:40,6,1,Díaz-Balart: Tenemos una crisis humanitaria en la frontera -- http://t.co/gdS54pOVhK,,,,,
481486534517194752,37094727,mariodb,TweetDeck,2014-06-24 17:18:30,3,2,Congratulations to @RepKayGranger on her leadership in getting #SFOPS @HouseAppropsGOP bill through committee http://t.co/TrM30ADzKu,,,,,
481482823174750209,37094727,mariodb,TweetDeck,2014-06-24 17:03:45,24,0,"RT @SpeakerBoehner: Led by @RepKayGranger, border crisis working group: @JudgeCarter @MarioDB @RepGoodlatte @McCaulPressShop @RepStevePearc…",,,481481200331403264,7713202,SpeakerBoehner
481478097284628480,37094727,mariodb,TweetDeck,2014-06-24 16:44:58,5,2,Looking forward to working with my colleagues to address the issue at the southern border that needs urgent attention http://t.co/TFogUJ2E0Q,,,,,
481477395787313152,37094727,mariodb,TweetDeck,2014-06-24 16:42:11,4,3,The situation at the southern border is a humanitarian crisis. Thanks @SpeakerBoehner for appointing me to working group to solve problem.,,,,,
481473863084437505,37094727,mariodb,TweetDeck,2014-06-24 16:28:08,7,2,"You keep your emails for years, and the IRS can't hang onto Lois Lerner's for 6 months? Yeah, right http://t.co/sbEpJpT1o8",,,,,
480050850787000320,37094727,mariodb,TweetDeck,2014-06-20 18:13:36,20,0,RT @SpeakerBoehner: #FF great House Republican women → @RepReneeEllmers @virginiafoxx @cathymcmorris @MicheleBachmann @RepKayGranger @RosLe…,,,480050792578433025,7713202,SpeakerBoehner
479973815565680640,37094727,mariodb,TweetDeck,2014-06-20 13:07:29,3,0,RT @dfatirl: Tánaiste @EamonGilmore met with Congressman Mario Diaz-Balart @MarioDB on Capitol Hill http://t.co/GMkNiKWSZ5,,,479941527897391104,364198635,dfatirl
479755722641924097,37094727,mariodb,Twitter for iPhone,2014-06-19 22:40:52,3,1,Great to meet with Cuban students who are studying @mdcollege #MDCollege http://t.co/6WckBg39tU,,,,,
479740657599545346,37094727,mariodb,TweetDeck,2014-06-19 21:41:00,5,0,Recent report by @ManhattanInst shows more negative impact for Floridians due to #Obamacare. #FL25 http://t.co/9QTw1IthGj,,,,,
479425643630043136,37094727,mariodb,Mobile Web (M5),2014-06-19 00:49:15,3,0,And they did it! Congrats to the members who #beatthepress! #CWSG @CWSoftballGame http://t.co/BvVBCLR7uo,,,,,
479423159872258048,37094727,mariodb,Mobile Web (M5),2014-06-19 00:39:23,7,3,Let's root root root for the home team! @CWSoftballGame #beatthepress Let's go Team @RosLehtinen #TeamIRL #CWSG http://t.co/2sAs0oiF44,,,,,
479376777861939200,37094727,mariodb,TweetDeck,2014-06-18 21:35:04,3,2,Always great to see @RebecaSosaMiami in DC! Discussed @PortMiami @iflymia + other issues imp to @MiamiDadeCounty http://t.co/lJei4FfbAf,,,,,
479354297789202432,37094727,mariodb,TweetDeck,2014-06-18 20:05:45,20,11,Thinking of the families of the three teens kidnapped in Israel. Praying for their immediate return #EyalGiladNaftali,,,,,
479344789377515521,37094727,mariodb,TweetDeck,2014-06-18 19:27:58,7,2,"Regardless of fake polls, we will continue our solidarity with the Cuban people. #cuba #libertad #democracy http://t.co/oRDoLrzOWe",,,,,
479015433664987136,37094727,mariodb,TweetDeck,2014-06-17 21:39:13,7,2,Ambassador Birx and I agree that more work is needed to combat global health issues like HIV/AIDS and malaria http://t.co/NDPVjaWMPj,,,,,
478980637232476160,37094727,mariodb,TweetDeck,2014-06-17 19:20:57,4,1,"Met with @NHCDirector about hurricane season, @NOAA's satellite capabilities, and how preparedness is always key! http://t.co/GHpeYxBVVM",,,,,
478931536025513985,37094727,mariodb,TweetDeck,2014-06-17 16:05:50,2,0,Great to meet with #FL members of the @ABCNational during their legislative conference in DC http://t.co/djPK0JnalA,,,,,
478898411702599681,37094727,mariodb,TweetDeck,2014-06-17 13:54:13,1,1,@janemiami Hi Jane -- please call my office in Doral at 305-470-8555 and they will be able to assist you. Thanks!,janemiami,478887286311256064,,,
478727638140583937,37094727,mariodb,Mobile Web (M5),2014-06-17 02:35:37,4,6,Thank you to @AIPAC for having me speak at tonight's event. Always great to be in your company. http://t.co/nevtW1K68W,,,,,
478716696451379200,37094727,mariodb,Twitter Web Client,2014-06-17 01:52:09,30,5,.@antunezcuba @YrisCuba-arrested again by brutal Castro regime. I ask intl comm to join me in condemning their arrest http://t.co/XxZjrBbSnL,,,,,
478689349350211584,37094727,mariodb,Twitter Web Client,2014-06-17 00:03:29,25,18,"Tonight, we believed, and we did! Congratulations to @USSoccer for winning #USAvGHA! On to the next one! http://t.co/bs9656mDbt",,,,,
478646219519295488,37094727,mariodb,TweetDeck,2014-06-16 21:12:06,2,0,I will do everything I can to hold @MiamiVAMC accountable + that they work to address issues immediately @RosLehtinen http://t.co/BeZuSf3oSP,,,,,
478632507215454208,37094727,mariodb,TweetDeck,2014-06-16 20:17:36,4,2,It's imperative that @MiamiVAMC moves quickly to address delays and failures. Our #vets deserve the best. http://t.co/RoKHbD7v1a,,,,,
478623579165458432,37094727,mariodb,TweetDeck,2014-06-16 19:42:08,3,1,.@RosLehtinen + I met with senior officials from @MiamiVAMC this afternoon to discuss the reports of #vets in #SFL http://t.co/TxDPasnFiB,,,,,
478593513383546880,37094727,mariodb,TweetDeck,2014-06-16 17:42:40,17,0,RT @RosLehtinen: .@MarioDB and I are outraged by @MiamiVAMC's sloppiness and lack of accountability. Our #veterans deserve better care and …,,,478585313799831553,14275291,RosLehtinen
478585224729985024,37094727,mariodb,TweetDeck,2014-06-16 17:09:43,29,5,It has been 18 days since the House passed #VZ Human Rights + Democracy Act. Time for the Senate to act &amp; hold Maduro accountable #SOSVzla,,,,,
478542653202915331,37094727,mariodb,TweetDeck,2014-06-16 14:20:34,4,3,"Tough loss last night, but still proud of our hometown team @MiamiHEAT!",,,,,
478533232397664257,37094727,mariodb,TweetDeck,2014-06-16 13:43:08,18,0,RT @FIU: Was @MarioDB involved in the world's first deep-sea selfie with Aquarius @ReefBase in the background? #Mission31 http://t.co/MI6i5…,,,477797644241084416,39583267,FIU
478199862262247424,37094727,mariodb,Twitter for iPhone,2014-06-15 15:38:26,3,3,"Happy Father's Day to all of the dads in #FL25! Being a dad is a special thing, and I'm thankful to be one to my son. http://t.co/Hn7JiJy7nI",,,,,
477846245206007808,37094727,mariodb,Twitter for iPhone,2014-06-14 16:13:17,22,8,"On June 14th, we commemorate the symbol of freedom and democracy, the American flag. We also celebrate the @USArmy! http://t.co/vYzCb9i0gF",,,,,
477590236415799296,37094727,mariodb,Twitter for iPhone,2014-06-13 23:16:00,17,22,Thanks @FIU for inviting me to join @FCousteau @ReefBase for @Mission_31. Aquarius is the world's only underwater lab http://t.co/4JuW8hCvjj,,,,,
477113671764946945,37094727,mariodb,TweetDeck,2014-06-12 15:42:18,3,4,Great meeting with @Florida4H members from Lee and Collier counties yesterday during their DC trip #leadership #4H http://t.co/WQpukI3q91,,,,,
476445841792991233,37094727,mariodb,Twitter for iPhone,2014-06-10 19:28:35,7,4,A friendly rivalry never hurt anyone! @repcuellar isn't ready to lose our bet. #LetsGoHeat #NBAFinals #BeatTheSpurs http://t.co/cto9PA8rTM,,,,,
476005396558409728,37094727,mariodb,TweetDeck,2014-06-09 14:18:24,6,6,Wishing the best to my friends @RosLehtinen + her husband Dexter on their 30th wedding anniversary! #IlyDex30 http://t.co/xB0ZsGWHb0,,,,,
475004236808212482,37094727,mariodb,TweetDeck,2014-06-06 20:00:09,4,0,Rising Gas Prices = Less Summer Fun? Tweet pics of #FL25 gas prices + join @HouseGOP as we work to #EaseTheSqueeze http://t.co/KXrLvAKbSb,,,,,
474988061366157312,37094727,mariodb,TweetDeck,2014-06-06 18:55:53,2,0,FYI -- .@cityofhialeah section 8 housing app extended until 3 PM Monday 6/9. More info: http://t.co/XkaZh72cxo,,,,,
474968144092876800,37094727,mariodb,TweetDeck,2014-06-06 17:36:44,1,1,Inspiring. Thanks for your bravery! MT @trooperbob101 Loading up for jump into Normandy. I was there D-Day 6/6/44 http://t.co/Iq0Uo58oz0,,,,,
474939288094638080,37094727,mariodb,TweetDeck,2014-06-06 15:42:04,3,0,FYI: For those eligible @cityofhialeah Sec. 8 Housing. Open today 9a-3p. Online ONLY. #FL25 #sayfie https://t.co/qY8PplKxyq,,,,,
474929308939866112,37094727,mariodb,TweetDeck,2014-06-06 15:02:25,21,5,Today we remember those who fought and risked everything in defiance of tyranny and in defense of freedom #DDay70 http://t.co/Za5yicW0e7,,,,,
474909632113418241,37094727,mariodb,TweetDeck,2014-06-06 13:44:14,0,3,Thank you to City of Hialeah Ed. Academy for inviting me to speak at your graduation! It truly was a privilege. #FL25 http://t.co/GqMz2qaEW8,,,,,
474263465922936833,37094727,mariodb,TweetDeck,2014-06-04 18:56:36,1,1,Speaking at the Miami Lakes Chamber of Commerce luncheon this afternoon about the #economy #jobs. http://t.co/EvNy9bmf3b,,,,,
474222536046419969,37094727,mariodb,TweetDeck,2014-06-04 16:13:57,35,12,Thanks @FWD_us for inviting me to join @RosLehtinen @helenaguirrefer @jorgeplasencia @joekgreen @danielggarza for a great convo #immigration,,,,,
474221004810907648,37094727,mariodb,TweetDeck,2014-06-04 16:07:52,8,3,Thoughtful discussion on the need for #immigrationreform and the economic impact it will have on our country http://t.co/kTwh3MtnQd,,,,,
474197598199619584,37094727,mariodb,TweetDeck,2014-06-04 14:34:52,38,8,Chatting with MDC Pres @EduardoJPadron + @FWD_us Pres @joekgreen before this morning's forum on #ImmigrationReform http://t.co/iEfI9Jn5x3,,,,,
473950480301703169,37094727,mariodb,Twitter for iPhone,2014-06-03 22:12:54,33,5,.@RosLehtinen and I were joined by VZ friends at El Arepazo to urge the Senate to pass sanctions bill #SOSVzla http://t.co/UA5LmKpv68,,,,,
473948463239925760,37094727,mariodb,Twitter for iPhone,2014-06-03 22:04:53,4,0,Honored to speak at Mater Lakes Academy HS Commencement today. These bright minds are on to make a difference in #SFL http://t.co/Pqzd6Laa0Q,,,,,
473505710102577152,37094727,mariodb,TweetDeck,2014-06-02 16:45:33,0,0,Check out this weekend's newsletter on how to prepare your family for the start of the 2014 Hurricane Season + more: http://t.co/G2PEMX5dZU,,,,,
472576674656428032,37094727,mariodb,Mobile Web (M5),2014-05-31 03:13:53,12,4,Congrats to our hometown team @MiamiHEAT on 4th #NBAFinals appearance in as many years. Now let's see that three-peat! #LETSGOHEAT,,,,,
