id,user_id,screen_name,source,created_at,retweet_count,favorite_count,text,in_reply_to_screen_name,in_reply_to_status_id,retweeted_status_id,retweeted_status_user_id,retweeted_status_screen_name
467026843527544832,1058717720,repanniekuster,Twitter Web Client,2014-05-15 19:40:51,4,4,"Today I met with law enforcement officials, advocates, and experts on human trafficking. We must take action! http://t.co/ntNsUKIpCe",,,,,
467024751119310848,1058717720,repanniekuster,Twitter Web Client,2014-05-15 19:32:32,1,0,RT @NFImedia: .@RepAnnieKuster knows waste when she sees it.[NEW] article in Politico highlights efforts 2 repeal USDA Catfish Pgrm http://…,,,467004248119857155,260419014,NFImedia
467013264749391872,1058717720,repanniekuster,Twitter Web Client,2014-05-15 18:46:53,1,0,Thrilled to tour GenFoot in Littleton. I fought legislation that would give foreign companies an unfair advantage! http://t.co/WEqqrANnCh,,,,,
466324822226903041,1058717720,repanniekuster,Twitter Web Client,2014-05-13 21:11:16,2,0,RT @NHHospitals: #NHHospitals - US Rep Annie Kuster posed with members of the Rural Health Coalition after today's meeting at the NHHA http…,,,466226499981697024,110777986,NHHospitals
466317134159949824,1058717720,repanniekuster,Twitter Web Client,2014-05-13 20:40:43,3,0,Proud to work across the aisle &amp; help lead all women House Reps to urge action against Boko Haram: http://t.co/PQC8bePpno #bringbackourgirls,,,,,
466253228355883009,1058717720,repanniekuster,Twitter Web Client,2014-05-13 16:26:46,4,0,Read the Mother’s Day op-ed I co-wrote to honor the memory of my mother and her fight against Alzheimer’s: http://t.co/qOll8MH7Fn,,,,,
466237467507838976,1058717720,repanniekuster,Twitter Web Client,2014-05-13 15:24:09,2,2,Tragic news about Officer Steve Arkell in Brentwood. His heroic actions deserve our deepest gratitude and his family is in my prayers.,,,,,
464856004480745472,1058717720,repanniekuster,Twitter Web Client,2014-05-09 19:54:42,3,2,Great to work w/ @RepAnnWagner to lead all House women in requesting sanctions on Boko Haram: http://t.co/OUCeX5IlT5 #BringBackOurGirls,,,,,
464854183154556928,1058717720,repanniekuster,Twitter Web Client,2014-05-09 19:47:28,4,2,Shocked and saddened by kidnappings in Nigeria - U.S govt must do all it can to #bringbackourgirls http://t.co/ABXWmQuFlr,,,,,
464846506127028224,1058717720,repanniekuster,Twitter Web Client,2014-05-09 19:16:58,1,0,Great meeting with the ESOP Assn yesterday about the bill I cosponsored to help these innovative businesses grow! http://t.co/jZPYfC1GEM,,,,,
464826070613905408,1058717720,repanniekuster,Twitter Web Client,2014-05-09 17:55:45,3,1,Discussed Small BREW Act with @smuttynosebeer yesterday. I cosponsored this bill to help small brewers expand in NH! http://t.co/C1vwyrVlS4,,,,,
464549459314348033,1058717720,repanniekuster,Twitter Web Client,2014-05-08 23:36:36,3,0,Just intro'd bill to make sure road &amp; bridge projects don't come to a halt this summer. Read abt my DRIVE Now Act: http://t.co/rg8cXedZcy,,,,,
464444475713269761,1058717720,repanniekuster,Twitter Web Client,2014-05-08 16:39:26,7,4,"My friends at @NALC_National &amp; @USPS are collecting food to #StampOutHunger this Saturday, May 10th. More info here: http://t.co/r61MgUbGC3",,,,,
464396745083219968,1058717720,repanniekuster,Twitter Web Client,2014-05-08 13:29:46,2,0,"If Mont Vernon’s Alex Preston makes it to the Top 3 on American Idol, he’ll be back in the Granite State to perform on Saturday! Go Alex!",,,,,
464150131743682561,1058717720,repanniekuster,Twitter Web Client,2014-05-07 21:09:49,1,0,Thank you to Small Biz Committee for highlighting importance of private sector initiatives to help vets start businesses and create jobs!,,,,,
464134120021721088,1058717720,repanniekuster,Twitter Web Client,2014-05-07 20:06:12,2,1,So happy the House passed a bill I introduced with Rep. Luetkemeyer to increase access to capital for NH businesses! http://t.co/ml5P0jKOzc,,,,,
464117363559133184,1058717720,repanniekuster,Twitter Web Client,2014-05-07 18:59:37,3,1,Most working moms today have to balance their breadwinning and caregiving roles. #WhatMothersNeed is paid family leave.,,,,,
463405446544388097,1058717720,repanniekuster,Twitter Web Client,2014-05-05 19:50:42,0,2,So honored to welcome home the 238th Medevac Company from Afghanistan yesterday. Thank you for your service. http://t.co/9tkvIAvuX1,,,,,
463353505890041856,1058717720,repanniekuster,Twitter Web Client,2014-05-05 16:24:19,2,1,Proud to announce McKenzie West as the winner of the 2014 Congressional Art Competition! http://t.co/0H16Gw0sSb,,,,,
463339647725502464,1058717720,repanniekuster,Twitter Web Client,2014-05-05 15:29:15,5,2,Teachers shouldn’t have to choose between their students &amp; their wallets. Congress should pass #REPAYSupplies!,,,,,
462982001931587584,1058717720,repanniekuster,Twitter Web Client,2014-05-04 15:48:05,2,1,Awesome comeback by the Bruins yesterday; 4 goals in the 3rd period! #BostonStrong,,,,,
462333530739994624,1058717720,repanniekuster,Twitter Web Client,2014-05-02 20:51:18,2,2,Honored to welcome Secretary of the Air Force Deborah Lee James to NH at Pease! http://t.co/idCySxw1dz,,,,,
462321645714038784,1058717720,repanniekuster,Twitter Web Client,2014-05-02 20:04:04,3,1,Met with NH Fire Marshal Bill Degnan to discuss efforts to boost fire safety. We must support our first responders! http://t.co/S5hpRPfBiG,,,,,
462289349435211776,1058717720,repanniekuster,Twitter Web Client,2014-05-02 17:55:44,3,2,"So proud Granite State native Alex Preston made it to the top four on American Idol. We’re pulling for you, Alex! http://t.co/SQZlt5KpXy",,,,,
461970888934834177,1058717720,repanniekuster,Twitter Web Client,2014-05-01 20:50:17,2,1,VA clinics in Berlin and Colebrook will provide service members returning from overseas with services they deserve! http://t.co/lwysenLxpA,,,,,
461950232620974081,1058717720,repanniekuster,Twitter Web Client,2014-05-01 19:28:12,1,0,"To help NH families succeed, we must support women business leaders like the ones I met in Amherst last week: http://t.co/tbiePYTZx1",,,,,
461925905443864577,1058717720,repanniekuster,Twitter Web Client,2014-05-01 17:51:32,0,0,@USDA working on new conservation programs created by Farm Bill. I was proud to support these--farmers should apply! http://t.co/cEgF1VthUB,USDA,,,,
461611458854653952,1058717720,repanniekuster,Twitter Web Client,2014-04-30 21:02:02,1,1,NH is 17th in the nation in growth of women-owned firms. My Women’s Economic Agenda aims to continue this trend. http://t.co/qpVVEtrGJE,,,,,
461527843777036288,1058717720,repanniekuster,Twitter Web Client,2014-04-30 15:29:47,2,0,Glad to see @USDOT’s 4-yr surface transpo proposal. I look forward to reviewing it &amp; working w/Rs and Ds to make these critical investments!,,,,,
461243120412545025,1058717720,repanniekuster,Twitter Web Client,2014-04-29 20:38:24,2,3,Glad #SCOTUS has acted to protect the health of NH families &amp;the environment &amp;upheld @EPA’s important pollution rule. http://t.co/yb8BK001w2,,,,,
460885295123415040,1058717720,repanniekuster,Twitter Web Client,2014-04-28 20:56:31,2,1,Great to see Hopkinton High top the list of NH's best high schools. Proud of NH’s commitment to public education! http://t.co/TTcplTS5IJ,,,,,
460876232276459520,1058717720,repanniekuster,Twitter Web Client,2014-04-28 20:20:31,2,4,Delicious meal at Polly’s Pancakes in Sugar Hill – a wonderful Granite State tradition! http://t.co/0SizlG2bXL,,,,,
460867765340237825,1058717720,repanniekuster,Twitter Web Client,2014-04-28 19:46:52,2,1,Such an amazing moment when NH soldier returning from Afghanistan surprises his son at Fisher Cats game: http://t.co/hPbHXTgGwE,,,,,
460817550574878720,1058717720,repanniekuster,Twitter Web Client,2014-04-28 16:27:20,1,2,Honored to join NH vets in recognizing ex-POWs at the NH vets cemetery on Saturday. We thank you for your sacrifice.,,,,,
459799710870806528,1058717720,repanniekuster,Twitter Web Client,2014-04-25 21:02:48,3,0,Great to see students at Plymouth Elementary learning how to protect our planet! Environmental education is critical: http://t.co/Wzv9Hgjn6P,,,,,
459720972279762944,1058717720,repanniekuster,Twitter Web Client,2014-04-25 15:49:55,4,2,"Congrats to Mont Vernon-native Alex Preston for advancing to the Top 5 on American Idol. We’re behind you, Alex!",,,,,
459405400388149248,1058717720,repanniekuster,Twitter Web Client,2014-04-24 18:55:57,6,2,"Fair pay is not just a women’s issue, it’s a family issue – and we must work to eliminate the wage gap: http://t.co/ewZerHhJ7v",,,,,
459391621491339264,1058717720,repanniekuster,Twitter Web Client,2014-04-24 18:01:12,1,0,"Yesterday, I heard from Rindge women about how Congress can support the financial success of NH women &amp; families: http://t.co/1bpzvJ2TQ8",,,,,
459084492020666368,1058717720,repanniekuster,Twitter Web Client,2014-04-23 21:40:46,3,1,Don’t forget to tune in to watch New Hampshire’s own Alex Preston continue to his quest to be the next American Idol! http://t.co/qXNbSGeptH,,,,,
459071399815290881,1058717720,repanniekuster,Twitter Web Client,2014-04-23 20:48:45,4,2,Vets and military spouses can now access job opportunities and career tools through the Veterans Employment Center! http://t.co/qtyKN8sce6,,,,,
458726954586611712,1058717720,repanniekuster,Twitter Web Client,2014-04-22 22:00:03,1,0,Great discussion about retirement security at the Nashua Adult Learning Center today. We must stand by Granite State seniors! @NHCAlliance,,,,,
458686503447572480,1058717720,repanniekuster,Twitter Web Client,2014-04-22 19:19:19,2,2,"Proud to hear from Amherst women about issues we must prioritize, like #equalpay &amp; education, to help women succeed http://t.co/CcflMueP9N",,,,,
458669392960946177,1058717720,repanniekuster,Twitter Web Client,2014-04-22 18:11:19,1,1,Happy #EarthDay! Join me in supporting efforts to protect our environment. Learn more about what you can do to help: http://t.co/upeSumePm1,,,,,
458363368425136128,1058717720,repanniekuster,Twitter Web Client,2014-04-21 21:55:17,6,4,"Congrats to all of today's @BostonMarathon runners, including @RepSinema and @RepJoeKennedy. It's a proud day for Boston #BostonStrong",,,,,
458331659692417024,1058717720,repanniekuster,Twitter Web Client,2014-04-21 19:49:17,5,2,So happy the VA announced plans last week to open veterans health clinics in Colebrook and Berlin: http://t.co/D7mWMaL1hr,,,,,
457289657592463360,1058717720,repanniekuster,Twitter Web Client,2014-04-18 22:48:45,3,1,Had great tour of Lisbon's New England Wire today - we must support innovative NH companies to strengthen our economy http://t.co/o4qnRE0QDE,,,,,
457250323552546817,1058717720,repanniekuster,Twitter Web Client,2014-04-18 20:12:27,3,2,Did you know that National Park Week starts tomorrow? Free admission to all National Parks this weekend! http://t.co/MTKbKvwXDX,,,,,
456914279946813440,1058717720,repanniekuster,Twitter Web Client,2014-04-17 21:57:08,3,2,Great news that so many younger Americans who previously couldn't afford health care are enrolling: http://t.co/eFOo3Yyp0b,,,,,
456539524248526850,1058717720,repanniekuster,Twitter Web Client,2014-04-16 21:07:59,1,0,Proud of Shaker Road students I met w/today in Concord who are competing in @SIFMAFoundation Stock Market Challenge! http://t.co/ZBcW8CGbMa,,,,,
456183800561938434,1058717720,repanniekuster,Twitter Web Client,2014-04-15 21:34:28,4,2,"Today, I unveiled my new Women's Economic Agenda - Congress must prioritize efforts to help NH women succeed. http://t.co/YJA4rDWKYs",,,,,
456172624310059008,1058717720,repanniekuster,Twitter Web Client,2014-04-15 20:50:03,1,0,RT @NHLABOR_NEWS: Congresswoman Kuster Calls For Increased Infrastructure Funding http://t.co/hPUd4WsGqJ,,,456163962413780992,348666133,NHLABOR_NEWS
456144007400148992,1058717720,repanniekuster,Twitter Web Client,2014-04-15 18:56:20,7,0,RT @NARALNH: Proud to be by @RepAnnieKuster's side as she launches her economic agenda for women &amp; families! #nhpolitics http://t.co/BclASO…,,,456090260439851008,15365461,NARALNH
456138755905429504,1058717720,repanniekuster,Twitter Web Client,2014-04-15 18:35:28,3,1,"Safe, reliable transpo netwrk is crucial. I'll keep fighting 4 critical $$ 4 transpo projects like the I-93 expansion http://t.co/e0F5NhyscW",,,,,
456131561415770113,1058717720,repanniekuster,Twitter Web Client,2014-04-15 18:06:53,11,5,My thoughts &amp; prayers are with all those affected by the tragic Boston Marathon bombings. All Americans hold you in their hearts today.,,,,,
455824104579670016,1058717720,repanniekuster,Twitter Web Client,2014-04-14 21:45:09,2,0,Thank you @NewHampshireDOT for giving me a tour of the I-93 project – we must invest in our roads and bridges!,,,,,
455822314425569281,1058717720,repanniekuster,Twitter Web Client,2014-04-14 21:38:03,4,0,RT @NewHampshireDOT: @RepAnnieKuster tours the I-93 widening project with Commissioner Clement http://t.co/5b6Kfse22M,,,455766988217122816,1265178546,NewHampshireDOT
455717935886000128,1058717720,repanniekuster,Twitter Web Client,2014-04-14 14:43:17,5,1,Proud to welcome home courageous members of the 237th Military Police Company yesterday. Thank you for your service! http://t.co/ajXOtHigRE,,,,,
454706598535913472,1058717720,repanniekuster,Twitter Web Client,2014-04-11 19:44:36,3,4,Congrats to Stephen Colbert on his new late night gig! http://t.co/2Axte0Jet2,,,,,
454378329819602945,1058717720,repanniekuster,Twitter Web Client,2014-04-10 22:00:10,8,2,"Under Paul Ryan's budget, insurance companies could once again treat being a woman as a “pre-existing condition” and charge women more",,,,,
454370521355153408,1058717720,repanniekuster,Twitter Web Client,2014-04-10 21:29:08,3,0,Today there's ~ $1tril in student loan debt in the US. The Ryan Budget adds to this deficit by raising interest rates for students #Umatter,,,,,
454363106513551360,1058717720,repanniekuster,Twitter Web Client,2014-04-10 20:59:40,9,2,"Today, I rejected Paul Ryan's extreme budget that would hurt NH seniors and middle class families: http://t.co/nY4CRBMvxk",,,,,
453960092501962753,1058717720,repanniekuster,Twitter Web Client,2014-04-09 18:18:14,2,1,"So glad the Obama Admin. took my advice &amp; won't cut payments to Medicare Advantage, which could have hurt NH seniors: http://t.co/Gjf0lM3din",,,,,
453618527887712256,1058717720,repanniekuster,Twitter Web Client,2014-04-08 19:40:59,0,0,Proud to hear President Obama announce fair pay initiatives today that I urged him to support. We must eliminate the wage gap #equalpayday,,,,,
452203237048057856,1058717720,repanniekuster,Twitter Web Client,2014-04-04 21:57:07,3,1,"We must protect investments in education, infrastructure to help hardworking New Hampshire families succeed: http://t.co/PZJhns1Zrn",,,,,
452161502737616896,1058717720,repanniekuster,Twitter Web Client,2014-04-04 19:11:17,2,0,"Today, we honor the memory of the great Dr. Martin Luther King, Jr. &amp; pledge to fight until his dream of equality for all is realized.",,,,,
451063075224178688,1058717720,repanniekuster,Twitter Web Client,2014-04-01 18:26:32,1,0,RT @thefccouncil: 4pm EDT today - @USDA hosts Google+ Hangout with @lenderhand on finding ag credit for your farm or ranch business http://…,,,451011609830629377,169079242,thefccouncil
451024621651755008,1058717720,repanniekuster,Twitter Web Client,2014-04-01 15:53:44,2,2,Our New England delegation is ready for the @RedSox!! @PeterWelch @RepJoeKennedy http://t.co/4MYbsiFMpM,,,,,
451016169794076672,1058717720,repanniekuster,Twitter Web Client,2014-04-01 15:20:09,4,0,Excited to be at the White House today with the 2013 World Series champion @RedSox!! Here's to a repeat in 2014!,,,,,
448606658504036352,1058717720,repanniekuster,Twitter Web Client,2014-03-25 23:45:36,3,2,Thrilled to hear from American Legion members today on how we can best honor and serve our nation’s veterans! http://t.co/YZUMIqPDCt,,,,,
446032275571228672,1058717720,repanniekuster,Twitter Web Client,2014-03-18 21:15:56,4,1,Today I joined 175 Reps&amp;Sens urging @BarackObama to prohibit fed contractors from discriminating against LGBT workers http://t.co/08C0Ti2Wl4,,,,,
445595515875774464,1058717720,repanniekuster,Twitter Web Client,2014-03-17 16:20:24,2,1,Happy Saint Patrick's Day!!,,,,,
444161438584946688,1058717720,repanniekuster,Twitter Web Client,2014-03-13 17:21:53,10,4,#BirthControl is critical to women’s health &amp; equality. Bosses shouldn’t interfere with women’s access to it. #NotMyBossBusiness,,,,,
444154707339399168,1058717720,repanniekuster,Twitter Web Client,2014-03-13 16:55:08,24,8,According to @CDCgov birth control is one of top 10 greatest public health advancements of the 20th Century #NotMyBossBusiness,,,,,
444134462721630208,1058717720,repanniekuster,Twitter Web Client,2014-03-13 15:34:42,2,1,"When women succeed, America succeeds. We must work together to fight for #equalpay. #whatwomenneed http://t.co/DyTXrHxSr0",,,,,
443853787535798273,1058717720,repanniekuster,Twitter Web Client,2014-03-12 20:59:24,3,2,Glad Democrats and Republicans came together to support the Hire More Heroes Act to help encourage job creation for our veterans.,,,,,
443826158451560448,1058717720,repanniekuster,Twitter Web Client,2014-03-12 19:09:36,12,3,Let’s work together to restore benefits and #renewUI for the #2million Americans who are struggling to find work and support their families,,,,,
443806771728371712,1058717720,repanniekuster,Twitter Web Client,2014-03-12 17:52:34,2,1,What an incredible effort by native Nashuan Aliy Zirkle in this year's #Iditarod. Proud of the Granite State!! http://t.co/9l4RttqtQy,,,,,
443476652702838784,1058717720,repanniekuster,Twitter Web Client,2014-03-11 20:00:48,2,3,I commend @KellyAyotte and @SenatorShaheen for taking another step to end sexual assault in the military: http://t.co/XsxCcKoRGK,,,,,
443121605225762816,1058717720,repanniekuster,Twitter Web Client,2014-03-10 20:29:58,4,4,Great @nytimes article abt how the Farm Bill supports local and organic farmers. I'm proud to support these programs! http://t.co/CODZaxVzc5,,,,,
443105209598754817,1058717720,repanniekuster,Twitter Web Client,2014-03-10 19:24:49,4,1,So inspired by the passion &amp; spirit shown by my teammates &amp; supporters at @NEDisabledSport's winter challenge! http://t.co/laZKyqzsfa,,,,,
441634193966387200,1058717720,repanniekuster,Twitter Web Client,2014-03-06 17:59:31,5,3,I was proud to work with the President on a fix to allow Granite Staters to keep previously-canceled health plans: http://t.co/5BJI9Wjhvj,,,,,
441602721565921280,1058717720,repanniekuster,Twitter Web Client,2014-03-06 15:54:28,5,3,Congratulations to Arushi Kalpande of Nashua who will represent NH at the @ScrippsBee National Spelling Bee!! http://t.co/NxOJygCIAl,,,,,
441384765766520832,1058717720,repanniekuster,Twitter for iPhone,2014-03-06 01:28:23,2,0,"RT @WomensPolicyInc: .@RepAnnieKuster ""I'm proud to represent the new women in the 113th Congress. I reach across the aisle!"" #WPIGala",,,441380832008085505,326929954,WomensPolicyInc
441349265126719488,1058717720,repanniekuster,Twitter Web Client,2014-03-05 23:07:19,2,0,Disappointed Small Biz Committee GOP voted against increased opportunity for women-owned businesses. We must support our women entrepreneurs,,,,,
441338217514561537,1058717720,repanniekuster,Twitter Web Client,2014-03-05 22:23:25,2,0,Thank you to the Small Biz Committee for passing my amendment to help increase contracting opportunities for veteran-owned small businesses.,,,,,
441302998539436032,1058717720,repanniekuster,Twitter Web Client,2014-03-05 20:03:28,5,4,2 million people have now lost benefits since the emergency unemployment program expired. Let's vote to #RenewUI now! http://t.co/LiOvnZACYS,,,,,
441279147772755968,1058717720,repanniekuster,Twitter Web Client,2014-03-05 18:28:42,3,0,RT @camsiemcadams: New Hampshire has the first ever all female delegation. Exciting! @RepAnnieKuster #women in #leadership http://t.co/tmRV…,,,441264766288670720,122162103,camsiemcadams
440485195356319744,1058717720,repanniekuster,Twitter Web Client,2014-03-03 13:53:49,3,0,RT @JimCalandra: @RepAnnieKuster working on behalf of NH veterans &amp; access to high tech medical procedures http://t.co/P2IEujumHb @MITAtoda…,,,440464130097414144,2344064363,JimCalandra
440326809285304320,1058717720,repanniekuster,Twitter for iPhone,2014-03-03 03:24:27,3332703,0,RT @TheEllenShow: If only Bradley's arm was longer. Best photo ever. #oscars http://t.co/C9U5NOtGap,,,440322224407314432,15846407,TheEllenShow
439051843587805184,1058717720,repanniekuster,Twitter Web Client,2014-02-27 14:58:11,4,4,Glad that #Arizona's Governor did the right thing and vetoed #SB1062.  Hate and discrimination have no place in America. #equality,,,,,
438784268849127424,1058717720,repanniekuster,Twitter Web Client,2014-02-26 21:14:56,13,12,"Proud to support efforts today to #raisethewage, strengthen our economy, and bring NH families out of poverty @RepDanKildee",RepDanKildee,438783280259665921,,,
438764611765284865,1058717720,repanniekuster,Twitter Web Client,2014-02-26 19:56:49,2,2,A federal judge in Texas just struck down Texas’ ban on #marriageequality. One step on the long road to fairness.  http://t.co/hY68S44z6G,,,,,
438757304943804416,1058717720,repanniekuster,Twitter Web Client,2014-02-26 19:27:47,3,0,Great discussion in Nashua Monday on comprehensive #immigration reform and its effect on our economy. http://t.co/pZMS5eRUGe,,,,,
438732917645529088,1058717720,repanniekuster,Twitter Web Client,2014-02-26 17:50:53,2,1,"I'm proud to see @ksc_web, local companies working together to create, fill good jobs here in New Hampshire. http://t.co/r0K0kFnCG4",,,,,
438353192519487489,1058717720,repanniekuster,Twitter Web Client,2014-02-25 16:41:59,2,0,Best wishes to the 6 @NHNationalGuard members who left NH yesterday en route to Kuwait. Thank you for your service!! http://t.co/EZvh1qcPSz,,,,,
438323606893101056,1058717720,repanniekuster,Twitter Web Client,2014-02-25 14:44:26,1,0,Congrats to all past &amp; present Granite Staters who helped bring home 8 medals for #TeamUSA during #Sochi2014!! http://t.co/6s9jPly4jv,,,,,
438026084735811584,1058717720,repanniekuster,Twitter Web Client,2014-02-24 19:02:11,2,0,Such sad news about the loss of New Hampshire's John Durkin. My thoughts and prayers are with his family and friends. http://t.co/tZ1n4XdRsH,,,,,
437984890542641152,1058717720,repanniekuster,Twitter for Android,2014-02-24 16:18:29,11,5,Excited to be here at Parallel Wireless in Nashua to talk immigration reform. Fixing immigration is an economic issue http://t.co/36kYDXeand,,,,,
436984409854861312,1058717720,repanniekuster,Twitter for Android,2014-02-21 22:02:56,1,0,Thanks to my friends @WhiteMountainCC for showing me the Virtual Welding Lab. Innovation at work in NH North Country http://t.co/2PQmstTvZK,,,,,
436941071734824961,1058717720,repanniekuster,Twitter for iPhone,2014-02-21 19:10:44,2,1,Congratulations to former Granite Stater Mikaela Shiffrin on winning gold in the slalom!! #Sochi2014,,,,,
436920666332594177,1058717720,repanniekuster,Twitter for iPhone,2014-02-21 17:49:39,1,1,Let's go @USAhockey!! #Sochi2014,,,,,
436550618841243648,1058717720,repanniekuster,Twitter Web Client,2014-02-20 17:19:13,5,1,"More than 30 employers are here over 1,000 job openings. #JobsAndOpportunityForAll http://t.co/eKPMbWDFQE",,,,,
436547890492628992,1058717720,repanniekuster,Twitter Web Client,2014-02-20 17:08:22,3,1,So happy to see so many great New Hampshire employers connecting with job seekers at today's job fair in Concord! http://t.co/9GRyubdv1v,,,,,
436506396717510656,1058717720,repanniekuster,Twitter for Android,2014-02-20 14:23:29,4,1,Excited to be in studio for an interview on @NHPRExchange. #TuneIn http://t.co/FesQ5vnZfQ,,,,,
436171723004989440,1058717720,repanniekuster,Twitter for Android,2014-02-19 16:13:37,2,0,Thrilled to be @HannahGrimesCtr in Keene to talk workforce development. Amazing work being done in the Monadnock Rgn http://t.co/huFNm9CWOz,,,,,
436162704462454786,1058717720,repanniekuster,Twitter Web Client,2014-02-19 15:37:46,2,3,My thanks go out to all the hardworking men and women of the @NewHampshireDOT for their efforts in handling yesterday's storm.,,,,,
436154835805536256,1058717720,repanniekuster,Twitter Web Client,2014-02-19 15:06:30,5,2,Raising the minimum wage would lift nearly 1 million Americans out of poverty: http://t.co/Z0CnOr477F #RaiseTheWage,,,,,
435825745060167680,1058717720,repanniekuster,Twitter Web Client,2014-02-18 17:18:49,2,0,"RT @CWBASNHU: ""When women succeed, NH Succeeds"" @RepAnnieKuster http://t.co/OzOlSDUXI7",,,435806226321260544,980512944,CWBASNHU
435809757233160192,1058717720,repanniekuster,Twitter for Android,2014-02-18 16:15:17,4,4,"Thrilled to be here at @SNHU in Salem talking with women business leaders. #WhenWomenSucceed,AmericaSucceeds. http://t.co/4mHr4d74kd",,,,,
435774997332639744,1058717720,repanniekuster,Twitter Web Client,2014-02-18 13:57:10,3,1,We're just a few days from my second Career and Opportunities Fair - Have you signed up yet?? http://t.co/0gfij4DSUM,,,,,
435239597795463168,1058717720,repanniekuster,Twitter for iPhone,2014-02-17 02:29:41,6,5,Congratulations to NH's own @MillerBode on winning bronze in the super-G!! #Sochi2014,,,,,
434709251857346560,1058717720,repanniekuster,Twitter for iPhone,2014-02-15 15:22:16,2,2,What a win by Team USA!! #Sochi #Oshie,,,,,
434381855891005440,1058717720,repanniekuster,Twitter Web Client,2014-02-14 17:41:19,2,2,Glad that @EPA has responded to my request &amp; will make sure that all #Atkinson residents have access to clean water! http://t.co/g0JP2o3VFv,,,,,
