id,user_id,screen_name,source,created_at,retweet_count,favorite_count,text,in_reply_to_screen_name,in_reply_to_status_id,retweeted_status_id,retweeted_status_user_id,retweeted_status_screen_name
626808827212488704,1058717720,repanniekuster,Twitter Web Client,2015-07-30 17:37:24,4,1,"Loving this list, “100 Things to Do to Know the Real New Hampshire!” How many have you checked off? http://t.co/YceRS5do2M",,,,,
626769343020441600,1058717720,repanniekuster,Twitter Web Client,2015-07-30 15:00:30,0,1,Happy 50th birthday to #Medicare and #Medicaid! #MedicareMedicaid50 http://t.co/7QNyLJB2bR,,,,,
626149393171902464,1058717720,repanniekuster,Twitter Web Client,2015-07-28 21:57:03,2,1,Great to discuss revitalizing NH’s manufacturing industry w/@NECouncil President at #MakeItInAmerica hearing today! http://t.co/QrwYVC8YvU,,,,,
626056886756999169,1058717720,repanniekuster,Twitter Web Client,2015-07-28 15:49:28,1,1,Exciting news about a first-of-its-kind partnership between @MLS and @SNHU! #winwin http://t.co/OaEcG4NBan,,,,,
625774596810272768,1058717720,repanniekuster,Twitter Web Client,2015-07-27 21:07:44,3,4,Honored to help welcome members of @WWAmpSoftball at their game on Saturday. Such an inspiring group! http://t.co/0BwnLJCmmX,,,,,
624682317404078081,1058717720,repanniekuster,Twitter Web Client,2015-07-24 20:47:25,0,1,Had an awesome visit to @GirlsIncNH this AM! Such a great organization filled with inspiring young women http://t.co/qUn4tKoN96,,,,,
624647273004331008,1058717720,repanniekuster,Twitter Web Client,2015-07-24 18:28:09,2,2,Proud to help introduce the #EqualityAct to ban discrimination against LGBT individuals. #EqualityForward http://t.co/oYC4ckEG2u,,,,,
624302014214897664,1058717720,repanniekuster,Twitter Web Client,2015-07-23 19:36:13,2,0,RT @TLincolnC: So great 2 see @RepAnnieKuster at the  #EqualityAct introduction. It's time for LGBT Americans 2 b protected from discrimina…,,,624251110316871681,234891867,TLincolnC
624297867004485632,1058717720,repanniekuster,Twitter Web Client,2015-07-23 19:19:45,0,1,Thrilled 2 join Women's Caucus &amp; @sherylsandberg 2 discuss ways 2 support women leaders in public &amp; private sectors! http://t.co/iH2MHPK1D1,,,,,
624266779636957184,1058717720,repanniekuster,Twitter Web Client,2015-07-23 17:16:13,1,1,Spoke against the Dark Act and in support of the millions of Americans who have a #RightToKnow what's in their food: http://t.co/YrHEWJ4b97,,,,,
624236322044149760,1058717720,repanniekuster,Twitter Web Client,2015-07-23 15:15:11,1,0,RT @kayleerogersNH: Would like to extend a sincere thank you to @RepAnnieKuster 's D.C. staff for speaking with RESULTS constituents on pov…,,,624094026954731520,3384096957,kayleerogersNH
624226193424936960,1058717720,repanniekuster,Twitter Web Client,2015-07-23 14:34:56,0,2,Good to see the #NH economy &amp; job creation improving. Let's keep working to sustain this growth for years to come. http://t.co/JgaeaqSBnx,,,,,
623980902302007296,1058717720,repanniekuster,Twitter Web Client,2015-07-22 22:20:14,1,0,I questioned USDA Sec Tom Vilsack on improving programs to help young farmers get off the ground. Watch here: http://t.co/4JcoqhbMK1,,,,,
623976856979685376,1058717720,repanniekuster,Twitter Web Client,2015-07-22 22:04:10,0,0,Questioned Sec McDonald on the VA’s plan to address impending budget shortfall; care for our vets must come first! http://t.co/uYiieBUvNg,,,,,
623554183170531329,1058717720,repanniekuster,Instagram,2015-07-21 18:04:37,4,4,"Great visit to the revitalization project in Franklin #NH, where the community is working to build a… https://t.co/hLJZqYKgp5",,,,,
623203713663008768,1058717720,repanniekuster,Twitter Web Client,2015-07-20 18:51:58,3,2,Visited @Intrinsyk in Salem to hear about their growing business &amp; collaboration with @NHSBDC and @ExportNH! http://t.co/OVEk8eilYD,,,,,
622153764800208896,1058717720,repanniekuster,Twitter Web Client,2015-07-17 21:19:51,1,2,Great to discuss my work to improve early childhood education this morning at Salem Family Resources! http://t.co/2InqsVpzd7,,,,,
622146780541677568,1058717720,repanniekuster,Twitter Web Client,2015-07-17 20:52:06,2,3,Congrats to #NH 2nd District resident and documentary filmmaker @KenBurns on being nominated for 2 Emmys! http://t.co/3Y3UcINlRb,,,,,
621782228209664000,1058717720,repanniekuster,Twitter Web Client,2015-07-16 20:43:30,3,0,"RT @brucebc: Thanks @RepAnnieKuster for supporting #LWCF! Great for NH's parks, trails, beaches, forests, economy, history! #Outdoors4All #…",,,621721961723469824,48454879,brucebc
621781437746909184,1058717720,repanniekuster,Twitter Web Client,2015-07-16 20:40:21,42,26,Families succeed when #WomenSucceed! It's time to #RaiseTheWage and achieve #EqualPay for equal work! http://t.co/s9klHtQIO7,,,,,
621775562579812353,1058717720,repanniekuster,Twitter Web Client,2015-07-16 20:17:00,14,0,"RT @RepDebDingell: Not @taylorswift13 &amp; @HillaryClinton, but @RepKClark &amp; @RepAnnieKuster are 2 of the best colleagues I could ask for http…",,,621761661079265281,2970279814,RepDebDingell
621737242734764032,1058717720,repanniekuster,Twitter Web Client,2015-07-16 17:44:44,1,3,#LWCF has preserved our natural &amp; cultural heritage for 50 yrs. We must reauthorize this essential tool for conserving iconic #publiclands,,,,,
621689229412835328,1058717720,repanniekuster,Twitter Web Client,2015-07-16 14:33:57,1,3,Honored to accept @NPCA’s Friend of the National Parks Award yesterday for being a #ParkChamp! http://t.co/53XrzfmRwp,,,,,
621678822451204097,1058717720,repanniekuster,Twitter Web Client,2015-07-16 13:52:36,1,1,"With 13.4% of NH bridges structurally deficient, it’s critical that Congress pass a long-term transportation bill! http://t.co/yghn23CjYM",,,,,
621407902155321344,1058717720,repanniekuster,Twitter Web Client,2015-07-15 19:56:03,0,1,"Today, I discussed how we can attract students towards careers in #organic farming during an Agriculture Committee hearing.",,,,,
621398474072944640,1058717720,repanniekuster,Twitter Web Client,2015-07-15 19:18:35,2,0,Joined @WhipHoyer to discuss the future of American manufacturing &amp; the strength of advanced manufacturing in NH! http://t.co/lHM2VxdDmK,,,,,
621341515101667328,1058717720,repanniekuster,Twitter Web Client,2015-07-15 15:32:15,4,0,RT @NHStateParks: Recently voted Best Swimming Spot in NH by @WMUR9 viewer poll! #WellingtonStatePark http://t.co/txT4AI12FJ,,,621332367404322816,48064895,NHStateParks
620731337914253312,1058717720,repanniekuster,Twitter Web Client,2015-07-13 23:07:38,1,2,Thrilled to see so many young farmers in the Granite State! http://t.co/KCfb0ahV8t,,,,,
619578037315739648,1058717720,repanniekuster,Twitter Web Client,2015-07-10 18:44:49,0,0,Proud to help pass the bipartisan 21st Century Cures Act to support research of cures for many diseases: http://t.co/fUtDamMaUs,,,,,
619240547400585216,1058717720,repanniekuster,Twitter Web Client,2015-07-09 20:23:46,1,0,Congress needs to act before the end of July to restore our nation's infrastructure! Read my op-ed in @NHBR here: http://t.co/z5WuFbMfch,,,,,
619230467619975168,1058717720,repanniekuster,Twitter Web Client,2015-07-09 19:43:42,0,1,Thrilled to honor retiring Concord Superintendent Chris Rath on the floor for her service to Granite State students: https://t.co/tFIJqM3q7o,,,,,
619208031163805697,1058717720,repanniekuster,Twitter Web Client,2015-07-09 18:14:33,3,0,Today at 3pm I’ll testify at #MIIAWhatsNext to discuss American #manufacturing. Tune in: https://t.co/CJigNza55e http://t.co/clA9Z9Ib8B,,,,,
619201373117284352,1058717720,repanniekuster,Twitter Web Client,2015-07-09 17:48:06,3,0,RT @PPNHAF: We were very excited to meet with #NH #WomensHealth Champion @RepAnnieKuster! #ppgeneration @PPGenAction http://t.co/8gG5kVnqUX,,,619195967838011392,2578897310,PPNHAF
619148160385064960,1058717720,repanniekuster,Twitter Web Client,2015-07-09 14:16:39,3,1,Congratulations to Anurudh Ganesan of Nashua for being named a regional finalist in the Google Science Fair! http://t.co/RHLhtpWp4o,,,,,
618830586287902720,1058717720,repanniekuster,Twitter Web Client,2015-07-08 17:14:43,0,2,I had such a great time with the amazing campers at Camp Spaulding in Penacook! http://t.co/LKa9LwaWgR,,,,,
618805220789907457,1058717720,repanniekuster,Twitter Web Client,2015-07-08 15:33:56,0,0,Visited Route 4 bridge project in West Leb to urge Congress to support Highway Trust Fund before it runs out in July: http://t.co/gDvGsnAOPr,,,,,
618178180277501952,1058717720,repanniekuster,Instagram,2015-07-06 22:02:18,0,1,"Great visit to the beautiful Taylor Brothers Farm, where we discussed the importance of agriculture… https://t.co/tFdytvr3nw",,,,,
618171483391717376,1058717720,repanniekuster,Twitter Web Client,2015-07-06 21:35:41,2,3,"Joined @NewHampshireDOT, @LebNH officials to call for transpo funding during a tour of the Route 4 bridge project! http://t.co/yNudXedzjM",,,,,
618143367361351681,1058717720,repanniekuster,Twitter Web Client,2015-07-06 19:43:57,0,1,Congratulations to #TeamUSA on winning the #WomensWorldCup title last night over Japan! http://t.co/G57F08RNHb,,,,,
617392672446136320,1058717720,repanniekuster,Twitter Web Client,2015-07-04 18:00:58,0,3,"Happy Fourth of July! Hope everyone is having fun celebrating our nation's founding with your friends, family, and loved ones!",,,,,
616337599955927040,1058717720,repanniekuster,Twitter Web Client,2015-07-01 20:08:29,1,0,Glad to discuss manufacturing with the @NECouncil yesterday at @GEAviation in Hooksett: http://t.co/IsexibcSTQ,,,,,
616321563961462785,1058717720,repanniekuster,Twitter Web Client,2015-07-01 19:04:46,0,1,Great to see that Harbor Homes is working to end veteran homelessness in Nashua by the end of 2015: http://t.co/8ZdobTQbaM,,,,,
616278324260769794,1058717720,repanniekuster,Twitter Web Client,2015-07-01 16:12:57,4,0,RT @NECouncil: Great coverage of yesterday's #AdvMfgNE event in NH at @generalelectric with @RepAnnieKuster in the @UnionLeader http://t.co…,,,616271585050251264,156030129,NECouncil
616272729474514944,1058717720,repanniekuster,Twitter Web Client,2015-07-01 15:50:43,1,0,RT @susan_doucet: “We need to make sure that women’s voices are heard.” USDA official + @RepAnnieKuster met with NH women in farming: http:…,,,616240637193682944,178747615,susan_doucet
616239801457639424,1058717720,repanniekuster,Twitter Web Client,2015-07-01 13:39:52,1,3,Congrats to @ussoccer_wnt on beating Germany 2-0 to advance to the #WomensWorldCup finals! @FIFAWWC http://t.co/w16A3W2a7t,,,,,
616009162015830017,1058717720,repanniekuster,Twitter Web Client,2015-06-30 22:23:23,1,3,Great discussion on #womeninag w/ local farms &amp; @USDA Deputy Secretary Krysta Harden at Dimond Hill Farm in Concord! http://t.co/mGfxNj2vzZ,,,,,
615994673170132996,1058717720,repanniekuster,Twitter Web Client,2015-06-30 21:25:49,0,0,Glad commuter rail expansion will continue to be studied; rail could bring jobs &amp; economic growth across southern NH! http://t.co/NTKVnwoX9m,,,,,
615635671059963904,1058717720,repanniekuster,Twitter Web Client,2015-06-29 21:39:16,1,3,"Terrific visit 2 Camp Spaulding today in Penacook. Thanks 2 @ConcordYMCA, @NashMerrYMCA &amp; NH Child &amp; Family Services! http://t.co/kybjZa9yQ5",,,,,
615629862452264960,1058717720,repanniekuster,Twitter Web Client,2015-06-29 21:16:11,2,1,Remember that NH's hands-free cell phone law goes into effect on Wednesday - make sure to be prepared! http://t.co/IYavhgZbxE,,,,,
615624576047947776,1058717720,repanniekuster,Twitter Web Client,2015-06-29 20:55:11,2,1,"Today, the Supreme Court took a stand for women's health and reproductive rights! #SCOTUS http://t.co/u1q2VU5tMq",,,,,
615613309832794112,1058717720,repanniekuster,Twitter Web Client,2015-06-29 20:10:25,3,0,Thrilled to see an expanded VA clinic in Littleton open its doors today to improve access for North Country veterans! http://t.co/uvbuEhND7Q,,,,,
615536032839299076,1058717720,repanniekuster,Twitter for iPhone,2015-06-29 15:03:20,0,1,Check out my op-ed in the Nashua Telegraph calling for a long-term surface transportation funding bill: http://t.co/TsaZ28nQd5,,,,,
614437682303922176,1058717720,repanniekuster,Twitter Web Client,2015-06-26 14:18:53,33,48,THRILLED #SCOTUS has ruled in favor of equality for all; Finally every American can marry the person they love!,,,,,
614114889582428161,1058717720,repanniekuster,Twitter Web Client,2015-06-25 16:56:14,0,0,Proud to urge #SCOTUS to increase transparency by allowing live audio of #marriageequality decision &amp; others: http://t.co/CIBcZnasZs,,,,,
614086202938028032,1058717720,repanniekuster,Twitter Web Client,2015-06-25 15:02:14,3,5,Glad the #SCOTUS decision today will prevent millions of Americans from losing their health insurance! #KingvBurwell,,,,,
613804541495128064,1058717720,repanniekuster,Instagram,2015-06-24 20:23:01,0,0,Excited to welcome #NH Congressional Art Competition winner &amp; Concord High grad Hope Morrison to… https://t.co/BcuNAxvPtU,,,,,
613792237101690881,1058717720,repanniekuster,Twitter Web Client,2015-06-24 19:34:07,4,4,The #ExIm Bank helps dozens of #NH businesses compete in the global marketplace – it’s time to reauthorize! #HoldAVote #ExIm4Jobs,,,,,
613777311914180608,1058717720,repanniekuster,Twitter Web Client,2015-06-24 18:34:49,0,1,The #VA may have wasted thousands buying resources without a contract. I pushed VA officials to explain: https://t.co/sDJJxcDP4N,,,,,
613769612518387712,1058717720,repanniekuster,Twitter Web Client,2015-06-24 18:04:13,1,0,Proud to discuss ways to improve intl food aid policy to better save taxpayer $$ and help those in need during Ag Committee hearing today!,,,,,
613747897264439296,1058717720,repanniekuster,Twitter Web Client,2015-06-24 16:37:56,1,1,Congrats to Katherine Fish of Bethlehem's Profile School for being selected to participate in the @librarycongress Summer Teacher Institute!,,,,,
613422993956540416,1058717720,repanniekuster,Instagram,2015-06-23 19:06:53,2,1,Wonderful screening of “The Ghost Army” and Q&amp;A in Keene last night – proud to help honor these brave… https://t.co/dJxbx9MSz8,,,,,
613391090234847232,1058717720,repanniekuster,Twitter Web Client,2015-06-23 17:00:06,1,2,Congress must reauthorize the #ExIm Bank to help #NH businesses like @TheMountainTees in Keene grow and create jobs! http://t.co/SWpjZ10v58,,,,,
613351323958943745,1058717720,repanniekuster,Twitter Web Client,2015-06-23 14:22:05,2,0,Congrats to #TeamUSA on beating Colombia last night to advance to the #WomensWorldCup quarterfinals against China! http://t.co/lJ7uZfcVuB,,,,,
613037740935016448,1058717720,repanniekuster,Instagram,2015-06-22 17:36:01,2,2,Amazing to see so many Granite State businesses represented at Experience #NH in Washington last week! https://t.co/gUfAPHg9P0,,,,,
612986953538121729,1058717720,repanniekuster,Instagram,2015-06-22 14:14:13,0,1,Fond thoughts of my Dad on Father's Day! https://t.co/iyhyYIqnos,,,,,
611596480680448000,1058717720,repanniekuster,Twitter Web Client,2015-06-18 18:08:58,0,0,Good luck to Derry native and Windham CC golf instructor Rich Berberian in this week’s US Open! http://t.co/PgyVfnhliR,,,,,
611565105441046528,1058717720,repanniekuster,Twitter Web Client,2015-06-18 16:04:18,0,1,"As a cosponsor of legislation to feature a woman’s face on one of our bills, excited one will be released in 2020! http://t.co/N5vc3TphZ6",,,,,
611294983711232001,1058717720,repanniekuster,Instagram,2015-06-17 22:10:56,2,1,The Ex-Im Bank helps strengthen the economy and create jobs. It’s time to reauthorize! #ExIm4Jobs https://t.co/7ygANx3bGX,,,,,
611265468712775680,1058717720,repanniekuster,Twitter Web Client,2015-06-17 20:13:39,0,2,Great to meet the National History Day winners from #NH today in Washington! http://t.co/CDTfuG6Hff,,,,,
611235455472943104,1058717720,repanniekuster,Twitter Web Client,2015-06-17 18:14:23,7,6,Proud to join @RepWesterman in urging EPA to clarify regs for biomass producers that create renewable energy &amp; jobs! http://t.co/R5zkA7QTVi,,,,,
611220846812753920,1058717720,repanniekuster,Twitter Web Client,2015-06-17 17:16:20,1,0,Another business leader from the Granite State highlighting the importance of the #ExIm Bank to the #NH economy: http://t.co/arofgMk0ND,,,,,
611204450347294721,1058717720,repanniekuster,Twitter Web Client,2015-06-17 16:11:11,0,0,Thrilling to watch #TeamUSA beat Nigeria last night. Go @AbbyWambach! #playlikeagirl http://t.co/FTHWZu7wOw,,,,,
610956218367127552,1058717720,repanniekuster,Twitter Web Client,2015-06-16 23:44:48,1,1,Proud to #SupportVolunteers by supporting legislation that would offer a tax break to our volunteer first responders. http://t.co/s7wghFfCWw,,,,,
609443453366353920,1058717720,repanniekuster,Twitter Web Client,2015-06-12 19:33:36,1,0,Good luck to @ussoccer_wnt against Sweden tonight! #WomensWorldCup #OneNationOneTeam http://t.co/mto8apTYqv,,,,,
609427159648718850,1058717720,repanniekuster,Twitter Web Client,2015-06-12 18:28:52,0,1,Great to see Granite State native Hawk Jensen’s “Witness Project” films shown at the Library of Congress this week!,,,,,
609081522545668097,1058717720,repanniekuster,Twitter Web Client,2015-06-11 19:35:25,1,0,"At a hearing on over-prescription of opioid meds to #veterans, I urged the VA to better address chronic pain issues. http://t.co/JIYJhAfGUG",,,,,
608744985501048833,1058717720,repanniekuster,Twitter Web Client,2015-06-10 21:18:09,1,1,Such an inspiring story out of Littleton. Generous acts like this remind us all of the power of kindness: http://t.co/eCiq6zH2Ud,,,,,
608733473969459200,1058717720,repanniekuster,Twitter Web Client,2015-06-10 20:32:24,2,5,"Proud to work with @RepMaloney &amp; Rep. @PeteSessions, &amp; a bipartisan coalition to introduce legislation to help fund breast cancer research!",,,,,
608716569498259456,1058717720,repanniekuster,Twitter Web Client,2015-06-10 19:25:14,5,3,"JFK signed #EqualPay 52 years ago, but the gender wage gap is still wide. When women succeed, families succeed! http://t.co/rkhPuZqIcn",,,,,
608701903405461504,1058717720,repanniekuster,Twitter Web Client,2015-06-10 18:26:57,1,1,Glad the House passed legislation I cosponsored to protect Granite Staters from unfair internet taxes! http://t.co/9GBhnZ17In,,,,,
608306813038174208,1058717720,repanniekuster,Twitter Web Client,2015-06-09 16:17:00,2,3,Go #USA! Congrats to @ussoccer_wnt for beating Australia in the 1st round of the #WomensWorldCup last night. http://t.co/qOqICDxPdA,,,,,
608010952630534145,1058717720,repanniekuster,Twitter Web Client,2015-06-08 20:41:22,2,3,Happy #WorldOceansDay! Let’s come together to protect our planet. http://t.co/AwuJ4wldwe,,,,,
606909020390236160,1058717720,repanniekuster,Twitter Web Client,2015-06-05 19:42:40,1,1,Proud to help introduce the Pregnant Workers Fairness Act to ensure the rights of pregnant workers are protected! http://t.co/RU4eWeIoMF,,,,,
606208972329242624,1058717720,repanniekuster,Twitter Web Client,2015-06-03 21:20:56,2,4,I questioned VA officials on improving the inefficient procurement process for non-VA care. Our #veterans deserve the highest quality care!,,,,,
606162573260673024,1058717720,repanniekuster,Twitter Web Client,2015-06-03 18:16:34,4,4,Congrats to @LebNH on being named the #1 small town in the nation! #NHrules http://t.co/sPuNum5SVS,,,,,
605862207423799297,1058717720,repanniekuster,Instagram,2015-06-02 22:23:01,2,2,Fun celebrating my colleague Tammy Duckworth's baby Abigail! https://t.co/NHxypou2tC,,,,,
605837103436472320,1058717720,repanniekuster,Twitter Web Client,2015-06-02 20:43:16,0,4,Congrats to the Hollis-Brookline Destination Imagination team on its impressive win at the global competition! http://t.co/MMBvLE3iUo,,,,,
605817564296441857,1058717720,repanniekuster,Twitter Web Client,2015-06-02 19:25:37,1,1,This amazing gesture by the senior class at Profile HS in Bethlehem inspires us to show compassion in our own lives: http://t.co/44hG4H6JWT,,,,,
605792975973515264,1058717720,repanniekuster,Twitter Web Client,2015-06-02 17:47:55,0,1,Working w/ VA to extend the network of NH health care providers in the new veterans choice card program: http://t.co/fHhvbSLbTd,,,,,
605752273902403584,1058717720,repanniekuster,Twitter Web Client,2015-06-02 15:06:11,0,1,Watch my opening remarks during last night’s House Veterans’ Affairs Subcommittee Hearing: https://t.co/fxS0oABNc9,,,,,
604383029033877504,1058717720,repanniekuster,Twitter Web Client,2015-05-29 20:25:17,1,1,Had a terrific visit to the @concordspca today in Concord.  We must protect our animals! http://t.co/qOr9hIBset,,,,,
604029616488075264,1058717720,repanniekuster,Twitter Web Client,2015-05-28 21:00:57,4,3,"Met w/ leaders of NH Ball Bearings, @BoyleEnergy, &amp; other NH companies to discuss @EximBankUS reauthorization! http://t.co/cki499BQSR",,,,,
604000399889158144,1058717720,repanniekuster,Instagram,2015-05-28 19:04:51,0,0,Great to attend Hillsborough County Drug Court Service Day bbq in #Nashua. Excellent program to treat… https://t.co/zPGH0aQr8f,,,,,
603981845240352768,1058717720,repanniekuster,Twitter Web Client,2015-05-28 17:51:08,1,1,Thrilled to present Patty Clark with the bill that renamed the #Nashua air traffic control center in her honor! http://t.co/dkZnCAuLHn,,,,,
603964939255095296,1058717720,repanniekuster,Twitter Web Client,2015-05-28 16:43:57,0,1,Congratulations to Nashua student Arushi Kalpande for advancing to the national spelling bee semifinals! http://t.co/FIfGBqah8J,,,,,
603677072423260160,1058717720,repanniekuster,Twitter Web Client,2015-05-27 21:40:04,0,2,Thrilled to join Mayor Lozeau to tour the Broad Street Parkway in #Nashua. We must act to improve our infrastructure! http://t.co/umGKeJQo0r,,,,,
603675782943223808,1058717720,repanniekuster,Twitter Web Client,2015-05-27 21:34:57,0,1,Congrats to Celdara Medical in Lebanon for winning a 2015 Tibbetts Award for success in the SBIR/STTR programs! http://t.co/WZ4EbQyWkU,,,,,
603609158424862720,1058717720,repanniekuster,Twitter Web Client,2015-05-27 17:10:12,0,1,Excited to be on Instagram to connect with you and share photos from my work in NH &amp; DC! Follow me to stay in touch: http://t.co/3dFUTl1yOM,,,,,
603584602712776704,1058717720,repanniekuster,Instagram,2015-05-27 15:32:38,0,2,Honored to offer thanks to our veterans and military families on #MemorialDay at the NH Vets Home. https://t.co/prYVCNgyDs,,,,,
603284939451301888,1058717720,repanniekuster,Twitter Web Client,2015-05-26 19:41:52,1,3,Incredible to see Ireland make history by standing up for the rights of all people to love who they choose: http://t.co/6G32isyVV0,,,,,
603274076136812544,1058717720,repanniekuster,Twitter Web Client,2015-05-26 18:58:42,0,4,Honored to receive a 92% from the Council for a Livable World; I will keep fighting for global peace &amp; security! http://t.co/qaSPXpdZQz,,,,,
603200062802554880,1058717720,repanniekuster,Twitter Web Client,2015-05-26 14:04:36,0,0,Humbled to honor fallen officers at the NH Law Enforcement Officers Memorial Ceremony on Friday. http://t.co/LceziHVfQd,,,,,
602857527898992640,1058717720,repanniekuster,Twitter Web Client,2015-05-25 15:23:29,3,2,"Today, we honor our nation's veterans and vow to repay our debt to them for their courageous service!",,,,,
601816924566216705,1058717720,repanniekuster,Twitter Web Client,2015-05-22 18:28:30,0,0,Farmers looking to turn commodities into new products should check out USDA’s Value-Added Producer Grants! https://t.co/BR3V9qYEu8,,,,,
601807642625998848,1058717720,repanniekuster,Twitter Web Client,2015-05-22 17:51:37,0,0,Spoke to recognize retiring Newfound Regional HS Principal Michael O’Malley; thanks for your service &amp; congrats! https://t.co/gWdhlVQrwT,,,,,
601792815593586689,1058717720,repanniekuster,Twitter Web Client,2015-05-22 16:52:42,0,3,Proud to speak at the 15th Annual CADY Prevention Summit at PSU - together we can reduce substance abuse in NH! http://t.co/zL6CcZtWt3,,,,,
601778022199484417,1058717720,repanniekuster,Twitter Web Client,2015-05-22 15:53:55,1,4,Proud to help pass the Ruth Moore Act in the VA committee to help survivors of military sexual trauma receive the services they need!,,,,,
601502168584192000,1058717720,repanniekuster,Twitter Web Client,2015-05-21 21:37:47,0,2,Honored to join wreath-laying ceremony at Arlington National Cemetery for #MemorialDay. @TulsiGabbard @RepGraceMeng http://t.co/FxdvfUE3Si,,,,,
601470759064760321,1058717720,repanniekuster,Twitter Web Client,2015-05-21 19:32:58,0,2,Spoke on the floor to recognize @NHTI for being named #1 in the country for providing “value-added” to students: https://t.co/Fb9dFmmMmh,,,,,
601421433516994560,1058717720,repanniekuster,Twitter Web Client,2015-05-21 16:16:58,2,6,"On Foster Youth Shadow Day, I spent a few hours hanging out with Mark Laing from Nashua! #FosterYouthVoices http://t.co/NctyF9Ujwf",,,,,
601147887226122240,1058717720,repanniekuster,Twitter Web Client,2015-05-20 22:09:59,4,3,We need to #ActOnClimate now to protect our environment and maintain our national security: http://t.co/qffOpUynHc,,,,,
601113620227973120,1058717720,repanniekuster,Twitter Web Client,2015-05-20 19:53:49,0,1,Pleased to see the Balsams redevelopment will move forward; excited to see this NH icon restored! http://t.co/edLcPx3xcK,,,,,
600758551330492418,1058717720,repanniekuster,Twitter Web Client,2015-05-19 20:22:54,0,1,Congrats 2 Medal of Honor recipient Ryan Pitts for speaking at UNH commencement; his humility &amp; courage are inspiring http://t.co/wi1IAx7Xp0,,,,,
600707130195374081,1058717720,repanniekuster,Twitter Web Client,2015-05-19 16:58:35,0,2,New Boston-native Dean Potter passed away over the weekend at Yosemite; my thoughts &amp; prayers are with his loved ones http://t.co/zC7Yup5ItL,,,,,
