id,user_id,screen_name,source,created_at,retweet_count,favorite_count,text,in_reply_to_screen_name,in_reply_to_status_id,retweeted_status_id,retweeted_status_user_id,retweeted_status_screen_name
350611174112493569,1058717720,repanniekuster,Twitter Web Client,2013-06-28 13:46:32,6,1,Beautiful story from the #ValleyNews yesterday about the local impact of striking down #DOMA. #NOH8 #Equality  http://t.co/hkikz0Ej5X,,,,,
350363084554108928,1058717720,repanniekuster,Twitter Web Client,2013-06-27 21:20:43,0,0,"Proud to help pass common sense, bipartisan legislation to strengthen protections for #MST whistleblowers. https://t.co/ohZfzyySL8",,,,,
350353098121822209,1058717720,repanniekuster,Twitter Web Client,2013-06-27 20:41:02,4,0,"#Senate just passed historic, bipartisan #ImmigrationReform. #TimeIsNow for the #House to do its part http://t.co/jzgjN5mIig #CIR",,,,,
350261855903690753,1058717720,repanniekuster,Twitter Web Client,2013-06-27 14:38:28,0,0,#SCOTUS decisions marked historic step #forward for #equality. Now time to finish the job + do away w/#DOMA in full http://t.co/2GcHDnpLPe,,,,,
350253382717542400,1058717720,repanniekuster,Twitter Web Client,2013-06-27 14:04:48,1,1,"Wishing a very happy birthday to another member of our historic all-female delegation, Sen. @KellyAyotte!",,,,,
349921504626089985,1058717720,repanniekuster,Twitter Web Client,2013-06-26 16:06:02,2,0,Today #SCOTUS reaffirmed bedrock principle that all Americans deserve equal treatment under the law http://t.co/0bcqhCgS6g #DOMA #Prop8,,,,,
349891549993246721,1058717720,repanniekuster,Twitter Web Client,2013-06-26 14:07:00,11,5,A great and historic day for our country: #SupremeCourt just struck down discriminatory #DOMA.  Hoping for same news on #Prop8. #equality,,,,,
349883586796720128,1058717720,repanniekuster,Twitter Web Client,2013-06-26 13:35:22,1,0,Proud that my bill to rename #Nashua's Boston Air Route Traffic Control Center after Patty Clark passed last night: http://t.co/UOopTljCm6,,,,,
349877233374085121,1058717720,repanniekuster,Twitter Web Client,2013-06-26 13:10:07,4,0,Via @ConMonitorNews: my op ed calling on #Congress 2 take action 2 prevent a student loan rate hike http://t.co/3dBa2Ng97M #DontDoubleMyRate,,,,,
349874935470096388,1058717720,repanniekuster,Twitter Web Client,2013-06-26 13:00:59,1,0,RT @NHLABOR_NEWS: @RepAnnieKuster &amp; @RepSheaPorter Celebrate Passage of Bill Renaming Air Traffic Control Center http://t.co/EgNvuloBJS @NA…,,,349711732387758081,348666133,NHLABOR_NEWS
349665747972259840,1058717720,repanniekuster,Twitter Web Client,2013-06-25 23:09:45,1,0,My bill to honor #Nashua public servant Patty Clark just passed the #House! Check out my speech on the House floor: http://t.co/vuWVrRVORu,,,,,
349640805679509504,1058717720,repanniekuster,Twitter Web Client,2013-06-25 21:30:38,3,1,We have a fundamental responsibility to confront the challenge of #climatechange head on http://t.co/eoVQCMPIgW,,,,,
349606697494519810,1058717720,repanniekuster,Twitter Web Client,2013-06-25 19:15:06,1,0,Going to the floor at 5pm to speak in support of my bill to honor #Nashua public servant Patty Clark! Watch at http://t.co/4r2mADsygW,,,,,
349570025935486977,1058717720,repanniekuster,Twitter Web Client,2013-06-25 16:49:23,1,1,My thoughts &amp; prayers are with the NH Boy Scouts struck by lightning in Gilmanton last night. Wishing them all a speedy recovery!,,,,,
349568069208784898,1058717720,repanniekuster,Twitter Web Client,2013-06-25 16:41:37,4,0,Mike from my district staff will be holding office hours at the Danbury Town Hall today from 2-4pm. Stop in and let us know how we can help!,,,,,
349364431613997057,1058717720,repanniekuster,Twitter Web Client,2013-06-25 03:12:26,4,2,A rough end to a truly remarkable season for the @NHLBruins. Hats off and congratulations to Chicago but remember: Boston will be back!,,,,,
349325690396614657,1058717720,repanniekuster,Twitter for iPhone,2013-06-25 00:38:29,1,0,Goal! Great start for the #Bruins!,,,,,
349247171897479168,1058717720,repanniekuster,Twitter Web Client,2013-06-24 19:26:29,38,29,Proud to support @NOH8campaign #NOH8onTheHill! Hope we hear good news from the Supreme Court for #equality this week. http://t.co/Mvjm52pxbD,,,,,
348119982825148416,1058717720,repanniekuster,Twitter Web Client,2013-06-21 16:47:26,1,1,Great @UnionLeader story on #Nashua manufacturer @WH_Bagshaw -- testified before small biz committee for #NSBW2013 http://t.co/WZW2B8JUzl,,,,,
347787631939162115,1058717720,repanniekuster,Twitter Web Client,2013-06-20 18:46:47,4,0,Just voted against a flawed #FarmBill that would hurt hungry #NH families. My statement: http://t.co/asyrrkihX0,,,,,
347517107921092608,1058717720,repanniekuster,Twitter for iPhone,2013-06-20 00:51:49,2,2,Tie game! Here we go #Bruins!,,,,,
347446400981798912,1058717720,repanniekuster,Twitter Web Client,2013-06-19 20:10:52,1,1,Great to talk about #cleanenergy and environmental policy with students from @dartmouth's @biggreenbus today! http://t.co/TOb25K2bHj,,,,,
347395593947201536,1058717720,repanniekuster,Twitter Web Client,2013-06-19 16:48:58,0,0,Thrilled to host @WH_Bagshaw Prez Aaron Bagshaw in DC for Natl Small Biz Week! Great #NH manufacturing company! http://t.co/Aq8OVyl1O8,,,,,
347393795383508994,1058717720,repanniekuster,Twitter Web Client,2013-06-19 16:41:49,0,1,Leading a bipartisan push to protect funding for critical access hospitals in #NH and across the country http://t.co/wEjA4R36pZ,,,,,
347138587357245441,1058717720,repanniekuster,Twitter Web Client,2013-06-18 23:47:43,4,2,Just wrapped up a great tele-town hall on #studentloans + college affordability. Thx to all who joined + shared stories! #DontDoubleMyRate,,,,,
346982305191051265,1058717720,repanniekuster,Twitter Web Client,2013-06-18 13:26:42,6,0,".@AP: ""NH's Kuster to discuss student loan rate hike"" &lt;-- telephone town hall tonight @ 6:30pm, hope you'll participate! #DontDoubleMyRate",,,,,
346979884695965696,1058717720,repanniekuster,Twitter Web Client,2013-06-18 13:17:05,2,1,My dinner last night for #SNAPchallenge was an apple &amp; pb crackers. Tough to eat nutritious food on $4.50 a day. http://t.co/AyqKITYMCS,,,,,
346779413775532034,1058717720,repanniekuster,Twitter Web Client,2013-06-18 00:00:29,2,0,"No overtime tonight, right guys? Let's go #Bruins!",,,,,
346747070604001282,1058717720,repanniekuster,Twitter Web Client,2013-06-17 21:51:58,1,0,Hosting a tele-town hall tomorrow night @ 6:30pm to hear from Granite Staters about #studentloans + college affordability #DontDoubleMyRate,,,,,
346692537966276608,1058717720,repanniekuster,Twitter Web Client,2013-06-17 18:15:16,2,2,Today's lunch: yogurt and a granola bar (found a deal on granola bars!). Takes a lot of planning to stretch a $ #SNAPchallenge,,,,,
346606952626921473,1058717720,repanniekuster,iOS,2013-06-17 12:35:12,3,0,My bfast today: a peach and a granola bar. Ate the peach before I remembered to take a pic! #SNAPchallenge http://t.co/oCKkRFbb1l,,,,,
346606086490566656,1058717720,repanniekuster,Twitter for iPhone,2013-06-17 12:31:45,4,1,Taking part in #SNAPchallenge today. My meals will cost $4.50--the avg for SNAP families.,,,,,
346391673443610624,1058717720,repanniekuster,Twitter for iPhone,2013-06-16 22:19:45,1,0,Happy Father's Day to all the great Dads out there!,,,,,
346057194560700416,1058717720,repanniekuster,Twitter for iPhone,2013-06-16 00:10:39,1,0,Let's go B's!,,,,,
345601649299050496,1058717720,repanniekuster,Camera on iOS,2013-06-14 18:00:28,0,0,Congrats to @harborhomesinc and @baesystemsinc on opening the new BAE Independence Hall for homeless vets! http://t.co/UcQ413t6P3,,,,,
345223184137740289,1058717720,repanniekuster,Twitter Web Client,2013-06-13 16:56:35,7,2,We must enhance whistleblower protections for service members who report #sexualassault in the military #MST https://t.co/T852f9YmQd,,,,,
345191821942599681,1058717720,repanniekuster,Twitter Web Client,2013-06-13 14:51:58,21,39,Just had my picture taken for #NOH8ontheHill. Thanks @bouska and @JeffParshley! http://t.co/WOSctx4Dmz,,,,,
345182700803616769,1058717720,repanniekuster,Twitter Web Client,2013-06-13 14:15:43,67,64,Excited to have my picture taken for #NOH8ontheHill today!  Every American deserves equal treatment under the law. #DOMA #marriageequality,,,,,
344964861459042304,1058717720,repanniekuster,Twitter for iPhone,2013-06-12 23:50:06,4,0,It's almost game time. Let's go @NHLBruins!! #StanleyCup,,,,,
344901475215998976,1058717720,repanniekuster,Twitter Web Client,2013-06-12 19:38:14,1,1,"Great meeting with Dr. Mayo-Smith, Director of the New England VA Health System, on how we can best serve our vets! http://t.co/R90P7OOwPy",,,,,
344548385732304897,1058717720,repanniekuster,Twitter Web Client,2013-06-11 20:15:11,1,0,"Proud to partner w/ @RepWalorski, @LorettaSanchez, and @AmyKlobuchar on bipartisan, bicameral leg. to combat #MST &amp; protect whistle-blowers.",,,,,
342432788156387328,1058717720,repanniekuster,Twitter for iPhone,2013-06-06 00:08:33,3,2,Let's go Bruins!,,,,,
341981233506562048,1058717720,repanniekuster,Twitter Web Client,2013-06-04 18:14:14,2,0,Proud to vote for the #RuthMooreAct -- important step fwd to level the playing field for survivors of #MST http://t.co/8Bx8jqWebX,,,,,
341939064661999616,1058717720,repanniekuster,Twitter Web Client,2013-06-04 15:26:40,9,3,Yesterday marked four years of marriage equality in #NH -- a fitting way to kick off June as #LGBT Pride Month! #MarriageEquality,,,,,
340167136876044288,1058717720,repanniekuster,Twitter for iPhone,2013-05-30 18:05:40,1,1,Great to be w/@GovernorHassan &amp; @KellyAyotte to see the new @MilitaryOfficer VetMobile @ the State Vets Cemetery! http://t.co/6Q6xYRAq6t,,,,,
340152969876082688,1058717720,repanniekuster,Twitter for iPhone,2013-05-30 17:09:22,1,0,Honored to be part of an inspiring #MemorialDay ceremony today at the NH State Veterans Cemetery. http://t.co/CPnayR9CxR,,,,,
340142213050822656,1058717720,repanniekuster,Twitter Web Client,2013-05-30 16:26:37,0,2,".@WCAX_Adam: ""Kuster wants to keep student loan rates from doubling"" http://t.co/zoO7QAqfn6",,,,,
340132418885386240,1058717720,repanniekuster,Twitter Web Client,2013-05-30 15:47:42,2,0,"RT @MBrindley_NHPR: At NH Veterans Cemetery, @RepAnnieKuster says honoring fallen a personal experience; we owe it to them to care for thos…",,,340130535504494593,5686162,MBrindley_NHPR
339844344683061250,1058717720,repanniekuster,Twitter Web Client,2013-05-29 20:43:00,0,0,".@UnionLeader: ""#Hudson firm gets backing from Rep. Kuster on cost of Internet sales tax bill""  http://t.co/iNnZzHyFe0",,,,,
339837127225393153,1058717720,repanniekuster,Twitter Web Client,2013-05-29 20:14:19,3,0,RT @SenatorShaheen: Calling on @US_FDA w/ @RepAnnieKuster to hold public hearing for NE farmers to voice concerns over new rule changes htt…,,,339834887404138499,109287731,SenatorShaheen
339762187176407040,1058717720,repanniekuster,Twitter Web Client,2013-05-29 15:16:32,1,0,Great talking w/students + staff at River Valley Community College about the need to prevent a student loan rate-hike http://t.co/RO3M8tEbLo,,,,,
339530806341021696,1058717720,repanniekuster,Twitter for iPhone,2013-05-28 23:57:07,5,1,Truly inspiring to see Jeff Bauman throwing out the first pitch at Fenway tonight. #BostonStrong,,,,,
339470849717465088,1058717720,repanniekuster,Twitter Web Client,2013-05-28 19:58:52,2,1,".@NashuaTelegraph: ""In #Hudson, Kuster reiterates opposition to Internet sales tax"" #NoNetTax http://t.co/GrLQhAPoHn",,,,,
339397232216395776,1058717720,repanniekuster,Twitter Web Client,2013-05-28 15:06:20,7,2,Just got to @WhaddyDeals in #Hudson to discuss why the #InternetSalesTax is bad for #NH small businesses #NoNetTax,,,,,
339395328849625088,1058717720,repanniekuster,Twitter Web Client,2013-05-28 14:58:46,1,1,Such a privilege celebrate Memorial Day w/ veterans at the NH Veterans Home ceremony in #Tilton yesterday http://t.co/TJY5uVNTlR,,,,,
338993274033422336,1058717720,repanniekuster,Twitter Web Client,2013-05-27 12:21:09,7,0,"On Memorial Day, we honor those who made the ultimate sacrifice in service to our  country http://t.co/73yqE2li5X",,,,,
338450492730507264,1058717720,repanniekuster,Twitter Web Client,2013-05-26 00:24:20,2,0,Congratulations to our @NHLBruins!! What a series. On to the Eastern Conference finals!,,,,,
338040893548396544,1058717720,repanniekuster,Twitter for iPhone,2013-05-24 21:16:44,1,0,"I want to thank Gen. Protzman, Col. Hutchinson and the entire @NHNationalGuard for hosting me at #Pease today. http://t.co/Y7k7S0N5XT",,,,,
338019291607728128,1058717720,repanniekuster,Twitter for iPhone,2013-05-24 19:50:54,0,0,It's great to be at Pease with the men and women of the Air Guard @NHNationalGuard http://t.co/CYN9gKVzGn,,,,,
337954972270489600,1058717720,repanniekuster,Twitter for iPhone,2013-05-24 15:35:19,1,0,Delighted to join so many inspiring NH Veterans for the grand opening of the Manchester Vet Center this morning. http://t.co/votlvCAMQu,,,,,
337923018431016962,1058717720,repanniekuster,Twitter Web Client,2013-05-24 13:28:20,4,0,My thoughts are w/those who were injured in the I-5 bridge collapse last night. We need to invest in roads/bridges--this can't happen again.,,,,,
337318652493824000,1058717720,repanniekuster,Twitter Web Client,2013-05-22 21:26:48,18,6,Urging President Obama to take action to help #EndTheVABacklog. Our nation's #veterans deserve better than this http://t.co/XNwLBOaKB2,,,,,
337241876568616961,1058717720,repanniekuster,Twitter Web Client,2013-05-22 16:21:43,2,0,Proud day for #NH: Air Force announces #Pease as top choice for KC46A http://t.co/dtFmQQnFZ7,,,,,
336947053441732608,1058717720,repanniekuster,Twitter Web Client,2013-05-21 20:50:12,1,1,Happy 100th to #NH's #FITN primary!,,,,,
336934710452293632,1058717720,repanniekuster,Twitter Web Client,2013-05-21 20:01:09,5,1,Just spoke out against the #InternetSalesTax bill passed by the #Senate - bad for #NH small biz #NoNetTax http://t.co/17akWo6dZe,,,,,
336874883680182272,1058717720,repanniekuster,Twitter Web Client,2013-05-21 16:03:25,3,0,"Imp. story, amazing person MT @Telegraph_SamA @JudyABell shares her story, speaks on issue of military sex assault http://t.co/WenxB4dgrJ",,,,,
336622583673913344,1058717720,repanniekuster,Twitter for iPhone,2013-05-20 23:20:52,1,0,My thoughts and prayers are with the people of Oklahoma tonight.,,,,,
336475354317332480,1058717720,repanniekuster,Twitter Web Client,2013-05-20 13:35:50,1,0,"RT @MSTJustice: @RepAnnieKuster Action Needed to Address Military Sexual Trauma, Calls For Action to Address the Growing Epidemic... http:/…",,,336226766752448512,28145694,MSTJustice
335900461821460480,1058717720,repanniekuster,Twitter for iPhone,2013-05-18 23:31:25,2,1,Today is #ArmedForcesDay. Thank you to all the heroes currently serving and all those who have served in the past.,,,,,
335445058545385472,1058717720,repanniekuster,Twitter Web Client,2013-05-17 17:21:48,2,0,Make sure you sign up for my e-newsletter to get the latest updates from #NH and DC! https://t.co/ch0tVIMyr8,,,,,
335100021148106752,1058717720,repanniekuster,Twitter Web Client,2013-05-16 18:30:45,1,0,Leading bipartisan group of Reps. to push for a hearing on VA's efforts to meet needs of veteran survivors of #MST http://t.co/hXC4MlOf3P,,,,,
335091835695407105,1058717720,repanniekuster,Twitter Web Client,2013-05-16 17:58:13,0,0,Proud 2 join bipartisan colleagues in advancing #FarmBill - imp step fwd 4 farmers/consumers/rural communities in #NH http://t.co/IOaFbZl6Sf,,,,,
335085159328149506,1058717720,repanniekuster,Twitter Web Client,2013-05-16 17:31:42,3,0,Very pleased to see the @DeptVetAffairs taking additional steps to help #EndTheVABacklog for our #veterans http://t.co/S0Ztshr11c,,,,,
335075788468658177,1058717720,repanniekuster,Twitter Web Client,2013-05-16 16:54:28,2,0,"Welcome news for #Atkinson, via @EagleTrib: ""EPA OKs $2M for water line in Atkinson"" http://t.co/pbFsuNBCXx",,,,,
334772358986481664,1058717720,repanniekuster,Twitter Web Client,2013-05-15 20:48:44,0,1,The American people deserve nothing less than complete confidence that the govt is protecting their privacy rights http://t.co/uCYYDSppFg,,,,,
334750738607636480,1058717720,repanniekuster,Twitter Web Client,2013-05-15 19:22:50,3,0,Thanks Jason! SNAP is critical for many NH families RT@ranoffic: tremendous comments by @RepAnnieKuster in support of #SNAP in the #farmbill,,,,,
334716951412760576,1058717720,repanniekuster,Twitter Web Client,2013-05-15 17:08:34,1,0,VIDEO: spoke about the need for bipartisan action to address the epidemic of sexual assault in the military #MST http://t.co/gJXfyil0jX,,,,,
334702460876750849,1058717720,repanniekuster,Twitter Web Client,2013-05-15 16:10:59,3,1,"On this #PeaceOfficersMemorialDay, we honor our brave law enforcement officers and all those who have given their lives to keep us safe.",,,,,
334693638036680704,1058717720,repanniekuster,Twitter Web Client,2013-05-15 15:35:56,5,1,Honored to join our whole delegation in celebrating the life of Greenland Police Chief Michael Maloney last night. http://t.co/3blFIxJKDb,,,,,
334680017739071490,1058717720,repanniekuster,Twitter Web Client,2013-05-15 14:41:48,1,1,Excited 2 work w/colleagues on both sides of aisle today to support our AG producers + protect vital nutrition assistance programs #FarmBill,,,,,
334675137339215872,1058717720,repanniekuster,Twitter Web Client,2013-05-15 14:22:25,0,0,"Today, the House Agriculture Committee is marking up the #FarmBill -- tune in live here: http://t.co/WS83zXbCoo",,,,,
334664333797781506,1058717720,repanniekuster,Twitter Web Client,2013-05-15 13:39:29,1,0,Great news for shipyard workers and for NH RT @UnionLeader Shipyard workers won't have to take furloughs http://t.co/2CDwe6omKU,,,,,
334658677799804930,1058717720,repanniekuster,Twitter Web Client,2013-05-15 13:17:01,2,0,"V disturbing MT @AP Army says sexual assault prevention coordinator being investigated for ""abusive sexual contact"" http://t.co/YPfYglsnSg",,,,,
334388166704369664,1058717720,repanniekuster,Twitter Web Client,2013-05-14 19:22:06,1,0,I am honored to attend tonight's memorial service during #NationalPoliceWeek for a true NH hero: Greenland Police Chief Michael Maloney.,,,,,
334312258144460801,1058717720,repanniekuster,Twitter for iPhone,2013-05-14 14:20:28,4,2,"It is completely inexcusable for the IRS or any government agency to target Americans or organizations for their political beliefs, period.",,,,,
334128718849134592,1058717720,repanniekuster,Twitter for iPhone,2013-05-14 02:11:09,1,0,What an amazing comeback and win for the @NHLBruins!,,,,,
334064666663845888,1058717720,repanniekuster,Twitter Web Client,2013-05-13 21:56:37,9,5,Congrats #Minnesota! The 12th state to recognize #marriageequality! w/DC that makes a bakers dozen standing on the right side of history!,,,,,
333991631051177985,1058717720,repanniekuster,Twitter Web Client,2013-05-13 17:06:24,2,0,"Tonight, @PBS will air the academy-award nominated documentary on military sexual assault: The Invisible War.  http://t.co/nBhA6x7Mbk #MST",,,,,
333985895520817152,1058717720,repanniekuster,Twitter Web Client,2013-05-13 16:43:37,2,0,My thoughts and prayers are with all those affected by yesterday's senseless violence in New Orleans.,,,,,
333667205499731969,1058717720,repanniekuster,Twitter for iPhone,2013-05-12 19:37:15,1,0,Wishing a very happy Mother's Day to all of the moms in NH and across the country!,,,,,
332482381359480834,1058717720,repanniekuster,Twitter Web Client,2013-05-09 13:09:11,2,0,"More on the CLEAN Act via .@thehill: ""House members push to save millions by closing unused government bank accounts"" http://t.co/a1yRs9DCtW",,,,,
332203155448291329,1058717720,repanniekuster,Twitter Web Client,2013-05-08 18:39:38,2,1,Important step forward today w/bipartisan passage of the #RuthMooreAct. More work to do to prevent + respond to #MST http://t.co/k6DU3VU5DB,,,,,
332123551551344641,1058717720,repanniekuster,Twitter Web Client,2013-05-08 13:23:19,7,2,RT if you agree: the govt shouldn't waste millions of dollars maintaining empty bank accounts that serve no purpose https://t.co/C8iXqBvI6D,,,,,
331891096793784320,1058717720,repanniekuster,Twitter Web Client,2013-05-07 21:59:38,7,0,"Congratulations to #Delaware, the 11th state to pass #marriageequality!",,,,,
331808134240808960,1058717720,repanniekuster,Twitter Web Client,2013-05-07 16:29:58,2,0,RT @BenLeubsdorf: NH's @RepAnnieKuster is sponsoring a bill to close thousands of empty federal bank accounts http://t.co/5hu5W36DWU #NHpol…,,,331803447294832641,28332786,BenLeubsdorf
331769727754059777,1058717720,repanniekuster,Twitter Web Client,2013-05-07 13:57:21,6,1,ICYMI: Great @ConMonitorNews editorial on our efforts to #EndTheVABacklog - so much more work to do for our #veterans http://t.co/qZDTIt7AcK,,,,,
331765928889032704,1058717720,repanniekuster,Twitter Web Client,2013-05-07 13:42:16,4,0,".@UnionLeader on my new bill to cut waste: ""Kuster introduces bi-partisan bill to close empty federal bank accounts"" http://t.co/KYWJYjnoNf",,,,,
331765339396399104,1058717720,repanniekuster,Twitter Web Client,2013-05-07 13:39:55,8,0,Introducing bipartisan bill w/@RepKevinCramer 2 close empty fed. bank accounts that serve no purpose + cost millions http://t.co/Nt5aIEYG4F,,,,,
331759459875577857,1058717720,repanniekuster,Twitter Web Client,2013-05-07 13:16:33,9,0,Disappointed #Senate passed #InternetSalesTax bill yest. - wld saddle #NH small biz w/onerous requirements http://t.co/FboM4uk9Y2 #NoNetTax,,,,,
331758295834570753,1058717720,repanniekuster,Twitter Web Client,2013-05-07 13:11:56,1,0,We must do better RT @cnnbrk Air Force officer involved in preventing sexual assaults accused of sexual battery. http://t.co/Ol2r7pwuUL,,,,,
331431451633532930,1058717720,repanniekuster,Twitter Web Client,2013-05-06 15:33:10,10,0,"RT @SenatorShaheen: Via @HRamer &amp; @seacoastonline, a good example of why Internet Sales Tax is bad for business and bad for NH #NoNetTa…",,,331429007105089536,109287731,SenatorShaheen
331404120789499904,1058717720,repanniekuster,Twitter Web Client,2013-05-06 13:44:34,6,1,Thx to all of the amazing teachers in #NH + across the country for all you do for our kids! Happy Teacher Appreciation Week! #ThankATeacher,,,,,
330396461747560448,1058717720,repanniekuster,Twitter Web Client,2013-05-03 19:00:29,5,0,Excited to announce a new package of bills to help #EndTheVABacklog -- including a bill I introd. Details here: http://t.co/rktdyKqCEr,,,,,
330356694334984193,1058717720,repanniekuster,Twitter Web Client,2013-05-03 16:22:28,0,0,Excited to announce the winner of the Congressional Art Competition in #NH02! Thx to all students who participated! http://t.co/42N6sFzYfw,,,,,
330355409472860160,1058717720,repanniekuster,Twitter Web Client,2013-05-03 16:17:21,1,0,.@sentinelsource covered my visit to Knappe &amp; Koester yesterday - talking student loans/workforce development in #NH: http://t.co/LYN0DiDLxZ,,,,,
330322826882064384,1058717720,repanniekuster,Twitter Web Client,2013-05-03 14:07:53,1,0,"As we mark 10 years since the collapse of the Old Man of the Mountain, we honor and remember #NH's iconic symbol: http://t.co/87m9eoJhUy",,,,,
330301638734659584,1058717720,repanniekuster,Twitter Web Client,2013-05-03 12:43:42,13,2,So proud to be a New Englander! Every New England state now recognizes #marriageequality! I’ll continue supporting #equality in Congress #RI,,,,,
330091737831841792,1058717720,repanniekuster,Twitter Web Client,2013-05-02 22:49:38,1,0,Great turnout at tonight's reception -- announcing the winner of the 2013 Congressional Art Competition in #NH02! http://t.co/uqHgjWQ9qn,,,,,
329997731919704066,1058717720,repanniekuster,Twitter Web Client,2013-05-02 16:36:05,2,0,RT @MENHVT_CNCS: @VISTAbuzz Morgan S. w/@RepAnnieKuster @NHFoodBank sharing challenges facing NH hungry &amp; impoverished populations http…,,,329975049794764801,1140141715,MENHVT_CNCS
329942899447955459,1058717720,repanniekuster,Twitter Web Client,2013-05-02 12:58:11,3,0,Talked w/@wcax yesterday about the need for action to help #EndTheVABacklog. More work to do for our #veterans: http://t.co/L4h0nQ9Cf3,,,,,
329940360442814465,1058717720,repanniekuster,Twitter Web Client,2013-05-02 12:48:06,0,0,thx for all the great work you're doing! RT @NHFB @RepAnnieKuster Thank you for coming to tour the Food Bank! We were glad to have you here.,,,,,
329680080194379776,1058717720,repanniekuster,Twitter Web Client,2013-05-01 19:33:51,2,1,Great visit/tour of the White River Junction VA Medical Center - doing such important work on behalf of our #veterans http://t.co/k8ZhugEwqc,,,,,
329627250771230720,1058717720,repanniekuster,Twitter Web Client,2013-05-01 16:03:55,1,0,RT @KMulhereKS: @RepAnnieKuster in #Keene at Knappe &amp; Koester today talking about her new workforce development bill. http://t.co/LQPXi…,,,329626869995556864,927826784,KMulhereKS
329613061549862914,1058717720,repanniekuster,Twitter Web Client,2013-05-01 15:07:32,1,0,".@LaconiaCitizen covered my mtg w/students at @PlymouthState: ""Kuster seeks PSU’s support against loan interest hike"" http://t.co/ViCz0Y9RFQ",,,,,
329580554469134336,1058717720,repanniekuster,Twitter Web Client,2013-05-01 12:58:22,2,1,"Check out this morning's .@NashuaTelegraph editorial on student loans: ""Call for student debt relief is warranted"" http://t.co/QX9R6rnraN",,,,,
329325926418624512,1058717720,repanniekuster,Twitter Web Client,2013-04-30 20:06:34,0,0,ICYMI: @nytimes editorial on #MST: http://t.co/4b5AZKGakA. We must do more to prevent #sexualassault in the military,,,,,
329300006584598529,1058717720,repanniekuster,Twitter Web Client,2013-04-30 18:23:34,3,0,Having a blast at @Rotobec in Littleton learning about advanced manufacturing and creating good jobs here at home. http://t.co/J2RVQcpS33,,,,,
