id,user_id,screen_name,source,created_at,retweet_count,favorite_count,text,in_reply_to_screen_name,in_reply_to_status_id,retweeted_status_id,retweeted_status_user_id,retweeted_status_screen_name
563037908811386881,1058717720,repanniekuster,Twitter Web Client,2015-02-04 18:14:32,8,0,"Last time we updated our #emailprivacy laws, Crocodile Dundee had never visited NYC. Let’s pass #ECPA! @RepKevinYoder http://t.co/s2EsiXrQMz",,,,,
563018190998220800,1058717720,repanniekuster,Twitter Web Client,2015-02-04 16:56:11,0,4,Great to visit with students from the Dublin School  – inspiring to see young people engaged in the process! http://t.co/Wlgceo4oZG,,,,,
563013293594656769,1058717720,repanniekuster,Twitter Web Client,2015-02-04 16:36:44,3,0,"RT @RepKevinYoder: The last time we updated our #emailprivacy laws, @DisneyPixar was opening up shop in California. Let's pass #ECPA. http:…",,,562998883920646145,252819642,RepKevinYoder
563013106386092033,1058717720,repanniekuster,Twitter Web Client,2015-02-04 16:35:59,14,0,"RT @RepJaredPolis: Our #EmailPrivacy laws were written for the #Apple2, not the #iPhone6. 227 reps joined @RepKevinYoder &amp; I today on a bil…",,,562993971136581632,463132556,RepJaredPolis
562736699235897344,1058717720,repanniekuster,Twitter Web Client,2015-02-03 22:17:38,3,3,Excited to learning more about options for rail expansion outlined in today’s study on the Capitol Corridor project: http://t.co/MMTwkeknsG,,,,,
562692062307713024,1058717720,repanniekuster,Twitter Web Client,2015-02-03 19:20:16,0,2,Pleased the Senate passed the #ClayHunt SAV Act today – was proud to help introduce this bill 2 improve mental health services for #veterans,,,,,
562668437873639425,1058717720,repanniekuster,Twitter Web Client,2015-02-03 17:46:24,1,0,Proud to present Stephen Baird of Hancock w/ the Congressional Bronze Medal Award 4 achievement &amp; community service: http://t.co/nP4KmMwq5C,,,,,
562381344349892608,1058717720,repanniekuster,Twitter Web Client,2015-02-02 22:45:35,3,1,Proud to join my Republican colleague Jackie Walorski to reintroduce our bill extending travel benefits to victims of MST.,,,,,
562299550233538561,1058717720,repanniekuster,Twitter Web Client,2015-02-02 17:20:34,5,7,Congrats to Windham High School's Jared Cassedy on winning the 2015 Grammy Music Educator Award! http://t.co/Swydda93O9,,,,,
561996275248541698,1058717720,repanniekuster,Twitter Web Client,2015-02-01 21:15:28,5,2,Game Day!! Let's go #Patriots - we're all rooting for you here in NH!!,,,,,
561235336265990146,1058717720,repanniekuster,Twitter Web Client,2015-01-30 18:51:46,3,1,Glad President Hanlon is working to prevent and address campus sexual assault at Dartmouth: http://t.co/mGlm4lR35g,,,,,
561216528780365824,1058717720,repanniekuster,Twitter Web Client,2015-01-30 17:37:02,35,0,RT @NWF: 2015 Wildlife Conservation Briefing with @RepAnnieKuster: http://t.co/bbQUlI4HXY http://t.co/h9YHkkG9Ve,,,561206968690671616,3554721,NWF
561215895822139392,1058717720,repanniekuster,Twitter Web Client,2015-01-30 17:34:31,1,0,RT @NHWomensFndn: NH's @RepAnnieKuster's &amp; MO's @RepAnnWagner's SAVE Act legislation was passed by Congress this week! #APathAppears http:/…,,,560912759450525697,44143192,NHWomensFndn
561212154809176065,1058717720,repanniekuster,Twitter Web Client,2015-01-30 17:19:39,6,0,RT @NHCADSV: Big thanks to @RepAnnieKuster for pushing for passage of critical anti-human trafficking bills in the House today!    http://t…,,,560218551051882496,222151790,NHCADSV
560911377209237504,1058717720,repanniekuster,Twitter Web Client,2015-01-29 21:24:28,7,1,"On the 6th Anniversary of the Lilly Ledbetter Act, we must continue working to achieve #EqualPay for equal work! http://t.co/UuJXlQENgH",,,,,
560596150823419904,1058717720,repanniekuster,Twitter Web Client,2015-01-29 00:31:52,5,3,Thrilled to attend the 1st hearing of the VA Subcommittee on Health on the cost of vets health care - we must serve those who served us!,,,,,
560487902631968769,1058717720,repanniekuster,Twitter Web Client,2015-01-28 17:21:44,2,2,"Happy birthday to my friend @SenatorShaheen, a great advocate for New Hampshire!",,,,,
560459445374025728,1058717720,repanniekuster,Twitter Web Client,2015-01-28 15:28:39,1,0,Proud &amp; honored to watch Selma w/ my courageous colleague @repjohnlewis. We shall overcome prejudice &amp; fear! http://t.co/p3bX0z7zlL,,,,,
560204782645022720,1058717720,repanniekuster,Twitter Web Client,2015-01-27 22:36:42,3,0,"Today I spoke in honor of U.S. skiers Ronnie Berlack &amp; Bryce Astle, who died doing what they loved: http://t.co/qdIwXFna4M",,,,,
560164492504735744,1058717720,repanniekuster,Twitter Web Client,2015-01-27 19:56:37,0,1,"Last night, I joined @RepAnnWagner to stress the importance of passing legislation to help end human trafficking: http://t.co/n57b3UN8pY",,,,,
560143461270450176,1058717720,repanniekuster,Twitter Web Client,2015-01-27 18:33:02,2,1,"On Holocaust Remembrance Day, we remember those who died and renew our commitment to peace and tolerance.",,,,,
559839162707509248,1058717720,repanniekuster,Twitter Web Client,2015-01-26 22:23:52,6,2,Don’t wait for a power outage to think about #FoodSafety!  Plan ahead to keep food safe during the #Blizzardof2015 http://t.co/Ml7HVdiX1m,,,,,
559821237434994689,1058717720,repanniekuster,Twitter Web Client,2015-01-26 21:12:38,3,3,"Granite Staters, please stay safe and warm during the upcoming storm! Visit http://t.co/M7I1zJ7Ehp for helpful hints on how to prepare.",,,,,
559785201329770496,1058717720,repanniekuster,Twitter Web Client,2015-01-26 18:49:26,1,6,So proud to help honor my friend @ColinVanOstern at the NARAL Pro-Choice NH “Roe at 42” event! http://t.co/LpCjl3eCam,,,,,
558747530360791040,1058717720,repanniekuster,Twitter Web Client,2015-01-23 22:06:06,3,0,Proud to help introduce the Reducing Barriers for Veterans Education Act to give #veterans better access to education!http://t.co/dehtpBg6pB,,,,,
558740907227623424,1058717720,repanniekuster,Twitter Web Client,2015-01-23 21:39:47,0,3,Honored to receive a 100 from the @HumaneSociety for my advocacy on behalf of animal rights! http://t.co/z4th6B7oJE,,,,,
558739139345256451,1058717720,repanniekuster,Twitter Web Client,2015-01-23 21:32:46,1,0,RT @RepMurphyFL: #FF @DesJarlaisTN04 @MarioDB @RepAnnieKuster - working together to give #veterans better access to education http://t.co/J…,,,558672191169241089,1128781184,RepMurphyFL
558739127093706752,1058717720,repanniekuster,Twitter Web Client,2015-01-23 21:32:43,8,0,"RT @RepSinema: #FF cosponsors of our bipartisan bill to prevent veteran suicide @Rep_Hunter, @RepAnnieKuster,  @CongressmanDan, @TulsiPress…",,,558655512774856705,1080844782,RepSinema
558733356662525952,1058717720,repanniekuster,Twitter Web Client,2015-01-23 21:09:47,0,0,"Great to meet with students, educators, and biz leaders at my @NHTI open roundtable forum on workforce development: http://t.co/9mCrO6ySKD",,,,,
558726577945866240,1058717720,repanniekuster,Twitter Web Client,2015-01-23 20:42:51,4,3,Proud to honor Stephen Baird of Hancock today with the Bronze Medal Congressional Award for his public service! http://t.co/OShxvslL7z,,,,,
558697674946650112,1058717720,repanniekuster,Twitter Web Client,2015-01-23 18:48:00,4,0,RT @RepWalorski: Made good on my bet w/ @RepAnnieKuster on #AFCChampionship from Sat night  and awarded her with @SBChocolate Enjoy! http:/…,,,558645831986081793,1065995022,RepWalorski
558393859794022401,1058717720,repanniekuster,Twitter Web Client,2015-01-22 22:40:45,4,4,Congrats to @SchillingBeer in Littleton for being named one of the best “ski town” breweries: http://t.co/4SGZL5ssrX,,,,,
558384042937430017,1058717720,repanniekuster,Twitter Web Client,2015-01-22 22:01:44,5,2,Proud to help reintroduce the Gov’t by the People Act to stem the tide of dark money into our elections since #CitizensUnited #GetMoneyOut,,,,,
558363438637133824,1058717720,repanniekuster,Twitter Web Client,2015-01-22 20:39:52,13,11,"On the 42nd Anniversary of Roe V. Wade, proud to defend women’s health &amp; rights by cosponsoring Women’s Health Protection Act. #ActForWomen",,,,,
558349921112567808,1058717720,repanniekuster,Twitter Web Client,2015-01-22 19:46:09,2,1,Thrilled to continue to advocate for NH priorities on the House Agriculture and House Veterans’ Affairs Committees: http://t.co/18xawKsnAy,,,,,
558035966804639745,1058717720,repanniekuster,Twitter Web Client,2015-01-21 22:58:36,5,3,"Glad Shaheen-Portman Act 2 improve energy efficiency, save $, &amp; protect the enviro passed; need more smart, bipartisan plans like this one!",,,,,
558010216936407040,1058717720,repanniekuster,Twitter Web Client,2015-01-21 21:16:17,3,1,"In NH &amp; around the country, we must help #FamiliesSucceed by supporting paid family leave for our workers!",,,,,
558001157210374144,1058717720,repanniekuster,Twitter Web Client,2015-01-21 20:40:17,3,3,"On the 5th anniversary of Citizens United, I am supporting the Democracy for All Amendment to #GetMoneyOut",,,,,
557944747399327744,1058717720,repanniekuster,Twitter Web Client,2015-01-21 16:56:08,2,1,Thrilled to see the Granite State ranked the #1 state in the country for the second year in a row! http://t.co/aXNoYEATy0,,,,,
557746072001732608,1058717720,repanniekuster,Twitter Web Client,2015-01-21 03:46:40,5,11,"We must continue to fight to strengthen our middle class, create more jobs for our workers, and make college more affordable #SOTU",,,,,
557720810828603393,1058717720,repanniekuster,Twitter Web Client,2015-01-21 02:06:17,14,18,Wearing pink @ State of the Union to celebrate over 100 women in Congress! We need to elect more. http://t.co/yETWm69zuG,,,,,
557701620809863171,1058717720,repanniekuster,Twitter Web Client,2015-01-21 00:50:02,20,0,RT @JuliaBrownley26: Wearing pink to #SOTU b/c need more women in Congress! @RepCheri @RepKClark @RepLoisFrankel @RepAnnieKuster @RepGraceM…,,,557662827436318720,1243902714,JuliaBrownley26
557679745669013504,1058717720,repanniekuster,Twitter Web Client,2015-01-20 23:23:07,1,2,Thrilled to help reintroduce the Partnership to Build America Act today to rebuild our nation’s infrastructure and create good jobs.,,,,,
557622389878845440,1058717720,repanniekuster,Twitter Web Client,2015-01-20 19:35:12,1,0,Proud to announce a $10 million USDA grant to help improve the health of the Connecticut River Watershed: http://t.co/b7K8yuDAFz,,,,,
556218875067789312,1058717720,repanniekuster,Twitter Web Client,2015-01-16 22:38:08,4,5,Exciting news from the Supreme Court!  Looking forward to celebrating full #marriageequality across the US in a few short months!,,,,,
556213437102292993,1058717720,repanniekuster,Twitter Web Client,2015-01-16 22:16:32,4,1,Today I urged President Obama to expand the National Network for Manufacturing Innovation and extend it to NH: http://t.co/Ym9yrhD3yE,,,,,
556195707389239297,1058717720,repanniekuster,Twitter Web Client,2015-01-16 21:06:04,0,3,Had a great time at the North Country Charter Academy in Littleton discussing their workforce training program. http://t.co/Zs4i5vcLpY,,,,,
556168736030597120,1058717720,repanniekuster,Twitter Web Client,2015-01-16 19:18:54,1,4,Great to meet with small business owners in Nashua yesterday to discuss how to support them at the federal level: http://t.co/rrJ5NYH64T,,,,,
556141371862835200,1058717720,repanniekuster,Twitter Web Client,2015-01-16 17:30:10,0,0,Read my op-ed on my work in 2014 &amp; my priorities for 2015 – I will continue fighting for YOU in the New Year! http://t.co/cVWHLB3EeC,,,,,
556107867615686656,1058717720,repanniekuster,Twitter Web Client,2015-01-16 15:17:02,1,0,I applaud yesterday’s announcement &amp; will fight for paid family leave to strengthen the middle class. #LeadOnLeave http://t.co/Wgva7HSAdg,,,,,
555853889233510401,1058717720,repanniekuster,Twitter Web Client,2015-01-15 22:27:49,4,4,Stopped by Nashua’s @pressedcafe for lunch &amp; to hear from local residents – great small business with delicious food! http://t.co/31ONkND1aI,,,,,
555849748092321792,1058717720,repanniekuster,Twitter Web Client,2015-01-15 22:11:21,2,0,RT @NHWomensFndn: Thank you @RepAnnieKuster and @RepAnnWagner for working together to reintroduce the SAVE Act to Congress. http://t.co/4Ko…,,,555772348029501440,44143192,NHWomensFndn
555844903792832512,1058717720,repanniekuster,Twitter Web Client,2015-01-15 21:52:06,0,3,Met with local small business leaders to discuss how to continue supporting our NH small businesses in Washington. http://t.co/kWrkd7LEjE,,,,,
555076308800401408,1058717720,repanniekuster,Twitter Web Client,2015-01-13 18:57:59,1,3,Proud to help pass the Clay Hunt Act last night to help ensure all veterans can access mental health services: http://t.co/DoGYI73ghk,,,,,
554761001565175808,1058717720,repanniekuster,Twitter Web Client,2015-01-12 22:05:04,1,0,Proud to reintroduce the bipartisan SAVE Act to fight the commercial exploitation of sex-trafficking victims: http://t.co/c35PJbEcoa,,,,,
554737460832661504,1058717720,repanniekuster,Twitter Web Client,2015-01-12 20:31:31,0,1,"Honored to help send off the NHANG’s 3rd Battalion, 197th Field Artillery Regiment. Thank you for your service. http://t.co/ieIUPWOfdu",,,,,
554710054369521665,1058717720,repanniekuster,Twitter Web Client,2015-01-12 18:42:37,0,1,Had a comprehensive discussion this morning with local stakeholders about issues facing NH veterans. http://t.co/2lSsCfz41J,,,,,
553692010717401088,1058717720,repanniekuster,Twitter Web Client,2015-01-09 23:17:17,2,0,"Good news re. 252,000 new U.S. jobs in December; must keep working to strengthen NH economy!",,,,,
553313289170845696,1058717720,repanniekuster,Twitter Web Client,2015-01-08 22:12:22,1,3,"Proud to take to the House floor to honor the life of Lt. Col. Steph Riley, a truly amazing Granite Stater: http://t.co/xDvOhx6NRb",,,,,
552967627602399232,1058717720,repanniekuster,Twitter Web Client,2015-01-07 23:18:50,3,3,"Proud to help pass the Hire More Heroes Act, which will help small businesses employ more of our nation’s veterans!",,,,,
552922754018979841,1058717720,repanniekuster,Twitter Web Client,2015-01-07 20:20:32,1,1,"Great to see that more than 30,000 Granite Staters enrolled in bipartisan NH Health Protection Program last year! http://t.co/9xvkKlzxlv",,,,,
552596328283652096,1058717720,repanniekuster,Twitter Web Client,2015-01-06 22:43:26,3,5,Honored &amp; humbled to be sworn in to serve a second term representing NH's 2nd District in Congress! http://t.co/L7mjRxxPe8,,,,,
552218183290343424,1058717720,repanniekuster,Twitter Web Client,2015-01-05 21:40:49,1,4,Saddened to hear about fatal avalanche in Austria; my thoughts &amp; prayers go out to the family of NH’s Ronnie Berlack http://t.co/tDQ43NjyL3,,,,,
550015709582221313,1058717720,repanniekuster,Twitter Web Client,2014-12-30 19:48:58,0,1,Steph Riley was a courageous and compassionate Granite Stater who touched so many lives. My prayers are with her family and friends.,,,,,
549675553088110592,1058717720,repanniekuster,Twitter Web Client,2014-12-29 21:17:18,2,3,Congrats to this group of NH students for securing a patent on the tracking device they designed in 2012! http://t.co/xKGt3ly6aV,,,,,
547485902050975744,1058717720,repanniekuster,Twitter Web Client,2014-12-23 20:16:25,4,5,I was excited to help deliver meals for Meals on Wheels this morning in Nashua! Inspiring work and wonderful people http://t.co/prHzazazmI,,,,,
547102912254451712,1058717720,repanniekuster,Twitter Web Client,2014-12-22 18:54:33,0,0,Proud to join 23 other Members of Congress last week to submit an Amicus Brief supporting the rights of MST victims: http://t.co/9nL2rOJNfA,,,,,
547101796985221121,1058717720,repanniekuster,Twitter Web Client,2014-12-22 18:50:07,4,0,RT @SenatorShaheen: FairPoint leadership &amp; workers should come together to resolve their labor dispute. My letter w/@RepAnnieKuster: http:/…,,,547092891211137024,109287731,SenatorShaheen
545662192545435648,1058717720,repanniekuster,Twitter Web Client,2014-12-18 19:29:39,2,1,"Thrilled to join @MayorLozeau &amp; @NashuaChamber today to discuss Exit 36S; would help relieve traffic, grow economy. http://t.co/ozw9pyEAzv",,,,,
545645720834170881,1058717720,repanniekuster,Twitter Web Client,2014-12-18 18:24:12,0,0,I was honored to deliver holiday cards made by local students to our heroes at the NH Veterans Home this morning! http://t.co/EwQsCViJA1,,,,,
545324386379902976,1058717720,repanniekuster,Twitter Web Client,2014-12-17 21:07:20,1,2,Honored to nominate 25 NH students for the U.S. Service Academies – I’m so proud of their hard work &amp; patriotism: http://t.co/UwVsNS6osP,,,,,
545292376353566720,1058717720,repanniekuster,Twitter Web Client,2014-12-17 19:00:08,0,0,"Great news that the Market Basket sale has been finalized, and workers’ voices were heard! http://t.co/KrWdWmLevo",,,,,
544977545024634882,1058717720,repanniekuster,Twitter Web Client,2014-12-16 22:09:06,3,5,"While it was good to see NH’s unemployment rate fall to 4.1% in November, we must continue working to boost economic growth &amp; job creation.",,,,,
544957736933679104,1058717720,repanniekuster,Twitter Web Client,2014-12-16 20:50:23,1,3,Happy Hanukkah to all my Jewish friends and neighbors celebrating tonight!,,,,,
544942069333360640,1058717720,repanniekuster,Twitter Web Client,2014-12-16 19:48:08,2,1,"Today marks 40 years since the Safe Drinking Water Act became law, protecting the public health nationwide. We must continue these efforts!",,,,,
544904632464863232,1058717720,repanniekuster,Twitter Web Client,2014-12-16 17:19:22,0,0,"On the 70th anniversary of the Battle of the Bulge, we honor the courageous service members who fought for our country in WWII.",,,,,
544611836390543360,1058717720,repanniekuster,Twitter Web Client,2014-12-15 21:55:54,0,0,Today’s report from the NH Coalition to End Homelessness shows veterans homelessness going up – we must take action! http://t.co/wfPFkJuOik,,,,,
544604624880422913,1058717720,repanniekuster,Twitter Web Client,2014-12-15 21:27:15,0,3,"Happy Bill of Rights Day! 223 years after the Bill of Rights was ratified, we should remember the civil liberties we have as Americans.",,,,,
543512628992434177,1058717720,repanniekuster,Twitter Web Client,2014-12-12 21:08:03,0,0,"Read here about my work during the 113th Congress, and my goals for the new legislative session: http://t.co/sPtgdCrErQ",,,,,
543505383839764480,1058717720,repanniekuster,Twitter Web Client,2014-12-12 20:39:16,4,1,Happy to record a holiday message for our troops overseas this week to thank them for their service! http://t.co/6giQIzwqMR,,,,,
543168231671074818,1058717720,repanniekuster,Twitter Web Client,2014-12-11 22:19:32,2,1,"At this morning’s VA hearing, great to hear from Soldier On about plans to build a vets housing facility in Plymouth: http://t.co/SlhskmFsBF",,,,,
542795210196254720,1058717720,repanniekuster,Twitter Web Client,2014-12-10 21:37:17,5,3,"Met w/ NH state reps @CindyR4NH, @rennycushing, &amp; Mary Jane Wallner to discuss our opposition 2 an online sales tax: http://t.co/XiDQMT7Htm",,,,,
542453900431745024,1058717720,repanniekuster,Twitter Web Client,2014-12-09 23:01:02,5,5,Happy to help pass legislation today to support breast cancer education &amp; prevention efforts among young women.,,,,,
542450185146613760,1058717720,repanniekuster,Twitter Web Client,2014-12-09 22:46:17,8,7,"Proud to help pass the bipartisan Clay Hunt Act, which I helped introduce to address veteran suicide and improve mental health services.",,,,,
542361111027523584,1058717720,repanniekuster,Twitter Web Client,2014-12-09 16:52:20,1,0,"During today’s winter storm, please use caution and look out for your neighbors. Info on emergency services here: http://t.co/M7I1zJ7Ehp",,,,,
542071532286394368,1058717720,repanniekuster,Twitter Web Client,2014-12-08 21:41:39,1,0,I had a great time on Friday meeting students who are making holiday cards for the men and women at the NH Vets Home: http://t.co/IOgRrkuEEB,,,,,
541967750533771264,1058717720,repanniekuster,Twitter Web Client,2014-12-08 14:49:15,1,0,RT @Kimber_Houghton: Nashua students write holiday cards for veterans with @RepAnnieKuster. http://t.co/4aD8MWp32j,,,541960389102411776,590900534,Kimber_Houghton
540997221496672257,1058717720,repanniekuster,Twitter Web Client,2014-12-05 22:32:43,2,6,Congrats to Jared Cassedy from Windham for being named a Grammy Music Educator Award finalist! http://t.co/tbwyHKfAyn,,,,,
540994452106805248,1058717720,repanniekuster,Twitter Web Client,2014-12-05 22:21:43,0,5,Great to visit schools in Nashua and Concord today to kick off my Holiday Cards for Heroes drive: http://t.co/igiMaFdJ7L,,,,,
540610107701469184,1058717720,repanniekuster,Twitter Web Client,2014-12-04 20:54:28,0,2,"Yesterday, I was proud to help pass the bipartisan ABLE Act, which will help provide financial security for people with disabilities.",,,,,
540586308973129730,1058717720,repanniekuster,Twitter Web Client,2014-12-04 19:19:54,2,2,Yesterday I questioned VA officials on the Family Caregiver Program – we must support our military families: http://t.co/RrIIXMTjZq,,,,,
540530232823144449,1058717720,repanniekuster,Twitter Web Client,2014-12-04 15:37:04,161,0,RT @RepMaloney: FACT: About two-thirds of minimum wage workers are women. We must #raisethewage to help #womensucceed &amp; to ensure their eco…,,,540490712693751808,258900199,RepMaloney
540229019166601216,1058717720,repanniekuster,Twitter Web Client,2014-12-03 19:40:09,14,5,"As the Supreme Court considers Young vs. UPS, we must stand up for the rights of pregnant workers! #StandWithPeggy http://t.co/70Tm2XLhez",,,,,
540222671330738176,1058717720,repanniekuster,Twitter Web Client,2014-12-03 19:14:56,1,1,"At a VA hearing today, I pushed VA officials and Congress to improve the Family Caregiver Program so more NH vets can recuperate at home.",,,,,
539498051115941889,1058717720,repanniekuster,Twitter Web Client,2014-12-01 19:15:33,3,2,"On #WorldAIDSDay, we renew our commitment to ending HIV &amp; AIDS and creating an #AIDSFreeGen http://t.co/rW2UzvSqJ6",,,,,
538803102338777088,1058717720,repanniekuster,Twitter Web Client,2014-11-29 21:14:04,3,6,"Small biz is the backbone of our economy - let's show support for our local, New Hampshire small businesses on #SmallBusinessSaturday!",,,,,
538798249940111362,1058717720,repanniekuster,Twitter Web Client,2014-11-29 20:54:47,7,3,"For anyone w/out power, here's a warming shelter list - and let's all look out for our neighbors this snow season! http://t.co/laRdVvEQES",,,,,
538017194446430208,1058717720,repanniekuster,Twitter Web Client,2014-11-27 17:11:09,1,2,Happy Thanksgiving to you and yours. Wishing every Granite Stater the best during this great celebration of our nation’s beginnings!,,,,,
536977626683174913,1058717720,repanniekuster,Twitter Web Client,2014-11-24 20:20:17,3,2,Read this op-ed I wrote over the weekend about NH’s local farms and how they can help feed low-income families: http://t.co/KhTJifqpmg,,,,,
536295646987554817,1058717720,repanniekuster,Twitter Web Client,2014-11-22 23:10:20,3,3,"As a former adoption attorney, I was proud 2 raise awareness re. Natl Adoption Day &amp; importance of adoption this week:http://t.co/PiPhK6sZh1",,,,,
535200877951594496,1058717720,repanniekuster,Twitter Web Client,2014-11-19 22:40:07,0,0,"At today’s VA Subcommittee hearing, I joined my colleagues and VSOs to discuss approaches to improving support services for our veterans.",,,,,
534834213351329792,1058717720,repanniekuster,Twitter Web Client,2014-11-18 22:23:07,3,4,Great to see NH’s unemployment rate drop to 4.2% in October. We need to continue to work to support economic growth and job creation.,,,,,
534823062823534592,1058717720,repanniekuster,Twitter Web Client,2014-11-18 21:38:49,2,4,Substance abuse cost the NH economy $1.85 billion in 2012 – we must work to end the addiction epidemic: http://t.co/wVFd4Kpy4O,,,,,
534768115553673216,1058717720,repanniekuster,Twitter Web Client,2014-11-18 18:00:28,3,0,Happy #EntrepreneursDay 2014! Entrepreneurship has a rich tradition in New Hampshire - I am proud to work on behalf of our small businesses.,,,,,
534465705123778560,1058717720,repanniekuster,Twitter Web Client,2014-11-17 21:58:48,1,4,Excited to see progress on marriage equality in Kansas. Every American should have the freedom to marry the person they love!,,,,,
533357515497799681,1058717720,repanniekuster,Twitter Web Client,2014-11-14 20:35:15,2,0,"RT @ACSCAN_NH: BREAKING: @RepAnnieKuster co-sponsoring all 3 fed. bills (HR 1070, 1339, &amp; 1666) we asked about at Sept. lobby day! Thank yo…",,,533325733805191169,2196217076,ACSCAN_NH
533348601200914432,1058717720,repanniekuster,Twitter Web Client,2014-11-14 19:59:50,2,2,"Open enrollment for the 2015 health insurance marketplace begins tomorrow, Nov 15 – go to http://t.co/84fv2wjgYg to enroll.",,,,,
533012997258895360,1058717720,repanniekuster,Twitter Web Client,2014-11-13 21:46:16,1,1,"This morning, I questioned VA officials about the implementation of the bipartisan VA reform law. We must improve access to care for vets!",,,,,
532993845014065152,1058717720,repanniekuster,Twitter Web Client,2014-11-13 20:30:09,1,2,Great to see UNH working to improve prevention and boost awareness of sexual assault in our high schools: http://t.co/7SEE1HGxe0,,,,,
532633944538492928,1058717720,repanniekuster,Twitter Web Client,2014-11-12 20:40:02,3,5,So proud to be part of the first Congress in history with more than 100 women! An incredible step towards equality: http://t.co/vYYT1AnI2B,,,,,
532236168789000193,1058717720,repanniekuster,Twitter Web Client,2014-11-11 18:19:25,1,2,Honored to thank our veterans and their families at the NH Vets Cemetery today. http://t.co/Tq6Z9SUyI5,,,,,
