id,user_id,screen_name,source,created_at,retweet_count,favorite_count,text,in_reply_to_screen_name,in_reply_to_status_id,retweeted_status_id,retweeted_status_user_id,retweeted_status_screen_name
463440468756688896,950783972,repbera,Twitter Web Client,2014-05-05 22:09:52,5,2,California and our nation is blessed to have a vibrant Mexican-American community - #HappyCincoDeMayo to all who are celebrating!,,,,,
463411568995094528,950783972,repbera,Twitter Web Client,2014-05-05 20:15:02,28,51,Congrats to Josh Corrigan for winning first place in the 2014 congressional art competition! http://t.co/umpDYYwqCp http://t.co/rQUXq9gXsV,,,,,
463322336872366080,950783972,repbera,Hootsuite,2014-05-05 14:20:27,1,0,See how I’m fighting to build an economy that works for middle class families on my website: http://t.co/n1VMv3D5Lt,,,,,
463094544318230528,950783972,repbera,Hootsuite,2014-05-04 23:15:17,4,1,Got to meet with students &amp; teachers from California visiting Capitol Hill through @CloseUp_DC this week. Pic: http://t.co/Gzm6d33g5v,,,,,
463039129937518593,950783972,repbera,Hootsuite,2014-05-04 19:35:06,3,2,Thanks to the spring interns in my D.C. office for all their hard work this semester! http://t.co/0MHs8ej7Dm,,,,,
462740416895672321,950783972,repbera,Hootsuite,2014-05-03 23:48:07,3,0,"Had a great time walking the Western Festival parade today. If we missed you, visit http://t.co/QBfNjxBOF4 to learn how our office can help",,,,,
462649136052207616,950783972,repbera,Hootsuite,2014-05-03 17:45:24,28,8,Story of kidnapped Nigerian girls is heartbreaking. We must hold those responsible accountable! #bringourgirlsback http://t.co/O9P0ITZq1s,,,,,
462601285821546496,950783972,repbera,Hootsuite,2014-05-03 14:35:15,4,0,"Spoke at a screening of #Misconception. Here I am w/ Gladys Kalibbala, Uganda journalist in the film. Trailer:  http://t.co/0Iu7oUYQvn",,,,,
462350530191581184,950783972,repbera,Hootsuite,2014-05-02 21:58:51,1,0,Extremely concerned by issue of sexual assaults at colleges &amp; commend students who've brought this issue to light: http://t.co/dcNVsMUp3A,,,,,
462262894101798913,950783972,repbera,Hootsuite,2014-05-02 16:10:37,2,1,LAST DAY TO VOTE! Don't forget to make your pick in the Congressional Art Competition. http://t.co/G8uOmDlkEK,,,,,
462233993849864193,950783972,repbera,Hootsuite,2014-05-02 14:15:46,5,1,"May is Asian Pacific American Heritage Month, a time to celebrate the many contributions our diverse community has made to the US #APAHM2014",,,,,
461950662264520705,950783972,repbera,Hootsuite,2014-05-01 19:29:55,3,3,Voted to keep my promise today: no pay raise for Congress until unemployment is under 5% in #ca07: http://t.co/wUhouLS3KG,,,,,
461895638964518912,950783972,repbera,Hootsuite,2014-05-01 15:51:16,7,4,Proud to launch bipartisan California Public Higher Education Caucus w @RepJeffDenham &amp; students fr UC &amp; CSU: http://t.co/YQLZbIA5nZ #cphec,,,,,
461880337342398464,950783972,repbera,Hootsuite,2014-05-01 14:50:28,1,0,Help choose which Sacramento student has their work of art displayed in the US Capitol! Vote here: http://t.co/G8uOmDlkEK,,,,,
461869873929670656,950783972,repbera,Hootsuite,2014-05-01 14:08:53,3,2,"Thx for your work! MT Headed to inauguration of CA Public Higher Ed Caucus with the 2awesome co-chairs, @RepBera and @RepJeffDenham #CPHEC",,,,,
461605378393116672,950783972,repbera,Hootsuite,2014-04-30 20:37:53,0,0,Disappointed bill to raise #minimumwage was blocked in Senate. We need to rebuild an economy that works for everyone http://t.co/aeqmw75s7V,,,,,
461543249292062721,950783972,repbera,Hootsuite,2014-04-30 16:31:00,3,0,Traveling to the D.C. area? My Washington office would be happy to help you w/ a tour. http://t.co/77KZaFIOEv,,,,,
461158711981899777,950783972,repbera,Hootsuite,2014-04-29 15:02:59,1,0,Meet Ann and Becca: A Citrus Heights couple who needed help getting their marriage recognized. More: http://t.co/KC0oNBH7Hv,,,,,
460890099027546112,950783972,repbera,Hootsuite,2014-04-28 21:15:37,6,1,On Holocaust Remembrance Day we honor the memories of the millions killed during one of the darkest periods in human history.  #neverforget,,,,,
460857145396039680,950783972,repbera,Hootsuite,2014-04-28 19:04:40,6,3,Congrats to Mira Loma High School’s team that just won the 2014 U.S. Department of Energy National Science Bowl! http://t.co/D4mTqYLTmE,,,,,
460827891744669696,950783972,repbera,Hootsuite,2014-04-28 17:08:25,1,0,Vote for your favorite art piece in this year’s Congressional Art Competition: http://t.co/dMeaiCOxvH,,,,,
460448661294817280,950783972,repbera,Hootsuite,2014-04-27 16:01:30,4,0,Thanks to all the volunteers who came out yesterday at the ReImagine Mack Road Day of Community Service! http://t.co/55Hpotqueb,,,,,
460192869048143872,950783972,repbera,Hootsuite,2014-04-26 23:05:04,3,1,Celebrated the new gate arrival for the Folsom Dam project this morning. http://t.co/vjyzjGUDRN,,,,,
460186269277257728,950783972,repbera,Hootsuite,2014-04-26 22:38:51,3,1,Had fun at the Folsom Dam today with Col. Farrel #selfie @USACESacramento http://t.co/IUkHLi2UXh,,,,,
459536407816450048,950783972,repbera,Twitter Web Client,2014-04-25 03:36:32,4,0,Have old medications? Taking back old prescriptions can save lives. Learn more in @thehill: http://t.co/egOrSSp9aE http://t.co/dAv7hXB8Jw,,,,,
458679964531830784,950783972,repbera,Twitter Web Client,2014-04-22 18:53:20,2,1,"We’re blessed to live in an area w/ rich natural beauty. On this #EarthDay, let’s recommit to protecting it. http://t.co/3qjxMl14SO",,,,,
458347561154117632,950783972,repbera,Twitter Web Client,2014-04-21 20:52:29,3,1,Need help w/ fed govt? Visit the Elk Grove Library tomorrow from 10AM to 12PM for assistance. http://t.co/63M9JjeaEd http://t.co/wn1jUFCQp8,,,,,
458292231951368192,950783972,repbera,Twitter Web Client,2014-04-21 17:12:37,2,2,My thoughts are with the people of Boston today. #BostonStrong,,,,,
457659562560995328,950783972,repbera,Twitter Web Client,2014-04-19 23:18:37,5,1,Meet Jon: A small business owner pursuing the American Dream. See how my office helped him: http://t.co/KC0oNBH7Hv http://t.co/BQ9PF9vtGT,,,,,
457599375888625664,950783972,repbera,Twitter for iPhone,2014-04-19 19:19:27,5,1,Attention #CA7 high school students: Time is running out! Enter House App Contest by 4/30/14: http://t.co/YLYVDW7oXA http://t.co/zgetT6rXZK,,,,,
457277586016833536,950783972,repbera,Hootsuite,2014-04-18 22:00:46,4,0,Last Friday I sent an email update on why I declined my 2013 pension. Don’t miss out on future updates – join now: http://t.co/LoWXcIphXb,,,,,
457254793816571905,950783972,repbera,Twitter Web Client,2014-04-18 20:30:12,2,1,Do you have unused or expired prescriptions? Dispose them on 4/26/14 – National Prescription Drug Take-Back Day! http://t.co/aoqAMuphYR,,,,,
456913963897589760,950783972,repbera,Twitter Web Client,2014-04-17 21:55:52,3,0,Good luck Phoenix Fury Lego Robotics team! Folsom students competing in national robotics competition: http://t.co/1Bwx7THS12 @sacbee_news,,,,,
455817250306400256,950783972,repbera,Twitter Web Client,2014-04-14 21:17:55,8,5,Thx @alzassociation &amp; Sac. County residents Linda Rodenzo &amp; Harold Rosenblume for coming by my Washington office. http://t.co/ThSDaA3b8F,,,,,
455483115512037376,950783972,repbera,Twitter Web Client,2014-04-13 23:10:11,3,1,"Meet Eugene: No matter how hard he tried, he couldn’t get a passport. Then he got in touch with my staff: http://t.co/Az8pzrwKiu",,,,,
455075041198092289,950783972,repbera,Twitter Web Client,2014-04-12 20:08:39,4,3,Great seeing a group of students in the U.S. Capitol from Presentation School in Arden Arcade! http://t.co/TYOEyIL9L7,,,,,
454739023735832576,950783972,repbera,Twitter Web Client,2014-04-11 21:53:26,2,0,Drop by the Folsom Public Library tomorrow to get help w/ the fed. govt – my staff will be there from 2-5 pm. http://t.co/4Xfyeif1Xy,,,,,
454682801510821890,950783972,repbera,Twitter Web Client,2014-04-11 18:10:02,2,4,My heart goes out to those involved in yesterday’s terrible bus crash on I-5 and their families. http://t.co/yl80NB65b8,,,,,
454379908257837056,950783972,repbera,Twitter Web Client,2014-04-10 22:06:26,6,3,"Family planning &amp; contraception is key to helping women succeed, both at home and abroad. http://t.co/QtJP5A2ADk cc: @HFACDemocrats",,,,,
454343367434850304,950783972,repbera,Twitter Web Client,2014-04-10 19:41:14,2,1,Glad Gold  River Resident 4-H Student Ambassador Rachel Ricchiuto was able to drop by my Washington office. http://t.co/M0WspQ0kw4,,,,,
453932153127317504,950783972,repbera,Twitter Web Client,2014-04-09 16:27:13,2,1,Glad the Administration is reversing Medicare Advantage cuts to protect Sac. County seniors. http://t.co/BHahtnPmAi,,,,,
453645822261862400,950783972,repbera,Twitter Web Client,2014-04-08 21:29:27,5,0,Closing the wage gap would mean CA women &amp; families could pay 7 more months of rent. #NoMadMenPay #WomenSucceed,,,,,
453601471654023168,950783972,repbera,Twitter Web Client,2014-04-08 18:33:13,0,0,Fact: Closing the wage gap would mean 59 more weeks of food for CA women &amp; their families. #NoMadMenPay #WomenSucceed,,,,,
453593832698171392,950783972,repbera,Twitter Web Client,2014-04-08 18:02:51,2,0,RT if you think it’s time to pass #PayCheckFairnessAct!  #NoMadMenPay #WomenSucceed,,,,,
453575783303618560,950783972,repbera,Twitter Web Client,2014-04-08 16:51:08,0,1,CA women &amp; families lose over $37 billion a year because of discriminatory wage gap. #NoMadMenPay #WomenSucceed,,,,,
452868965300441088,950783972,repbera,Hootsuite,2014-04-06 18:02:29,4,1,Ensuring #WomenSucceed requires educating boys early on importance of equality. http://t.co/8OMegeFKez  cc: @HFACrepublicans @HFACDemocrats,,,,,
452596773685833728,950783972,repbera,Hootsuite,2014-04-06 00:00:54,3,1,Great ‘Day of Play’ in Hagan Park! As a doctor I love talking to kids about the importance of exercise &amp; eating well http://t.co/sCKpsvCtne,,,,,
452574140667809792,950783972,repbera,Hootsuite,2014-04-05 22:30:58,2,2,Thank you to all the volunteers who joined me today in helping to clear debris &amp; trash along the American River Pkwy http://t.co/vFadL1Dbma,,,,,
452549778212413440,950783972,repbera,Hootsuite,2014-04-05 20:54:09,2,1,Enjoyed spending time with the Rancho Cordova volunteers this morning to clean up Folsom Blvd.! http://t.co/rJpMEZFb2K,,,,,
452538604326096896,950783972,repbera,Twitter Web Client,2014-04-05 20:09:45,4,1,"Tax tip: If you make 58k or less, visit http://t.co/sWtbmmGXgs to prepare &amp; e-file your federal tax return for free! http://t.co/3Htkz2CLhX",,,,,
452210707581661185,950783972,repbera,Twitter for iPhone,2014-04-04 22:26:49,4,1,Congratulations to Sunil Sabharwal for being nominated to US Alternate Executive Director at @IMFNews. http://t.co/cariqgv87z cc: @CAPAC,,,,,
452207489094660096,950783972,repbera,Twitter Web Client,2014-04-04 22:14:02,5,5,Had fun meeting Jimmy - a Sochi rescue dog- at the @ASPCA #Paws4Love event today. http://t.co/TGahmWYu82,,,,,
452131875658543104,950783972,repbera,Twitter Web Client,2014-04-04 17:13:34,3,1,Honored to meet w/ CA Lutheran Bishop Guy Erwin – 1st Native American &amp; openly gay bishop in his denomination. http://t.co/VtCy4jMdx0,,,,,
451876876936835073,950783972,repbera,Hootsuite,2014-04-04 00:20:17,3,3,Local filmmaker made this amazing video of Sacramento region – from 20k still pics. More in @Sactownmagazine: http://t.co/gsd2iJQLCC,,,,,
451826562501849088,950783972,repbera,Twitter Web Client,2014-04-03 21:00:21,1,2,Congrats Eric Cahill and Megan Murphy – two new @ucdavis #STEM graduates! http://t.co/WSKc13DYuR,,,,,
451758978893348864,950783972,repbera,Twitter Web Client,2014-04-03 16:31:48,3,0,Meet Shelly: A daughter who needed help getting her mom her Social Security. See how my office helped them: http://t.co/Az8pzrwKiu,,,,,
451528664568446976,950783972,repbera,Twitter Web Client,2014-04-03 01:16:37,7,3,Pleased to see reps from Sac. area flood control &amp; work w/ them to strengthen flood protection for Sac. County. http://t.co/abSKcj5TIN,,,,,
450798442739036161,950783972,repbera,Twitter Web Client,2014-04-01 00:54:59,4,1,Congrats to Franklin High School students for winning entries in @cspan @StudentCam contest: https://t.co/PI2emLo1eq http://t.co/lucCupvYQL,,,,,
450365709483540480,950783972,repbera,Hootsuite,2014-03-30 20:15:27,2,0,Did you know taxpayers still haven’t claimed $760 million in 2010 refunds? Claim yours today! Learn more: http://t.co/W593hQC6yu,,,,,
450335516152827904,950783972,repbera,Hootsuite,2014-03-30 18:15:28,2,1,Great seeing Folsom Mayor Kerri Howell in my Washington office this week! http://t.co/XRwPtveWqJ cc: @FolsomCityHall,,,,,
450033568962850816,950783972,repbera,Hootsuite,2014-03-29 22:15:38,5,0,Great news: Verizon Wireless is hiring 50 new employees for its Rancho Cordova call center! http://t.co/LReEQ7sVpd cc: @Sacbiz #CA7,,,,,
449992265558392832,950783972,repbera,Hootsuite,2014-03-29 19:31:31,5,1,"When Women Succeed, America Succeeds. Learn more in my @FolsomTelegraph op-ed:  http://t.co/BVR7LuObiZ #WomenSucceed",,,,,
449693860219088896,950783972,repbera,Hootsuite,2014-03-28 23:45:45,3,1,Pleased @USACEHQ is no longer requiring trees be removed from our local levees: http://t.co/ZIbgjveJhX cc: @Sacbee_news,,,,,
449628620659896320,950783972,repbera,Hootsuite,2014-03-28 19:26:31,3,2,Glad to have @Cardiology fellows @mwcullen &amp; @jeffreygeske drop by my DC office this week. http://t.co/VSXMVu1HMj,,,,,
449307420452720640,950783972,repbera,Twitter Web Client,2014-03-27 22:10:11,3,2,Sent back 2013 pension - I’m not taking a congressional pension until Medicare &amp; Social Security are secure: http://t.co/8SnTBW1mkM,,,,,
449017041538646017,950783972,repbera,Twitter Web Client,2014-03-27 02:56:19,3,0,Proud to go to @PPact's Natl. Conference reception &amp; help recognize women’s health care leaders! cc: @ippf http://t.co/ktZfWpAzTb,,,,,
448973366779969536,950783972,repbera,Hootsuite,2014-03-27 00:02:46,2,0,Discussed how to keep U.S. most innovative economy in Science Cmte today: http://t.co/b7HzpS4O9c  cc: @SciCmteDems @HouseScience,,,,,
448930041775538176,950783972,repbera,Hootsuite,2014-03-26 21:10:37,1,2,Honored to receive @HealthInFocus Champion of Healthcare Innovation award today! http://t.co/bGvN8z414n,,,,,
448922037730701312,950783972,repbera,Twitter Web Client,2014-03-26 20:38:49,3,4,.I wish honorary @NoLabelsOrg Co-Chair @JonHuntsman a very happy birthday today! #FixNotFight #ProblemSolver,,,,,
448589054091984896,950783972,repbera,Hootsuite,2014-03-25 22:35:39,18,7,Thinking of @Keithknappjr and Mikaela from Folsom today. Learn more about their story here: http://t.co/Jx7gOku8G9 #wegotthis,,,,,
448583894464724992,950783972,repbera,Hootsuite,2014-03-25 22:15:09,5,5,.@keithknappjr – Glad to have the chance to speak w/ you today. My heart goes out to you &amp; Mikaela. #wegotthis,,,,,
448579171640684545,950783972,repbera,Twitter Web Client,2014-03-25 21:56:23,1,3,It was great to see you this morning! MT @bananababe44: Thanks for coming to the rally! #NotMyBossBusiness http://t.co/hKFGs7RW4h,,,,,
448570692884520960,950783972,repbera,Twitter Web Client,2014-03-25 21:22:41,1,0,"Instead of voting on bills that threaten communities w/ toxic waste, we must focus on jobs – especially for veterans. http://t.co/kim6KGxDfI",,,,,
448517715225886720,950783972,repbera,Twitter Web Client,2014-03-25 17:52:11,7,3,"#SCOTUS heard #HobbyLobby case today, &amp; I stand w/ 99% of  U.S. women who've used birth control #NotMyBossBusiness http://t.co/rN6i329bMz",,,,,
448502169722167296,950783972,repbera,Twitter Web Client,2014-03-25 16:50:24,3,2,Thanks to all rallying at SCOTUS to keep women’s health choices in exam room &amp; out of boardroom. #NotMyBossBusiness https://t.co/tHPIZQTbdu,,,,,
448455418604294144,950783972,repbera,Twitter Web Client,2014-03-25 13:44:38,6,3,Stood outside SCOTUS this morning w/ @PPActionCA’s Kathy Kneer &amp; @ACOGNews’s Dr. Jeanne Conry. #NotMyBossBusiness http://t.co/ub5NC9F7j1,,,,,
448268518031495168,950783972,repbera,Twitter Web Client,2014-03-25 01:21:57,3,2,Great to see CA community colleges are making a comeback. No one should be denied college b/c they can’t afford it. http://t.co/9bAjYddePl,,,,,
447825796477247488,950783972,repbera,Hootsuite,2014-03-23 20:02:44,2,0,"Need help w/ your taxes? Last tax workshop on Tuesday, 4-7pm at Orangevale library. RSVP: http://t.co/GcLnQoHm7Y",,,,,
446783782532972544,950783972,repbera,Hootsuite,2014-03-20 23:02:09,2,0,Thanks to our panelists for their time at our Tax Workshop yesterday. RSVP for next workshop: http://t.co/GcLnQoHm7Y...,,,,,
446770728323809280,950783972,repbera,Hootsuite,2014-03-20 22:10:16,2,0,.@SacBee_news: New @SiemensUSA contract = 32 locomotives assembled in Sac. County! http://t.co/MxKnFFya3Y  http://t.co/ByLUIQADhE,,,,,
446391429397372928,950783972,repbera,Twitter Web Client,2014-03-19 21:03:05,0,0,Privileged to tour SearchPro Staffing – great local small business founded and owned by women. #WomenSucceed http://t.co/BTXWC69bFK,,,,,
446337026845990913,950783972,repbera,Twitter Web Client,2014-03-19 17:26:54,4,0,Urging @WhiteHouse to ban employment discrimination against #LGBT Americans by federal contractors. http://t.co/lRSH8gZC1Q,,,,,
446047239035961345,950783972,repbera,Twitter Web Client,2014-03-18 22:15:23,2,1,Don’t forget – first tax assistance workshop at 5 PM today. Space is limited – RSVP now: http://t.co/GcLnQoHm7Y,,,,,
445692692958171137,950783972,repbera,Twitter Web Client,2014-03-17 22:46:33,3,0,Great hearing from @intel employees at their town hall in Folsom today! http://t.co/TTE87S72el,,,,,
445356527323316224,950783972,repbera,Twitter Web Client,2014-03-17 00:30:45,4,0,Great seeing the team from @SMUDUpdates in my Washington office. http://t.co/cGcn56d4GQ,,,,,
444597294886031360,950783972,repbera,Twitter Web Client,2014-03-14 22:13:49,4,1,Did you know I have an e-newsletter? My e-mail updates are a great way for us to stay in touch. Join now: http://t.co/LoWXcIphXb,,,,,
444239454572912640,950783972,repbera,Twitter for iPhone,2014-03-13 22:31:54,2,1,Don’t forget to RSVP for one of my office’s free tax assistance workshops – beginning next week! http://t.co/eu4ILHWj0c,,,,,
444158372481630208,950783972,repbera,Twitter Web Client,2014-03-13 17:09:42,74,33,"Women, not their bosses or politicians, should be in charge of personal health care decisions. #NotMyBossBusiness http://t.co/QuLSPqRpkE",,,,,
443901795757486080,950783972,repbera,Hootsuite,2014-03-13 00:10:10,3,0,Got to meet with team from @AerojetRdyne today. Proud to work w/ them to help grow our local economy!  http://t.co/lWdxPCo5EC #CA7,,,,,
443864930400612352,950783972,repbera,Twitter Web Client,2014-03-12 21:43:40,5,1,Thanks @SARTA_tech for showing why Sacramento County is such a great place to work &amp; start a business! http://t.co/mZyzom0H4o #CA7,,,,,
443547868625133568,950783972,repbera,Twitter Web Client,2014-03-12 00:43:47,5,1,Join me Saturday for my Women and Families Economic Agenda forum in Rancho Cordova. #WomenSucceed RSVP: http://t.co/YMfkkByYWx,,,,,
443195775158583296,950783972,repbera,Twitter Web Client,2014-03-11 01:24:41,2,0,Don’t forget – first office hours dedicated to veterans is tomorrow at the Southgate branch library. Details &amp; RSVP: http://t.co/4Xfyeif1Xy,,,,,
442736904388485121,950783972,repbera,Hootsuite,2014-03-09 19:01:18,3,1,Veteran who needs help w/ backlogged benefits? Come to my 1st office hours dedicated to veterans on 3/11/2014: http://t.co/wcFehEfzcB,,,,,
442479949434609664,950783972,repbera,Hootsuite,2014-03-09 02:00:15,5,2,Let's continue the march towards equality for all this #IWD14! http://t.co/0DycKblRp1,,,,,
442460626003435520,950783972,repbera,Twitter Web Client,2014-03-09 00:43:28,7,0,"Urged congressional leadership to again extend unemployment insurance, including for the 200k veterans who need it: http://t.co/qdYCW2xLMS",,,,,
442109979722784769,950783972,repbera,Hootsuite,2014-03-08 01:30:07,4,2,Proud to have voted for bipartisan reauthorization of Violence Against Women Act 1 year ago today – see me speak in favor of bill:...,,,,,
442102813804732416,950783972,repbera,Hootsuite,2014-03-08 01:01:39,5,2,"This Intl. Women’s Day, the #WorldWeWant promotes equal access to healthcare regardless of gender, race, or sexual identity #IWD14 cc:...",,,,,
442095105563193344,950783972,repbera,Hootsuite,2014-03-08 00:31:01,4,1,Urging @AmbassadorPower this #IWD14 to make the US a leader in promoting reproductive health rights worldwide cc: @ppglobal #WorldWeWant,,,,,
442091438969724928,950783972,repbera,Twitter Web Client,2014-03-08 00:16:27,4,0,Need help w/ your taxes? Come to one of my office’s free tax assistance workshops! RSVP: http://t.co/eu4ILHWj0c,,,,,
441757155520049152,950783972,repbera,Twitter Web Client,2014-03-07 02:08:08,5,3,Was excited to join @AOAforDOs for #DODay2014 earlier today. Great seeing Sac County resident Jeremy Berger there! http://t.co/nb57j2ZJNp,,,,,
441398967180345344,950783972,repbera,Twitter Web Client,2014-03-06 02:24:49,7,2,Proud to host briefing w/ @ppglobe &amp; @RepKarenBass on importance of international family planning. http://t.co/jnQ1dqGKyV,,,,,
441394834302304257,950783972,repbera,Twitter Web Client,2014-03-06 02:08:23,0,1,@konradng - Thanks so much for your birthday message!,konradng,440348056832069632,,,
441335007479861248,950783972,repbera,Hootsuite,2014-03-05 22:10:40,1,1,Thx @acognews &amp; @healthinfocus for partnering w/ @RepAndyBarr &amp; I to support #SavingLivesSavingCosts. http://t.co/JId5x4KdL4,,,,,
441325464934952960,950783972,repbera,Twitter Web Client,2014-03-05 21:32:44,2,0,RT @HealthInFocus: HLC Endorses Bipartisan Legislation Creating Patient-Centered Medical Liability Reforms http://t.co/7Cyb68H2VS #SavingLi…,,,441255204051496961,43888471,HealthInFocus
441317957244043264,950783972,repbera,Hootsuite,2014-03-05 21:02:54,2,2,Honored to join w/ @RepAndyBarr &amp; on new #SavingLivesSavingCosts bill to improve patient care &amp; lower costs. http://t.co/JId5x4KdL4,,,,,
441294781663424512,950783972,repbera,Twitter Web Client,2014-03-05 19:30:49,3,0,RT @RepAndyBarr: There’s nothing partisan ab finding practical #solution 2 improving patient outcomes @RepBera #SavingLivesSavingCosts http…,,,441264554912137219,1089334250,RepAndyBarr
441011486438473729,950783972,repbera,Hootsuite,2014-03-05 00:45:06,4,0,Great chatting w/ @SACOG on revitalizing local infrastructure to create jobs &amp; move Sac. County forward. http://t.co/QSiqGvem0l,,,,,
440987143326801920,950783972,repbera,Twitter Web Client,2014-03-04 23:08:23,2,0,Terrific meeting w/ Dr. Jeanne Conry of @ACOGNews – always honored work w/ them to defend women’s health rights. http://t.co/8cAYW9cgR2,,,,,
440568705596919809,950783972,repbera,Twitter Web Client,2014-03-03 19:25:39,3,0,Need help w/ fed govt? Staff will be at Rancho Cordova library on 9845 Folsom Blvd tomorrow from 12-2pm. http://t.co/H27DmFXJYN,,,,,
440206747580788736,950783972,repbera,Twitter for iPhone,2014-03-02 19:27:21,4,0,Thanks @WhipHoyer @NoLabelsOrg @RepSinema for your birthday well wishes!,,,,,
439869328734035969,950783972,repbera,Twitter Web Client,2014-03-01 21:06:35,4,3,.@sacbee_news has article on my work fighting for Sac. County families over last year. It's an honor to serve you. http://t.co/6ZzoJuM164,,,,,
439785327067418624,950783972,repbera,Twitter Web Client,2014-03-01 15:32:47,4,0,"If you need help with the fed govt, my staff will be at Franklin branch library in Elk Grove today at 11 AM. More: http://t.co/H3TVTOpqgd",,,,,
439459936670859264,950783972,repbera,Twitter Web Client,2014-02-28 17:59:48,4,0,"Staff will be at the Franklin branch library tomorrow to help you fix VA benefits, Social Security &amp; more! Details: http://t.co/H3TVTOpqgd",,,,,
439207175303725056,950783972,repbera,Hootsuite,2014-02-28 01:15:25,2,0,.@FolsomTelegraph has an article this week on two local businesses I visited that are being impacted by the #drought: http://t.co/cbK3QK2Mm5,,,,,
439168565095444480,950783972,repbera,Twitter Web Client,2014-02-27 22:41:59,1,1,Honored @smithsonian is including my congressional record statement in their new “Beyond Bollywood” exhibit: http://t.co/uIqQsDalQk,,,,,
438859232893747200,950783972,repbera,Twitter Web Client,2014-02-27 02:12:49,9,1,Participated in @smithsonian ribbon cutting of Beyond Bollywood Exhibit.  Photos: http://t.co/BkDO0yeQ7u,,,,,
438799263447793664,950783972,repbera,Twitter Web Client,2014-02-26 22:14:31,4,4,Great seeing @SacState President Alexander Gonzalez &amp; the Sac State team in Washington D.C. today! Go hornets! http://t.co/x13Umn6ulT,,,,,
438440636052959232,950783972,repbera,Twitter Web Client,2014-02-25 22:29:28,3,0,.@thehill has great article on how my work w/ @RepChrisGibson coauthoring Health Care for Heroes Act to help vets: http://t.co/cobYTQddB3,,,,,
438116484829941760,950783972,repbera,Hootsuite,2014-02-25 01:01:24,4,0,.@sacbee_news shows how damaging drought is to CA agriculture: http://t.co/QE7yZfG46q. Farmers: Visit http://t.co/Wy3zPeyimO for help.,,,,,
438067593761804290,950783972,repbera,Twitter Web Client,2014-02-24 21:47:07,5,1,How should we cut spending and save taxpayer money? Take my survey now: http://t.co/LHo1RYBS9Q,,,,,
437755452995039232,950783972,repbera,Twitter Web Client,2014-02-24 01:06:47,6,1,Visited local farms to see how our drought is impacting Sacramento County: http://t.co/ey97HGUmla http://t.co/mzwUMhqr3j,,,,,
436669121607262208,950783972,repbera,Hootsuite,2014-02-21 01:10:06,4,0,#ICYMI: @CBSSacramento aired story on my office’s drought resources workshop – call (916) 635 0505 if you need help. http://t.co/bLBN7R7CSr,,,,,
436551874959785984,950783972,repbera,Twitter Web Client,2014-02-20 17:24:12,1,2,Great job-seekers resources for re-entering the workforce or just starting. http://t.co/a46ajswNC9 http://t.co/RI5U4UyiXb,,,,,
