id,user_id,screen_name,source,created_at,retweet_count,favorite_count,text,in_reply_to_screen_name,in_reply_to_status_id,retweeted_status_id,retweeted_status_user_id,retweeted_status_screen_name
353276084411854848,950783972,repbera,Twitter Web Client,2013-07-05 22:15:56,1,1,Humbled to help honor some new military recruits last night at the Folsom Pro Rodeo. http://t.co/nzH20tFtcP,,,,,
352965943095341056,950783972,repbera,Twitter Web Client,2013-07-05 01:43:33,1,1,Had wonderful time greeting and listening to local community members this #IndependenceDay. Pictures: http://t.co/S6A044J6h9,,,,,
352903013964341248,950783972,repbera,Twitter Web Client,2013-07-04 21:33:30,2,0,Had terrific time at the Carmichael 4th of July parade. Hope you &amp; your family are having a great #IndependenceDay! http://t.co/lnHKTaZ8mm,,,,,
352835470641729539,950783972,repbera,Twitter for iPhone,2013-07-04 17:05:06,1,0,Getting ready for 55th Carmichael Elks Parade! Pleasure meeting w/ volunteers who make it great. http://t.co/0PP3aXgOy8,,,,,
352824146071265280,950783972,repbera,Twitter Web Client,2013-07-04 16:20:06,1,1,Having fun at Carmichael Kiwanis Club 4th of July Pancake Breakfast! Always great seeing our community come together. http://t.co/trUip3lu0A,,,,,
352809427277070336,950783972,repbera,Twitter Web Client,2013-07-04 15:21:37,3,3,"Happy 4th of July! Let’s appreciate enormous sacrifices of our men &amp; women in uniform, and the values they defend that make America great.",,,,,
352591325239066626,950783972,repbera,Twitter Web Client,2013-07-04 00:54:57,3,1,"Thx @SYMVCD for protecting health from West Nile &amp; other mosquito borne diseases. As a doctor, I appreciate it. http://t.co/0YuQUTqnso",,,,,
352579543934058496,950783972,repbera,Twitter Web Client,2013-07-04 00:08:08,1,1,My pleasure – thanks for having me! MT @Plates_Cafe – Thx for stopping by @RepBera. We value your support. http://t.co/WM7noMda0N,,,,,
352564353087725568,950783972,repbera,Twitter for iPhone,2013-07-03 23:07:46,3,0,Continued Congress at Your Company tour at CleanWorld – leader in clean energy that helps w/ climate change. http://t.co/hE7nRy22r0,,,,,
352518582632071168,950783972,repbera,Twitter Web Client,2013-07-03 20:05:54,2,0,Visited w/ Aerojet RocketDyne as part of my Congress at Your Company tour of #CA7 businesses this week. Picts: http://t.co/FrTGOL4o9J,,,,,
352490062128222208,950783972,repbera,Twitter Web Client,2013-07-03 18:12:34,0,0,#ICYMI: Great catching up w/ @News10_CA - chatted about my Congress at Your Company visits of #CA7 businesses. http://t.co/ijPCQL3ZcW,,,,,
352429181847601153,950783972,repbera,Hootsuite,2013-07-03 14:10:39,0,0,"As our economy slowly recovers, we need to take the time to make sure ACA implementation doesn't send us backwards: http://t.co/pHz3s5T1ef",,,,,
352222532495081473,950783972,repbera,Twitter Web Client,2013-07-03 00:29:30,1,1,Continued Congress at Your Company tour at RCS Tech. in Rancho Cordova. Discussed ways to save energy &amp; create jobs. http://t.co/50K4gVH9Jf,,,,,
352186421353783297,950783972,repbera,Hootsuite,2013-07-02 22:06:00,6,2,On the 49th anniversary of the Civil Rights Act let's remember those who've fought for civil rights and equality. http://t.co/C6WIIq1KyL,,,,,
352160389313724416,950783972,repbera,Twitter Web Client,2013-07-02 20:22:34,0,1,Enjoyed volunteering @EGFoodBank today to help our neighbors in need. http://t.co/xuBya0n2xP,,,,,
352154204657315840,950783972,repbera,Twitter Web Client,2013-07-02 19:57:59,0,0,Wonderful time at @Rancho_Cordova 10th anniversary last night – proud to present Mayor Budge w/ congrats resolution. http://t.co/7jx42H0Jt6,,,,,
352090821870354434,950783972,repbera,Twitter Web Client,2013-07-02 15:46:08,3,0,Tune into Sacramento @News10_CA at 9 AM to watch my morning interview with Dan Elliott &amp; @KebaArnold. #CA7,,,,,
351857802890858496,950783972,repbera,Twitter Web Client,2013-07-02 00:20:12,1,0,Pleasure visiting @SiemensUSA in Florin today – great seeing one of our local major economic engines up close! http://t.co/pOKoh9EYSR,,,,,
351811218249498624,950783972,repbera,Twitter Web Client,2013-07-01 21:15:05,5,0,Needless politics shouldn’t force students to pay more for their loans. Tell me what you think: http://t.co/47jlNPirQT #DontDoubleMyRate,,,,,
351806196434468864,950783972,repbera,Twitter Web Client,2013-07-01 20:55:08,0,0,"@smithkimh I appreciate your kind words. But more importantly, thx for your support for moving past partisanship. #FixNotFight",smithkimh,351439396349812738,,,
351806076729040896,950783972,repbera,Twitter Web Client,2013-07-01 20:54:39,0,0,"@PamelaButler3 I appreciate your kind words. But more importantly, thx for your support for moving past partisanship. #FixNotFight",PamelaButler3,351465483167477761,,,
351805991907639296,950783972,repbera,Twitter Web Client,2013-07-01 20:54:19,0,0,"@MaureenAtGSDM I appreciate your kind words. But more importantly, thx for your support for moving past partisanship. #FixNotFight",MaureenAtGSDM,351538416753721344,,,
351805800592838656,950783972,repbera,Twitter Web Client,2013-07-01 20:53:33,0,0,"@dbinghamesq  I appreciate your kind words. But more importantly, thx for your support for moving past partisanship. #FixNotFight",dbinghamesq,351545473615675392,,,
351805733874053121,950783972,repbera,Twitter Web Client,2013-07-01 20:53:17,0,0,"@SchweizerJ I appreciate your kind words. But more importantly, thx for your support for moving past partisanship. #FixNotFight",SchweizerJ,351726050604093440,,,
351805591267704832,950783972,repbera,Twitter Web Client,2013-07-01 20:52:43,0,0,"@jeanieya I appreciate your kind words. But more importantly, thx for your support for moving past partisanship. #FixNotFight",jeanieya,351768517336498176,,,
351804918383915009,950783972,repbera,Twitter Web Client,2013-07-01 20:50:03,2,1,Thank YOU for being a leader on getting past partisanship. MT @MarkMNoLabels: Thx for being a Problem Solver! http://t.co/pEHH0jSCOn,,,,,
351791334736146435,950783972,repbera,Twitter Web Client,2013-07-01 19:56:04,2,0,Over 100 degrees in Sacramento this week - stay cool &amp; stay healthy! See @sacbee_news on how to beat the heat: http://t.co/eFyYNbjFyU,,,,,
351784478168989696,950783972,repbera,Twitter Web Client,2013-07-01 19:28:50,0,0,Meeting w/ ppl at @SiemensUSA &amp; Aerojet Rocketdyne in #CA7 today. 2 crucial local job creation engines – looking fwd to hearing from them!,,,,,
351037153846902784,950783972,repbera,Hootsuite,2013-06-29 17:59:14,6,1,"Congrats to Nikola Simmersbach and Diana Luiz, the first Sacramento County same sex couple to wed! http://t.co/KDBOMi45cd",,,,,
350713048140488704,950783972,repbera,Twitter Web Client,2013-06-28 20:31:21,2,0,Student loan rates set to double in just days – but congressional leadership adjourns. Exactly what’s wrong with D.C. #DontDoubleMyRate,,,,,
350697336600657921,950783972,repbera,Hootsuite,2013-06-28 19:28:55,2,0,"Next week, I'll be touring innovative businesses in #ca7 on my Sacramento County Congress at Your Company tour: http://t.co/2hrmQGlJZO",,,,,
350424287569657856,950783972,repbera,Twitter Web Client,2013-06-28 01:23:55,7,0,Thanks for sharing your thoughts on #DontDoubleMyRate! I’m going to make sure Congress hears from you on this. http://t.co/7gxRwrWGKo,,,,,
350374904224432128,950783972,repbera,Twitter Web Client,2013-06-27 22:07:41,0,0,Share your story! Fed. Student loan rates set to double in less than a week! Will you be impacted? http://t.co/7gxRwrWGKo #DontDoubleMyRate,,,,,
350372576125661184,950783972,repbera,Twitter Web Client,2013-06-27 21:58:26,4,1,Urging @JerryBrownGov to induct trailblazer Rep. Dalip Singh Saund into CA hall of fame. http://t.co/gT72wVIB1X,,,,,
350352205934632963,950783972,repbera,Twitter Web Client,2013-06-27 20:37:29,4,0,Unacceptable. Students owe $1 trillion in loan debt &amp; rates are set to double Monday. Tell me what you think: http://t.co/7gxRwrWGKo,,,,,
350308437940383744,950783972,repbera,Twitter Web Client,2013-06-27 17:43:34,0,0,Coming up soon: Federal student loan rates set to double Monday! What do you think? How will you be affected? http://t.co/7gxRwrWGKo,,,,,
350294251478851584,950783972,repbera,Twitter Web Client,2013-06-27 16:47:12,0,0,Share your story – Rates on federal student loans set to double by Monday. How does this affect you &amp; loved ones? http://t.co/7gxRwrWGKo,,,,,
350007986149789696,950783972,repbera,Twitter Web Client,2013-06-26 21:49:41,1,0,Great seeing Alexis Andrews in D.C. - #CA7 Congressional Art Competition winner. Her art now hangs in U.S. Capitol. http://t.co/psiMUWPLBN,,,,,
349999343505391617,950783972,repbera,Hootsuite,2013-06-26 21:15:20,4,1,Introduced bipartisan legislation today to address doctor shortage &amp; visa process w/ @RepMarkMeadows: http://t.co/orHjzApYsi,,,,,
349964184588533761,950783972,repbera,Twitter Web Client,2013-06-26 18:55:38,1,0,.@emmy03sayd – Great question. Call your Congressmember &amp; demand action! We answer to you. http://t.co/grM9KtKzJl #AskDems,,,,,
349959370865516545,950783972,repbera,Twitter Web Client,2013-06-26 18:36:30,2,0,.@ColeenMonroe – Always good to work in bipartisan way. Just intro. bill w/ @RepMarkMeadows to reform immigrant visas http://t.co/CiWOeHCKAF,,,,,
349932341680013312,950783972,repbera,Twitter Web Client,2013-06-26 16:49:06,1,0,Twitter town hall today – Join me &amp; @HouseDemocrats at 11 AM PST on preventing student loan rates from doubling. #DontDoubleMyRate #AskDems,,,,,
349917811939885056,950783972,repbera,Twitter Web Client,2013-06-26 15:51:22,9,3,#MarriageEquality returns to CA! This is an incredible day. Our country is made stronger by respecting &amp; supporting all families. cc: @HRC,,,,,
349899882762481664,950783972,repbera,Twitter Web Client,2013-06-26 14:40:07,5760,0,RT @HRC: Monumental Victories: Supreme Court Strikes Down #DOMA and Return Marriage Equality to California! #Time4Marriage http://t.co/R1PW…,,,349897485814202369,19608297,HRC
349896510584012800,950783972,repbera,Twitter Web Client,2013-06-26 14:26:43,6,2,"Thrilled #SCOTUS struck down #DOMA. LGBT friends, neighbors, &amp; our country made history today. http://t.co/CUKXO07rHO cc: @HRC",,,,,
349866853813846016,950783972,repbera,Twitter Web Client,2013-06-26 12:28:52,87,0,RT @KamalaHarris: CA stands with TX women. Tweet your support to @WendyDavisTexas! @PPActionCA http://t.co/bVm6fHx8Jw,,,349692751589277698,30354991,KamalaHarris
349646736496672769,950783972,repbera,Hootsuite,2013-06-25 21:54:12,1,0,"Thanks to @elkgrovepatch &amp; participants for a great chat earlier today. If you missed it, catch the recap here: http://t.co/iwtFJYJVM1",,,,,
349605144155017216,950783972,repbera,Twitter for iPhone,2013-06-25 19:08:56,4,0,Taking part in live online chat now. Join me and ask your questions at http://t.co/Gt1u0XfTyT http://t.co/5Bi4ZwOxX3,,,,,
349601604749639680,950783972,repbera,Twitter Web Client,2013-06-25 18:54:52,0,0,Remember: Live online chat at Noon PST w/ @ElkGrovePatch @FOaksCarmPatch @CitHeightsPatch @RosemontPatch. http://t.co/MFdavKPktF,,,,,
349555530156634112,950783972,repbera,Twitter Web Client,2013-06-25 15:51:47,5,4,Proud to join w/ @HRC &amp; change my #Facebook profile picture to support #MarriageEquality. http://t.co/5DEDhNnccp http://t.co/Jw7dfV27zG,,,,,
349541254251556864,950783972,repbera,Twitter Web Client,2013-06-25 14:55:03,1569,0,RT @HRC: RT if you believe every American has the right to marry the person they love! #time4marriage http://t.co/7TXgwEReRd @HRC,,,349515598641901571,19608297,HRC
349534576323997698,950783972,repbera,Twitter Web Client,2013-06-25 14:28:31,2,0,Disappointed by #SCOTUS decision to strike down part of Voting Rights Act. We must ensure every American has a right to vote.,,,,,
349288745289256960,950783972,repbera,Twitter Web Client,2013-06-24 22:11:41,1,0,"RT @CitHeightsPatch: Tomorrow at noon, chat LIVE on #Patch with @RepBera: http://t.co/56CsR4CisV #congress",,,349250141561171969,751821192,CitHeightsPatch
349261750211854336,950783972,repbera,Twitter Web Client,2013-06-24 20:24:24,3,0,Supporting Student Loan Relief Act so federal student loan rates stay in place for 2 more years. #DontDoubleMyRate cc: @SacStateASI,,,,,
349211326733750273,950783972,repbera,Twitter Web Client,2013-06-24 17:04:03,0,0,"Excited for online chat tomorrow, Noon PST w/ @ElkGrovePatch @FOaksCarmPatch @CitHeightsPatch  @RosemontPatch. More: http://t.co/MFdavKPktF",,,,,
348854071458951168,950783972,repbera,Hootsuite,2013-06-23 17:24:26,0,2,@rajshah honored to share the award with you too!,rajshah,348437822623084545,,,
348853929544663042,950783972,repbera,Hootsuite,2013-06-23 17:23:52,9,0,RT @rajshah: Honored to have been recognized as #India Abroad Person of the year alongside @RepBera last night! #iapoy  http://t.co/Pk53dmT…,,,348437822623084545,232193350,rajshah
348510776258068480,950783972,repbera,Hootsuite,2013-06-22 18:40:18,2,1,Thanks to India Abroad for naming me Person of the Year. Congrats to all the awardees! http://t.co/cOYkFLiafI,,,,,
348194840279908352,950783972,repbera,Hootsuite,2013-06-21 21:44:53,1,1,#FF More co-sponsors and women's health champs @repswalwell @eleanornorton @cbrangel @payne10thnj @repdinatitus @repcicilline,,,,,
348194002207666176,950783972,repbera,Hootsuite,2013-06-21 21:41:33,1,1,#FF Women’s Preventive Health Awareness Campaign co-sponsors @repgwenmoore @gracenapalitano @repbarbaralee @reproybalallard @juliabrownley,,,,,
348193120023891970,950783972,repbera,Hootsuite,2013-06-21 21:38:03,2,0,#FF women's health champions&amp; co-sponsors of Women’s Preventive Health Awareness Campaign Act @louiseslaughter @repspeier @repschakowsky,,,,,
348192482913308672,950783972,repbera,Hootsuite,2013-06-21 21:35:31,3,0,Congrats to Aimee Miller from Folsom for earning @theaward Gold Medal for service! #Gold2013 http://t.co/iFeZL6zz65,,,,,
347834838016999425,950783972,repbera,Twitter Web Client,2013-06-20 21:54:22,4,0,"Thx @CecileRichards &amp; @ConryJeanne for supporting my #WomensHealth bill. As a doctor, proud to partner w/ you both http://t.co/3Qg860qWZa",,,,,
347805705694236673,950783972,repbera,Twitter Web Client,2013-06-20 19:58:36,4,0,I’m excited to introduce my new #WomensHealth bill today! I just finished signing it and am introducing it now. http://t.co/jE9Z5Zhneh,,,,,
347735090010390528,950783972,repbera,Twitter Web Client,2013-06-20 15:18:00,2,0,Disappointed Congress voted for #SnapCuts last night – Was proud to support @RepMcGovern’s #FarmBill amendment to help hungry families,,,,,
347463257235267584,950783972,repbera,Twitter Web Client,2013-06-19 21:17:50,1,0,Thx Michael Kuhlmann for your #smallbiz leadership. Residential Control Systems is a true success story. http://t.co/UQsxelELh1 #SBW2013,,,,,
347419429312815104,950783972,repbera,Twitter Web Client,2013-06-19 18:23:41,13,3,"As a doctor, I find it ridiculously ignorant to believe pregnancies from rape are “low.” Read more in @sacbee_news: http://t.co/rbtHtFP1Co",,,,,
347383338169925633,950783972,repbera,Twitter Web Client,2013-06-19 16:00:16,1,1,Thx @PPMarMonte - honored by your award. And thx to my wife &amp; daughter for accepting it for me cc: @PPact @PPActionCA http://t.co/ZJDhjtDO2R,,,,,
347123576282947584,950783972,repbera,Twitter Web Client,2013-06-18 22:48:04,3,0,RT to #StandUpForWomen. Fought #WarOnWomen bill today that robs women of their abortion rights at 20 weeks. http://t.co/bZKCc4hmZd,,,,,
347072845802778625,950783972,repbera,Twitter Web Client,2013-06-18 19:26:29,4,2,Fighting #WarOnWomen bill today that takes away women’s abortion rights at 20 weeks. http://t.co/6A1qlJT8oi cc: @PPact @NARAL @acognews,,,,,
346344630847148033,950783972,repbera,Twitter Web Client,2013-06-16 19:12:49,1,0,Trouble w/ Social Security &amp; Medicare benefits? My office can help! 916 635 0505 or http://t.co/7Lq7Sbkuli,,,,,
345925570657415168,950783972,repbera,Twitter Web Client,2013-06-15 15:27:37,1,0,Need help w/ your home loan modification? My office is here to assist you. 916 635 0505 or http://t.co/7Lq7Sbkuli,,,,,
345602663381082112,950783972,repbera,Twitter Web Client,2013-06-14 18:04:30,0,0,Happy Birthday @WhipHoyer! Thanks for all that you do - honored to work with you in Congress.,,,,,
345331821774524416,950783972,repbera,Twitter Web Client,2013-06-14 00:08:16,1,0,"Pleased that Sacramento County will receive thousands in fed. funds to help pay for cops, firefighters, &amp; schools. http://t.co/YKG5dHWenD",,,,,
345313543953997825,950783972,repbera,Twitter for BlackBerry®,2013-06-13 22:55:39,2,1,"Alarmed by Rep. Franks’ remark that rape pregnancies are “low.” As a doctor, I know this is untrue, and insulting. http://t.co/TFJ3QcyMUl",,,,,
345268131377324032,950783972,repbera,Twitter Web Client,2013-06-13 19:55:11,0,0,Congrats to the People’s Choice Award winners for the Congressional Art Competition! See the winners: http://t.co/Xs2u4QF9FE,,,,,
345240250970415107,950783972,repbera,Twitter Web Client,2013-06-13 18:04:24,2,0,RT @SethStatler: Thanks to @RepBera and the 450 Members and staff who took time today to learn about @NASA and our science programs http://…,,,344992327334498304,858672044,SethStatler
345205908340617217,950783972,repbera,Twitter Web Client,2013-06-13 15:47:56,18,0,"RT @PPact: PPFA President @CecileRichards on why available, affordable emergency contraception is wonderful news for women: http://t.co/Cnt…",,,344574982782861313,22162854,PPact
345193821350555648,950783972,repbera,Twitter Web Client,2013-06-13 14:59:55,0,0,Are you a veteran who needs help? My office has helped vets recover $75k in benefits. Call 916 635 0505 or http://t.co/7Lq7Sbkuli.,,,,,
344574475083341824,950783972,repbera,Hootsuite,2013-06-11 21:58:51,2,0,My Rancho Cordova office is here to serve you. Please always feel free to call 916 635 0505 if you need help. http://t.co/cTR9kRPfJt,,,,,
344215574055907328,950783972,repbera,Twitter Web Client,2013-06-10 22:12:42,6,2,"RT to support #EqualPayNow. 50th anniv. of Equal Pay Act, CA women still earn $7,464 less than men. We can do better. http://t.co/PEOMpFccIq",,,,,
343098536453361664,950783972,repbera,Twitter Web Client,2013-06-07 20:14:00,3,1,Congrats @john_dingell for becoming longest-serving Representative. Congress is a place for service &amp; you’re an example of that every day.,,,,,
342772568924770304,950783972,repbera,Twitter Web Client,2013-06-06 22:38:43,1,0,"Pleasure seeing @CDCGov Director Tom Frieden – good talk on how preventive care saves lives, lowers health costs. http://t.co/hsQCgDyK7v",,,,,
342080924558700544,950783972,repbera,Hootsuite,2013-06-05 00:50:22,1,1,Great seeing local 8th graders from Toby Johnson Middle School in D.C. Get help w/ your tour: http://t.co/5XE6MKN0pN http://t.co/gw3mCvWwOa,,,,,
342059466520420352,950783972,repbera,Twitter Web Client,2013-06-04 23:25:06,4,0,Proud to celebrate 150th anniversary of Swami Vivekanada – his message of religious freedom is a core American value. http://t.co/PzayRjmBsb,,,,,
341698424980242432,950783972,repbera,Twitter Web Client,2013-06-03 23:30:27,2,0,Honored to join @whitehouse conference on mental health w/ other medical experts &amp; concerned citizens. For help visit http://t.co/tg8YvP1d4c,,,,,
341283049742422016,950783972,repbera,Twitter Web Client,2013-06-02 19:59:54,3,0,Catch my @News10_CA interview on my trip to Afghanistan and the latest in Congress: http://t.co/DqqqdZ0dMW,,,,,
340606564811538432,950783972,repbera,Twitter for BlackBerry®,2013-05-31 23:11:47,2,0,Use this #FollowFriday to help #WomensHealth champions - @AcogNews @PPActionCA @PPMarMonte,,,,,
340260061635043328,950783972,repbera,Twitter for BlackBerry®,2013-05-31 00:14:55,4,0,"A special thank you to @acognews for supporting my #womenshealth bill. As a doctor, I am honored to partner w/ you.",,,,,
340230912589586432,950783972,repbera,Twitter Web Client,2013-05-30 22:19:05,3,1,Joined w/ @RepGaramendi @RepThompson @DorisMatsui @AskGeorge @RepMcNerny to speak out against flawed #BDCP. http://t.co/KKAovYy9PL,,,,,
339902940435333121,950783972,repbera,Twitter Web Client,2013-05-30 00:35:51,22,12,"As a doctor, husband, &amp; a father, thrilled to join w/ @PPActionCA &amp; @PPMarMonte to intro. my new #WomensHealth bill. http://t.co/dMLHvKgEoe",,,,,
339839250302373888,950783972,repbera,Twitter Web Client,2013-05-29 20:22:46,1,1,Proud to join w/ local veterans who completed PowerPathway – American River College’s job training program. http://t.co/i96oaLaNc0,,,,,
339822169439756288,950783972,repbera,Twitter Web Client,2013-05-29 19:14:53,1,0,Thanks Kathy &amp; @PPActionCA! MT @PPActionCA - Kathy Kneer emcees the #womenshealth rally with @RepBera http://t.co/yksgi9jjBH,,,,,
339776635387666432,950783972,repbera,Twitter Web Client,2013-05-29 16:13:57,0,1,#ICYMI: Discussed my trip to Afghanistan on @Fox40 this morning. We must support our troops when they come home. http://t.co/HNJIp5oXOp,,,,,
339476830434250752,950783972,repbera,Twitter Web Client,2013-05-28 20:22:38,2,0,Remember – Join me tomorrow to help keep women healthy! Introducing my new #WomensHealth bill. RSVP: http://t.co/Gv6MbJYnTI,,,,,
339189544249344001,950783972,repbera,Twitter Web Client,2013-05-28 01:21:03,3,1,How can Congress best serve our troops &amp; veterans? I want to hear from you! Take my #MemorialDay survey: http://t.co/3Dp5OVy2lJ,,,,,
339184625412886528,950783972,repbera,Twitter Web Client,2013-05-28 01:01:31,4,0,Humbled by enormous sacrifices of our service members this #MemorialDay. Here are some photos from Afghanistan trip: http://t.co/ITO7xhb4Va,,,,,
338796060187181056,950783972,repbera,Twitter Web Client,2013-05-26 23:17:30,11,2,"Privileged to visit troops in Afghanistan, including w/ Morgan Alcalay from Carmichael. More: http://t.co/kIeAhIe38s http://t.co/a6LE92YaGx",,,,,
338737760837984256,950783972,repbera,Twitter Web Client,2013-05-26 19:25:50,10,4,Humbled by sacrifices of men &amp; women in uniform this Memorial Day Weekend. Proud to provide @the_USO care package. http://t.co/M5Z2WhSW8f,,,,,
338458375601913857,950783972,repbera,Twitter Web Client,2013-05-26 00:55:39,3,1,Join me this Wed. for an event to keep women healthy! I’ll be introducing my new #WomensHealth bill. RSVP: http://t.co/Gv6MbJYnTI,,,,,
337948243872858112,950783972,repbera,Twitter Web Client,2013-05-24 15:08:34,8,0,Relieved no one seems to be injured from last night's quake! Make sure you &amp; your family are ready for a disaster: http://t.co/YiKfIxgTpv,,,,,
337664925377888256,950783972,repbera,Twitter Web Client,2013-05-23 20:22:46,6,0,I’m thrilled that the Senate confirmed Sri Srinivasan to the D.C. Circuit Court of Appeals today. http://t.co/b7nBxAJ55c,,,,,
337645436204630016,950783972,repbera,Twitter Web Client,2013-05-23 19:05:19,2,3,Voted against bill that would force students into loans w/ skyrocketing interest rates. http://t.co/vJT60zLMtg,,,,,
337368586450505729,950783972,repbera,Twitter Web Client,2013-05-23 00:45:13,2,0,RT @CAPAC: CAPAC: @RepMarkTakano @RepBera @RepGraceMeng @RepMikeHonda @RepBobbyScott @RepLowenthal @RepSusanDavis w/ @ArneDuncan http://t.c…,,,337333053816983553,192955168,CAPAC
337317834218684416,950783972,repbera,Twitter Web Client,2013-05-22 21:23:33,4,0,Had a wonderful time in my 1st online Congress in Your Classroom – great chat w/ high school students in Elk grove. http://t.co/Jnmyz1CuUD,,,,,
337272339173634048,950783972,repbera,Twitter Web Client,2013-05-22 18:22:46,1,2,Privileged to speak at @UCNewsroom reception last night. Proud to have earned my B.S. &amp; M.D. from @UCIrvine! http://t.co/K57WEhRmh0,,,,,
337201227806957568,950783972,repbera,Twitter Web Client,2013-05-22 13:40:12,2,0,"It was my privilege, thank you. MT @AdvocatesIM – Thanks @RepBera for speaking to us this morning. #ACPLD http://t.co/OQUTvIsOLq",,,,,
337196130184073216,950783972,repbera,Twitter Web Client,2013-05-22 13:19:56,4,0,I commend the Senate Judiciary Cmte. for passing bipartisan comprehensive immigration reform bill last night – http://t.co/UcKJGVYoDP.,,,,,
337003472421539840,950783972,repbera,Twitter Web Client,2013-05-22 00:34:23,4,0,Had thoughtful conversation today w/ @MCCtweets on importance of diversity in intl. development work &amp; #APAHM2013. http://t.co/qLXKB3Jwim,,,,,
336933972196073472,950783972,repbera,Twitter Web Client,2013-05-21 19:58:13,5,1,Proud to join fellow @NoLabelsOrg Problem Solvers last night to highlight why Congress needs to #FixNotFight. http://t.co/wDZyRdwhVt,,,,,
336884056694325250,950783972,repbera,Twitter Web Client,2013-05-21 16:39:52,3,0,Thanks for having me! MT @MCCtweets: MCC is excited to have @RepBera speak today w/ staff &amp; celebrate Asian-Pacific American Heritage Month.,,,,,
336646492477587456,950783972,repbera,Twitter Web Client,2013-05-21 00:55:53,3,0,My heart goes out to all of the Oklahoma families impacted by this horrible disaster. #PrayforOklahoma http://t.co/1vbdGnFo4u,,,,,
335931891389714433,950783972,repbera,Twitter Web Client,2013-05-19 01:36:19,1,0,Had a blast at the 45th Annual Hangtown Motocross Classic! Great seeing Host Dave Picket &amp; Gen. Anthony Jackson. http://t.co/mBRRRO3wQ5,,,,,
335926534806319104,950783972,repbera,Twitter Web Client,2013-05-19 01:15:02,3,0,Proud to support “Taste of Carmichael” to help families w/ seriously ill children &amp; adults at UC Davis Med Center. http://t.co/5NwBw7Chnq,,,,,
335521206654627840,950783972,repbera,Twitter Web Client,2013-05-17 22:24:24,11,1,"FACT: 53% of pregnant women weren’t vaccinated during 2011-2012 flu season. As a doctor, I know we can do better. #NWHW cc: @womenshealth",,,,,
335497975121985536,950783972,repbera,Twitter Web Client,2013-05-17 20:52:05,6,0,.@Amtrak rolling out its new energy efficient trains – assembled by @SiemensUSA in Sacramento! http://t.co/mSTFHHb4Np #MakeItInAmerica,,,,,
