id,user_id,screen_name,source,created_at,retweet_count,favorite_count,text,in_reply_to_screen_name,in_reply_to_status_id,retweeted_status_id,retweeted_status_user_id,retweeted_status_screen_name
555903570776948736,950783972,repbera,Hootsuite,2015-01-16 01:45:14,1,0,Expanding paid leave is critical for building an economy that works for middle class → http://t.co/PLtLaJcjj0,,,,,
555875884045836290,950783972,repbera,Hootsuite,2015-01-15 23:55:13,4,2,Great news! Local manufacturer Siemens will build 40 new light rail cars for the Bay Area: http://t.co/rTieKwHNL3 #CA07,,,,,
555842237364707328,950783972,repbera,Twitter Web Client,2015-01-15 21:41:31,2,3,"Honored to have Susan Oliver, widow of Sheriff Deputy Danny Oliver, join me as my guest to the State of the Union. http://t.co/HUVNXr9fxV",,,,,
555544279150780416,950783972,repbera,Twitter for iPhone,2015-01-15 01:57:32,4,0,"What are your priorities for Congress in 2015? If you haven’t already, take my survey now → http://t.co/8ZknTMZdep http://t.co/vVaisiT2gt",,,,,
555537645044891648,950783972,repbera,Twitter for iPhone,2015-01-15 01:31:10,0,0,We were pleased to hold 1st 2015 office hrs yesterday. See how to get help w/ fed gov → http://t.co/almMlPwxlq http://t.co/QJLWusu38u,,,,,
554818393053089792,950783972,repbera,Twitter for iPhone,2015-01-13 01:53:07,3,4,"Don’t forget – first library office hours of 2015 are tomorrow. If you need help w/ fed govt, please stop by → http://t.co/EYjD7ZrewG",,,,,
554812423455404032,950783972,repbera,Twitter for iPhone,2015-01-13 01:29:24,4,6,.@sacbee_news published interview about my new term. We can only move forward together → http://t.co/heXSMb2sLg http://t.co/PLC0zKaekJ,,,,,
554808516465410049,950783972,repbera,Twitter for iPhone,2015-01-13 01:13:52,15,19,"Proud to vote for Clay Hunt vets suicide prevention bill today. If you know a vet who needs help, call 1-800-273-8255. #ClayHunt",,,,,
554355886060478466,950783972,repbera,Hootsuite,2015-01-11 19:15:17,3,2,#ICYMI: Posted 2015 library office hours schedule. Please come if you need help w/ fed gov → http://t.co/IoJWMT2qaD http://t.co/HJoncrds2j,,,,,
554003523822944256,950783972,repbera,Hootsuite,2015-01-10 19:55:07,2,0,According to @CDCgov about 1/2 of U.S. is experiencing high flu activity. See how to stay healthy in @sacbee_news → http://t.co/3q166xdsbk,,,,,
553697856994148353,950783972,repbera,Hootsuite,2015-01-09 23:40:30,4,0,#CA07 library office hours scheduled for throughout 2015! See where/when you can get help w/the fed. government → http://t.co/IoJWMT2qaD,,,,,
553670103263629312,950783972,repbera,Hootsuite,2015-01-09 21:50:13,3,3,"We've moved: My office has moved to 8950 Cal Center Dr., Building 3, Suite 100, in Sacramento→ http://t.co/Jp2Ff04SdB http://t.co/enGX5uygUu",,,,,
553657543810355200,950783972,repbera,Twitter Web Client,2015-01-09 21:00:19,3,2,I join with all Americans in standing with our French friends as this dangerous situation continues to develop. Je Suis Charlie.,,,,,
553624785855709185,950783972,repbera,Hootsuite,2015-01-09 18:50:09,1,0,See my @McClatchyDC interview about working w both parties to serve you as I start 2nd term → http://t.co/FmkudaQk86 #CA07 cc: @nolabelsorg,,,,,
553577804143816706,950783972,repbera,Twitter Web Client,2015-01-09 15:43:28,3,0,"RT @RepRibble: If Congress can't pass a budget, we shouldn't be paid. #NoBudgetNoPay w/ @repjimcooper @SenDeanHeller @RepDeSantis @Sen_JoeM…",,,553278063715573760,234053893,RepRibble
553297633155231745,950783972,repbera,Hootsuite,2015-01-08 21:10:10,0,0,Anniversary of No Child Left Behind is crucial reminder we must strengthen our schools → http://t.co/UVvV7ay4zE http://t.co/qceL3tT2EY,,,,,
552980539515617280,950783972,repbera,Hootsuite,2015-01-08 00:10:09,4,2,Applaud @Intel on new initiative to make sure job opportunities are available for all Americans. http://t.co/yFfEImWplZ,,,,,
552965230062735360,950783972,repbera,Twitter Web Client,2015-01-07 23:09:19,2,2,Thanks for the follow @RepEdRoyce! Appreciate your leadership on @HouseForeign – looking forward to work with you in the 114th Congress!,,,,,
552949069220704257,950783972,repbera,Hootsuite,2015-01-07 22:05:06,0,2,"Proud to introduce No Budget, No Pay w/ @repjimcooper @repribble @RepDeSantis @SenDeanHeller @Sen_JoeManchin. Thank you! cc: @nolabelsorg",,,,,
552945342023737344,950783972,repbera,Twitter Web Client,2015-01-07 21:50:17,2,1,"Intro. No Budget, No Pay today. Members of Congress shouldn’t get paid if they don’t do their jobs. http://t.co/yLTw2rfIap cc: @NoLabelsOrg",,,,,
552861799595663360,950783972,repbera,Twitter Web Client,2015-01-07 16:18:19,10,0,Thoughts are with the people of France today. Democracy &amp; freedom are always stronger than terrorism. http://t.co/5RGI0aAIe6 #CharlieHebdo,,,,,
552585453460029442,950783972,repbera,Twitter Web Client,2015-01-06 22:00:13,5,11,Honored to take my oath of office and begin my second term serving the people of #CA07 → http://t.co/bbh05qjNeY http://t.co/9Q3q7MBcRw,,,,,
552276576860385280,950783972,repbera,Twitter for iPhone,2015-01-06 01:32:51,1,1,"Excited to be sworn in to the 114th Congress tomorrow. If you’re in the D.C. area, drop by 1535 LHOB between 12-3 PM EST for our open house.",,,,,
551834265680613378,950783972,repbera,Hootsuite,2015-01-04 20:15:16,0,1,Today is the anniversary of America COMPETES. See how I’m fighting to build on this law to advance innovation → http://t.co/1BHdzlz1lv,,,,,
551499542844440577,950783972,repbera,Hootsuite,2015-01-03 22:05:12,4,1,"Answered 79,890 of your letters since 1/1/13. Listening to you is my most important job → http://t.co/VlxaIRaRwQ http://t.co/exWtNeMq85",,,,,
551104438266761216,950783972,repbera,Hootsuite,2015-01-02 19:55:11,2,0,Joined my email updates? One of the best ways for us to stay in touch. Join here → http://t.co/d25OPQUUbT http://t.co/wAIt1kPC0b,,,,,
550753361633751041,950783972,repbera,Hootsuite,2015-01-01 20:40:08,2,0,2015 is here &amp; a new term is about to begin. What’s your top priority for Congress? Survey → http://t.co/WLLPS83Gay http://t.co/lbyOotx4fv,,,,,
550562324432818176,950783972,repbera,Hootsuite,2015-01-01 08:01:01,2,3,Happy New Year! Here's to a great 2015! http://t.co/ks5FksBFiB,,,,,
550408617296662529,950783972,repbera,Hootsuite,2014-12-31 21:50:15,4,0,"As 2014 ends, I’ve made it my top priority to build an economy for the middle class → http://t.co/AvEMfpbMCt http://t.co/VNogcscbQW",,,,,
550377188814782465,950783972,repbera,Hootsuite,2014-12-31 19:45:21,2,2,"As 2014 ends, so does my first term serving you. Proud of what we’ve done, including passage of No Budget, No Pay →...",,,,,
550014820184248323,950783972,repbera,Hootsuite,2014-12-30 19:45:26,3,0,Proud my office helped #CA07 seniors recover nearly $150k since 1/1/13. Get help: http://t.co/2iwP2Ibvni http://t.co/kCju3EX0Oq,,,,,
549717821669015553,950783972,repbera,Hootsuite,2014-12-30 00:05:16,3,1,"With 2014 coming to a close soon, this is a natural time for reflection. See my end-of-year report email update → http://t.co/quuoLSBcyQ",,,,,
549309015814316032,950783972,repbera,Hootsuite,2014-12-28 21:00:49,5,3,41st anniversary of the Endangered Species Act is today. See how I’m working to protect endangered species  → http://t.co/7znlxjuD8k,,,,,
548917516094144513,950783972,repbera,Hootsuite,2014-12-27 19:05:08,2,2,Proud my office helped #CA07 vets recover more than $1 million since 1/1/13. Visit http://t.co/q3OyvElsBV if you need help.,,,,,
548587881322012673,950783972,repbera,Hootsuite,2014-12-26 21:15:17,5,0,"On this day in ’07, Congress passed biggest VA health funding increase in history, yet so much work remains. More:  https://t.co/kqD1F4SRbC",,,,,
548162537569910785,950783972,repbera,Hootsuite,2014-12-25 17:05:07,1,2,"From my family to yours, Merry Christmas! http://t.co/0rMJl4pym2",,,,,
547866931387052032,950783972,repbera,Hootsuite,2014-12-24 21:30:29,4,4,"For all who are celebrating Hanukkah as it comes to an end tonight, I hope you have a great evening with friends and family. Happy Hanukkah!",,,,,
547574458815614976,950783972,repbera,Twitter Web Client,2014-12-24 02:08:19,3,3,#ICYMI: UC regents recently voted to hike tuition by 28% over 5 years. Do you support raising CA tuition? Survey → http://t.co/2WJXVAdJQP,,,,,
547136130442096640,950783972,repbera,Twitter Web Client,2014-12-22 21:06:33,4,3,"Today is the 4th anniversary of the Don’t Ask, Don’t Tell Repeal Act. We must honor our men &amp; women in uniform, regardless of who they love.",,,,,
546782230023254019,950783972,repbera,Hootsuite,2014-12-21 21:40:17,1,1,It's been a busy few weeks! See my latest email update on how I’m working for you → http://t.co/4jlKDobLZE #CA07,,,,,
545754112466624513,950783972,repbera,Twitter for iPhone,2014-12-19 01:34:54,2,1,Do you support raising California college tuition? Take my quick survey to share your views: http://t.co/iQUbWcv1Fh,,,,,
545402364304572417,950783972,repbera,Twitter for iPhone,2014-12-18 02:17:11,4,3,Very disappointed that one Senator decided to block bipartisan veterans suicide prevention bill. http://t.co/irDqRScjF1,,,,,
544973972178087936,950783972,repbera,Twitter Web Client,2014-12-16 21:54:54,4,3,Happy Hanukkah to all who will begin celebrating this evening! http://t.co/xdzNj3P5yi,,,,,
544669113965375489,950783972,repbera,Twitter for iPhone,2014-12-16 01:43:30,9,9,I’m thrilled the Senate has confirmed Dr. Vivek Murthy as our next surgeon general. http://t.co/XuZpdMyhj3,,,,,
544192352261140480,950783972,repbera,Twitter for iPhone,2014-12-14 18:09:02,3,2,Thanks to all who came to our Open House yesterday. I had a great time chatting with everyone. #CA07 http://t.co/JXVqftF8ai,,,,,
543138754052227072,950783972,repbera,Twitter for iPhone,2014-12-11 20:22:24,9,10,"As only Indian American serving in Congress, honored to have been voted co-chair of the Congressional Caucus on India and Indian-Americans.",,,,,
542870611547389954,950783972,repbera,Twitter for iPhone,2014-12-11 02:36:54,5,3,"Congratulations to the new American Ambassador to India, Richard Verma! http://t.co/qP3Rm7GzKI",,,,,
542863087456755714,950783972,repbera,Twitter for iPhone,2014-12-11 02:07:00,7,1,Ready for the big storm tonight? See Sac County’s helpful Storm Ready preparedness information so you can stay safe → http://t.co/QvvCaoEmKK,,,,,
542505240226824193,950783972,repbera,Hootsuite,2014-12-10 02:25:03,7,1,Biggest storm in six years expected  to hit #CA07 beginning on Wed night. See @Sacbee_news to see what to expect → http://t.co/vcx9kVkQBG,,,,,
542480421947465728,950783972,repbera,Twitter Web Client,2014-12-10 00:46:26,8,2,RT to stop the water grab! Voted against the Majority’s harmful water-grab bill today. #CAWater http://t.co/UAR2vkcWX0,,,,,
542078250202460160,950783972,repbera,Twitter Web Client,2014-12-08 22:08:20,8,1,Congress began debating water-grab bill today. Thx @SacBeeEditBoard for shining light on this partisan ploy → http://t.co/fX7XPBBi0I,,,,,
541681096128487424,950783972,repbera,Hootsuite,2014-12-07 19:50:11,2,1,#ICYMI: Listening to you is my most important job. Take my quick survey on the President’s actions on immigration → http://t.co/Gkt5UKzA7f,,,,,
541303609749958656,950783972,repbera,Hootsuite,2014-12-06 18:50:12,2,1,#ICYMI: You’re invited to join my staff and I for an Open House at my local office on 12/13/14 → www.http://t.co/CSlgRei333...,,,,,
540985292984172544,950783972,repbera,Hootsuite,2014-12-05 21:45:19,1,2,"Great to meet Frances Leslie, Dean of Graduate Studies from my alma mater @UCIrvine! http://t.co/YA7X2fySWi",,,,,
540965514173218816,950783972,repbera,Twitter Web Client,2014-12-05 20:26:43,3,5,I first met Carmichael’s Morgan Alcalay in Afghanistan in 2013. Great to see him again in my D.C. office today! http://t.co/qq2r4TGo8G,,,,,
540939998909181953,950783972,repbera,Hootsuite,2014-12-05 18:45:20,4,1,Support the President's actions on immigration? Take my quick survey to share your views → http://t.co/Gkt5UKzA7f http://t.co/yvS5iWDSL6,,,,,
540907503299866624,950783972,repbera,Twitter Web Client,2014-12-05 16:36:13,4,1,You’re invited! Come to my local office open house on 12/13/14 → http://t.co/CSlgRei333 http://t.co/YYPrMlhs50,,,,,
540899300390498304,950783972,repbera,Twitter Web Client,2014-12-05 16:03:37,5,0,RT @CAPAC: #CAPAC thanks @efaleomavaega &amp; @RepHanabusa for their service. @RepRoybalAllard @gracenapolitano @repbobbyscott http://t.co/c39Y…,,,540292672465162241,192955168,CAPAC
540587523295412225,950783972,repbera,Twitter Web Client,2014-12-04 19:24:43,3,0,RT @RepGaramendi: Déjà vu all over again: House to pass #CAWater bill that would hurt #CA jobs &amp; environment: http://t.co/PFb32T4HIy http:/…,,,540527938073276416,88806753,RepGaramendi
540582502298316800,950783972,repbera,Twitter Web Client,2014-12-04 19:04:46,1,0,Voted for the bipartisan Tax Increase Prevention Act so families &amp; businesses can rely on tax relief next year. http://t.co/DQ7zeDa4qS,,,,,
540199916027781120,950783972,repbera,Twitter Web Client,2014-12-03 17:44:31,4,7,Proud to #StandWithPeggy in her fight against unfair discrimination towards working pregnant women. http://t.co/cqu315vE26,,,,,
539886609463001088,950783972,repbera,Twitter Web Client,2014-12-02 20:59:32,1,0,Best wishes with Richard Verma now during his Senate Foreign Relations Committee hearing to become the next U.S. Ambassador to India.,,,,,
539588775018790912,950783972,repbera,Twitter Web Client,2014-12-02 01:16:03,5,6,"In the #WorldWeWant access to health care doesn't hinge on gender, sexual orientation, societal status. #WAD2014 http://t.co/ANVPqEBiwU",,,,,
539148165380046850,950783972,repbera,Hootsuite,2014-11-30 20:05:14,5,0,"Joined my email updates yet? Democracy works best when we stay in touch, join now so you don’t miss out → http://t.co/d25OPQUUbT #CA07",,,,,
538781534090977280,950783972,repbera,Twitter Web Client,2014-11-29 19:48:22,3,0,Need to do some holiday shopping? Remember that today is #SmallBizSat – support Sacramento County’s small businesses &amp; #ShopSmall!,,,,,
538442286108250112,950783972,repbera,Hootsuite,2014-11-28 21:20:19,3,1,Remember - #SmallBizSat is tomorrow! Great opportunity to do Holiday shopping &amp; support #CA07 small businesses. http://t.co/tt00qLFJnS,,,,,
537783595742793728,950783972,repbera,Twitter for iPhone,2014-11-27 01:42:55,10,6,"Saddened by passing of Murli Deora, dedicated public servant &amp; strong advocate of a robust U.S.-India relationship. http://t.co/3wYY0veCc3",,,,,
537694904471011328,950783972,repbera,Hootsuite,2014-11-26 19:50:29,4,0,Ready for #Thanksgiving? Here are some food safety tips from @USDA. Hoping yours is safe &amp; delicious! http://t.co/1pytACH2gQ,,,,,
537317436132196353,950783972,repbera,Hootsuite,2014-11-25 18:50:34,4,1,#ICYMI: Know a local family who needs help this Thanksgiving? See this resource guide for #CA07 families in need → http://t.co/JKmT0IUffR,,,,,
536597580156010497,950783972,repbera,Hootsuite,2014-11-23 19:10:07,13,8,Extremely disappointed that the U.C. Regents voted for unreasonable tuition hikes → http://t.co/jFwe5D4JFz,,,,,
536320345943588865,950783972,repbera,Twitter Web Client,2014-11-23 00:48:29,6,5,Honored to take part in Congressional Caucus on India and Indian-Americans’ Diwali celebration earlier this week. http://t.co/Jwk3YywRIG,,,,,
535260595747291136,950783972,repbera,Twitter Web Client,2014-11-20 02:37:25,76,0,"RT @librarycongress: Abraham Lincoln gave the Gettysburg Address #OTD 1863. Of the 5 known manuscript copies, the Library has two. http://t…",,,535085147704406016,7152572,librarycongress
534910214815113216,950783972,repbera,Hootsuite,2014-11-19 03:25:08,2,3,Remember – Medicare open enrollment lasts until 12/7/14! Learn more &amp; see how you can take part → http://t.co/DprtQbbLfV #CA07 #ICYMI,,,,,
534879712980766720,950783972,repbera,Twitter Web Client,2014-11-19 01:23:55,2,1,"Great to see that we may get some rain, but we're still in the midst of a #drought. See how my office can help → http://t.co/9L55j6SkDY",,,,,
534554132112482304,950783972,repbera,Hootsuite,2014-11-18 03:50:11,2,1,Remember: Staff holding office hours tmrw for #CA07 seniors → http://t.co/wIlhHlfWfD #CA07 http://t.co/mwFotNq5PF #ICYMI,,,,,
534519974711529472,950783972,repbera,Twitter Web Client,2014-11-18 01:34:27,4,2,"More than 20k jobs created in Sac County since 2012, great how infrastructure is moving our economy forward → http://t.co/f4tCYUGsYj #CA07",,,,,
534091132129792001,950783972,repbera,Hootsuite,2014-11-16 21:10:23,7,1,Staff holding new office hours on Tuesday to help #CA07 seniors → http://t.co/HXEcWUFCwp http://t.co/CsSouA6m0H,,,,,
533713629913554945,950783972,repbera,Hootsuite,2014-11-15 20:10:19,1,0,Honoring our veterans can’t begin and end on Veterans Day. See more in my new email update → http://t.co/1PpCqBjvnH #CA07 #ICYMI,,,,,
533322033858641920,950783972,repbera,Twitter Web Client,2014-11-14 18:14:16,4,1,"Great news! One of our largest employers, @BlueDiamond, is reporting record revenue growth → http://t.co/wAeql7dXcT  #CA07 #ICYMI",,,,,
533004239770230785,950783972,repbera,Twitter Web Client,2014-11-13 21:11:28,2,1,"Glad that U.S. &amp; China are now cooperating to help stop climate change pollution, but there’s still work to do → https://t.co/JnVqDGKikr",,,,,
532619195947966464,950783972,repbera,Twitter for iPhone,2014-11-12 19:41:26,3,1,Honored to help celebrate our local #Veterans yesterday. Thank You. #CA07 http://t.co/wiFLyF6Wiv,,,,,
532223901246685185,950783972,repbera,Hootsuite,2014-11-11 17:30:40,4,2,"On #VeteransDay, I want to thank #CA07 vets for their service. Please visit http://t.co/OHaDbGdEQM if you need help.",,,,,
531992584777129984,950783972,repbera,Twitter Web Client,2014-11-11 02:11:30,3,1,Attn #CA07 vets: See how you can apply for Choice for Vets program in my new email update → http://t.co/8LzHI1xHJX http://t.co/nBS9topu1m,,,,,
530899373778296832,950783972,repbera,Twitter Web Client,2014-11-08 01:47:29,6,3,#CA07 Veterans: New choice health care program for vets is now underway. Learn more → http://t.co/j1XIYzNliq http://t.co/lYES8Yur3p,,,,,
530470200999964673,950783972,repbera,Twitter Web Client,2014-11-06 21:22:06,3,2,#ICYMI: Glad my office was able to help keep Arcade Creek Park Preserve project on track → http://t.co/8r4CYgtPmt http://t.co/jqp34omHfO,,,,,
530105721653063680,950783972,repbera,Twitter Web Client,2014-11-05 21:13:47,2,0,Our small businesses are key pillar of a strong middle class. See how my #smallbiz bill helps: http://t.co/PVNAiHDqWZ #CA07,,,,,
529832323563671552,950783972,repbera,Twitter Web Client,2014-11-05 03:07:24,7,2,CA women lose more than $37 billion every year because of the wage gap. Past time for #EqualPay → http://t.co/lPedkFMhBX,,,,,
529829186819870720,950783972,repbera,Twitter Web Client,2014-11-05 02:54:56,5,1,"We need to put people ahead of politics and focus on fixing things, not fighting → http://t.co/i8eO9ogb8Y #CA07 #FixNotFight",,,,,
529751258522189824,950783972,repbera,Hootsuite,2014-11-04 21:45:16,12,6,RT if you agree! Both parties need to #FixNotFight → http://t.co/QWRJnA9lzc #CA07 #FixNotFight http://t.co/6CPgdOC1cg,,,,,
529690441135185921,950783972,repbera,Twitter Web Client,2014-11-04 17:43:37,6,3,"Today is election day. Make sure your voice is heard, find where you can vote → http://t.co/bzj8vAi8wF http://t.co/ndNtmbynG7",,,,,
529377770850504704,950783972,repbera,Twitter Web Client,2014-11-03 21:01:10,4,1,Proud to work with #CA07 leaders &amp; vets to push for new Mather Vets village → http://t.co/RnkDyPgex1 http://t.co/wvYTj82qZw,,,,,
529335151067955201,950783972,repbera,Twitter Web Client,2014-11-03 18:11:49,4,4,RT if you agree! #CA07 http://t.co/yakDqWs8cI,,,,,
528988995095912449,950783972,repbera,Twitter Web Client,2014-11-02 19:16:19,3,0,RT if you agree! Learn more → http://t.co/xeHyOACMvS #CA07 http://t.co/Eo7oxtoD3Q,,,,,
528721898793086977,950783972,repbera,Twitter Web Client,2014-11-02 01:34:58,3,0,Arcade Creek Park Preserve is open! See how my office helped cut govt red tape to keep this project on track: http://t.co/WRHKKHfymT #CA07,,,,,
528672561186750464,950783972,repbera,Twitter Web Client,2014-11-01 22:18:55,5,6,#ICYMI: Proud to take part in 35th annual Sacramento Women Take Back the night → http://t.co/S9iGXYclZi #CA07 http://t.co/DapJOMjFiT,,,,,
528650097345970176,950783972,repbera,Twitter Web Client,2014-11-01 20:49:39,7,4,We need  to hire more doctors at the VA so our vets can have the 1st class medical care they've earned → http://t.co/Y3ZwQXNo7C #CA07,,,,,
528602371308683264,950783972,repbera,Twitter Web Client,2014-11-01 17:40:00,5,0,RT if you agree! Learn more → http://t.co/QWRJnA9lzc #CA07 #FixNotFight http://t.co/MNt6dio6Q1,,,,,
528296508081582080,950783972,repbera,Twitter Web Client,2014-10-31 21:24:37,7,3,Proud to help local #CA07 vets recover more than $1 million → http://t.co/xeHyOACMvS #CA07 http://t.co/wFkIeC1O4C,,,,,
528289994226802688,950783972,repbera,Twitter Web Client,2014-10-31 20:58:44,1,1,"From my family to yours, have a happy and safe Halloween! #CA07 http://t.co/TlvGzZ37WI",,,,,
528003491814703104,950783972,repbera,Twitter Web Client,2014-10-31 02:00:16,3,2,"My office has helped #CA07 veterans recover more than $1 million. See how we helped Corey, who nearly lost his home → http://t.co/I1nIxUlHlO",,,,,
527938075566301184,950783972,repbera,Twitter Web Client,2014-10-30 21:40:20,4,5,Our vets deserve nothing less than first-class health care → http://t.co/xeHyOACMvS #CA07 http://t.co/tvgoPFihQn,,,,,
527937831100903424,950783972,repbera,Twitter Web Client,2014-10-30 21:39:22,2,3,Our vets deserve nothing less than first-class health care → http://t.co/ObYSB1VB03 #CA07 http://t.co/oaLaucFTUn,,,,,
527864749170884609,950783972,repbera,Twitter Web Client,2014-10-30 16:48:58,2,1,#ThrowBackThursday: Have you met Matt? I’m honored to have Matt on my team to help local #CA07 vets → http://t.co/qF0kAm7GFh #TBT,,,,,
527640202152800257,950783972,repbera,Twitter Web Client,2014-10-30 01:56:41,4,2,My office is connecting #CA07 with #drought relief help &amp; resources. Learn more → http://t.co/ARhBwC81Gx http://t.co/jh7kCb8SDQ,,,,,
527536067483013121,950783972,repbera,Twitter Web Client,2014-10-29 19:02:54,2,2,We must work together to secure water throughout CA  → http://t.co/ARhBwC81Gx #CA07 #Drought http://t.co/OkC04UiY7A,,,,,
527203922063007746,950783972,repbera,Twitter Web Client,2014-10-28 21:03:04,1,2,I’m fighting plans that would take more water from #CA07 → http://t.co/MZHIWmUEv1 #Drought http://t.co/QQwA1HzSh6,,,,,
526937280418959360,950783972,repbera,Twitter Web Client,2014-10-28 03:23:32,11,4,Critical reminder: Got your flu shot yet? See how to get yours in my new email update → http://t.co/CRr2YV7TXv #CA07 http://t.co/AvX4DyNZQF,,,,,
526793658188976128,950783972,repbera,Twitter Web Client,2014-10-27 17:52:50,2,2,See how I’m fighting to ensure women &amp; families are given a fair shake → http://t.co/q7gNh1rbu5 #CA07 http://t.co/CLEroaDFnJ,,,,,
526416235333181441,950783972,repbera,Twitter Web Client,2014-10-26 16:53:05,5,1,RT if you agree! Learn more → http://t.co/q7gNh1rbu5  #HobbyLobby #NotMyBossBusiness #CA07 http://t.co/oDA2Abvguu,,,,,
526102577524776960,950783972,repbera,Twitter Web Client,2014-10-25 20:06:43,5,3,"As a doctor, I strongly support a woman’s right to choose → http://t.co/q7gNh1rbu5 #CA07 http://t.co/zyY9fPlPLN",,,,,
525756718891159553,950783972,repbera,Hootsuite,2014-10-24 21:12:24,3,3,My thoughts and prayers are with the departments and families of the officers and civilian victim. http://t.co/DJKWtopSvy,,,,,
525717314344615936,950783972,repbera,Hootsuite,2014-10-24 18:35:49,298,0,"RT @CHP_HQ: BLUE ALERT issued for an armed suspect who shot a deputy in Sacramento:  Red Ford F-150, California License Plate: 8J34411.",,,525715361992167424,385535253,CHP_HQ
525692755386068992,950783972,repbera,Twitter Web Client,2014-10-24 16:58:14,5,2,RT if you agree! Learn more → http://t.co/q7gNh1rbu5 #CA07 #WomenSucceed http://t.co/yUeRP07yBd,,,,,
525482377125298178,950783972,repbera,Twitter Web Client,2014-10-24 03:02:16,4,0,#ThrowBackThursday: Spoke out against outrageous #HobbyLobby ruling → http://t.co/1sUFV8V4CJ #TBT #NotMyBossBusiness,,,,,
525375357466476544,950783972,repbera,Twitter Web Client,2014-10-23 19:57:00,3,1,Supporting innovation is critical for growing #CA07 econ &amp; jobs → http://t.co/rwN91tpINb http://t.co/jx0BEqzxhp,,,,,
525375252235579392,950783972,repbera,Twitter Web Client,2014-10-23 19:56:35,2,0,Supporting innovation is critical for growing #CA07 econ &amp; jobs → http://t.co/rwN91tpINb http://t.co/8sSGlmGIpx,,,,,
525132063008374787,950783972,repbera,Twitter Web Client,2014-10-23 03:50:14,10,7,"To the millions who are celebrating around the globe, I wish you a happy Diwali. cc: @CAPAC http://t.co/veKcqqCNc3",,,,,
525081812172046336,950783972,repbera,Hootsuite,2014-10-23 00:30:34,4,5,Elizabeth Pinkerton Middle School named a CA 2014 ‘School to Watch’ Congratulations! http://t.co/JPWjQJzFAB,,,,,
524985538944978944,950783972,repbera,Twitter Web Client,2014-10-22 18:08:00,9,21,Thinking of our great friends and neighbors in Canada today. #PrayForOttawa,,,,,
524679234229645312,950783972,repbera,Twitter Web Client,2014-10-21 21:50:52,4,1,RT if you agree! Learn more → http://t.co/rwN91tpINb #CA07 http://t.co/ZNKuhWOfbv,,,,,
524397005549105153,950783972,repbera,Twitter Web Client,2014-10-21 03:09:23,5,1,Rebuilding our infrastructure is critical for building a strong middle class→ http://t.co/rwN91tpINb #CA07 http://t.co/9pLupFKBpZ,,,,,
523930404416655360,950783972,repbera,Hootsuite,2014-10-19 20:15:17,2,1,#CA07 Seniors: 2015 Medicare open enrollment has begun! Change plans or sign up for 2015 coverage→ https://t.co/KXJIsI4kb8,,,,,
