id,user_id,screen_name,source,created_at,retweet_count,favorite_count,text,in_reply_to_screen_name,in_reply_to_status_id,retweeted_status_id,retweeted_status_user_id,retweeted_status_screen_name
627277450398015490,950783972,repbera,Twitter Web Client,2015-08-01 00:39:33,4,3,IG report shows we need to take immediate steps to protect our vets: https://t.co/Z9yvSSThCE,,,,,
626877570462691336,950783972,repbera,Twitter Web Client,2015-07-30 22:10:34,4,3,Happy Birthday Medicare and Medicaid! http://t.co/tHue22MHek,,,,,
626207148461162496,950783972,repbera,Twitter Web Client,2015-07-29 01:46:33,3,0,Great hearing on #MakeItInAmerica to create more good-paying middle class jobs.  #MIIWhatsNext http://t.co/k6iRCcdM6g,,,,,
625703532247818240,950783972,repbera,Hootsuite,2015-07-27 16:25:21,1,0,Receive my email updates? Take my survey to let me know how I can make them better → http://t.co/Mpz21VqsYr http://t.co/aZC4Wwj7dI,,,,,
625409035282575360,950783972,repbera,Hootsuite,2015-07-26 20:55:08,1,1,Supporting new bill to clarify OTC birth control be provided at no cost. More on CA efforts to increase access: http://t.co/sqJZtnVZov,,,,,
625362542601334784,950783972,repbera,Hootsuite,2015-07-26 17:50:23,2,3,"We need equality for all Americans, regardless of who the love. See how we can move #EqualityForward w/ #EqualityAct: http://t.co/C4g1mL4HNz",,,,,
625133057121648640,950783972,repbera,Twitter Web Client,2015-07-26 02:38:29,6,3,Fighting to raise the minimum wage &amp; more in my new email update: http://t.co/sKEI0cQSjj,,,,,
624293247289004032,950783972,repbera,Twitter Web Client,2015-07-23 19:01:23,7,16,"We need fairness for all Americans, regardless of who they love. Proud to support to Equality Act. #EqualityForward http://t.co/kT40S2L6B5",,,,,
624281698524602368,950783972,repbera,Twitter Web Client,2015-07-23 18:15:30,3,3,Great news that the @UofCalifornia is raising its minimum wage! http://t.co/pIuKbxe3VL,,,,,
623947282552094720,950783972,repbera,Twitter Web Client,2015-07-22 20:06:39,2,1,"We need responsible #CADrought solutions, not partisan water grabs. See latest email update → http://t.co/epdI4Rzgco http://t.co/hu3daW0eOd",,,,,
623233621923659777,950783972,repbera,Twitter Web Client,2015-07-20 20:50:49,1,0,"Our drought is about people, not politics. See how the Drought Relief &amp; Resilience Act helps → http://t.co/vaeADt7koC http://t.co/DOVU6r1dx1",,,,,
622590959537229824,950783972,repbera,Twitter Web Client,2015-07-19 02:17:06,3,1,"Supporting Drought Relief &amp; Resilience Act to bring solutions to #CA07, not water wars: http://t.co/vaeADt7koC http://t.co/2USUpTKlqH",,,,,
622128138970136576,950783972,repbera,Twitter Web Client,2015-07-17 19:38:01,0,1,"We need real #CADrought solutions, not partisan water grabs. See how new drought bill helps: http://t.co/EYgZkRBFV9 http://t.co/k8NhEySJ8K",,,,,
622085276479827969,950783972,repbera,Twitter for iPhone,2015-07-17 16:47:42,2,2,With .@SARTA_tech CEO Howard Bubb this morning discussing how to grow our Ag &amp; Med strengths in the Capital region. http://t.co/mcSz9hUbLH,,,,,
621846689364738048,950783972,repbera,Twitter Web Client,2015-07-17 00:59:38,2,1,My thoughts &amp; prayers are with the service members &amp; families impacted by senseless shooting in Chattanooga. http://t.co/fpzVUULaDV,,,,,
621790483262668800,950783972,repbera,Hootsuite,2015-07-16 21:16:18,5,4,Voted against House Majority’s partisan water grab bill today. We must protect #CA07 water! https://t.co/gLebWzl9HZ #CADrought,,,,,
621458139137900544,950783972,repbera,Hootsuite,2015-07-15 23:15:41,1,3,Voted on another short-term transportation bill. We’ve done this 30x now and need a long term solution! https://t.co/4Nna8cO8zi,,,,,
621423722025627648,950783972,repbera,Twitter Web Client,2015-07-15 20:58:55,1,0,So inspiring! MT @NASA: Zoom into Pluto &amp; discover mountains on @NASANewHorizons #PlutoFlyby: http://t.co/zw0dJoPsmI,,,,,
621132429886136320,950783972,repbera,Twitter Web Client,2015-07-15 01:41:26,2,1,Disappointed House majority will once again push their partisan water grab bill tomorrow. http://t.co/ncJNHvTX8q #CAdrought,,,,,
620655690466611200,950783972,repbera,Twitter Web Client,2015-07-13 18:07:02,2,1,#ICYMI: New rules will help rollback disastrous #HobbyLobby impact on women's access to healthcare: http://t.co/bhP7hjvY0V,,,,,
620044600288411648,950783972,repbera,Twitter Web Client,2015-07-12 01:38:47,6,2,"As a doctor, proud to vote for bipartisan 21st Century Cures bill to invest in groundbreaking medical research: http://t.co/r8UophAKCe",,,,,
619211018368077828,950783972,repbera,Twitter Web Client,2015-07-09 18:26:25,4,4,U.S. is better than this. #ConfederateFlag is offensive to millions &amp; shouldn’t have special recognition on natl. property. #TakeItDown,,,,,
618962676258091008,950783972,repbera,Twitter Web Client,2015-07-09 01:59:36,1,1,"Great having incoming principal for Edna Batey Elementary school, Mary Beth Kropp, drop by my D.C. office! http://t.co/IwK8K4Clo1",,,,,
618605462985027584,950783972,repbera,Hootsuite,2015-07-08 02:20:10,3,3,Good news about Folsom Lake – glad to see CA Water Board listened to our concerns about local water supply. http://t.co/DUlV6je92l,,,,,
618589955003187200,950783972,repbera,Twitter Web Client,2015-07-08 01:18:32,5,0,Pleased @Rancho_Cordova will receive $2.5 million in funding to help complete the Mather Veterans Village project: http://t.co/ElpmeXe7Ma,,,,,
618199038899429377,950783972,repbera,Hootsuite,2015-07-06 23:25:11,1,2,Staff at Orangevale library on Wednesday from 10AM to noon to serve you: http://t.co/bdhQSLYUQy http://t.co/qe8x7GPXU1,,,,,
617835731226988544,950783972,repbera,Twitter for iPhone,2015-07-05 23:21:31,4,8,Hope her birthday continues to be this sweet for former Elk Grove player Megan Rapinoe! 4-0 in under 20 min of the #WorldCup Go #USA!!,,,,,
617426480335822848,950783972,repbera,Hootsuite,2015-07-04 20:15:18,0,1,"Thx to all servicemembers for your sacrifices on this 4th of July. If you’re a #CA07 vet, we’re here to serve you:...",,,,,
617378680394903552,950783972,repbera,Hootsuite,2015-07-04 17:05:22,4,7,Happy Fourth of July! http://t.co/j3INVnigVJ,,,,,
617056160886226944,950783972,repbera,Twitter Web Client,2015-07-03 19:43:47,1,2,See how @SecretaryFoxx &amp; I are working to upgrade #CA07 infrastructure in new email update: http://t.co/nILMYBNCcP http://t.co/C6Yl31eIN0,,,,,
616791084094648321,950783972,repbera,Hootsuite,2015-07-03 02:10:28,1,2,#ICYMI – Welcomed @SecretaryFoxx to #CA07 to help us update roads &amp; bridges: http://t.co/kzzvx1usU1 http://t.co/JX35QvuwrK,,,,,
616775945895198721,950783972,repbera,Hootsuite,2015-07-03 01:10:19,6,12,"51 years ago today, we became a stronger &amp; more united country with signing of landmark 1964 Civil Rights Act. http://t.co/jhNVtmLIHD",,,,,
616427372389208064,950783972,repbera,Hootsuite,2015-07-02 02:05:12,5,5,"Medicare began on this day in '66. As a doctor, I will continue to defend this promise to seniors. http://t.co/6dNVJFbkAM",,,,,
616416207286214656,950783972,repbera,Twitter Web Client,2015-07-02 01:20:50,6,5,Honored to welcome @SecretaryFoxx to Sac County to discuss improvements to our roads &amp; bridges to grow #CA07 economy! http://t.co/BMDoIIf56V,,,,,
616064804898369536,950783972,repbera,Twitter Web Client,2015-07-01 02:04:30,1,0,Great to see #CA07 #smallbiz come to our workshop! Learn more at http://t.co/xkzUCnkbcH http://t.co/jwJ78nmG33,,,,,
615701403047194624,950783972,repbera,Hootsuite,2015-06-30 02:00:28,2,0,Staff will be at Rancho Cordova library tmrw to help you: http://t.co/UdGjc43Mar http://t.co/mtM9lh4vc8,,,,,
615688702933778432,950783972,repbera,Twitter Web Client,2015-06-30 01:10:00,1,0,Remember – office is hosting workshop to help #CA07 #smallbiz tomorrow: http://t.co/LsIegWjceC http://t.co/N3YF0pvRvh,,,,,
615214452221325312,950783972,repbera,Hootsuite,2015-06-28 17:45:30,3,5,A couple photos from the #MarriageEquality ruling celebration at #SCOTUS Friday: https://t.co/0tc03Akgiw http://t.co/wAdrKi0iXT,,,,,
614462749582749697,950783972,repbera,Twitter Web Client,2015-06-26 15:58:30,5,15,What a great day for our country! #SCOTUS. #LoveWins #LoveIsLove https://t.co/C4cqI5wxjE,,,,,
614435111208136704,950783972,repbera,Twitter Web Client,2015-06-26 14:08:40,16,47,Thrilled about the Supreme Court decision! #LoveisLove http://t.co/6LhttRgyKi,,,,,
614232001852260352,950783972,repbera,Twitter Web Client,2015-06-26 00:41:35,10,6,#SCOTUS struck down key part of Voting Rights Act 2 yrs ago. We must continue struggle to protect all voters. http://t.co/v8yheyISkj,,,,,
614118399711551488,950783972,repbera,Twitter Web Client,2015-06-25 17:10:10,2,11,Glad #SCOTUS did right by protecting health care for millions of Americans. But work on health is far from over → http://t.co/1Hnjt03T2x,,,,,
613893153347776512,950783972,repbera,Hootsuite,2015-06-25 02:15:07,2,2,Voted for Toxic Substances Modernization Act to protect health &amp; environment from possibly dangerous chemicals → http://t.co/DBed0SJ8x1,,,,,
613884804577251328,950783972,repbera,Twitter Web Client,2015-06-25 01:41:57,3,0,#CA07 vets: VA hosting Google Hangout tmrw at 11:30 AM PST to explain new Vets Choice program. Access it here → http://t.co/l9cZAnET15,,,,,
613832574423666689,950783972,repbera,Twitter Web Client,2015-06-24 22:14:24,1,1,Answered letter from local boy scout on why we need space exploration. We need to dream again → http://t.co/rsUxkHZZ6G cc: @NASA,,,,,
613743744697933824,950783972,repbera,Twitter Web Client,2015-06-24 16:21:26,1,0,Invite: Come to my office’s workshop for #CA07 #smallbiz on Tues. so we can serve you → http://t.co/dHwSjlrm1r http://t.co/Rrq5cDa6wS,,,,,
613154368330813440,950783972,repbera,Twitter Web Client,2015-06-23 01:19:27,4,0,#ICYMI - @CBSSunday had great Father’s Day story on importance of paid family leave: http://t.co/owgBggnQn6,,,,,
613103680443645952,950783972,repbera,Twitter for iPhone,2015-06-22 21:58:02,1,2,With @SacCountyCA reps Natasha and Troy talking about economic development &amp; ways to work together. http://t.co/1kKDqERdmI,,,,,
612797174888439808,950783972,repbera,Hootsuite,2015-06-22 01:40:06,6,4,Father’s Day is important occasion for including dads in conversation on paid family leave. More in email update: http://t.co/twrb8ktTb5,,,,,
612779159715233796,950783972,repbera,Twitter Web Client,2015-06-22 00:28:31,3,8,"As a proud dad and son, I want to take a moment to wish my own father &amp; all my fellow fathers a Happy Father’s Day. http://t.co/SZtLn8THq2",,,,,
612390319255105536,950783972,repbera,Twitter for iPhone,2015-06-20 22:43:24,3,0,See how my office helped a local senior named Eugene get his passport: https://t.co/ljzWjQpw3H,,,,,
612067819870679040,950783972,repbera,Twitter for iPhone,2015-06-20 01:21:54,3,4,I join with Americans everywhere today in recognizing Juneteenth. May we continue the struggle for equality and justice.,,,,,
611689943862276096,950783972,repbera,Hootsuite,2015-06-19 00:20:21,3,2,"See how we helped Paul from Fair Oaks, a Vietnam Veteran who needed help w/ his benefits: http://t.co/uNWYhJVFBf http://t.co/BGbLHEdvyt",,,,,
611660982042161152,950783972,repbera,Hootsuite,2015-06-18 22:25:16,5,6,"Met w/ inspirational Kailash Satyarthi, 2014 Nobel Peace Prize winner for standing against child exploitation. http://t.co/dyIFk5Tukb",,,,,
611636452242403328,950783972,repbera,Twitter Web Client,2015-06-18 20:47:48,0,0,Great news that a woman will be on the $10 – it’s about time! Who would you like to be on the $10? http://t.co/R3LCUxdPJQ #WomenSucceed,,,,,
611528949286477824,950783972,repbera,Twitter Web Client,2015-06-18 13:40:37,2,5,My thoughts and prayers are with the people of Charleston. Love and justice will always overcome violence and hate. http://t.co/Fq8HOUvkGb,,,,,
611333434166878208,950783972,repbera,Twitter for iPhone,2015-06-18 00:43:43,0,2,“Representative Bera and his staff really saved us.” Watch to see how we helped Shellie &amp; her senior mom → http://t.co/xp8piPL5sS,,,,,
611293843007389696,950783972,repbera,Twitter Web Client,2015-06-17 22:06:24,7,7,"As a dad, proud to unveil 1st State of the World’s Father Report &amp; push for paid family leave→ http://t.co/c7o2nxfOGO http://t.co/iOu86CocWi",,,,,
610962665717018624,950783972,repbera,Hootsuite,2015-06-17 00:10:25,3,0,"See how we helped Rob, who had his Medicare supplemental insurance canceled: http://t.co/toJTSC6QYJ http://t.co/9N5spHt6RV",,,,,
610929929807642625,950783972,repbera,Twitter Web Client,2015-06-16 22:00:20,1,1,Pleased @WhiteHouse announced new emergency drought funding. Call 916 635 0505 so we can connect you w/ drought help. http://t.co/DhTHVb2aHm,,,,,
610555669918445571,950783972,repbera,Twitter Web Client,2015-06-15 21:13:09,1,2,Great telephone town hall w/ @NCPSSM’s Max Ricthman on how we can honor promises to #CA07 seniors. http://t.co/vZPJjKq9pM,,,,,
610225306574716928,950783972,repbera,Hootsuite,2015-06-14 23:20:25,4,2,Did you know you might qualify for a rebate for conserving more water in your home? Learn more: http://t.co/6id4drEhjK,,,,,
609835314526453760,950783972,repbera,Hootsuite,2015-06-13 21:30:43,0,0,"Great meeting w/ Alison &amp; Scott from Elk Grove in my D.C. office this week, representing Leukemia &amp; Lymphoma Society. http://t.co/ZrsxB6X9Va",,,,,
609460517325942784,950783972,repbera,Twitter Web Client,2015-06-12 20:41:25,2,1,"Honored to recently help welcome new Indian Ambassador to the U.S., Arun Singh. cc: @HouseForeign @HFACDemocrats http://t.co/AoOEANDcou",,,,,
609110368267440128,950783972,repbera,Twitter Web Client,2015-06-11 21:30:03,4,5,"Great meeting with local middle school students from Gold River Discovery Center in Washington, D.C. http://t.co/FsT7v4bs0M",,,,,
608749445556137984,950783972,repbera,Twitter Web Client,2015-06-10 21:35:52,12,4,"#EqualPay Act signed into law 52 yrs ago, but the struggle for equal pay for equal work must continue. http://t.co/I7WpsIt8zI",,,,,
607991750528012288,950783972,repbera,Twitter Web Client,2015-06-08 19:25:03,2,1,Need help w/ fed govt? Staff at Franklin Library tmrw from 10 AM to noon. Details →http://t.co/we7VfBdkvD http://t.co/xTmubVGgCK,,,,,
607570592464650240,950783972,repbera,Twitter for iPhone,2015-06-07 15:31:32,3,2,Celebrating health &amp; wellness with my wife Janine at 11th Kaiser Women's Fitness Festival benefiting @WEAVEinc http://t.co/FU0C7G9hCm,,,,,
606970301981720576,950783972,repbera,Twitter for iPhone,2015-06-05 23:46:11,7,11,Great chat w/ @DrMarionEdu about @metroedge's work engaging young professionals in our region. http://t.co/YGEIvIzQww,,,,,
606944515639767041,950783972,repbera,Twitter for iPhone,2015-06-05 22:03:43,4,4,Hosted Brain Forum for Ntl Alzheimer's &amp; Brain Health Awareness month with @ALZassociation &amp; UCDavis ALZ center http://t.co/tyP3DHYY4i,,,,,
606914330945159168,950783972,repbera,Twitter for iPhone,2015-06-05 20:03:47,1,1,Met with West Sac @mayorcabaldon &amp; @linked_learning Alliance to talk about 21st century education. Learn more at http://t.co/crvhVNpRWN,,,,,
606572080293933056,950783972,repbera,Twitter Web Client,2015-06-04 21:23:48,0,0,"Battle of Midway began 73 yrs ago today, marking critical WW2 turning point. Thx to all WW2 vets for their service. http://t.co/kRA9sS2GpR",,,,,
606186196344176640,950783972,repbera,Twitter Web Client,2015-06-03 19:50:26,13,9,"Sometimes history hits home. W/ @USAmbIndia Verma near Dalip Singh Saund portrait, 1st Indian American congressman. http://t.co/XHHemfLAXP",,,,,
605789787266514945,950783972,repbera,Hootsuite,2015-06-02 17:35:14,4,5,Great having Folsom student &amp; National Spelling Bee finalist Snehaa Ganesh Kumar drop by my D.C. office! http://t.co/QoZbRiRz9Z,,,,,
605463942039805952,950783972,repbera,Twitter Web Client,2015-06-01 20:00:27,1,1,Staff at Arden Dimick library tmrw at 10AM to noon to help you w/ fed govt. Details → http://t.co/we7VfBdkvD http://t.co/EFiJWjN6m0,,,,,
605132989278920704,950783972,repbera,Hootsuite,2015-05-31 22:05:22,2,2,Joined my email updates yet? Stay updated on my work for you: http://t.co/F1dbETmUKS http://t.co/xclTCrdf96,,,,,
604740387685691394,950783972,repbera,Hootsuite,2015-05-30 20:05:18,3,0,Office hosting Brain Health Forum &amp; Resource Fair on Fri to give update on Alzheimer’s &amp; help in our area. RSVP: http://t.co/3TARk7I4Sf,,,,,
604389440727949312,950783972,repbera,Twitter Web Client,2015-05-29 20:50:46,2,4,Congrats to Folsom middle schooler Snehaa Ganesh Kumar for making the Natl Spelling Bee finals! Well done! http://t.co/RJ37fw2NIk,,,,,
603916239778492418,950783972,repbera,Twitter Web Client,2015-05-28 13:30:26,1,2,Good luck to Folsom’s Snehaa Ganesh Kumar in the National Spelling Bee’s semi-finals today! You’ve made us all proud! http://t.co/P1bAKAWrDN,,,,,
602948405761937408,950783972,repbera,Twitter for iPhone,2015-05-25 21:24:36,2,4,Today is for remembering the sacrifices. 9th Annual Rancho Cordova Memorial Day ceremony @ Mather VA http://t.co/ovjvz08YCB,,,,,
602873559954763776,950783972,repbera,Twitter for iPhone,2015-05-25 16:27:12,3,5,Spent the morning honoring the sacrifices and service of our Veterans at the 5th Annual Wounded Veteran Run. http://t.co/i8e67Jdxqc,,,,,
602223523591946240,950783972,repbera,Twitter for iPhone,2015-05-23 21:24:11,2,4,Volunteering w my wife Janine for 20th year at Imani Clinic. Great way to serve our community &amp; help people in need http://t.co/0qaQrGHCdR,,,,,
602166668677152768,950783972,repbera,Twitter for iPhone,2015-05-23 17:38:16,3,1,Honored to speak at the 17th Annual Memorial Day Ceremony and Avenue of Flags in Fair Oaks today #MemorialDay http://t.co/GpQ4SjivqD,,,,,
602142898834911232,950783972,repbera,Twitter for iPhone,2015-05-23 16:03:49,2,2,Met yesterday w/ @ChiefLehner of @ElkGrovePD &amp; representatives from all police depts. in Sac County about building trust &amp; safe communities.,,,,,
601870189236355072,950783972,repbera,Twitter for iPhone,2015-05-22 22:00:09,4,5,"With @WayUpSac, @JaySchenirer &amp; @MegAtSarta talking about creating MedZone 4 jobs &amp; health http://t.co/HOFoPjk9Ig",,,,,
601435257900896257,950783972,repbera,Twitter for iPhone,2015-05-21 17:11:54,3,0,Proud to introduce bipartisan DROP Act today w/ @DrPhileRoe to address prescription drug abuse http://t.co/al1lwNp7J7 http://t.co/NiBlLROJiE,,,,,
600466640741003264,950783972,repbera,Twitter Web Client,2015-05-19 01:02:57,1,1,Need help? Staff will be at Folsom public library tomorrow from 10 AM to noon → http://t.co/1eaDoTZsOE,,,,,
600063331592994817,950783972,repbera,Hootsuite,2015-05-17 22:20:21,2,0,Need help w/ fed govt? Staff will be at Sylvan Oaks library on 5/19. Details &amp; RSVP → http://t.co/F0kytSglGc http://t.co/Bdnj5iYm7V,,,,,
600014242620768256,950783972,repbera,Hootsuite,2015-05-17 19:05:17,4,2,Great meeting w/ Farm Bureau in D.C. this week! #CA07 ag is critical to our local economy→ http://t.co/eJPZnWbDCE http://t.co/Z7CDsaizLg,,,,,
599699693375983616,950783972,repbera,Hootsuite,2015-05-16 22:15:23,1,2,See how I’ve been fighting for #WomensHealth in my new email update →  http://t.co/k5e2ytMLd5  #StopTheBan #NWHW http://t.co/GX9QNous06,,,,,
599639307658391552,950783972,repbera,Hootsuite,2015-05-16 18:15:26,1,4,Should politicians be able to deny women access to health care? Take my survey → http://t.co/V4dSOsqQYK #StopTheBan http://t.co/c9c084rifS,,,,,
599317919542210560,950783972,repbera,Twitter Web Client,2015-05-15 20:58:21,3,3,Just intro new bill – the Women’s Preventive Health Awareness Campaign →http://t.co/pZ3Taqvijp #WomensHealth #NWHW http://t.co/iZAesCzhnZ,,,,,
599212245252513792,950783972,repbera,Twitter Web Client,2015-05-15 13:58:26,2,1,My thoughts and prayers are with the U.S. marines in Nepal and their loved ones. http://t.co/mcWFqaYyH3,,,,,
599007568980254720,950783972,repbera,Hootsuite,2015-05-15 00:25:08,2,3,Thrilled to see @JerryBrownGov budget proposal calls for UC tuition freeze. We must invest in next generation → http://t.co/vz3SKRiq8x,,,,,
598992483587104768,950783972,repbera,Hootsuite,2015-05-14 23:25:11,2,4,#ThrowBackThursday: Spoke out against outrageous #HobbyLobby decision by SCOTUS → http://t.co/oxd4CDmAr6 #WomensHealth #NWHW,,,,,
598958728935792640,950783972,repbera,Twitter Web Client,2015-05-14 21:11:03,1,1,Should politicians be able to deny women access to health care? Take my survey →http://t.co/V4dSOsqQYK #StopTheBan http://t.co/2usrnbaJxd,,,,,
598656593471877123,950783972,repbera,Hootsuite,2015-05-14 01:10:29,7,5,Honored to join w/ my @CAPAC colleagues to commemorate APA heritage month! #CAPAC2015 #AAPISummit http://t.co/MGKrGbnrpG,,,,,
598638996693118976,950783972,repbera,Hootsuite,2015-05-14 00:00:33,7,8,Voting against radical attack on women’s health care today – HR 36. #StopTheBan #WomensHealth #NWHW http://t.co/l51n9bX8fp,,,,,
598619681860296704,950783972,repbera,Twitter Web Client,2015-05-13 22:43:48,2,4,"Spoke on House floor to #StopTheBan, a radical attack on women’s health care → http://t.co/hOxNEJac2k #WomensHealth #NWHW",,,,,
598250731154624513,950783972,repbera,Twitter Web Client,2015-05-12 22:17:43,4,1,"We’re in middle of #NWHW, but some Washington politicians are pushing a radical attack on #WomensHealth. #StoptheBan→ http://t.co/sUCn7GXEib",,,,,
597956905332568065,950783972,repbera,Hootsuite,2015-05-12 02:50:10,3,0,Had your check-up yet? See why you should schedule yours on this Natl Women’s #CheckupDay→ http://t.co/sRV3EgXxMa http://t.co/9vlwp1wNi4,,,,,
597950145649573888,950783972,repbera,Twitter Web Client,2015-05-12 02:23:18,12,6,RT if you agree! Glad @WhiteHouse working so women can access birth control. #WomensHealth #AllBCforAllWomen http://t.co/DScd0I91QB,,,,,
597734289397145600,950783972,repbera,Hootsuite,2015-05-11 12:05:34,1,0,"Great tour of ConQuip, Inc. last week. Another hidden manufacturing gem in Sacramento County. http://t.co/as13noS9Si",,,,,
597499097730387968,950783972,repbera,Hootsuite,2015-05-10 20:31:00,7,8,#MothersDay kicks off Natl Women’s Health Week. See how I’m fighting for women’s health → http://t.co/KePGZPih1H http://t.co/vqJcrqnfOk,,,,,
597462471646019584,950783972,repbera,Hootsuite,2015-05-10 18:05:28,3,7,"From my family to yours, Happy #MothersDay! http://t.co/Aa0z1cwINk",,,,,
597448659056353280,950783972,repbera,Hootsuite,2015-05-10 17:10:35,1,2,Joined @SacKidsMuseum last week to honor Juanita Garcia of @AerojetRdyne Foundation for her work helping kids http://t.co/QLvtFGWInd,,,,,
597196960530042880,950783972,repbera,Hootsuite,2015-05-10 00:30:25,6,3,Speaking to @NLCSac New Leaders Council fellows last weekend. http://t.co/Zu549JiV1X,,,,,
597152854395265024,950783972,repbera,Hootsuite,2015-05-09 21:35:09,6,7,"As a doctor, I want to thank nurses everywhere for all the work they do during this national #NursesWeek. http://t.co/RgnCwVgGNS",,,,,
597074841456500736,950783972,repbera,Hootsuite,2015-05-09 16:25:09,3,1,Congratulations to Bryan Hsieh of Troop 380 on obtaining the rank of Eagle Scout!  Thanks for your community service. http://t.co/Qm5RW6Sdv7,,,,,
596849694699040768,950783972,repbera,Hootsuite,2015-05-09 01:30:30,2,3,See how my office can help you grow &amp; hire during this natl #smallbiz week → http://t.co/atV1AwPt9o  #DreamSmallBiz http://t.co/t9A3PMLD5p,,,,,
596830526184550401,950783972,repbera,Twitter Web Client,2015-05-09 00:14:20,5,3,Pleased to announce new federal funding I fought for is going to new permanent health center in Arden-Arcade area → http://t.co/PiOLpk9LzE,,,,,
596800609891840000,950783972,repbera,Twitter Web Client,2015-05-08 22:15:28,4,2,"On this 70th anniversary of V-E Day, a special thanks to America’s WW2 veterans everywhere for their sacrifices. http://t.co/xaFAZNnZx9",,,,,
596752225893896192,950783972,repbera,Twitter for iPhone,2015-05-08 19:03:12,3,4,Great seeing progress of @SacramentoESC. Looking forward to 2016 and a more vibrant downtown! #SacramentoProud http://t.co/ldDqI3ky4u,,,,,
596721300833325058,950783972,repbera,Twitter for iPhone,2015-05-08 17:00:19,2,3,Grand opening of @AsmJimCooper’s district office. Congrats! http://t.co/byke6MuWdt,,,,,
596422714434326528,950783972,repbera,Twitter for iPhone,2015-05-07 21:13:50,2,1,Thanks to AMPAC Fine Chemicals for inviting me out for a tour and to talk about manufacturing jobs &amp; exports. http://t.co/TLKhcWoDwE,,,,,
596071844630765569,950783972,repbera,Twitter for iPhone,2015-05-06 21:59:36,3,3,At GNB today to talk about the importance of exports for US manufacturing jobs. http://t.co/XG4a3oaOfu,,,,,
596020453749096448,950783972,repbera,Twitter for iPhone,2015-05-06 18:35:24,2,1,At GNB today to talk about the importance of exports for US manufacturing jobs. http://t.co/5r9WjtcAIY,,,,,
595998096464617472,950783972,repbera,Twitter for iPhone,2015-05-06 17:06:33,2,1,Joined representatives from @CityofElkGrove this morning to talk about job creation &amp; projects in Elk Grove. http://t.co/IcUiJZlwHW,,,,,
595982070163251200,950783972,repbera,Twitter for iPhone,2015-05-06 16:02:52,1,0,At Laguna Sunrise Rotary talking about how building friendships with No Labels in Congress helps break thru gridlock. http://t.co/x6CBKNIJRf,,,,,
595698808694120448,950783972,repbera,Twitter Web Client,2015-05-05 21:17:18,4,2,Thanks to my mom and teachers everywhere for inspiring the next generation. #ThankATeacher #NationalTeacherDay http://t.co/kf7v1Qwyhe,,,,,
595695058109788160,950783972,repbera,Twitter Web Client,2015-05-05 21:02:23,94,0,"RT @NARAL: #HowToSpotAFeminist: they support #reprorights, #reprofreedom, and full equality for all.",,,595584897999331331,17006036,NARAL
595614508460023809,950783972,repbera,Twitter for iPhone,2015-05-05 15:42:19,0,2,Congratulations to Christopher Chen!  His piece Bob the Veteran won first place in our Congressional Art Competition! http://t.co/XOAgtTnYSV,,,,,
