id,user_id,screen_name,source,created_at,retweet_count,favorite_count,text,in_reply_to_screen_name,in_reply_to_status_id,retweeted_status_id,retweeted_status_user_id,retweeted_status_screen_name
361223497298624512,240760644,repgosar,Twitter for iPhone,2013-07-27 20:36:07,1,0,"RT @GrahamJones_MP: Big thanks to @RepGosar and staff, Penny, Tom et al for their friendly welcome, support and friendship in Arizona.",,,361221204989841408,260824465,GrahamJones_MP
361154229437612032,240760644,repgosar,Twitter for iPad,2013-07-27 16:00:52,6,2,"It's been 60 years since the sacrifices of the Korean War, yet the Forgotten War, is one that we shall forever remember.",,,,,
361153022971232258,240760644,repgosar,Twitter for iPad,2013-07-27 15:56:05,1,1,#AlloftheAboveEnergy RT @RebekahLSanders: @repgosar visits Pinal County solar plant Copper Crossing #SRP http://t.co/YKTdsnqSqo,RebekahLSanders,361152473714548736,,,
360865726766133250,240760644,repgosar,Twitter Web Client,2013-07-26 20:54:28,8,0,"The union representing #IRS employees doesn't want Obamacare coverage, despite the IRS’s role implementing the law. http://t.co/G33U9pgzWO",,,,,
360834110622670848,240760644,repgosar,Twitter Web Client,2013-07-26 18:48:50,5,4,"Overlooking 144 acres of solar panels in Florence #AZ. Powers 3,400 homes. #alloftheaboveenergy http://t.co/s0ALh5Efqy",,,,,
360828261959352320,240760644,repgosar,Twitter Web Client,2013-07-26 18:25:36,36,0,"RT @repjustinamash: Supported my #NSA amdt =&gt; “@RepGosar: We're nearing 8,000 twitter followers. Can you help me get there? Thank you all f…",,,360819748684054528,233842454,repjustinamash
360815524961189889,240760644,repgosar,Twitter for iPhone,2013-07-26 17:34:59,4,0,"We're nearing 8,000 twitter followers. Can you help me get there? Thank you all for your support. #FF",,,,,
360813557757116417,240760644,repgosar,Twitter for iPhone,2013-07-26 17:27:10,1,0,"RT @IberdrolaRen: Our Copper Crossing Solar Ranch had a special guest today, @RepGosar! We hope you had a wonderful time touring our facili…",,,360809693385465856,545452448,IberdrolaRen
360781549471416321,240760644,repgosar,Twitter Web Client,2013-07-26 15:19:59,9,6,"""What's The Difference Secretary Clinton? My son is dead. That's the difference."" via @FoxNews http://t.co/ZU0sC0gzmB",,,,,
360502048170582016,240760644,repgosar,Twitter Web Client,2013-07-25 20:49:20,3,2,"My heart goes out for family of Arizonan &amp; ASU grad 1Lt Jonam Russell, who was killed in AFG on Tues. Keep Russell family in your prayers",,,,,
360487549657022464,240760644,repgosar,Twitter Web Client,2013-07-25 19:51:44,16,5,Lady Justice wears a blindfold. So why does Attorney General Holder dispense his version of justice partially? http://t.co/Frwd2zkAQ7,,,,,
360481735785459714,240760644,repgosar,Twitter Web Client,2013-07-25 19:28:37,9,2,RT @KatiePavlich: @RepGosar: Let's Shed Some Light on Holder's Blatant Disregard For the Law http://t.co/8Yb5UMYcBk,,,,,
360468014904246272,240760644,repgosar,Twitter Web Client,2013-07-25 18:34:06,3,1,I will be speaking with @CamAndCompany of NRA Radio about Attorney General Holder's failure to seek justice. LIVE: http://t.co/c0UOtPguly,,,,,
360463614336966656,240760644,repgosar,Twitter Web Client,2013-07-25 18:16:37,5,0,"RT @CamAndCompany: LIVE @ 2P/E: @RepGosar, @KurtSchlichter, @StacyOnTheRight, @EditMeDavid, @HHShootingSport, Hero &amp; Deal of the day, and m…",,,360452023138783232,325897784,CamAndCompany
360451996630777856,240760644,repgosar,Twitter Web Client,2013-07-25 17:30:27,1,2,Really enjoyed having lunch w/ @GrahamJones_MP and other members of Parliament today. Thank you all for joining me,,,,,
360415375717969920,240760644,repgosar,Twitter Web Client,2013-07-25 15:04:56,5,2,"For an admin promising new era of transparency, its secrecy &amp; obstructionism has turned from hypocritical to ironic http://t.co/HACeqjfhHp",,,,,
360412595615834112,240760644,repgosar,Twitter Web Client,2013-07-25 14:53:53,12,4,"RT if you agree that convenience, not the law, has been Attorney General Holder's way. #ShortCutKing #tcot http://t.co/HACeqjfhHp",,,,,
360405284348379137,240760644,repgosar,Twitter Web Client,2013-07-25 14:24:50,10,4,"""The Short Cut King At Justice: Convenience Not The Law Is The Eric Holder Way"" My op-ed in this morning's @WashTimes http://t.co/HACeqjfhHp",,,,,
360384063602831361,240760644,repgosar,Twitter for iPhone,2013-07-25 13:00:31,7,5,"Yesterday, I took to the people's pulpit to highlight Attorney General Holder's disregard for the rule of law. This morning I return. #tcot",,,,,
360190187210412032,240760644,repgosar,Twitter Web Client,2013-07-25 00:10:07,100,76,I voted to restore civil liberties and uphold the Constitution. I voted for @repjustinamash's amendment today. http://t.co/JZuUYEBXHg,,,,,
360189226588971009,240760644,repgosar,Twitter Web Client,2013-07-25 00:06:18,10,6,"While some in #Congress desperately want to continue the #NSA’s domestic spying, I defended the 4th Amendment. http://t.co/JZuUYEBXHg",,,,,
360140604316983296,240760644,repgosar,Twitter Web Client,2013-07-24 20:53:05,2,0,I applaud the @NatResources Committee today for making the right decision in passing the Keep the Promise Act of 2013 http://t.co/OzUNHFhCpM,,,,,
360117320389103617,240760644,repgosar,Twitter Web Client,2013-07-24 19:20:34,5,2,"During Pres Obama's first term, fed govt accumulated more debt than it did under the first 42 U.S  presidents combined.  #RhetoricVsReality",,,,,
360116445826408448,240760644,repgosar,Twitter Web Client,2013-07-24 19:17:06,7,1,The unemployment rate has been at 7.5 percent or higher for 54 months in a row - the longest stretch in U.S. history. http://t.co/OFZZWy5D8A,,,,,
360080145102536705,240760644,repgosar,Twitter Web Client,2013-07-24 16:52:51,91,19,RT if you agree Attorney General Holder must resign immediately for his blatant disregard of the rule of law. #tcot http://t.co/LiQRQLOC3O,,,,,
360075956829954050,240760644,repgosar,Twitter Web Client,2013-07-24 16:36:12,6,2,An ordinary citizen would go to jail for lying to Congress about an investigation. http://t.co/DTl7K7yiP0 #HolderNotFit,,,,,
360075292594814976,240760644,repgosar,Twitter Web Client,2013-07-24 16:33:34,9,6,An ordinary citizen would go to jail for secretly obtaining phone records and emails. AG Holder must resign. #HolderNotFit,,,,,
360074517269331969,240760644,repgosar,Twitter Web Client,2013-07-24 16:30:29,14,7,An ordinary citizen would go to jail for selling guns to Mexican drug cartels. AG Holder must resign now. #HolderNotFit,,,,,
360072754629840896,240760644,repgosar,Twitter Web Client,2013-07-24 16:23:29,9,4,AG Holder shouldn’t be immune from prosecution or given license to act without restraint.  #HolderNotFit,,,,,
360070655871422464,240760644,repgosar,Twitter Web Client,2013-07-24 16:15:08,4,4,AG Holder’s violations of the law are egregious. He’s not fit for office and must resign. http://t.co/AxJGFU3qNq #HolderNotFit,,,,,
360067144244936704,240760644,repgosar,Twitter Web Client,2013-07-24 16:01:11,42,18,"Today, I shed light on Attorney General Eric Holder’s blatant disregard for the rule of law. http://t.co/DTl7K7yiP0",,,,,
360048507819790340,240760644,repgosar,Twitter Web Client,2013-07-24 14:47:08,24,2,#WhatPeopleDontRealize is the average duration of unemployment almost doubled from 19.8 to 35.6 weeks since Pres. Obama took office,,,,,
360036912356007941,240760644,repgosar,Twitter Web Client,2013-07-24 14:01:03,3,0,Proud to co-sponsor the Planning for American Energy Act. We must develop all energy sources on all possible lands #AllOfTheAboveEnergyPlan,,,,,
359781755777060864,240760644,repgosar,Twitter Web Client,2013-07-23 21:07:09,1,0,"Last week, I spoke with KAWC radio about former DHS Secretary Napolitano’s failure to uphold the rule of law. http://t.co/WmjnoW2NZJ",,,,,
359762083463712768,240760644,repgosar,Twitter Web Client,2013-07-23 19:48:59,3,0,Pres. #Obama's record on the economy is clear: sluggish growth &amp; fewer jobs. It's time to enact pro-growth policies http://t.co/y9hYgDI2Yf,,,,,
359732227564777474,240760644,repgosar,Twitter Web Client,2013-07-23 17:50:21,26,2,#Obamacare is one of the worst laws Congress passed since Prohibition. We have to make every effort prevent this disaster. RT if you agree,,,,,
359731510615621632,240760644,repgosar,Twitter Web Client,2013-07-23 17:47:30,5,3,Democrats have even admitted #Obamacare is a “train wreck” – a phrase that insults train wrecks. http://t.co/hBUuDY9mPx …,,,,,
359725106156675072,240760644,repgosar,Twitter Web Client,2013-07-23 17:22:03,2,0,"Today, I recognized Robert Davies who truly met the definition of a “hero” for coming to the aid of his neighbor  http://t.co/wIN0EIhTnw",,,,,
359689017119350785,240760644,repgosar,Twitter Web Client,2013-07-23 14:58:39,2,0,Did you know there are 2.2 million fewer people employed than before the recession? We need pro-growth policies http://t.co/tjuHwqhrxA,,,,,
359401959746322432,240760644,repgosar,Twitter Web Client,2013-07-22 19:57:59,17,8,"Congrats to the royal family! If the #RoyalBaby were born a US citizen, he'd inherit more than $53,340 in debt. http://t.co/LSwX5dhcBU",,,,,
359395967432261635,240760644,repgosar,Twitter Web Client,2013-07-22 19:34:10,1,0,Who do you trust to make the best decision about your child's education? Parents &amp; teachers or DC bureaucrats? http://t.co/Um36dItLzP,,,,,
359329278220959744,240760644,repgosar,Twitter Web Client,2013-07-22 15:09:10,2,1,Please be careful. Monsoon rain and flooding is here. #Arizona http://t.co/ZGECsC0Y4e,,,,,
358310710612205568,240760644,repgosar,Twitter Web Client,2013-07-19 19:41:45,3,1,No Child Left Behind proved disastrous. We owe our students a higher quality education https://t.co/WWWuKDV2Zr,,,,,
358301683450781696,240760644,repgosar,Twitter Web Client,2013-07-19 19:05:52,3,1,"Today, I voted in favor of the Student Success Act, which comprehensively reforms No Child Left Behind http://t.co/FMmHGqX3iv",,,,,
358285519022592001,240760644,repgosar,Twitter Web Client,2013-07-19 18:01:39,2,0,"When it comes to reforming forest management, it can’t be tomorrow, it can’t be in a month. It’s got to be now.  http://t.co/2VOab4RGS2",,,,,
358246585567690753,240760644,repgosar,Twitter Web Client,2013-07-19 15:26:56,3,0,Thank you Clint Handley &amp; Mark Johnson of Prescott. Both just returned from service in Afghanistan w/ National Guard. http://t.co/n8Ci21RpMV,,,,,
358231673369919490,240760644,repgosar,Twitter Web Client,2013-07-19 14:27:41,1,1,"Yesterday, I spoke to a group of AZ TARs visiting Capitol Hill. Great to spend time w/ our next generation of leaders http://t.co/Pk6lqANqMu",,,,,
357892182906126336,240760644,repgosar,Twitter Web Client,2013-07-18 15:58:40,5,2,"Yesterday, I discussed the importance of wildfire prevention on Bloomberg TV. http://t.co/HwyCORpQOh",,,,,
357874111147540480,240760644,repgosar,Twitter Web Client,2013-07-18 14:46:51,56,1,OGR hearing today at 11AM (EST) entitled “The IRS’s Systematic Delay and Scrutiny of Tea Party Applications” http://t.co/DmGHqwWxKn,,,,,
357642586900541443,240760644,repgosar,Twitter Web Client,2013-07-17 23:26:52,17,12,I voted to delay implementation of #Obamacare with the intention that in the next year we will scrap this law. http://t.co/hBUuDY9mPx,,,,,
357642470500208641,240760644,repgosar,Twitter Web Client,2013-07-17 23:26:24,17,6,Democrats have admitted #Obamacare is a “train wreck” – a phrase that insults train wrecks. http://t.co/hBUuDY9mPx,,,,,
357642032937840640,240760644,repgosar,Twitter Web Client,2013-07-17 23:24:39,30,8,#Obamacare is the worst law Congress passed since Prohibition. I'll make every effort prevent this disaster. http://t.co/hBUuDY9mPx,,,,,
357590988216213506,240760644,repgosar,Twitter Web Client,2013-07-17 20:01:49,0,0,"In a few minutes, I will be speaking with Bloomberg TV about the resignation of Secretary Napolitano. Tune in LIVE http://t.co/OsVDquqid5",,,,,
357572276620759041,240760644,repgosar,Twitter Web Client,2013-07-17 18:47:28,3,0,71% of small businesses say #Obamacare makes it harder to hire http://t.co/xO1xt7LKRE,,,,,
357556602276024322,240760644,repgosar,Twitter Web Client,2013-07-17 17:45:11,3,3,"As I am close to 2,000 likes, thank you for all of the shared stories and comments on my #Facebook page.  https://t.co/XyH2lN4fHK",,,,,
357505505582784515,240760644,repgosar,Twitter Web Client,2013-07-17 14:22:09,0,1,"This morning, the House Oversight Committee will be discussing border security oversight &amp; examining asylum requests  http://t.co/RaMOWNNqM8",,,,,
357223601088380928,240760644,repgosar,Twitter Web Client,2013-07-16 19:41:58,92,16,"Please RT if you believe, as I do, that Attorney General Holder should follow Secretary #Napolitano’s lead &amp; resign. http://t.co/4o5Ojp9HlO",,,,,
357208052509847552,240760644,repgosar,Twitter Web Client,2013-07-16 18:40:10,2,0,"At tomorrow's @NatResources hearing, Sec. of Interior Sally Jewell will testify. What questions would you ask her? #tcot #AZ",,,,,
357201246786031616,240760644,repgosar,Twitter Web Client,2013-07-16 18:13:08,8,1,Residents across AZ make one thing clear: the federal govt’s red-tape is holding our economy back. RT if you agree.   http://t.co/25ItAzs1Do,,,,,
357154553327661056,240760644,repgosar,Twitter Web Client,2013-07-16 15:07:35,3,1,"Last weekend, I spoke with folks in Prescott Valley about securing our border first and foremost. http://t.co/LMa2i6LxjD",,,,,
356854261335855104,240760644,repgosar,Twitter Web Client,2013-07-15 19:14:20,0,0,"On Saturday, I was honored to attend the grand opening of the #Prescott Area Shelter Services' new family shelter. http://t.co/swkMPryiuB",,,,,
356818473193717761,240760644,repgosar,Twitter Web Client,2013-07-15 16:52:08,2,0,"Tune in to @KAWC in a few minutes as I will be discussing the FARRM bill, and why I voted for real reform.  http://t.co/RnjMO4Zl1m",,,,,
356804354080124928,240760644,repgosar,Twitter Web Client,2013-07-15 15:56:01,4,2,Are President Obama’s policies making us a nation of part-time workers when people are in need of full-time jobs? http://t.co/xyCwT9TZzm,,,,,
356804263369900035,240760644,repgosar,Twitter Web Client,2013-07-15 15:55:40,4,0,The (un)intended consequences of Obamacare: employers cut down on hiring full-time workers due to insurance costs. http://t.co/xyCwT9TZzm,,,,,
356785598272507905,240760644,repgosar,Twitter Web Client,2013-07-15 14:41:30,1,0,This morning I will be on KBLU radio to discuss Secretary #Napolitano’s resignation.   http://t.co/gLGNuyBz8Q,,,,,
355809549598474242,240760644,repgosar,Twitter Web Client,2013-07-12 22:03:02,2,0,Great meeting today with @ASU and @ASUbiodesign's Dr. Raymond DuBois and Sethuraman Panchanathan. http://t.co/EQveWBPvZs,,,,,
355808895664521220,240760644,repgosar,Twitter for iPhone,2013-07-12 22:00:26,13,0,RT @mboyle1: .@RepGosar on Napolitano Resignation: Eric Holder Should 'Follow Her Lead': http://t.co/KWjgApKplW,,,355808852123459584,21426423,mboyle1
355790078666215425,240760644,repgosar,Twitter Web Client,2013-07-12 20:45:39,3,1,I recently spoke with the Mohave Valley Daily News about the need for wildfire prevention policies. http://t.co/lUgsoNWPiA,,,,,
355755613831176192,240760644,repgosar,Twitter Web Client,2013-07-12 18:28:42,50,10,What the American people need now is for Attorney General Eric Holder to follow Secretary #Napolitano's lead &amp; resign http://t.co/NNNH9ZVCxp,,,,,
355723124123246594,240760644,repgosar,Twitter Web Client,2013-07-12 16:19:36,0,0,"Bat-Sheva Hayat, mother of fallen Israeli firefighter, attended Prescott service &amp; presented me w/ poster of her son http://t.co/EtmdbypMs7",,,,,
355433382345310208,240760644,repgosar,Twitter Web Client,2013-07-11 21:08:16,17,10,"Riddled w/ pork, rewarding law breakers &amp; making false promises, I cannot support the Senate passed immigration bill. http://t.co/q2MrbhAvo8",,,,,
355428403601612801,240760644,repgosar,Twitter Web Client,2013-07-11 20:48:29,2,2,"#AZ04 is a destination location! #open4biz RT @YumaArizona Yay, our Congressman @RepGosar is a member of the Travel &amp; Tourism caucus #AZGCOT",,,,,
355423977293873152,240760644,repgosar,Twitter Web Client,2013-07-11 20:30:54,5,2,I made clear this morning @NatResources that my #wildfire bill is needed now more than ever. http://t.co/zwcB19guy9,,,,,
355395316155027456,240760644,repgosar,Twitter Web Client,2013-07-11 18:37:00,1,1,My amdt to stop #Arizona energy prices from skyrocketing passed yesterday as part of the Energy and Water bill http://t.co/yfUfHsB5Zv,,,,,
355394504687230976,240760644,repgosar,Twitter Web Client,2013-07-11 18:33:47,4,1,We MUST cut spending while prioritizing &amp; preserving our most vital programs. Passage of Energy and Water bill accomplishes just that. #tcot,,,,,
355332185869398017,240760644,repgosar,Twitter Web Client,2013-07-11 14:26:09,6,5,At the @NatResources hearing to urge my colleagues to support the Catastrophic Wildfire Prevention Act. Watch here: http://t.co/Jr5xJnOSjO,,,,,
355182818055290880,240760644,repgosar,Twitter for iPhone,2013-07-11 04:32:37,6,2,"It's great news that #Yarnellfire is 100% contained. The ppl of Prescott, Peeple's Valley &amp; Yarnell have been thru so much these past 2 wks",,,,,
355080913627004930,240760644,repgosar,Twitter Web Client,2013-07-10 21:47:41,0,1,Yarnell UPDATE: the #Yarnell Post Office has resumed operations. http://t.co/A5nHtM3ewR,,,,,
355078311107502083,240760644,repgosar,Twitter Web Client,2013-07-10 21:37:21,1,2,Sent a letter to Pres. #Obama asking him to consider request for Major Disaster Declaration for AZ b/c #Yarnell Fire. http://t.co/sSnmniJ8FH,,,,,
355077559538561024,240760644,repgosar,Twitter Web Client,2013-07-10 21:34:21,2,0,Sent a letter to Pres. #Obama asking him to consider request for Major Disaster Declaration for AZ b/c #Yarnell Fire http://t.co/uiftEa7u8l,,,,,
355064974848180225,240760644,repgosar,Twitter Web Client,2013-07-10 20:44:21,0,0,I-11 will create thousands of #jobs and facilitate commerce between Phoenix and Las Vegas http://t.co/qf8WQSwOIU,,,,,
355054426064560128,240760644,repgosar,Twitter Web Client,2013-07-10 20:02:26,3,1,My colleagues and I held a moment of silence on the House floor to honor the #Yarnell 19’s ultimate act of courage:  http://t.co/n5PRplxjVB,,,,,
355052567476178945,240760644,repgosar,Twitter for iPhone,2013-07-10 19:55:03,3,0,"RT @dannowicki: Arizona's @RepGosar, who represents area where the Granite Mountain Hotshots died, led House in moment of silence: http://t…",,,355051578534797313,19629840,dannowicki
355024912303394816,240760644,repgosar,Twitter Web Client,2013-07-10 18:05:09,4,2,I'm headed to the House floor to hold a moment of silence with my colleagues of the AZ delegation for the #Yarnell 19 http://t.co/aV619fWi77,,,,,
354988050679480322,240760644,repgosar,Twitter Web Client,2013-07-10 15:38:41,5,1,The #Obama Administration’s 2013 regulations could cost over $130 billion. This will stifle economic growth. http://t.co/0fhawQZjxW,,,,,
354987795242168321,240760644,repgosar,Twitter Web Client,2013-07-10 15:37:40,7,1,"Every elected official should be against over-regulation, which leads to job losses &amp; makes it difficult for those who are struggling. #tcot",,,,,
354986464397897728,240760644,repgosar,Twitter Web Client,2013-07-10 15:32:23,3,1,Price tag for proposed and current #Obama Administration regulations for 2013 could be over $130 billion #tcot http://t.co/0fhawQZjxW,,,,,
354730571265609729,240760644,repgosar,Twitter Web Client,2013-07-09 22:35:33,9,3,The #IRS is effective @ 2 things - collecting your $ and targeting political opposition. Time we cut their budget. http://t.co/9XwBjJ8OoN,,,,,
354646953742704640,240760644,repgosar,Twitter Web Client,2013-07-09 17:03:17,12,2,"Joined by @RepTrentFranks, @RepMattSalmon, @RepKirkpatrick, @RepRonBarber @RepSinema at memorial service. #Yarnell19 http://t.co/nkVHHmjRck",,,,,
354646505350635521,240760644,repgosar,Twitter Web Client,2013-07-09 17:01:30,4,1,Let us never forget the stories of these brave firefighters &amp; may we remain committed to preventing future tragedies such as this #Yarnell19,,,,,
354646288018587651,240760644,repgosar,Twitter Web Client,2013-07-09 17:00:38,5,2,"Together, we mourn the loss of 19 fallen heroes and honor their courageous sacrifice. #Yarnell19",,,,,
354646138969784321,240760644,repgosar,Twitter Web Client,2013-07-09 17:00:03,10,3,"Today we are all Arizonans, as the sadness touching the #Yarnell community stretches across the country.",,,,,
354645808378941440,240760644,repgosar,Twitter Web Client,2013-07-09 16:58:44,4,3,Today we all mourn and honor the #Yarnell 19 and pray for their families.,,,,,
354644012059205632,240760644,repgosar,Twitter Web Client,2013-07-09 16:51:36,2,2,Arizona is known for it’s 5 C’s but today we have a 6th – Community. #Yarnell,,,,,
354641813560233985,240760644,repgosar,Twitter Web Client,2013-07-09 16:42:51,6,2,Citizens &amp; firefighters from across the country and world will stand with the families of 19 heroes today. Please RT to stand w/ us #Yarnell,,,,,
354638875823583232,240760644,repgosar,Twitter Web Client,2013-07-09 16:31:11,0,0,Headed to the memorial service to honor the heroic #Yarnell 19 who gave their lives protecting our community. Watch: http://t.co/Q05ym3ybPX,,,,,
354622347040395264,240760644,repgosar,Twitter Web Client,2013-07-09 15:25:30,1,1,"Shortly, I will be speaking with Lou and Tonya of the AZTV Morning Scramble about the #Yarnell 19.  Watch live. http://t.co/Cd5VzZvr6u",,,,,
354349011576160256,240760644,repgosar,Twitter Web Client,2013-07-08 21:19:22,12,1,This story is deeply troubling. The #TSA stripped this decorated and wounded Marine of his dignity http://t.co/bMfK8jKuEA,,,,,
354338648956731392,240760644,repgosar,Twitter Web Client,2013-07-08 20:38:11,3,0,"RT @CamAndCompany: 5P/E: Live! @CamEdwards is back in the saddle, joining us @RepGosar, Samantha Olsen from the @NRA and Curator's Corner o…",,,354336699389706240,325897784,CamAndCompany
354330662821580801,240760644,repgosar,Twitter Web Client,2013-07-08 20:06:27,0,0,I am at the American Legion Post 12 in Wickenburg meeting w/ resilient Arizonans who were displaced by #Yarnell Fire http://t.co/23U8UvC3PN,,,,,
354300407218061312,240760644,repgosar,Twitter Web Client,2013-07-08 18:06:14,3,1,Headed to #Wickenburg today to meet with Arizonans displaced by the Yarnell Fire. Here is my interview from last week http://t.co/KYodvRBD3F,,,,,
354247121593049088,240760644,repgosar,Twitter Web Client,2013-07-08 14:34:30,7,2,"#Obamacare subsidies to be distributed using honor system. Likely result: billions of dollars of waste, fraud &amp; abuse http://t.co/xO2rHlVoLP",,,,,
352821558533816321,240760644,repgosar,Twitter Web Client,2013-07-04 16:09:49,3,2,My family and I wish you and yours a happy and safe Fourth of July. http://t.co/DTUa0TRnGE #Freedom,,,,,
352520151733780480,240760644,repgosar,Twitter for iPhone,2013-07-03 20:12:08,4,0,"RT @CamAndCompany: LIVE @ 2P/E: Arizona @RepGosar, Rep. @MikeKellyPA, @Rare's @TabithaHale, @GOALupdate, @NSSF, @MichaelWNewbern, and more …",,,352481975925346305,325897784,CamAndCompany
352504106302189569,240760644,repgosar,Twitter Web Client,2013-07-03 19:08:22,6,1,"The administration thought #Obamacare looked good from afar, but as it's implemented, it has looked far from good. RT if you agree #tcot",,,,,
352498571427319809,240760644,repgosar,Twitter Web Client,2013-07-03 18:46:23,6,3,"My staff  will hold a Veterans Roundtable in #Payson on Tuesday, July 23rd. http://t.co/ajbIheLLZv",,,,,
352494722549432320,240760644,repgosar,Twitter Web Client,2013-07-03 18:31:05,10,2,I support #FULLREPEAL of #Obamacare. This disastrous law is bad for Americans. We need patient-centered &amp; market-based reforms to healthcare,,,,,
352492409214611456,240760644,repgosar,Twitter Web Client,2013-07-03 18:21:54,6,1,"A lot like a jenga tower, #Obamacare is coming apart piece by piece. #tcot",,,,,
352469422818070529,240760644,repgosar,Twitter Web Client,2013-07-03 16:50:33,40,6,"As #Obamacare collapses under its own weight, we need to replace it w/ patient-centered and market-based reforms. RT if you agree",,,,,
352469299618791425,240760644,repgosar,Twitter Web Client,2013-07-03 16:50:04,8,0,"3 years after #Obamacare became law, its implementation looks like a jenga tower: coming apart piece by piece &amp; increasingly unsustainable",,,,,
352442183997067264,240760644,repgosar,Twitter Web Client,2013-07-03 15:02:19,5,1,Key portion of #Obamacare implementation delayed. Another clear signal it isn’t working. It’s time for real health care reform,,,,,
352179337417588736,240760644,repgosar,Twitter Web Client,2013-07-02 21:37:51,4,1,I would like to thank everyone who showed their support last night by attending the #Yarnell Fire Memorial Service http://t.co/rVVwNZ8yky,,,,,
352095915252793344,240760644,repgosar,Twitter Web Client,2013-07-02 16:06:22,2,0,UPDATE: #Yarnell residents displaced by the fire can pick up their mail in Wickenburg.http://t.co/Jyd16Cv1kU,,,,,
352062505465552899,240760644,repgosar,Twitter for iPhone,2013-07-02 13:53:36,1,0,RT @nicolecrites: Tune to #cbs5 now! @patmcreynolds talking live with @RepGosar from #prescott talking about the #yarnell19 http://t.co/Fp4…,,,352062254876876800,20074963,nicolecrites
351950686772142080,240760644,repgosar,Twitter for BlackBerry®,2013-07-02 06:29:17,13,0,RT @abc15: Want to help those affected by the #YarnellHillFire? Here are some organizations that are working to help http://t.co/kcBCTsBn8X,,,351946424180678658,9721292,abc15
351885174151184384,240760644,repgosar,Twitter for iPhone,2013-07-02 02:08:57,10,5,The outpouring of support tonight was overwhelming and demonstrated the strength of our community. I am proud to be an Arizonan. #Yarnell,,,,,
