id,user_id,screen_name,source,created_at,retweet_count,favorite_count,text,in_reply_to_screen_name,in_reply_to_status_id,retweeted_status_id,retweeted_status_user_id,retweeted_status_screen_name
627264147370045440,22669526,repgwenmoore,Twitter Web Client,2015-07-31 23:46:41,119,86,The only place defunding @PPFA will get you is a place where millions lack access to vital health care. #StandWithPP http://t.co/nExo0Dfpms,,,,,
627195066575126528,22669526,repgwenmoore,Twitter Web Client,2015-07-31 19:12:11,3,1,10 women lodged formal complaint accusing #ICE of providing inadequate #MedicalCare in their family detention centers http://t.co/vuIdaFNZG8,,,,,
627125223448518656,22669526,repgwenmoore,Twitter Web Client,2015-07-31 14:34:39,7,5,"Numbers don’t lie: Drug testing the poor = waste of time/$, but @GovWalker continues to push this vile policy on #WI. http://t.co/rrOW2NBe6R",,,,,
626819517751144449,22669526,repgwenmoore,Twitter Web Client,2015-07-30 18:19:53,6,7,"50 years ago today, President Lyndon Baines Johnson signed #Medicare into law. #MedicareAt50 #HealthCareIsAHumanRight http://t.co/A7cYc4fU5k",,,,,
626771534191951872,22669526,repgwenmoore,Twitter Web Client,2015-07-30 15:09:13,1,0,Great discussion w/ @JoyCardinShow about my @Salon piece on @GovWalker's ongoing campaign to dismantle WI's #GunLaws. http://t.co/HGvrvPdfWy,,,,,
626762345583374336,22669526,repgwenmoore,Twitter Web Client,2015-07-30 14:32:42,1,2,It's always a shame when someone as smart as Senator @tedcruz says something so foolish about @POTUS &amp; the #IranDeal. http://t.co/kSfayGh8f9,,,,,
626505841496203264,22669526,repgwenmoore,Twitter Web Client,2015-07-29 21:33:27,9,9,I want to offer my deepest condolences to the family of #SamuelDubose during this difficult time. http://t.co/fRPRfxiKy7,,,,,
626494768835624964,22669526,repgwenmoore,Twitter Web Client,2015-07-29 20:49:27,3,1,"""This case represents an unduly burden on a woman's fundamental, constitutional right to have an abortion"" http://t.co/Loj3PSfgV4 #prochoice",,,,,
626419272655499264,22669526,repgwenmoore,Twitter Web Client,2015-07-29 15:49:27,51,8,The death of #RaynettaTurner marks the fifth #BlackWoman — that we know of — to die behind bars in the month of July. http://t.co/APZ7XzeFWK,,,,,
626103107500548097,22669526,repgwenmoore,Twitter Web Client,2015-07-28 18:53:07,16,11,Does this look like #equality to you? #BlackWomen only make 64% of a white male’s earnings. #BlackWomenEqualPay http://t.co/cTke7nzsrc,,,,,
626073030641516548,22669526,repgwenmoore,Twitter Web Client,2015-07-28 16:53:37,6,8,#BlackWomen: paid just 64¢ for every dollar paid to a white man. Sound fair? Didn't think so. Join us: Tweet #BlackWomenEqualPay at 2pm ET!,,,,,
626055143277117441,22669526,repgwenmoore,Twitter Web Client,2015-07-28 15:42:32,3,2,Discrimination has no place in scouting. I applaud the @boyscouts for ending their ban on openly gay adult leaders. http://t.co/6jnHQNyt7X,,,,,
625754818901114880,22669526,repgwenmoore,Twitter Web Client,2015-07-27 19:49:09,3,1,Follow our new @instagram page created by our interns about their experiences on #CapitolHill https://t.co/l6eMC95oxi http://t.co/eLFcVifEd4,,,,,
625741906165821441,22669526,repgwenmoore,Twitter Web Client,2015-07-27 18:57:50,3,0,Can @SpeakerBoehner fight off @GOP extremists in his own camp to reauthorize @EximBankUS &amp; help American businesses? http://t.co/hZEVZqIWxD,,,,,
625678012869156864,22669526,repgwenmoore,Twitter Web Client,2015-07-27 14:43:57,5,5,I commend @POTUS for strongly condemning 2nd-class treatment of #WomenAndGirls in his address in #Nairobi yesterday. http://t.co/3uti88UGHh,,,,,
624692302989164545,22669526,repgwenmoore,Twitter for iPhone,2015-07-24 21:27:05,2,5,"Honored to be here with you, @POTUS. https://t.co/WZ7w4BAGov",,,,,
624655490631475201,22669526,repgwenmoore,Twitter Web Client,2015-07-24 19:00:49,11,8,Happy to join @POTUS &amp; my @OfficialCBC colleagues on this historic trip to Kenya &amp; Ethiopia. #Africa #AirForceOne http://t.co/p90IEzOrRu,,,,,
624590304281235456,22669526,repgwenmoore,Twitter Web Client,2015-07-24 14:41:47,8,4,"“We asked @SenRonJohnson's office what he meant, &amp; at first they thought we must have misheard him. We didn’t.” #SMH http://t.co/R7XOGCL71V",,,,,
624334834048106496,22669526,repgwenmoore,Twitter Web Client,2015-07-23 21:46:38,4,2,Join me tomorrow for my 1-on-1 w/ @LukeRussert about @GovWalker's record. Tune in at 10am ET: http://t.co/6HF2FKEh8c http://t.co/UlS4fJcjhp,,,,,
624330512589524992,22669526,repgwenmoore,Twitter Web Client,2015-07-23 21:29:28,8,1,The pasage of this anti-immigrant @GOP bill threatens victims of domestic violence/sexual assault/#HumanTrafficking. http://t.co/BlvUFcO2O7,,,,,
624289227736526848,22669526,repgwenmoore,Twitter Web Client,2015-07-23 18:45:25,2,1,It's clear from his comments about @JohnKerry that @SenTomCotton cares more about politics than the actual #IranDeal. http://t.co/DEDGDYExS3,,,,,
624211363477352448,22669526,repgwenmoore,Twitter Web Client,2015-07-23 13:36:00,3,1,Addressing #GunViolence will always be an uphill battle as long as @NRA keeps their stranglehold on @GovWalker/@GOP. http://t.co/pEoJtCJMfG,,,,,
624013186577076225,22669526,repgwenmoore,Twitter Web Client,2015-07-23 00:28:31,21,17,"This is NOT a joke: If you see the #MKElion, call 911. Please do NOT try to shoot it. #ThingsYouNeverThoughtYoudTweet http://t.co/3cbF0i6NEL",,,,,
623956695694331904,22669526,repgwenmoore,Twitter Web Client,2015-07-22 20:44:03,5,0,I want to thank @SenatorBaldwin for her leadership in helping us shed a national spotlight on #DontreHamilton's story http://t.co/FGXnWN26cX,,,,,
623910398295691264,22669526,repgwenmoore,Twitter Web Client,2015-07-22 17:40:05,4,2,Headed to the @WhiteHouse to meet with @POTUS &amp; small business owners to discuss the importance of reauthorizing the @EximBankUS. #ExIm4Jobs,,,,,
623885039332380674,22669526,repgwenmoore,Twitter Web Client,2015-07-22 15:59:19,2,2,#ExIm Bank represents a vital pillar of US competitiveness. @HouseDemocrats support workers! We support small biz! We support #ExIm4Jobs!,,,,,
623627476829401088,22669526,repgwenmoore,Twitter for iPhone,2015-07-21 22:55:51,4,7,Some goals seem impossible but our collective activity will make it happen! Thanks @RESULTS_Tweets. #Voices4RESULTS http://t.co/ze6K7r478g,,,,,
623606365869731840,22669526,repgwenmoore,Twitter Web Client,2015-07-21 21:31:58,1,1,Happy to see @Pontifex tackle #ModernDaySlavery &amp; #ClimateChange w/ mayors from across the globe. #EndTrafficking    http://t.co/iU2Yo4lsbF,,,,,
623567101916278784,22669526,repgwenmoore,Twitter for iPhone,2015-07-21 18:55:57,9,0,RT @SenatorBaldwin: Read the letter @RepGwenMoore &amp; I sent @TheJusticeDept's @LorettaLynch calling for updates on #DontreHamilton case: htt…,,,623537672896794624,1074518754,SenatorBaldwin
623494348114685952,22669526,repgwenmoore,Twitter Web Client,2015-07-21 14:06:51,10,5,Today @SenatorBaldwin &amp; I sent a letter to @TheJusticeDept asking @LorettaLynch for updates on #DontreHamilton's case http://t.co/MNZj9VuQHa,,,,,
623259400321519616,22669526,repgwenmoore,Twitter Web Client,2015-07-20 22:33:15,7,3,"#Shameful: With a stroke of a pen, @GovWalker just made it illegal for WI women to have an abortion after 20 weeks. http://t.co/GAYHhumIYO",,,,,
623155516831891456,22669526,repgwenmoore,Twitter Web Client,2015-07-20 15:40:27,6,5,"Thanks to #WallStReform, shareholders of US corporations have a “say-on-pay” voting to approve or disapprove CEO payouts. #WallStReformWorks",,,,,
622407091878273024,22669526,repgwenmoore,Twitter for iPhone,2015-07-18 14:06:29,11,11,"Now, more than ever, I need the passion &amp; influence of @RESULTS_Tweets to create the political will to expand #EITC. http://t.co/hFMwuglZqH",,,,,
622402080989421568,22669526,repgwenmoore,Twitter for iPhone,2015-07-18 13:46:34,9,7,"When I see @RESULTS_Tweets volunteers roaming the halls of Rayburn/Russell/Longworth, I know #SNAP is in good hands. http://t.co/I49QkG8e5N",,,,,
622398829070024705,22669526,repgwenmoore,Twitter for iPhone,2015-07-18 13:33:39,12,12,Poverty doesn't distinguish between weekdays/weekends. I gladly share my Saturday w/ these @RESULTS_Tweets advocates https://t.co/Jqenon7tri,,,,,
622393537519316992,22669526,repgwenmoore,Twitter for iPhone,2015-07-18 13:12:37,8,5,Happy to share the stage w/ @marwilliamson &amp; Linda Mafu at @RESULTS_Tweets International Conference. #talkpoverty #p2 http://t.co/yt4sfXGQtW,,,,,
622381993452531712,22669526,repgwenmoore,Twitter for iPhone,2015-07-18 12:26:45,5,0,RT @Crickovich: #Voices4RESULTS Looking forward 2 this today! MT @RepGwenMoore: I'm thrilled to join @RESULTS_Tweets advocates 2 discuss ho…,,,622381472637427717,20958934,Crickovich
622154673210855424,22669526,repgwenmoore,Twitter Web Client,2015-07-17 21:23:27,2,1,We don't always see eye-to-eye but it looks like @RickSantorum &amp; I agree that we must reauthorize the @EximBankUS. http://t.co/Gcllnzh7Ya,,,,,
622098302918656000,22669526,repgwenmoore,Twitter Web Client,2015-07-17 17:39:28,7,5,Join me tomorrow AM at @RESULTS_Tweets IC as I discuss what we can do as a country to strengthen our #SocialSafetyNet http://t.co/kPG3VQGLsw,,,,,
621835305306464256,22669526,repgwenmoore,Twitter for iPhone,2015-07-17 00:14:24,19,15,"This is a groundbreaking decision to advance legal protections for gay, lesbian &amp; bisexual workers! #PROGRESS! #p2  https://t.co/ZGlMhsdNh9",,,,,
621784689284632576,22669526,repgwenmoore,Twitter Web Client,2015-07-16 20:53:16,22,16,Today I sent @GovWalker a letter in response to his frivolous lawsuit against the fed gov over drug testing the poor. http://t.co/pigxD3brYb,,,,,
621709075529732096,22669526,repgwenmoore,Twitter Web Client,2015-07-16 15:52:49,1,5,"""@GovWalker hasn’t read the law. It’s always a good idea before you start litigation to understand what the law is.” http://t.co/6JLWgwwsfk",,,,,
621687922182488064,22669526,repgwenmoore,Twitter Web Client,2015-07-16 14:28:45,8,6,I'm just as thrilled to join you &amp; @RESULTS_Tweets advocates to discuss how we can mobilize together to #EndPoverty! https://t.co/kez3zjn7Jx,,,,,
621528933750734848,22669526,repgwenmoore,Twitter Web Client,2015-07-16 03:56:59,5,5,Wishing @GeorgeHWBush a full and speedy recovery. #GetWellSoon41 http://t.co/47iI6reqlv,,,,,
621480741264699393,22669526,repgwenmoore,Twitter Web Client,2015-07-16 00:45:29,4,4,"It’s hard to believe the new @GOP rhetoric of concern for the poor, especially after seeing this @officialOKGOP post. http://t.co/SeypTF3Z0s",,,,,
621356320898347008,22669526,repgwenmoore,Twitter Web Client,2015-07-15 16:31:05,139,108,Don't be fooled: This misleading video is rife with false claims &amp; deceptive editing.  #IStandWithPlannedParenthood http://t.co/xRVobiFWRD,,,,,
621146117003198465,22669526,repgwenmoore,Twitter Web Client,2015-07-15 02:35:49,26,16,Another absurd &amp; unconstitutional policy courtesy of @GovWalker: drug testing poor families seeking #FoodAssistance. http://t.co/tVHKI0s73y,,,,,
621051344976277509,22669526,repgwenmoore,Twitter Web Client,2015-07-14 20:19:13,10,5,via @buzzfeed: @GovWalker under no illusion as to which groups will be impacted by these discriminatory #VoterID laws http://t.co/Gq6DK1WzVj,,,,,
621039357051465728,22669526,repgwenmoore,Twitter Web Client,2015-07-14 19:31:35,1,0,Very proud to have attended the Organization for Security &amp; Cooperation in Europe’s Parliamentary Assembly meeting. http://t.co/r1qjHyjl1w,,,,,
621010384556847104,22669526,repgwenmoore,Twitter for iPhone,2015-07-14 17:36:28,9,7,Great to see such passionate #SpecialEducation advocates on the hill today! Thanks @CECAdvocacy &amp; @casecec! #SELS15 http://t.co/wN0wAvEov7,,,,,
620951528770306048,22669526,repgwenmoore,Twitter Web Client,2015-07-14 13:42:35,7,9,I applaud all the hard work @POTUS/@JohnKerry have done on the #IranDeal. Looking forward to reviewing the full text. http://t.co/hrgOQnkIpu,,,,,
620708193006678016,22669526,repgwenmoore,Twitter Web Client,2015-07-13 21:35:40,24,16,"In 30min, I'm joining @TheRevAl on @msnbc to talk about @GovWalker's abysmal record in Wisconsin. Tune in @ 6:00pm ET http://t.co/T899w5iIpJ",,,,,
620676015682142208,22669526,repgwenmoore,Twitter Web Client,2015-07-13 19:27:48,4,2,Glad to hear of the Pentagon's plan to lift the ban on #transgender individuals serving in our armed forces http://t.co/Vox2uDrRfo #Progress,,,,,
620611070038831104,22669526,repgwenmoore,Twitter Web Client,2015-07-13 15:09:44,7,1,Drug testing as a condition of eligibility for life-saving social services is an insult to WI's struggling families. http://t.co/yXNZlLRyXM,,,,,
619559989871542272,22669526,repgwenmoore,Twitter Web Client,2015-07-10 17:33:07,1,0,"@BrownDeerRepub Regardless of what you think of my policies, my staff would be happy to help you w/ a tour request. Call us at 202-225-4572.",BrownDeerRepub,619224483308683264,,,
619557072401768450,22669526,repgwenmoore,Twitter Web Client,2015-07-10 17:21:31,6,1,Canceling DC's team trademark registration was the right move. Let's make the US a more inclusive place for everyone! http://t.co/SBxJ5bfRhw,,,,,
619293771369443328,22669526,repgwenmoore,Twitter Web Client,2015-07-09 23:55:15,24,8,"Buried within @GovWalker's budget lies a host of shocking attacks on the environment, our labor movement &amp; @UWSystem. http://t.co/NasCr4b4Wd",,,,,
619180021119340544,22669526,repgwenmoore,Twitter Web Client,2015-07-09 16:23:15,8,5,"Rep. Jenny Horne's plea against the #ConfederateFlag was as raw as it was powerful. Thank you, my sister. #TakeItDown http://t.co/czKUu5M5lD",,,,,
619172300403904512,22669526,repgwenmoore,Twitter Web Client,2015-07-09 15:52:34,6,6,"Since #DoddFrank’s passage, the America's economy added nearly 12.8 million private sector jobs. #WallStReformWorks http://t.co/1wTb4Fm8Vf",,,,,
618916885627830272,22669526,repgwenmoore,Twitter Web Client,2015-07-08 22:57:39,4,2,"Sadly, @GOP is applying their #ReverseRobinHood principles to our nation’s education system. http://t.co/irgtmUCHD1 http://t.co/yhdq7PpjLR",,,,,
618868929130307584,22669526,repgwenmoore,Twitter for iPhone,2015-07-08 19:47:05,4,10,I was delighted to join @runningstartDC to discuss #WomenInPolitics w/ these future leaders. Great event! #YWPL2015 http://t.co/5VVzO23oDm,,,,,
618811609880875008,22669526,repgwenmoore,Twitter Web Client,2015-07-08 15:59:19,3,0,"As #PoorDecisions go, buying an #iPhoneGun case ends up somewhere between bad &amp; appallingly/catastrophically bad http://t.co/2kyaedf15X #SMH",,,,,
618500919211261953,22669526,repgwenmoore,Twitter Web Client,2015-07-07 19:24:44,6,1,The @UWSystem campus budget numbers are out &amp; the news isn't good for @UWM. #MKE students/educators deserve better! http://t.co/2U4guH0uQL,,,,,
618499966231838720,22669526,repgwenmoore,Twitter Web Client,2015-07-07 19:20:57,3,2,Thanks @JVPMKE! And thank you for continued commitment to peace and #TikkunOlam in Milwaukee! #MKEcares https://t.co/ix94Ib8ZXV,,,,,
618467717469896704,22669526,repgwenmoore,Twitter Web Client,2015-07-07 17:12:49,4,2,"Together, we've achieved many #LGBT victories but as a @LGBTEqCaucus member, our fight for equality is far from over. http://t.co/yhrkFthc4y",,,,,
618181490388660224,22669526,repgwenmoore,Twitter Web Client,2015-07-06 22:15:27,3,2,"I may disagree with @ScottWalker's politics &amp; policies, but his wife is certainly a strong/amazing woman. #GreatRead  http://t.co/eHj7eolPb8",,,,,
618140920735776768,22669526,repgwenmoore,Twitter for iPhone,2015-07-06 19:34:14,0,3,"Ezra Aitch, 14yr active @MilFireDept vet, won 2nd place at @fairfax2015 Toughest Competitor Alive contest! Well done! http://t.co/xS1Yqc4bkY",,,,,
618103531271258114,22669526,repgwenmoore,Twitter Web Client,2015-07-06 17:05:40,10,5,".@ussoccer_wnt is paid 40x less than their male counterparts. Our champs deserve better, don’t you agree? #EqualPay http://t.co/K9VJDPE05h",,,,,
617389527590547456,22669526,repgwenmoore,Twitter Web Client,2015-07-04 17:48:28,4,2,"Happy Independence Day, friends! Stay safe and have a great weekend! 🇺🇸 #July4th #HappyIndependenceDay http://t.co/P0uUvw86e3",,,,,
616760128323366914,22669526,repgwenmoore,Twitter for iPhone,2015-07-03 00:07:28,147,0,RT @ABC: US Navy Sec. Mabus triples maternity leave to 18 weeks for women in Navy and Marine Corps - @LMartinezABC http://t.co/vfuQlKDbIt,,,616754744074174464,28785486,ABC
616627975073714176,22669526,repgwenmoore,Twitter Web Client,2015-07-02 15:22:20,3,3,Congrats to @hopesolo @kohara19 @CarliLloyd &amp; the entire @ussoccer_wnt on advancing to the @FIFAWWC Finals! http://t.co/uN46on8NMh #WorldCup,,,,,
616380292698361857,22669526,repgwenmoore,Twitter Web Client,2015-07-01 22:58:08,6,1,Looking for information about transit services during the @RideMCTS driver work stoppage? Visit http://t.co/2Dz2XHggQA or call 414-343-1700.,,,,,
616345154916626433,22669526,repgwenmoore,Twitter Web Client,2015-07-01 20:38:30,190,244,"In honor of #InternationalJokeDay, I thought I'd take this chance to contribute.   Ok, here's a joke:   @ScottWalker  #SorryNotSorry",,,,,
616320030817546240,22669526,repgwenmoore,Twitter Web Client,2015-07-01 18:58:40,7,7,I am so proud of @girlscouts for turning down a $100K donation that discriminated against their transgender peers. http://t.co/C0lqDQskRB,,,,,
616270497072947201,22669526,repgwenmoore,Twitter Web Client,2015-07-01 15:41:50,5,4,Eyeopening/thought provoking @washingtonpost analysis on officer-involved shootings of mentally distraught Americans. http://t.co/zg6w5eGcHY,,,,,
615974008840974336,22669526,repgwenmoore,Twitter Web Client,2015-06-30 20:03:42,3,2,It's clear @GOP can't contain the most extreme &amp; dangerous elements in their Party. #AmericanWorkers deserve better! https://t.co/9bDHMlchVp,,,,,
615972317970219008,22669526,repgwenmoore,Twitter Web Client,2015-06-30 19:56:59,6,6,"As a country, we must do everything in our power to ensure that our houses of worship are places of safety &amp; comfort. http://t.co/DnVCQpD0Fw",,,,,
615645119929167874,22669526,repgwenmoore,Twitter Web Client,2015-06-29 22:16:49,3,2,I applaud #SCOTUS for refusing to allow Texas to enforce restrictions that would force 10 abortion clinics to close. http://t.co/df7GIESaLH,,,,,
615640613304803328,22669526,repgwenmoore,Twitter Web Client,2015-06-29 21:58:54,3,2,"Last week, I traveled to #Charleston to honor &amp; remember the victims of the #EmanuelAMEChurch shooting. #AmazingGrace http://t.co/B4Z39zSolr",,,,,
615557562382073856,22669526,repgwenmoore,Twitter Web Client,2015-06-29 16:28:54,8,5,#Obamacare works &amp; it's here to stay! Low-income families now have greater access to critical health coverage. #ACA http://t.co/NyUUnRJEGZ,,,,,
614499977629433856,22669526,repgwenmoore,Twitter Web Client,2015-06-26 18:26:26,3,4,Hey #MKE: Join @MKELGBTCENTER today to discuss &amp; celebrate together on this historic #MarriageEquaility victory! https://t.co/XCtNHlKUot,,,,,
614455554090516481,22669526,repgwenmoore,Twitter Web Client,2015-06-26 15:29:54,11,15,This decision by #SCOTUS marks a truly historic day for our country. We're all created equal! #LoveIsLove #LGBTRights http://t.co/r3XXDkvXe3,,,,,
614438170080505857,22669526,repgwenmoore,Twitter Web Client,2015-06-26 14:20:50,106,117,Love &amp; dignity wins!!! #LoveIsLove #LGBTEquality #SCOTUSMarriage http://t.co/xg6cfc2SPq,,,,,
614185308607877120,22669526,repgwenmoore,Twitter Web Client,2015-06-25 21:36:03,2,2,I had the pleasure of meeting w/ one of my younger constituents looking to take a more active role in our community. http://t.co/Ac1hdW5w9W,,,,,
614102340623335425,22669526,repgwenmoore,Twitter Web Client,2015-06-25 16:06:22,7,5,Millions of Americans whose #HealthCare was on the line can now breathe a sigh of relief. #ACA http://t.co/HTzmg17QuS http://t.co/wnWc5kKhkd,,,,,
613899224690724864,22669526,repgwenmoore,Twitter Web Client,2015-06-25 02:39:15,2,6,I'm always delighted to meet with dedicated/passionate local representatives like @DavidFBowen. #MKE http://t.co/GeOP9Uj6k2,,,,,
613818072231620608,22669526,repgwenmoore,Twitter Web Client,2015-06-24 21:16:47,3,6,Great to meet Congressional Art Competition winner Brandon Poll. I know @NicoletKnights &amp; his family are very proud! http://t.co/o62iSiLoDF,,,,,
613785018515738624,22669526,repgwenmoore,Twitter Web Client,2015-06-24 19:05:26,15,5,Study by @NewAmerica reveals that right wing extremists killed almost 2x more people than jihadists in US since 9/11. http://t.co/BzQnHESizh,,,,,
613742858248568833,22669526,repgwenmoore,Twitter Web Client,2015-06-24 16:17:54,14,6,Classic @ScottWalker: Prioritizes @NRA above his constituents &amp; scraps 48-hour waiting period for firearm purchases. http://t.co/cXqfnnhfrD,,,,,
613382429160685569,22669526,repgwenmoore,Twitter Web Client,2015-06-23 16:25:41,3,1,Time running out on #AmericanJobs/exports. Republicans need to show some leadership &amp; vote on @EximBankUS. http://t.co/8900jiTCVi #ExIm4jobs,,,,,
613002955286052864,22669526,repgwenmoore,Twitter Web Client,2015-06-22 15:17:48,7,4,"The #ConfederateFlag needs to go. This relic belongs in a museum, not flying over capital grounds. #TakeItDown http://t.co/TBPnvfEEFW #P2",,,,,
612019208038318080,22669526,repgwenmoore,Twitter Web Client,2015-06-19 22:08:44,3,3,Let our commitment to #Equality serve as a source of strength for those in pain. #CharlestonShooting #Juneteenth2015 http://t.co/1L3RGQbTii,,,,,
611967735396876288,22669526,repgwenmoore,Twitter Web Client,2015-06-19 18:44:12,6,3,We must engage in an honest/thoughtful conversation about what happened in #Charleston this week. #CharlestonShooting http://t.co/qACwCtMhDN,,,,,
611603615476764672,22669526,repgwenmoore,Twitter Web Client,2015-06-18 18:37:19,2,2,I'd like to send my warmest regards to all of my constituents observing the holy month of #Ramadan. #RamadanKareem http://t.co/NFMOofmtt2,,,,,
611521330647834624,22669526,repgwenmoore,Twitter Web Client,2015-06-18 13:10:21,2,1,My deepest condolences go out to all of those whose lives will be forever changed by this tragedy. #PrayForCharleston http://t.co/azpcGGuwde,,,,,
611286507001913346,22669526,repgwenmoore,Twitter Web Client,2015-06-17 21:37:15,4,2,"Rather than helping working/middle class families, @GOP is trying again to repeal #ACA. So the 59th time's the charm? http://t.co/Y59wRkr1UA",,,,,
611259903483768834,22669526,repgwenmoore,Twitter Web Client,2015-06-17 19:51:32,2,2,"If the @GOP is serious about ensuring our economic security, it’s time for them to join @TheDemocrats in supporting @EximBankUS. #ExIm4Jobs",,,,,
611199637458976768,22669526,repgwenmoore,Twitter Web Client,2015-06-17 15:52:03,8,5,#EarlyInvestment in our moms/babies will help ensure the growth/prosperity of our communities for generations to come http://t.co/jsTyYzUbX1,,,,,
611186535501799424,22669526,repgwenmoore,Twitter Web Client,2015-06-17 15:00:00,1,0,Federal lawmakers need to pick up the slack on funding for vital #PoliceTraining where states &amp; local gov have failed http://t.co/qmQqh7jdC9,,,,,
610936934739873792,22669526,repgwenmoore,Twitter Web Client,2015-06-16 22:28:10,15,6,His policies are disastrous! Glad to see WI lawmakers recognizing just how dangerous @ScottWalker's budget really is. http://t.co/UNdP3k0wK4,,,,,
610870257188741121,22669526,repgwenmoore,Twitter Web Client,2015-06-16 18:03:13,2,1,Police need more vital training to prevent violence in dealing w/ the mentally ill. Congress needs to step up/fund it http://t.co/y7s7mvh8RM,,,,,
610842996733542400,22669526,repgwenmoore,Twitter Web Client,2015-06-16 16:14:53,3,1,This innovative program is promoting peace &amp; reducing conflict in Milwaukee schools by connecting students to mentors http://t.co/xxOFovNgZO,,,,,
610795652172410880,22669526,repgwenmoore,Twitter Web Client,2015-06-16 13:06:46,3,2,America's broken mental health infrastructure has turned local police into first responders for individuals in crisis http://t.co/qmQqh7jdC9,,,,,
610511792570245120,22669526,repgwenmoore,Twitter Web Client,2015-06-15 18:18:48,3,1,#WarAgainstThePoor must end: Politicians are setting behavioral standards as a condition to receive #PublicAssistance http://t.co/PwAVXQMkgL,,,,,
610459075202129920,22669526,repgwenmoore,Twitter Web Client,2015-06-15 14:49:19,2,0,Happy to see local #Milwaukee stakeholders coming together to address the issues facing our community! #QualityOfLife http://t.co/lqDEQUpA9S,,,,,
610453119277899776,22669526,repgwenmoore,Twitter Web Client,2015-06-15 14:25:39,57,0,"RT @RepBrendanBoyle: Another day in the GOP Congress, another day of governance by manufactured crisis. Let's renew #ExIm4Jobs ASAP! http:/…",,,610432648654270464,231108733,RepBrendanBoyle
609442624064331776,22669526,repgwenmoore,Twitter Web Client,2015-06-12 19:30:19,5,1,Powerful words about understanding one's self. We are all worthy of acceptance. Self expression is courageous. #LGBTQ http://t.co/WglZtae7yJ,,,,,
609429127456755712,22669526,repgwenmoore,Twitter Web Client,2015-06-12 18:36:41,5,5,American workers deserve an equitable deal. http://t.co/9r1wpuKHHs @AFLCIO @ACLU @MoveOn @BoingBoing #TPP #TPA #p2 http://t.co/gxlbL5FFqz,,,,,
609383731346960385,22669526,repgwenmoore,Twitter Web Client,2015-06-12 15:36:18,3,3,"I want to know what you think: Is it time to put a woman on the $20? If so, who should take Andrew Jackson's place? http://t.co/pE93ytGCkZ",,,,,
609033621148680193,22669526,repgwenmoore,Twitter Web Client,2015-06-11 16:25:05,13,8,On a great panel w/ @dreaflynn @nwlc @keithellison &amp; MN Rep Erin Murphy at @ReproRights #reProActive! #BeBoldEndHyde http://t.co/MmI8pzeDqJ,,,,,
608759661177786368,22669526,repgwenmoore,Twitter Web Client,2015-06-10 22:16:28,2,3,Proud to stand w/ @RepRonKind &amp; @repmarkpocan in support of our world class higher education system! #WisconsinIdea http://t.co/CqsOP4Isbs,,,,,
