id,user_id,screen_name,source,created_at,retweet_count,favorite_count,text,in_reply_to_screen_name,in_reply_to_status_id,retweeted_status_id,retweeted_status_user_id,retweeted_status_screen_name
530934369704476672,240760644,repgosar,Twitter Web Client,2014-11-08 04:06:32,8,6,The next Attorney General has their work cut out to regain the faith of the American people. http://t.co/SRi8TENWaL,,,,,
530767247665803264,240760644,repgosar,Twitter Web Client,2014-11-07 17:02:27,2,1,@SenatorTimScott is a great American and this clip of him defending why he's a Conservative is worth watching. #tcot https://t.co/tJmLIFjqXd,SenatorTimScott,,,,
530498747596558336,240760644,repgosar,Twitter Web Client,2014-11-06 23:15:32,2,0,RT @RebekahLSanders: The more you know: 3 dentists elected to Congress http://t.co/rjZGq7anyt @RepGosar,,,530498132233428993,17090066,RebekahLSanders
530493160846528512,240760644,repgosar,Twitter Web Client,2014-11-06 22:53:20,12,8,http://t.co/MISi8MZlVX,,,,,
530109925226467328,240760644,repgosar,Twitter Web Client,2014-11-05 21:30:29,16,8,"I bet AG Holder and the DOJ were hoping you would miss the 64,280 pages of #FastAndFurious emails released yesterday. http://t.co/sQqbA1McoG",,,,,
527144936836464641,240760644,repgosar,Twitter Web Client,2014-10-28 17:08:41,8,0,It's good to see union president Kenneth Palinkas speaking out about Obama's plan to unilaterally enact #amnesty: http://t.co/yXrb5qvZKB,,,,,
526884713588588544,240760644,repgosar,Twitter Web Client,2014-10-27 23:54:39,8,3,"Trout-stocking program reinstated at Willow Beach Fish Hatchery! Saves 1,700 AZ jobs, $75 million in economic output. http://t.co/spHyqAbpF4",,,,,
526831843338121217,240760644,repgosar,Twitter Web Client,2014-10-27 20:24:34,12,5,WATCH: Key events in the #IRStargeting scandal and investigation. It's time for an end to IRS targeting http://t.co/NVblBvxrVq,,,,,
526796372675411969,240760644,repgosar,Twitter Web Client,2014-10-27 18:03:37,4,0,"Check out the video from my interview with #PoliticsUnplugged. Discussed gun control, job creation, Ebola: http://t.co/0GhpIaBu4V @azfamily",,,,,
525777037462863872,240760644,repgosar,Twitter Web Client,2014-10-24 22:33:08,24,7,Another example of the most transparent administration in US history right? What are they hiding? #FastAndFurious ?http://t.co/ZovhzLXckT,,,,,
525672129183121408,240760644,repgosar,Twitter Web Client,2014-10-24 15:36:16,4,3,Watch @jimmykimmel read from the #Wastebook published by @TomCoburn All you can do is laugh to keep from crying. https://t.co/xqA0RD1cuZ,,,,,
525412774214922240,240760644,repgosar,Twitter Web Client,2014-10-23 22:25:41,3,3,Discussed my bill H.R. 448 to reform federal contracting saving billions at my transportation roundtable in PHX today http://t.co/vsrBMjwpAH,,,,,
525373997211742208,240760644,repgosar,Twitter Web Client,2014-10-23 19:51:36,14,7,U.S. State Dept: #KeystoneXL would support more jobs than total # of students enrolled at U. of Arizona. #TimeToBuild http://t.co/oIZxm3LCeV,,,,,
525303909515296768,240760644,repgosar,Twitter Web Client,2014-10-23 15:13:06,2,3,I am extremely proud to call Sergeant at Arms Kevin Vickers and the Canadian people our closest neighbor and ally. https://t.co/wL8WF3cF1E,,,,,
525032218012688385,240760644,repgosar,Twitter Web Client,2014-10-22 21:13:30,3,2,I'm pleased to see the Idaho court ruling validate my legislative effort to protect the 2nd Amendment on public land: http://t.co/F3A4riiqsc,,,,,
524994702626807810,240760644,repgosar,Twitter Web Client,2014-10-22 18:44:25,2,3,GOP Doctors Caucus urges Obama to implement a temporary travel ban to limit spread of the Ebola virus. @gopdoccaucus http://t.co/MALUovj6F3,,,,,
524960587886112768,240760644,repgosar,Twitter for iPhone,2014-10-22 16:28:52,1,1,Had a great roundtable discussion on AZ education issues with Prescott area teachers and administrators #AZeducation http://t.co/BZcD572J3H,,,,,
524589083885318144,240760644,repgosar,Twitter Web Client,2014-10-21 15:52:38,2,4,Met with Prescott area hotel and tourism industry leaders to discuss growing AZ economy @aztourismpays #VisitPrescott http://t.co/s1UDqkcSDq,,,,,
524399491148161025,240760644,repgosar,Twitter for iPhone,2014-10-21 03:19:16,2,0,"RT @azrepbobthorpe: Terrific presentation by AZ Congressman Paul Gosar at Article V Liberty Amendment Symposium in Tucson, AZ http://t.co/O…",,,523901566244245504,2441091258,azrepbobthorpe
524261304719405057,240760644,repgosar,Twitter Web Client,2014-10-20 18:10:10,2,1,"Get to know Obama's Ebola Czar: Democrat political operative Ron Klain, central player in Obama's Solyndra fraud: http://t.co/BL0CMVSyHp",,,,,
523659804896931840,240760644,repgosar,Twitter for iPhone,2014-10-19 02:20:01,5,2,Packed house in Oro Valley for the Liberty Amendment Symposium #compactforamerica http://t.co/oSapPtdGEy,,,,,
523224412796256257,240760644,repgosar,Twitter Web Client,2014-10-17 21:29:55,2,1,Congress must fully fund vital programs to rural Arizona such as PILT and Secure Rural Schools. http://t.co/4LYq6s7Aa8,,,,,
523216582710132736,240760644,repgosar,Twitter Web Client,2014-10-17 20:58:48,0,1,@Bringer_ofLight @HavasuChamber Very productive! Biggest theme discussed: helping small businesses by lifting burdensome govt. regulations.,OnlyOneJeree,523215584155410432,,,
523215274997465088,240760644,repgosar,Twitter Web Client,2014-10-17 20:53:37,1,4,Today I met with local business leaders in Lake Havasu to discuss issues that are impacting them. @HavasuChamber http://t.co/st4KcWR1Aq,,,,,
523192542373113857,240760644,repgosar,Twitter Web Client,2014-10-17 19:23:17,2,2,Great turnout at #Goodwill Job Fair in Bullhead City. Special thanks to Cristy Crow for putting on this event. #MCC http://t.co/UjUSqXOaRG,,,,,
523140803288653824,240760644,repgosar,Twitter Web Client,2014-10-17 15:57:41,2,4,"I'm happy to have @SenJohnMcCain support of Resolution Copper mine: +3,700 AZ jobs, +$220.5 million in annual wages http://t.co/a4kdloIgni",,,,,
522835940377501697,240760644,repgosar,Twitter Web Client,2014-10-16 19:46:16,36,0,RT @ChadPergram: Rep. Paul Gosar (R-AZ): While the recent #Ebola outbreak poses a real threat..the incompetence..of..the Obama Admin is jus…,,,522811261604888576,16187637,ChadPergram
522813110630252544,240760644,repgosar,Twitter Web Client,2014-10-16 18:15:33,1,0,"@jddrafter House passed H.R. 3547, the Consolidated Approps Act of 2014 w/ my support. Increased $ for CDC $567 million above FY 13 level.",jddrafter,522810353282187264,,,
522807247479767040,240760644,repgosar,Twitter Web Client,2014-10-16 17:52:15,5,2,"Step one for combating #Ebola - Remove CDC Director Frieden: Incompetence, indecisiveness can be just as dangerous. http://t.co/8YDNSvKySH",,,,,
522481947810213888,240760644,repgosar,Twitter Web Client,2014-10-15 20:19:38,3,2,Join me this Friday in Lake Havasu City for Small Business Friday 1:00-2:30 PM at Havasu Fitness. See flyer for info. http://t.co/n6EMuRiPFd,,,,,
522124007630721026,240760644,repgosar,Twitter Web Client,2014-10-14 20:37:18,3,1,I met some very smart students at Mountain View Elementary in Prescott Valley. We could use their common sense in DC. http://t.co/8O0Dvlx5Km,,,,,
522058372552880129,240760644,repgosar,Twitter Web Client,2014-10-14 16:16:30,6,1,My 1st read of the day: @DailyCaller - Ebola Lessons From Down Under: Quarantines And Containment Work @retinaldoctor http://t.co/AumXeuM30I,,,,,
521717867461754880,240760644,repgosar,Twitter Web Client,2014-10-13 17:43:27,16,9,"Happy 239th birthday to the @USNavy Thank you to all those who have, or currently serve. @SenJohnMcCain #USNavy http://t.co/mInLET9FLM",,,,,
521453335678058496,240760644,repgosar,Twitter for iPhone,2014-10-13 00:12:18,5,0,"RT @lilydashevsky: .@RepGosar asks: people can't trust @fredduval to drive a car, how can they trust him to drive the Arizona economy?",,,521448294711832576,701274655,lilydashevsky
520624488975990784,240760644,repgosar,Twitter Web Client,2014-10-10 17:18:45,4,1,"Communities suffer when exec monument designations are made w/o public input, transparency. My bill HR1495 fixes that http://t.co/EltJ9QAZX2",,,,,
520230377617883136,240760644,repgosar,Twitter Web Client,2014-10-09 15:12:42,3,3,Are you or anyone you know interested in receiving a nomination to a service academy? AZ-4 residents click here:  https://t.co/TSBfUJNCfY,,,,,
520213909874417664,240760644,repgosar,Twitter Web Client,2014-10-09 14:07:15,1,0,2/2 Read a very relevant 1st read of the day from @WSJ addressing the problem with out of control federal agencies: http://t.co/jJOB2b7adT,,,,,
520213525621637121,240760644,repgosar,Twitter Web Client,2014-10-09 14:05:44,1,1,1/2 Have we reached a point where using money to make already large bureaucracies bigger makes the likelihood of catastrophic events worse?,,,,,
519566206475304961,240760644,repgosar,Twitter for iPad,2014-10-07 19:13:31,4,1,Rep. Gosar: Latest Habitat Designation by U.S. Fish and Wildlife Service Unacceptable http://t.co/f4q6XKwnwU,,,,,
519545282166784001,240760644,repgosar,Twitter Web Client,2014-10-07 17:50:22,0,0,"Unfortunately, I have to postpone my Meet and Greet tomorrow in Yuma. I will make sure to reschedule sometime soon. http://t.co/6UWKEwIzoI",,,,,
519185800530243584,240760644,repgosar,Twitter Web Client,2014-10-06 18:01:55,4,2,REMINDER: I will be hosting Meet and Greets tomorrow in BUCKEYE and on Wednesday in YUMA. I want to see YOU there! http://t.co/slPJPqH8sn,,,,,
518133819711688705,240760644,repgosar,Twitter Web Client,2014-10-03 20:21:43,3,2,Great panel w/ my AZ colleagues @RepMattSalmon @RepTrentFranks @RepDavid at the Arizona Manufacturing Summit #AZMS14 http://t.co/mt6l7XY4Ny,,,,,
517721492080308224,240760644,repgosar,Twitter Web Client,2014-10-02 17:03:17,5,2,Queen Creek! Buckeye! Yuma! I'll be in your neck of the woods this month. Check out the attached flyer for more info. http://t.co/wXlONpFXxK,,,,,
517350753413763072,240760644,repgosar,Twitter Web Client,2014-10-01 16:30:06,63,14,Today marks the 1 year anniversary of the botched #ObamaCare launch. RT if you think it needs to be repealed. http://t.co/mtqWPOYkF7,,,,,
517304048245305346,240760644,repgosar,Twitter for iPhone,2014-10-01 13:24:30,0,0,@dailyrundown Reagan,JDBmsnbc,,,,
517006087250518016,240760644,repgosar,Twitter Web Client,2014-09-30 17:40:31,2,1,Great coverage from @azcentral of Prescott resident Krystal Koons replacing her father's stolen WWII medals: http://t.co/XYiOevGvQv,,,,,
516638229324648450,240760644,repgosar,Twitter Web Client,2014-09-29 17:18:47,3,0,"My afternoon read of the day, from @wallstjournal - Holder's Legacy of Racial Politics http://t.co/TeVbUajoQI",,,,,
515986244078415875,240760644,repgosar,Twitter Web Client,2014-09-27 22:08:01,6,0,RT @joeyyeo13: America's Forum | Rep. Paul Gosar talks about why Holder’s resignation i...: http://t.co/LcwFSks2qp via @YouTube,,,515558164029140993,228134082,joeyyeo13
515986019456651266,240760644,repgosar,Twitter Web Client,2014-09-27 22:07:08,5,0,RT @eNewsAZ: People packed in at Murphys to hear Doug Ducey and Paul Gosar. #eNewsAZNow http://t.co/juQ5K0u3Ux,,,515971472402436096,14146656,eNewsAZ
515622949156843520,240760644,repgosar,Twitter Web Client,2014-09-26 22:04:25,4,2,Thank you to everyone who came out for my Meet and Greets today in Lake Havasu City and Kingman! http://t.co/qNEVkZVGlT,,,,,
515309919109517312,240760644,repgosar,Twitter for iPhone,2014-09-26 01:20:33,7,3,Great discussion tonight at my invasive species roundtable in Lake Havasu City on quagga mussels @azgfd http://t.co/ZSGHWTDcOO,,,,,
515257839041122304,240760644,repgosar,Twitter Web Client,2014-09-25 21:53:36,9,1,#throwbackthursday Looking back on Eric Holder's #LegacyOfLawlessness #Anarchy  https://t.co/eZtWttQX9I,,,,,
515245285178884096,240760644,repgosar,Twitter Web Client,2014-09-25 21:03:43,2,1,Lake Havasu and Kingman! I will be hosting a MEET AND GREET tomorrow in your town. See attached flyer for more info. http://t.co/sOwM2drX3h,,,,,
515192821704577024,240760644,repgosar,Twitter Web Client,2014-09-25 17:35:15,448,208,"Eric Holder leaves behind a legacy of lawlessness, incompetence and hyper partisanship. http://t.co/UsmHyp7sHs http://t.co/H6cRK2xKYB",,,,,
514966100950282240,240760644,repgosar,Twitter for iPhone,2014-09-25 02:34:20,3,1,Amazing tour of the Yuma Boys and Girls Club by my Easter Card Contest Winner Aiden Jensen. We had a lot of fun. http://t.co/LHeAlgWWsl,,,,,
514934578570887168,240760644,repgosar,Twitter for iPhone,2014-09-25 00:29:05,4,3,Enjoyed my tour today of ACHIEVE's corporate headquarters in Yuma. ACHIEVE assists people with disabilities w/ jobs. http://t.co/i5QdLlthTM,,,,,
514930914716303360,240760644,repgosar,Twitter for iPhone,2014-09-25 00:14:31,3,0,RT @karitatar09: US Congressman Paul Gosar playing foos ball with club kids! http://t.co/oplOQN4o7S,,,514917674150031361,517128867,karitatar09
514816672122015745,240760644,repgosar,Twitter Web Client,2014-09-24 16:40:34,2,2,"Had a great breakfast with Southern AZ Home Builders Assoc. Discussed excessive regulations, EPA + national security. http://t.co/2EuG8TL4NL",,,,,
514447500464640000,240760644,repgosar,Twitter Web Client,2014-09-23 16:13:36,3,2,"My first read of the day, from @Reuters - U.S., Arab Partners Launch First Strikes in Syria http://t.co/jvOX6Rxdrc",,,,,
514402941735026688,240760644,repgosar,Twitter Web Client,2014-09-23 13:16:33,34,20,25 miles of barbed wire fence is the only thing keeping #ISIS out of America. We must secure the border #AZBorderTour http://t.co/vjyGnHp2dp,,,,,
514156819917582337,240760644,repgosar,Twitter for iPhone,2014-09-22 20:58:33,21,12,Today I toured the Arizona/Mexico border near Arivaca. Check out the sign pictured. #SecureTheBorder  #AZBorderTour. http://t.co/n88XguyxOb,,,,,
514114431220199424,240760644,repgosar,Twitter Web Client,2014-09-22 18:10:06,3,2,I will be hosting a roundtable discussing invasive species Thursday night at 5:30 PM in Lake Havasu City. Come join! http://t.co/9FSVhnqhFX,,,,,
514087591671758849,240760644,repgosar,Twitter Web Client,2014-09-22 16:23:27,6,2,"My afternoon read of the day, from @NatReview - The Crumbling Climate-Change Consensus @johnfund http://t.co/zwd3WSn8Bx",,,,,
512992202902220800,240760644,repgosar,Twitter Web Client,2014-09-19 15:50:46,12,6,Today is National POW/MIA Recognition Day #NeverForget until all are returned home to the land of the free. #POWMIA http://t.co/zU3udFlsis,,,,,
512967390817419264,240760644,repgosar,Twitter Web Client,2014-09-19 14:12:11,4,4,"My first read of the day, from @thehill : House Passes Bill to Audit the Federal Reserve #AuditTheFed http://t.co/sjBdGS5Z0m",,,,,
512747392752300032,240760644,repgosar,Twitter Web Client,2014-09-18 23:37:59,3,1,Today I introduced the TRAILS Act putting local communities in the driver seat for developing travel management plans http://t.co/6bHxBJx1Td,,,,,
512632289495617536,240760644,repgosar,Twitter Web Client,2014-09-18 16:00:36,3,3,Honored to help an AZ family restore the military medals of an American hero: Thomas L. Cullon http://t.co/A3GAWDJUjX http://t.co/pDDICsktRZ,,,,,
512611337009373185,240760644,repgosar,Twitter Web Client,2014-09-18 14:37:21,7,2,"My first read of the day, from @WashTimes - Bipartisan House #Benghazi Panel Kicks off without Bickering http://t.co/rLqyGNlBDX",,,,,
512379562551160832,240760644,repgosar,Twitter for iPhone,2014-09-17 23:16:21,4,0,"RT @RebekahLSanders: Majority of AZ delegation- 3 GOP &amp; 2 Dems -vote against bill to keep the government open. @RepGosar: it's a ""short ter…",,,512377793364365313,17090066,RebekahLSanders
512378279010263040,240760644,repgosar,Twitter Web Client,2014-09-17 23:11:15,10,9,"Today I voted against business as usual, arming Syrian rebels and approving the President's flawed plan for ISIS. http://t.co/5bfTbeN5pc",,,,,
512323764076675072,240760644,repgosar,Twitter for iPhone,2014-09-17 19:34:38,3,0,"RT @DCTaxNerd: @RepGosar to IRS Commissioner Koskinen: ""How do you feel about the law?""",,,512319783640256512,2544289136,DCTaxNerd
512310127194812417,240760644,repgosar,Twitter for iPhone,2014-09-17 18:40:27,3,3,I was honored to be recognized today by @NFIB and their CEO Dan Danner with their Guardian of Small Business Award. http://t.co/1vrHRPVjJ5,,,,,
512235917688729600,240760644,repgosar,Twitter Web Client,2014-09-17 13:45:34,20,7,"Happy Constitution Day! Read it, know it, demand your elected leaders uphold it above all else! #ConstitutionDay2014 http://t.co/YflHmDBpDv",,,,,
511908129517633536,240760644,repgosar,Twitter Web Client,2014-09-16 16:03:03,5,2,GAO report finds taxpayer dollars being used for #Obamacare abortion coverage. Just more #brokenpromises from Obama. http://t.co/u3RZqm6p8S,,,,,
511632140585676800,240760644,repgosar,Twitter Web Client,2014-09-15 21:46:22,65,16,"This week the House votes to #AuditTheFed - Congress created it, we should also be able to audit it. RT if you agree. http://t.co/1oOacwphMY",,,,,
511534513793814528,240760644,repgosar,Twitter Web Client,2014-09-15 15:18:26,4,2,Congratulations to the @PhoenixMercury  for #winning their 3rd WNBA Championship this past Saturday!!! #WNBA #CHAMPS http://t.co/IG1jtt3bou,,,,,
510864344226484225,240760644,repgosar,Twitter for iPhone,2014-09-13 18:55:25,4,2,Great meeting today with the Arizona Automatic Merchandising Council yearly convention.  #azcavend2014 http://t.co/VvE58Pw8Dk,,,,,
510530720910290945,240760644,repgosar,Twitter Web Client,2014-09-12 20:49:43,13,4,Thank you @IngrahamAngle for having me on your show to discuss the DOJ refusing to prosecute many 1st time illegals: http://t.co/yctvBOgcRU,,,,,
510517330062094336,240760644,repgosar,Twitter Web Client,2014-09-12 19:56:31,3,2,Today I’m going orange with @StMarysFoodBank to raise awareness of hunger. To learn more go to http://t.co/2mxjk30uZ0 http://t.co/3zkGI7gt5h,,,,,
510509473082118144,240760644,repgosar,Twitter Web Client,2014-09-12 19:25:17,4,1,"Had a great town hall with the AMAC -Association of Mature American Citizens in Apache Junction, AZ today. http://t.co/x4wbDoAVhS",,,,,
510060535631867904,240760644,repgosar,Twitter Web Client,2014-09-11 13:41:22,7,6,Today let us remember the heroes and reaffirm ourselves to each other and to the promise of a UNITED American people. http://t.co/2mZxXlsJj5,,,,,
509888072948133888,240760644,repgosar,Twitter Web Client,2014-09-11 02:16:04,36,22,"Signaling to your enemy what you’re not willing to do militarily sends a message of weakness, ineptitude emboldening ISIS to grow stronger.",,,,,
509854490338787328,240760644,repgosar,Twitter Web Client,2014-09-11 00:02:37,4,5,"Today I got my shot at grilling the US Fish and Wildlife Director, Dan Ashe for their misguided policy decisions: https://t.co/X49HhVCIki",,,,,
509806283747516416,240760644,repgosar,Twitter Web Client,2014-09-10 20:51:04,15,7,I am demanding answers from AG Eric Holder in regards to changing illegal #immigration enforcement laws. http://t.co/ZEWbuDi7KM,,,,,
509718213085908992,240760644,repgosar,Twitter Web Client,2014-09-10 15:01:06,17,10,House passed H.R. 5078 means rain falling from the sky on private land is still free and does not belong to the #EPA http://t.co/uyI5uGhvyI,,,,,
509704612006608896,240760644,repgosar,Twitter Web Client,2014-09-10 14:07:04,7,1,"My first read of the day, from @DailyCaller - Obama’s ISIS Speech Preview: Leadership-ish? http://t.co/eNxgOSo5ot",,,,,
509470826265997312,240760644,repgosar,Twitter Web Client,2014-09-09 22:38:05,3,1,@EPA Not on our watch: House Votes to Prevent Harmful EPA Water Grab http://t.co/qRAGshTvpx,EPA,,,,
509348436945436672,240760644,repgosar,Twitter Web Client,2014-09-09 14:31:45,2,0,"My first read of the day, from the @arizonarepublic - Storm Swamps Phoenix: Mesa Flooding a 'Slow-Moving Disaster' http://t.co/uvAkiX0uML",,,,,
509110846841434112,240760644,repgosar,Twitter Web Client,2014-09-08 22:47:39,2,2,Pumped to watch @AZCardinals open up their 2014 NFL season taking on the San Diego Chargers tonight on #mondaynightfootball #ThisIsOurYear,,,,,
508981732943867904,240760644,repgosar,Twitter Web Client,2014-09-08 14:14:36,8,3,"My first read of the day, from @NatReview - Why Obama Delayed Immigration Action Until After the Election http://t.co/Gi1Qd26IBl",,,,,
508972673440186369,240760644,repgosar,Twitter Web Client,2014-09-08 13:38:36,2,1,Crazy weather in Arizona right now. Be careful out there today folks. #BringAnUnbrella https://t.co/Rb0RTGOPln,,,,,
507897933786656769,240760644,repgosar,Twitter Web Client,2014-09-05 14:27:58,10,2,"My first read of the day, from @DailyCaller - Even Obama’s Political Base Opposes His Unilateral Amnesty http://t.co/aYCynsj8a9",,,,,
507667252351471616,240760644,repgosar,Twitter Web Client,2014-09-04 23:11:19,6,1,I call on @USFWSHQ to find a solution for the Willow Beach Hatchery and resume the rainbow trout stocking progm. asap http://t.co/bTuzC0s83t,,,,,
507598512343629824,240760644,repgosar,Twitter Web Client,2014-09-04 18:38:10,6,1,"Stay alert Arizona: My first read of the day, from @USATODAY : Scammers Posing as IRS Agents Extort $5 Million http://t.co/SppGI7RRd4",,,,,
507205322013159424,240760644,repgosar,Twitter Web Client,2014-09-03 16:35:46,14,0,"Please spread the word: missing 8 yr. old Bullhead City girl named Isabella ""Bella"" Grogan-Cannella. 4' 8"" 85 lbs http://t.co/gDvL0wNBdv",,,,,
507166254382465024,240760644,repgosar,Twitter Web Client,2014-09-03 14:00:32,3,2,"My first read of the day, from @thehill - Lawmakers to Obama: Hit ISIS http://t.co/K7gO5F8Zhb",,,,,
506912059033153537,240760644,repgosar,Twitter Web Client,2014-09-02 21:10:27,0,0,@PATR2014 https://t.co/hX72GLNwwt,NoParty2016,506908352853856258,,,
506910755820941312,240760644,repgosar,Twitter for iPhone,2014-09-02 21:05:16,0,1,@PATR2014 Clearly you have not been paying attention. I have been on the front lines of stopping Obama's amnesty. http://t.co/I9wOaVE10u,NoParty2016,506908352853856258,,,
506907884182306816,240760644,repgosar,Twitter for iPhone,2014-09-02 20:53:52,5,0,"DHS is now encouraging illegal immigrants to return to the US. No, this is not an article from The Onion: http://t.co/1m8b9Uo9XN",,,,,
506861918381166592,240760644,repgosar,Twitter Web Client,2014-09-02 17:51:13,5,7,Please keep American journalist Steven Sotloff in your prayers today. http://t.co/V4l5xmTuV5,,,,,
506847375852572672,240760644,repgosar,Twitter Web Client,2014-09-02 16:53:25,2,0,"My first read of the day, from @Forbes - #ObamaCare Is Dampening The Job Market In 3 Principal Ways http://t.co/AtFQf4eUcP",,,,,
505384656351817728,240760644,repgosar,Twitter for iPhone,2014-08-29 16:01:06,2,2,Last night I was honored to speak with the Apache Junction #TeaParty. Great group engaged in important  AZ issues. http://t.co/oqVLXg3tEu,,,,,
505374730170695680,240760644,repgosar,Twitter Web Client,2014-08-29 15:21:39,12,3,"My first read of the day, from @weeklystandard - ""We Don’t Have a Strategy Yet"" http://t.co/mbKNIUvmSb",,,,,
505110553568620544,240760644,repgosar,Twitter Web Client,2014-08-28 21:51:55,3,2,Excited for the start of the college football season. The State of AZ is well represented: @ASU @UofA @NAUAthletics http://t.co/RP8WQSdZzO,,,,,
505023866948038656,240760644,repgosar,Twitter for iPhone,2014-08-28 16:07:27,3,0,@DHSgov When will you respond to my inquiry &amp; under what authority are you transferring illegals throughout the US? http://t.co/tgJ5dxiu0H,DHSgov,,,,
505004597795385344,240760644,repgosar,Twitter Web Client,2014-08-28 14:50:53,6,0,"My 1st read of the day, from @FoxNews Obama Reportedly Plotting End-Run around Congress on Global Climate Change Deal http://t.co/ilLTuzRYjm",,,,,
504772495833321472,240760644,repgosar,Twitter for iPhone,2014-08-27 23:28:35,9,6,Today I urged @AlgenolBiofuels to invest $800 million in Arizona and create thousands of jobs with a new facility. http://t.co/WFFZ76JszT,,,,,
504706112730714112,240760644,repgosar,Twitter for iPhone,2014-08-27 19:04:48,9,0,RT @aztourismpays: Thanks so much to @RepGosar for your strong support of AZ's tourism industry and our state's economy! http://t.co/oLsxno…,,,504698895528906754,20784326,aztourismpays
504698280513904640,240760644,repgosar,Twitter for iPhone,2014-08-27 18:33:41,7,5,Great meeting today with the Arizona Lodging and Tourism Association.  @aztourismpays http://t.co/qcq8m5BHtM,,,,,
504686020294868992,240760644,repgosar,Twitter for iPhone,2014-08-27 17:44:58,2,0,RT @am970TheAnswer: Listen to @JohnGambling right now. Guests include Ed Mullins of SBA &amp; @RepGosar http://t.co/87rzj2zde7,,,504645931426271233,102714152,am970TheAnswer
504346722009886720,240760644,repgosar,Twitter Web Client,2014-08-26 19:16:43,3,3,"Touring the Bullhead City Boy and Girls Club with my friend Daisy Solis Esquer, winner of my Easter Card Competition. http://t.co/qQh1y8pMn5",,,,,
504334744285626368,240760644,repgosar,Twitter Web Client,2014-08-26 18:29:07,4,1,"First read of the day, from @Forbes : Judicial Watch Claims #IRS Attorneys Admit Lois Lerner's 'Missing' Emails Exist http://t.co/SPQeFNh5k3",,,,,
503954203262595072,240760644,repgosar,Twitter Web Client,2014-08-25 17:16:59,3,1,"Speaking with Mohave County school administrators in Kingman, AZ. http://t.co/hxeECF0TcB",,,,,
503951544921100289,240760644,repgosar,Twitter Web Client,2014-08-25 17:06:25,9,0,"A somber but important 1st read of the day, from @azcentral - VA Touts Progress on Suicides; Data Tell Another Story http://t.co/HrK3Mc4HJ2",,,,,
503592032108306433,240760644,repgosar,Twitter Web Client,2014-08-24 17:17:51,6,4,"My thoughts and prayers are with the family of a monumental leader in the Gila River Indian Community, Mary Thomas. http://t.co/pHeu0U8iJf",,,,,
502883007494361090,240760644,repgosar,Twitter Web Client,2014-08-22 18:20:26,6,4,I am hosting a workshop on Sept. 6 in Prescott for anyone interested in attending one of the U.S. Service Academies: http://t.co/QQeOJBFIOS,,,,,
