id,user_id,screen_name,source,created_at,retweet_count,favorite_count,text,in_reply_to_screen_name,in_reply_to_status_id,retweeted_status_id,retweeted_status_user_id,retweeted_status_screen_name
428351601196023809,240760644,repgosar,Twitter Web Client,2014-01-29 02:19:14,16,2,FACT: Oil and gas production have thrived on state lands but declined on federal lands under President's watch http://t.co/tgd8jr8Bd7 #SOTU,,,,,
428351202238017536,240760644,repgosar,Twitter Web Client,2014-01-29 02:17:39,32,5,"Labor Force Participation Rate is 63%; lowest since April 1978, translating into 91.27 million not in the labor force #ObamaEconomy #SOTU",,,,,
428343719901659136,240760644,repgosar,Twitter Web Client,2014-01-29 01:47:55,4,1,Staff will be live tweeting throughout #SOTU,,,,,
428334421222363136,240760644,repgosar,Twitter Web Client,2014-01-29 01:10:58,1,0,RT @MohavePatriot: @RepGosar Keep up the good work!,,,428331591962603521,2295663450,MohavePatriot
428297229917360128,240760644,repgosar,Twitter Web Client,2014-01-28 22:43:11,10,7,Today I voted in favor of HR7. Legislation that permanently outlaws taxpayer-funded abortion is long overdue. http://t.co/8TfC3u5CHC,,,,,
428236432499412992,240760644,repgosar,Twitter Web Client,2014-01-28 18:41:36,6,0,Same. Broken. Promises. #SOTUinthreewords,,,,,
428177020510404608,240760644,repgosar,Twitter Web Client,2014-01-28 14:45:31,1,1,"Tonight, the President will deliver the State of the Union Address. What do you want to hear? #SOTU http://t.co/0jHizZOklM",,,,,
428152167694733312,240760644,repgosar,iOS,2014-01-28 13:06:46,1,3,Getting ready for an interview with @DailyCaller http://t.co/5zROfkYjo8,,,,,
427897924123496448,240760644,repgosar,Twitter Web Client,2014-01-27 20:16:29,10,4,Over-regulation is stifling Arizona's economy. Here are 4 ways to cut government and create thousands of #jobs. http://t.co/RByQUvfgMy,,,,,
427117119302795264,240760644,repgosar,Twitter for iPad,2014-01-25 16:33:51,9,0,4: number of minutes it took hacking expert to access personal information of 70k people on http://t.co/gz4GHmC6XJ. http://t.co/C5IlNvNT3Z,,,,,
427113173792342016,240760644,repgosar,Twitter for iPad,2014-01-25 16:18:10,3,0,RT @NatResources: Natural Resources GOP #FF @RepGosar @Raul_Labrador @Rep_Southerland @RepBillFlores @RepJonRunyan @RepMullin,,,426806907408764928,41445718,NatResources
426788661632708608,240760644,repgosar,Twitter for iPad,2014-01-24 18:48:40,2,0,Rep. Gosar inside the new wind tunnel facility. http://t.co/rAYMDtx7ld,,,,,
426787008003178496,240760644,repgosar,Twitter for iPad,2014-01-24 18:42:06,1,1,"It was a privilege to hear Lt. Col. Cleveland, commanding officer of the U.S. Army Special Operations Command, speak http://t.co/AVePvikdna",,,,,
426781237752397826,240760644,repgosar,Twitter for iPad,2014-01-24 18:19:10,1,0,It was also an honor to meet Gen. Fox at the wind tunnel dedication today. http://t.co/s8ysTIyJpc,,,,,
426780065738002432,240760644,repgosar,Twitter for iPad,2014-01-24 18:14:31,0,1,"It was an honor to meet Sheila Long, mother of Master Sergeant George A. Bannar. http://t.co/zlMJCwRNyA",,,,,
426779174842662913,240760644,repgosar,Twitter for iPad,2014-01-24 18:10:59,1,0,Proud to attend the grand opening and dedication ceremony of a new wind tunnel at Yuma Proving Ground named after Master Sergeant Bannar.,,,,,
426745573153460224,240760644,repgosar,Twitter for iPad,2014-01-24 15:57:27,0,0,"Great breakfast meeting this morning with Phil Townsend, Jonathan Lines and Yuma County Supervisor Russell McCloud http://t.co/2XKBiqgIyp",,,,,
426743889631125504,240760644,repgosar,Twitter for iPad,2014-01-24 15:50:46,3,0,RT @Judi_Harris: @RepGosar thank you for visiting Lake Havasu City and sharing the facts with our citizens,,,426213729131167746,21704763,Judi_Harris
426743482754289664,240760644,repgosar,Twitter for iPad,2014-01-24 15:49:09,1,2,"This morning I was on air in Yuma with Russ Clark, AM 1400. http://t.co/1F9lP8BN8X",,,,,
426526453690531840,240760644,repgosar,Twitter for iPad,2014-01-24 01:26:45,3,2,Packed house for Yuma townhall tonight. #patriots http://t.co/qtH9a59EUJ,,,,,
426525827254460416,240760644,repgosar,iOS,2014-01-24 01:24:16,4,2,On air in Yuma with @KYMA11 http://t.co/doXWJP6rOq,,,,,
426516762138787840,240760644,repgosar,Twitter for iPad,2014-01-24 00:48:15,6,1,Lively immigration discussion with Yuma County supervisors and elected officials this afternoon. http://t.co/GbAsfe4iNg,,,,,
426486914141913088,240760644,repgosar,Twitter for iPad,2014-01-23 22:49:38,4,2,Speaking to AZ Western College Student Leadership. We're discussing #jobs &amp; need for free-market health care reform http://t.co/3cwzOTC9AA,,,,,
426477568599289856,240760644,repgosar,Twitter for iPad,2014-01-23 22:12:30,2,0,Enjoyed lunch today in Yuma with Sheriff Leon Wilmot and Jonathan Lines. http://t.co/pxd3DQgOgO,,,,,
426169946951806976,240760644,repgosar,Twitter for iPad,2014-01-23 01:50:07,4,0,RT @dizzystrings: @RepGosar government prevents the creation of jobs. The environment to me would be the government getting out of the way#…,,,426167289915113472,197969289,dizzystrings
426169248101056513,240760644,repgosar,Twitter for iPad,2014-01-23 01:47:21,8,3,"Rep. Gosar re Benghazi: ""You deserve awnsers. You're going to get awnsers."" #LakeHavasuTownHall",,,,,
426167431128571904,240760644,repgosar,Twitter for iPad,2014-01-23 01:40:08,6,1,"Rep. Gosar: ""The President says we're the party of no. We are the party of KNOW!"" #LakeHavasuTownHall",,,,,
426166647229927424,240760644,repgosar,Twitter for iPad,2014-01-23 01:37:01,6,0,"Rep. Gosar: ""We need a patient-centered, patient-friendly healthcare system."" #LakeHavasuTownHall",,,,,
426163387131629568,240760644,repgosar,Twitter for iPad,2014-01-23 01:24:03,8,4,Rep. Gosar: the federal government doesn't create jobs. It creates the environment for private-sector job creation.,,,,,
426162301809348609,240760644,repgosar,Twitter for iPad,2014-01-23 01:19:45,9,4,Rep. Gosar: Who won with the omnibus spending bill? Lobbyists. Who lost? Taxpayers.,,,,,
426160922256613376,240760644,repgosar,Twitter for iPad,2014-01-23 01:14:16,6,1,"Rep. Gosar at town hall: ""we have to start looking at mandatory spending. We can change our fiscal trajectory."" http://t.co/MVwTeKs0xH",,,,,
426156165043462144,240760644,repgosar,Twitter for iPad,2014-01-23 00:55:22,4,1,Constituents are filing in for the 6pm town hall in Lake Havasu City http://t.co/z8Z0LSOYk6,,,,,
426117440636862464,240760644,repgosar,Twitter for iPad,2014-01-22 22:21:29,4,0,Big thanks to Dave and Andrew from the Bullhead City Police Department for their service to our community. http://t.co/K82mb4HDtm,,,,,
426106824673095680,240760644,repgosar,iOS,2014-01-22 21:39:18,3,0,Thank you for your service Admiral Schultz! http://t.co/BLI6ChY1SQ,,,,,
426104640015310848,240760644,repgosar,Twitter for iPad,2014-01-22 21:30:37,2,1,"Rep. Gosar: ""if you don't give us PILT, give us our land back""",,,,,
426103984349138944,240760644,repgosar,Twitter for iPad,2014-01-22 21:28:01,3,1,"Rep Gosar to law enforcement officials: If government doesn't uphold the rule of law, it breeds contempt for the law http://t.co/s5XeVdWB8V",,,,,
426102407722840064,240760644,repgosar,Twitter for iPad,2014-01-22 21:21:45,0,1,About to speak at the Colorado River Law Enforcement Association http://t.co/Sp1fE0DSBX,,,,,
426098482642812928,240760644,repgosar,Twitter for iPad,2014-01-22 21:06:09,1,1,Big thanks to Alan Nelson from the La Paz County Sheriff's Office for inviting me to speak to CRLEA this afternoon. http://t.co/NbGfn1uVzW,,,,,
426092040879742976,240760644,repgosar,Twitter for iPad,2014-01-22 20:40:33,1,0,"@RebekahLSanders to appreciate Arizona is to appreciate the 2nd Amendment. To appreciate the 2nd Amendment, you have to exercise it.",RebekahLSanders,426071057414373376,,,
426090969184743424,240760644,repgosar,Twitter for iPad,2014-01-22 20:36:18,6,0,"RT @RebekahLSanders: .@RepGosar, staff and 13 guns. Skeet and trap shooting in Fort Mohave. http://t.co/hLmW8RUKtj",,,426071057414373376,17090066,RebekahLSanders
426066543617658880,240760644,repgosar,Twitter for iPad,2014-01-22 18:59:14,3,1,"Big thanks to Bubba, owner of Redneck's Southern Pit BBQ. I inhaled it so fast that I barely remember the taste. http://t.co/7HKlW6dBMj",,,,,
426064814163492864,240760644,repgosar,iOS,2014-01-22 18:52:22,2,0,"Great lunch meeting today at Redneck's Southern Pit BBQ w/ Tyler Carlson, CEO of Mohave Electric Cooperative http://t.co/eEVsKu4XY4",,,,,
426064528535601152,240760644,repgosar,Twitter for iPhone,2014-01-22 18:51:14,3,0,RT @YumaArizona: Where else do you see tank crossing signs? ;-) http://t.co/8ZsOTphBMc,,,426064095515652096,56452260,YumaArizona
426064018613104640,240760644,repgosar,Twitter for iPhone,2014-01-22 18:49:12,72,0,RT @Heritage: Poll: 62% of Americans Support More Abortion Restriction Laws http://t.co/bsMhrJGbLY #MarchForLife #WhyWeMarch,,,426063123687034881,10168082,Heritage
426032036906688512,240760644,repgosar,Twitter for iPad,2014-01-22 16:42:07,13,7,"""I've noticed that everyone who is for #abortion is already born"" --Ronald Reagan. I'm proud to stand for Life today! #prolife",,,,,
426028337606062083,240760644,repgosar,Twitter for iPad,2014-01-22 16:27:25,2,1,Rep. Gosar speaking to veterans in Kingman: my office is here to help you. -Staff http://t.co/3NeiNT6bIv,,,,,
425835507013013504,240760644,repgosar,Twitter for iPhone,2014-01-22 03:41:11,1,0,@hotzgeor @BlueDuPage Never let facts get in the way of a pretty infographic. Fact: House has passed many jobs bills only to die in Senate.,hotzgeor,425834126273703936,,,
425821961730535424,240760644,repgosar,Twitter for iPhone,2014-01-22 02:47:21,17,6,President says I'm the party of no. I am the party of know.  We have the facts and know the truth.,,,,,
425821694746316800,240760644,repgosar,Twitter for iPhone,2014-01-22 02:46:18,10,4,"""We need civil discussion. These aren't democrat or republican issues they're American issues.""",,,,,
425821541108940800,240760644,repgosar,Twitter for iPhone,2014-01-22 02:45:41,6,1,"Discussing healthcare. ""We need patient centered, patient friendly plans...There is an alternative to Obamacare.""",,,,,
425818249100414976,240760644,repgosar,Twitter for iPhone,2014-01-22 02:32:36,5,4,Round of applause for the fact none of the Az conservatives voted for massive spending bill.,,,,,
425815449331187712,240760644,repgosar,Twitter for iPhone,2014-01-22 02:21:29,5,1,"""There has to be ramifications for bad behavior."" Re: Wasteful spending within the department of defense.",,,,,
425814186547884032,240760644,repgosar,Twitter for iPhone,2014-01-22 02:16:27,7,1,"""More taxes and spending are not the solution.""",,,,,
425813522816069632,240760644,repgosar,Twitter for iPhone,2014-01-22 02:13:49,2,1,Staff will be live tweeting the town hall. Discussing our debt.  The causes and the solutions. http://t.co/hnX1IYwRaO,,,,,
425812914688110593,240760644,repgosar,Twitter for iPhone,2014-01-22 02:11:24,2,1,Thank you everyone joining us at our townhall in Kingman.  Just getting started. http://t.co/DEbB0vUl42,,,,,
425778213332074496,240760644,repgosar,Twitter for iPad,2014-01-21 23:53:31,5,0,"Big thanks to Angela Patterson, owner of Beale Street Brews Coffee Shop, for hosting us this afternoon. http://t.co/j1DOzsg1uk",,,,,
425757942537650176,240760644,repgosar,Twitter for iPad,2014-01-21 22:32:58,3,1,Enjoying coffee with Gina Cobb and several other leaders in Kingman at Beale Street Brew. http://t.co/YNF7ijCmF7,,,,,
425746303620878336,240760644,repgosar,Twitter for iPhone,2014-01-21 21:46:43,5,0,RT @BenAlteneder: Thanks for your support of shooting sports! @RepGosar @azgfd http://t.co/Xhv9FmoKMq,,,425701052386516993,26100391,BenAlteneder
425727434000855040,240760644,repgosar,Twitter for iPhone,2014-01-21 20:31:44,2,0,"Great lunch meeting today in Bullhead City with Mayor Hakin, City Manager Cotter and other community leaders http://t.co/ddWRPWmVTM",,,,,
425341998367666176,240760644,repgosar,Twitter for iPad,2014-01-20 19:00:09,10,3,Today we remember a great American #MLKDay http://t.co/USjVJM3Hxn,,,,,
424596611822399488,240760644,repgosar,iOS,2014-01-18 17:38:15,6,5,"Rep. Gosar to Student Dental Association: Good legislation isn't Republican or Democrat, it's American. http://t.co/LKSB80mk3c",,,,,
424337967050547200,240760644,repgosar,Twitter Web Client,2014-01-18 00:30:29,4,1,Enjoyed my tour of Paloma Dairy this afternoon. Big thanks to Arie for showing me how the milking process happens. http://t.co/g5r5QeeyZO,,,,,
424316124570714112,240760644,repgosar,Twitter Web Client,2014-01-17 23:03:42,2,0,Enjoyed touring the Gilbert Arizona Temple today with @JeffFlake and @RepMattSalmon,,,,,
424287077518159872,240760644,repgosar,Twitter Web Client,2014-01-17 21:08:16,3,0,Our debt is in excess of $17 trillion. What we're doing to future generations is shameful! http://t.co/NKq5AdZVE2,,,,,
424227212565291008,240760644,repgosar,Twitter Web Client,2014-01-17 17:10:24,2,2,This morning @EVITnews students interviewed me on topics ranging from GMOs to the FARRM bill. They're a smart group! http://t.co/ejhQ4p1ZrW,,,,,
424225836414562304,240760644,repgosar,Twitter for iPhone,2014-01-17 17:04:55,0,0,"@unemployeed2 Thank you for your passion, though the profanity is unnecessary. Please take a moment to get the facts http://t.co/c23T9Z6KhR",unemployeed2,424224572175417344,,,
423969099316994048,240760644,repgosar,Twitter for iPhone,2014-01-17 00:04:44,4,0,Sec. Gates: nothing gets people's attention in a hierarchal organization more than firing a big shot. #Obamacare #accountability -Staff,,,,,
423964866505101312,240760644,repgosar,Twitter for iPhone,2014-01-16 23:47:55,4,1,Sec. Gates: all throughout 2010 senior White House staff was leaking information about Afghanistan. #accountability #playbookcocktails,,,,,
423870777511772160,240760644,repgosar,Twitter Web Client,2014-01-16 17:34:03,11,5,Today I voted in favor of H.R.3362 because Americans have a right to know what’s happening with their healthcare. http://t.co/6RY1Tvx9tf,,,,,
423843820376031232,240760644,repgosar,Twitter Web Client,2014-01-16 15:46:56,5,2,"Today I co-sponsored H.R.7, legislation that would end funding for abortion insurance coverage in ObamaCare. http://t.co/4JBzwaRCH2",,,,,
423567155091611648,240760644,repgosar,Twitter Web Client,2014-01-15 21:27:33,9,4,Today I voted against the Omnibus Spending Bill because I was sent to Congress to cut spending and balance the budget http://t.co/n3iG5d9Fpw,,,,,
423548845511802880,240760644,repgosar,Twitter Web Client,2014-01-15 20:14:48,1,0,RT @joshua_deford: Can't wait to see @RepGosar in town next Tuesday!,,,423541033578672128,1213483770,joshua_deford
423495322786992128,240760644,repgosar,Twitter Web Client,2014-01-15 16:42:07,1,1,"Please join me next week for town hall meetings in Kingman, Lake Havasu City and Yuma. Check out the details here: http://t.co/vH0AyQYfb2",,,,,
423133043311017984,240760644,repgosar,Twitter Web Client,2014-01-14 16:42:33,2,0,RT @AZCounties: Thanks @RepGosar for putting congratulations &amp; recognition of Sup. Buster Johnson being elected Pres of AACo into the Congr…,,,422848013548023808,24196431,AZCounties
423132957273260032,240760644,repgosar,Twitter Web Client,2014-01-14 16:42:13,1,0,RT @JamesSpawnMD: I appreciate @RepGosar 's staff meeting with me and the @AmerAcadPeds today in DC.  Together we will put the needs of AZ …,,,422876955013558272,563445846,JamesSpawnMD
423132695518912512,240760644,repgosar,Twitter Web Client,2014-01-14 16:41:11,15,4,"Americans need jobs! About 347,000 people gave up looking for a job in December, while only 74,000 jobs were created. http://t.co/R9mC9AkcDn",,,,,
422824206879842305,240760644,repgosar,Twitter Web Client,2014-01-13 20:15:21,8,2,I'm appalled and dismayed that the U.S. Supreme Court is blocking Arizona’s ability to protect its children. http://t.co/3tQ9kpnhDo,,,,,
422747027232276480,240760644,repgosar,Twitter Web Client,2014-01-13 15:08:40,4,0,"RT @RepublicanStudy: .@RepGosar says ""I will do everything I can to advance this free-market alternative."" #ABetterWay http://t.co/7TcznjTo…",,,422738711273418752,22528309,RepublicanStudy
422149081595912192,240760644,repgosar,Twitter for iPad,2014-01-11 23:32:38,4,2,My wife Maude and I send our condolences to the family of former Israeli Prime Minister Ariel Sharon.,,,,,
422108847504125952,240760644,repgosar,Twitter for iPad,2014-01-11 20:52:46,24,2,"The House passed dozens of jobs bills last year, which are now stuck on Harry Reid's desk. http://t.co/ttnrgNvNEI",,,,,
421849502257926144,240760644,repgosar,Twitter for iPhone,2014-01-11 03:42:13,14,0,RT @repjustinamash: #ff @RepJBridenstine @RepDeSantis @RepJeffDuncan @RepGarrett @RepGosar @TGowdySC @RepTomGraves @RepAndyHarrisMD,,,421733627081547776,233842454,repjustinamash
421849262368911360,240760644,repgosar,Twitter for iPhone,2014-01-11 03:41:16,1,0,RT @NatResources: Natural Resources GOP #FF @RepGosar @Raul_Labrador @Rep_Southerland @RepBillFlores @RepJonRunyan @RepMullin,,,421767654165467137,41445718,NatResources
421768622516600832,240760644,repgosar,Twitter Web Client,2014-01-10 22:20:50,12,4,AG Holder has a total disregard for the rule of law and our nation's Constitution. It's time to hold him accountable! http://t.co/QsGYLyBRc3,,,,,
421692566069731328,240760644,repgosar,Twitter Web Client,2014-01-10 17:18:37,7,0,"Today I voted in favor of the Health Exchange Security and Transparency Act, which passed the House overwhelmingly. http://t.co/tzjxf6hKMC",,,,,
421673300108918786,240760644,repgosar,Twitter Web Client,2014-01-10 16:02:03,7,1,Obama Economy = Stagnant Job growth http://t.co/f8sMZiv3kR,,,,,
421416034185138176,240760644,repgosar,Twitter Web Client,2014-01-09 22:59:46,13,1,Eric Holder’s Department of ‘Injustice’ continues ignoring the rule of law and common sense. http://t.co/Pdz7bapQFO,,,,,
421112379599249408,240760644,repgosar,Twitter for iPad,2014-01-09 02:53:09,4,0,"RT @AZCounties: @RepGosar thanks for meeting w/ AACo &amp; Pres. Johnson to discuss unmanned aerial units, 4FRI &amp; officer benefits http://t.co/…",,,421109703687831552,24196431,AZCounties
421024834336731136,240760644,repgosar,Twitter Web Client,2014-01-08 21:05:17,6,2,The @NavalAcademy Summer STEM program is a great opportunity for your 8th-11th graders interested in science. http://t.co/U4IdyOpIJy,,,,,
421020113920200704,240760644,repgosar,Twitter Web Client,2014-01-08 20:46:31,7,3,"Congratulations to @RepByrne! I look forward to working with you to repeal and replace #Obamacare, reduce spending and rein in the fed govt",,,,,
421008657354985472,240760644,repgosar,Twitter Web Client,2014-01-08 20:01:00,10,2,"No more taxpayer bailouts!  Today, I announced my co-sponsorship of the ObamaCare Taxpayer Bailout Prevention Act http://t.co/gRVH8IhNPm",,,,,
420981500507484160,240760644,repgosar,Twitter Web Client,2014-01-08 18:13:05,0,0,"@RoughCreek7 @CamAndCompany My flight from Arizona to DC was delayed, which caused me to miss the interview. Sorry I missed you.",RoughCreek7,420673071645609984,,,
420976353463119872,240760644,repgosar,Twitter Web Client,2014-01-08 17:52:38,2,2,"Today marks 3 years since the tragic shooting in #Tucson. Remember the heroes, mourn the victims and pray for their families.",,,,,
420669830404902912,240760644,repgosar,Twitter Web Client,2014-01-07 21:34:37,5,0,Listen live at 2:40pm (AZ) to my interview w/ @CamAndCompany. We'll be discussing latest on Fast and Furious &amp; more http://t.co/9ph2pbkayP,,,,,
420668366408257536,240760644,repgosar,Twitter Web Client,2014-01-07 21:28:48,5,0,"RT @CamAndCompany: LIVE @ 2P/E: Arizona @RepGosar, @edmorrissey, @instapundit, @jgunlock, the latest #2A news from Chicago, and more - @NRA…",,,420628178541891584,325897784,CamAndCompany
420594525224976384,240760644,repgosar,Twitter Web Client,2014-01-07 16:35:23,1,0,"Congratulations to Robert Davies of Golden Valley, who was recently awarded the Carnegie Medal. http://t.co/M3iVJUFtP1",,,,,
420322871274008577,240760644,repgosar,Twitter Web Client,2014-01-06 22:35:56,2,0,Today I announced my nominations to the United States Service Academies for the Class of 2018. http://t.co/0HGhHGnRwR,,,,,
420301031268827136,240760644,repgosar,Twitter Web Client,2014-01-06 21:09:09,10,7,"This year, I'll continue demanding answers about Operation Fast &amp; Furious. The American people deserve to know the truth",,,,,
419975270272348161,240760644,repgosar,Twitter for iPad,2014-01-05 23:34:41,6,0,RT @mboyle1: @RepGosar that's right congressman. There's so few of you guys willing to stand up for truth. Thanks for what you do! Happy ne…,,,419347711289491457,21426423,mboyle1
419530475095744512,240760644,repgosar,Twitter for iPad,2014-01-04 18:07:14,10,2,Dec. 30 marked 6 months since the 19 hotshots died in Yarnell Hill Fire. Remember them and pray for their families. http://t.co/lyun5Wnro2,,,,,
419315611986968577,240760644,repgosar,Twitter for iPhone,2014-01-04 03:53:27,1,0,RT @CoyotefanJack: @fry_X_cycle Congrats on being a member of USA 2014 Women's Hockey. We could not be more proud of you. http://t.co/sTZSn…,,,418484924824305664,548654241,CoyotefanJack
419306776392003586,240760644,repgosar,Twitter for iPhone,2014-01-04 03:18:20,0,1,@TontoRimSAR Thank you for all you do! Happy New Year.,TontoRimSAR,419305063308206080,,,
419306519977398272,240760644,repgosar,Twitter for iPhone,2014-01-04 03:17:19,6,3,".@mboyle1 Don't let the facts get in the way of popular talking points in support amnesty for all, including drug, gun and human smugglers.",mboyle1,419209374674862080,,,
419305431685529600,240760644,repgosar,Twitter for iPhone,2014-01-04 03:12:59,5,0,RT @mboyle1: Steve King Was Right: 12-Year Old Illegal Alien Caught Smuggling 80 lbs of Marijuana at Border http://t.co/zm8HHRDOsM via @Bre…,,,419209374674862080,21426423,mboyle1
419299955560308736,240760644,repgosar,Twitter Web Client,2014-01-04 02:51:14,5,2,I've gotten behind on keeping up with my followers. I'm working to catch up. If you're in AZ and I'm not following you back give me a shout.,,,,,
419148076973326336,240760644,repgosar,Twitter for iPad,2014-01-03 16:47:43,4,2,I commend the @Annenberg_FDN for returning several Hopi and San Carlos Apache artifacts to their respective tribes. http://t.co/i55Pu8zs29,,,,,
418792931102040065,240760644,repgosar,Twitter for iPad,2014-01-02 17:16:30,9,1,"Pres. Obama's keep-your-doctor promise also false: people flocked to their doctors before Jan 1, when they lost them. http://t.co/cWVHaOPsYA",,,,,
418512884612603904,240760644,repgosar,iOS,2014-01-01 22:43:41,3,1,Team Gosar's Penny and Teresa attended today's 2nd Annual Emancipation Proclamation in PHX #selfie http://t.co/0Wg7f3ZX4P,,,,,
418427194608975873,240760644,repgosar,Twitter for iPad,2014-01-01 17:03:11,18,13,"In 2014, I will keep fighting to repeal and replace #ObamaCare, to investigate Benghazi &amp; Operation Fast and Furious, and to cut spending.",,,,,
418091051828932610,240760644,repgosar,Twitter for iPad,2013-12-31 18:47:29,3,2,"Happy New Year’s Eve! Have fun celebrating with family and friends tonight, but please do so safely! #NYE",,,,,
417762652866486272,240760644,repgosar,Twitter for iPad,2013-12-30 21:02:32,9,2,"According to witnesses, @nytimes recent claims about the terrorist attack in #Benghazi are false. http://t.co/wDjfKu9dEW",,,,,
417041161904082944,240760644,repgosar,Twitter Web Client,2013-12-28 21:15:35,6,4,Proud of my former staff @orlandowatson on the O'Reilly Factor discussing Obama losing African American support http://t.co/vbz9MM6Ovi,,,,,
417004085879922688,240760644,repgosar,Twitter for iPad,2013-12-28 18:48:16,9,0,RT @RepMattSalmon: #FF #AZ delegation on @twitter  @RepTrentFranks @RepDavid @RepGosar @RepRonBarber @RepSinema @RepKirkpatrick @RepRaulGri…,,,416664780905000960,1072382221,RepMattSalmon
416754007907237888,240760644,repgosar,Twitter for iPad,2013-12-28 02:14:33,3,0,"RT @lhindustrial: PRT @azmining ""@RepGosar speaks to @bullheadcity Mohave HS students on importance of minerals in every day life @azmining…",,,416610878684147712,291193320,lhindustrial
416357080346284032,240760644,repgosar,Twitter for iPad,2013-12-26 23:57:18,3,0,RT @ShannonJoyRadio: @RepGosar love your NON PC work in Washington DC! Keep it up!!,,,416064459443298304,26040780,ShannonJoyRadio
415917097026211840,240760644,repgosar,Twitter Web Client,2013-12-25 18:48:57,4,4,Merry Christmas everyone!,,,,,
415906642949971968,240760644,repgosar,Twitter Web Client,2013-12-25 18:07:25,5,0,RT @TMcArthurAZ: @RepGosar: 'I Dare the P.C. Police' to Punish Me for a 'Merry Christmas' Message http://t.co/XRvfMCd8Um,,,415879440212578304,263275295,TMcArthurAZ
415525927599079424,240760644,repgosar,Twitter for iPad,2013-12-24 16:54:35,2,1,"As we round out the year, I give thanks for the great community I serve. I want to thank each of you for making our community a great place",,,,,
415170001495007232,240760644,repgosar,Twitter for iPad,2013-12-23 17:20:16,12,1,New poll says #Obamacare support at all-time low. People are getting hurt by skyrocketing premiums. #Repeal&amp;Replace http://t.co/kjwD0lpgeg,,,,,
414942164078972928,240760644,repgosar,Twitter for iPad,2013-12-23 02:14:55,4,2,Big day for the #Cardinals! How about that defense?,,,,,
414420933286195200,240760644,repgosar,Twitter for iPad,2013-12-21 15:43:44,2,1,Tune into 1100 AM today from 12-2pm. I'll be on air w/ Jeff Serdy discussing #FastFurious Click here to listen live: http://t.co/H9WKpjLIqA,,,,,
414181388728795136,240760644,repgosar,iOS,2013-12-20 23:51:52,15,11,Welcome home to wounded warrior Seth Wakeling. Your service &amp; sacrifice will never be forgotten. http://t.co/gYYUB678JH,,,,,
414101894597189632,240760644,repgosar,Twitter Web Client,2013-12-20 18:35:59,4,0,RT @AHLA_GovAffairs: @RepGosar thank you for your work on HR3661 to protect local communities in the event of a federal govt. #shutdown htt…,,,414099363153977344,1599284149,AHLA_GovAffairs
