id,user_id,screen_name,source,created_at,retweet_count,favorite_count,text,in_reply_to_screen_name,in_reply_to_status_id,retweeted_status_id,retweeted_status_user_id,retweeted_status_screen_name
627288577878175744,240760644,repgosar,Twitter for iPhone,2015-08-01 01:23:46,13,0,RT @FreedomWorks: Congrats to @RepGosar for winning FreedomWorks' FreedomFighter Award for 2014! http://t.co/5Mdu1KnIW1,,,627182018032484352,14730894,FreedomWorks
627245010568749057,240760644,repgosar,Twitter Web Client,2015-07-31 22:30:38,7,4,BREAKING F-35 NEWS: US Marine Corps Declares F-35 Operational http://t.co/DO3EyWk5G5,,,,,
627139863637282817,240760644,repgosar,Instagram,2015-07-31 15:32:49,7,3,I'm honored to have received the 2014 Freedom Fighter Award from @freedomworks #liberty #freedom… https://t.co/5OEeUOIcPC,,,,,
627132157711024128,240760644,repgosar,Twitter Web Client,2015-07-31 15:02:12,2,0,My first read of the day from @thehill: GOP Probes Alleged Internal Problems with Obama Water Rule http://t.co/qmhPr2lkow @GOPoversight,,,,,
626884450987692032,240760644,repgosar,Twitter Web Client,2015-07-30 22:37:54,16,11,It's great to have the support of @SenMikeLee in the fight to stop Obama's utopian housing regulation: http://t.co/g1hqiw3lFc,,,,,
626854998262071297,240760644,repgosar,Twitter Web Client,2015-07-30 20:40:52,1,0,"RT @amenasaiyid: .@GOPoversight posts corps #wotus memos on their website, a day after @RepGosar submits them to the committee. https://t.c…",,,626844612716560384,240737573,amenasaiyid
626771887553683456,240760644,repgosar,Twitter Web Client,2015-07-30 15:10:37,4,2,"1st read of the day from @JudicialWatch: Judge Threatens to Hold IRS Commissioner, DOJ Lawyers in Contempt of Court http://t.co/jMNVUnNzPJ",,,,,
626740359712931840,240760644,repgosar,Twitter for iPhone,2015-07-30 13:05:20,6,0,"RT @ijreview: I'm Condemning Planned Parenthood For Their Actions, and Millennials Agree. http://t.co/Qe1hECsPWQ via @RepGosar",,,626429243090714624,474464413,ijreview
626489561120698368,240760644,repgosar,Twitter Web Client,2015-07-29 20:28:45,3,1,MUST WATCH: Shame on #EPA &amp; Admin. McCarthy for illegally forcing WOTUS rule on the American people. @GOPoversight https://t.co/K1a9YKocKJ,,,,,
626461367525081088,240760644,repgosar,Twitter Web Client,2015-07-29 18:36:43,0,2,Federal bureaucracy continues to plague natural energy development on public lands. My bill (H.R. 2663) fixes that: http://t.co/EPZQLiMcce,,,,,
626422044058501120,240760644,repgosar,Sprout Social,2015-07-29 16:00:28,11,13,My first article for @ijreview is out: I'm condemning #PlannedParenthood and millennials will agree! http://t.co/vX4wrckfHL #AZ04,,,,,
626406448944271360,240760644,repgosar,Twitter Web Client,2015-07-29 14:58:30,1,0,"1st read of the day from @DailyCaller: Vet Community Backs New Accountability Bill, But This Union Stands in the Way http://t.co/6C5QXwteOR",,,,,
626178254219681792,240760644,repgosar,Twitter Web Client,2015-07-28 23:51:44,10,6,It’s far past time for Congress to take a stand and take back its Constitutional power. http://t.co/0aVFVcFwjZ http://t.co/UtxDvYCZqk,,,,,
626143371409661953,240760644,repgosar,Twitter Web Client,2015-07-28 21:33:07,6,0,RT @ACUConservative: The 2014 ACU Award for Conservative Excellence for a 92% rating presented to @RepGosar by Chairman @mschlapp #tcot htt…,,,626143288471482368,56401482,ACUConservative
626127667033583616,240760644,repgosar,Sprout Social,2015-07-28 20:30:43,3,3,"Last week for my D.C. summer interns! Thank you for your hard work, Jack, Josh, &amp; Harry! http://t.co/EDxt4j6lXn",,,,,
626085999471296513,240760644,repgosar,TweetDeck,2015-07-28 17:45:09,11,11,Here is how I'm taking action to stop Obama's most radical regulation yet: http://t.co/K8V7lgURdo #AFFH http://t.co/jwXlYUKe4v,,,,,
626071892974260224,240760644,repgosar,Twitter Web Client,2015-07-28 16:49:05,0,3,"Congratulations to the @AZCardinals newest hire Dr. Jen Welter, 1st female coach in the #NFL. http://t.co/bjiHmyw3J4 #AZCardinals",,,,,
626053087451594752,240760644,repgosar,Twitter Web Client,2015-07-28 15:34:22,4,5,My first read of the day from @politico:Third Graphic Planned Parenthood Video Released http://t.co/Sa5yEBsFeC,,,,,
625825761153445888,240760644,repgosar,Twitter for iPhone,2015-07-28 00:31:03,17,17,"This week’s #MilitaryMonday honors the life of Vincent Rethman (U.S. Air Force) from Prescott, Arizona. #AZ04 http://t.co/ZeIM29hy4O",,,,,
625802938271797248,240760644,repgosar,Twitter Web Client,2015-07-27 23:00:21,9,4,I've joined my @GOPoversight colleagues in calling for the removal of IRS Commissioner John Koskinen: http://t.co/HrA65oI4jc #IRSFail,,,,,
625765506910420993,240760644,repgosar,Twitter Web Client,2015-07-27 20:31:37,3,0,RT @RickWarner13: AZ US congressman Paul Gosar keynote at Arizona #WateReuse / #AZ Water Water Reuse Symposium OGS. http://t.co/GQC1RaH3I9,,,625708926797897728,1461239528,RickWarner13
625757705039425537,240760644,repgosar,Twitter Web Client,2015-07-27 20:00:37,6,5,Must watch video: The #IRS must be held accountable &amp; @GOPoversight is planning to do just that... https://t.co/GigaKzT3sB,,,,,
625672414370865153,240760644,repgosar,Twitter Web Client,2015-07-27 14:21:42,14,6,My 1st read of the day from @dcexaminer: Documents Prove IRS 'Political Targeting' of Conservatives http://t.co/HJdutWO6kt @GOPoversight,,,,,
625347909287047168,240760644,repgosar,Instagram,2015-07-26 16:52:14,3,3,How is this for being a good host to our guests from the U.K. Parliament? Big thanks to Air Methods… https://t.co/zASlEg4BNW,,,,,
624981185958178816,240760644,repgosar,Instagram,2015-07-25 16:35:00,2,6,I am honored to welcome Members of Parliament Andrea Jenkyns and Angela Rayner to the Grand Canyon… https://t.co/IRPOOEa8TQ,,,,,
624708258385764352,240760644,repgosar,Instagram,2015-07-24 22:30:29,2,4,"Today was the final day that my Senior Legislative Aide, Michael Mansour, will be serving on my… https://t.co/PYU7IFoNm8",,,,,
624621317308854272,240760644,repgosar,Sprout Social,2015-07-24 16:45:01,1,5,#FollowFriday for TODAY ONLY! #Follow me &amp; I'll follow back! #FF http://t.co/Uj41mYAFVf,,,,,
624605438382751745,240760644,repgosar,Twitter Web Client,2015-07-24 15:41:55,2,0,RT @RepFrankGuinta: #FF @HerreraBeutler @RepDavid @CongPalazzo @RepGosar who cosponsored my bill #HR1737 to help #consumers struggling to r…,,,624590459185332224,236960387,RepFrankGuinta
624584119633215488,240760644,repgosar,Twitter Web Client,2015-07-24 14:17:12,8,5,Former San Carlos Apache Tribe historian separates fact from fiction on Oak Flat: http://t.co/vwFQCAg7kJ @azcentral,,,,,
624414999784591360,240760644,repgosar,Twitter for iPhone,2015-07-24 03:05:11,4,4,Praying for those involved in the #Lafayette move theater shooting,,,,,
624342102168719360,240760644,repgosar,Twitter Web Client,2015-07-23 22:15:31,6,0,RT @GOPoversight: Congrats to @RepGosar &amp; @HurdOnTheHill for making top 20 in the @HouseGOP #digitalchallenge!,,,624341386192637952,22508473,GOPoversight
624221601744220160,240760644,repgosar,Twitter Web Client,2015-07-23 14:16:41,6,2,My 1st read of the day from @thehill: Republicans Turn Subpoena Power on Obama’s Environmental Agenda http://t.co/dajcoDZclB @GOPoversight,,,,,
624208675159326720,240760644,repgosar,Twitter Web Client,2015-07-23 13:25:20,2,1,Great to join @JrzyJoePiscopo this morning on NYC's @am970TheAnswer to discuss ending #SanctuaryCity laws.,,,,,
624198890326204417,240760644,repgosar,Twitter for iPhone,2015-07-23 12:46:27,3,0,"RT @am970TheAnswer: Coming up at 8:40, @JrzyJoePiscopo talks w/ @RepGosar #immigration #SanctuaryCities http://t.co/87rzj2zde7",,,624184275902959616,102714152,am970TheAnswer
623933963833339904,240760644,repgosar,Twitter Web Client,2015-07-22 19:13:43,5,3,It should surprise no one that the fallen heroes of #Chattanooga selflessly gave their lives protecting others: http://t.co/hrKNHJBKk2,,,,,
623913522972520448,240760644,repgosar,Twitter Web Client,2015-07-22 17:52:30,10,12,My sincerest condolences go out to the family of WWII vet &amp; Navajo Code Talker Kee Etsicitty. http://t.co/zp9AbpyohI http://t.co/LN5FvxEXqi,,,,,
623871059293507588,240760644,repgosar,Twitter Web Client,2015-07-22 15:03:46,5,1,"My first read of the day, from @WSJ: Iran Inspections in 24 Days? Not Even Close http://t.co/WGFU4DIhj4",,,,,
623606239419871234,240760644,repgosar,Twitter Web Client,2015-07-21 21:31:28,2,0,RT @roselawgroup: Jordan Rose participated in @RepGosar's #WomenOnDeck event. Top right is Library of Congress… https://t.co/lORWL27zw3,,,623604712743522305,18624182,roselawgroup
623597216079441921,240760644,repgosar,Twitter Web Client,2015-07-21 20:55:36,3,6,Proud of the services #TeamGosar provided to #AZ04 so far in 2015. Arizonans deserve nothing but the best. http://t.co/sInLVnPOPI,,,,,
623543941758107648,240760644,repgosar,Twitter Web Client,2015-07-21 17:23:55,5,5,Proud of House Leadership for taking the lead in honoring our 5 servicemen who were killed in #Chattanooga. http://t.co/lbZsernGd5,,,,,
623513164009897989,240760644,repgosar,Twitter Web Client,2015-07-21 15:21:37,2,0,"My first read of the day, from @thehill: Top Republican Slams Federal Land Energy Report as ‘Dismal’ http://t.co/dIiruBjYbb @RepRobBishop",,,,,
623249235719421953,240760644,repgosar,Twitter Web Client,2015-07-20 21:52:51,1,3,"This week’s #MilitaryMonday honors Robert Brutinel (Marine Corps) of Casa Grande, Arizona. https://t.co/DwYp15WWSi http://t.co/Z9pde1jjgL",,,,,
623237417965854720,240760644,repgosar,Twitter Web Client,2015-07-20 21:05:54,1,0,RT @Anne4Arizona: Great conversation about engaging more women in community!  Thank you @RepGosar and @SecretaryReagan!  #SHECounts https:/…,,,623228625618219008,86247800,Anne4Arizona
623234572344557568,240760644,repgosar,Twitter Web Client,2015-07-20 20:54:35,4,1,Attention America’s Suburbs: You Have Just Been Annexed http://t.co/UPjvuBuanm from @NRO,,,,,
623220215996915712,240760644,repgosar,Twitter Web Client,2015-07-20 19:57:33,2,2,"Thanks to everyone who attended my women's leadership conference ""Women on Deck"" today in Scottsdale! #WomenOnDeck http://t.co/kebkfB1FyZ",,,,,
623194908099244033,240760644,repgosar,Twitter for iPhone,2015-07-20 18:16:59,3,0,RT @SecretaryReagan: It's a pleasure to be at the Women On Deck Event in Scottsdale with these amazing women and @RepGosar! http://t.co/sX7…,,,623194804231405568,104904750,SecretaryReagan
623144018059370496,240760644,repgosar,Twitter Web Client,2015-07-20 14:54:46,8,2,Disturbing 1st read of the day from @FoxNews: Obama Looks to Ban Some Social Security Recipients from Owning Guns http://t.co/ZAJGrequoG,,,,,
622098711443832832,240760644,repgosar,Twitter Web Client,2015-07-17 17:41:05,15,15,I’m excited to welcome Lilia Dashevsky as the newest full-time member of Team Gosar! @lilydashevsky http://t.co/7nPX9r2FQm,,,,,
622091815928360960,240760644,repgosar,Twitter Web Client,2015-07-17 17:13:41,12,0,RT @RepScottRigell: Thx @RepLouieGohmert &amp; @RepGosar 4 joining our call for #SECDEF Carter to make immediate changes re: concealed carry @ …,,,622090602746880000,221793778,RepScottRigell
622051097528692736,240760644,repgosar,Twitter Web Client,2015-07-17 14:31:53,2,5,"My first read of the day, from Charles @Krauthammer: Worse than We Could Have Imagined @washingtonpost http://t.co/XqWaKD770u",,,,,
621820358597873664,240760644,repgosar,Sprout Social,2015-07-16 23:15:01,6,6,As a father of 3 I'm disgusted by #PlannedParenthood &amp; I call on Dr. Nucatola to be #fired http://t.co/xk1SLTQiGW,,,,,
621804087374409728,240760644,repgosar,Twitter Web Client,2015-07-16 22:10:21,2,3,The bipartisan action taken in the House today will ensure a reliable water supply for U.S. agriculture producers. http://t.co/iXa9cMdOjG,,,,,
621715139688050689,240760644,repgosar,Twitter Web Client,2015-07-16 16:16:54,172,117,.@BarackObama runs an Admin. that prioritizes terrorist nations &amp; illegal immigrants over our allies &amp; the unborn http://t.co/xlLsmMn4R5,,,,,
621684889973297152,240760644,repgosar,Twitter Web Client,2015-07-16 14:16:42,4,1,"A very good first read of the day, from @SenatorLankford: When Courts Defer to Agencies http://t.co/seLTBi56ZB @WashTimes",,,,,
621406690303475712,240760644,repgosar,Twitter Web Client,2015-07-15 19:51:14,2,2,Proud to support Arizona's thriving golf industry along with @GCSAA for all of their important work. http://t.co/AAaqtr2xDU,,,,,
621371593667817473,240760644,repgosar,Twitter Web Client,2015-07-15 17:31:47,23,0,RT @RepMarthaRoby: I'd say we're gaining momentum. Thank you @SpeakerBoehner &amp; @GOPLeader for demanding investigations of PP practices http…,,,621356185179017217,224294785,RepMarthaRoby
621356735538831365,240760644,repgosar,Instagram,2015-07-15 16:32:44,2,1,"Answering questions at the monthly ""Conversations with Conservatives"" press conference #AZ04… https://t.co/ydYlUOFdPr",,,,,
621353654201765888,240760644,repgosar,Twitter for iPhone,2015-07-15 16:20:30,4,0,"RT @conversations: ""In order to raise the debt ceiling we should be asking for some real reforms"" - @Raul_Labrador #cwc114",,,621352180809920512,562989744,conversations
621350265006854146,240760644,repgosar,Sprout Social,2015-07-15 16:07:01,5,9,"I want to wish former Rep. Barry Goldwater, Jr. a very happy 77th #birthday! http://t.co/5X2lUS5zdY",,,,,
621328867052097536,240760644,repgosar,Twitter Web Client,2015-07-15 14:42:00,155,64,My horrifying first read of the day from @michellemalkin: The Wine-Sipping Butchers of Planned Parenthood http://t.co/b9gHcVBtem,,,,,
621059518856830976,240760644,repgosar,Instagram,2015-07-14 20:51:42,1,6,I'm proud to have heritageaction's highest Conservative rating of the entire Arizona delegation so… https://t.co/YtsW6vYiVb,,,,,
621023354095562752,240760644,repgosar,Twitter for iPhone,2015-07-14 18:28:00,19,0,"RT @repjohnconyers: Proud to oppose the ""Innovation Act."" HR9 would stifle #innovation and hurt our patent system: http://t.co/GVbKPO8RWa h…",,,621022037381922816,138770045,repjohnconyers
620959396525424640,240760644,repgosar,Twitter Web Client,2015-07-14 14:13:51,6,4,Here is my full statement in response to the #IranDeal announced this morning: http://t.co/bzJKrr3rKZ,,,,,
620932309097816064,240760644,repgosar,Twitter Web Client,2015-07-14 12:26:13,8,4,"Under the Obama Administration, we've gone from preventing, to managing, to encouraging Iran's nuclear capabilities. #IranDeal is a #BadDeal",,,,,
620749594922741760,240760644,repgosar,Twitter Web Client,2015-07-14 00:20:11,8,3,"This week’s #MilitaryMonday features Jack Moneymaker (U.S. Army) of Chino Valley, Arizona. https://t.co/pWuCgqoURC http://t.co/PjZaNs4xzF",,,,,
620724710632988672,240760644,repgosar,Twitter for iPhone,2015-07-13 22:41:18,1,0,"RT @CYC_Coolidge: The Coolidge Youth Coalition is excited to attend the ""Women On Deck"" event and hear @RepGosar! #feelingexcited https://t…",,,620714306208821248,3166068824,CYC_Coolidge
620702548102643712,240760644,repgosar,Twitter for iPhone,2015-07-13 21:13:14,3,0,RT @boblatta: RT @propanecaucus: Thanks to @RepGosar for joining the Congressional #Propane Caucus!,,,620702388907835392,15394954,boblatta
620687473681825792,240760644,repgosar,Instagram,2015-07-13 20:13:20,0,2,"We have added one last speaker for my leadership conference, ""Women On Deck"" next Monday July 20th in… https://t.co/RpM8RCofdl",,,,,
620678181805256705,240760644,repgosar,Twitter Web Client,2015-07-13 19:36:24,3,5,Got @taylorswift13 stuck in my head today but for a good reason: Her generous donation to help Naomi Oakes from AZ fight Leukemia #TeamNaomi,,,,,
620668364390858752,240760644,repgosar,Twitter Web Client,2015-07-13 18:57:24,0,1,"Good news: the Hellsgate Fire Department in Payson, Arizona was awarded the SAFER federal grant. @PaysonRoundup http://t.co/VscK56Sina",,,,,
620600231860805632,240760644,repgosar,Twitter Web Client,2015-07-13 14:26:40,6,2,My 1st read of the day from Senator @BenSasse &amp; @WIRED: The #OPM Hack May Have Given China a Spy Recruiting Database http://t.co/IiJT68WKWs,,,,,
619584254935191552,240760644,repgosar,Twitter Web Client,2015-07-10 19:09:32,8,12,.@oreillyfactor I have signed on as an original sponsor of Kate's Law joining @RepMattSalmon &amp; @Rep_Hunter http://t.co/ILqcYmfZTJ #KatesLaw,,,,,
619578908472643585,240760644,repgosar,Twitter Web Client,2015-07-10 18:48:17,6,5,.@KatiePavlich wishing you a #HappyBirthday! Thank you for all your good work!,,,,,
619568521815703552,240760644,repgosar,Twitter Web Client,2015-07-10 18:07:01,2,3,#FF Speakers at my 7/20 leadership conference in Scottsdale: @ChavezLinda @SecretaryReagan @LisaAAtkins @roselawgroup http://t.co/fsMzABBZVO,,,,,
619556805077766144,240760644,repgosar,Twitter Web Client,2015-07-10 17:20:27,4,3,The resignation of OPM Director Archuleta was long overdue. More proactive leadership is desperately needed to prevent future data breaches.,,,,,
619530209101000704,240760644,repgosar,Twitter Web Client,2015-07-10 15:34:46,5,0,RT @RepSinema: #FF cosponsors of our bill to help firefighters use Unmanned Aircraft Systems to fight wildfires @Rep_Hunter @RepScottPeters…,,,619521973870137345,1080844782,RepSinema
619511922493407232,240760644,repgosar,Twitter Web Client,2015-07-10 14:22:06,3,0,"My first read of the day, from @cronkitenews: House OKs Bill Aimed at Curbing Wildfires https://t.co/k3DfdDOEz4",,,,,
619245211445673984,240760644,repgosar,Twitter Web Client,2015-07-09 20:42:18,4,5,Looking forward to being on the @VitoandVitoShow show tonight at 8:30PM EST! http://t.co/tJFjcuHmN2 #AZ04,,,,,
619179006487883776,240760644,repgosar,Twitter Web Client,2015-07-09 16:19:13,4,7,THIS WEEK ONLY: Follow me (REPGOSAR) on #Instagram and I'll follow you back! #Follow4Follow #FollowMe #F4F http://t.co/jH985cGBVE,,,,,
619169852192915457,240760644,repgosar,Twitter Web Client,2015-07-09 15:42:51,4,3,Proud to work with @RepHardy on increasing transparency of national monument designations. http://t.co/Fn2ES4dQhK http://t.co/UvjRSO1Td7,,,,,
618927568092299264,240760644,repgosar,Twitter Web Client,2015-07-08 23:40:06,4,3,We have added a speaker for the July 20th women's leadership conference in Scottsdale. Updated flyer attached. http://t.co/GfDqsaAmmn,,,,,
618921584091377664,240760644,repgosar,Twitter Web Client,2015-07-08 23:16:19,1,1,@Big1stTeaParty @SpecialReport My amendment defunding this regulation passed the House. http://t.co/PjDIVG1sCA,Big1stTeaParty,618914259230064640,,,
618920736632258560,240760644,repgosar,Instagram,2015-07-08 23:12:57,5,2,Short clip from my appearance tonight on specialreport with @bretbaier foxnews @ United States Capitol https://t.co/UPax0KLED2,,,,,
618889468481773570,240760644,repgosar,TweetDeck,2015-07-08 21:08:42,6,7,Don't miss @SpecialReport on @FoxNews tonight as they cover Obama's utopian housing regulation. @BretBaier http://t.co/8h83uil1UV,,,,,
618868393962291200,240760644,repgosar,Twitter Web Client,2015-07-08 19:44:57,9,11,I want to join @taylorswift13 in sending my love &amp; prayers to Naomi Oakes as she battles cancer. #TeamNaomi #BadBlood http://t.co/7pWw52AjjI,,,,,
618823920167350272,240760644,repgosar,Twitter Web Client,2015-07-08 16:48:14,2,4,I'll continue to fight HUD's AFFH regulation &amp; ensure not 1 penny is appropriated to his big government takeover of America’s neighborhoods.,,,,,
618822500470947840,240760644,repgosar,Twitter Web Client,2015-07-08 16:42:35,2,2,"Just like DOJ/IRS/DHS, Obama is using HUD's new regulation as a political weapon to punish communities that don’t follow his liberal agenda.",,,,,
618821712365404160,240760644,repgosar,Twitter Web Client,2015-07-08 16:39:28,2,0,"Obama’s “Fair Housing"" regulation is the most aggressive attempt yet to force his utopian ideology on US communities. http://t.co/nXFAWf1Mvb",,,,,
618789190671708160,240760644,repgosar,Twitter Web Client,2015-07-08 14:30:14,0,0,A very tragic first read of the day from @thehill: Killing Roils Immigration Debate http://t.co/EazEnVyjMY,,,,,
618777559405301760,240760644,repgosar,Twitter Web Client,2015-07-08 13:44:01,0,2,"@ItsSpencerBrown @lilydashevsky Not for today's event, but here is the press release from the launch back in April: http://t.co/632aluZMbP",ItsSpencerBrown,618771012277174273,,,
618758110296018945,240760644,repgosar,Twitter for iPhone,2015-07-08 12:26:44,2,1,Big thanks to Randy Domolky &amp; David Long for speaking on patent reform with the #InventionsCaucus @RepBillFoster http://t.co/aBY5WYjUFr,,,,,
618573924352327680,240760644,repgosar,Twitter Web Client,2015-07-08 00:14:50,4,0,RT @RepHardy: Special thanks to @RepRobBishop &amp; @RepGosar for supporting my amendment to require transparency and local input for nat'l mon…,,,618573377058549760,2964222544,RepHardy
618570761289252864,240760644,repgosar,Twitter Web Client,2015-07-08 00:02:16,5,4,"Tonight, the House passed my amendmenet blocking one of the most wasteful examples of taxpayer funds I've ever seen: http://t.co/lTtCi8Ckam",,,,,
618530563889176577,240760644,repgosar,Twitter Web Client,2015-07-07 21:22:32,1,0,RT @RepCloakroom: Rep. Gosar (R-AZ) {@RepGosar} Amendment was adopted by voice.,,,618530438928277504,1137600571,RepCloakroom
618427240557191168,240760644,repgosar,Twitter Web Client,2015-07-07 14:31:58,4,1,"My first read of the day, from @StephenMoore and @FoxNews: As Greece Collapses, the Big Loser is Socialism http://t.co/QniyiuBqdA",,,,,
618159035594973186,240760644,repgosar,Twitter Web Client,2015-07-06 20:46:13,5,5,"This week's #MilitaryMonday features Harry Oberg (U.S. Army veteran) from Prescott, AZ: https://t.co/UW5iJQNa6Q http://t.co/J8zRtIHVbM",,,,,
618138929909362688,240760644,repgosar,Twitter Web Client,2015-07-06 19:26:20,2,3,"Please join me on July 20th in Scottsdale, AZ for my women's leadership conference. See flyer for more info. http://t.co/p04QrhLlLo",,,,,
618107243683315713,240760644,repgosar,Twitter Web Client,2015-07-06 17:20:25,4,4,Happy birthday W! I still get chills watching his first pitch at the 01' AZ/NY World Series: https://t.co/sc3gCxFSgM http://t.co/iWmvi8SpNb,,,,,
618063726072217600,240760644,repgosar,Twitter Web Client,2015-07-06 14:27:30,3,1,"My first read of the day, from @krauthammer &amp; @washingtonpost: The Worst Agreement in U.S. Diplomatic History http://t.co/kt5H7uta1Y",,,,,
617861334647107584,240760644,repgosar,Twitter for iPhone,2015-07-06 01:03:16,8,19,Champions of the world! Congrats Team USA! Especially proud of Arizona's own Julie Johnston! #USWNT @_JulieJohnston_ http://t.co/3mEklTkXl6,,,,,
617830916472369152,240760644,repgosar,Twitter for iPhone,2015-07-05 23:02:23,4,7,Here we go Team USA! We are incredibly proud of you all! #USWNT #USAvJPN #USASheBelieves http://t.co/1DCyyWq6c4,,,,,
617043519446851584,240760644,repgosar,Twitter for iPhone,2015-07-03 18:53:33,2,3,Remember: practice food safety when grilling with family &amp; friends this holiday weekend. #grillinglikeapro #4thofJuly @USDAfoodsafety,,,,,
616628325855952896,240760644,repgosar,Twitter Web Client,2015-07-02 15:23:43,2,2,"My first read of the day, from @HISTORY - Congress votes for independence http://t.co/Y8MMwqCRrm",,,,,
616353527556886528,240760644,repgosar,Twitter Web Client,2015-07-01 21:11:46,4,4,"Got a chance to congratulate Jaicee Pain from Kingman, AZ, who won my annual Easter card competition! You go girl! http://t.co/WFyz0UFFlC",,,,,
616298404617039872,240760644,repgosar,Twitter Web Client,2015-07-01 17:32:44,2,1,"My first read of the day, from @NRO - Despite Denials, White House Aides Knew about Hillary’s Private E-Mail Account http://t.co/k0rvJZEgAd",,,,,
615905898112925696,240760644,repgosar,Twitter Web Client,2015-06-30 15:33:03,0,1,"My first read of the day, from @azcentral - Here's What Became of the Granite Mountain Hotshots http://t.co/pP4mutEOgC",,,,,
615546872556556288,240760644,repgosar,Twitter Web Client,2015-06-29 15:46:25,7,5,"My first read of the day, from @politico - Supreme Court Deals Blow to Obama's Green Agenda http://t.co/z7WiUqC0cE",,,,,
614550661296975872,240760644,repgosar,Twitter Web Client,2015-06-26 21:47:50,6,3,Non-partisan Legal Review Validates Gosar Bill Williams River Water Rights Settlement Law http://t.co/A3uZgWSW56,,,,,
614451468700098560,240760644,repgosar,Twitter Web Client,2015-06-26 15:13:40,3,2,"My first read of the day, from @NRO - King v. Burwell: An Embarrassing Decision http://t.co/g98zmmsvnc",,,,,
614238365605580800,240760644,repgosar,Twitter Web Client,2015-06-26 01:06:53,19,14,"If the EPA continues to force job killing regs. on the American people, I'll continue to strip away their funding: http://t.co/nO740XWaUD",,,,,
614152816035262464,240760644,repgosar,Twitter Web Client,2015-06-25 19:26:56,2,0,RT @ezperkins: @RepGosar Thank you for your amendment to better fund the Bureau of Indian Education.,,,614152324274126850,28570569,ezperkins
614152789388849152,240760644,repgosar,Twitter Web Client,2015-06-25 19:26:50,1,0,RT @RepCloakroom: The Rep. Gosar (R-AZ) {@RepGosar} Amendment was adopted by voice,,,614152670169931776,1137600571,RepCloakroom
614138511789154304,240760644,repgosar,TweetDeck,2015-06-25 18:30:06,1,0,Happening now! Join @DeptVetAffairs Google Hangout to learn more about the #Veterans Choice Program. http://t.co/E6Cae3nbUD,,,,,
614125340680683522,240760644,repgosar,Twitter Web Client,2015-06-25 17:37:45,8,2,http://t.co/woACg8gQlm,,,,,
614101437711286273,240760644,repgosar,Twitter Web Client,2015-06-25 16:02:46,0,0,@mikelkaz @AZs_Politics Here is my solution: http://t.co/5F7x0iMYsN,mikelkaz,614081077666119680,,,
614101253900083200,240760644,repgosar,Twitter Web Client,2015-06-25 16:02:03,0,0,@CDaeda http://t.co/5F7x0iMYsN,CDaeda,614098841185288192,,,
614098632292364289,240760644,repgosar,Twitter Web Client,2015-06-25 15:51:37,12,4,"#SCOTUS Got “Grubered”, Legitimizes Obamacare Deceit &amp; Lies: http://t.co/lBbhTRWvpE",,,,,
