id,user_id,screen_name,source,created_at,retweet_count,favorite_count,text,in_reply_to_screen_name,in_reply_to_status_id,retweeted_status_id,retweeted_status_user_id,retweeted_status_screen_name
476392130945224705,222286905,repjoeheck,TweetDeck,2014-06-10 15:55:09,1,0,"This week on the @HouseFloor: #NASA auth, Mortgage Choice Act, #Veterans Access to Care Act. More info here -  http://t.co/gcNTgUmg3h #NV03",,,,,
475767705690443778,222286905,repjoeheck,TweetDeck,2014-06-08 22:33:55,40,18,Our thoughts and prayers go out to the LVMPD family and all those affected by today's tragedy. http://t.co/bUBNzcyhgV http://t.co/B0csKMz5Ux,,,,,
474924272943894528,222286905,repjoeheck,TweetDeck,2014-06-06 14:42:25,8,2,On #DDay70 let us never forget the men who bravely stormed the beaches &amp; turned the tide of the war in Europe #NV03 http://t.co/hEkQ9MkHQA,,,,,
474604864031293440,222286905,repjoeheck,TweetDeck,2014-06-05 17:33:11,8,1,"My personal fave: ""We'll preserve for our children this, the last best hope of man on earth."" What's yours? http://t.co/P8lJ5aeqSy #NV03 2/2",,,,,
474604125238202368,222286905,repjoeheck,TweetDeck,2014-06-05 17:30:15,2,1,"On 10th ann of President Ronald Reagan's passing, @USAToday has great list of his 10 most memorable quotes http://t.co/P8lJ5aeqSy #NV03 1/2",,,,,
474340050105561088,222286905,repjoeheck,Hootsuite,2014-06-05 00:00:55,2,2,Incredible views from @DTSummerlin project - supporting 2k construction jobs and bringing 2k retail jobs to #NV03  http://t.co/otnqOKtiQ1,,,,,
474312025582358528,222286905,repjoeheck,Hootsuite,2014-06-04 22:09:33,0,0,Today's visit to VA SW Primary Care Center was great opportunity 2 talk w vets &amp; staff about issues facing the system http://t.co/uK1blOwt8z,,,,,
474310028342861826,222286905,repjoeheck,TweetDeck,2014-06-04 22:01:37,0,0,Answer to @UPS &amp; NV connection: Founder Jim Casey born in Candelaria NV and first attempt at creating biz was in Goldfield NV.,,,,,
474232416341872641,222286905,repjoeheck,Hootsuite,2014-06-04 16:53:13,2,1,Up early 2 meet w @UPS drivers &amp; present safety/longevity awards. Do you know connection btw UPS &amp; Nevada? #NV03  http://t.co/d1CfhTX181,,,,,
474215270266200064,222286905,repjoeheck,TweetDeck,2014-06-04 15:45:05,1,2,Last night I held a listening session w/ #NV03 #veterans. A video summary of the event can be seen here - https://t.co/yKZkZstnZF,,,,,
473608094585745408,222286905,repjoeheck,TweetDeck,2014-06-02 23:32:23,1,1,MT @FSL3D:Thanks for stopping by @RepJoeHeck! Hope you enjoy the #3dprinting and #laser gifts! http://t.co/LeR7CcSN7x / Thnx for tour! #NV03,,,,,
473577183357988865,222286905,repjoeheck,Hootsuite,2014-06-02 21:29:33,2,1,Enjoyed meeting w members of Henderson chapter of @NARFEHQ in #NV03 Thanks for your service! http://t.co/NqKzB0OayQ,,,,,
473282920149295104,222286905,repjoeheck,TweetDeck,2014-06-02 02:00:16,4,2,I'm hosting a #veterans listening session on June 3 to hear from local vets abt VA issues. Information here - http://t.co/fHZGQ34DIi #NV03,,,,,
472860101246599169,222286905,repjoeheck,TweetDeck,2014-05-31 22:00:08,2,2,I'm hosting a #veterans listening session on June 3 to hear from local vets abt VA issues. Information here - http://t.co/fHZGQ34DIi #NV03,,,,,
472811743484604416,222286905,repjoeheck,Hootsuite,2014-05-31 18:47:58,3,2,Great news! Welcome home Sergeant Bowe Bergdahl!,,,,,
472437326145007616,222286905,repjoeheck,TweetDeck,2014-05-30 18:00:10,2,2,I'm hosting a #veterans listening session on June 3 to hear from local vets abt VA issues. Information here - http://t.co/fHZGQ34DIi #NV03,,,,,
472403773135261697,222286905,repjoeheck,TweetDeck,2014-05-30 15:46:51,2,0,"Take 3 minutes to hear my thoughts on problems at the VA, learn abt upcoming listening session for #veterans https://t.co/rrKMyeS8Uc #NV03",,,,,
472108057468870657,222286905,repjoeheck,TweetDeck,2014-05-29 20:11:46,2,0,#TBT to early 2013 meeting w/ local #Veterans Advisory Panel. These #vets are my eyes/ears in NV vet community #NV03 http://t.co/ioyc1K2WIm,,,,,
471739319213101056,222286905,repjoeheck,TweetDeck,2014-05-28 19:46:32,2,0,Click this link to get my thoughts on the problems at the VA surrounding the mistreatment of our #veterans. http://t.co/3oUevov57u #NV03,,,,,
471381482200895488,222286905,repjoeheck,Hootsuite,2014-05-27 20:04:37,3,0,You can see some photos from #MemorialDay community events and recognition ceremonies here: http://t.co/lzxYaQQfvo #NeverForget #NV03,,,,,
471025717804032000,222286905,repjoeheck,Hootsuite,2014-05-26 20:30:57,4,1,Finishing a day of remembrance at So. NV Veterans Memorial Cemetery  #MemorialDay #NV03 #NeverForget http://t.co/DQLD6SLuPh,,,,,
470995521747025920,222286905,repjoeheck,Hootsuite,2014-05-26 18:30:57,2,1,Humbled to participate in honoring the memory of @AmericanLegion BMI Post 40 members #MemorialDay #NV03 #NeverForget http://t.co/05FUJxhoHl,,,,,
470968993021714432,222286905,repjoeheck,Hootsuite,2014-05-26 16:45:32,0,0,"1st stop today, speaking at the Lakes Association 12th Annual Memorial Day ceremony #NV03 #MemorialDay #NeverForget http://t.co/mdFIPwGrfm",,,,,
470942447833329664,222286905,repjoeheck,TweetDeck,2014-05-26 15:00:03,2,2,I visited the Vietnam Veterans Memorial to pay my respects and talk about what #MemorialDay means to me. https://t.co/XTEJ2IO77T #NV03,,,,,
470342776283230208,222286905,repjoeheck,Hootsuite,2014-05-24 23:17:11,1,0,Thnx to @FindlayChevy 4 Memorial Day Celebration &amp; surprising 2 wounded warriors! Follow link to learn more! http://t.co/vew3Q0DP34 #NV03,,,,,
470272048561139712,222286905,repjoeheck,Hootsuite,2014-05-24 18:36:08,2,2,"Congrats 2 @USArmy newest 2LT's Cameron, Castro, Fune, Henriod, Thom, Wilkerson &amp; Yim #UNLV #ROTC #ArmyStrong #NV03 http://t.co/hwHOtlaJSI",,,,,
470255454053216256,222286905,repjoeheck,Hootsuite,2014-05-24 17:30:11,2,0,Honored to keynote and administer oath @USArmy commissioning ceremony. #UNLV #ROTC #HOOAH #NV03 http://t.co/VnMIQGL7gE,,,,,
469525866272153601,222286905,repjoeheck,TweetDeck,2014-05-22 17:11:04,1,0,I will continue pushing this important debate so that security is not achieved at the expense of our civil liberties. #NV03 3/3,,,,,
469524353357336577,222286905,repjoeheck,TweetDeck,2014-05-22 17:05:03,0,1,But was frustrated my amendment to reaffirm Americans can't be turned over to military for indef detention was ruled out of order. #NV03 2/3,,,,,
469523290378092545,222286905,repjoeheck,TweetDeck,2014-05-22 17:00:50,0,0,"2day voted 4 #FY15NDAA which provides 4 common defense, supports/protects warfighters, allows US to maintain vital global presence #NV03 1/3",,,,,
469497811420319744,222286905,repjoeheck,TweetDeck,2014-05-22 15:19:35,3,2,"Just supported House passage of USA FREEDOM Act which ends bulk data collection by the federal government, maintains nat'l security #NV03",,,,,
469497114645757953,222286905,repjoeheck,TweetDeck,2014-05-22 15:16:49,8,0,RT @RepMikeQuigley: Honored to be @BPC_Bipartisan May #Bipartisan Champion w/ @RepJoeHeck for work to create jobs via #JOLTact http://t.co/…,,,469496620581916673,56864092,RepMikeQuigley
469245087214764033,222286905,repjoeheck,TweetDeck,2014-05-21 22:35:21,3,1,House passed VA Mngmnt Accountability Act. Bill = important step twrds bringing increased accountability 2 VA #NV03 http://t.co/LJpNXAYDcF,,,,,
469205254396198913,222286905,repjoeheck,TweetDeck,2014-05-21 19:57:04,1,1,Met today with Mary &amp; @BarryGoldNV from @AARPNV to talk about #AARP2014issues. Good talking with you! #NV03 http://t.co/QPkipD7qBd,,,,,
469161201034067969,222286905,repjoeheck,TweetDeck,2014-05-21 17:02:01,0,0,"I spoke on the House floor to urge colleagues to support #FY15NDAA which provides funds for ""common defense"" https://t.co/j90zhVDh04 #NV03",,,,,
469126794877370368,222286905,repjoeheck,TweetDeck,2014-05-21 14:45:18,0,0,Via the @LasVegasSun - #Nevada lawmakers support legislation to fight human trafficking http://t.co/oHmHi1vRjQ #EndTrafficking #NV03,,,,,
468884058911834113,222286905,repjoeheck,TweetDeck,2014-05-20 22:40:45,0,0,Today the House passed 5 bills to #EndTrafficking. Click http://t.co/yk8nnrp4C8 to learn more about them. #NV03,,,,,
468872707527163904,222286905,repjoeheck,TweetDeck,2014-05-20 21:55:39,2,3,Great meeting with fellow #Nevada emergency physicians from @ACEPNow to discuss issues affecting patient care. #NV03 http://t.co/3jIzyzS4MO,,,,,
468832324894081024,222286905,repjoeheck,TweetDeck,2014-05-20 19:15:11,3,0,"The House just approved Conference report to #WRRDA, impt bipartisan bill that supports water infrastructure projects, creates #jobs #NV03",,,,,
468821206230376450,222286905,repjoeheck,TweetDeck,2014-05-20 18:31:00,1,2,Problem: Sex tourism. Solution: HR 4573 International Megan's Law. #NV03 Learn more here - http://t.co/r0iFWWGEzD #EndTrafficking,,,,,
468813659654062081,222286905,repjoeheck,TweetDeck,2014-05-20 18:01:01,0,1,Problem: Online advertising. Solution: HR 4225 Stop Advertising Victims of Exploitation Act. http://t.co/r0iFWWGEzD #NV03 #EndTrafficking,,,,,
468806104630460416,222286905,repjoeheck,TweetDeck,2014-05-20 17:31:00,0,0,Problem: Trafficking victims are charged as criminals. Solution: HR 3610 Stop Exploitation Through Trafficking Act #NV03 #EndTrafficking,,,,,
468798558645518337,222286905,repjoeheck,TweetDeck,2014-05-20 17:01:00,1,1,Problem: Sex trafficking of youth in foster care. Solution: Preventing Sex Trafficking &amp; Improving Opps for Youth in Foster Care Act #NV03,,,,,
468791007010914304,222286905,repjoeheck,TweetDeck,2014-05-20 16:31:00,0,0,Problem-Lack of resources; law enforcement tools. Solution-Justice 4 Victims of Trafficking Act http://t.co/r0iFWWGEzD #EndTrafficking #NV03,,,,,
468785315034173440,222286905,repjoeheck,TweetDeck,2014-05-20 16:08:23,1,0,RT @NevadaWingCAP: @RepJoeHeck  Thank you for your support! Hooray for CAP! The Congressional Gold Medal has passed! http://t.co/VDvcFG3o40…,,,468784065903357952,844911439,NevadaWingCAP
468783459704795136,222286905,repjoeheck,TweetDeck,2014-05-20 16:01:01,1,0,Today House will vote on a series of bills to address problems we face in fight to #EndTrafficking. Learn more http://t.co/r0iFWWGEzD. #NV03,,,,,
468768858590171136,222286905,repjoeheck,TweetDeck,2014-05-20 15:02:59,0,2,.@hambrick4assemb and I wrote op-ed for @LasVegasSun on 3 areas we most focus on to #EndTrafficking. http://t.co/EjKJGP3xxe #NV03,,,,,
468527262506430465,222286905,repjoeheck,TweetDeck,2014-05-19 23:02:58,4,1,This week the House will be working to #EndTrafficking. Visit  http://t.co/r0iFWWGEzD to learn abt the bills we will be voting on. #NV03,,,,,
468491396060827648,222286905,repjoeheck,TweetDeck,2014-05-19 20:40:27,5,3,"Pleased to see #JOLTAct recognized by @BPC_Bipartisan as solution to improve economy, create #jobs #NV03   http://t.co/zJ2R8DWrvi",,,,,
468414401423622144,222286905,repjoeheck,TweetDeck,2014-05-19 15:34:30,5,0,"RT @BPC_Bipartisan: For their work to boost the economy, @RepJoeHeck and @RepMikeQuigley are this month's Bipartisan Champions: http://t.co…",,,468413007673171968,83932732,BPC_Bipartisan
467681596448186369,222286905,repjoeheck,Hootsuite,2014-05-17 15:02:36,3,2,"To all who wear the uniform, thank you for your patriotic and selfless service in support of our country. http://t.co/99DuDfQh0P",,,,,
467394108378456066,222286905,repjoeheck,TweetDeck,2014-05-16 20:00:13,1,0,Visit http://t.co/uPcdgC8sGn to learn abt VA Management Accountability Act which will give the VA tools to make needed changes #NV03,,,,,
467386560866828288,222286905,repjoeheck,TweetDeck,2014-05-16 19:30:14,1,0,In light of issues surrounding @DeptVetAffairs it is critical we move the VA Management Accountability Act to the floor. #HR4031 #NV03,,,,,
467362153318453248,222286905,repjoeheck,TweetDeck,2014-05-16 17:53:15,0,0,Attention military families &amp; veterans - celebrate Armed Forces day at Craig Ranch Regional Park! See attached flyer! http://t.co/WKK1AevZdX,,,,,
467026366010236928,222286905,repjoeheck,TweetDeck,2014-05-15 19:38:57,3,1,".@lvlcc Thanks for the great discussion this morning on jobs, education, immigration. #NV03 http://t.co/G021DctqpY",,,,,
466963409406545920,222286905,repjoeheck,TweetDeck,2014-05-15 15:28:47,5,1,Learn about how the #JOLTAct will improve the economy and add jobs by watching this 3 minute video -  https://t.co/Q0weEojpSb #NV03,,,,,
466935235155099648,222286905,repjoeheck,TweetDeck,2014-05-15 13:36:49,4,0,Today is Peace Officers Memorial Day - pause to remember those who gave their lives in the protection of others. http://t.co/5Vtzmw08fn,,,,,
466676245405904896,222286905,repjoeheck,TweetDeck,2014-05-14 20:27:41,0,0,Last night I was proud 2 announce winners of 2014 Congressional Art Competition frm #NV03. Congrats to all! #CAC2014 http://t.co/vTD6JD6EKy,,,,,
466644240639221760,222286905,repjoeheck,Hootsuite,2014-05-14 18:20:31,0,0,@DaleNapierLV unfortunately invite arrived 4 days b4 event and I had prior commitment. Thanks for ur efforts incl fighting human trafficking,DaleNapierLV,466603671669993472,,,
466601368690892800,222286905,repjoeheck,TweetDeck,2014-05-14 15:30:09,4,2,Honored 2b recipient of @IFDA 's 2014 Thomas Jefferson Award for support of sensible fiscal/regulatory policy #NV03 http://t.co/wvpFeaQHBX,,,,,
466400036038135808,222286905,repjoeheck,TweetDeck,2014-05-14 02:10:08,3,0,Take 2 mins to watch this video about what I am doing locally and in Washington to #StopTrafficking.  http://t.co/HMYj74Eoao… #NV03,,,,,
466380730147569664,222286905,repjoeheck,Hootsuite,2014-05-14 00:53:25,3,1,Getting ready to recognize the artistic talents of @clarkcountysch students @SmithCenterLV http://t.co/v3uIlaQQca,,,,,
466326891667128320,222286905,repjoeheck,TweetDeck,2014-05-13 21:19:29,2,0,"RT @hambrick4assemb: A great round table discussing human trafficking.   Thanks, Congressman Dr. Joe Heck http://t.co/0eeDOWGftH",,,466276614985093121,159605877,hambrick4assemb
466274759211515904,222286905,repjoeheck,TweetDeck,2014-05-13 17:52:20,1,1,MT @NAIOPSNV: Thank you @RepJoeHeck for meeting with our President's Circle sponsors this morning http://t.co/JbsXbpCld4 / great discussion!,,,,,
466260919224664064,222286905,repjoeheck,TweetDeck,2014-05-13 16:57:20,0,0,Take 2 mins to watch this video about what I am doing locally and in Washington to #StopTrafficking.  https://t.co/yBoSgE1r7h #NV03,,,,,
466221370368864256,222286905,repjoeheck,TweetDeck,2014-05-13 14:20:11,2,0,RT @KTNV: Rep. Joe Heck hosts panel on human trafficking http://t.co/i9bGJ0qc8y,,,466196161221500929,16396368,KTNV
466003168049242112,222286905,repjoeheck,TweetDeck,2014-05-12 23:53:07,3,1,Thnx to everyone who attended today's Human Trafficking Panel Discussion. Building partnerships to #StopTrafficking http://t.co/SBSNA7mVXV,,,,,
465884377218420736,222286905,repjoeheck,TweetDeck,2014-05-12 16:01:05,1,1,2P TODAY - Anti Human Trafficking Panel Discussion. Visit http://t.co/o5BpY5zya6 for more info abt the event. #NV03 #StopTraffickingLasVegas,,,,,
465536830658445313,222286905,repjoeheck,TweetDeck,2014-05-11 17:00:04,0,1,Happy #MothersDay to the moms in #NV03! My message recognizing the immeasurable impact mothers have on our lives - http://t.co/cETivUKyrO,,,,,
465234833866645504,222286905,repjoeheck,TweetDeck,2014-05-10 21:00:02,2,0,I'm hosting a panel discussion to talk abt ways to prevent human trafficking in the Las Vegas area. Info here - http://t.co/o5BpY5zya6 #NV03,,,,,
464874640520015872,222286905,repjoeheck,Hootsuite,2014-05-09 21:08:45,2,0,Today is Military Spouse Appreciation Day. Thnx 2 the spouses who sacrifice so that those in uniform can serve. http://t.co/8z4ia0qtuZ,,,,,
464854399119282176,222286905,repjoeheck,TweetDeck,2014-05-09 19:48:20,6,0,RT @westerncaucus: #FF @westerncaucus Members @MarkAmodeiNV2 @RepJeffDuncan @RepJoeHeck @RepLynnJenkins @RepWalterJones,,,464853573617344512,144986277,westerncaucus
464842237520519168,222286905,repjoeheck,TweetDeck,2014-05-09 19:00:00,1,0,"Next week I'm hosting anti human trafficking panel in @CityofHenderson with law  enforcement, victim advocates http://t.co/o5BpY5zya6 #NV03",,,,,
464808024146989056,222286905,repjoeheck,TweetDeck,2014-05-09 16:44:03,1,1,House just passed @EdWorkforce bill Success &amp; Opportunity thru #QualityCharters Act on bipartisan 360-45 vote. #NV03 http://t.co/QJWR6K9qlX,,,,,
464477493656039424,222286905,repjoeheck,TweetDeck,2014-05-08 18:50:38,2,0,"On 69th ann. of VEDay, we remember men &amp; women of our #GreatestGeneration whose sacrifice made victory possible #NV03 http://t.co/G3O5LFgfia",,,,,
464437429215428609,222286905,repjoeheck,TweetDeck,2014-05-08 16:11:26,1,0,"Last night the House Armed Services Comm passed #FY15NDAA 61-0. Bill funds nat'l defense, supports troops, their families, veterans. #NV03",,,,,
464404931735474176,222286905,repjoeheck,Hootsuite,2014-05-08 14:02:18,1,0,"It's Nurse Appreciation Week! Thnx 2 all the nurses that helped train me, worked w me in the ER &amp; care for patients http://t.co/DL0npgCL4I",,,,,
464223397015089152,222286905,repjoeheck,TweetDeck,2014-05-08 02:00:57,6,2,"Next week I'm hosting anti human trafficking panel in @CityofHenderson with law  enforcement, victim advocates http://t.co/o5BpY5zya6 #NV03",,,,,
464142734744616960,222286905,repjoeheck,TweetDeck,2014-05-07 20:40:25,1,1,Today I am working with my House Armed Services Comm colleagues &amp; fellow @HASCRepublicans on #FY15NDAA mark-up #NV03 http://t.co/GmydMtAtnf,,,,,
464056608822009856,222286905,repjoeheck,TweetDeck,2014-05-07 14:58:11,22,10,"May is #MilitaryAppreciationMonth. Take time this month to thank our troops,their families, and our #veterans. #NV03 http://t.co/LEbbjNl8A5",,,,,
463678554589655040,222286905,repjoeheck,TweetDeck,2014-05-06 13:55:56,1,0,Today is National Teachers Appreciation Day. Thanks to all the teachers that helped me realize my potential #NV03 http://t.co/RDeRI2pvO7,,,,,
463476783095218177,222286905,repjoeheck,TweetDeck,2014-05-06 00:34:10,4,2,"It's Natl Travel &amp; Tourism Week. In LV, T&amp;T is $40 Billion/yr biz &amp; employs about half the workforce! #NTTW14 #NV03 http://t.co/V1Y2IVsWJZ",,,,,
463375093075550209,222286905,repjoeheck,TweetDeck,2014-05-05 17:50:05,3,0,Today marks Yom HaZikaron - Memorial Day in Israel. 66 years ago today our ally #Israel became an independent state.  #NV03,,,,,
462336183532797953,222286905,repjoeheck,TweetDeck,2014-05-02 21:01:50,0,2,"The American people deserve to know what actions the White House took before, during, and after the attack. #NV03",,,,,
462336111696965632,222286905,repjoeheck,TweetDeck,2014-05-02 21:01:33,2,1,"As co-spon of HRes36/given info revealed by released emails, I support Speaker’s decision 2 create select committee to invest Benghazi #NV03",,,,,
461970216923463680,222286905,repjoeheck,TweetDeck,2014-05-01 20:47:37,0,0,@WizardHunt https://t.co/4w4P1iAU5h,WizardHunt,461961636744417280,,,
461906522738790400,222286905,repjoeheck,TweetDeck,2014-05-01 16:34:31,0,0,My stmnt commemorating Asian American/Pacific Islander Heritage Month.  http://t.co/B8UZoeosaL I'm proud 2 rep the AAPI community of #NV03!,,,,,
461694170382364672,222286905,repjoeheck,TweetDeck,2014-05-01 02:30:42,2,0,Attention students in #NV03 - @CongApps Challenge submission deadline extended to May 31. Visit http://t.co/g14JrSewbQ for more information.,,,,,
461659094718640128,222286905,repjoeheck,TweetDeck,2014-05-01 00:11:20,2,2,"Celebrating 106th @USArmyReserve BDay w LTG Talley, CSM Thomas, @TulsiPress, and @RepBradWenstrup http://t.co/ZOd70vRzRO",,,,,
461658636709011456,222286905,repjoeheck,TweetDeck,2014-05-01 00:09:30,0,0,"House just passed H.R. 4486, Military Construction/Veterans Affairs Appropriations bill, w/ my vote in support. #NV03 http://t.co/T36A0WBIMT",,,,,
461566392421343233,222286905,repjoeheck,TweetDeck,2014-04-30 18:02:58,2,3,"Thx to Jason Smith, star of @ThriftHunters, for stopping by to talk abt small biz issues &amp; internet sales tax. #NV03 http://t.co/lWNlOr3zWz",,,,,
461558272944644096,222286905,repjoeheck,TweetDeck,2014-04-30 17:30:42,0,0,"In light of today's econ growth report, visit http://t.co/8mpW6WO7c7 2 see bills I'm pushing that will improve local, nat'l economy #NV03",,,,,
461536124796547072,222286905,repjoeheck,TweetDeck,2014-04-30 16:02:41,1,0,Via @NYTimes Econ Barely Grew in First Qtr http://t.co/xO7H9OJVuG House passed #StackofBills that will help get econ growth on track. #NV03,,,,,
461257445168656384,222286905,repjoeheck,TweetDeck,2014-04-29 21:35:19,2,3,Met w/ Nevadans rep'ing @AOAConnect abt issues facing optometrists; honored 2 rec Healthcare Leadership Award #NV03 http://t.co/Ub8bjC42WL,,,,,
461254028215996416,222286905,repjoeheck,TweetDeck,2014-04-29 21:21:44,0,0,MT @purtyboy: @Amer_Infidel @SkyeShepard Good question! / Co-sponsored 9/10/2013!!,,,,,
461253164596203520,222286905,repjoeheck,TweetDeck,2014-04-29 21:18:18,3,0,RT @TravelCoalition: #JOLTAct is a bipartisan bill to increase intl. visitation &amp; create jobs. An op-ed by @RepJoeHeck &amp; @RepMikeQuigley: h…,,,461241294917210112,158397501,TravelCoalition
461212398356287489,222286905,repjoeheck,TweetDeck,2014-04-29 18:36:19,1,0,As @EdWorkforce considers DoEd FY15 budget I remain committed to ensuring Nevada's successful #CTE programs are properly funded. #NV03,,,,,
461144406259924992,222286905,repjoeheck,Hootsuite,2014-04-29 14:06:08,10,0,RT @EdWorkforce: LIVE at 10AM: Secretary @arneduncan to discuss education department FY15 budget &amp; policy priorities. Watch online: http://…,,,461139784640233472,16424044,EdWorkforce
460858416261775360,222286905,repjoeheck,TweetDeck,2014-04-28 19:09:43,4,2,"As we mark Holocaust Remembrance Day, let us vow to #NeverForget atrocities committed &amp; lives lost due 2 hatred, intolerance. #NeverAgain",,,,,
460794355616579584,222286905,repjoeheck,TweetDeck,2014-04-28 14:55:10,1,0,Click http://t.co/BJrf2kYDwg to read my latest eNewsletter highlighting my work around #Nevada during the district work period. #NV03,,,,,
460128478910611456,222286905,repjoeheck,TweetDeck,2014-04-26 18:49:12,4,3,.@GrantAGift Great turnout for the Autism 5K Race for Hope &amp; Fun Walk at Town Square in #NV03! http://t.co/k4FgPP2y5E,,,,,
459453228447698944,222286905,repjoeheck,Hootsuite,2014-04-24 22:06:00,5,1,.@LVCCLD Congrats on 2014 National Medal for Museum and Library Service award! http://t.co/ex1cMZzKnC,,,,,
459093402370732032,222286905,repjoeheck,Hootsuite,2014-04-23 22:16:11,2,1,Stopped by @AmericanLegion Post 60 in Laughlin to talk w vets. #NV03 http://t.co/84F2pvVjiz,,,,,
459075730253819904,222286905,repjoeheck,Hootsuite,2014-04-23 21:05:57,0,1,Got a construction update on the new #NV03 VA Clinic in Laughlin http://t.co/mAX6rxJkm4,,,,,
459061112139677696,222286905,repjoeheck,Hootsuite,2014-04-23 20:07:52,1,0,"Stopped by CMA/New Wave Communications providing cable TV, digital phone and Internet services throughout Laughlin http://t.co/qe2jhfYMzH",,,,,
459037705960435712,222286905,repjoeheck,Hootsuite,2014-04-23 18:34:52,1,0,.@ClarkCountySch Great questions from Mr. Autry’s 12th grade US Govt Honors class at Laughlin HS in #NV03 http://t.co/0A7sPUIV6n,,,,,
458977302668259329,222286905,repjoeheck,TweetDeck,2014-04-23 14:34:51,9,7,.@USArmyReserve Happy Birthday! An honor to serve and I send a hearty HOOAH to my Army Reserve family! ARMY STRONG http://t.co/ix1TcphJbI,,,,,
458688006489391104,222286905,repjoeheck,Hootsuite,2014-04-22 19:25:17,1,1,".@BonanzaBev Thanx for tour, discussion on small business concerns, and keeping our visitors well-hydrated! #NV03  http://t.co/aU8cmw3dvd",,,,,
458419703422021632,222286905,repjoeheck,TweetDeck,2014-04-22 01:39:08,1,0,Thanx to the Asian Chamber of Commerce for a great discussion on issues affecting the small business community #NV03 http://t.co/6iT5nSykAW,,,,,
458330429129764864,222286905,repjoeheck,Hootsuite,2014-04-21 19:44:24,3,1,Toured @PremiumOutlets in #NV03. 60% of customers are intl tourists. #JOLT Act will inc. intl travel &amp; create jobs! http://t.co/sn7kNL5ZyL,,,,,
458302704646094848,222286905,repjoeheck,Hootsuite,2014-04-21 17:54:14,0,0,.@DunkinDonuts thanks for hosting another successful “Cup of Joe” at the Durango &amp; Wm Spgs location in #NV03 http://t.co/khdAXOJGXR,,,,,
457868576263659520,222286905,repjoeheck,TweetDeck,2014-04-20 13:09:10,1,1,Wishing everyone a blessed Easter Sunday http://t.co/KB6v4cI2QV,,,,,
457286495075074048,222286905,repjoeheck,Hootsuite,2014-04-18 22:36:11,1,2,RT @madhouseeastern: @RepJoeHeck thanks 4 stopping by the store today! Would’ve been there but on vacation./great service as always!,tealiciousherbs,457277299239305217,,,
457240935882297344,222286905,repjoeheck,Hootsuite,2014-04-18 19:35:08,4,1,.@WellHealthQC Thanx for putting patients at the center of healthcare w innovative/integrated healthcare solutions! http://t.co/UaUDz9AcrM,,,,,
456627208761532416,222286905,repjoeheck,Hootsuite,2014-04-17 02:56:24,1,1,Humbled to participate in @TheSpiritOf45 event in #NV03 to honor the achievements of America’s Greatest Generation http://t.co/0C1ajhmwtA,,,,,
456443355627409410,222286905,repjoeheck,TweetDeck,2014-04-16 14:45:50,8,8,Great meeting w/ students frm @UNLVDECA yesterday. These students are future business leaders of our community. #NV03 http://t.co/w7sRFN0uvk,,,,,
456186881068515328,222286905,repjoeheck,TweetDeck,2014-04-15 21:46:42,2,0,"Today is #TaxFreedomDay for #Nevada. Nevadans have now worked long enough to pay federal, state, &amp; local taxes #NV03 http://t.co/2aCbWiFB2I",,,,,
456145142643036160,222286905,repjoeheck,TweetDeck,2014-04-15 19:00:51,7,9,"#TaxDay fact: tax code contains nearly 4 mil words. Shakespeare's collected works - 900,000. Time to simplify. #NV03 http://t.co/eCcmSOtdeL",,,,,
456111460029304832,222286905,repjoeheck,TweetDeck,2014-04-15 16:47:00,6,4,#TaxDay fact: individuals/biz spend 6.1 bil hours per year on tax filing. Took abt 44k hrs to build Hoover Dam. #NV03 http://t.co/3ZoiRJauUq,,,,,
