id,user_id,screen_name,source,created_at,retweet_count,favorite_count,text,in_reply_to_screen_name,in_reply_to_status_id,retweeted_status_id,retweeted_status_user_id,retweeted_status_screen_name
626406854659190785,234812598,replarrybucshon,Twitter Ads,2015-07-29 15:00:06,0,0,REMINDER: A member of my staff will host office hours in Martin Co. tomorrow from 11am–12:30pm ET in the Loogootee Municipal Building. #IN08,,,,,
626156713192857601,234812598,replarrybucshon,Twitter Web Client,2015-07-28 22:26:08,3,0,RT @HouseJudiciary: The House passes the #REINSAct to control #regulations and reduce costs for #smallbiz #HJC114 http://t.co/odmd7b7x6F,,,626156628484726784,1131917492,HouseJudiciary
626124818891583489,234812598,replarrybucshon,Twitter Web Client,2015-07-28 20:19:24,1,0,21st Century Cures is something positive for all Americans. Watch: https://t.co/eAIOebgV7H. #cures2015,,,,,
626044468056080386,234812598,replarrybucshon,Twitter Ads,2015-07-28 15:00:07,0,0,REMINDER: A member of my staff will host office hours in Knox County tomorrow from 9am-5pm ET at 1500 North Chestnut St. in Vincennes. #IN08,,,,,
626030633819734016,234812598,replarrybucshon,Twitter Web Client,2015-07-28 14:05:08,9,0,RT @RepEdRoyce: .@HouseForeign Affairs Cmte hearing on the #IranDeal begins now. Watch here: http://t.co/zdkePzwzAH #NoNuclearIran http://t…,,,626030461958115328,246769138,RepEdRoyce
626021600001949696,234812598,replarrybucshon,Twitter Web Client,2015-07-28 13:29:15,4,0,"RT @RepToddYoung: With 10 new regs a day, #smallbiz spend $11k per employee each year in regulatory costs. #REINSAct is key to reform: http…",,,626021403985346561,234128524,RepToddYoung
625788768415522816,234812598,replarrybucshon,Twitter Web Client,2015-07-27 22:04:03,1,1,My office will have a resource table at the Mental Health Summit &amp; Workshop on USI's campus tomorrow morning. More: http://t.co/FouZQoAtT4.,,,,,
625754130246713344,234812598,replarrybucshon,Twitter Web Client,2015-07-27 19:46:25,2,0,"RT @irtl: Listen to Reps @repwalorski, @RepStutzman and @RepLarryBucshon re: #PPSellsBabyParts on our radio program. http://t.co/qzBwtdId7o",,,625742848948862976,73206697,irtl
625682067351678976,234812598,replarrybucshon,Twitter Ads,2015-07-27 15:00:04,0,1,REMINDER: A member of my staff will host office hours in Warrick County tomorrow from 1:30 -3:00 pm CT at the Newburgh Town Hall. #IN08,,,,,
625682064478638081,234812598,replarrybucshon,Twitter Ads,2015-07-27 15:00:03,0,0,REMINDER: A member of my staff will host office hours tomorrow from 10:00 am - 1:00 pm ET at the Jasper City Hall. #IN08,,,,,
623609627918381056,234812598,replarrybucshon,Twitter Web Client,2015-07-21 21:44:56,3,3,Congrats Adam!  https://t.co/Ikn4MQji7A,,,,,
623507743156998144,234812598,replarrybucshon,Twitter Ads,2015-07-21 15:00:04,1,0,REMINDER: A member of my staff will host office hours in Knox County tomorrow from 9am-5pm ET at 1500 N. Chestnut St. in Vincennes. #IN08,,,,,
623475106426322945,234812598,replarrybucshon,Twitter Web Client,2015-07-21 12:50:23,1464,0,RT @SpeakerBoehner: The flags @USCapitol stand at half-staff today in honor of the brave service members we lost in #Chattanooga. http://t.…,,,623468156196098048,7713202,SpeakerBoehner
623188411806040064,234812598,replarrybucshon,Twitter Web Client,2015-07-20 17:51:10,1,0,"""'Skeptical,' 'Concerned,' 'Disappointed': Dems Raise Tough Questions on Iran Nuclear Deal"" http://t.co/kDjuJ44nfd (via @SpeakerBoehner)",,,,,
623145364401467395,234812598,replarrybucshon,Twitter Ads,2015-07-20 15:00:07,0,1,REMINDER: A member of my staff will host office hours in Parke County tomorrow from 12:30-2:00 pm ET in the Parke County Courthouse. #IN08,,,,,
623145364372086784,234812598,replarrybucshon,Twitter Ads,2015-07-20 15:00:07,0,1,REMINDER: A member of my staff will host office hours in Vermillion County tomorrow from 9:30 - 11:00 am ET in the Clinton City Hall. #IN08,,,,,
623145354909716480,234812598,replarrybucshon,Twitter Ads,2015-07-20 15:00:04,0,1,REMINDER: A member of my staff will host office hours tomorrow from 10:00am - 1:00pm ET at the Jasper City Hall. #IN08,,,,,
623145346554728449,234812598,replarrybucshon,Twitter Ads,2015-07-20 15:00:02,0,1,REMINDER: A member of my staff will host office hours in Spencer County tomorrow from 1:30-3:00 pm CT in the Rockport City Hall. #IN08,,,,,
622119626693062656,234812598,replarrybucshon,Twitter Web Client,2015-07-17 19:04:12,2,0,RT @HouseCommerce: #SubOversight to review state health care exchanges under #Obamacare NEXT Friday --&gt; http://t.co/5UkHYucXej,,,622117723305312256,114756202,HouseCommerce
622087338060054528,234812598,replarrybucshon,Twitter Web Client,2015-07-17 16:55:53,3,0,"RT @IU_Health: Our visitor @RepLarryBucshon, a cardiothoracic surgeon, supported the #21stCenturyCures Act for medical advancements. http:/…",,,622086523954008064,64800805,IU_Health
622087307248713728,234812598,replarrybucshon,Twitter Web Client,2015-07-17 16:55:46,1,1,Thanks for having me today!  https://t.co/B5y2MmWK2g,,,,,
621695795671138305,234812598,replarrybucshon,Twitter Ads,2015-07-16 15:00:02,0,0,REMINDER: A member of my staff will host office hours in Daviess County tomorrow from 1:30–3pm ET at the Washington Mayor's Office. #IN08,,,,,
621689579070980096,234812598,replarrybucshon,Twitter Web Client,2015-07-16 14:35:20,1,1,Have you read the President's Iran deal? I've posted the full text here: http://t.co/JMf0ncbC79. Take a look &amp; let me know what you think.,,,,,
621663552596770816,234812598,replarrybucshon,Twitter Web Client,2015-07-16 12:51:55,1,0,RT @IHIF1: Thank you @RepLarryBucshon for meeting with our #WWFH15 group this morning!  Thanks for support of Indiana's life science indust…,,,621663460770709504,90907717,IHIF1
621432272030404608,234812598,replarrybucshon,Twitter Web Client,2015-07-15 21:32:53,0,0,Read the President's Iran deal in full and share your thoughts with me: http://t.co/JMf0ncbC79.,,,,,
621405445320765440,234812598,replarrybucshon,Twitter Web Client,2015-07-15 19:46:17,1,1,Proud to support our Hoosier farmers and ag industry!  https://t.co/ILIDZE0sC8,,,,,
621402033011204096,234812598,replarrybucshon,Twitter Web Client,2015-07-15 19:32:44,115,0,RT @RepFredUpton: Planned Parenthood video is abhorrent and rips at the heart. @HouseCommerce will get to the bottom of this appalling situ…,,,621352306521604096,124224165,RepFredUpton
621397538260807680,234812598,replarrybucshon,Twitter Web Client,2015-07-15 19:14:52,4,11,"“As a father of four and physician, I find this callous disregard for human life absolutely appalling."" http://t.co/nzuo9OvnVi",,,,,
621385011523137536,234812598,replarrybucshon,Twitter Web Client,2015-07-15 18:25:06,0,1,Thanks for inviting me!  https://t.co/husvIs7LqL,,,,,
621370139896885248,234812598,replarrybucshon,Twitter Web Client,2015-07-15 17:26:00,1,3,ICYMI: My statement on President Obama's Iran deal --&gt; http://t.co/bC4iwJKgPF.,,,,,
621344022502735872,234812598,replarrybucshon,Twitter Web Client,2015-07-15 15:42:13,0,2,Agree we need to end all taxpayer funds. Also need an investigation to hold everyone involved accountable. https://t.co/9YZDb00YCM,,,,,
621335103885733888,234812598,replarrybucshon,Twitter Web Client,2015-07-15 15:06:47,1,2,Thank you for all that you do!  https://t.co/hbLyCDzxXN,,,,,
621334854177845248,234812598,replarrybucshon,Twitter Web Client,2015-07-15 15:05:47,8,0,"RT @LD_Advocate: ""Whatever I can do to help, I will. It's about personal stories...it's not just about policy."" -@RepLarryBucshon DyslexiaH…",,,621311737342631936,884458202,LD_Advocate
621334814038302720,234812598,replarrybucshon,Twitter Web Client,2015-07-15 15:05:38,1,0,Happy to join you all today!  https://t.co/ptosuPWu8e,,,,,
621334732111015936,234812598,replarrybucshon,Twitter Web Client,2015-07-15 15:05:18,3,0,RT @LD_Advocate: .@ncldorg award winner @trine_it_up11 introduces his representative @RepLarryBucshon - a doctor and a father! #DyslexiaHil…,,,621310862150791168,884458202,LD_Advocate
621334496013627392,234812598,replarrybucshon,Twitter Web Client,2015-07-15 15:04:22,0,1,Find out more - http://t.co/L2DCgjcNyr.  https://t.co/ktND9ZnCgK,,,,,
621333418089910273,234812598,replarrybucshon,Twitter Ads,2015-07-15 15:00:05,0,0,REMINDER: A member of my staff will host office hours in Sullivan County tomorrow from 9–10:30am ET in the Sullivan County Courthouse. #IN08,,,,,
621333407243440128,234812598,replarrybucshon,Twitter Ads,2015-07-15 15:00:02,1,0,REMINDER: A member of my staff will host office hours tomorrow in Gibson County from 10:00 - 11:30 am CT in the Princeton City Hall. #IN08,,,,,
621304068963741696,234812598,replarrybucshon,Twitter Web Client,2015-07-15 13:03:27,1,0,RT @ACSCANIN: TY @RepLarryBucshon for voting YES on #cures2015 &amp; helping us work toward an end to #cancer! #OneDegree http://t.co/B8Os7pEgNr,,,620648310211088384,2693000023,ACSCANIN
621304030606790656,234812598,replarrybucshon,Twitter Web Client,2015-07-15 13:03:18,2,1,Thanks for stopping by yesterday!  https://t.co/Ck2GqPKv65,,,,,
620971040198430720,234812598,replarrybucshon,Twitter Ads,2015-07-14 15:00:07,0,0,REMINDER: A member of my staff will host office hours in Knox County tomorrow from 9am-5pm ET at 1500 N. Chestnut Street in Vincennes. #IN08,,,,,
620608649723973633,234812598,replarrybucshon,Twitter Ads,2015-07-13 15:00:07,0,0,REMINDER: A member of my staff will host office hours tomorrow from 10am - 1pm ET at the Jasper City Hall. #IN08,,,,,
620608638516723712,234812598,replarrybucshon,Twitter Ads,2015-07-13 15:00:04,0,0,REMINDER: A member of my staff will host office hours in Perry County tomorrow from 1:30 - 3:00 pm CT in the Tell City City Hall. #IN08,,,,,
620608634653806594,234812598,replarrybucshon,Twitter Ads,2015-07-13 15:00:03,0,0,REMINDER: A member of my staff will host office hours in Owen County tomorrow from 9:30 – 11:00 am ET in the Owen County Court House. #IN08,,,,,
620597913375387649,234812598,replarrybucshon,Twitter Web Client,2015-07-13 14:17:27,1,0,"RT @DuboisCoHerald: U.S. Rep. Larry Bucshon, R-8th, spoke on the House floor Thursday and included the story of the late Ann Seitz: http://…",,,619522971615391744,58882026,DuboisCoHerald
620597899722944512,234812598,replarrybucshon,Twitter Web Client,2015-07-13 14:17:24,1,0,"RT @BradfordWJTSTV: A special moment today on the floor of the US House of Representatives. Rep. Larry Bucshon, speaking on... http://t.co/…",,,619312576917147649,239183102,BradfordWJTSTV
619560318256156672,234812598,replarrybucshon,Twitter Web Client,2015-07-10 17:34:25,1,0,RT @alsadvocacy: Thanks for the ALS shout! @RepLarryBucshon @MayorSeitz Dr Bucshon 21st Cen Cures gives patients hope https://t.co/MIBU0PTw…,,,619538569221283840,21649697,alsadvocacy
619530121259687937,234812598,replarrybucshon,Twitter Web Client,2015-07-10 15:34:25,2,2,Huge win for patients across the country! #Cures2015 passes the House 344 to 77! http://t.co/qz0DRh9FQx,,,,,
619496338997313537,234812598,replarrybucshon,Twitter Web Client,2015-07-10 13:20:11,3,3,"ICYMI: ""Conservative Health Care Reform For The 21st Century"" (via @RepGusBilirakis) http://t.co/vrKQB5pRY2",,,,,
619280476008763392,234812598,replarrybucshon,Twitter for iPhone,2015-07-09 23:02:25,4,0,RT @ALSPublicPolicy: Thank you for giving the ALS community hope &amp; supporting HR 6! @RepLarryBucshon,,,619275692858036224,289374103,ALSPublicPolicy
619278697087021058,234812598,replarrybucshon,Twitter Web Client,2015-07-09 22:55:21,1,2,Watch my speech on #Cures2015 here - https://t.co/BqsuP3mhWi. Thx to @MayorSeitz for sharing his family's story. https://t.co/ULSfxZQYbN,,,,,
619244061543677952,234812598,replarrybucshon,Twitter Web Client,2015-07-09 20:37:43,1,3,Condolences to my friend @MayorWinnecke after the loss of his mother. Our thoughts and prayers are with the entire Winnecke family.,,,,,
619150210133049344,234812598,replarrybucshon,Twitter Web Client,2015-07-09 14:24:48,2,1,ICYMI: @RepLarryBucshon and @Rep_SteveWomack want to change how heroin addiction is treated --&gt; http://t.co/mqCXJ26Tc6 (via @dcexaminer),,,,,
619135700508770304,234812598,replarrybucshon,Twitter Web Client,2015-07-09 13:27:08,26,0,RT @PennyPritzker: .@CocaColaCO celebrates the 100th anniversary of the iconic @USPTO-patented glass coke bottle #CokeBottle100 http://t.co…,,,618941267171483648,308573576,PennyPritzker
619135594183180288,234812598,replarrybucshon,Twitter Web Client,2015-07-09 13:26:43,12,0,"RT @CocaColaCo: ""Indiana is proud to have played a part in a timeless tradition."" @RepLarryBucshon on Terre Haute, the birthplace of the Co…",,,618933653431812096,23482357,CocaColaCo
618907191312023552,234812598,replarrybucshon,Twitter Web Client,2015-07-08 22:19:07,22,0,"RT @RepFredUpton: Six things to know about #HR6, the 21st Century Cures Act: http://t.co/XCwtpOybmG #Cures2015",,,618887513743077376,124224165,RepFredUpton
618825332305580032,234812598,replarrybucshon,Twitter Web Client,2015-07-08 16:53:51,4,2,Great momentum for #Cures2015!   https://t.co/sjw9ccC5hn,,,,,
618824364625104897,234812598,replarrybucshon,Twitter Web Client,2015-07-08 16:50:00,1,1,Find out more about our bill here - http://t.co/L2DCgjcNyr. @rep_stevewomack  https://t.co/JpT3CjKqou,,,,,
618800651301179392,234812598,replarrybucshon,Twitter Web Client,2015-07-08 15:15:46,1,0,"RT @jonswaner: @RepLarryBucshon says technology, innovation should foster environmental improvements in power plants, not @EPA deadlines th…",,,618532013948170241,121238614,jonswaner
618800212811886592,234812598,replarrybucshon,Twitter Web Client,2015-07-08 15:14:02,4,0,"RT @HouseGOP: ""For the past year and a half, our committee has been listening. We've listened to researchers.. To patients."" -@RepFredUpton…",,,618785288136040448,15207668,HouseGOP
618798291527028737,234812598,replarrybucshon,Twitter Web Client,2015-07-08 15:06:24,3,3,"Release: ""@RepLarryBucshon &amp; @rep_stevewomack Introduce Bill to Combat Drug Addiction"" --&gt; http://t.co/L2DCgjcNyr. http://t.co/dDgX3utKl2",,,,,
618796705551519744,234812598,replarrybucshon,Twitter Ads,2015-07-08 15:00:05,0,0,REMINDER: A member of my staff will host office hours in Posey County tomorrow from 10 - 11:30 am CT at the Mt. Vernon Mayor's Office. #IN08,,,,,
618764623219675136,234812598,replarrybucshon,Twitter Web Client,2015-07-08 12:52:36,2,2,#CuresIn4Words --&gt; House vote this week! Learn more about @ECcures here: http://t.co/hrk38D6eA4. #Cures2015 http://t.co/oLBWLGbw2X,,,,,
618445044194910208,234812598,replarrybucshon,Twitter Web Client,2015-07-07 15:42:43,0,0,Great video highlighting the progress we've made in Congress.  https://t.co/gmiNZKi5SJ,,,,,
618434343128530944,234812598,replarrybucshon,Twitter Ads,2015-07-07 15:00:12,1,0,REMINDER: A member of my staff will host office hours in Knox County tomorrow from 9am-5pm ET at 1500 N. Chestnut Street in Vincennes. #IN08,,,,,
618413156977803264,234812598,replarrybucshon,Twitter Web Client,2015-07-07 13:36:00,38,0,RT @HouseCommerce: Have you seen this? Powerful patient voices urge #Cures2015 https://t.co/mQfdHeS1QC   RT to show your support for this l…,,,611909399955787776,114756202,HouseCommerce
618074707200348160,234812598,replarrybucshon,Twitter Ads,2015-07-06 15:11:08,1,0,REMINDER: A member of my staff will host office hours tomorrow in Greene County from 2:00 - 3:30 pm ET at the Linton City Hall. #IN08,,,,,
618070845718564864,234812598,replarrybucshon,Twitter Ads,2015-07-06 14:55:47,1,0,REMINDER: A member of my staff will host office hours tomorrow from 10am - 1pm ET at the Jasper City Hall. #IN08,,,,,
618070597503836160,234812598,replarrybucshon,Twitter Ads,2015-07-06 14:54:48,0,0,REMINDER: A member of my staff will host office hours in Dubois County tomorrow from 2:30-4:00 pm ET at the Ferdinand Town Hall. #IN08,,,,,
618069931590987780,234812598,replarrybucshon,Twitter Ads,2015-07-06 14:52:09,0,0,REMINDER: A member of my staff will host office hours in Clay County tomorrow from 9:30–11:00 am ET in the Clay County Court House. #IN08,,,,,
618037553338449920,234812598,replarrybucshon,Twitter Web Client,2015-07-06 12:43:29,27,0,RT @GOPLeader: On floor next week. #CuresIn4Words #Cures2015,,,616641496121507840,19739126,GOPLeader
616643058755608576,234812598,replarrybucshon,Twitter for iPhone,2015-07-02 16:22:16,1,1,Stopped by the @VincennesU all employee lunch to present Pres Helton a copy of my floor speech honoring his service! http://t.co/3Ox4CXn6aq,,,,,
616361921885958144,234812598,replarrybucshon,Twitter Web Client,2015-07-01 21:45:08,13,0,RT @HouseCommerce: Have you checked your vehicle this summer? --&gt; http://t.co/4Gxoqh1cEV http://t.co/WZ4GhOCOYV,,,616325629827485696,114756202,HouseCommerce
615527643283365888,234812598,replarrybucshon,Twitter Web Client,2015-06-29 14:30:00,0,0,"I’m holding office hours in my Evansville Office on Tues., July 1 from 1:30–3:30 pm CT. Appts. can be made by calling (812) 232-0523. #IN08",,,,,
614523027070398465,234812598,replarrybucshon,Twitter Web Client,2015-06-26 19:58:01,0,2,"I’m holding office hours in my Terre Haute Office on Mon., June 29 from 2:30–4:00 pm ET. Appts. can be made by calling (812) 232-0523. #IN08",,,,,
614130913845317632,234812598,replarrybucshon,Twitter Web Client,2015-06-25 17:59:54,1,0,"RT @wfyi: #NoLimitsWFYI is prerecorded today, listen at http://t.co/BPtezcVrJ2 or download the show at http://t.co/amQFqTj9mc. http://t.co/…",,,614121768278749184,17498103,wfyi
614129489170329601,234812598,replarrybucshon,Twitter Web Client,2015-06-25 17:54:14,3,0,RT @IndyThisWeek: .@RepLarryBucshon statement on Supreme Court ACA ruling. He's on #IndyThisWeek Sunday at 830 @rtv6 @RafaelOnTV http://t.c…,,,614123851044270080,3232145409,IndyThisWeek
614123013349490688,234812598,replarrybucshon,Twitter Web Client,2015-06-25 17:28:30,3,1,ICYMI: My statement on the King v. Burwell decision -- &gt; http://t.co/UsF3FSKAWK. http://t.co/bhTrRl0dgf,,,,,
614062733768720384,234812598,replarrybucshon,Twitter Web Client,2015-06-25 13:28:59,0,2,Hope everyone is ok!  https://t.co/6JQBwCjq1q,,,,,
613841995426103298,234812598,replarrybucshon,Twitter Web Client,2015-06-24 22:51:50,0,4,"RELEASE: ""Dr. Bucshon Votes to Protect Ratepayers from EPA Action"" http://t.co/3wX2A3MHyU",,,,,
613799882034413570,234812598,replarrybucshon,Twitter Web Client,2015-06-24 20:04:30,11,0,RT @McConnellPress: Thanks @GovPenceIN for standing up to #EPA overreach &amp; for jobs &amp; affordable/reliable electricity.  https://t.co/FLu4du…,,,613754909373132802,339822881,McConnellPress
613783479441072128,234812598,replarrybucshon,Twitter Web Client,2015-06-24 18:59:19,1,1,My full statement can be found here - http://t.co/umCX2OS5AE.  https://t.co/k10FIaDnfH,,,,,
613782239936184320,234812598,replarrybucshon,Twitter Web Client,2015-06-24 18:54:24,3,0,RT @ECcures: TLDR: Here's what you need to know about the @USCBO's 20 pg analysis of #Cures2015 legislation --&gt; http://t.co/FQ5CaJBxSY,,,613782120176160769,2469604452,ECcures
613778127911829504,234812598,replarrybucshon,Twitter Web Client,2015-06-24 18:38:03,6,0,RT @INSenateGOP: Here is Sen Jon Ford's statement on @GovPenceIN rejecting the @EPA Clean Power Plan: http://t.co/zf50D5YPqM #INLegis,,,613762486844682240,287822090,INSenateGOP
613770920486957057,234812598,replarrybucshon,Twitter Web Client,2015-06-24 18:09:25,5,0,RT @ColeClaybourn: .@RepLarryBucshon issues a statement supporting @GovPenceIN's letter to Obama re: not complying with new EPA plan. http:…,,,613769332422746112,39574682,ColeClaybourn
613770785354829824,234812598,replarrybucshon,Twitter Web Client,2015-06-24 18:08:53,0,4,Thanks for stopping by!  https://t.co/jMbLF4TJrU,,,,,
613770375806234624,234812598,replarrybucshon,Twitter Web Client,2015-06-24 18:07:15,7,15,I support @GovPenceIN's announcement that Indiana will not comply with EPA’s Clean Power Plan in its current form. http://t.co/xnuWLYMpHh,,,,,
613766360808689664,234812598,replarrybucshon,Twitter Web Client,2015-06-24 17:51:18,0,3,Make sure to tune in!  https://t.co/nE3gfxzACA,,,,,
613763954230300672,234812598,replarrybucshon,Twitter Web Client,2015-06-24 17:41:44,2,3,"ICYMI: I voted to end IPAB, an unelected board of 15 bureaucrats put in place by #ObamaCare to make cuts to Medicare. http://t.co/fT9QKmL9Xm",,,,,
613723281548443648,234812598,replarrybucshon,Twitter Ads,2015-06-24 15:00:07,0,0,REMINDER: A member of my staff will hold office hours tomorrow in Martin County from 11am–12:30pm ET at the Loogootee Municipal Building.,,,,,
613715976878714880,234812598,replarrybucshon,Twitter Web Client,2015-06-24 14:31:05,4,0,RT @PanCANIndy: Cody and others from Indiana @pancan are looking forward to visiting the office of @RepLarryBucshon to #WageHope http://t.c…,,,613403193939230720,181252803,PanCANIndy
613705894153584640,234812598,replarrybucshon,Twitter Web Client,2015-06-24 13:51:01,1,0,ICYMI: The House passed the Toxic Substances Control Act Modernization Act. Here's what it means to Indiana --&gt; http://t.co/rRP7n0ULht.,,,,,
613467172040503296,234812598,replarrybucshon,Twitter Web Client,2015-06-23 22:02:26,4,0,RT @ECcures: Read the updated letter from 67 cancer institutes in support of #Cures2015--&gt; http://t.co/E01MNadbEQ,,,613466873825468416,2469604452,ECcures
613360889790468097,234812598,replarrybucshon,Twitter Ads,2015-06-23 15:00:06,0,0,REMINDER: A member of my staff will host office hours in Gibson County tomorrow from 10:00-11:30am CT at the Princeton City Hall. #IN08,,,,,
613360887819206656,234812598,replarrybucshon,Twitter Ads,2015-06-23 15:00:06,1,0,"REMINDER: A member of my staff will host office hours tomorrow in Knox County from 9am-5pm ET at 1500 N. Chestnut Street, Vincennes. #IN08",,,,,
612998505817243648,234812598,replarrybucshon,Twitter Ads,2015-06-22 15:00:07,0,0,REMINDER: A member of my staff will hold office hours in Dubois County tomorrow from 10am – 1pm ET at the Jasper City Hall. #IN08,,,,,
612998505813049344,234812598,replarrybucshon,Twitter Ads,2015-06-22 15:00:07,0,0,REMINDER: A member of my staff will hold office hours in Warrick Co. tomorrow from 1:30-3pm CT at the Boonville-Warrick Co. Public Library.,,,,,
611914139393519616,234812598,replarrybucshon,Twitter Web Client,2015-06-19 15:11:14,1,0,REMINDER! Our Terre Haute Job Fair is today at 2pm ET (1pm ET for veterans) at @indianastate's Hulman Center. http://t.co/ArIqdXBmWr,,,,,
611593916127670272,234812598,replarrybucshon,Twitter Web Client,2015-06-18 17:58:47,1,1,Here's my floor speech: https://t.co/8hL70BFzp4.  https://t.co/2cDVF9YWr0,,,,,
611568450146799617,234812598,replarrybucshon,Twitter Web Client,2015-06-18 16:17:35,4,5,"Please join me in sending thoughts and prayers to the Emanuel Ame Church community in Charleston, SC. http://t.co/koOnNaK6Zh",,,,,
611548951733403648,234812598,replarrybucshon,Twitter Ads,2015-06-18 15:00:06,0,1,REMINDER: A member of my staff will host office hours in Daviess County tomorrow from 1:30–3:00pm ET at the Washington Mayor's Office. #IN08,,,,,
611258822032814080,234812598,replarrybucshon,Twitter Web Client,2015-06-17 19:47:14,4,3,WATCH: I spoke on the House floor to urge my colleagues to support full repeal of the medical device tax -- &gt; https://t.co/8hL70BXaNE.,,,,,
611186563129544704,234812598,replarrybucshon,Twitter Ads,2015-06-17 15:00:06,0,0,REMINDER: A member of my staff will hold office hours in Sullivan County tomorrow from 9–10:30am ET at the Sullivan County Courthouse. #IN08,,,,,
610824171317170176,234812598,replarrybucshon,Twitter Ads,2015-06-16 15:00:05,0,0,"REMINDER: A member of my staff will hold office hours tomorrow in Knox County from 9am-5pm ET at 1500 N. Chestnut Street, Vincennes. #IN08",,,,,
610788684468781056,234812598,replarrybucshon,Twitter for iPhone,2015-06-16 12:39:04,2,0,RT @NYUDocs: Hear abt new 21st Century Cures legislation w/ board-certified cardiothoracic surgeon &amp; @RepLarryBucshon #CURES2015 @SiriusXM …,,,610788535956828160,28147277,NYUDocs
610550807390494720,234812598,replarrybucshon,Twitter Web Client,2015-06-15 20:53:50,1,2,For more information on the 2015 Terre Haute Job Fair please visit: http://t.co/lC11a5I1Gr. #IN08,,,,,
610550462308294658,234812598,replarrybucshon,Twitter Web Client,2015-06-15 20:52:28,1,2,"REMINDER: The 2015 Terre Haute Job Fair is this Friday, June 19th from 1:00pm - 5:00pm ET at the Hulman Center! #IN08 http://t.co/b9YgXI9Joc",,,,,
610461789592027136,234812598,replarrybucshon,Twitter Ads,2015-06-15 15:00:07,1,0,REMINDER: A member of my staff will hold office hours in Dubois County tomorrow from 10:00am – 1:00pm ET at the Jasper City Hall. #IN08,,,,,
610461781979369473,234812598,replarrybucshon,Twitter Ads,2015-06-15 15:00:05,0,0,REMINDER: A member of my staff will hold office hours in Spencer County tomorrow from 1:30-3:00pm CT at the Santa Claus Town Hall. #IN08,,,,,
610461781970915328,234812598,replarrybucshon,Twitter Ads,2015-06-15 15:00:05,0,0,REMINDER: A member of my staff will hold office hours in Vermillion County tomorrow from 9:30 - 11:00 am ET at the Clinton City Hall. #IN08,,,,,
610461775859875840,234812598,replarrybucshon,Twitter Ads,2015-06-15 15:00:03,0,0,REMINDER: A member of my staff will hold office hours tomorrow in Parke County from 12:30–2:00 pm ET at the Parke County Courthouse. #IN08,,,,,
610450162037690368,234812598,replarrybucshon,Twitter Web Client,2015-06-15 14:13:54,1,0,"Happy to have Brown-Forman Corp. investing in #IN08! They just announced plans to bring a facility to Spencer, IN! http://t.co/6eR2i6EeWj",,,,,
609446929961873408,234812598,replarrybucshon,Twitter Web Client,2015-06-12 19:47:25,1,0,RT @ECcures: Chmn @RepFredUpton joins @SusanWBrooks &amp; @RepLarryBucshon in IN to discuss 21st Century Cures Act --&gt; http://t.co/s4LLFCSdCI #…,,,609432523769270272,2469604452,ECcures
609354731648061440,234812598,replarrybucshon,Twitter Web Client,2015-06-12 13:41:03,2,0,See how trade impacts the Hoosier economy --&gt; http://t.co/ePca6OslKH #TPA4USJobs,,,,,
