id,user_id,screen_name,source,created_at,retweet_count,favorite_count,text,in_reply_to_screen_name,in_reply_to_status_id,retweeted_status_id,retweeted_status_user_id,retweeted_status_screen_name
382935252231933952,132278386,senatorbarb,Twitter for BlackBerry®,2013-09-25 18:30:53,9,3,Today- 3:45 pm on CSPANII: Watch my Senate floor speech on why I oppose defunding Obamacare &amp;taking away healthcare from those who need it  ,,,,,
382873550639861760,132278386,senatorbarb,Twitter for iPhone,2013-09-25 14:25:42,24,7,"Thanks to Obamacare, simply being a woman is no longer a preexisting condition &amp; we’re going to fight for that.",,,,,
382873530029076480,132278386,senatorbarb,Twitter for iPhone,2013-09-25 14:25:37,17,7,"I fought to ensure women have coverage like maternity care, prenatal care &amp; preventive screenings like mammograms.",,,,,
382873303691825152,132278386,senatorbarb,Twitter for iPhone,2013-09-25 14:24:43,15,1,"As Dean of Senate Women, will be joined by Senate women along w new mothers to fight GOP plan to roll back women’s health coverage.",,,,,
382187586691006465,132278386,senatorbarb,Twitter for iPhone,2013-09-23 16:59:56,2,0,I'm continuing to fight for military construction jobs so Maryland BRAC jobs stay in Maryland,,,,,
382187460966772736,132278386,senatorbarb,Twitter for iPhone,2013-09-23 16:59:26,2,0,Maryland's military &amp; security assets make our nation safer &amp; MD's economy stronger,,,,,
382187409443524609,132278386,senatorbarb,Twitter for iPhone,2013-09-23 16:59:13,2,1,This morning met w MD Military Installation Council to talk military construction jobs http://t.co/AI1z62Utoo,,,,,
382184331743363072,132278386,senatorbarb,Twitter for iPhone,2013-09-23 16:47:00,9,0,RT @SenateApprops: The @NIHClinicalCntr will not admit new patients or initiate clinical trials in a government shutdown #NoShutdown @Senat…,,,382142630974742528,352534407,SenateApprops
382164896223211521,132278386,senatorbarb,Twitter for BlackBerry®,2013-09-23 15:29:46,5,0,"RT @SenateApprops: Under a government shutdown, thousands of children will lose access to school readiness programs #NoShutdown @SenatorBarb",,,382127546982494208,352534407,SenateApprops
381877949508890624,132278386,senatorbarb,Twitter for iPhone,2013-09-22 20:29:32,17,3,"New hotline set up for victims, witnesses &amp; survivors of Navy Yard tragedy to connect to crisis &amp; trauma counseling: Call 1-866-962-5048",,,,,
381877555977940993,132278386,senatorbarb,Twitter for BlackBerry®,2013-09-22 20:27:58,9,1,Am here at memorial service with our MD families who lost their loved ones. Expressing our deepest sympathies and condolences.,,,,,
381873196129341441,132278386,senatorbarb,Twitter for iPhone,2013-09-22 20:10:39,4,4,"And to thank our local &amp; federal law enforcement who were first on the scene &amp; took control of terrible, horrific situation",,,,,
381865240717430784,132278386,senatorbarb,Twitter for iPhone,2013-09-22 19:39:02,6,5,I join with all Americans in expressing my deepest condolences to all the families of those killed at the Navy Yard.,,,,,
381855471982088192,132278386,senatorbarb,Twitter for iPhone,2013-09-22 19:00:13,4,6,Headed to memorial in Washington w Pres Obama for those affected by senseless tragedy at Navy Yard.,,,,,
381849515956793344,132278386,senatorbarb,Twitter for BlackBerry®,2013-09-22 18:36:33,10,0,RT @SenateApprops: Chairwoman @SenatorBarb will work in Senate next week to keep the gov’t open so it meets day-to-day and long range needs…,,,381846211243696129,352534407,SenateApprops
381849436868997121,132278386,senatorbarb,Twitter for BlackBerry®,2013-09-22 18:36:14,11,0,"RT @SenateApprops: Shutting down the government hurts the middle class -- it threatens our country’s economic growth, jobs and national sec…",,,381844533979275266,352534407,SenateApprops
381844395252666368,132278386,senatorbarb,Twitter for BlackBerry®,2013-09-22 18:16:12,13,0,RT @SenateApprops: House CR puts political ideology ahead of country. They want to shut down the govt b/c we won’t take away people’s healt…,,,381834617478983680,352534407,SenateApprops
381780975497519104,132278386,senatorbarb,Twitter for iPhone,2013-09-22 14:04:12,4,0,"RT @SenateApprops: ICYMI: ""We must end sequester"" @SenatorBarb. FBI agents will face furloughs of ten days if we don’t #fixsequester @FBIPr…",,,381779959532232704,352534407,SenateApprops
381548139368710144,132278386,senatorbarb,Twitter for iPhone,2013-09-21 22:38:59,11,0,"RT @SenateApprops: ""We must end sequester"" @SenatorBarb. 1.3 million fewer students will be served by Title I next year if we don't #fixseq…",,,381538546320179200,352534407,SenateApprops
381531669859434496,132278386,senatorbarb,Twitter for iPhone,2013-09-21 21:33:33,8,0,"RT @SenateApprops: ""We must end sequester"" @SenatorBarb. @HeadStartgov would serve 177,000 fewer children next year if we don’t #fixseqeust…",,,381523584881291264,352534407,SenateApprops
381523685875933184,132278386,senatorbarb,Twitter for iPhone,2013-09-21 21:01:49,8,0,RT @SenateApprops: Support for transit systems around the country would be underfunded by $134 million next year if we don’t #fixseqeuster …,,,381508490759770112,352534407,SenateApprops
381497340739473408,132278386,senatorbarb,Twitter for iPhone,2013-09-21 19:17:08,6,0,"RT @SenateApprops: ""We must end sequester"" @SenatorBarb. Critical work on our nation’s bridges would be cut by $500 million next year if we…",,,381493628474261504,352534407,SenateApprops
381491723790471168,132278386,senatorbarb,Twitter for iPhone,2013-09-21 18:54:49,3,0,"RT @SenateApprops: ""We must end sequester"" @SenatorBarb. Repairs to highways would face a $636 million shortfall next year if we don’t #fix…",,,381478687943958528,352534407,SenateApprops
381463962770239488,132278386,senatorbarb,Twitter for iPhone,2013-09-21 17:04:30,9,0,"RT @SenateApprops: As many as 500,000 fewer infants, children &amp; women would receive nutrition support if we don’t #fixseqeuster @SenatorBarb",,,381462931445411840,352534407,SenateApprops
381454603323449344,132278386,senatorbarb,Twitter for iPhone,2013-09-21 16:27:19,7,0,"RT @SenateApprops: ""We must end sequester"" @SenatorBarb. @NSF would provide 1,500 fewer grants to keep America first in science if we don’t…",,,381447811637968896,352534407,SenateApprops
381434078790438912,132278386,senatorbarb,Twitter for iPhone,2013-09-21 15:05:45,10,0,"RT @SenateApprops: ""We must end sequester"" @SenatorBarb. @NIH would receive $2 billion less for research--meaning 1,300 fewer grants if we …",,,381432679268618241,352534407,SenateApprops
381421570532470784,132278386,senatorbarb,Twitter for BlackBerry®,2013-09-21 14:16:03,9,0,RT @SenateApprops: FBI agents will face furloughs of ten days if we don’t #fixsequester @FBIPressOffice,,,381417772074299392,352534407,SenateApprops
381420563895689216,132278386,senatorbarb,Twitter for iPhone,2013-09-21 14:12:03,2,1,"On Senate floor, I spoke with a heavy heart for victims of Navy Yard tragedy – including 6 Marylanders killed http://t.co/PiTa78rDRK",,,,,
381179136527855616,132278386,senatorbarb,Twitter for iPhone,2013-09-20 22:12:42,3,0,"My thoughts &amp; prayers are will the victims, their families &amp; all those affected by this terrible, senseless act.",,,,,
381179059398782976,132278386,senatorbarb,Twitter for iPhone,2013-09-20 22:12:24,10,4,"On Sunday I’ll join Pres Obama, Navy community &amp; affected families at a memorial for victims of Navy Yard tragedy.",,,,,
381084159810498560,132278386,senatorbarb,Twitter for iPhone,2013-09-20 15:55:18,6,0,"RT @SenateApprops: “Today’s action by the House is a defeat for our economy, jobs, &amp; our national security."" @SenatorBarb on House CR http:…",,,381081318915702785,352534407,SenateApprops
380826927965036544,132278386,senatorbarb,Twitter for iPhone,2013-09-19 22:53:09,13,5,I’m proud to stand w @AmeriCorps volunteers to applaud service &amp; kick off next 20 yrs of supporting communities! http://t.co/ehjgier7Lj,,,,,
380826749229342721,132278386,senatorbarb,Twitter for iPhone,2013-09-19 22:52:27,5,5,"I fought to establish AmeriCorps, have worked to strengthen it &amp; expand opportunities because I believe in neighbor helping neighbor",,,,,
380826523928117249,132278386,senatorbarb,Twitter for iPhone,2013-09-19 22:51:33,3,0,"Volunteers mentor children, support vets, promote health, respond to disasters &amp; increase economic opportunities",,,,,
380826352641122304,132278386,senatorbarb,Twitter for iPhone,2013-09-19 22:50:52,7,2,Over 800K @AmeriCorps volunteers have served more than 1 billion hrs of community service in past 20 yrs,,,,,
380826247917735936,132278386,senatorbarb,Twitter for iPhone,2013-09-19 22:50:27,25,3,Congrats to @AmeriCorps &amp; @NationalService on 20 years of serving families &amp; communities across America! #AmeriCorps20,,,,,
380819029579288576,132278386,senatorbarb,Twitter for iPhone,2013-09-19 22:21:46,43,9,I believe in America no one should have to choose between paying rent &amp; putting food on the table,,,,,
380818870518693888,132278386,senatorbarb,Twitter for iPhone,2013-09-19 22:21:08,28,8,"Deeply disappointed by House GOP vote to slash crucial nutrition assistance for children, families &amp; seniors who need it most.",,,,,
380352825273745408,132278386,senatorbarb,Twitter for BlackBerry®,2013-09-18 15:29:14,14,4,Great day at Spaceport Wallops! Launching cargo to the Space Station and jobs on the Eastern Shore http://t.co/8fyycm5VUA,,,,,
380352538219773952,132278386,senatorbarb,Twitter for BlackBerry®,2013-09-18 15:28:06,4,4,Great day at Spaceport Wallops! Launching cargo to the Space Station and jobs on the Eastern Shore http://t.co/NmzZIGcU0S,,,,,
380329781260062720,132278386,senatorbarb,Twitter for BlackBerry®,2013-09-18 13:57:40,3,3,"Great having support: @SavetheChildren, @AmerAcadPeds &amp; @Easter_Seals for bill making critical reforms to child care! http://t.co/0OZJaub6Dd",,,,,
380329244464648192,132278386,senatorbarb,Twitter for BlackBerry®,2013-09-18 13:55:32,6,2,"As a social worker, I know importance of quality child care for kids &amp; families.  ",,,,,
380327102270029824,132278386,senatorbarb,Twitter for BlackBerry®,2013-09-18 13:47:01,5,2,"Every working parent with children worries about child care that’s affordable, accessible &amp; safe",,,,,
380326934070042625,132278386,senatorbarb,Twitter for BlackBerry®,2013-09-18 13:46:21,2,0,"This morning headed to HELP Cmt markup of bipartisan CCDBG bill I intro’d to revitalize, refresh &amp; reform child care",,,,,
380018441413210113,132278386,senatorbarb,Twitter for iPhone,2013-09-17 17:20:31,7,0,RT @RmazeTns: Tough words from @SenatorBarb about VA's Baltimore claims office after @AmericanLegion complaint http://t.co/3GhAWQr1cr,,,379980919605436416,577690047,RmazeTns
380018269631295488,132278386,senatorbarb,Twitter for iPhone,2013-09-17 17:19:50,13,0,"RT @AmericanLegion: ,@SenatorBarb demands @DeptVetAffairs fix Baltimore #claims office following Legion testimony to @HouseVetAffairs. http…",,,379981644536377344,27048645,AmericanLegion
379728555397361664,132278386,senatorbarb,Twitter for iPhone,2013-09-16 22:08:37,2,1,Announced Ft Meade as partner in Healthy Base Initiative serving as model healthy base worthy of military families http://t.co/oshsbdlbek,,,,,
379728336278523904,132278386,senatorbarb,Twitter for iPhone,2013-09-16 22:07:45,3,0,New Wellness Center will help our military &amp; their families  be fit for duty as best fighting force &amp; best family support they can be.,,,,,
379728227063058433,132278386,senatorbarb,Twitter for iPhone,2013-09-16 22:07:19,5,0,Today at Fort Meade helped cut ribbon on new state of the art Army Wellness Center http://t.co/NDTOpvru7R,,,,,
379668317625393152,132278386,senatorbarb,Twitter for BlackBerry®,2013-09-16 18:09:15,13,3,"My thoughts are with those wounded, killed and impacted at the Navy Yard. My thanks are with the first responders.",,,,,
379668083604205569,132278386,senatorbarb,Twitter for BlackBerry®,2013-09-16 18:08:19,9,1,"Deepest condolences &amp; support for the victims, including law enforcement, of today's Navy Yard shooting.",,,,,
379625784572276736,132278386,senatorbarb,Twitter for BlackBerry®,2013-09-16 15:20:14,2,1,Will announce Ft Meade partnership in Healthy Base Initiative. Fought for designation so Ft Meade leads making healthy living an easy choice,,,,,
379624494668603393,132278386,senatorbarb,Twitter for BlackBerry®,2013-09-16 15:15:07,3,0,"Will provide men &amp; women in uniform, civilians &amp; their families w/ access to health services to build &amp; maintain healthy lives.",,,,,
379620972443074560,132278386,senatorbarb,Twitter for BlackBerry®,2013-09-16 15:01:07,1,0,At Ft Meade this AM to cut ribbon at new Army Wellness Center,,,,,
378581236874104832,132278386,senatorbarb,Twitter for BlackBerry®,2013-09-13 18:09:35,6,1,I'll be cheering Ravens on to victory as Super Bowl champs return to the field in Baltimore to take down Browns on Sunday! #PurpleFriday,,,,,
377920405228752896,132278386,senatorbarb,Twitter for iPhone,2013-09-11 22:23:40,6,3,The children of Birmingham made history &amp; changed history &amp; that dream shall never die.,,,,,
377920181714288640,132278386,senatorbarb,Twitter for iPhone,2013-09-11 22:22:47,2,1,"Inspired to meet w Dianne Braddock of Laurel, MD sister of Carole Robertson who told me about that tragic day http://t.co/D7mxdmkftL",,,,,
377919892760305664,132278386,senatorbarb,Twitter for iPhone,2013-09-11 22:21:38,13,6,"No child in America should be redlined or sidelined or defined by their race, gender, religion or creed http://t.co/8F691uFLJQ",,,,,
377919704578686976,132278386,senatorbarb,Twitter for iPhone,2013-09-11 22:20:53,2,0,The dreams of those 4 little girls who were victims of 16th St Baptist Church bombing should not be defied.,,,,,
377919591068237824,132278386,senatorbarb,Twitter for iPhone,2013-09-11 22:20:26,5,3,"So proud to award Congressional Gold Medal to honor the lives &amp; legacies of Addie Mae, Denise, Carole &amp; Cynthia http://t.co/3TaZ13PTlT",,,,,
377850677994999809,132278386,senatorbarb,Twitter for iPhone,2013-09-11 17:46:36,6,2,We’ll never forget those suddenly &amp; sadly taken from us &amp; heroic 1st responders. Today we honor their courage &amp; sacrifice,,,,,
377850241502175232,132278386,senatorbarb,Twitter for iPhone,2013-09-11 17:44:52,7,1,My heart goes out to the 68 Maryland families &amp; all who lost loved ones that day. They’re not alone in their grief.,,,,,
377850032315461632,132278386,senatorbarb,Twitter for iPhone,2013-09-11 17:44:02,6,2,Today gathered w bipartisan members of US Senate &amp; House to commemorate those tragically lost on 9/11/2001. http://t.co/8L5I4Bq8TM,,,,,
377545061577531392,132278386,senatorbarb,Twitter for iPhone,2013-09-10 21:32:11,8,2,"Life science jobs are life blood of MD’s economy, speeding development of treatments &amp; cures keeping families healthy.",,,,,
377544942538993664,132278386,senatorbarb,Twitter for iPhone,2013-09-10 21:31:43,5,1,"Today announced funds in federal checkbook 2 promote healthcare research, innovation &amp; jobs in Baltimore &amp; Montgomery http://t.co/Mp2eh0F3xr",,,,,
377496279624212480,132278386,senatorbarb,Twitter for iPhone,2013-09-10 18:18:21,6,1,Proud to cosponsor resolution honoring lives &amp; legacies of 4 African American girls killed in turning point of civil rights movement,,,,,
377495958860599296,132278386,senatorbarb,Twitter for iPhone,2013-09-10 18:17:04,20,2,At 3pm today will help honor victims of 1963 Birmingham bombings w Congressional Gold Medal. Watch LIVE: http://t.co/kVAQNcF9Be,,,,,
377474546879975424,132278386,senatorbarb,Twitter for iPhone,2013-09-10 16:51:59,13,6,"As a social worker, I’ve seen firsthand how Head Start can make all the difference in the world in life of a child.",,,,,
377474418114842624,132278386,senatorbarb,Twitter for iPhone,2013-09-10 16:51:29,7,2,"Great news that new head start center in Cumberland cut ribbon this week, serving 47 children http://t.co/XBJzxwLpuE",,,,,
377208672520523776,132278386,senatorbarb,Twitter for iPhone,2013-09-09 23:15:30,2,4,"As daughter of small business owner, I know how important they are to create jobs by hiring local workers &amp; investing in communities",,,,,
377208519399067648,132278386,senatorbarb,Twitter for iPhone,2013-09-09 23:14:53,5,2,Great to meet w minority owned small business leaders &amp; President’s Roundtable today in Baltimore http://t.co/sJMGvFkSgP,,,,,
377154203145502720,132278386,senatorbarb,Twitter for iPhone,2013-09-09 19:39:03,3,0,RT @portofbalt: @SenatorBarb and @SenatorCardin also spoke today. Both MD senators really understand what the PoB means! http://t.co/RW0iAO…,,,377135288641802240,208668757,portofbalt
377115180942893057,132278386,senatorbarb,Twitter for BlackBerry®,2013-09-09 17:04:00,3,6,we fight so hard because we believe in jobs and we believe that the Port has built this city and built our economy,,,,,
377114776494559232,132278386,senatorbarb,Twitter for BlackBerry®,2013-09-09 17:02:23,2,1,Delegation fought over the years to put funds in federal checkbook for everything from annual dredging to deeping channels to Port security,,,,,
377113506245382144,132278386,senatorbarb,Twitter for BlackBerry®,2013-09-09 16:57:20,2,2,Md's Congressional delegation is no Johnny or Janey come lately when it comes to fighting for the Port-we answered call of “Dredge or Die!”,,,,,
377094030128975874,132278386,senatorbarb,Twitter for BlackBerry®,2013-09-09 15:39:57,4,3,Headed to Port of Baltimore w @VP Biden &amp; Team MD to announce $10 million in fed funds to increase Port capacity &amp; support jobs.,,,,,
376773976841658368,132278386,senatorbarb,Twitter for iPhone,2013-09-08 18:28:10,2,0,Good cheer to Mount Calvary AME Church in Towson on 124th homecoming anniversary,,,,,
376773247032782849,132278386,senatorbarb,Twitter for iPhone,2013-09-08 18:25:16,4,0,Congrats to St. Peter Claver Catholic Church celebrating 125th anniversary mass in Baltimore City,,,,,
376011304294965248,132278386,senatorbarb,Twitter for iPhone,2013-09-06 15:57:35,3,4,Launch @ 11:27pm. Watch blaze from #Minotaur V rocket - visible for hundreds of miles! http://t.co/2X2HLvX0Q5,,,,,
376011089777295360,132278386,senatorbarb,Twitter for iPhone,2013-09-06 15:56:44,7,4,Over the moon for @NASA_Wallops launch of @NASALADEE on mission to study the moon up close,,,,,
375386283000205312,132278386,senatorbarb,Twitter for iPhone,2013-09-04 22:33:58,10,6,"Shanah Tovah to all celebrating Rosh Hashanah tonight! Here's to a happy, healthy new year",,,,,
375372652372062208,132278386,senatorbarb,Twitter for iPhone,2013-09-04 21:39:49,5,1,Thanks Lori for great Eastern Shore photo! MT @lomartin33 Here's a beautiful sunrise pic I took today in Ocean City! http://t.co/sFVxYhwcIK,,,,,
375344257344995329,132278386,senatorbarb,Twitter for iPhone,2013-09-04 19:46:59,4,4,MD can count on me to keep fighting for our state's fair share supporting jobs &amp; communities. http://t.co/LqCATB0Ru8,,,,,
375343392328519680,132278386,senatorbarb,Twitter for iPhone,2013-09-04 19:43:32,4,3,"Fought hard for federal investments in long overdue improvements to MD highways, byways &amp; transit systems.",,,,,
375343081010528256,132278386,senatorbarb,Twitter for iPhone,2013-09-04 19:42:18,9,0,"RT @GovernorOMalley: Our transportation investments in the Baltimore region will support 13,000+ jobs, reduce traffic and revitalize commun…",,,375332645204664320,15824288,GovernorOMalley
375342962500448257,132278386,senatorbarb,Twitter for iPhone,2013-09-04 19:41:50,4,0,Reliable &amp; well maintained infrastructure lays groundwork for our future &amp; is vital to create jobs today &amp; jobs tomorrow.,,,,,
375331382261989376,132278386,senatorbarb,Twitter for iPhone,2013-09-04 18:55:49,5,0,Look forward to working together for jobs &amp; working families w MDer @USDOL @LaborSec Tom Perez sworn in today by @VP,,,,,
375271213771542528,132278386,senatorbarb,Twitter for iPhone,2013-09-04 14:56:44,5,0,Must end sequester &amp; devastating impact to #NIH research into new treatments &amp; cures for dreaded diseases.  http://t.co/be9wYEN8UL,,,,,
375270661465587712,132278386,senatorbarb,Twitter for iPhone,2013-09-04 14:54:32,7,1,Must make smart investments in research to end Alzheimer's once &amp; for all! #AgeofAlz,,,,,
375270431147958273,132278386,senatorbarb,Twitter for iPhone,2013-09-04 14:53:37,5,2,"Thanks @mariashriver for efforts to end scourge of Alzheimer's, affecting over 5 million seniors &amp; costing US $200 billion in 2013 #AgeofAlz",,,,,
374743183847993344,132278386,senatorbarb,Twitter for BlackBerry®,2013-09-03 03:58:32,31,15,Congrats to diana nyad- another woman who swam thru the sharks n made it - find away,,,,,
374614836396568576,132278386,senatorbarb,Twitter for BlackBerry®,2013-09-02 19:28:31,7,3,Labor day.  A day to committ to helping create more jobs- wish the. Rs  supported Senate.  TransP. bill which=infrastructure. Jobs,,,,,
373784095496499200,132278386,senatorbarb,Twitter for BlackBerry®,2013-08-31 12:27:27,8,4,Sad Day-Officer Schneider-killed in line of duty/Laid to Rest Today/ A Cops Cop/ beloved by many/ appreciated. all for his service,,,,,
373109373381267457,132278386,senatorbarb,Twitter Web Client,2013-08-29 15:46:21,5,1,"Funds in federal checkbook will reduce Baltimore DNA crime backlog, help solve &amp; prosecute crime &amp; keep families safe http://t.co/HSks8fpdwF",,,,,
373109149090840576,132278386,senatorbarb,Twitter Web Client,2013-08-29 15:45:27,2,2,Maryland’s state &amp; local law enforcement work around the clock to protect community safety.,,,,,
372747007556730880,132278386,senatorbarb,Twitter Web Client,2013-08-28 15:46:26,8,1,"Just as we marched them, must march today to end injustice, break down barriers &amp; restore voters rights. #MarchonWashington",,,,,
372745869994377216,132278386,senatorbarb,Twitter Web Client,2013-08-28 15:41:55,8,3,I remember march 50 yrs ago. Was getting ready to go back to school. Social workers across Baltimore helped marchers coming from NY &amp; Penn.,,,,,
372734659479601152,132278386,senatorbarb,Twitter Web Client,2013-08-28 14:57:22,12,2,Today Americans across the nation come together to renew the dream of Dr. King &amp; the fight for equality. #MarchonWashington #MOW50,,,,,
372109400082632704,132278386,senatorbarb,Twitter for BlackBerry®,2013-08-26 21:32:49,2,2,Hey Ben- iwent to City College for Summer Sch for Geometry.    Can I b. An. Alum Too ????,,,,,
372108360310456320,132278386,senatorbarb,Twitter for BlackBerry®,2013-08-26 21:28:41,12,3,The Rs want to defund obamacare - does that mean they want to bring bk prohibiting pre existing coonditions,,,,,
372107319242285057,132278386,senatorbarb,Twitter for BlackBerry®,2013-08-26 21:24:32,18,7,As. School year begins. Let our teachers. Know we support. Them - we count on them 2 make sure our kids learn-,,,,,
371997299565527040,132278386,senatorbarb,Twitter Web Client,2013-08-26 14:07:22,12,3,Good luck for a great school year. Thanks to teachers &amp; parents for all you do to prepare students today for jobs tomorrow.,,,,,
371997220033146881,132278386,senatorbarb,Twitter Web Client,2013-08-26 14:07:03,5,2,"Welcome back students in Baltimore, Montgomery, Anne Arundel, Charles, Garrett &amp; all across Maryland! #BacktoSchool",,,,,
370916086952124416,132278386,senatorbarb,Twitter Web Client,2013-08-23 14:31:01,10,2,"Voting Rights Act threatened by Supreme Court decision, leaving Americans vulnerable to prejudice &amp; intimidation",,,,,
370916049392123904,132278386,senatorbarb,Twitter Web Client,2013-08-23 14:30:52,10,2,"Have accomplished so much, but still have so far to go. The fight for civil rights is far from over.",,,,,
370915435161452544,132278386,senatorbarb,Twitter Web Client,2013-08-23 14:28:25,6,2,"We’ve made much progress towards equality – passed Lily Ledbetter Fair Pay, repealed DOMA &amp; Don’t Ask Don’t Tell.",,,,,
370914660855197697,132278386,senatorbarb,Twitter Web Client,2013-08-23 14:25:21,8,3,"Fifty years ago, Americans came to nation’s capital to march for jobs, for justice, for the economy &amp; for freedom.",,,,,
370914466281435136,132278386,senatorbarb,Twitter Web Client,2013-08-23 14:24:34,6,1,"In coming days, Americans will come together to commemorate 50th anniversary of historic March on Washington.",,,,,
370589298648563712,132278386,senatorbarb,Twitter Web Client,2013-08-22 16:52:28,16,4,MD students can now apply for 2014 US Senate Youth Program.  Prepares future leaders by seeing gov’t in action. http://t.co/dG2KWNl1wJ,,,,,
370266891287150592,132278386,senatorbarb,Twitter Web Client,2013-08-21 19:31:20,1,1,"Here’s to a good first day of school in St. Mary’s Co and for great year for students, teachers &amp; parents.",,,,,
369559203909619712,132278386,senatorbarb,Twitter Web Client,2013-08-19 20:39:14,6,0,"RT @CommerceSec: Congrats to Talbot County, MD on receiving an #EDA grant toward a new medical center. Great points by @SenatorBarb: http:/…",,,369502767699595265,308573576,CommerceSec
369527485806821378,132278386,senatorbarb,Twitter Web Client,2013-08-19 18:33:12,0,1,I look forward to @NTSB’s recs to ensure Bay Bridge is safest it can possibly be for everyone. http://t.co/P9Kd8sI6Tp,,,,,
369527352734146560,132278386,senatorbarb,Twitter Web Client,2013-08-19 18:32:41,3,1,No matter your destination – families traveling to Eastern Shore vacations or daily commuting – everyone should feel safe on the bridge.,,,,,
369527104804642817,132278386,senatorbarb,Twitter Web Client,2013-08-19 18:31:41,3,0,I asked @NTSB to investigate after hearing concerns of many Marylanders who cross the Bay Bridge. http://t.co/46NEMvJjMh,,,,,
369526867327340544,132278386,senatorbarb,Twitter Web Client,2013-08-19 18:30:45,3,0,I appreciate @NTSB update of facts from horrific July crash on MD’s Bay Bridge &amp; applaud commitment to get to the bottom of it.,,,,,
