id,user_id,screen_name,source,created_at,retweet_count,favorite_count,text,in_reply_to_screen_name,in_reply_to_status_id,retweeted_status_id,retweeted_status_user_id,retweeted_status_screen_name
288988549318070272,132278386,senatorbarb,Twitter for BlackBerry®,2013-01-09 12:40:13,4,1,Today looking forward to speaking at opening of this session of Md General Assembly on behalf of Md's Congressional Delegation #MDSession,,,,,
288102672018579457,132278386,senatorbarb,Twitter for BlackBerry®,2013-01-07 02:00:04,15,3,GR8 Game.   Loved The Fun Run by Ray -     now the Ravens. Fly. High. In the Mile. High City Denver.,,,,,
287277375102791681,132278386,senatorbarb,Twitter Web Client,2013-01-04 19:20:38,14,3,Glad to be joined by historic number of Senate women in 113th Congress for discussion w/ @DianeSawyer. WATCH: http://t.co/Cj3U93ej,,,,,
286984613946093568,132278386,senatorbarb,Twitter Web Client,2013-01-03 23:57:18,12,5,Wonderful being with Senate women of the 113th Congress with @DianeSawyer. Thanks #ABCWorldNews,,,,,
286984141000552449,132278386,senatorbarb,Twitter Web Client,2013-01-03 23:55:25,2,0,.@SenatorCardin @rickklein Thanks!,SenatorCardin,286981533997342720,,,
286979642089410562,132278386,senatorbarb,Twitter Web Client,2013-01-03 23:37:33,6,4,ABC News did a nice page on the advice women Senators would give to boys and girls: http://t.co/VOjXVa84,,,,,
286977712579571712,132278386,senatorbarb,Twitter Web Client,2013-01-03 23:29:53,4,1,Today led Team MD in announcing FEMA approval of public assistance for Baltimore Co recovering from Super-Storm Sandy http://t.co/KHO1umBX,,,,,
286977267777818624,132278386,senatorbarb,Twitter Web Client,2013-01-03 23:28:07,2,0,.@SenShelbyPress Looking forward to working with you on @SenateApprops too!,SenShelby,286968588831694848,,,
286953013946511360,132278386,senatorbarb,Twitter Web Client,2013-01-03 21:51:44,10,1,"Need more frugal gov, but not one that hangs us out to dry. These civil servants deserve gov on their side &amp; I’ll continue to fight for them",,,,,
286952798665461762,132278386,senatorbarb,Twitter Web Client,2013-01-03 21:50:53,2,1,"This is good news for jobs in PG Co, for MD and for the duty driven civil servants at the Hyattsville FMS facility. http://t.co/KHO1umBX",,,,,
286952625855922176,132278386,senatorbarb,Twitter Web Client,2013-01-03 21:50:11,8,0,"Thanks to efforts of Team MD, proud to announce Treasury &amp; GSA have delayed their plan to move 450 jobs out of PG County until 2019.",,,,,
286937473429422080,132278386,senatorbarb,Twitter Web Client,2013-01-03 20:49:59,28,0,RT @SenatorHarkin: Thx @SenatorBarb for joining me in supporting #filibusterreform &amp; sending an important msg this 1st day of the 11 ...,,,286936493983940608,115733549,SenatorHarkin
286881056236388353,132278386,senatorbarb,Twitter Web Client,2013-01-03 17:05:48,14,4,Glad to escort my friend &amp; colleague @SenatorCardin to be sworn in by @VP to continue representing MD in US Senate.,,,,,
286852839584698368,132278386,senatorbarb,Twitter Web Client,2013-01-03 15:13:41,208,0,"RT @DianeSawyer: I sat down with the historic class of 20 female senators -the tough, lively, surprising intvw tonight on @ABCWorldNews  ...",,,286851722419269632,282735852,DianeSawyer
286610348742701056,132278386,senatorbarb,Twitter Web Client,2013-01-02 23:10:07,6,4,ABC News / Martin Simon shared a great photo of our interview with @DianeSawyer -- http://t.co/LaigqemA,,,,,
286609956004827136,132278386,senatorbarb,Twitter Web Client,2013-01-02 23:08:33,5,1,Clips of the @DianeSawyer and women of the Senate interview begin airing Thursday morning during Good Morning America,,,,,
286609465883627521,132278386,senatorbarb,Twitter Web Client,2013-01-02 23:06:36,11,2,Tomorrow night - be sure to tune in to ABC World News Tonight to see @DianeSawyer interview with the Senate Women of the 113th Congress,,,,,
286519770029907968,132278386,senatorbarb,Twitter Web Client,2013-01-02 17:10:11,6,0,RT @SenateApprops: Chairwoman Mikulski (@SenatorBarb) Statement on House Inaction on Disaster Assistance Supplemental  http://t.co/Y01pO ...,,,286519532355457026,352534407,SenateApprops
286519259826360320,132278386,senatorbarb,Twitter Web Client,2013-01-02 17:08:09,10,6,I am committed to helping communities hit hard by #Sandy &amp; will make enacting a supplemental bill an urgent priority in new Congress.,,,,,
286519186769973248,132278386,senatorbarb,Twitter Web Client,2013-01-02 17:07:52,3,2,"It is long past time communities in MD, NY, NJ &amp; across nation get resources &amp; support they need from their federal government.",,,,,
286519017093623808,132278386,senatorbarb,Twitter Web Client,2013-01-02 17:07:11,30,7,"As Chairwoman of @SenateApprops, I’m deeply disappointed House failed 2 act on emergency relief from Super-Storm #Sandy http://t.co/D2xQTYA6",,,,,
286123155448287232,132278386,senatorbarb,Twitter for BlackBerry®,2013-01-01 14:54:10,24,8,Wishing all a safe and happy new year - especially our troops serving overseas and their families here at home,,,,,
285820496132587520,132278386,senatorbarb,Twitter Web Client,2012-12-31 18:51:31,8,1,Will discuss fiscal cliff on Senate floor @ 2 p.m. -- Watch live on CSPAN 2,,,,,
284811842067496960,132278386,senatorbarb,Twitter Web Client,2012-12-29 00:03:29,11,0,But clock is ticking-been two months since Sandy hit. Businesses need restarting. Homes need rebuilding. Now up to House to pass bill ASAP,,,,,
284811335961821184,132278386,senatorbarb,Twitter Web Client,2012-12-29 00:01:28,4,2,"Shows that in America, we are all in this together – that when one community is hit by a disaster, all communities are hit.",,,,,
284811304357744640,132278386,senatorbarb,Twitter Web Client,2012-12-29 00:01:21,2,1,Critical legislation provides well-tailored resources to those hit hardest by Sandy.,,,,,
284810530688999424,132278386,senatorbarb,Twitter Web Client,2012-12-28 23:58:16,15,1,"Senate just passed the Superstorm Sandy Emergency Supplemental Appropriations Bill in strong, bipartisan vote",,,,,
284724180283449344,132278386,senatorbarb,Twitter Web Client,2012-12-28 18:15:09,10,2,American families already are stretched and strained. Why should they pay $7 for milk because House won’t act,,,,,
284723998208708612,132278386,senatorbarb,Twitter Web Client,2012-12-28 18:14:25,12,2,"House Republicans need to come home in from pasture, get back to Washington, pass the Farm Bill and avoid the dairy cliff",,,,,
284698605074403328,132278386,senatorbarb,Twitter Web Client,2012-12-28 16:33:31,10,0,Dock workers and Port able to come together to avoid a strike – need Congress to do same thing and avoid fiscal cliff,,,,,
284698545771143169,132278386,senatorbarb,Twitter Web Client,2012-12-28 16:33:17,7,1,"Good news for families, jobs and economy– Port strike averted with 30 day extension",,,,,
284403585196896256,132278386,senatorbarb,Twitter Web Client,2012-12-27 21:01:13,1,0,Read about it today's Baltimore Sun -- http://t.co/5kD8Xthc,,,,,
284403482264494080,132278386,senatorbarb,Twitter Web Client,2012-12-27 21:00:48,4,0,Already 691 Somerset Co. residents who lost homes/ businesses in #Sandy have applied for help since FEMA okay'd aid 4 individuals last week,,,,,
284401800734445569,132278386,senatorbarb,Twitter Web Client,2012-12-27 20:54:07,4,0,News u can use” links for Somerset Co. residents &amp; biz's still getting back on feet after #sandy: http://t.co/RcINBAFb http://t.co/0tKmLwGt,,,,,
283737955829428224,132278386,senatorbarb,Twitter for BlackBerry®,2012-12-26 00:56:14,10,6,A. Merry n blessed day. To one n all. Mine.was Church - Family n Traditions. Let's each give an act of kindness - big or small. to someone,,,,,
281527037544505344,132278386,senatorbarb,Twitter Web Client,2012-12-19 22:30:50,128,24,It's an honor &amp; privilege to be expected to follow the great leadership of Senator Inouye as Appropriations Committee Chairwoman,,,,,
281424941532979201,132278386,senatorbarb,Twitter Web Client,2012-12-19 15:45:09,4,0,Will discuss MD #Sandy recovery funds on Senate floor @ 10:45 &amp; continue fight 2 get MD communities back on track WATCH http://t.co/IzY3K9hB,,,,,
280809477740060673,132278386,senatorbarb,Twitter Web Client,2012-12-17 22:59:31,16,6,Must also look at issues related to mental health. There’s a pattern of too many that fall between the cracks. These tragedies must end.,,,,,
280809363269111808,132278386,senatorbarb,Twitter Web Client,2012-12-17 22:59:04,79,24,"Weapons of war have no place on our streets, in our schools or in our homes. I’ll work with my colleagues to reinstate assault weapons ban.",,,,,
280809287515783169,132278386,senatorbarb,Twitter Web Client,2012-12-17 22:58:45,7,1,"Today funerals in Newtown begin. Our mourning will go on for a long time, but our work must continue.",,,,,
280680693091160064,132278386,senatorbarb,Twitter Web Client,2012-12-17 14:27:46,1,0,NCCC transforming communities &amp; building new generation of duty driven volunteers. Neighbor helping neighbor,,,,,
280680543610343424,132278386,senatorbarb,Twitter Web Client,2012-12-17 14:27:11,1,0,This morning at ribbon cutting for new AmeriCorps NCCC campus in Baltimore at Sacred Heart school.,,,,,
280492419785560064,132278386,senatorbarb,Twitter for BlackBerry®,2012-12-17 01:59:38,133,22,Absolutely Will.  Support Feinstein Leg on Banning Assault Weapons-  but also so need more mental health help in our communities,,,,,
279700875100946432,132278386,senatorbarb,Twitter Web Client,2012-12-14 21:34:19,115,15,This is a wakeup call. Weapons of war have no place on the streets of America.  It's time for Congress to act.,,,,,
279700676819419136,132278386,senatorbarb,Twitter Web Client,2012-12-14 21:33:32,14,4,Our thoughts and prayers go out to the Newton community as we struggle to cope with such senseless violence.,,,,,
279700526579458048,132278386,senatorbarb,Twitter Web Client,2012-12-14 21:32:56,18,0,Today our nation mourns for those lost and the families that have been shattered by this devastating tragedy.,,,,,
279348310446317569,132278386,senatorbarb,Twitter Web Client,2012-12-13 22:13:21,8,1,"America needs a wakeup call, must get serious about priorities. Not about tax breaks 4 billionaires, it's about jobs! http://t.co/mU6g89db",,,,,
279347972888748033,132278386,senatorbarb,Twitter Web Client,2012-12-13 22:12:01,3,0,Affected Sparrows Point employees should visit http://t.co/vA8weKCk and http://t.co/o1VkkquD for federal benefits info.,,,,,
279347857121751040,132278386,senatorbarb,Twitter Web Client,2012-12-13 22:11:33,2,0,Thanks to men &amp; women at Bethlehem Steel. You built America. You helped save America. I’m going to work to save your safety net benefits.,,,,,
279347517181800448,132278386,senatorbarb,Twitter Web Client,2012-12-13 22:10:12,5,1,"Throughout 20th century, Baltimore’s Bethlehem Steel put people to work building steel for our great iconic projects. They built America.",,,,,
279258943019167745,132278386,senatorbarb,Twitter Web Client,2012-12-13 16:18:15,1,0,Continuing to fight for those affected. Led Team Maryland in supporting Gov’s appeal for individual disaster assistance http://t.co/LRgsI1F0,,,,,
279258839809945600,132278386,senatorbarb,Twitter Web Client,2012-12-13 16:17:50,1,0,Communities in Lower Shore &amp; Western MD recovering from Super Storm #Sandy are in dire situation in need of swift resolution.,,,,,
278244898996625408,132278386,senatorbarb,Twitter Web Client,2012-12-10 21:08:48,6,0,Last year LIHEAP helped 149K MD households stressed &amp; stretched by high energy costs to keep warm during cold winter months.,,,,,
278244836484718595,132278386,senatorbarb,Twitter Web Client,2012-12-10 21:08:33,15,0,I urged President Obama to restore LIHEAP low energy assistance funding to support thousands of MD families. http://t.co/D3fWqM0e,,,,,
278244735586537473,132278386,senatorbarb,Twitter Web Client,2012-12-10 21:08:09,26,7,"In America, no family should be forced to choose between paying their heating bill &amp; putting food on the table.",,,,,
276440040584925185,132278386,senatorbarb,Twitter Web Client,2012-12-05 21:36:56,5,2,Seniors &amp; families who’ve earned these benefits shouldn’t be forced over the fiscal cliff themselves!,,,,,
276440022633287680,132278386,senatorbarb,Twitter Web Client,2012-12-05 21:36:52,5,1,Today met w/ leaders of @AARPmaryland to say I’m fighting to protect Social Security &amp; Medicare from fiscal cliff. http://t.co/e9HZ0MZR,,,,,
276340589551816705,132278386,senatorbarb,Twitter for iPhone,2012-12-05 15:01:45,2,0,Watch my remarks at #Sandy hearing at 10am LIVE at http://t.co/MfnnuzhR,,,,,
276340392151097344,132278386,senatorbarb,Twitter for iPhone,2012-12-05 15:00:58,0,0,I'll be questioning FEMA &amp; HUD directors on everything they're doing to support communities hit hardest by #Sandy.,,,,,
276340093390823424,132278386,senatorbarb,Twitter for iPhone,2012-12-05 14:59:47,4,0,At Senate hearing on #Sandy will call for immediate action on assistance for MDers still recovering.,,,,,
276330525252259841,132278386,senatorbarb,Twitter for BlackBerry®,2012-12-05 14:21:45,7,0,Am. Heading to Fema hearing to fight for help for the lower shore.        Devastated by Sandy.   Denied help by their govt.   Not right.,,,,,
276067069718573056,132278386,senatorbarb,Twitter Web Client,2012-12-04 20:54:53,4,1,For 3 yrs Alan Gross has been imprisoned in Cuba on bogus charges &amp; sham trial. Time 2 come home to Md &amp; his family http://t.co/RDd2e5oZ,,,,,
276066351666323456,132278386,senatorbarb,Twitter Web Client,2012-12-04 20:52:01,0,0,"Mr. Castro, let Alan Gross go! Let him go today. Let him go now! http://t.co/TtIALrk5",,,,,
276035373002547200,132278386,senatorbarb,Twitter Web Client,2012-12-04 18:48:56,5,2,I’ve introduced amndt to #NDAA w @SenatorCardin &amp; @SenatorKirk to prevent Navy plan w/out Congressional approval. http://t.co/7DJpDjdp,,,,,
276035125802852352,132278386,senatorbarb,Twitter Web Client,2012-12-04 18:47:57,2,0,Navy plan to move aircraft squadron VAQ-209 from Maryland would mean lost jobs and lost defense in our Nation’s Capital Region.,,,,,
275742452370001920,132278386,senatorbarb,Twitter Web Client,2012-12-03 23:24:58,3,0,MD deserves to have highly qualified judges who will uphold the law &amp; provide equal justice for all. We have that in Judge Grimm.,,,,,
275742392907362304,132278386,senatorbarb,Twitter Web Client,2012-12-03 23:24:44,7,0,Pleased Senate voted overwhelmingly 92-1 to confirm Judge Paul Grimm to US District Court in MD. http://t.co/AE66fzZ8,,,,,
275725091537555457,132278386,senatorbarb,Twitter Web Client,2012-12-03 22:15:59,1,0,Headed to Senate floor at 5:15 to speak on nomination of Judge Paul Grimm to US District Court in MD. WATCH live: http://t.co/IzY3K9hB,,,,,
275723379456241664,132278386,senatorbarb,Twitter Web Client,2012-12-03 22:09:11,2,0,It’s time for him to be immediately and unconditionally released so he can come home to Maryland  his family.,,,,,
275723344375078912,132278386,senatorbarb,Twitter Web Client,2012-12-03 22:09:02,3,1,It’s been 3 yrs since Alan Gross has been wrongfully imprisoned in Cuba after bogus charges &amp; sham trial.,,,,,
275685438818238464,132278386,senatorbarb,Twitter Web Client,2012-12-03 19:38:26,4,0,Visiting w Tom Marquardt @CapGazNews 2 thank him for 35 yrs as journalist &amp; thought leader for MD &amp; Annapolis community http://t.co/v1rwWZku,,,,,
275316628852453377,132278386,senatorbarb,Twitter for BlackBerry®,2012-12-02 19:12:54,6,3,Watch them. Ravens. Fly. High today--   all the way to the.  Playoffs.   Go Go Ravens!!!!,,,,,
274644368093224960,132278386,senatorbarb,Twitter Web Client,2012-11-30 22:41:34,2,0,Leading Team MD in supporting updated request 4 individual disaster assistance 4 Lower Shore hurt by Super Storm Sandy. http://t.co/VpxozMGl,,,,,
274559313534656512,132278386,senatorbarb,Twitter Web Client,2012-11-30 17:03:36,8,2,"Time to put aside differences, come to the table to negotiate in good faith &amp; get the job done.",,,,,
274559239471652865,132278386,senatorbarb,Twitter Web Client,2012-11-30 17:03:18,1,0,We've made serious &amp; significant cuts already including $917B over 10 yrs in Budget Control Act.,,,,,
274552694432210944,132278386,senatorbarb,Twitter Web Client,2012-11-30 16:37:17,5,1,"Need a more frugal gov that will reduce deficit &amp; debt, but only things that caused debt &amp; deficit shld be on the table.",,,,,
274552506732929024,132278386,senatorbarb,Twitter Web Client,2012-11-30 16:36:33,12,2,We've reformed Medicare thru Obamacare - took $500B in guaranteed profits from ins companies extending life of Medicare by 8 yrs.,,,,,
274552202763317248,132278386,senatorbarb,Twitter Web Client,2012-11-30 16:35:20,2,0,"Medicare &amp; Medicaid pay for life-saving health care for elderly, children &amp; families.",,,,,
274536022249975808,132278386,senatorbarb,Twitter Web Client,2012-11-30 15:31:02,7,2,"If you play by the rules &amp; pay your dues, you deserve Social Security benefit that is reliable, undeniable &amp; inflation proof.",,,,,
274535267120066560,132278386,senatorbarb,Twitter Web Client,2012-11-30 15:28:02,15,1,Social Security didn't get us in this mess &amp; shldn't be on the table. We must protect Social Contract between American people &amp; their gov.,,,,,
274534451344715777,132278386,senatorbarb,Twitter Web Client,2012-11-30 15:24:48,10,0,"Families who have earned benefits of Medicare, Medicaid &amp; Social Security shldn't be targeted &amp; forced over their own fiscal cliff.",,,,,
274533789303185408,132278386,senatorbarb,Twitter Web Client,2012-11-30 15:22:10,3,1,"Pieces are in place to prevent fiscal cliff crisis. We've had ideas from all sides, now is time to come together &amp; prevent disaster.",,,,,
274189636434272257,132278386,senatorbarb,Twitter Web Client,2012-11-29 16:34:38,1,0,Disaster Declaration is good news to help MD recover. Continuing push for Individual Assistance for those impacted most http://t.co/oSV6zDqQ,,,,,
274189509820821504,132278386,senatorbarb,Twitter Web Client,2012-11-29 16:34:07,1,1,Sandy’s wrath had a measurable impact on MDers that’s still being felt. I want those affected to know they have a government on their side.,,,,,
274189333957844992,132278386,senatorbarb,Twitter Web Client,2012-11-29 16:33:26,2,1,Here’s my testimony for today’s Senate hearing examining impact of Super-Storm Sandy. http://t.co/hmoIvYpR,,,,,
274161257085554688,132278386,senatorbarb,Twitter Web Client,2012-11-29 14:41:52,2,1,"While he &amp; MD business leaders have strengthened MD STEM edu, I’ve been working on fed STEM investment 2 prepare students 4 innovation jobs.",,,,,
274161194825314306,132278386,senatorbarb,Twitter Web Client,2012-11-29 14:41:37,2,1,On my way to speak @ MD Business Roundtable to honor Jim Pitts for his STEM education leadership in Maryland.,,,,,
273927991120248832,132278386,senatorbarb,Twitter Web Client,2012-11-28 23:14:57,8,1,"To my colleagues from both sides of the aisle, both sides of the Dome and even the White House, let’s get the job done. http://t.co/WwZvo4wv",,,,,
273926458714517505,132278386,senatorbarb,Twitter Web Client,2012-11-28 23:08:51,5,3,"Must put ourselves on a sound fiscal path with the right combination of growth, frugality &amp; ensuring a safety net for most vulnerable.",,,,,
273926242338758657,132278386,senatorbarb,Twitter Web Client,2012-11-28 23:08:00,13,1,We need sense of urgency about solving the fiscal cliff. We need to end culture of delay in this institution.,,,,,
273830029182513152,132278386,senatorbarb,Twitter Web Client,2012-11-28 16:45:41,9,2,Spoke w Portland's @WCSH6 today on @SenatorSnowe's retirement. Will greatly miss my friend &amp; Maine's champion in Senate http://t.co/maUo44Yu,,,,,
273443339494383617,132278386,senatorbarb,Twitter Web Client,2012-11-27 15:09:07,3,1,"The battlefield is real &amp; cyber battleships are being built right here in Md, keeping our country safer &amp; Md’s economy stronger.",,,,,
273443268577095680,132278386,senatorbarb,Twitter Web Client,2012-11-27 15:08:50,5,0,I’ll continue to lead fight in cyber battle so Md is epicenter of cybersecurity in US. We are Ft. Cyber! http://t.co/WcP3Spb4,,,,,
271656970656817153,132278386,senatorbarb,Twitter for BlackBerry®,2012-11-22 16:50:43,14,5,Happy thanksgiving. -  to one n all.    Peace in our hearts -home n the world !!!,,,,,
271291014868779008,132278386,senatorbarb,Twitter Web Client,2012-11-21 16:36:32,2,0,"Public assistance &amp; hazard mitigation is good news, but I will continue to support Gov’s request for individual assistance for Lower Shore.",,,,,
271290965032071169,132278386,senatorbarb,Twitter Web Client,2012-11-21 16:36:21,1,0,"As we prepare to celebrate Thanksgiving, want families &amp; communities struggling to recover to know they have gov on their side.",,,,,
271290891459772416,132278386,senatorbarb,Twitter Web Client,2012-11-21 16:36:03,2,0,Today announced that fed disaster declaration has been signed for MD following Super-Storm Sandy. http://t.co/2NEkOUcb,,,,,
269144219921309696,132278386,senatorbarb,Twitter Web Client,2012-11-15 18:25:57,16,4,So proud of all the women who’ve made history. And now it’s time to change history.,,,,,
269144148370669569,132278386,senatorbarb,Twitter Web Client,2012-11-15 18:25:40,6,2,"But when we gather all of the women together in January for the 113th Congress, we’ll have 20 women serving at one time.",,,,,
269144098131279872,132278386,senatorbarb,Twitter Web Client,2012-11-15 18:25:28,17,6,I was the first Democratic woman elected to the Senate in her own right. The 16th women to serve in the Senate in all of American history,,,,,
269143983454826496,132278386,senatorbarb,Twitter Web Client,2012-11-15 18:25:01,36,10,"Today, Senate women joined me in welcoming newly elected women with my traditional bipartisan Power Workshop. http://t.co/ktIi51R8",,,,,
269099337852784640,132278386,senatorbarb,Twitter Web Client,2012-11-15 15:27:36,2,0,Must get to bottom of what went wrong &amp; make sure we have rules &amp; regs in place so it never happens again.,,,,,
269099297579085824,132278386,senatorbarb,Twitter Web Client,2012-11-15 15:27:26,5,0,At Senate hearing on deadly meningitis outbreak. Will hear from FDA commissioner &amp; MDer Dr. Kasey Thompson of pharmacists assoc.,,,,,
268777981814640640,132278386,senatorbarb,Twitter Web Client,2012-11-14 18:10:39,4,0,"Disaster declaration will mean federal help for MD families, businesses &amp; communities struggling to recover from devastating storm.",,,,,
268777883760222209,132278386,senatorbarb,Twitter Web Client,2012-11-14 18:10:15,5,1,Leading Team Maryland’s support of Gov. O’Malley’s request for disaster declaration for MD following Super-Storm Sandy. http://t.co/0F25ecNn,,,,,
268401499586052096,132278386,senatorbarb,Twitter Web Client,2012-11-13 17:14:38,12,2,Three cheers for #UMUC cyber team taking 2nd place @ int’l cyberlympics! MD leading the way preparing cyber warriors today 4 jobs tomorrow.,,,,,
267699644434362368,132278386,senatorbarb,Twitter for BlackBerry®,2012-11-11 18:45:43,7,0,Happy. Birthday to the. Marine Corp- Always there when the. Country Needs Them. -  Always Semper Fi !!,,,,,
267699114676998146,132278386,senatorbarb,Twitter for BlackBerry®,2012-11-11 18:43:37,16,2,Let's.  Salute the. Vets of. All Wars. N their families. by. Making Sure we. Help them w. Jobs/ Health Care. N Education - They Deserve IT,,,,,
267358293582823430,132278386,senatorbarb,Twitter for BlackBerry®,2012-11-10 20:09:19,4,0,RT @FtMeadeMD: .@SenatorBarb Mikulski presents @USArmy veterans overdue Bronze Star medals http://t.co/VYTJmYaq,,,267335851032334336,20717232,FtMeadeMD
266184395411566592,132278386,senatorbarb,Twitter Web Client,2012-11-07 14:24:39,9,0,RT @SenatorCardin: Breakfast at Jimmy's w/ @SenatorBarb ... Getting back to work early on behalf of Marylanders! #mdpolitics #forward ht ...,,,266174294550269952,109071031,SenatorCardin
265869980799741953,132278386,senatorbarb,Twitter Web Client,2012-11-06 17:35:18,3,0,Met w students at Northwestern High in Baltimore &amp; discussed importance of civic engagement &amp; voting w student reporter http://t.co/s5DbdgtM,,,,,
265550623125151745,132278386,senatorbarb,Twitter Web Client,2012-11-05 20:26:17,1,1,"Thanks for a great visit, Daniel! http://t.co/W94K5uI1",,,,,
265550454652559361,132278386,senatorbarb,Twitter Web Client,2012-11-05 20:25:36,0,0,Brought along a get well soon letter from Mrs. Obama &amp; Bo for Daniel and then made him an honorary Senator!,,,,,
265549232159739904,132278386,senatorbarb,Twitter Web Client,2012-11-05 20:20:45,1,0,So glad to meet w Daniel Borowy &amp; family today and see he's getting better after Perry Hall tragedy. He's a remarkable young man,,,,,
264149269374726144,132278386,senatorbarb,Twitter for BlackBerry®,2012-11-01 23:37:48,4,0,RT @RedCrossMD: Thank you @SenatorBarb for your visit to @RedCrossMD.  http://t.co/f1bpLldx,,,264141433886355456,20722363,RedCrossMD
264012092946907139,132278386,senatorbarb,Twitter for iPhone,2012-11-01 14:32:42,4,0,Visiting @RedCrossMD Superstorm #Sandy hdqrts in Baltimore today to thank everyone working to support disaster response &amp; relief.,,,,,
263730301828755456,132278386,senatorbarb,Twitter for BlackBerry®,2012-10-31 19:52:58,2,0,Whew what a day. Working the phones around the State Chkng on the needs of our communities - squeezed in. Early Voting too,,,,,
263292846625398784,132278386,senatorbarb,Twitter Web Client,2012-10-30 14:54:41,66,0,RT @NOAA: Get up to date local weather information from #NOAA #NWS at  http://t.co/ofG0aGqk click your location on map or enter your ZIP ...,,,263271108671840256,14342564,NOAA
263292746498990080,132278386,senatorbarb,Twitter Web Client,2012-10-30 14:54:17,907,0,"RT @fema: What to do before, during, and after a #hurricane. On the web: http://t.co/sPshqlkH On your phone: http://t.co/xz5hNhXR #Sandy",,,263100040233492480,16669075,fema
