id,user_id,screen_name,source,created_at,retweet_count,favorite_count,text,in_reply_to_screen_name,in_reply_to_status_id,retweeted_status_id,retweeted_status_user_id,retweeted_status_screen_name
626872923928821760,132278386,senatorbarb,Twitter Web Client,2015-07-30 21:52:06,11,14,I'll continue fighting so Medicare is always a guarantee -never privatized or turned into a voucher #KeepingUSHealthy http://t.co/aKmhEwRX2b,,,,,
626871316885413888,132278386,senatorbarb,Twitter Web Client,2015-07-30 21:45:43,4,13,As a young social worker in Baltimore I helped our seniors enroll so they could get the care they desperately needed #KeepingUSHealthy,,,,,
626870576460754944,132278386,senatorbarb,Twitter Web Client,2015-07-30 21:42:46,6,6,"50 yrs ago today, Pres. Johnson signed Medicare legislation into law - ensuring all seniors had access to health care #KeepingUSHealthy",,,,,
626810834316980224,132278386,senatorbarb,Twitter Web Client,2015-07-30 17:45:23,2,0,"RT @SenateApprops: US has grown, investment in our future &amp; services hasn’t. We need a budget deal to end sequester. Must read @Politico ht…",,,626806478670823424,352534407,SenateApprops
626485025559736321,132278386,senatorbarb,Twitter Web Client,2015-07-29 20:10:44,6,4,Here's my column in @MyDelmarvaNow on the importance of protecting Medicare - http://t.co/3kC8klxzfX,,,,,
626484087801413632,132278386,senatorbarb,Twitter Web Client,2015-07-29 20:07:00,2,5,"Today, I marked the 50th Anniversary of Medicare w/ Sec. Burwell by handing out new cards to new Medicare recipients http://t.co/mLxOb8EnJh",,,,,
625799058247032832,132278386,senatorbarb,Twitter Web Client,2015-07-27 22:44:56,2,13,Was cosponsor of original bill 25 years ago. It's been protecting disabled Americans by helping w jobs &amp;  providing access,,,,,
625798763559391232,132278386,senatorbarb,Twitter Web Client,2015-07-27 22:43:46,4,16,Happy 25th anniversary Americans w/ Disabilities Act (ADA)!,,,,,
623611684142338049,132278386,senatorbarb,Twitter Web Client,2015-07-21 21:53:06,2,4,"#WallStReformWorks laid the groundwork for a financial system that helps American families and small businesses, not giving Wall St. bonuses",,,,,
623609639217799168,132278386,senatorbarb,Twitter Web Client,2015-07-21 21:44:58,6,6,"Since we passed sweeping financial reform five years ago, our economy has added nearly 12 million private sector jobs #WallStReformWorks",,,,,
623608303621423104,132278386,senatorbarb,Twitter Web Client,2015-07-21 21:39:40,6,11,"Five years ago, we passed financial reform so taxpayers wouldn't have to bail out banks that make irresponsible decisions #WallStReformWorks",,,,,
623251874934837248,132278386,senatorbarb,Twitter Web Client,2015-07-20 22:03:21,6,5,Metro safety improvement- from now on there will be a regional fire chief in Metro's operations control center. http://t.co/0z3TXXUmjA,,,,,
620996380362964992,132278386,senatorbarb,Twitter Web Client,2015-07-14 16:40:49,16,15,So proud of men &amp; women of @JHUAPL making history w/ #PlutoFlyby this morning. What an amazing team &amp; space craft! http://t.co/NxBmKyEDvM,,,,,
620995342239186944,132278386,senatorbarb,Twitter Web Client,2015-07-14 16:36:41,216,0,RT @JHUAPL: Closest approach. Now. #PlutoFlyby @NASANewHorizons http://t.co/QHVp7NDAik,,,620923287686803456,22032817,JHUAPL
618522892301664257,132278386,senatorbarb,Twitter Web Client,2015-07-07 20:52:03,8,15,I was so honored to be able to present Vietnam vet Michael Parker w his Bronze Star for Meritorious Service yesterday http://t.co/DCJzSxJ9kR,,,,,
618516045461110784,132278386,senatorbarb,Twitter Web Client,2015-07-07 20:24:51,3,13,Continued my Washington County jobs tour yesterday at the Hagerstown FedEx ground facility http://t.co/UiVykZPvoh,,,,,
618072975854686208,132278386,senatorbarb,Twitter Web Client,2015-07-06 15:04:15,4,8,On my way to Funkstown to present vet Michael Parker w/ his Bronze Star for Meritorious Service during his second tour in Vietnam.,,,,,
618070705243037697,132278386,senatorbarb,Twitter Web Client,2015-07-06 14:55:13,7,8,So proud of @CarliLloyd &amp; @ussoccer_wnt – World Cup champions!! #SheBelieves #USA,,,,,
617417073422139393,132278386,senatorbarb,Mobile Web (M5),2015-07-04 19:37:56,11,27,Great seeing everyone at today's parade today in Catonsville. Have a happy and safe 4th! http://t.co/eYh2Hj2vY8,,,,,
616669211893596160,132278386,senatorbarb,Twitter Web Client,2015-07-02 18:06:11,9,0,RT @HarfordCC: Thank you @SenatorBarb Mikulski for supporting @HarfordCC #cybersecurity program! Happy to have you on campus today. http://…,,,616647729461260288,402912572,HarfordCC
616663880710889472,132278386,senatorbarb,Twitter Web Client,2015-07-02 17:45:00,1,8,So happy to join Bethel AME in celebrating Rev. Reid’s 64th birthday last Sunday! http://t.co/YSULBp0cGr,,,,,
616620597485944832,132278386,senatorbarb,Twitter Web Client,2015-07-02 14:53:01,67,0,RT @AAUW: Is this really what equality looks like? Watch the entire video: http://t.co/PaTbfzBMZf #TheNew10 #EqualPay http://t.co/P5rX7eYMuW,,,615560337916567552,19719380,AAUW
616336610121109504,132278386,senatorbarb,Twitter Web Client,2015-07-01 20:04:33,2,14,Love the people and heritage of the Eastern Shore!,,,,,
616335841905016832,132278386,senatorbarb,Twitter Web Client,2015-07-01 20:01:30,0,3,"Yesterday, I continued my jobs tour of the Eastern Shore http://t.co/9urRhrFEln",,,,,
613722595519807488,132278386,senatorbarb,Twitter Web Client,2015-06-24 14:57:23,11,18,I fight every day to ensure govt maintains commitment it made to vets when they signed up to protect us. Promises made must be promises kept,,,,,
613720484916666368,132278386,senatorbarb,Twitter Web Client,2015-06-24 14:49:00,8,14,So honored to be 1st member of Congress to be awarded @DAVHQ’s Veterans Champion Award- but I want to honor our vets http://t.co/OSyB2Qa6CE,,,,,
613107945946148864,132278386,senatorbarb,Twitter Web Client,2015-06-22 22:14:59,52,73,"Pulling for you, @LarryHogan. Team MD is on your side for a complete and speedy recovery.",,,,,
601080095856525315,132278386,senatorbarb,Twitter Web Client,2015-05-20 17:40:37,6,23,At White House to get plan to get my hometown the fed resources we need &amp; best practices so we don't waste taxpayer $ http://t.co/tCnvey6QXx,,,,,
600715693894594560,132278386,senatorbarb,Twitter Web Client,2015-05-19 17:32:36,1,0,RT @SenateApprops: Today @ 2:30pm Ranking Mem @SenFeinstein &amp; the Energy &amp; Water Subcom will markup their bill. For more info: http://t.co/…,,,600714913389084672,352534407,SenateApprops
600428043614715906,132278386,senatorbarb,Twitter Web Client,2015-05-18 22:29:35,19,25,That's why I'm fighting to put funds in the fed checkbook for NASA's Earth Science program and #climate research at NOAA and NSF,,,,,
600426917087551488,132278386,senatorbarb,Twitter Web Client,2015-05-18 22:25:07,37,36,"#ClimateChange is damaging MDs shores and the Chesapeake Bay, costing billions in tourism and causing farmers heavy losses",,,,,
600425167110676480,132278386,senatorbarb,Twitter Web Client,2015-05-18 22:18:09,8,16,"Because of extensive shorelines, MD is among states most vulnerable to #ClimateChange. Rising sea levels &amp; more freaky weather erodes shores",,,,,
600354821972058114,132278386,senatorbarb,Twitter Web Client,2015-05-18 17:38:38,1,4,Baltimore Company Vac Pac wins Presidential E Star Award – same export award current CEO’s father won in 1966! http://t.co/vEfm1ETOeO,,,,,
598183906089787392,132278386,senatorbarb,Twitter Web Client,2015-05-12 17:52:11,12,0,"RT @NDI: .@madeleine surprises @SenatorBarb, awarding her the Averell Harriman #DemocracyAward http://t.co/zlW5u75HyU",,,598171964210053120,15035484,NDI
598181843096248320,132278386,senatorbarb,Twitter Web Client,2015-05-12 17:43:59,14,0,RT @NDI: “When I first started in the senate they were all named Dick and Harry. Now they're Debbie and Patty.” - @SenatorBarb #NDIMKA,,,598169395358216194,15035484,NDI
598180808520794112,132278386,senatorbarb,Twitter Web Client,2015-05-12 17:39:53,3,0,RT @NDI: .@SenatorBarb &amp; #Afghanistan First Lady @rulaghani will deliver special remarks. https://t.co/ekVDCNCqRC #NDIMKA http://t.co/J9V7v…,,,598165362413277185,15035484,NDI
596326845349568513,132278386,senatorbarb,Twitter Web Client,2015-05-07 14:52:53,10,10,Discussing resources &amp; reforms to help communities like #Baltimore w AG Lynch at @SenateApprops hearing on DOJ budget http://t.co/MVn0Ou6Arh,,,,,
596032207107563520,132278386,senatorbarb,Twitter Web Client,2015-05-06 19:22:06,21,0,"RT @CVSHealth: Thanks to @SenatorBarb, @SenatorCardin, @RepCummings, @LarryHogan, @MayorSRB &amp; others for helping w/ rebuilding plans. #OneB…",,,596022258063134720,122473388,CVSHealth
595684423150018561,132278386,senatorbarb,Twitter Web Client,2015-05-05 20:20:08,4,4,"As Vice-Chair of Appropriations, holding a hearing Thurs on DOJ funding-look forward to discussing AG Lynch's ideas for resources &amp; reforms",,,,,
595683437043970048,132278386,senatorbarb,Twitter Web Client,2015-05-05 20:16:13,7,11,Invited AG Lynch to Baltimore to listen to faith community and get the facts http://t.co/vO10TuOZQe,,,,,
595594134695579651,132278386,senatorbarb,Twitter Web Client,2015-05-05 14:21:21,46,43,Joining our new AG Loretta Lynch for a roundtable with community and faith leaders this afternoon in Baltimore.,,,,,
593474667614199809,132278386,senatorbarb,Twitter Web Client,2015-04-29 17:59:21,4,0,RT @SenateApprops: Happening soon: Watch @SenatorBarb live at a subcommittee hearing on @DHSgov budget request: http://t.co/sykFDGoGba,,,593474134417534976,352534407,SenateApprops
593471605164154881,132278386,senatorbarb,Twitter Web Client,2015-04-29 17:47:11,4,0,RT @SenateApprops: Today @ 2pm @SenatorBarb will attend DHS subcommittee hearing on @DHSgov budget request. More info here: http://t.co/tBI…,,,593454181995917312,352534407,SenateApprops
593163194908180480,132278386,senatorbarb,Twitter Web Client,2015-04-28 21:21:40,20,43,At Baltimore Police Headquarters thanked those working to keep our streets safe. http://t.co/mzRS5nfeBS,,,,,
593163091380154368,132278386,senatorbarb,Twitter Web Client,2015-04-28 21:21:16,5,26,Visiting men &amp; women at Emergency Operations Center this afternoon in Baltimore. http://t.co/cY89Hq1N8F,,,,,
593104389105135617,132278386,senatorbarb,Twitter Web Client,2015-04-28 17:28:00,5,17,"Some guard members I ran into from Frederick, MD. Glad to see people helping people &amp; that things moving in right direction.",,,,,
593104278220308480,132278386,senatorbarb,Twitter Web Client,2015-04-28 17:27:33,77,99,Out at Johns Hopkins in Baltimore &amp; stopped to say hi to MD National Guard members out front. http://t.co/BzlrStFY2v,,,,,
592844010617741312,132278386,senatorbarb,Twitter for iPhone,2015-04-28 00:13:21,211,211,It's time for calm. It's time for kids to go home. It's time to remember vast majority of Baltimore's citizens are law abiding.,,,,,
592843743469928450,132278386,senatorbarb,Twitter for iPhone,2015-04-28 00:12:17,187,161,"I've asked Justice Dept for independent investigation into death of Freddie Gray. Must be rigorous, thorough &amp; expeditious.",,,,,
592843611676549120,132278386,senatorbarb,Twitter for iPhone,2015-04-28 00:11:46,63,47,I've offered support to Baltimore Mayor Rawlings-Blake &amp; have asked mayor and Governor Hogan what federal assistance might be required.,,,,,
592843341198454785,132278386,senatorbarb,Twitter for iPhone,2015-04-28 00:10:41,41,22,Violence &amp; vandalism are unacceptable no matter who does it. http://t.co/hqSGxadIGP,,,,,
592777950233292801,132278386,senatorbarb,Twitter for iPhone,2015-04-27 19:50:51,5,9,So pleased to be part of compelling documentary that tells incredible story of Hubble &amp; all who fought to make it reality. #Hubble25,,,,,
592777776211599362,132278386,senatorbarb,Twitter for iPhone,2015-04-27 19:50:09,2,3,Tune in to @NatGeoChannel at 6pm ET to watch new film Hubble’s Cosmic Journey telling incredible @NASA_Hubble story. http://t.co/6fpFVF9jQT,,,,,
591724599303348225,132278386,senatorbarb,Twitter for iPhone,2015-04-24 22:05:12,4,4,Happy Federation Day! Congrats to #GFWC on celebrating 125 yrs of volunteering &amp; service to communities.,,,,,
591683853628088320,132278386,senatorbarb,Twitter Web Client,2015-04-24 19:23:18,4,10,".@NASA_Hubble has had an amazing 25 yr journey, would love ability to keep its enduring mission going for another 25!",,,,,
591683655728287745,132278386,senatorbarb,Twitter Web Client,2015-04-24 19:22:31,949,0,"RT @NASA: #FF to @NASA_Hubble, launched 25 years old today. Here's Hubble deployed in 1990: http://t.co/0kgkrj9hJB #Hubble25 http://t.co/vB…",,,591636863376556032,11348282,NASA
591683605304365056,132278386,senatorbarb,Twitter Web Client,2015-04-24 19:22:19,2,6,"#FF - @NASA, @NASAGoddard, @NASA_Hubble celebrating 25 amazing yrs of Hubble Space Telescope!",,,,,
591682998174687233,132278386,senatorbarb,Twitter Web Client,2015-04-24 19:19:54,2,9,.@NatGeoChannel tells incredible story of Hubble &amp; all who fought to make it reality. Tune in Mon @ 6pm. http://t.co/6fpFVF9jQT #Hubble25,,,,,
591682797342892032,132278386,senatorbarb,Twitter Web Client,2015-04-24 19:19:06,161,0,RT @SciAstro: Happy Birthday Hubble Space Telescope!  My favorite Hubble image: #Hubble25 @NASASocial http://t.co/aqXoizoN0I,,,591614401557454848,484991854,SciAstro
591682696553877504,132278386,senatorbarb,Twitter Web Client,2015-04-24 19:18:42,5,3,Was so pleased to join w @SciAstro &amp; @NatGeoChannel to unveil new Hubble’s Cosmic Journey documentary. WATCH https://t.co/E0UF9K3mri,,,,,
591682445335990274,132278386,senatorbarb,Twitter Web Client,2015-04-24 19:17:42,10,19,"Favorite @NASA_Hubble image is Eye of God, its hanging in my office. Read my story @nytimes http://t.co/kG6UGLFy9T http://t.co/eMj17h5OD9",,,,,
591681590406807552,132278386,senatorbarb,Twitter Web Client,2015-04-24 19:14:18,1167,0,"RT @StationCDRKelly: Good morning, and #HappyBirthday @NASA_Hubble from the @space_station! #Hubble25 Anniversary Image. #YearInSpace http:…",,,591574556399292417,65647594,StationCDRKelly
591681171202924544,132278386,senatorbarb,Twitter Web Client,2015-04-24 19:12:38,3,10,"I’m so proud of all at @NASA, @NASAGoddard, Space Telescope Science Institute in Baltimore &amp; all who have made dream of Hubble reality!",,,,,
591681025736089600,132278386,senatorbarb,Twitter Web Client,2015-04-24 19:12:04,5,10,RT @nytimes Happy 25th birthday to the Hubble Space Telescope. See unforgettable scenes from our universe http://t.co/PZxS621xps,,,,,
591680785939304448,132278386,senatorbarb,Twitter Web Client,2015-04-24 19:11:06,3,4,".@NASA_Hubble has told story of our universe, inspiring generations from school kids to Nobel prize winning astronomers.",,,,,
591680572218548224,132278386,senatorbarb,Twitter Web Client,2015-04-24 19:10:15,250,0,"RT @NASAGoddard: More than 3,000 new stars are visible in this 3-D #Hubble25 anniversary image that's a fly-through of nebul... https://t.c…",,,591569305218768896,20060293,NASAGoddard
591680408078651392,132278386,senatorbarb,Twitter Web Client,2015-04-24 19:09:36,8,14,".@NASA Hubble is greatest tool for studying universe since Galileo’s telescope! Seen over 38,000 objects &amp; traveled over 3.8 billion miles!",,,,,
591680343515725824,132278386,senatorbarb,Twitter Web Client,2015-04-24 19:09:21,18,30,"@NASA Hubble is greatest tool for studying universe since Galileo’s telescope! Seen over 38,000 objects &amp; traveled over 3.8 billion miles!",NASA,,,,
591680175303163906,132278386,senatorbarb,Twitter Web Client,2015-04-24 19:08:41,294,0,RT @NASA_Hubble: Today at 8:33:51a.m. EDT the Hubble Space Telescope was launched into space on STS-31.  #Hubble25 http://t.co/o7eKeljNwA,,,591580612785377282,14091091,NASA_Hubble
591680005958172672,132278386,senatorbarb,Twitter Web Client,2015-04-24 19:08:00,3,5,25 yrs ago @NASA_Hubble Space Telescope blasted off into orbit &amp; brought w it new era in space science &amp; discovery. #Hubble25,,,,,
591352245645680640,132278386,senatorbarb,Twitter Web Client,2015-04-23 21:25:36,12,14,Pleased Senate has finally acted to confirm Loretta Lynch as our next Attorney General. http://t.co/DELhza6xvw,,,,,
591237278380462080,132278386,senatorbarb,Twitter Web Client,2015-04-23 13:48:46,5,0,RT @SenateApprops: Happening soon: at 10am @SenatorBarb will attend LHHS hearing on @HHSGov budget w/@SecBurwell. Watch live: http://t.co/B…,,,591232864722804736,352534407,SenateApprops
590975671830245376,132278386,senatorbarb,Twitter Web Client,2015-04-22 20:29:14,9,9,"As we mark #EarthDay, let’s recommit to protecting &amp; sustaining MD’s natural wonders – a key part of our culture, economy &amp; our heritage.",,,,,
590876413751906304,132278386,senatorbarb,Twitter Web Client,2015-04-22 13:54:49,15,14,"Libraries more than collections of books, they’re community centers, safe spaces for families to grow &amp; learn &amp; unleash imagination of kids.",,,,,
590876294491086848,132278386,senatorbarb,Twitter Web Client,2015-04-22 13:54:21,5,7,I’m especially proud that Cecil Co Public Library recognized for programs that help vets find jobs &amp; support local small businesses.,,,,,
590876228535615488,132278386,senatorbarb,Twitter Web Client,2015-04-22 13:54:05,5,0,RT @ccpltweets: We're thrilled to announce that CCPL is a winner of the 2015 #NationalMedal from @US_IMLS http://t.co/v50H4ojB17 http://t.c…,,,590564946737557504,20813926,ccpltweets
590876154539728896,132278386,senatorbarb,Twitter Web Client,2015-04-22 13:53:47,1,5,Kudos Cecil Co Public Library @ccpltweets on receiving Institute for Museum &amp; Library Services nat'l medal! @US_IMLS. http://t.co/EZaQSZa8lS,,,,,
590654577126596608,132278386,senatorbarb,Twitter for iPhone,2015-04-21 23:13:19,18,16,Today w MD Delegation called on @TheJusticeDept to open criminal &amp; civil rights investigations into death of Freddie Gray.,,,,,
590145729965981697,132278386,senatorbarb,Twitter Web Client,2015-04-20 13:31:21,34,0,"RT @PolishEmbassyUS: ""Stalin wanted to kill the spirit of #Poland but he did not succeed"" @SenatorBarb at the #Katyn memorial in Baltimore …",,,589845408861528064,238286421,PolishEmbassyUS
590145447341219841,132278386,senatorbarb,Twitter Web Client,2015-04-20 13:30:13,3,0,"RT @AttmansDeli: Incredible week hosting beloved guests @senatorcardin, @senatorbarb, leaders from @theassociated, &amp; especially... http://t…",,,589426554020700160,194191528,AttmansDeli
589854198990266368,132278386,senatorbarb,Twitter for iPhone,2015-04-19 18:12:54,6,7,Congrats to @BishopWSThomas of New Psalmist Baptist Church  on 40 yrs of ministry to Baltimore families! #NPBC,,,,,
589155974910517248,132278386,senatorbarb,Twitter Web Client,2015-04-17 19:58:25,4,4,I fought alongside Judy Gross &amp; @SenatorCardin to bring Alan home &amp; am honored to again join them here in B’More now that Alan is free.,,,,,
589155700573659136,132278386,senatorbarb,Twitter Web Client,2015-04-17 19:57:19,3,6,So glad to welcome @AlanPGross home as he touched US soil &amp; now am glad to welcome him back to beloved @AttmansDeli! http://t.co/4F2jLUAaq1,,,,,
589155341704769536,132278386,senatorbarb,Twitter Web Client,2015-04-17 19:55:54,4,11,What a great day w @AlanPGross &amp; his wife Judy celebrating his freedom over @AttmansDeli corned beef sandwiches! http://t.co/MS8Ase7pvz,,,,,
589069201878306816,132278386,senatorbarb,Twitter Web Client,2015-04-17 14:13:36,28,14,By expanding Social Security benefits &amp; growing support for seniors we'll ensure those who need it most have fair shot w gov’t on their side,,,,,
589068835480739841,132278386,senatorbarb,Twitter Web Client,2015-04-17 14:12:09,47,68,"I’m standing firm in my commitment to protect Social Security so that it is reliable, guaranteed &amp; inflation proof.",,,,,
589068749749129216,132278386,senatorbarb,Twitter Web Client,2015-04-17 14:11:48,6,12,"Honor thy mother &amp; father isn’t just a good commandment to live by, it’s good policy to govern by.",,,,,
589068667637211136,132278386,senatorbarb,Twitter Web Client,2015-04-17 14:11:29,1,5,I recently continued my Maryland Jobs Tour meeting w leaders &amp; employees of the Social Security Administration. http://t.co/JTQvZwF93V,,,,,
588838996442222592,132278386,senatorbarb,Twitter for iPhone,2015-04-16 22:58:51,16,22,"We must continue to honor Holocaust survivors not just with words, but with deeds. Never again can such evil be allowed to exist.",,,,,
588838417338916865,132278386,senatorbarb,Twitter for iPhone,2015-04-16 22:56:33,4,6,Every day I carry memories of my visit to Auschwitz &amp; the sheering experience of seeing repugnant &amp; wrenching things.,,,,,
588837682912108544,132278386,senatorbarb,Twitter for iPhone,2015-04-16 22:53:38,13,13,Today we honor memory of lives lost &amp; legacy forged by those who survived as testament to sheer force of human spirit #HolocaustRemembrance,,,,,
588799865083277313,132278386,senatorbarb,Twitter Web Client,2015-04-16 20:23:21,3,4,".@CatholicRelief, @LuthWorldRelief, @theIRC &amp; others giving lifesaving support &amp; hope to those in dire need.",,,,,
588799764793274368,132278386,senatorbarb,Twitter Web Client,2015-04-16 20:22:57,2,4,Job well done to MD based relief organizations leading way providing critical humanitarian aid in war torn regions. http://t.co/9i6jtTpraM,,,,,
588673940064751616,132278386,senatorbarb,Twitter for iPhone,2015-04-16 12:02:59,8,12,"We must invest in futures of gifted students, making sure they are identified, teachers are supported &amp; we grow our national talent pool.",,,,,
588673752545763328,132278386,senatorbarb,Twitter for iPhone,2015-04-16 12:02:14,4,10,I’ve continued to champion Javits Gifted &amp; Talented Education Program to help schools get tools &amp; resources needed to support gifted kids.,,,,,
588673560417275904,132278386,senatorbarb,Twitter for iPhone,2015-04-16 12:01:28,8,15,So pleased #Senate HELP committee voted unanimously to pass my amendment to support gifted &amp; talented students. #ESEA http://t.co/9Zb3eTPc82,,,,,
588449214172008448,132278386,senatorbarb,Twitter Web Client,2015-04-15 21:10:00,15,11,Over 50 yrs after Equal Pay Act signed into law women still earn average of just 78¢ for every $ a man earns. Families deserve #EqualPayNOW!,,,,,
588449044604694529,132278386,senatorbarb,Twitter Web Client,2015-04-15 21:09:19,6,12,My #PaycheckFairness amendment to federal budget is about family budgets. It’s time to close the wage gap! #EqualPayNOW,,,,,
588448893303590912,132278386,senatorbarb,Twitter Web Client,2015-04-15 21:08:43,26,28,Today I’m continuing my fight for #EqualPayNOW introducing #PaycheckFairness Act as budget motion. WATCH: https://t.co/iLIQrUkO2m,,,,,
588097215157161984,132278386,senatorbarb,Twitter Web Client,2015-04-14 21:51:17,36,43,"It's time to square our shoulders, put on our lipstick and fight for #EqualPayNOW for equal work! http://t.co/k5VPz1etVI",,,,,
588055584261406720,132278386,senatorbarb,Twitter Web Client,2015-04-14 19:05:51,43,37,I’m calling on Congress to pass #PaycheckFairness Act to change law books so we can put change in family checkbooks! http://t.co/LWXVu5w7jm,,,,,
588055296200810497,132278386,senatorbarb,Twitter Web Client,2015-04-14 19:04:42,6,10,Today stood shoulder to shoulder w Senate &amp; House women &amp; advocates to say it’s time for #EqualPayNOW! WATCH: https://t.co/RFUYczk85j,,,,,
587994181718695938,132278386,senatorbarb,Twitter Web Client,2015-04-14 15:01:51,29,24,Today on #EqualPayDay @ 12:30pm I’ll be joined by Senate &amp; House women &amp; advocates to say we need #EqualPayNOW! LIVE https://t.co/RFUYczk85j,,,,,
586630010842308608,132278386,senatorbarb,Twitter Web Client,2015-04-10 20:41:08,4,10,Congrats to staff member @KeenenGeter recognized by @MDDailyRecord as Top 20 in their 20s! http://t.co/VL4Ft0Jsnh http://t.co/Ot3JzdYIkm,,,,,
586620269185368067,132278386,senatorbarb,Twitter Web Client,2015-04-10 20:02:25,21,28,.@Orioles are back in Camden Yards for #OpeningDay! Ready to root root root for our O’s! #Birdland http://t.co/RGtWn4b9Ws,,,,,
585140905222479872,132278386,senatorbarb,Twitter Web Client,2015-04-06 18:03:57,84,147,Orange &amp; black are back! Ready for a new season cheering on our @Orioles! #OperationOrange http://t.co/hBrMTqjDgt,,,,,
585132931401830401,132278386,senatorbarb,Twitter Web Client,2015-04-06 17:32:16,2,7,ROTC means @UMBC will grow historic relationship as it teaches &amp; trains our young leaders for jobs of tomorrow. http://t.co/RnwaNGsaLg,,,,,
585132664753152000,132278386,senatorbarb,Twitter Web Client,2015-04-06 17:31:13,14,13,"Pleased @USNavy starting ROTC at @UMBC. With Naval Academy in Annapolis, MD has proud history supporting those who sacrifice to keep us safe",,,,,
585132112468127745,132278386,senatorbarb,Twitter Web Client,2015-04-06 17:29:01,2,6,"So proud of @umdwbb #LadyTerps for nonstop grit, determination &amp; fight this season! Fear the Turtles! #NCAATournament",,,,,
584770274035367936,132278386,senatorbarb,Twitter for iPhone,2015-04-05 17:31:12,7,19,Happy Easter!!!,,,,,
584399548136689664,132278386,senatorbarb,Twitter for iPhone,2015-04-04 16:58:04,7,20,Wishing all a Passover filled with joy &amp; happiness.,,,,,
582873763085205504,132278386,senatorbarb,Twitter for iPhone,2015-03-31 11:55:09,35,42,Way to go #ladyterps!! Final 4 bound! Great shots &amp; blocks. MD cheering you on! @umdwbb #NCAATournament,,,,,
582612740184915969,132278386,senatorbarb,Twitter Web Client,2015-03-30 18:37:56,13,18,"Pleased to be joined by Columbia, MD student leader Tomi Williams on floor of @emkinstitute. http://t.co/5VMlKgdonX",,,,,
582590962024779776,132278386,senatorbarb,Twitter Web Client,2015-03-30 17:11:24,13,15,Glad to sign my desk in @EMKinstitute where students will be inspired to service &amp; learn about govt for generations. http://t.co/QcYBf9dP1E,,,,,
