id,user_id,screen_name,source,created_at,retweet_count,favorite_count,text,in_reply_to_screen_name,in_reply_to_status_id,retweeted_status_id,retweeted_status_user_id,retweeted_status_screen_name
496393554655469569,132278386,senatorbarb,Twitter Web Client,2014-08-04 20:33:40,6,5,Today met w @MD_CommColleges Presidents to discuss ensuring access to affordable higher education. http://t.co/cJkbTCkS8i,,,,,
495280666675019776,132278386,senatorbarb,Twitter Web Client,2014-08-01 18:51:27,5,2,Pleased my resolution passed Senate marking anniversary that forever stands as testament to strength of human spirit. http://t.co/5jprCnEeeN,,,,,
495280512542736385,132278386,senatorbarb,Twitter Web Client,2014-08-01 18:50:50,25,14,Today we commemorate 70th anniversary of heroic #WarsawUprising which serves as inspiration to all people fighting for freedom &amp; dignity.,,,,,
495262460300263424,132278386,senatorbarb,Twitter Web Client,2014-08-01 17:39:06,6,5,It’s crucial that Israel has opportunity to defend itself while others work on ceasefires or political solutions. https://t.co/ymdaxu8wVG,,,,,
495262235745615872,132278386,senatorbarb,Twitter Web Client,2014-08-01 17:38:13,7,4,Fought hard to pass emergency spending bill to replenish Israel’s Iron Dome-critical to defense of our treasured ally http://t.co/DBIEbMRMnd,,,,,
494956383847325696,132278386,senatorbarb,Twitter Web Client,2014-07-31 21:22:52,3,3,Carolyn Colvin is intellectually brilliant w enormous competency &amp; is up to the job at Social Security  http://t.co/hIZUlEmQ78,,,,,
494956173796589568,132278386,senatorbarb,Twitter Web Client,2014-07-31 21:22:02,7,5,Social Security a social contract between American people &amp; their gov’t providing critical safety net there when they need it.,,,,,
494956003201675265,132278386,senatorbarb,Twitter Web Client,2014-07-31 21:21:21,4,2,Today introd Anne Arundel Co native Carolyn Colvin at hearing on her nomination to be @SocialSecurity Commissioner https://t.co/eace822jpn,,,,,
494506588951298048,132278386,senatorbarb,Twitter Web Client,2014-07-30 15:35:32,5,22,"My Polish heritage has given me set of beliefs–in freedom, in people, in strength of human spirit &amp; that we must always speak truth to power",,,,,
494506361892638721,132278386,senatorbarb,Twitter Web Client,2014-07-30 15:34:38,2,9,Senate action w @SenatorRisch &amp; @SenatorCardin marks 8/1/44 uprising that forever serves as symbol of heroism in face of great adversity.,,,,,
494506135907729408,132278386,senatorbarb,Twitter Web Client,2014-07-30 15:33:44,18,15,Pleased Senate Foreign Relations Cmt passed my bipartisan resolution marking Polish Warsaw Uprising 70th anniversary. http://t.co/BzRAHId1Uv,,,,,
494502096939794432,132278386,senatorbarb,Twitter Web Client,2014-07-30 15:17:41,5,0,"RT @SenateApprops: Here is video of Chairwoman @SenatorBarb talking about #veteransaffairs &amp; Iron Dome, wildfires &amp; border funding:  https:…",,,494197200550125568,352534407,SenateApprops
494500269590585344,132278386,senatorbarb,Twitter Web Client,2014-07-30 15:10:26,1,2,FBI needs 21st century fully consolidated headquarters so it can fulfill its 21st century mission. WATCH https://t.co/y2QLaSaNVL,,,,,
494247589517463552,132278386,senatorbarb,Twitter Web Client,2014-07-29 22:26:22,9,2,Today w @SenatorCardin &amp; Team MD announced 2 proposed Prince George's Co sites on shortlist for new FBI headquarters http://t.co/cBhMA265OG,,,,,
493887138359156736,132278386,senatorbarb,Twitter Web Client,2014-07-28 22:34:04,2,4,Pamela Harris is extraordinarily qualified for the job w/ commitment to rule of law &amp; passion for how it affects lives of ordinary Americans,,,,,
493887057325203456,132278386,senatorbarb,Twitter Web Client,2014-07-28 22:33:45,1,6,Pleased Senate voted to confirm Pamela Harris to serve on 4th Circuit Court of Appeals &amp; was proud to recommend her http://t.co/PCRo7clunB,,,,,
492350424234881024,132278386,senatorbarb,Twitter Web Client,2014-07-24 16:47:43,9,0,RT @baltimoresun: COMMENTARY: Md. senators fight for multi-year transportation bill. http://t.co/mr3fg65AGX via @SenatorBarb and @SenatorCa…,,,491983881734979584,8861752,baltimoresun
492350263232319490,132278386,senatorbarb,Twitter Web Client,2014-07-24 16:47:04,5,3,"Time for Congress to act! Long-term investments in transportation create jobs, help businesses succeed &amp; create certainty for communities.",,,,,
492350045417930753,132278386,senatorbarb,Twitter Web Client,2014-07-24 16:46:12,8,6,I’m fighting along w @SenatorCardin for multi-year transportation bill to provide planning &amp; funding certainty for Maryland.,,,,,
492349957182337024,132278386,senatorbarb,Twitter Web Client,2014-07-24 16:45:51,9,2,"In midst of peak construction season, critical Highway Trust Fund will go bankrupt in August if Congress doesn’t act. http://t.co/ahDbRDoTu4",,,,,
492302285067010048,132278386,senatorbarb,Twitter Web Client,2014-07-24 13:36:25,4,2,Proud to cut through red tape &amp; break bureaucracy so Cpl. Mackall received long-overdue honor he deserves. http://t.co/YRvanvu29q,,,,,
492302144088055809,132278386,senatorbarb,Twitter Web Client,2014-07-24 13:35:52,4,1,Life-long Calvert Co MDer Corporal Elmer Mackall served his country as Montford Marine–but never received his medal or official recognition.,,,,,
492302047052832768,132278386,senatorbarb,Twitter Web Client,2014-07-24 13:35:29,6,2,Montford Marines broke down barriers for African Americans serving in Armed Forces-I cosponsored bill awarding them Congressional Gold Medal,,,,,
492046585984212992,132278386,senatorbarb,Twitter Web Client,2014-07-23 20:40:22,8,16,Jim-you are my sunshine for a rainy day or any day. Thanks for all you &amp; @WeatherChannel do to keep communities safe! http://t.co/G3zgoaZQLG,,,,,
492046401053155329,132278386,senatorbarb,Twitter Web Client,2014-07-23 20:39:38,12,25,Would have liked to join @JimCantore today at Capitol to talk weather safety–sent him photo of our last mtg w regards http://t.co/aYWMg5rh3E,,,,,
491712019318337536,132278386,senatorbarb,Twitter for iPhone,2014-07-22 22:30:55,2,3,"As our nation looks at how best to create, sustain &amp; support high-paying jobs, must better prepare workforce to fill high demand jobs now.",,,,,
491711872198922240,132278386,senatorbarb,Twitter for iPhone,2014-07-22 22:30:20,6,7,Pleased President signed into law bipartisan Workforce Innovation &amp; Opportunity Act I cosponsored promoting jobs today &amp; tomorrow. #WIOA,,,,,
491662247157309441,132278386,senatorbarb,Twitter Web Client,2014-07-22 19:13:09,5,4,I’m proud to honor Mattie &amp; his call for hope and peace that lives on &amp; will continue to inspire future generations. http://t.co/56xIEXlOLM,,,,,
491662143562211328,132278386,senatorbarb,Twitter Web Client,2014-07-22 19:12:44,1,2,Mattie’s life &amp; legacy continues to inspire us all as advocate for peace whose message reached millions around world.,,,,,
491661985994801152,132278386,senatorbarb,Twitter Web Client,2014-07-22 19:12:06,1,2,He’s especially on our mind as last Thursday would have marked his 24th birthday.,,,,,
491661905795497984,132278386,senatorbarb,Twitter Web Client,2014-07-22 19:11:47,5,9,Pleased Senate has acted to pass resolution I intro’d w @SenatorCardin honoring life of MDer &amp; advocate for peace Mattie Stepanek.,,,,,
491228891860979712,132278386,senatorbarb,Twitter Web Client,2014-07-21 14:31:09,11,11,Headed to Howard Co to tour MD Center for Entrepreneurship w/ Councilwoman Watson &amp; talk innovation jobs.,,,,,
489887995122946048,132278386,senatorbarb,Twitter Web Client,2014-07-17 21:42:54,6,7,To honor his life &amp; legacy joined by @SenatorCardin to intro resolution declaring Mattie Stepanek World Peace Day http://t.co/ngqYDyLt0W,,,,,
489887668927361025,132278386,senatorbarb,Twitter Web Client,2014-07-17 21:41:36,3,5,Mattie was inspiration as gifted author &amp; noted peacemaker. Took personal challenge &amp; turned it into message of peace heard around world,,,,,
489887412827750403,132278386,senatorbarb,Twitter Web Client,2014-07-17 21:40:35,2,3,He’s especially on our mind as today would have marked his 24th birthday.,,,,,
489887337670017024,132278386,senatorbarb,Twitter Web Client,2014-07-17 21:40:17,10,11,Today we pay tribute to life of Mattie Stepanek who passed away 10 yrs ago after fight w/ Muscular Dystrophy.,,,,,
489829558540308481,132278386,senatorbarb,Twitter Web Client,2014-07-17 17:50:42,3,3,In June I intro’d Pamela Harris at her Senate hearing – she’ll be true asset to 4th Circuit https://t.co/ptkdL5TthS http://t.co/A18YcWDLD4,,,,,
489829106868310016,132278386,senatorbarb,Twitter Web Client,2014-07-17 17:48:54,0,0,"Pamela is an exceptional litigator, professor, public servant &amp; proud Marylander who is well suited for job.",,,,,
489828985682292736,132278386,senatorbarb,Twitter Web Client,2014-07-17 17:48:25,1,0,Pleased Sen Judiciary Cmt today voted to approve nomination of Pamela Harris to serve on 4th Circuit Court of Appeals http://t.co/1KLDIQpPBy,,,,,
489777005895122944,132278386,senatorbarb,Twitter Web Client,2014-07-17 14:21:52,6,0,RT @SenateApprops: At 10:30 @SenatorBarb will hold a full committee markup of @SenatorDurbin’s FY15 #Defense appropriations bill. Listen ht…,,,489776225477722114,352534407,SenateApprops
489541193806532609,132278386,senatorbarb,Twitter for iPhone,2014-07-16 22:44:50,14,19,"I'll keep fighting so health decisions made between an individual &amp; their doctor, not an employer &amp; insurance company http://t.co/ryQpQoEGEG",,,,,
489540786698977280,132278386,senatorbarb,Twitter for iPhone,2014-07-16 22:43:13,21,16,"By denying women access to care, Supreme Court decision again allows for gender discrimination in health care – something I fought to end.",,,,,
489539956713332736,132278386,senatorbarb,Twitter for iPhone,2014-07-16 22:39:55,19,17,Deeply disappointed Senate Republicans voted to put personal opinion of a employer ahead of medical opinion of a doctor. #NotMyBossBusiness,,,,,
489506545038663680,132278386,senatorbarb,Twitter for iPhone,2014-07-16 20:27:09,9,0,RT @SenateApprops: On the floor now: @SenatorBarb will speak on humanitarian crisis at SW border &amp; @WhiteHouse emergency supplemental http:…,,,489506167698522112,352534407,SenateApprops
489442008088723456,132278386,senatorbarb,Twitter Web Client,2014-07-16 16:10:42,29,25,Important health care decisions should be made by an individual and their doctor -- not by their employer.,,,,,
489441920901726208,132278386,senatorbarb,Twitter Web Client,2014-07-16 16:10:21,13,11,I'm speaking out to ensure personal opinion of your employer doesn’t trump medical opinion of your doctor. WATCH https://t.co/8qaFk3b8xW,,,,,
489441456969773057,132278386,senatorbarb,Twitter Web Client,2014-07-16 16:08:31,9,9,I’m fighting to right this wrong &amp; protect all Americans by prohibiting employers from denying access to impt health benefits.,,,,,
489441004370792448,132278386,senatorbarb,Twitter Web Client,2014-07-16 16:06:43,22,25,Today I’ll vote to support legislation protecting women’s health following dangerous Supreme Court decision. #NotMyBossBusiness,,,,,
489112429586952193,132278386,senatorbarb,Twitter for iPhone,2014-07-15 18:21:05,10,17,Headed to Senate floor to speak out for bill protecting women's health after dangerous Supreme Court decision. Watch http://t.co/SkDOQFqTVG,,,,,
488783572711383041,132278386,senatorbarb,Twitter Web Client,2014-07-14 20:34:19,4,7,I’m proud to support research &amp; innovation jobs in MD’s biotech industry keeping MD competitive in global economy http://t.co/s2JGx7CXn0,,,,,
488783368990236673,132278386,senatorbarb,Twitter Web Client,2014-07-14 20:33:30,1,5,In MD life science is life blood of our economy – supporting 90K jobs developing new products &amp; treatments that help save &amp; improve lives.,,,,,
488783160659181568,132278386,senatorbarb,Twitter Web Client,2014-07-14 20:32:41,4,0,RT @AstraZenecaUS: .@SenatorBarb showed her support of MD biotech today at AZ's biologics manufacturing center in Frederick. http://t.co/xX…,,,488781273604034561,18723114,AstraZenecaUS
488783089548926976,132278386,senatorbarb,Twitter Web Client,2014-07-14 20:32:24,5,1,Today in Frederick met w/ @AstraZenecaUS to talk community health &amp; supporting biotech research &amp; manufacturing jobs. http://t.co/uVbcRgHe7c,,,,,
488370869857947649,132278386,senatorbarb,Twitter for iPhone,2014-07-13 17:14:23,32,43,Congrats to @OrbitalSciences on successful Antares launch from Spaceport @NASA_Wallops carrying critical cargo to int'l space station.,,,,,
487720727311687680,132278386,senatorbarb,Twitter for iPhone,2014-07-11 22:10:57,8,4,National Parks would be fitting tribute to honor her lasting legacy for MD &amp; our nation while inspiring future generations.,,,,,
487720647099813888,132278386,senatorbarb,Twitter for iPhone,2014-07-11 22:10:38,8,5,Harriet Tubman was a courageous fighter w tireless commitment to fight for those who couldn’t fight for themselves.,,,,,
487720553067724801,132278386,senatorbarb,Twitter for iPhone,2014-07-11 22:10:15,13,9,Pleased Senate passed bill I helped intro to create national historic parks to honor life &amp; legacy of Harriet Tubman http://t.co/39ylWey5Dd,,,,,
487715711091892224,132278386,senatorbarb,Twitter for iPhone,2014-07-11 21:51:01,19,0,RT @repdonnaedwards: I look forward to appearing on @HBO's Real Time w @billmaher tonight. Hope you can tune in!,,,487664141088608256,82649553,repdonnaedwards
487668186125717504,132278386,senatorbarb,Twitter Web Client,2014-07-11 18:42:10,6,5,#FF Team Maryland in the House @WhipHoyer @RepCummings @Call_Me_Dutch @ChrisVanHollen @RepJohnSarbanes @repdonnaedwards @repjohndelaney,,,,,
487664960903077888,132278386,senatorbarb,Twitter Web Client,2014-07-11 18:29:21,0,3,I'll continue to stand sentry to ensure our firefighters have a gov't on their side and by their side http://t.co/pHI6vAXEmQ,,,,,
487664750835552256,132278386,senatorbarb,Twitter Web Client,2014-07-11 18:28:31,0,1,Ensuring states have tools they need to respond to disasters w/ surplus equipment is common sense. Saves money &amp; saves lives.,,,,,
487664354767421440,132278386,senatorbarb,Twitter Web Client,2014-07-11 18:26:57,3,3,First responders put their lives on the line to protect communities. Federal gov’t must protect our protectors w/ tools they need.,,,,,
487663919939719168,132278386,senatorbarb,Twitter Web Client,2014-07-11 18:25:13,4,5,Joined w/ @SenJohnMcCain to call on Defense Dept to release surplus military equipment to firefighters responding to natural disasters.,,,,,
487361132102172673,132278386,senatorbarb,Twitter Web Client,2014-07-10 22:22:03,37,13,"Health decisions should be made by an individual and their doctor, not by their employer. http://t.co/fubkL6zFYd",,,,,
487361066004131840,132278386,senatorbarb,Twitter Web Client,2014-07-10 22:21:47,12,11,I’ve cosponsored bill to right this wrong &amp; protect all Americans by prohibiting employers from denying access to impt health benefits.,,,,,
487360833673244672,132278386,senatorbarb,Twitter Web Client,2014-07-10 22:20:52,20,11,Allowing employers to deny women access to needed care once again allows for gender discrimination in health care –something I fought to end,,,,,
487360752165339137,132278386,senatorbarb,Twitter Web Client,2014-07-10 22:20:32,21,12,Far-reaching Supreme Court womens health decision should concern us all–puts personal opinion of employer ahead of medical opinion of doctor,,,,,
487302263095173120,132278386,senatorbarb,Twitter Web Client,2014-07-10 18:28:07,5,0,RT @SenateApprops: At 2:30 pm: @SenatorBarb will chair full committee hearing on @WhiteHouse emergency supplemental request. Watch live: ht…,,,487301413018808321,352534407,SenateApprops
486260376099880962,132278386,senatorbarb,Twitter Web Client,2014-07-07 21:28:02,4,10,MD cities &amp; towns need gov't on their wide to upgrade water &amp; sewer infrastructure. I'll keep working to make sure MD's water works!,,,,,
486260161305387009,132278386,senatorbarb,Twitter Web Client,2014-07-07 21:27:11,8,8,"I'm fighting to wash away rust &amp; decay of crumbling water infrastructure to create jobs - protect public safety, environment &amp; ratepayers.",,,,,
486260057391525888,132278386,senatorbarb,Twitter Web Client,2014-07-07 21:26:46,7,0,RT @SenatorCardin: At Montebello Water Treatment Plant w/ @SenatorBarb talking about the need to invest in US water infrastructure http://t…,,,486151205899341825,109071031,SenatorCardin
486259862406717440,132278386,senatorbarb,Twitter Web Client,2014-07-07 21:26:00,5,3,Today visited Baltimore water treatment plant w @SenatorCardin to get up close view of MDs aging water infrastructure http://t.co/4a5bCazuOS,,,,,
485119648979902464,132278386,senatorbarb,Twitter for iPhone,2014-07-04 17:55:12,6,8,Have a happy &amp; safe July 4th!!,,,,,
484697934294839300,132278386,senatorbarb,Twitter for iPhone,2014-07-03 13:59:27,10,4,"Every day when first responders report for duty, don't know what they'll face. That's why I'm fighting to protect our protectors.",,,,,
484697521772441600,132278386,senatorbarb,Twitter for iPhone,2014-07-03 13:57:49,4,5,Headed to Rosedale to announce funds in federal checkbook for Baltimore Co &amp; MD fire fighters.,,,,,
484008076706869248,132278386,senatorbarb,Twitter Web Client,2014-07-01 16:18:12,5,3,"Ellicott City small businesses backbone of community – creating jobs &amp; bringing in families who shop, eat &amp; live here http://t.co/Oahm5lOfZp",,,,,
484006983008550912,132278386,senatorbarb,Twitter Web Client,2014-07-01 16:13:51,14,9,Vote TODAY for Ellicott City as @ParadeMagazine Best Main Street in US! Let’s support Howard Co families &amp; businesses http://t.co/Oahm5lOfZp,,,,,
483735660554379264,132278386,senatorbarb,Twitter Web Client,2014-06-30 22:15:43,3,2,Look forward to Senate’s confirmation so we can right the ship &amp; together continue to tackle issues in VA.,,,,,
483735553754808320,132278386,senatorbarb,Twitter Web Client,2014-06-30 22:15:18,4,1,"His military, business &amp; management experience needed to lead our nation’s largest health care network.",,,,,
483735497563701248,132278386,senatorbarb,Twitter Web Client,2014-06-30 22:15:04,6,2,Decision to nominate Bob McDonald as next Sec of Veterans Affairs demonstrates President's commitment to resolving mgmt issues plaguing VA.,,,,,
482634324462665728,132278386,senatorbarb,Twitter for iPhone,2014-06-27 21:19:24,7,5,"MD artists using their passion, talents &amp; voices to keep American musical traditions alive for generations to come.",,,,,
482634219743477760,132278386,senatorbarb,Twitter for iPhone,2014-06-27 21:18:59,7,5,Kudos to MD blues &amp; gospel Holmes Brothers / Singing &amp; Praying Bands of MD &amp; DE named @NEAarts Nat’l Heritage Fellows http://t.co/My1oMBBCtL,,,,,
482233322417180672,132278386,senatorbarb,Twitter Web Client,2014-06-26 18:45:58,6,7,Congrats to #USA Soccer! On to the Round of 16! #USMNT #1N1T,,,,,
482213416397185024,132278386,senatorbarb,Twitter Web Client,2014-06-26 17:26:52,5,3,On Senate floor will keep up drumbeat against Boko Haram terrorists &amp; call for access to education for women &amp; girls http://t.co/m7x27CNEFJ,,,,,
481927665922748416,132278386,senatorbarb,Twitter for iPhone,2014-06-25 22:31:24,6,3,Workforce investment is a down-payment on middle class &amp; our nation’s future – promoting jobs today &amp; jobs tomorrow,,,,,
481927490881867776,132278386,senatorbarb,Twitter for iPhone,2014-06-25 22:30:42,3,2,"As we look at how best to create, sustain &amp; support high-paying jobs, must look at how to best educate our workforce &amp; fill high-demand jobs",,,,,
481927329959014401,132278386,senatorbarb,Twitter for iPhone,2014-06-25 22:30:03,5,0,Today’s passage of bipartisan workforce #WIA bill is step forward for jobs &amp; helping our nation remain competitive globally in 21st century,,,,,
481518057664569344,132278386,senatorbarb,Twitter Web Client,2014-06-24 19:23:45,5,9,"Together we can break down barriers so all can live in a country that lives up to undeniable promise of life, liberty &amp; pursuit of happiness",,,,,
481517887757484035,132278386,senatorbarb,Twitter Web Client,2014-06-24 19:23:05,8,7,"50 yrs after Civil Rights Act signed into law, we must renew &amp; reinvigorate our fight to break down barriers of injustice.",,,,,
481517782874730496,132278386,senatorbarb,Twitter Web Client,2014-06-24 19:22:40,3,5,Long-overdue &amp; well-deserved award recognizes monumental impact of Dr. King &amp; his march towards freedom &amp; equality for all.,,,,,
481517479026769920,132278386,senatorbarb,Twitter Web Client,2014-06-24 19:21:27,1,4,"Today as Congressional Gold Medal awarded to Dr. Martin Luther King &amp; his wife Coretta, we reflect on 50 yrs of historic Civil Rights Act.",,,,,
481440145485209600,132278386,senatorbarb,Twitter for iPhone,2014-06-24 14:14:10,4,3,Judiciary received letter of support from 79 members of legal community expressing united admiration for nomination. http://t.co/ZCjEVDNoij,,,,,
481439995878588416,132278386,senatorbarb,Twitter for iPhone,2014-06-24 14:13:34,2,2,"Pamela is a brilliant litigator, professor, public servant &amp; proud MDer who is well suited for the job.",,,,,
481439901020192768,132278386,senatorbarb,Twitter for iPhone,2014-06-24 14:13:11,6,1,"Today at 10:15am Senate hearing, will intro MDer Pamela Harris-nominee to serve on 4th Circuit Court of Appeals WATCH http://t.co/caghhmFmmW",,,,,
481193722496155648,132278386,senatorbarb,Twitter Web Client,2014-06-23 21:54:58,3,1,Will continue to fight for funds in  federal checkbook to support justice programs protecting kids &amp; families.,,,,,
481193634851999745,132278386,senatorbarb,Twitter Web Client,2014-06-23 21:54:37,3,0,Operation Cross Country shows what can be accomplished w government working to keep our kids safe.,,,,,
481193500244185089,132278386,senatorbarb,Twitter Web Client,2014-06-23 21:54:05,11,11,"So proud of @FBI working w state, local police &amp; @MissingKids who rescued 168 exploited kids from prostitution rings. http://t.co/Pm9Bn906k6",,,,,
480796687523672064,132278386,senatorbarb,Twitter for iPhone,2014-06-22 19:37:17,5,4,"On 5th anniversary of deadly metro crash, thoughts are w victims families remembering their loved ones.",,,,,
479628941687128066,132278386,senatorbarb,Twitter for iPhone,2014-06-19 14:17:05,5,0,RT @SenateApprops: At 10:30 @SenatorBarb will hold a full committee markup of FY15 SFOPS &amp; Leg Branch #appropriations bills. Listen: http:/…,,,479628414266380288,352534407,SenateApprops
479321774380040192,132278386,senatorbarb,Twitter Web Client,2014-06-18 17:56:31,7,6,If you gather evidence – then test &amp; use it to prosecute sexual predators &amp; stand up for victims who need gov’t on their side.,,,,,
479321666393489408,132278386,senatorbarb,Twitter Web Client,2014-06-18 17:56:05,17,12,"Rape victims shouldn’t be double assaulted! First by predator who attacked them, then by lackluster criminal justice! http://t.co/NlanUTL5V7",,,,,
479321370757980160,132278386,senatorbarb,Twitter Web Client,2014-06-18 17:54:54,2,2,Bill meets compelling human need addressing backlog of sexual assault kits kept in lab storage or at police departments,,,,,
479321266122657793,132278386,senatorbarb,Twitter Web Client,2014-06-18 17:54:29,16,19,I’m leading charge for passage of my CJS funding bill to take on sexual assault &amp; violence against women. http://t.co/9xihm4WISg,,,,,
478960675256303616,132278386,senatorbarb,Twitter Web Client,2014-06-17 18:01:38,16,8,"Evidence must be processed, cases investigated, criminals punished &amp; victims provided services they need to help rebuild lives.",,,,,
478960583749152769,132278386,senatorbarb,Twitter Web Client,2014-06-17 18:01:16,32,26,I’m fighting for funds in CJS bill to clear backlog of sex assault kit testing &amp; bring criminals to justice. http://t.co/CKPZWt8aR8 #VAWA,,,,,
478960108962328576,132278386,senatorbarb,Twitter Web Client,2014-06-17 17:59:23,19,18,Outrageous that 10s of thousands untested sex assault kits sitting in crime labs or police lockers. Victims must know they're not forgotten.,,,,,
478959846013009920,132278386,senatorbarb,Twitter Web Client,2014-06-17 17:58:20,72,50,No woman in America should live in fear of being assaulted or abused. Those that are need a gov’t on their side as they seek justice.,,,,,
478899730706358273,132278386,senatorbarb,Twitter Web Client,2014-06-17 13:59:27,7,3,As families &amp; communities work to recover &amp; rebuild they need a gov't on their side. I’m at the ready should federal assistance be requested,,,,,
478899546400243712,132278386,senatorbarb,Twitter Web Client,2014-06-17 13:58:44,3,3,Thank you to 1st responders who selflessly helped residents prepare for worst &amp; evacuate to safety those in danger.,,,,,
478898998615760897,132278386,senatorbarb,Twitter Web Client,2014-06-17 13:56:33,6,2,"Western MD communities like Clear Spring subjected to destruction &amp; devastation of severe flooding, uprooting lives. http://t.co/3tBqwuQyIi",,,,,
478609245550940161,132278386,senatorbarb,Twitter Web Client,2014-06-16 18:45:10,9,4,"By giving our teachers the tools they need in the classroom, we’ll better prepare MD students for successful futures.",,,,,
478609154584887297,132278386,senatorbarb,Twitter Web Client,2014-06-16 18:44:49,8,7,.@PGCPS &amp; @DiscoveryEd public/private partnership of continued teacher development &amp; digital resources will better prepare teachers. #depd,,,,,
478609039669329921,132278386,senatorbarb,Twitter Web Client,2014-06-16 18:44:21,12,9,"Every student, regardless of zip code, should have access to America’s opportunity ladder through quality education.",,,,,
