id,user_id,screen_name,source,created_at,retweet_count,favorite_count,text,in_reply_to_screen_name,in_reply_to_status_id,retweeted_status_id,retweeted_status_user_id,retweeted_status_screen_name
127072077143478272,20597460,senbillnelson,TweetDeck,2011-10-20 17:21:58,12,1,"With Libya’s dictator reported dead, it’s very important that we help the transitional government secure and destroy weapons stockpiles.",,,,,
125997906942631936,20597460,senbillnelson,TweetDeck,2011-10-17 18:13:36,10,0,"Let’s also remember St. Pete IndyCar driver Dan Wheldon for his work with at-risk youth, the elderly and our soldiers. http://t.co/lq1DgwOL",,,,,
124900178678390784,20597460,senbillnelson,TweetDeck,2011-10-14 17:31:37,4,0,I hope you’ll read an op-ed column I co-authored with @eltonjohndotcom.  http://t.co/ABx6JEwl,,,,,
118339235374825472,20597460,senbillnelson,TweetDeck,2011-09-26 15:00:47,16,1,Want to know why the price of basic items like gasoline and bread keeps going up?  Read this: http://t.co/b6V4YfA0,,,,,
113673118295392256,20597460,senbillnelson,TweetDeck,2011-09-13 17:59:18,3,3,Closing tax loopholes will help U.S. get finances in order. See former Fed chief Greenspan & others testify live. http://t.co/b1sd2HG,,,,,
113278736752848896,20597460,senbillnelson,TweetDeck,2011-09-12 15:52:10,10,2,Chairing hearing tomorrow on how to pull U.S. out of financial doldrums. Look for ex-Fed chief Greenspan to paint dismal picture of economy.,,,,,
112275252842729472,20597460,senbillnelson,TweetDeck,2011-09-09 21:24:40,5,0,Here is a list of some of the events going on in Florida this weekend as we remember the victims of 9-11: http://t.co/pUW0fqK,,,,,
101298428558053376,20597460,senbillnelson,TweetDeck,2011-08-10 14:26:42,15,5,There’s no mystery about what we have to do to get out of this financial fix.  http://politi.co/qQ5EvQ,,,,,
99516208923152385,20597460,senbillnelson,TweetDeck,2011-08-05 16:24:47,0,2,Hope you’re able to watch the launch: http://1.usa.gov/nr3wv,,,,,
99476019236446209,20597460,senbillnelson,TweetDeck,2011-08-05 13:45:05,14,1,"T-minus 1 hour and 49 minutes – and, we’re going to Jupiter.  http://bit.ly/priZr6",,,,,
99204251435278338,20597460,senbillnelson,TweetDeck,2011-08-04 19:45:11,15,1,Breaking news: Deal reached to fix #FAA. http://n.pr/pV972x,,,,,
99148089205592065,20597460,senbillnelson,TweetDeck,2011-08-04 16:02:01,4,0,The winner of this competition will be America: http://bit.ly/oh3BI4,,,,,
98865661765357568,20597460,senbillnelson,TweetDeck,2011-08-03 21:19:45,3,0,You ought to read this story if you have a minute … http://bit.ly/oHqlcF,,,,,
98461072830377985,20597460,senbillnelson,TweetDeck,2011-08-02 18:32:03,5,0,"Holy Toledo!  We just went over 18,000 followers.",,,,,
98454074449600512,20597460,senbillnelson,TweetDeck,2011-08-02 18:04:15,15,1,"We got a debt deal done. Next up: jobs. Then, we’ve got to get rid of some of the unfair corporate tax loopholes.",,,,,
98090368670765056,20597460,senbillnelson,TweetDeck,2011-08-01 17:59:00,14,0,You will see this new debt plan pass with an overwhelming bipartisan majority in the Senate.,,,,,
98053034743046144,20597460,senbillnelson,TweetDeck,2011-08-01 15:30:39,15,1,"This is going to cut almost $3 trillion from the deficit.  It’s not a perfect plan, but it’s something we need to have right now.",,,,,
96988860369731585,20597460,senbillnelson,TweetDeck,2011-07-29 17:02:00,17,3,"I’m just a little country boy, but seems to me a solution to the #debt is right under our nose: http://politi.co/qIGu1V",,,,,
96251486673182720,20597460,senbillnelson,TweetDeck,2011-07-27 16:11:57,12,3,"I favor a #debt plan that includes $2.7 trillion in savings and cuts, while protecting #SocialSecurity and #Medicare. http://usat.ly/pDmAAz",,,,,
94521037739405313,20597460,senbillnelson,TweetDeck,2011-07-22 21:35:46,35,2,Was 105 in D.C. today. Only 83 right now in Tampa. Never thought you’d have to go to FL to cool off during the summer.,,,,,
94024111029882880,20597460,senbillnelson,TweetDeck,2011-07-21 12:41:09,25,2,"Welcome home #Atlantis.  Though we’ll not again explore on a shuttle’s wings, we won’t stop reaching as long as there are stars.",,,,,
91216544062906368,20597460,senbillnelson,TweetDeck,2011-07-13 18:44:53,6,2,"This might be a way to protect vital payments, like Social Security, if partisanship leads country to default: http://1.usa.gov/qsZz7y",,,,,
90499719670927360,20597460,senbillnelson,TweetDeck,2011-07-11 19:16:29,49,2,BP now wants to limit spill claims? It’s the citizenry that needs to be protected from BP. Not the other way around.  http://wapo.st/qFNfC8,,,,,
89373056736296961,20597460,senbillnelson,TweetDeck,2011-07-08 16:39:31,24,4,"Today marks the end of one era, the beginning of the next. Soon #NASA will build a new monster rocket that will help get us to Mars.",,,,,
89357949012676608,20597460,senbillnelson,TweetDeck,2011-07-08 15:39:29,15,1,Main engine cutoff. #STS135 performing perfectly. #Atlantis crew taking one more step toward our understanding of the universe.,,,,,
89355411722997760,20597460,senbillnelson,TweetDeck,2011-07-08 15:29:24,21,0,"Go, #Atlantis.  Go.  Go ...",,,,,
89353993003872256,20597460,senbillnelson,TweetDeck,2011-07-08 15:23:46,46,2,"I remember my launch. Strapped in, hanging on. When those solid rocket engines light off – right then you know you’re going somewhere. #NASA",,,,,
89337576980348928,20597460,senbillnelson,TweetDeck,2011-07-08 14:18:32,7,0,At KSC for #Atlantis.  All eyes turned skyward as our astronauts get ready for #STS135 launch.,,,,,
88323940228939776,20597460,senbillnelson,TweetDeck,2011-07-05 19:10:42,11,0,Do you support closing tax breaks for big business if it helps avoid cuts in #SocialSecurity and #Medicare?  http://billnelson.senate.gov/,,,,,
83569648938921984,20597460,senbillnelson,TweetDeck,2011-06-22 16:18:51,21,1,"Census shows FL at 18.8 M poised to top 3rd biggest state NY at 19.4. RT to help us catch Sen. Gillibrand, who’s up by only 1,973 followers.",,,,,
82903514560466944,20597460,senbillnelson,TweetDeck,2011-06-20 20:11:52,6,2,"Obama, Oprah among most civil in uncivil America, says a new survey that names the most rude.  http://politi.co/lzv8vy",,,,,
81089836248862720,20597460,senbillnelson,TweetDeck,2011-06-15 20:04:58,4,0,Smoke on the water. http://1.usa.gov/6lTdUW,,,,,
78227369177001984,20597460,senbillnelson,TweetDeck,2011-06-07 22:30:32,4,0,What do you think most folks say is the biggest threat to America right now? http://1.usa.gov/6lTdUW,,,,,
70983427368828928,20597460,senbillnelson,TweetDeck,2011-05-18 22:45:42,20,0,"Looks like Jacksonville is getting a bold new leader in my good friend, Alvin Brown.  http://bit.ly/jDTjjH",,,,,
70122941429452801,20597460,senbillnelson,TweetDeck,2011-05-16 13:46:26,5,2,Endeavour is on its way.  One more step in our long journey.,,,,,
68803222424403968,20597460,senbillnelson,TweetDeck,2011-05-12 22:22:21,19,2,Taxpayers facing maybe 29 percent of tab for Gulf oil-spill cleanup: http://bit.ly/m8UceG,,,,,
68756627079172096,20597460,senbillnelson,TweetDeck,2011-05-12 19:17:11,52,3,"Just saw Usama death photos at CIA.  While the job of fighting terrorists isn’t finished, bin Laden is.",,,,,
68673233938952192,20597460,senbillnelson,TweetDeck,2011-05-12 13:45:49,15,1,‘am about to question oil co. execs about the price of gasoline,,,,,
65835986785021952,20597460,senbillnelson,TweetDeck,2011-05-04 17:51:37,8,1,"So, Pakistan really didn’t know bin Laden was hiding in plain sight?  My response to reporters on what all this means: http://bit.ly/khsZaV",,,,,
65068486170386432,20597460,senbillnelson,TweetDeck,2011-05-02 15:01:50,10,2,Finally. We cut off the head of the snake. http://www.cnn.com/2011/WORLD/asiapcf/05/01/bin.laden.us.reacts/index.html,,,,,
63332859204747264,20597460,senbillnelson,TweetDeck,2011-04-27 20:05:04,5,0,Today we lost one of the best public servants I’ve known.  Patsy Kurth also was a wonderful mother to four daughters. http://bit.ly/jMcUFi,,,,,
57864755897044992,20597460,senbillnelson,TweetDeck,2011-04-12 17:56:47,7,0,Atlantis is coming home to Kennedy after traveling roughly 120 million miles. http://bit.ly/gpvBJ4,,,,,
56457758920286209,20597460,senbillnelson,Twitter Web Client,2011-04-08 20:45:53,16,0,RT @learyspt: Sen. Bill Nelson says he would donate any salary earned during shutdown to charity.,,,56446096624455680,74241914,learyspt
55678490963488768,20597460,senbillnelson,TweetDeck,2011-04-06 17:09:21,10,1,Let us know whether you think the threat of a government shut-down is a partisan political ploy: http://1.usa.gov/6lTdUW,,,,,
53493152593616897,20597460,senbillnelson,TweetDeck,2011-03-31 16:25:36,2,0,Friday forecast for Orlando: Mostly sunny skies with a good chance of parachutes? http://bit.ly/gzxkXY,,,,,
53183293356654593,20597460,senbillnelson,TweetDeck,2011-03-30 19:54:19,9,1,Maybe our plan for reducing dependence on foreign oil will finally go somewhere now.      http://1.usa.gov/hVcY38,,,,,
48863402784858112,20597460,senbillnelson,TweetDeck,2011-03-18 21:48:37,7,1,I guess these tax cheats figure they have nothing to lose: http://bit.ly/9JWrMV,,,,,
47678882429673472,20597460,senbillnelson,TweetDeck,2011-03-15 15:21:46,32,2,Oil prices should not be dictated by speculators http://1.usa.gov/g8jsxR,,,,,
46346138122600449,20597460,senbillnelson,TweetDeck,2011-03-11 23:05:55,45,2,Florida’s chances of getting high-speed rail are still alive  http://bit.ly/gPMdqx,,,,,
45614935543263233,20597460,senbillnelson,TweetDeck,2011-03-09 22:40:22,3,0,I'm very proud of my former legislative director  http://1.usa.gov/eJcpF5,,,,,
43400351507939329,20597460,senbillnelson,TweetDeck,2011-03-03 20:00:24,21,1,Watch live as the future of Florida’s high-speed rail is argued before the state Supreme Court starting at 3 p.m. http://bit.ly/fDhhVt,,,,,
43384442210893824,20597460,senbillnelson,TweetDeck,2011-03-03 18:57:11,4,1,Should the U.S. and its allies intervene in Libya?  http://bit.ly/6lTdUW,,,,,
43004592543375360,20597460,senbillnelson,TweetDeck,2011-03-02 17:47:48,7,0,This legislation would show you the money - http://bit.ly/9JWrMV,,,,,
42719374125182976,20597460,senbillnelson,TweetDeck,2011-03-01 22:54:27,30,1,All aboard - next stop for the bullet train: Florida Supreme Court http://bit.ly/fO7CMY,,,,,
40872274374426624,20597460,senbillnelson,TweetDeck,2011-02-24 20:34:44,18,1,"You can offer someone an opportunity, but you cannot make them take it.  http://bit.ly/eVfD66",,,,,
37981564046417920,20597460,senbillnelson,Twitter Web Client,2011-02-16 21:08:05,65,4,Someone just asked: you looking for a way to sidestep Gov. Scott on his decision to kill high-speed rail? Yep. http://youtu.be/WcqIK0VziDI,,,,,
37911878025871360,20597460,senbillnelson,Twitter Web Client,2011-02-16 16:31:10,133,11,"If Florida would’ve had a governor who rejected President Eisenhower’s idea, we wouldn’t have an interstate system. http://bit.ly/g0gXyT",,,,,
37619072019472384,20597460,senbillnelson,Twitter Web Client,2011-02-15 21:07:40,6,0,"Remembering the lady who reached for the sun, and the contributions of many others http://bit.ly/fHNt5M",,,,,
37534541040058369,20597460,senbillnelson,Twitter Web Client,2011-02-15 15:31:46,3,0,Sad news out of Palm Coast about Dalai Lama's nephew http://bit.ly/hkm92V,,,,,
35462394088005632,20597460,senbillnelson,Twitter Web Client,2011-02-09 22:17:48,4,0,Agreed! RT@chuckgrassley: Talked algae/corn ethanol during Finance Comm. Need 2 support 1st & 2nd gen of ethanol http://tinyurl.com/6x3su5x,,,,,
32205738122149888,20597460,senbillnelson,Twitter Web Client,2011-01-31 22:37:00,24,2,Mubarak will have to go… http://bit.ly/dYFauU,,,,,
32140845272530944,20597460,senbillnelson,Twitter Web Client,2011-01-31 18:19:09,4,0,Situation in Egypt is right on the edge – and things could go either way. http://youtu.be/Db2fsgX-od8,,,,,
31025531516354561,20597460,senbillnelson,Twitter Web Client,2011-01-28 16:27:17,6,0,Sacrificed lives remind us that we must press on http://bit.ly/eEz97W,,,,,
30768379585368064,20597460,senbillnelson,Twitter Web Client,2011-01-27 23:25:27,7,2,Given the recent rash of police shootings it’s clear law enforcement could use some more tools when they go on manhunts http://bit.ly/fjRRsH,,,,,
29982565595095040,20597460,senbillnelson,Twitter Web Client,2011-01-25 19:22:55,3,0,In what ways has the “Great Recession” most directly affected you? Let me know http://billnelson.senate.gov/,,,,,
28231837151137793,20597460,senbillnelson,Twitter Web Client,2011-01-20 23:26:09,6,1,I think US-China deal is kinda fuzzy http://wapo.st/ijSQwE,,,,,
25646223184625665,20597460,senbillnelson,Twitter Web Client,2011-01-13 20:11:50,1,0,A new poll’s been posted on my website where you can share your view of the president's speech last night.  http://billnelson.senate.gov/,,,,,
25275531020730368,20597460,senbillnelson,Twitter Web Client,2011-01-12 19:38:50,6,1,I think we have to end excessive speculation because it runs up the cost of oil and food. Regulators to discuss in a.m. http://bit.ly/fNFcBf,,,,,
25211720540626945,20597460,senbillnelson,Twitter Web Client,2011-01-12 15:25:17,8,0,Today we pray for Haiti and renew our commitment to helping our neighbor in need http://bit.ly/hPTKBw,,,,,
22399713948999680,20597460,senbillnelson,Twitter Web Client,2011-01-04 21:11:22,15,1,I think total repeal of the health-care law will hurt seniors and others http://bit.ly/ecJjMD,,,,,
22001327882108928,20597460,senbillnelson,Twitter Web Client,2011-01-03 18:48:19,3,0,Just posted a new poll on my website about the cause of rising gas prices. Weigh in - http://billnelson.senate.gov/,,,,,
17950132985143298,20597460,senbillnelson,Twitter Web Client,2010-12-23 14:30:19,4,1,Started a poll on my website. First one shows folks by 55-45 don’t yet trust the stock market. Weigh in - http://billnelson.senate.gov/,,,,,
15105784555773952,20597460,senbillnelson,Twitter Web Client,2010-12-15 18:07:54,4,1,check this out: http://www.fpl.com/environment/plant/riviera_cam.shtml,,,,,
12941569954947072,20597460,senbillnelson,Twitter Web Client,2010-12-09 18:48:05,15,1,Looks like Santa's trading in his sleigh for a bullet train http://bit.ly/hJCXlF,,,,,
12600770956365825,20597460,senbillnelson,Twitter Web Client,2010-12-08 20:13:52,10,0,"While we’re sad to see him go, the glory Urban brought to the Gator nation won’t soon be forgotten http://bit.ly/fhzrIw",,,,,
12567515104280576,20597460,senbillnelson,Twitter Web Client,2010-12-08 18:01:43,6,0,"Remembering John Lennon on the 30th anniversary of his death, my favorite Fab Four song is “I want to hold your hand.”  What’s yours?",,,,,
9732160424513536,20597460,senbillnelson,Twitter Web Client,2010-11-30 22:15:02,2,0,Some folks tell me Miss Florida looks a lot like… who? http://bit.ly/epsBzs,,,,,
5402687956848640,20597460,senbillnelson,Twitter Web Client,2010-11-18 23:31:15,3,0,Who knew? LSU’s football team and I have something in common - we’re both #5 in the polls! http://bit.ly/b4VQU8,,,,,
28710710290,20597460,senbillnelson,Twitter Web Client,2010-10-25 17:26:17,17,3,Fantastic news for Florida - http://bit.ly/cdSLX3. Now we are full speed ahead with high-speed rail construction.,,,,,
26015942954,20597460,senbillnelson,Twitter Web Client,2010-09-30 21:23:17,7,1,Some good news from the IRS today for homeowners who have defective drywall - http://bit.ly/9saqXW,,,,,
24408429174,20597460,senbillnelson,Twitter Web Client,2010-09-13 19:18:48,4,0,I happen to love launch photos and Matt Walsh sent me this one. Check it out - http://on.natgeo.com/aLxOBC,,,,,
22009176156,20597460,senbillnelson,Twitter Web Client,2010-08-24 15:27:52,10,0,Phenomenal  – AP’s reporting Florida’s a big winner for school reform money http://bit.ly/arSQ2m,,,,,
20808371366,20597460,senbillnelson,Twitter Web Client,2010-08-10 16:39:34,8,0,Brought federal pay czar Feinberg to the Panhandle today to meet with folks about their oil spill claims http://TwitPWR.com/Ntv/,,,,,
20156014321,20597460,senbillnelson,Twitter Web Client,2010-08-02 17:43:28,9,1,The ‘Glades remains at risk and should’ve never been removed in the first place – http://bit.ly/9euEil,,,,,
19766200175,20597460,senbillnelson,Twitter Web Client,2010-07-28 19:56:21,10,1,Got two thumbs up today from a key Senate panel on my plan for giving Gulf residents oversight of oil drilling http://bit.ly/dftX8a,,,,,
19106651119,20597460,senbillnelson,Twitter Web Client,2010-07-21 21:28:26,3,1,Met w pay czar Feinberg – pushed for oil-spill claims center to be in NW FL Sallie Mae bldg & hiring their workers http://bit.ly/cXcUP0,,,,,
19011946448,20597460,senbillnelson,Twitter Web Client,2010-07-20 17:58:40,2,1,Hearing starts in an hour on Gen. Clapper for intelligence chief - expect a few questions about Washington Post series http://bit.ly/bci63J,,,,,
18616459547,20597460,senbillnelson,Twitter Web Client,2010-07-15 16:55:47,34,6,We have liftoff: Senate committee passes plan to keep U.S. global leader in space http://bit.ly/acnmyd,,,,,
18530323284,20597460,senbillnelson,Twitter Web Client,2010-07-14 16:08:04,6,0,I would’ve gotten at least one question right - if I’d’ve been on Jeopardy Monday night. http://bit.ly/d50DKW (See: Just a Bill for $800),,,,,
17509920414,20597460,senbillnelson,Twitter Web Client,2010-07-01 17:53:32,6,1,Some counties wondering why they didn’t get more out of the $50 million BP gave Florida http://billnelson.senate.gov/news/CristLetter.pdf,,,,,
17370596318,20597460,senbillnelson,Twitter Web Client,2010-06-29 23:30:12,2,0,Robert Byrd always put public service ahead of personal fortune.  http://www.youtube.com/watch?v=PMs93QzG2AM,,,,,
17368183556,20597460,senbillnelson,Twitter Web Client,2010-06-29 22:47:24,27,2,Just handed BP a past-due notice on some $7 million it owes FL for oil spill cleanup costs  http://bit.ly/bVhGRl,,,,,
17360931418,20597460,senbillnelson,Twitter Web Client,2010-06-29 20:29:34,36,4,"“No drilling off Florida, period,” is what I told the White House today. http://bit.ly/aUCee3",,,,,
17256800406,20597460,senbillnelson,Twitter Web Client,2010-06-28 14:55:35,9,1,"Sen. Byrd gave his all - to his wife Erma, to the people of West Virginia and America, and to the U.S. Senate.",,,,,
17041859629,20597460,senbillnelson,Twitter Web Client,2010-06-25 20:31:11,9,0,Brewing Gulf gale could leave twice as much oil to clean up.  http://bit.ly/c7Hxpj,,,,,
16878097389,20597460,senbillnelson,Twitter Web Client,2010-06-23 21:22:32,10,1,"I’m sure there will be criticism, but Obama had no choice but to accept McChrystal’s resignation. And picking Petraeus was a great move.",,,,,
16177805126,20597460,senbillnelson,Twitter Web Client,2010-06-14 21:38:06,42,4,Surveyed waters off Pensacola today. Orange gunk all over. This is not only a disaster – it’s a crime. http://bit.ly/aT6Gcs,,,,,
15859980329,20597460,senbillnelson,Twitter Web Client,2010-06-10 16:00:16,16,3,Feds didn’t alert FL yesterday when they boomed state waters due to oil contamination. Hear what I think about that http://bit.ly/dAFDQ7,,,,,
14865027919,20597460,senbillnelson,Twitter Web Client,2010-05-27 23:00:43,13,2,Fed transportation czar today gave Florida the first multi-million dollar installment for high speed rail. http://bit.ly/9zH53D,,,,,
14849175541,20597460,senbillnelson,Twitter Web Client,2010-05-27 17:38:57,7,1,Latest News: Experts now say Gulf leak is nation's worst spill - far bigger than Exxon Valdez http://bit.ly/d6Jhgx,,,,,
14794071909,20597460,senbillnelson,Twitter Web Client,2010-05-26 23:01:44,8,1,Next hours are critical as BP aims to plug gushing oil well.  Come with me once more – live from one-mile down http://billnelson.senate.gov/,,,,,
14789436931,20597460,senbillnelson,Twitter Web Client,2010-05-26 21:30:12,14,2,I wrote Obama today to say I’m sure Congress will fund an extra space shuttle flight http://bit.ly/9nmNzF,,,,,
14784250439,20597460,senbillnelson,Twitter Web Client,2010-05-26 19:44:23,19,3,It’s time to close the revolving door between regulators and Big Oil once-and-for-all - I’m filing legislation http://bit.ly/cOwE7V,,,,,
14697429340,20597460,senbillnelson,Twitter Web Client,2010-05-25 14:48:04,14,1,New investigation confirms drilling regulators buddy-buddy with Big Oil.  Read it here - http://billnelson.senate.gov/news/IGreport.pdf,,,,,
14624636458,20597460,senbillnelson,Twitter Web Client,2010-05-24 13:57:41,4,1,My angel (Grace) and I are overjoyed. Our daughter has found her Mr. Right. http://bit.ly/bi4S8w,,,,,
14455317656,20597460,senbillnelson,Twitter Web Client,2010-05-21 22:07:02,13,2,Just posted new never-before-seen BP video footage of robots working a mile underwater at oil spill site http://bit.ly/bmowCj,,,,,
14375823440,20597460,senbillnelson,Twitter Web Client,2010-05-20 17:40:41,18,3,"Come with me - live from one-mile down, under the Gulf, at the oil spill - http://billnelson.senate.gov/",,,,,
14310885117,20597460,senbillnelson,Twitter Web Client,2010-05-19 19:04:04,20,1,"Interior Dept. chief yesterday said there are some bad apples among the oil regulators.  To me, it looks like an orchard!",,,,,
14244742764,20597460,senbillnelson,Twitter Web Client,2010-05-18 19:09:19,15,1,Have put a bunch more BP video on my site http://bit.ly/d80zfB and on my youtube channel at http://bit.ly/avEN5L,,,,,
14240341400,20597460,senbillnelson,Twitter Web Client,2010-05-18 17:33:02,28,2,Previously unseen footage of BP well leak now available on my website - http://bit.ly/dtYiQD,,,,,
14234852980,20597460,senbillnelson,Twitter Web Client,2010-05-18 15:47:02,16,2,Got word this am BP will bring more underwater video of oil spill to our 2:30 Commerce hearing. http://bit.ly/bKPOQc,,,,,
13993302936,20597460,senbillnelson,Twitter Web Client,2010-05-14 19:31:20,6,0,Playing Hardball with Chris Matthews at 5 p.m. – hope we get to talk about oil regulators ignoring safety and environmental concerns.,,,,,
13977558013,20597460,senbillnelson,Twitter Web Client,2010-05-14 13:53:38,13,1,"We’ve got to stop this - experts now say spill is much worse than thought, while BP chief says it’s “relatively tiny.” Unbelievable!",,,,,
13929631387,20597460,senbillnelson,Twitter Web Client,2010-05-13 19:08:53,68,7,Senator from Alaska just sandbagged my bill to hold BP accountable for up to $10 billion for the oil spill.,,,,,
13865392362,20597460,senbillnelson,Twitter Web Client,2010-05-12 18:34:49,3,0,My hearing on the future of space program about to get started with Neil Armstrong and others - watch it live here http://bit.ly/bO7eHL,,,,,
13860811306,20597460,senbillnelson,Twitter Web Client,2010-05-12 16:51:34,5,2,USA Today supports offshore drilling expansion – I’m glad they invited me to share my opposing view http://bit.ly/am6EsH,,,,,
13805722090,20597460,senbillnelson,Twitter Web Client,2010-05-11 19:42:36,34,3,"Word is climate bill might let rigs in Florida’s no-drill zone. If Sens. Kerry, Lieberman are following me on Twitter: that’s a non starter.",,,,,
13798523915,20597460,senbillnelson,Twitter Web Client,2010-05-11 16:59:24,23,0,"Ban, baby, ban – that’s what I’ve asked Gov. Crist to do about any new drilling off FL. http://bit.ly/ayQnig",,,,,
13789127849,20597460,senbillnelson,Twitter Web Client,2010-05-11 13:41:06,10,1,Have been invited to testify in Senate today about the oil rig explosion.  You can read my prepared remarks here - http://bit.ly/99UcDO,,,,,
13749353446,20597460,senbillnelson,Twitter Web Client,2010-05-10 21:42:55,16,0,"Injecting golf balls into well isn’t reassuring that BP has a plan to stop oil slick, which could hit FL in 10 days http://bit.ly/bZnyrC",,,,,
13736088833,20597460,senbillnelson,Twitter Web Client,2010-05-10 16:51:42,2,1,The first man on the moon makes a very rare public appearance here Wednesday at a hearing I’m chairing on the future of our space program.,,,,,
13728986808,20597460,senbillnelson,Twitter Web Client,2010-05-10 14:16:50,13,0,"Mtg w officials in South FL in a bit - if BP doesn’t get this well capped, oil is going to cover the whole Gulf coast. http://bit.ly/bS40PG",,,,,
13385359655,20597460,senbillnelson,Twitter Web Client,2010-05-04 21:28:43,14,1,About to meet with BP execs in my office - hopefully we’ll find out when they’ll be able to stop this underwater volcano.,,,,,
13365137489,20597460,senbillnelson,Twitter Web Client,2010-05-04 13:40:33,4,1,Meeting on oil spill  with BP execs today at 5 p.m.  http://bit.ly/dnYCNA,,,,,
13314058937,20597460,senbillnelson,Twitter Web Client,2010-05-03 16:30:35,14,3,This oil spill is our worst nightmare come true. I’m asking for investigation of lobbying on safety rules by Big Oil http://bit.ly/b4aNjX,,,,,
13313319499,20597460,senbillnelson,Twitter Web Client,2010-05-03 16:14:51,1,1,"Went over 10,000 followers on Friday.  Thanks to y’all for getting the word out – and hello to our new followers!",,,,,
13032254787,20597460,senbillnelson,Twitter Web Client,2010-04-28 22:34:46,9,2,"Holy cow – only need 43 more to hit 10,000 followers… help spread the word and put me over the top!",,,,,
13020789511,20597460,senbillnelson,Twitter Web Client,2010-04-28 18:21:08,2,0,http://bit.ly/92rNtr,,,,,
13020773923,20597460,senbillnelson,Twitter Web Client,2010-04-28 18:20:46,6,1,Got favorable response today to my request for a congressional probe of oil industry’s claims that it’s safe enough to drill near florida.,,,,,
12959456666,20597460,senbillnelson,Twitter Web Client,2010-04-27 18:54:43,1,1,"So far partisanship has kept us from considering Wall Street reform.  Hopefully, we can break the divide.  http://bit.ly/cheB76",,,,,
12888289674,20597460,senbillnelson,Twitter Web Client,2010-04-26 15:14:04,0,0,touring st. joseph’s children’s hospital in tampa.  anytime you want a lesson in hope – just visit some of the kids here.,,,,,
12718396210,20597460,senbillnelson,Twitter Web Client,2010-04-23 18:47:44,1,0,"Based on all the tweets yesterday, nobody saw Denver coming! http://bit.ly/d8Ree7",,,,,
