id,user_id,screen_name,source,created_at,retweet_count,favorite_count,text,in_reply_to_screen_name,in_reply_to_status_id,retweeted_status_id,retweeted_status_user_id,retweeted_status_screen_name
623897656830599168,20597460,senbillnelson,Twitter Web Client,2015-07-22 16:49:27,32,0,RT @AndyMarlette: New cartoon: @SenBillNelson whoops cancer. Toughest man in the Sunshine State? #sayfie #FlaPol http://t.co/66WNtooAqo,,,623865677468823553,772190557,AndyMarlette
623495357863993344,20597460,senbillnelson,Twitter Web Client,2015-07-21 14:10:51,2,6,I'm sorry Dr. Claudia Alexander isn't with us to see all these Pluto pix. The NASA trailblazer passed away July 11: http://t.co/gLG7qqvBIK,,,,,
623276757295230981,20597460,senbillnelson,Twitter for iPhone,2015-07-20 23:42:13,14,15,Today marks 46 years since first human on moon. http://t.co/11Ejl6SzpR,,,,,
621753052660371457,20597460,senbillnelson,Twitter Web Client,2015-07-16 18:47:34,18,0,RT @amyklobuchar: Introduced bill with @SenBillNelson to crack down on caller ID fraud and phone scams by giving consumers new tools to pro…,,,621708612012867584,33537967,amyklobuchar
621348190831439872,20597460,senbillnelson,Twitter Web Client,2015-07-15 15:58:47,46,42,Congratulations to @NASA on its unmanned mission to the edge of our solar system. Now let's send humans to Mars.,,,,,
618828807387119616,20597460,senbillnelson,Twitter Web Client,2015-07-08 17:07:39,75,35,"Three major computer malfunctions on same day give appearance of an attack, serve as reminder Congress must pass a cybersecurity bill",,,,,
616336380159987712,20597460,senbillnelson,TweetDeck,2015-07-01 20:03:38,25,22,"On highway today and reminded why I don’t like idea of allowing longer, heavier trucks. Here’s DOT’s study on it: http://t.co/ilzB5kFth0",,,,,
615187210787246080,20597460,senbillnelson,Twitter Web Client,2015-06-28 15:57:15,45,62,What happened today is why I hold my breath and say a little prayer every time we launch a big rocket.,,,,,
614460474013433856,20597460,senbillnelson,Twitter Web Client,2015-06-26 15:49:27,19,54,The Supreme Court has ruled and gay marriage is the law of the land. I support this decision.,,,,,
614167064975155200,20597460,senbillnelson,Twitter Web Client,2015-06-25 20:23:33,20,24,"Hopefully, extremists will now stop trying to dismantle the Affordable Care Act and instead join us in trying to improve it where needed.",,,,,
611275350367174656,20597460,senbillnelson,Twitter Web Client,2015-06-17 20:52:55,7,0,RT @abcactionnews: Here's the video. @SenBillNelson is a pushups champ.   Thanks for a great season #TampaBayLightning  https://t.co/7eQbOU…,,,611264528064446464,15138087,abcactionnews
606135211659821056,20597460,senbillnelson,Twitter Web Client,2015-06-03 16:27:50,3,0,"RT @LedgeKing: As added bonus in hockey wager between .@SenBillNelson &amp; .@SenatorDurbin, loser does # of pushups equal to total # of goals …",,,606124831130718208,20086363,LedgeKing
601434609079816192,20597460,senbillnelson,Twitter Web Client,2015-05-21 17:09:19,24,14,Florida is again under siege from Big Oil. http://t.co/9JXCSn0OdK,,,,,
592800454519738369,20597460,senbillnelson,Twitter Web Client,2015-04-27 21:20:16,20,18,UCF for 2nd year in a row wins national title in cyber-defense competition. http://t.co/Cq0NoJ11Di,,,,,
588088470452699139,20597460,senbillnelson,Twitter Web Client,2015-04-14 21:16:32,15,9,Castro should not be rewarded while there are ongoing human rights violations in Cuba. http://t.co/nMXvnBIiQF,,,,,
587689936498884608,20597460,senbillnelson,Twitter Web Client,2015-04-13 18:52:54,54,74,I have a great personal and professional relationship with Marco. But I am all in with Hillary.,,,,,
583287206015537152,20597460,senbillnelson,Twitter Web Client,2015-04-01 15:18:01,26,0,RT @Daniel_Sweeney: .Sen. Bill Nelson rallies for Medicaid expansion before the @FLSenate Democratic Caucus. http://t.co/xBT1oFnn7s,,,583265190646554624,34365624,Daniel_Sweeney
581191180207128576,20597460,senbillnelson,Twitter Web Client,2015-03-26 20:29:10,49,41,Science shouldn't be muzzled. http://t.co/gxLibsNS1U,,,,,
575764315061493760,20597460,senbillnelson,Twitter Web Client,2015-03-11 21:04:44,36,26,Reports say Florida led the nation in Obamacare sign ups. http://t.co/t9csEwO5Jc,,,,,
575029959682560000,20597460,senbillnelson,Twitter Web Client,2015-03-09 20:26:40,18,19,Just filed a bill to increase penalties for ID thieves who commit tax fraud. Here are the details: http://t.co/5K5cvrRoHN,,,,,
571375566118645760,20597460,senbillnelson,Twitter Web Client,2015-02-27 18:25:25,11,11,Pleased to have @ConsumersUnion support of our bill protecting kids from poisoning. http://t.co/58lgmdaDG9,,,,,
571373186014523392,20597460,senbillnelson,Twitter Web Client,2015-02-27 18:15:57,6,8,Happy to report @ConsumerFed support of my bill to make liquid nicotine packaging child-resistant. http://t.co/hKnxKwlA9D,,,,,
570656567495958528,20597460,senbillnelson,Twitter Web Client,2015-02-25 18:48:22,23,20,"I’ve asked @TheJusticeDept to investigate the deaths of 51 kids at the Dozier School for Boys in Marianna, FL: http://t.co/hV7Edxk5l1",,,,,
570269828965130240,20597460,senbillnelson,Twitter Web Client,2015-02-24 17:11:36,5,0,RT @fawnjohnson: The Democrat With the Bully Pulpit @SenBillNelson and #supercookies.  http://t.co/JXlhb0lbPk via @nationaljournal,,,570202041877983232,15481070,fawnjohnson
562380354225721345,20597460,senbillnelson,Twitter Web Client,2015-02-02 22:41:39,12,0,"RT @CAdamsMcClatchy: On @WhiteHouse budget, @SenBillNelson of FL says: 'One of the good things' is an end to 'meat-cleaver' sequestration a…",,,562367946232971265,912981500,CAdamsMcClatchy
554726969586515968,20597460,senbillnelson,Twitter Web Client,2015-01-12 19:49:50,19,0,"RT @bnjacobs: And it happened on this date in 1986. Our Administrator's first space shuttle flight. Among the crew, @SenBillNelson http://t…",,,554689886511714306,17897744,bnjacobs
552826964953014273,20597460,senbillnelson,Twitter Web Client,2015-01-07 13:59:54,17,19,The people behind the attacks in Paris are nothing but murderous extremists.,,,,,
552221393291845633,20597460,senbillnelson,Twitter Web Client,2015-01-05 21:53:34,12,6,ESPN'S Stuart Scott had an amazing ability to connect with people including many who remember his time broadcasting in Orlando.,,,,,
547520709061537793,20597460,senbillnelson,Twitter for iPhone,2014-12-23 22:34:44,70,28,Florida has officially surpassed New York to become the third most populous state in the country.,,,,,
540861854957203456,20597460,senbillnelson,Twitter Web Client,2014-12-05 13:34:49,74,98,I shot this video of #orion launch this morning @nasakennedy @nasa_go4launch http://t.co/vRxh74Yv9L,,,,,
540844924623912960,20597460,senbillnelson,Twitter for iPhone,2014-12-05 12:27:33,38,44,#Orion is a star now,,,,,
540194400274759680,20597460,senbillnelson,Twitter Web Client,2014-12-03 17:22:36,14,11,Today marks fifth year of Alan Gross’s wrongful imprisonment in Cuba. On my way to the White House now – will discuss case while I’m there.,,,,,
535864119124324352,20597460,senbillnelson,Twitter Web Client,2014-11-21 18:35:36,10,4,"Saturday is National Adoption Day. Remember, there are an estimated 100,000 kids in the U.S. in need of a good home. http://t.co/Yw3Hurj30w",,,,,
535495579108114433,20597460,senbillnelson,Twitter Web Client,2014-11-20 18:11:09,96,88,Another campus shooting. Yet we still haven't started even a dialogue on keeping guns from criminals and the mentally ill.,,,,,
535467997813809152,20597460,senbillnelson,Twitter Web Client,2014-11-20 16:21:33,4,5,Demanding answers from auto officials at airbag hearing. Watch here now: http://t.co/uclXxnH6rn,,,,,
535092441339424768,20597460,senbillnelson,Twitter Web Client,2014-11-19 15:29:14,6,7,Tomorrow I’m asking officials for answers about deadly exploding airbags at 10am Senate hearing. Stay tuned for a link to watch.,,,,,
532577597549719553,20597460,senbillnelson,Twitter Web Client,2014-11-12 16:56:08,35,29,Congrats to our European partners in space exploration for landing the first-ever spacecraft on a comet.,,,,,
527154375794651136,20597460,senbillnelson,Twitter Web Client,2014-10-28 17:46:11,15,14,I’ve asked carmakers to give owners loaners or cover rental costs until all defective airbags are fixed. http://t.co/GnXqivSPHg,,,,,
522817995572531200,20597460,senbillnelson,Twitter Web Client,2014-10-16 18:34:58,14,12,The situation in Dallas has convinced me it’s time to set up White House war room led by Ebola point person. http://t.co/VctePwIIvK,,,,,
520589962321100800,20597460,senbillnelson,Twitter Web Client,2014-10-10 15:01:33,2,5,"Proud of Jayne Ellspermann from West Port High School in Ocala, named 2015 National Principal of the Year!",,,,,
519927025176690688,20597460,senbillnelson,Twitter Web Client,2014-10-08 19:07:17,15,18,"U.S. must do more to combat the Ebola outbreak, including restricting travel visas from affected countries: http://t.co/gFv6LAFO6h",,,,,
515195587416051713,20597460,senbillnelson,Twitter Web Client,2014-09-25 17:46:14,3,0,RT @CAdamsMcClatchy: Reaction on #Holder decision from FL @SenBillNelson: 'outstanding public servant...president will miss his counsel.” h…,,,515184833371590656,912981500,CAdamsMcClatchy
513032947738624000,20597460,senbillnelson,Twitter Web Client,2014-09-19 18:32:41,8,0,RT @vickiecusf: .@SenBillNelson talking with @USouthFlorida biology students in St Pete about @FIOTweet oil spill research @usfcms http://t…,,,513029315978862592,262300948,vickiecusf
512308873940959232,20597460,senbillnelson,Twitter Web Client,2014-09-17 18:35:28,4,3,A major test in Congress for the effort to regulate e-cigarettes. Watch here now: http://t.co/LQJe9s0kyb,,,,,
512005257321517056,20597460,senbillnelson,Twitter Web Client,2014-09-16 22:29:00,2,10,"Met the impressive Maryah Sullivan today, who was named Boys &amp; Girls Club Southeast Regional Youth of the Year. http://t.co/KfxftzNGkt",,,,,
510104997112315905,20597460,senbillnelson,TweetDeck,2014-09-11 16:38:03,11,0,RT @wolfblitzer: Reaction to the President's new #ISIS strategy from @RepKinzinger &amp; @SenBillNelson coming up. #Wolf 1PM ET @CNN,,,510101405475274753,71294756,wolfblitzer
509410376430391297,20597460,senbillnelson,Twitter Web Client,2014-09-09 18:37:52,8,0,"RT @ChadGillisNP: @SenBillNelson says federal DOT giving $20M to elevate Tamiami Trial, increase flows south to @EvergladesNPS #swfl",,,509395612211904512,876225474,ChadGillisNP
509057454337187840,20597460,senbillnelson,Twitter Web Client,2014-09-08 19:15:29,52,24,"Should be no safe place for ISIS, so I just filed legislation to authorize use of airstrikes against them in Syria. http://t.co/7AB3hEnRj4",,,,,
508313839906336768,20597460,senbillnelson,Twitter Web Client,2014-09-06 18:00:38,7,10,This was the right immigration call by the president given the tea party’s stranglehold on House GOP.,,,,,
507541588688764929,20597460,senbillnelson,Twitter Web Client,2014-09-04 14:51:59,2,0,RT @newsnation: .@TamronHall's at the #NewsNation anchor desk for a packed show. @ChrisJansing @SenBillNelson @woodwriter join to discuss I…,,,507537148833447936,295899118,newsnation
507496626077061120,20597460,senbillnelson,Twitter Web Client,2014-09-04 11:53:19,15,7,Tune into @CNN at 8am to hear more about the bill I'm introducing next week to give the president clear authority for airstrikes in Syria.,,,,,
507290111000981505,20597460,senbillnelson,Twitter Web Client,2014-09-03 22:12:42,3,7,"Tonight at 6:30, I’ll be speaking with @WolfBlitzer on CNN about the threat of ISIS.",,,,,
507227585202634752,20597460,senbillnelson,Twitter Web Client,2014-09-03 18:04:14,19,0,RT @GretchenCarlson: Sen. Nelson on #ISIS: “These ppl are clearly coming after us.” @SenBillNelson – (D) FL joins me w/ his request for leg…,,,507202794324230144,1487846678,GretchenCarlson
507221451649597440,20597460,senbillnelson,Twitter Web Client,2014-09-03 17:39:52,20,13,I spoke with @RonanFarrow on MSNBC today about my legislation to give Obama clear authority to strike ISIS in Syria. http://t.co/hZJt4vcGQK,,,,,
505062465064144896,20597460,senbillnelson,Twitter Web Client,2014-08-28 18:40:49,4,7,Just back from international meetings on ISIS and Ukraine and will give update on @OutFrontCNN tonight,,,,,
497387903178530816,20597460,senbillnelson,Twitter Web Client,2014-08-07 14:24:51,32,0,RT @DWStweets: Floridians - don't miss @SenBillNelson on how the GOP is making health care more expensive for #Florida families: http://t.c…,,,497148654256660480,115979444,DWStweets
495238806610931712,20597460,senbillnelson,Twitter Web Client,2014-08-01 16:05:07,13,15,"Sent a letter to Sec. Jewell to make known my opposition to oil drilling off Florida’s Atlantic coast. Now, urging local leaders to do same.",,,,,
489858658164297728,20597460,senbillnelson,Twitter Web Client,2014-07-17 19:46:19,9,4,The decrease in U.S. drug fighting in Central America is the root cause of that region’s child exodus: http://t.co/1eWyf74H8T,,,,,
488716053787467777,20597460,senbillnelson,Twitter Web Client,2014-07-14 16:06:01,15,0,"RT @AshleyLopezFL: Sen. Bill Nelson: ""I am very concerned"" oil drilling near the Everglades will jeopardize restoration efforts.",,,488696772013723648,284626595,AshleyLopezFL
487295684128018432,20597460,senbillnelson,Twitter Web Client,2014-07-10 18:01:59,9,8,We’ve got to keep kids from being exposed to this new kind of poison. http://t.co/Oe0uyQN77L,,,,,
479054079617138688,20597460,senbillnelson,TweetDeck,2014-06-18 00:12:47,3,0,"RT @CHeathWFTV: 275 troops headed to Baghdad, @SenBillNelson praises move and says ""sectarian violence is about to blow #Iraq apart"" @WFTV",,,478996821386461184,321082871,CHeathWFTV
477148241239474176,20597460,senbillnelson,TweetDeck,2014-06-12 17:59:40,12,3,U.S. should consider use of drones with hellfire missiles if Iraq nears collapse.,,,,,
477119636354641920,20597460,senbillnelson,TweetDeck,2014-06-12 16:06:00,4,0,RT @ArletteSaenz: Sen. Bill Nelson on Iraq: It's a grave situation,,,477117481031860225,21878635,ArletteSaenz
476452542969155584,20597460,senbillnelson,Twitter Web Client,2014-06-10 19:55:12,13,12,Was great to watch president sign our bill awarding Congressional Gold Medal to veterans who served in an all-Puerto Rican unit of the Army.,,,,,
476424952586199041,20597460,senbillnelson,Twitter Web Client,2014-06-10 18:05:34,6,0,RT @msynan: @SenBillNelson says there are $1.9B in Everglades and S FL water flow/quality projects in water bill signed by Pres. Obama #Fox…,,,476408873130422272,19976677,msynan
476127001422864384,20597460,senbillnelson,Twitter Web Client,2014-06-09 22:21:37,13,14,I got a first-hand look at one of three spacecraft competing for America's next-generation commercial launch system. http://t.co/dYt4y15Izu,,,,,
474296175315914752,20597460,senbillnelson,Twitter Web Client,2014-06-04 21:06:34,8,8,One of nation’s top scientific groups affirms we should go to Mars. http://t.co/K7usiv0rQs,,,,,
472419876511178753,20597460,senbillnelson,Twitter Web Client,2014-05-30 16:50:50,21,13,A lot of heads should be rolling. There’s something in the VA’s culture that isn’t responding to serve our vets in the way they deserve.,,,,,
471706563213008896,20597460,senbillnelson,Twitter Web Client,2014-05-28 17:36:23,21,17,Maya Angelou’s soul remains in the indelible words she left behind.,,,,,
471401416557617152,20597460,senbillnelson,Twitter Web Client,2014-05-27 21:23:50,8,0,RT @TSStricklandPNJ: Co. Comm. Grover Robinson and Sen. Bill Nelson touring devastation in Crescent Lake. http://t.co/YrJ9ykQcau,,,471324615453966336,2180908794,TSStricklandPNJ
464401693200097281,20597460,senbillnelson,Twitter Web Client,2014-05-08 13:49:26,14,3,Developing and assembling long-range strike aircraft is a new beginning for Florida's Space Coast. http://t.co/EwMtfu6sJT,,,,,
462327360965316608,20597460,senbillnelson,Twitter Web Client,2014-05-02 20:26:47,15,6,A report I asked for links various illnesses hitting some Floridians and defective Chinese drywall in their homes. http://t.co/YzcoaHV90x,,,,,
462311793072041986,20597460,senbillnelson,Twitter Web Client,2014-05-02 19:24:55,10,0,RT @Steve_Doane_: Find out why @SenBillNelson has asked the @EPA to investigate drilling procedures in Collier. http://t.co/a69Fhw8dtv @the…,,,462232244883849217,378548032,Steve_Doane_
460786847279775744,20597460,senbillnelson,Twitter Web Client,2014-04-28 14:25:20,20,8,“Florida lawmakers dilly dally while constituents die”  http://t.co/Rtwc1AgQhd,,,,,
459429035681267712,20597460,senbillnelson,Twitter Web Client,2014-04-24 20:29:52,14,7,"U.S. shouldn't deal with Palestinian govt. that includes Hamas unless Hamas, among other things, renounces violence and recognizes Israel.",,,,,
459015492632838145,20597460,senbillnelson,Twitter Web Client,2014-04-23 17:06:36,7,0,RT @SkylerSwisher: .@SenBillNelson speaking to @DaytonaChamber. Says unbridled campaign contributions have changed politics for worst. http…,,,459007700568141824,375194353,SkylerSwisher
458666151330201600,20597460,senbillnelson,Twitter Web Client,2014-04-22 17:58:26,9,10,We're celebrating National Park Week - thanks to those with foresight to protect and preserve our country's natural resources and beauty.,,,,,
458607150840156161,20597460,senbillnelson,Twitter Web Client,2014-04-22 14:03:59,28,7,"U.S. Senate Commerce Committee hearing in FL today to explore the effects of rising sea levels at ""ground zero"": http://t.co/WhrEt7Cp93",,,,,
457582793556758529,20597460,senbillnelson,Twitter Web Client,2014-04-19 18:13:34,19,8,Hope you can take a minute to read my column in the Tampa Bay Times: http://t.co/dhXmrvDzbn,,,,,
456174311095930880,20597460,senbillnelson,Twitter Web Client,2014-04-15 20:56:45,9,4,We should breathe a bit easier thanks to court ruling. http://t.co/d94b1TBXa1,,,,,
455767463725387778,20597460,senbillnelson,Twitter Web Client,2014-04-14 18:00:05,5,0,"RT @CHeathWFTV: ""We need to keep the Baldwin Park VA facility open"" @SenBillNelson #wftv http://t.co/m9BZvuMD4S",,,455762774904565761,321082871,CHeathWFTV
454726498151567360,20597460,senbillnelson,Twitter Web Client,2014-04-11 21:03:40,7,0,RT @Tampa_Chamber: Great news from @PortTampaBay!  New crane at Int'l Ship with help from @SenBillNelson @USRepKCastor for fed grant. http:…,,,454650391935070208,78319974,Tampa_Chamber
453600872732585984,20597460,senbillnelson,Twitter Web Client,2014-04-08 18:30:50,27,18,I’m co-sponsoring the Paycheck Fairness Act because equal work deserves equal pay. http://t.co/luluh2yUKF,,,,,
453585637145604097,20597460,senbillnelson,Twitter Web Client,2014-04-08 17:30:17,3,2,"4 yrs into wrongful imprisonment, Alan Gross announces hunger strike. We must keep pressure on Cuba for his release. http://t.co/z7MlFaKKjR",,,,,
451405783956455424,20597460,senbillnelson,Twitter Web Client,2014-04-02 17:08:20,1,0,RT @jackiefell: .@senbillnelson asks Barra if #GM mislead federal regulators and consumers. She doesn't answer. Says she wants to know that…,,,451379496835633152,44295213,jackiefell
451080739480961024,20597460,senbillnelson,Twitter Web Client,2014-04-01 19:36:43,6,6,"http://t.co/DGX6b5IRNW is new, improved and better-equipped to help constituents. Check it out (on your mobile device, too)!",,,,,
451068648157741058,20597460,senbillnelson,Twitter Web Client,2014-04-01 18:48:40,3,0,"RT @LGreenonthehill: Sen. Bill Nelson, D-Florida, says of GM: ""it's an outrage that a corporate culture would end up sacrificing at least 1…",,,451060418359099392,1107119816,LGreenonthehill
450759979856039936,20597460,senbillnelson,Twitter Web Client,2014-03-31 22:22:08,8,3,"It took a while, but it was worth the fight if we can save at least one child from being backed over by a car. http://t.co/PTrZZDnb9K",,,,,
446659955341688832,20597460,senbillnelson,Twitter Web Client,2014-03-20 14:50:06,13,0,RT @JKennedyReport: .Fla U.S. Sen. Nelson tells state Sen Dems he's talking w/HHS and CMS to get some Medicaid xpansion $$ refused by Fla G…,,,446331288040267776,59123957,JKennedyReport
446396357709139969,20597460,senbillnelson,Twitter Web Client,2014-03-19 21:22:39,11,8,Service for Gov. Askew today was a fitting tribute and called to mind his unwavering commitment to integrity in public office.,,,,,
446358838975795200,20597460,senbillnelson,Twitter Web Client,2014-03-19 18:53:34,4,0,"RT @fineout: During visit @SenBillNelson says he is concerned that there are signs of the ""heavy hand of voter suppression"" in recent Fla a…",,,446323646387470336,16001789,fineout
444240547302346752,20597460,senbillnelson,Twitter Web Client,2014-03-13 22:36:14,14,4,"The flood insurance bill is not everything I wanted for homeowners, but it’s significant protection from unconscionable rate increases.",,,,,
444208207498858496,20597460,senbillnelson,Twitter Web Client,2014-03-13 20:27:44,10,7,Getting ready to vote on flood insurance.  Should be in about 5 mins.,,,,,
443845666125926400,20597460,senbillnelson,Twitter Web Client,2014-03-12 20:27:07,5,0,"RT @AnthonyAdragna: .@SenBillNelson told me yesterday he'll hold April 22 hearing in Miami Beach on #climatechange, sea level rise. Free ht…",,,443836191407099904,460246990,AnthonyAdragna
443429982573195264,20597460,senbillnelson,Twitter Web Client,2014-03-11 16:55:21,21,10,"If unchecked, rising sea levels threaten many coastal areas where some 14 million Floridians now live. http://t.co/1J0x8FmTU4",,,,,
442670848412241920,20597460,senbillnelson,Twitter Web Client,2014-03-09 14:38:49,24,14,Today marks seven years since Bob Levinson disappeared while working in Iran. We need to keep pressure on government there to get him home.,,,,,
438734926528413696,20597460,senbillnelson,Twitter Web Client,2014-02-26 17:58:52,9,6,Pleased @CommerceGov responded with $6.3 M to my request for disaster funding to decimated Apalachicola Bay oyster industry,,,,,
436553668868206592,20597460,senbillnelson,Twitter Web Client,2014-02-20 17:31:20,23,11,Today marks 52 years since John Glenn became the 1st American to orbit the Earth.,,,,,
434084751767400448,20597460,senbillnelson,Twitter Web Client,2014-02-13 22:00:44,12,4,With Dr. Haru Okuda at VA medical center in Orlando where simulation training will help save vets' lives: http://t.co/CXu7VRgw16,,,,,
433372265250430976,20597460,senbillnelson,Twitter Web Client,2014-02-11 22:49:34,6,0,"RT @cspan: WEDNESDAY: Sen Aging Cmte hearing on Senior Citizens Starting Businesses, @SenBillNelson chairs - LIVE 10am ET online http://t.c…",,,433359546640105474,15675138,cspan
432924182704173056,20597460,senbillnelson,Twitter Web Client,2014-02-10 17:09:03,21,20,Met with UF students today to discuss Gov. Scott’s attempt to suppress the vote on college campuses. http://t.co/GGj4eKFQWd,,,,,
431555093880520704,20597460,senbillnelson,Twitter Web Client,2014-02-06 22:28:46,15,3,Extension of unemployment benefits defeated due to lack of GOP votes. http://t.co/qiTcRdXVwj,,,,,
431097158998458368,20597460,senbillnelson,TweetDeck,2014-02-05 16:09:06,5,0,RT @SayfieReview: Herald: Congressional Democrats blast Rick Scott for turning back on Medicaid expansion http://t.co/T33BifITFI #sayfie,,,431096308829417472,15111202,SayfieReview
430739132609216512,20597460,senbillnelson,TweetDeck,2014-02-04 16:26:26,13,14,Looks like farm bill with funds to save Florida oranges from citrus disease will win final passage this afternoon.,,,,,
429367034523049984,20597460,senbillnelson,Twitter Web Client,2014-01-31 21:34:13,4,4,Withlacoochee River Electric Coop.'s Billy Brown and I at the opening of the new Lacoochee Community Center today http://t.co/Dx4USYo94w,,,,,
428656604888584192,20597460,senbillnelson,Twitter Web Client,2014-01-29 22:31:13,25,6,USF team finds 55 bodies in unmarked graves at shuttered Florida reform school: http://t.co/mqQU0UbPZY,,,,,
428248860071170048,20597460,senbillnelson,Twitter Web Client,2014-01-28 19:30:59,19,10,"In remembering Challenger crew today, let’s also remember crews of Apollo 1 and Columbia. http://t.co/rBBilMJr9N",,,,,
427923762030206976,20597460,senbillnelson,Twitter Web Client,2014-01-27 21:59:09,12,3,Orange juice lovers take note: we got $125 million in the farm bill to find a cure for deadly citrus greening: http://t.co/OYCvHPrPqY,,,,,
426473283396325377,20597460,senbillnelson,Twitter Web Client,2014-01-23 21:55:28,4,0,RT @thenewspress: Sen. Bill Nelson talks flood insurance to The News-Press http://t.co/39irR5ya5Z #swfl,,,426468768772919296,14089276,thenewspress
424237081590657024,20597460,senbillnelson,TweetDeck,2014-01-17 17:49:36,21,3,"The Senate is now scheduled to make an initial decision on curbing flood insurance rates on Monday, the 27th.",,,,,
423933950315089920,20597460,senbillnelson,TweetDeck,2014-01-16 21:45:04,44,5,Stunned that GOP House leader says he’ll block our efforts to reduce flood insurance rates.  http://t.co/Hqo6ElCzZq,,,,,
423638951690125312,20597460,senbillnelson,TweetDeck,2014-01-16 02:12:51,12,6,Feds to help Florida's unemployed with delayed benefit claims. http://t.co/bKekRRupKC,,,,,
423168227909582848,20597460,senbillnelson,Twitter Web Client,2014-01-14 19:02:22,7,0,"RT @lesleyclark: Good news for #orange lovers: About $20 million to ""bolster fight"" against citrus greening is in budget bill, @SenBillNels…",,,423159649957732353,22077368,lesleyclark
422856013532774401,20597460,senbillnelson,Twitter Web Client,2014-01-13 22:21:44,16,8,In the Senate today we’re honoring FSU for winning the 2014 BCS Championship! http://t.co/WRbgtIqMcr,,,,,
422780095309168640,20597460,senbillnelson,Twitter Web Client,2014-01-13 17:20:04,14,8,"It’s been four years (yesterday) since that huge earthquake ravaged Haiti and killed 230,000.  Let’s keep the victims in our prayers.",,,,,
421772147300655104,20597460,senbillnelson,Twitter Web Client,2014-01-10 22:34:50,29,33,Having a reunion this weekend with the shuttle crew I had a blast with in January 1986. http://t.co/es5d8OunU4,,,,,
