id,user_id,screen_name,source,created_at,retweet_count,favorite_count,text,in_reply_to_screen_name,in_reply_to_status_id,retweeted_status_id,retweeted_status_user_id,retweeted_status_screen_name
12662533685,20597460,senbillnelson,Twitter Web Client,2010-04-22 21:38:31,4,0,"Ok, it’s draft time – so where do y’all think Tim Tebow’s going to end up?",,,,,
12645591673,20597460,senbillnelson,Twitter Web Client,2010-04-22 15:36:50,2,0,"Happy Earth Day. Did you know Sen. Nelson had a hand in launching the movement?  Gaylord Nelson, that is. http://bit.ly/bFlJoR",,,,,
12594942373,20597460,senbillnelson,Twitter Web Client,2010-04-21 19:59:59,4,0,At budget cmte – looks like we’ll get another $1 billion for NASA next year. Could save jobs. Here’s what I had to say http://bit.ly/cdzz9Z,,,,,
12524817978,20597460,senbillnelson,Twitter Web Client,2010-04-20 16:20:57,1,1,Saddened by Dorothy Height’s passing - she certainly left her mark in America’s history as a pioneer of civil rights http://bit.ly/bRC45D,,,,,
12303147918,20597460,senbillnelson,Twitter Web Client,2010-04-16 20:34:20,1,0,At the Clinton Global Initiative mtg – looking forward to meeting the students who are doing extraordinary work http://bit.ly/dCevgw,,,,,
12298355549,20597460,senbillnelson,Twitter Web Client,2010-04-16 18:41:37,1,0,Toured Univision in Miami today – Elizabeth and the rest of the folks there are doing a heck of a job!,,,,,
12247857427,20597460,senbillnelson,Twitter Web Client,2010-04-15 22:30:55,2,1,Was great playing Hardball w Chris Matthews about Obama’s plan for space exploration. See it here - http://bit.ly/9WF0kz,,,,,
12240565353,20597460,senbillnelson,Twitter Web Client,2010-04-15 19:43:19,6,0,Listen to my reaction to Obama’s plan for space here - http://billnelson.senate.gov/audiofiles/NelsonSpace.wma,,,,,
12238689859,20597460,senbillnelson,Twitter Web Client,2010-04-15 18:58:35,2,0,At KSC - Crowd here anxiously awaiting president’s speech on space program http://bit.ly/ajh7RZ,,,,,
11845144836,20597460,senbillnelson,Twitter Web Client,2010-04-08 21:49:02,6,0,The White House announcement today of some extra work for NASA in Florida is a step in the right direction – but there are miles to go.,,,,,
11832930060,20597460,senbillnelson,Twitter Web Client,2010-04-08 16:56:04,3,1,Judge says Chinese company at fault in drywall mess. It’s time our government stepped up the pressure on the Chinese. http://bit.ly/ctGzrO,,,,,
11711298220,20597460,senbillnelson,Twitter Web Client,2010-04-06 18:16:13,2,0,FL to get $24 million for medical IT – read more here http://billnelson.senate.gov/news/details.cfm?id=323635&,,,,,
10928535934,20597460,senbillnelson,Twitter Web Client,2010-03-23 14:49:01,7,2,Headed to the White House for historic signing of health care bill,,,,,
10572276143,20597460,senbillnelson,Twitter Web Client,2010-03-16 14:32:27,10,1,Headed to Oval Office for meeting with the president about America’s space program. Lots of folks unhappy with newly released plan for NASA.,,,,,
10284858681,20597460,senbillnelson,Twitter Web Client,2010-03-10 19:20:41,6,0,Met some really extraordinary women this morning - volunteer WWII pilots. They're getting long overdue honors. http://bit.ly/9vBihk,,,,,
10237707523,20597460,senbillnelson,Twitter Web Client,2010-03-09 21:03:44,7,1,Hard to believe: it’s been three years today since former FBI agent Bob Levinson disappeared in Iran. http://www.helpboblevinson.com/,,,,,
10173443675,20597460,senbillnelson,Twitter Web Client,2010-03-08 14:47:33,3,0,Glad President Obama has decided to come to Florida next month and elaborate on his plans for our nation’s space program.,,,,,
10030670323,20597460,senbillnelson,Twitter Web Client,2010-03-05 16:15:10,4,1,Senate is considering financial reform today – I think executives who got golden parachutes should have been left without their shirts.,,,,,
9828360748,20597460,senbillnelson,Twitter Web Client,2010-03-01 15:08:23,1,0,Down in Central Fla today to see where our stimulus bucks are going.  With VP at widening of U.S. 27.,,,,,
9695018378,20597460,senbillnelson,Twitter Web Client,2010-02-26 20:28:06,6,1,The latest partisan stunt is getting in the way of helping Americans by temporarily blocking unemployment benefits http://bit.ly/cIxv10,,,,,
9589585478,20597460,senbillnelson,Twitter Web Client,2010-02-24 19:43:24,5,0,We got a jobs bill passed today – it would give companies a strong incentive to hire new folks. Now we have to see what the House does.,,,,,
9582934823,20597460,senbillnelson,Twitter Web Client,2010-02-24 16:39:33,5,0,NASA to boldly go - where?  http://www.newschief.com/article/20100224/NEWS/2245060/1053,,,,,
9538427340,20597460,senbillnelson,Twitter Web Client,2010-02-23 19:10:24,2,2,Florida fishermen raised significant concerns with me today about new govt. fishing bans – I’m asking for a full review.,,,,,
9494580327,20597460,senbillnelson,Twitter Web Client,2010-02-22 21:40:11,3,0,RT @LCVoters: @senbillnelson 100% on Nat'l Environmental Scorecard. Thx for leading on environment & clean energy jobs http://bit.ly/dq7PCk,,,9490039207,20517132,LCVoters
9483962630,20597460,senbillnelson,Twitter Web Client,2010-02-22 17:04:28,3,0,"StoryCorps bus now in Pensacola http://bit.ly/dCkaky – 50,000 Americans have so far recorded their stories for NPR and Library of Congress.",,,,,
9299081199,20597460,senbillnelson,Twitter Web Client,2010-02-18 20:13:39,4,1,"I’m asking three federal agencies to investigate unusual cancer cases in South FL, here’s more http://bit.ly/clEATU",,,,,
9026673329,20597460,senbillnelson,Twitter Web Client,2010-02-12 21:33:45,4,0,"En route back from Haiti. Distribution of food, supplies greatly improved. But urgent help still needed especially before the rainy season.",,,,,
8517293370,20597460,senbillnelson,Twitter Web Client,2010-02-01 22:49:28,19,3,"Looking at administration’s budget for nasa – houston, we may have a problem.",,,,,
8502396077,20597460,senbillnelson,Twitter Web Client,2010-02-01 15:30:30,4,0,Reason for moving it is so they're not all in one place like sitting ducks. Also huge for the North Florida economy. http://bit.ly/bbdWUz,,,,,
8502387546,20597460,senbillnelson,Twitter Web Client,2010-02-01 15:30:17,3,0,"In Jax this morning on Mayport landing a new carrier. Something Ander, Corrine and I have spent close to a decade fighting for.",,,,,
8287838668,20597460,senbillnelson,Twitter Web Client,2010-01-27 18:01:47,9,1,"Obama in Tampa tomorrow where he’s announcing $8 B in stimulus money for high-speed rail, including some for a bullet train in Florida.",,,,,
8040634656,20597460,senbillnelson,Twitter Web Client,2010-01-21 20:37:58,17,0,"Just got off phone with folks from the administration, they’ll be allowing kids from Haiti with critical injuries quick passage to the U.S.",,,,,
7954309353,20597460,senbillnelson,Twitter Web Client,2010-01-19 18:15:35,2,1,Still pressing gov’t for one-year medical visas for the youngest and worst traumatized victims of the quake http://bit.ly/7Tq01D,,,,,
7724169574,20597460,senbillnelson,Twitter Web Client,2010-01-13 22:18:37,10,0,For some ways to help Haiti earthquake victims: http://www.billnelson.senate.gov/2010haitiearthquake.cfm,,,,,
7710858956,20597460,senbillnelson,Twitter Web Client,2010-01-13 15:07:49,2,0,My heart and prayers go out to the people in Haiti.,,,,,
7676889386,20597460,senbillnelson,Twitter Web Client,2010-01-12 17:56:30,7,0,Big grassroots rallies today to help bring high speed rail to Florida http://bit.ly/6MayM8,,,,,
7673722113,20597460,senbillnelson,Twitter Web Client,2010-01-12 16:13:37,3,0,Went on quite a ride - 24 years ago today http://www.upi.com/Odd_News/2010/01/12/The-almanac/UPI-51371263285000/,,,,,
7491174375,20597460,senbillnelson,Twitter Web Client,2010-01-07 20:33:37,0,0,Been a long time coming but this a.m. we finally turned the first shovel of dirt on a key 'Glades restoration project http://bit.ly/86DFQM,,,,,
6999460294,20597460,senbillnelson,Twitter Web Client,2009-12-24 13:37:11,6,4,"Senate just passed health care with my vote. Not a perfect bill, but good. It’ll let a lot more people get medical coverage.",,,,,
6540535675,20597460,senbillnelson,Twitter Web Client,2009-12-10 19:09:04,4,0,@mmarkarian thanks to humane society for supporting a ban on harmful species http://bit.ly/7rmSpt,mmarkarian,,,,
6539649747,20597460,senbillnelson,Twitter Web Client,2009-12-10 18:37:26,7,0,"Bunch of us (me, LeMieux, Reps. Brown, Mica) had heart-to-heart with US transportation boss last night. Optimistic FL will get bullet train.",,,,,
6532973264,20597460,senbillnelson,Twitter Web Client,2009-12-10 14:43:52,1,0,A guy who punched someone outside one of my speeches on health-care reform gets sent to anger classes http://bit.ly/4XiGdx,,,,,
6281313942,20597460,senbillnelson,Twitter Web Client,2009-12-02 21:16:21,7,1,I told my wife Grace not to push the refresh button so many times http://bit.ly/7PVDUs,,,,,
6275761303,20597460,senbillnelson,Twitter Web Client,2009-12-02 17:45:32,0,1,And the mission is unchanged: wipe out Al Qaeda; diminish the Taliban insurgents and keep up the pressure in the Pakistan border region.,,,,,
6275752259,20597460,senbillnelson,Twitter Web Client,2009-12-02 17:45:12,1,1,I think the president offered a sensible plan to empower the Afghan people and allow for our troops to complete their mission and come home.,,,,,
5836768965,20597460,senbillnelson,Twitter Web Client,2009-11-18 20:49:17,5,1,Usually where there’s smoke there’s fire – that’s why I’m calling for an investigation into the drug price hikes http://bit.ly/2Qul6W,,,,,
5836760762,20597460,senbillnelson,Twitter Web Client,2009-11-18 20:48:58,2,2,"What? Drug makers hiking prices even more, despite promises to shave costs to help pay for health reform?  http://bit.ly/4DfU1b",,,,,
5805157638,20597460,senbillnelson,Twitter Web Client,2009-11-17 20:20:54,2,0,"I usually drink my first cup of coffee watching Morning Joe, wonder if he'd host Hillary and Palin talking over a cup? http://bit.ly/1JLLVt",,,,,
5800038781,20597460,senbillnelson,Twitter Web Client,2009-11-17 16:43:05,1,0,We’ll be voting on big military projects today. Stuff like getting ready for one day moving a huge Navy carrier to Florida.,,,,,
5233125390,20597460,senbillnelson,Twitter Web Client,2009-10-28 15:43:46,0,0,Today’s picture-perfect launch of the new experimental Ares rocket shows America remains the leader in science and technology.,,,,,
5232689970,20597460,senbillnelson,Twitter Web Client,2009-10-28 15:26:11,0,0,Weather’s interfered with new Ares rocket launch. But countdown finally resumed at four minutes. Try to get to a TV or http://bit.ly/IAL4!,,,,,
5203243182,20597460,senbillnelson,Twitter Web Client,2009-10-27 15:36:57,0,1,"Well, weather didn’t cooperate. Ares launch scrubbed for today. Maybe go for tomorrow, or the next day?",,,,,
5200890874,20597460,senbillnelson,Twitter Web Client,2009-10-27 13:56:18,0,0,"Weather has stalled Ares launch, stay tuned.",,,,,
5200674383,20597460,senbillnelson,Twitter Web Client,2009-10-27 13:46:25,0,0,The future of America’s space program is 3 minutes away from launch.,,,,,
5175724640,20597460,senbillnelson,Twitter Web Client,2009-10-26 15:47:24,0,1,Going to make sure he knows why we need to get Jacksonville’s Mayport ready for a nuclear carrier.,,,,,
5175718866,20597460,senbillnelson,Twitter Web Client,2009-10-26 15:47:08,0,1,"About to head down to Florida with Obama, we’ll be in Jacksonville meeting with service men and women then on to Miami.",,,,,
5074840691,20597460,senbillnelson,Twitter Web Client,2009-10-22 17:43:57,1,0,I will continue to fight to get NASA funding for the next generation of human spaceflight. More on what we need to do http://bit.ly/1Q1aG9,,,,,
5074828582,20597460,senbillnelson,Twitter Web Client,2009-10-22 17:43:24,0,0,"Our space program is being asked to pursue goals without the necessary resources, or so says the Augustine Commission http://bit.ly/UsU09",,,,,
5045243973,20597460,senbillnelson,Twitter Web Client,2009-10-21 14:42:49,0,0,Why care if we explore space? At 2:30 today we’ll “make the case for space” in a hearing that’s online at http://tinyurl.com/yz2f5tz,,,,,
4841789965,20597460,senbillnelson,Twitter Web Client,2009-10-13 18:59:38,1,1,"Just voted for the Finance Committee’s health-care bill, I’ll be on CNN about it just after 3 p.m.",,,,,
4505970041,20597460,senbillnelson,Twitter Web Client,2009-09-30 20:13:25,0,0,Extraordinary person. Six adopted children. Truly an Angel. Was proud to nominate her for Angels in Adoption http://www.angelsinadoption.org,,,,,
4505962933,20597460,senbillnelson,Twitter Web Client,2009-09-30 20:13:05,0,0,"On a break from the cmte health care debate to meet Barbara Kadzis, you may remember her from Extreme Makeover: Home Edition in Tally.",,,,,
3874833933,20597460,senbillnelson,Twitter Web Client,2009-09-09 23:48:01,0,5,Americans who like their health coverage should be able to keep it. And we need to make coverage affordable for those who don’t have it.,,,,,
3874796648,20597460,senbillnelson,Twitter Web Client,2009-09-09 23:46:11,1,1,Health-insurance exchanges will help the nearly one-in-four Floridians who don’t have or cannot get affordable health insurance.,,,,,
3874780995,20597460,senbillnelson,Twitter Web Client,2009-09-09 23:45:25,1,1,Just read excerpts from President’s speech for tonight. I’m glad the president is proposing insurance exchanges.,,,,,
3556675148,20597460,senbillnelson,Twitter Web Client,2009-08-26 14:04:06,0,1,"Grace and I came to know Ted and Vicki in his later years in the Senate, and we count it a privilege to have known him.",,,,,
3556670285,20597460,senbillnelson,Twitter Web Client,2009-08-26 14:03:48,0,1,"Whatever your political views, his lion-like conviction was respected. It was that conviction that gave a voice to the powerless.",,,,,
3556666233,20597460,senbillnelson,Twitter Web Client,2009-08-26 14:03:33,0,1,Most Americans cannot even remember a time without Ted Kennedy.,,,,,
3179701665,20597460,senbillnelson,Twitter Web Client,2009-08-07 16:18:59,0,2,I look forward to having the same bipartisan working relationship with his successor.,,,,,
3179697254,20597460,senbillnelson,Twitter Web Client,2009-08-07 16:18:38,0,1,"Mel Martinez is stepping down. He has been a good Senate colleague of mine, as well as a personal friend.",,,,,
3108175289,20597460,senbillnelson,Twitter Web Client,2009-08-03 17:52:51,0,1,Cash for clunkers?  Hard to argue with apparent success - just wish the thing applied to cars that got better gas mileage.,,,,,
2950890524,20597460,senbillnelson,Twitter Web Client,2009-07-31 13:28:23,0,1,Headed to KSC for the shuttle landing,,,,,
2890070640,20597460,senbillnelson,Twitter Web Client,2009-07-28 13:54:42,0,0,"It starts at 10 am, and you can watch it live here http://tinyurl.com/nz4z24",,,,,
2890064900,20597460,senbillnelson,Twitter Web Client,2009-07-28 13:54:18,0,0,This morning I’ll be heading up a meeting with some of the nation’s top hurricane experts to see if the govt’s ready for the next big one.,,,,,
2824860751,20597460,senbillnelson,Twitter Web Client,2009-07-24 20:04:04,1,1,Meeting with folks in Orl. hurt by decline in tourism worsened by gov’t blacklisting. Talking about ways to end it http://tinyurl.com/nzhzst,,,,,
2759518359,20597460,senbillnelson,Twitter Web Client,2009-07-21 15:30:07,0,0,"Amazing, when you think about it. Took NASA about eight years to figure it out, and go from earth to the moon.",,,,,
2759509113,20597460,senbillnelson,Twitter Web Client,2009-07-21 15:29:32,0,0,Went to 40th anniversary celebration of moon landing last night in D.C. Wow!  Neil Armstrong delivered one heckuva stirring speech.,,,,,
2745095373,20597460,senbillnelson,Twitter Web Client,2009-07-20 20:40:31,0,0,Waiting to go on with Wolf on CNN’s Situation Room,,,,,
2742023118,20597460,senbillnelson,Twitter Web Client,2009-07-20 17:26:28,0,0,"And on this historic 40th anniversary of the moon landing, let’s not rest. It's up to us to reach for the stars.",,,,,
2742014248,20597460,senbillnelson,Twitter Web Client,2009-07-20 17:25:54,0,0,Space flight grows science and technology. It grows education. And it grows the economy.,,,,,
2742010580,20597460,senbillnelson,Twitter Web Client,2009-07-20 17:25:40,0,0,"Our president needs to set clear goals for space exploration: a lunar base, humans on Mars and keep going.",,,,,
2742007681,20597460,senbillnelson,Twitter Web Client,2009-07-20 17:25:28,0,0,"I remember when JFK reminded us that this country was not built by those who rested, and set a lofty goal for our country – the moon.",,,,,
2740603876,20597460,senbillnelson,Twitter Web Client,2009-07-20 15:56:59,0,1,Just used Skype for an interview with a station back in FL.  Great way to see and talk with folks back home - right from my desk!,,,,,
2699738524,20597460,senbillnelson,Twitter Web Client,2009-07-18 02:12:56,0,0,A star has set - with Walter Cronkite's passing America has lost one of her most trusted voices,,,,,
2660283370,20597460,senbillnelson,Twitter Web Client,2009-07-15 23:51:02,0,0,"Naval academy grad, Marine test pilot, astronaut, general – Charlie will bring back the magic from a time when we rode rockets to the moon",,,,,
2660280120,20597460,senbillnelson,Twitter Web Client,2009-07-15 23:50:48,0,0,"I’ve known Charlie Bolden the better part of a quarter century, since he was my pilot on the space shuttle in 1986",,,,,
2660277706,20597460,senbillnelson,Twitter Web Client,2009-07-15 23:50:38,0,0,"Charlie Bolden just confirmed by Senate as nation’s new space czar.  He’s perfect to keep America leading in space, science and technology",,,,,
2620348009,20597460,senbillnelson,Twitter Web Client,2009-07-13 20:55:50,0,1,"No big surprises on day one of Sotomayor hearings, a few audience members got tossed out and a couple of lawmakers threw partisan jabs.",,,,,
2573093827,20597460,senbillnelson,Twitter Web Client,2009-07-10 20:18:28,0,0,"Plus, got a letter from the IRS saying folks with tainted drywall could qualify for a special tax deduction - http://tinyurl.com/ma2gm9",,,,,
2573088509,20597460,senbillnelson,Twitter Web Client,2009-07-10 20:18:00,0,1,"stopping the deportation of people when their American spouse dies, even mothers with children who are born here.",,,,,
2573080730,20597460,senbillnelson,Twitter Web Client,2009-07-10 20:17:21,0,0,Lotta other news today. Senate OK’d folks buying less expensive prescriptions from Canada online. And…,,,,,
2573075941,20597460,senbillnelson,Twitter Web Client,2009-07-10 20:16:57,0,0,Just left a meeting in Jax with a Coast Guard team that hunts down drug runners. These guys mean business.,,,,,
2539347029,20597460,senbillnelson,Twitter Web Client,2009-07-08 21:36:46,0,1,Here’s my letter today to the Prez on closing the Enron loophole  http://tinyurl.com/n639wo,,,,,
2539343572,20597460,senbillnelson,Twitter Web Client,2009-07-08 21:36:31,0,0,We shouldn’t be allowing profiteers to flip oil contracts like condos.,,,,,
2539334452,20597460,senbillnelson,Twitter Web Client,2009-07-08 21:35:54,0,0,Glad to see the Obama administration cracking down on unregulated oil speculation http://tinyurl.com/lhzcbz,,,,,
2538870475,20597460,senbillnelson,Twitter Web Client,2009-07-08 21:04:31,0,1,"Back in the office after the Bolden nomination hearing, further confirmation that he’s the right pick for NASA.",,,,,
2538085750,20597460,senbillnelson,Twitter Web Client,2009-07-08 20:11:29,0,0,"This morning I spoke about the pythons infesting the Everglades, and the tragic death of a toddler in Florida http://tinyurl.com/kv7zd8",,,,,
2521920779,20597460,senbillnelson,Twitter Web Client,2009-07-07 22:00:04,0,1,"Was happy to see Al Franken here today, glad that election finally is decided. Known Al for a while. I think you’ll see he’s a good guy.",,,,,
2420823470,20597460,senbillnelson,Twitter Web Client,2009-07-01 14:43:58,0,1,"This afternoon I’ll be meeting with folks who fear they may be part of a cancer cluster in WPB, I’ve asked EPA and CDC to investigate.",,,,,
2348110810,20597460,senbillnelson,Twitter Web Client,2009-06-26 18:53:59,0,0,"In Haiti ‘til Monday to see how else we can help our neighbor recover from the wounds of drug trafficking, poverty and violence.",,,,,
2332010572,20597460,senbillnelson,Twitter Web Client,2009-06-25 20:53:35,0,0,"@MajoratWH re:HC patient looks a little better, but not out the woods yet",MajorCBS,,,,
2301078265,20597460,senbillnelson,Twitter Web Client,2009-06-23 21:58:21,0,0,"Some have kids who are American citizens, yet their husbands died too soon, so the U.S. wants to split the families and deport widows.",,,,,
2301064004,20597460,senbillnelson,Twitter Web Client,2009-06-23 21:57:12,0,0,Met with widows in the capital today who fear being deported. Heartbreaking stories. http://tinyurl.com/lgh7re,,,,,
2227856481,20597460,senbillnelson,Twitter Web Client,2009-06-18 20:43:08,0,1,Lotta folks asking me about health-care reform. We really need it. I'm working on it. But we need a viable plan for how to pay for it.,,,,,
2211417472,20597460,senbillnelson,Twitter Web Client,2009-06-17 19:49:48,0,0,Seminoles just lost their biggest booster. My good friend T. K. Wetherell just announced his retirement.,,,,,
2210820856,20597460,senbillnelson,Twitter Web Client,2009-06-17 19:03:52,0,1,"Don’t mean to tweet my own horn, but… http://politics.theatlantic.com/2009/06/the_top_30_washington_insiders_on_twitter.php",,,,,
2179504716,20597460,senbillnelson,Twitter Web Client,2009-06-15 16:11:41,0,0,In the Panhandle today trying to stop coastal oil drilling  http://www.pnj.com/article/20090615/NEWS01/90615007,,,,,
2131541222,20597460,senbillnelson,Twitter Web Client,2009-06-12 14:10:36,0,1,In Tampa on oil drilling this morning.  We can’t let the oil industry trash our coast and economy.,,,,,
2091538602,20597460,senbillnelson,Twitter Web Client,2009-06-09 16:50:16,0,0,"Congress ought to be looking at alternative energy, instead of putting oil rigs off Florida’s world-class tourist spots.",,,,,
2091534723,20597460,senbillnelson,Twitter Web Client,2009-06-09 16:49:57,0,0,Senate energy panel just voted to put oil rigs 190 miles closer to spots on Florida’s Gulf coast.  I’ll fight ‘em.,,,,,
2032834553,20597460,senbillnelson,Twitter Web Client,2009-06-04 18:50:10,0,2,"Just spoke in Senate about stimulus money in Florida. More jobs for teachers in Seminole County, for example, and some 200,000 jobs overall.",,,,,
1961722141,20597460,senbillnelson,Twitter Web Client,2009-05-29 16:56:41,0,0,Tonight I’ll join Citizens’ Crime Watch of Miami-Dade County to honor the folks who help keep our communities safe,,,,,
1960677975,20597460,senbillnelson,Twitter Web Client,2009-05-29 15:20:19,0,0,Here’s more on the disappearance of Felix Batista http://www.cnn.com/2009/CRIME/01/07/security.expert.kidnap/index.html,,,,,
1960671485,20597460,senbillnelson,Twitter Web Client,2009-05-29 15:19:42,0,0,"Working with Rep. Ros-Lehtinen to find the husband of Lourdes Batista who was last seen in Mexico, we met with the family today in Miami",,,,,
1951407904,20597460,senbillnelson,Twitter Web Client,2009-05-28 20:29:03,0,2,He saw for himself why restoring the Everglades is so important,,,,,
1951404899,20597460,senbillnelson,Twitter Web Client,2009-05-28 20:28:45,0,0,Just came out of the Everglades with the Secretary of the Interior,,,,,
1893477731,20597460,senbillnelson,Twitter Web Client,2009-05-23 14:22:23,0,0,Obama taps Bolden to run NASA http://www.billnelson.senate.gov/audiofiles/052209billnelsonboldennomination.mp4,,,,,
1871264763,20597460,senbillnelson,Twitter Web Client,2009-05-21 14:21:50,0,2,Here's the direct link to the drywall hearing webcast http://bit.ly/XWyrZ,,,,,
1871008227,20597460,senbillnelson,Twitter Web Client,2009-05-21 13:54:11,0,0,"We’re holding a hearing on Chinese-made drywall this morning at 10:30 a.m., it’ll be streaming here http://tiny.cc/fwDgo",,,,,
1862316006,20597460,senbillnelson,Twitter Web Client,2009-05-20 18:57:52,0,1,RT @TDOnline: Sens. Nelson and Landrieu seeking $2 million to test Chinese drywall http://tinyurl.com/r9a49t,,,,,
1788375749,20597460,senbillnelson,Twitter Web Client,2009-05-13 21:39:45,0,1,"Just got word, Interior Secretary Ken Salazar has accepted my invite to tour Everglades to see importance of restoration efforts",,,,,
1775256569,20597460,senbillnelson,Twitter Web Client,2009-05-12 17:12:32,0,0,It looks like politics has been put aside today and Craig Fugate will be approved to head FEMA – just in time for hurricane season.,,,,,
1767088845,20597460,senbillnelson,Twitter Web Client,2009-05-11 21:37:18,0,1,The Department of Education just announced more than $1.8 billion in stimulus money for Florida that will help save teachers jobs.,,,,,
1766038949,20597460,senbillnelson,Twitter Web Client,2009-05-11 19:38:17,0,0,This mission will demonstrate the success of humans interacting with machines in space to discover the unknown.,,,,,
1766036967,20597460,senbillnelson,Twitter Web Client,2009-05-11 19:38:04,0,0,It was a flawless launch for what will be one of the most technologically challenging missions to repair & extend the Hubble space telescope,,,,,
1730308911,20597460,senbillnelson,Twitter Web Client,2009-05-07 19:49:03,0,0,"Just got back from Senate floor, talked about importance of confirming Craig Fugate to head FEMA.  His nomination is being held up.",,,,,
1721270774,20597460,senbillnelson,Twitter Web Client,2009-05-06 22:27:37,0,0,More about the shuttle from the Flame Trench http://bit.ly/15uCWS,,,,,
1719586483,20597460,senbillnelson,Twitter Web Client,2009-05-06 19:17:54,0,3,White House tells me the president will fly all nine remaining shuttle missions - even if it means flying the shuttle an extra year.,,,,,
