id,user_id,screen_name,source,created_at,retweet_count,favorite_count,text,in_reply_to_screen_name,in_reply_to_status_id,retweeted_status_id,retweeted_status_user_id,retweeted_status_screen_name
465522573925548033,193794406,sencapito,Twitter Web Client,2014-05-11 16:03:25,8,13,Love you Mom. Happy Mother's Day to all. http://t.co/mwKqgceDUA,,,,,
464800695271825408,193794406,sencapito,Twitter Web Client,2014-05-09 16:14:56,1,6,Thank a teacher for Teacher Appreciation Week! Teresa Hammond @tbh1965 taught all three of my children in 4th grade. http://t.co/eiiIBfAMA6,,,,,
464520100327194624,193794406,sencapito,Twitter Web Client,2014-05-08 21:39:56,6,3,"Thousands of children across West Virginia are waiting for homes. You can make a difference by volunteering, mentoring or fostering a child.",,,,,
464519687456714752,193794406,sencapito,Twitter Web Client,2014-05-08 21:38:18,0,5,I’m wearing this blue ribbon to show my support for our foster care families during National Foster Care Month. http://t.co/33E4K4reZW,,,,,
464472179938447360,193794406,sencapito,Twitter Web Client,2014-05-08 18:29:31,1,5,#TBT for Mother's Day: The three Shelleys together on a family vacation in 1987. http://t.co/7tDf35Rs3j,,,,,
464221731272417280,193794406,sencapito,Twitter Web Client,2014-05-08 01:54:20,3,4,Meeting with @WVForestry State Forester Randy Dye today. http://t.co/5acVTN0CZR,,,,,
464220281645445120,193794406,sencapito,Twitter Web Client,2014-05-08 01:48:34,5,2,I'm proud to support the creation of a committee to study building the National Women’s History Museum.,,,,,
464034197502324737,193794406,sencapito,Twitter Web Client,2014-05-07 13:29:08,5,0,RT @LJSeawel: Thanks @RepShelley for being a lead co- sponsor of the Accelerating the End of Breast Cancer Act! #BCD2020 http://t.co/6pHSCn…,,,463897264369332225,17029813,LJSeawel
464034147124539393,193794406,sencapito,Twitter Web Client,2014-05-07 13:28:56,8,0,RT @MichelleZelsman: @RepShelley thanks for your support of #HR1830 #BCD2020 with your help we will #endbreastcancer http://t.co/qYnmx1L4AC,,,463811606107799552,1615391594,MichelleZelsman
464033995542376449,193794406,sencapito,Twitter Web Client,2014-05-07 13:28:20,9,0,"RT @DWStweets: The 2014 @CWSoftballGame roster is out: http://t.co/b0FsKdIMwP Shout-out to my co-captains, @RepShelley, @SenGillibrand, and…",,,463800247634763777,115979444,DWStweets
463799051201159168,193794406,sencapito,Twitter Web Client,2014-05-06 21:54:45,1,0,RT @jsimha: @RepShelley thank you for your leadership on #H1830 we can @Deadline2020 together!!! http://t.co/eC28qq9G4D,,,463798401818034176,22263859,jsimha
463798732689915906,193794406,sencapito,Twitter Web Client,2014-05-06 21:53:29,0,0,"Beth Brown, director of the Louis A. Johnson VA Medical Center in Clarksburg, leads a tour of the center on Monday. http://t.co/nZpRCUVQnr",,,,,
462331767035146240,193794406,sencapito,Twitter Web Client,2014-05-02 20:44:17,1,1,First stop this morning – the future site of the Heartland Intermodal Gateway in Prichard. http://t.co/DbYQeao6qD,,,,,
462330462481154048,193794406,sencapito,Twitter Web Client,2014-05-02 20:39:06,0,0,Driving the length of the King Coal and Tolsia highways today at the invitation of the King Coal Highway Authority.,,,,,
462219192755052545,193794406,sencapito,Twitter Web Client,2014-05-02 13:16:57,3,7,"Saddened by the death of Spike Maynard, a good friend and devoted public servant. My condolences go out to his family and friends.",,,,,
461970825944788992,193794406,sencapito,Twitter Web Client,2014-05-01 20:50:02,0,0,"#TBT: Honoring @RelayForLife in Lewis County, 2006. http://t.co/gcn7IFZfwE",,,,,
461967743701745664,193794406,sencapito,Twitter Web Client,2014-05-01 20:37:47,3,1,The House VA appropriations bill provides for our nation’s veterans and their families – they deserve nothing less.,,,,,
461915713331281920,193794406,sencapito,Twitter Web Client,2014-05-01 17:11:02,2,0,RT @lsbossie: Had a great meeting with Representative Shelley Moore Capito today @RepShelley  Lots of positive support for education @NASSP,,,461914579573145600,606592544,lsbossie
461608904842293248,193794406,sencapito,Twitter Web Client,2014-04-30 20:51:53,1,0,RT @hillrat1156: Rep. Shelley Moore Capito welcomes public health leaders @BrkFreeAlliance at its Capitol Hill briefing! #promisingpractice…,,,461501037799415808,20438066,hillrat1156
461546331908341760,193794406,sencapito,Twitter Web Client,2014-04-30 16:43:15,1,0,RT @GoParks: @RepShelley: Thank you for your support of HR 627 &amp; of our #NationalParks! We couldn’t have done it without you! http://t.co/k…,,,461542016246349824,17787705,GoParks
461527301717389313,193794406,sencapito,Twitter Web Client,2014-04-30 15:27:38,1,1,"Congrats to @WestVirginiaU senior @priyanka1478, who presented a research poster on Capitol Hill. http://t.co/mzvPcUrXUs",,,,,
459420328960462848,193794406,sencapito,Twitter Web Client,2014-04-24 19:55:16,2,0,RT @Cardiology: Thanks @RepShelley for meeting with Dr. Miller &amp; Mr. Adkins &amp; hearing about how they are advancing patient care. http://t.c…,,,459417862458048513,9689662,Cardiology
459419269445349376,193794406,sencapito,Twitter Web Client,2014-04-24 19:51:04,2,3,Answering questions about government and history from fourth graders at Sacred Heart Grade School in Charleston. http://t.co/B7wjZhdMS1,,,,,
459386011441971200,193794406,sencapito,Twitter Web Client,2014-04-24 17:38:54,1,0,RT @JeremyBurkhamer: @RepShelley #tbt Military Ball 2013!! http://t.co/M7NvQsIzfy,,,459385175278100480,748244634,JeremyBurkhamer
459351349293903872,193794406,sencapito,Twitter Web Client,2014-04-24 15:21:10,1,5,#tbt from Easter 2011: With my granddaughter Celia at the White House Easter Egg Roll. http://t.co/JmjqihaUPa,,,,,
459050893040553985,193794406,sencapito,Twitter Web Client,2014-04-23 19:27:16,0,2,Ben Franklin Career &amp; Technical Center science teacher Belinda Fox describes a tadpole found behind the school. http://t.co/4kgx78bboq,,,,,
459049698750263296,193794406,sencapito,Twitter Web Client,2014-04-23 19:22:31,0,0,Robert McCallister shows me a robot he built for Ben Franklin Career &amp; Technical Center’s Power and Energy class. http://t.co/KawVdgvEZK,,,,,
458772264373088256,193794406,sencapito,Twitter Web Client,2014-04-23 01:00:06,6,4,Thank you to @wchs8fox11 for hosting tonight's town hall on water in South Charleston. http://t.co/ZdeCrZnhXq,,,,,
458760798907932672,193794406,sencapito,Twitter Web Client,2014-04-23 00:14:32,2,0,"RT @wchs8fox11: @RepShelley says whole delegation united in post-spill work, want to make sure nothing is swept under table #yourvoiceyourf…",,,458745312673157120,32444366,wchs8fox11
458760769078054912,193794406,sencapito,Twitter Web Client,2014-04-23 00:14:25,4,0,"RT @enoreikaWCHS: #yourvoiceyourfuture ""we started working on legislation immediately"" @RepShelley http://t.co/4RtauMQT1b",,,458745025778970624,52324807,enoreikaWCHS
458281390354989056,193794406,sencapito,Twitter Web Client,2014-04-21 16:29:32,2,4,Good luck to the runners -- including 59 West Virginians -- participating in the Boston Marathon today. We stand together.,,,,,
457968782510936064,193794406,sencapito,Twitter Web Client,2014-04-20 19:47:21,5,8,Wishing you and your family a very happy Easter!,,,,,
457687341399019520,193794406,sencapito,Twitter Web Client,2014-04-20 01:09:00,2,1,Photo gallery from Thursday's events in Jackson County. https://t.co/W9eERlNOUE,,,,,
457344546268262400,193794406,sencapito,Twitter Web Client,2014-04-19 02:26:51,12,5,The president's punt on the Keystone pipeline will cost America jobs and deny us access to affordable energy.,,,,,
456473506906005505,193794406,sencapito,Twitter Web Client,2014-04-16 16:45:39,1,1,"@AlisHeart Congratulations, Ali. Welcome to my office!",AlisHeart,456111013952094208,,,
456419797282979840,193794406,sencapito,Twitter Web Client,2014-04-16 13:12:14,7,13,"Happy 91st birthday, Dad! http://t.co/l4VYsMN9ZA",,,,,
456258085489623040,193794406,sencapito,Twitter Web Client,2014-04-16 02:29:39,8,3,Meeting with Dominion Transmission leaders to discuss their new headquarters under construction in Bridgeport. http://t.co/zN1yXVAJDM,,,,,
456223570520055810,193794406,sencapito,Twitter Web Client,2014-04-16 00:12:30,1,1,Participating in @google Online Safety Roadshow with students at Robert Bland Middle School in Weston today. http://t.co/0c5TTdPoq1,,,,,
456222703460958208,193794406,sencapito,Twitter Web Client,2014-04-16 00:09:03,1,1,I held the third in a series of roundtables on cyberbullying today with educators in Weston. http://t.co/91XhnrdEdA,,,,,
456133859768545282,193794406,sencapito,Twitter Web Client,2014-04-15 18:16:01,3,2,"Mick Staton served the people of West Virginia well in Congress, and I will miss his bright smile, quick wit, and warm friendship.",,,,,
454724214486863872,193794406,sencapito,Twitter Web Client,2014-04-11 20:54:35,1,2,And a visit to Rouster Wire Rope and Rigging in Mabscott. http://t.co/IOKnWPK36Y,,,,,
454723647324700672,193794406,sencapito,Twitter Web Client,2014-04-11 20:52:20,1,3,"With Mike Massinople, president of Mabscott Supply Company near Beckley. http://t.co/JYwLv4keX8",,,,,
454714581114302464,193794406,sencapito,Twitter Web Client,2014-04-11 20:16:19,1,2,It was my privilege to visit Dunbar Elementary School for its Teach a Child to Save money management program today. http://t.co/jLIWWc0a6B,,,,,
454712458742358016,193794406,sencapito,Twitter Web Client,2014-04-11 20:07:53,1,0,RT @PutnamPSD: Ran across these kind words by @RepShelley about our Commish Chair Joe Miller when he retired from the DMV last year: http:/…,,,454702827055894528,102424766,PutnamPSD
454684445954830337,193794406,sencapito,Twitter Web Client,2014-04-11 18:16:34,1,0,"RT @WendyHoldren: @RepShelley attends ribbon cutting of PPPFD, an organization fighting prescription pill abuse. http://t.co/ffeyrnS8xx",,,454683644255539200,1120103360,WendyHoldren
454338410442788864,193794406,sencapito,Twitter Web Client,2014-04-10 19:21:33,3,8,"#tbt: Afghanistan in 2010. Our pilot was David Crigger of Charleston, whom I'd nominated for admission to West Point. http://t.co/xVLbxUlZJ6",,,,,
454013454689370112,193794406,sencapito,Twitter Web Client,2014-04-09 21:50:17,2,2,"As a former WV Cherry Blossom Princess, congrats to @JackieRiggleman, WV’s 2014 Cherry Blossom Princess. #CBP2014 http://t.co/miy8eH6xFR",,,,,
454010030916780032,193794406,sencapito,Twitter Web Client,2014-04-09 21:36:41,4,3,Alzheimer's is a cause close to my heart. Thank you to the WV @alzassociation @fightalzwv for their work. http://t.co/Ji13ZARLQl,,,,,
454004814238588928,193794406,sencapito,Twitter Web Client,2014-04-09 21:15:57,5,5,Thank you to the @4H and @WVUExtension members who visited me today. http://t.co/MkW4mQQhA3,,,,,
454003464440250368,193794406,sencapito,Twitter Web Client,2014-04-09 21:10:35,0,0,Thanks to Jim Robinson of @MilitaryOfficer for meeting with me about issues facing active &amp; retired military members. http://t.co/hHn09lnc1K,,,,,
454002553802727424,193794406,sencapito,Twitter Web Client,2014-04-09 21:06:58,1,1,Investment in West Virginia’s highways is an investment in West Virginia. Completing the King Coal Highway will ensure safer travel for all.,,,,,
453988947690287104,193794406,sencapito,Twitter Web Client,2014-04-09 20:12:54,1,0,RT @ccsham_34: We had the pleasure of meeting with Rep. Shelley Moore Capito today! #N4HC14 #DC http://t.co/ICkNpYObW9,,,453983614985064448,377074840,ccsham_34
453962354511077376,193794406,sencapito,Twitter Web Client,2014-04-09 18:27:14,4,0,RT @WVUExtension: @WVUExtension 4-H'ers getting ready to speak with @RepShelley #4H #wvu http://t.co/ok6Y299j80,,,453960931374944256,393384457,WVUExtension
453621460175577088,193794406,sencapito,Twitter Web Client,2014-04-08 19:52:38,2,0,RT @crnaMarnie: @RepShelley thanks for the visit from WV Cert.Reg.Nurse Anesthetists http://t.co/bUvYlX1MM2,,,453619573359910912,637231843,crnaMarnie
453598175530872834,193794406,sencapito,Twitter Web Client,2014-04-08 18:20:07,11,8,Women absolutely deserve equal pay for equal work – and equal pay is the law. For helpful resources on equal pay: http://t.co/UihiH9WzXf,,,,,
453548691056787456,193794406,sencapito,Twitter Web Client,2014-04-08 15:03:29,1,0,"RT @LaurelMK: So exciting to see @RepShelley welcome video welcoming 1,000+ advocates to #alzforum #WV #ENDALZ",,,453519146270343168,17313605,LaurelMK
452605733067304961,193794406,sencapito,Twitter Web Client,2014-04-06 00:36:30,14,8,"We will never forget the 29 miners lost at Upper Big Branch. My thoughts and prayers are with their families, friends and fellow miners.",,,,,
451837047125573633,193794406,sencapito,Twitter Web Client,2014-04-03 21:42:01,5,1,Middle-class families are being squeezed by Obamacare mandates that are reducing full-time employees’ hours &amp; wages.  http://t.co/4xpYcllgLB,,,,,
451828631572979712,193794406,sencapito,Twitter Web Client,2014-04-03 21:08:35,2,2,#TBT Part II: 2005 Congressional Baseball Game. @thehillbaseball http://t.co/NYvoyBfVx2,,,,,
451787971612532737,193794406,sencapito,Twitter Web Client,2014-04-03 18:27:00,2,5,Thanks to Brentney Steele-Fields of Huntington for sharing her son's experience with cystic fibrosis. @CF_Foundation http://t.co/0cOTytPfeF,,,,,
451759949664636928,193794406,sencapito,Twitter Web Client,2014-04-03 16:35:40,1,2,#TBT for the start of baseball season: the 2001 Congressional Baseball Game @thehillbaseball. http://t.co/TxUETS8kp4,,,,,
451468303345528832,193794406,sencapito,Twitter Web Client,2014-04-02 21:16:46,2,5,"I met today with @ShepherdU nursing students, who spoke with me about what called them to pursue a nursing career. http://t.co/PPx08Johsp",,,,,
450043879455485952,193794406,sencapito,Twitter Web Client,2014-03-29 22:56:36,6,3,What a game! A valiant effort by @WLathletics men's basketball team.,,,,,
450001776998354944,193794406,sencapito,Twitter Web Client,2014-03-29 20:09:18,12,7,Wishing the @WLathletics men's basketball team the best of luck as they play for the NCAA Division II championship on @CBS! Go Hilltoppers!,,,,,
449629026278453248,193794406,sencapito,Twitter Web Client,2014-03-28 19:28:08,2,1,Wishing @RepMcKinley a wonderful birthday!,,,,,
449200772056510464,193794406,sencapito,Twitter Web Client,2014-03-27 15:06:24,2,2,Thank you to WV @NAEMT_ members for meeting with me to discuss issues important to EMTs. http://t.co/kDCI4zQVxI,,,,,
448940184550526976,193794406,sencapito,Twitter Web Client,2014-03-26 21:50:55,14,9,The Obama administration’s delay of the March 31 Obamacare deadline shows that Obamacare isn’t ready and isn’t working.,,,,,
448875180627349504,193794406,sencapito,Twitter Web Client,2014-03-26 17:32:37,1,0,RT @MrEricMicheal: Thank you @RepShelley for giving me the opportunity to job shadow you yesterday. It was an awesome experience!,,,448874259138772992,2436939215,MrEricMicheal
448875166274449408,193794406,sencapito,Twitter Web Client,2014-03-26 17:32:34,6,0,RT @NRPA_news: Great meeting with @RepShelley to talk about support of parks and trails! #NRPALegForum http://t.co/m7LerjjFeR,,,448874207141982208,78685011,NRPA_news
448855921142546432,193794406,sencapito,Twitter Web Client,2014-03-26 16:16:05,6,4,My thoughts and prayers go out to the injured and the families of those killed in this morning’s I-81 accident in Berkeley County.,,,,,
448554059058794497,193794406,sencapito,Twitter Web Client,2014-03-25 20:16:36,10,18,Catching up with @WestVirginiaU President @gordongee outside my office before votes today. http://t.co/m7jCa9d19A,,,,,
448539120923840512,193794406,sencapito,Twitter Web Client,2014-03-25 19:17:14,1,0,RT @WVTRiO: @RepShelley Thank you so much for meeting with our WV TRiO Delegation. #TRiONATION #TRiOWorks http://t.co/CoFZRRCHsU,,,448537425372262400,1322812434,WVTRiO
448518096190701569,193794406,sencapito,Twitter Web Client,2014-03-25 17:53:41,4,1,I met today with West Virginia members of the @AmericanLegion to discuss ways to help our veterans. https://t.co/0UZ7ZVX5Yt,,,,,
448506230492127232,193794406,sencapito,Twitter Web Client,2014-03-25 17:06:32,4,0,"In case you missed it -- my op-ed in today's @charleywest: ""A fix for the flood insurance fix."" http://t.co/RJtkKox9vh",,,,,
448457083357528064,193794406,sencapito,Twitter Web Client,2014-03-25 13:51:15,1,0,RT @Addicted_Babies: @RepShelley Thank you for stopping by!! ❤️,,,448214283852480514,1259766421,Addicted_Babies
448448490109431808,193794406,sencapito,Twitter Web Client,2014-03-25 13:17:06,1,0,RT @FacingHungerFB: @RepShelley thank you so much for coming out and helping us kick off the new Facing Hunger Foodbank,,,448438552401940480,2401503193,FacingHungerFB
448213995850186753,193794406,sencapito,Twitter Web Client,2014-03-24 21:45:18,5,6,"While in Huntington, I paid a visit to Lily’s Place @Addicted_Babies, a pediatric addiction recovery center. http://t.co/R5pFpRYPqI",,,,,
448207800322117632,193794406,sencapito,Twitter Web Client,2014-03-24 21:20:41,3,3,It was my privilege to help Huntington’s @hafoodbank celebrate its rebranding as Facing Hunger Foodbank today. http://t.co/rgtAp6XqZb,,,,,
446841226537340928,193794406,sencapito,Twitter Web Client,2014-03-21 02:50:25,2,6,With @marshallu President Stephen Kopp during my campus visit today. http://t.co/lDTSSxs6fR,,,,,
446840901877235712,193794406,sencapito,Twitter Web Client,2014-03-21 02:49:07,2,4,Thanks to @MarshallU Forensic Science Center for inviting me to tour their facility today. http://t.co/bnC2LVzKzn,,,,,
446651354459955200,193794406,sencapito,Twitter Web Client,2014-03-20 14:15:55,2,0,RT @NASAIVV: @RepShelley It was a pleasure to share @NASA's presence in West Virginia with Congresswoman Capito.,,,446644001689849856,608450132,NASAIVV
446373864176504833,193794406,sencapito,Twitter Web Client,2014-03-19 19:53:17,1,0,I toured @NASA's IV&amp;V facility in Fairmont today with Director Gregory Blaney. http://t.co/fm3grM5Khl,,,,,
446106441422622720,193794406,sencapito,Twitter Web Client,2014-03-19 02:10:38,1,3,I joined the Weirton Area Chamber of Commerce this afternoon for a roundtable on local small business issues. http://t.co/NtERWQAnXK,,,,,
446003499067650049,193794406,sencapito,Twitter Web Client,2014-03-18 19:21:35,4,2,I was honored to keynote @wlumedia Economics Club lunch today in Wheeling and speak about Obamacare and job creation. http://t.co/WIUOWCrKhe,,,,,
446002064124948480,193794406,sencapito,Twitter Web Client,2014-03-18 19:15:53,3,5,"This morning I toured Eagle Manufacturing, which employs about 180 people in Brooke County. http://t.co/CKpjLo1fV2",,,,,
445998257811226624,193794406,sencapito,Twitter Web Client,2014-03-18 19:00:45,1,0,RT @wlumedia: @RepShelley So glad you shared your knowledge &amp; insight with WLU students as they prepare for successful futures! Thank you!,,,445753216894918656,87036994,wlumedia
445998212093345793,193794406,sencapito,Twitter Web Client,2014-03-18 19:00:34,2,0,RT @SYinglingWTRF: @RepShelley taking a tour of Eagle Manufacturing. http://t.co/1FzCIZiJsq,,,445918083182780416,1260156492,SYinglingWTRF
445732838172680192,193794406,sencapito,Twitter Web Client,2014-03-18 01:26:04,6,9,Thank you to @wlumedia for inviting me to campus to speak to their business students today. http://t.co/cusDait8fF,,,,,
444552503003480064,193794406,sencapito,Twitter Web Client,2014-03-14 19:15:50,1,3,I honored great women in West Virginia’s history on the House floor today for Women’s History Month. @marylouretton http://t.co/1R69yn9rTQ,,,,,
444220821209243648,193794406,sencapito,Twitter Web Client,2014-03-13 21:17:51,2,0,I met today with @justinmraber and Amy Arnold from WV @NationalPTA to discuss parental engagement in our schools. http://t.co/Pa89ehQ2Ew,,,,,
443852488404635648,193794406,sencapito,Twitter Web Client,2014-03-12 20:54:14,1,0,"RT @girlscouts: @RepShelley Once a Girl Scout, always a Girl Scout! :-)",,,443852292077662208,103018203,girlscouts
443852046484373504,193794406,sencapito,Twitter Web Client,2014-03-12 20:52:28,3,6,Happy birthday @GirlScouts from a former Brownie and Girl Scout! #HappyBDayGirlScouts,,,,,
443835270882799616,193794406,sencapito,Twitter Web Client,2014-03-12 19:45:49,4,2,"Thanks to @lionsclubs Int'l Director Stephen Glass of Bridgeport &amp; his daughter, Jordan Glass, for visiting me today. http://t.co/BFVnfVhoJo",,,,,
443471016401334272,193794406,sencapito,Twitter Web Client,2014-03-11 19:38:24,1,0,"RT @WVPublicTransit: Great meeting with @RepShelley, thanks for meeting with us and for your continued support of #WVPublicTransit",,,443469006964801537,346257843,WVPublicTransit
442052830321319936,193794406,sencapito,Twitter Web Client,2014-03-07 21:43:02,5,4,It's time to finish Route 35 in Mason &amp; Putnam counties - I'm working for a robust highway bill to improve our roads. http://t.co/6FMTWKAn0V,,,,,
442031164992532480,193794406,sencapito,Twitter Web Client,2014-03-07 20:16:56,2,0,RT @WSAZPewitt: Rep. Capito is urging the state to finish widening project of Rt. 35. See the full story at 5 and 6 on @WSAZnews,,,442014224752324608,1710080790,WSAZPewitt
441995870519984129,193794406,sencapito,Twitter Web Client,2014-03-07 17:56:42,4,0,RT @wvpublicnews: .@RepShelley Wants U.S. 35 Upgrade Finished in West Virginia: http://t.co/aGpMTf67ij http://t.co/UE8yBRLW63,,,441990116081283072,258831459,wvpublicnews
441946910556164096,193794406,sencapito,Twitter Web Client,2014-03-07 14:42:09,2,0,RT @charleywest: .@RepShelley wants US 35 upgrade finished in #WV http://t.co/hZXuXCgpul #PutnamWV,,,441931622170894337,16259734,charleywest
441683451117187072,193794406,sencapito,Twitter Web Client,2014-03-06 21:15:15,2,6,"A warm welcome to students from @WVSOM, who visited me today to speak about healthcare issues. http://t.co/ZV7g13k0f0",,,,,
441664681108049920,193794406,sencapito,Twitter Web Client,2014-03-06 20:00:40,2,0,RT @waterwitch89: Proud to be a West Virginian after great discussions in DC about STEM w/ @RepShelley @SenRockefeller @Sen_JoeManchin #STE…,,,441658111938809856,176858735,waterwitch89
441243531538350080,193794406,sencapito,Twitter Web Client,2014-03-05 16:07:10,1,0,RT @CWSoftballGame: We cheer for #CWSG Member Team Captain @RepShelley too!!! http://t.co/IlWCDFhBdO,,,441238169552699392,259918701,CWSoftballGame
441236833578786816,193794406,sencapito,Twitter Web Client,2014-03-05 15:40:33,3,0,RT @wvheadachedoc: .@RepShelley Thanks for always taking the time to listen. Great meeting today with @AANMember Dr Payne #NOH14 http://t.c…,,,441041698719014912,1491468866,wvheadachedoc
440989168068329472,193794406,sencapito,Twitter Web Client,2014-03-04 23:16:25,13,2,It’s time to #fixflood – the House is voting shortly to help homeowners facing skyrocketing flood insurance premiums. http://t.co/qWKSAxg3MW,,,,,
440970565885497344,193794406,sencapito,Twitter Web Client,2014-03-04 22:02:30,3,4,.@WVUWBB keeps moving up – No. 7 in the @AP_Top25 and No. 8 in the @USATODAY Coaches Poll!,,,,,
440965780897660929,193794406,sencapito,Twitter Web Client,2014-03-04 21:43:29,5,8,"A warm welcome to @wvusga members Molly Callahan, Nathan Tehrani and Ryan Campione. http://t.co/zNgYAwpaa3",,,,,
440930776419270656,193794406,sencapito,Twitter Web Client,2014-03-04 19:24:23,1,1,With all of the WV @VFWHQ visitors -- thank you again for your service to our nation and our veterans. http://t.co/v1w8E23g6m,,,,,
440924757999878144,193794406,sencapito,Twitter Web Client,2014-03-04 19:00:29,5,1,Thank you to members of the WV @VFWHQ for meeting with me today and sharing their thoughts on veterans' issues. http://t.co/al9CJfc63O,,,,,
439932028520497152,193794406,sencapito,Twitter Web Client,2014-03-02 01:15:43,10,15,"Welcome to Charleston, fellow Glen Dale native @BradPaisley!",,,,,
439464324122550272,193794406,sencapito,Twitter Web Client,2014-02-28 18:17:14,6,8,Happy birthday to a great broadcaster and West Virginian @HoppyKercheval!,,,,,
439098971982929920,193794406,sencapito,Twitter Web Client,2014-02-27 18:05:27,2,0,RT @RDHDKelley: Thank you @RepShelley for always taking time for us &amp; suicide prevention!  Montani Semper Liberi #AFSPForum14 http://t.co/k…,,,439094602713538560,25278019,RDHDKelley
438733250388033536,193794406,sencapito,Twitter Web Client,2014-02-26 17:52:12,9,0,RT @BridgetatACIE: A big thank you to @RepShelley and Victoria Weaver for meeting with #KLYES student Mesabia of #Indonesia #CivEdWeek http…,,,438729199848001536,958307396,BridgetatACIE
438692276878184448,193794406,sencapito,Twitter Web Client,2014-02-26 15:09:23,2,2,Congrats to @WVUWBB -- No. 10 in this week's @USATODAY Coaches Poll. http://t.co/f52Vj69J2y,,,,,
436984913581985793,193794406,sencapito,Twitter Web Client,2014-02-21 22:04:56,2,1,Many thanks to Coy Miller for his 35 years of dedicated service to @HuntingtonCorps. http://t.co/bm3pGXO1jV,,,,,
436945010454720512,193794406,sencapito,Twitter Web Client,2014-02-21 19:26:23,1,1,"In a call with FEMA Regional Administrator MaryAnn Tierney, I continued to urge @FEMA to reverse denial decision for WV chemical spill aid.",,,,,
436896682005909504,193794406,sencapito,Twitter Web Client,2014-02-21 16:14:20,0,0,Thank you to the McDowell County Chamber of Commerce for inviting me to join them for their monthly lunch. http://t.co/9QOxoNjclX,,,,,
436257640918683648,193794406,sencapito,Twitter Web Client,2014-02-19 21:55:01,10,2,Presenting WWII veteran Chester McNeely of Marmet with a flag flown over the U.S. Capitol in his honor. http://t.co/L1kgpcT17H,,,,,
436237293515317248,193794406,sencapito,Twitter Web Client,2014-02-19 20:34:10,2,1,I met today with small businesses to discuss the chemical spill &amp; will continue to push for answers on water safety. http://t.co/yH9kgSZJ88,,,,,
436229341882507264,193794406,sencapito,Twitter Web Client,2014-02-19 20:02:34,3,0,"Touring WVU’s physics department Tuesday with professor Earl Scime, interim associate vice president for research. http://t.co/KUPMBw7YFE",,,,,
