id,user_id,screen_name,source,created_at,retweet_count,favorite_count,text,in_reply_to_screen_name,in_reply_to_status_id,retweeted_status_id,retweeted_status_user_id,retweeted_status_screen_name
627194893778190336,193794406,sencapito,TweetDeck,2015-07-31 19:11:30,3,0,Watch my weekly video message for an update on the #DRIVEAct &amp; a major Appropriations accomplishment benefiting #WV: https://t.co/YirybycJhp,,,,,
627176546479046656,193794406,sencapito,TweetDeck,2015-07-31 17:58:35,3,1,"Joined @amyklobuchar, @KellyAyotte &amp; @clairecmc on @CBSThisMorning to discuss how we’re making #Congress work again: http://t.co/KMRhW6zzxR",,,,,
627144458728042496,193794406,sencapito,TweetDeck,2015-07-31 15:51:05,3,4,The DePond family from Charleston #WV stopped in my office while they were in town. Always good to see WVians in DC! http://t.co/zsNFquaNK9,,,,,
626882506785067008,193794406,sencapito,TweetDeck,2015-07-30 22:30:11,1,1,Final #CapitoConnect sessions of the week tomorrow in Marion &amp; Greenbrier Counties: http://t.co/gLbRtoV1cP http://t.co/VUYaH7ql4B,,,,,
626855567563354113,193794406,sencapito,TweetDeck,2015-07-30 20:43:08,0,2,Joined Mayor Vaughn to see firsthand the recent fire damage in #HarpersFerry. I’m hopeful for a quick recovery. http://t.co/rf8bWUpjNq,,,,,
626839111798784000,193794406,sencapito,TweetDeck,2015-07-30 19:37:45,2,4,Good news for WV: @EnergyGOP  passed a bill that includes my legislation to streamline #natgas #pipeline permitting: http://t.co/iXQNBxsCTt,,,,,
626822064981327872,193794406,sencapito,TweetDeck,2015-07-30 18:30:00,2,3,"Now that the Senate has passed a multi-year highway bill, it’s time for the House to follow. Read my statement: http://t.co/pemT3zKBY4",,,,,
626817717039943680,193794406,sencapito,TweetDeck,2015-07-30 18:12:44,15,8,"Today the #Senate passed the #DRIVEAct, an important step toward improving #WV’s infrastructure, promoting growth and creating certainty.",,,,,
626792172763922432,193794406,sencapito,TweetDeck,2015-07-30 16:31:13,9,7,"Joining @amyklobuchar on @msnbc’s @mitchellreports at 12:40 to discuss the #AnnaWestinAct, our bill to help combat eating disorders.",,,,,
626765819159146496,193794406,sencapito,TweetDeck,2015-07-30 14:46:30,3,1,Enjoyed meeting @ALANatlHQ Senators representing #WV in the Girls Nation program. These young women make WV proud! http://t.co/IPVqVb84ZI,,,,,
626522237143773184,193794406,sencapito,TweetDeck,2015-07-29 22:38:36,1,2,Proud of these interns from @NASA's IV&amp;V facility in Fairmont who presented their research today at #NASA’s HQ in DC. http://t.co/KaMnR4BJ51,,,,,
626507452125683713,193794406,sencapito,TweetDeck,2015-07-29 21:39:51,6,6,America does not have to accept a bad deal with #Iran. Watch my floor speech here: https://t.co/DKQvXaw8NQ,,,,,
626497679418392577,193794406,sencapito,TweetDeck,2015-07-29 21:01:01,3,0,Attention Mason County: #CapitoConnect is coming your way tomorrow at 3. More details here: http://t.co/gLbRtpcCBp http://t.co/OVBFV9oZrX,,,,,
626473714687868928,193794406,sencapito,TweetDeck,2015-07-29 19:25:47,4,3,I’ll be speaking on the @SenateFloor about the #IranDeal shortly. Watch live here: http://t.co/W27DMFas6y,,,,,
626431704308318212,193794406,sencapito,TweetDeck,2015-07-29 16:38:51,3,5,Introduced legislation with @SenJackReed to advance pediatric #cancerresearch &amp; child-focused #cancer treatments: http://t.co/PdfZ94YTC1,,,,,
626408192583581696,193794406,sencapito,TweetDeck,2015-07-29 15:05:25,0,1,#WV’s own #GreenBankTelescope is doing cutting-edge research. Great to meet those behind this fascinating work. http://t.co/vKz86ERRAz,,,,,
626162940954157057,193794406,sencapito,TweetDeck,2015-07-28 22:50:53,3,2,"Tomorrow, my staff will be in Beckley to talk #CapitoConnect &amp; #broadband. Learn more here: http://t.co/gLbRtpcCBp http://t.co/54Sw9mZDoc",,,,,
626120024839696385,193794406,sencapito,TweetDeck,2015-07-28 20:00:21,1,4,A staggering 30M Americans suffer from eating disorders. The #AnnaWestinAct helps improves treatment &amp; prevention: http://t.co/Xc5FcJeBYe,,,,,
626097322150072320,193794406,sencapito,TweetDeck,2015-07-28 18:30:08,6,5,35% of WV’s bridges are deficient or outdated. A long-term #transportation bill provides a path to fix crumbling infrastructure. #DRIVEAct,,,,,
626076762011758592,193794406,sencapito,TweetDeck,2015-07-28 17:08:26,1,0,Glad @DEANEWS heard our feedback &amp; will reinstate Drug Take-Back Days: http://t.co/dtC3ZIGw1o https://t.co/515U3w2a7j,,,,,
625847365417725952,193794406,sencapito,Twitter Web Client,2015-07-28 01:56:54,4,1,"… Following the closure, it is my hope that Century will fulfill the commitments it made to retirees. (3/3)",,,,,
625847295473504256,193794406,sencapito,Twitter Web Client,2015-07-28 01:56:37,1,1,"… for Jackson County, Century retirees, and the federal, state and local officials who worked hard to reopen the facility… (2/3)",,,,,
625847224472334336,193794406,sencapito,Twitter Web Client,2015-07-28 01:56:20,1,0,Today’s announcement that Century Aluminum will permanently close its Ravenswood aluminum smelter is a deep disappointment… (1/3),,,,,
625829291813502976,193794406,sencapito,TweetDeck,2015-07-28 00:45:05,4,0,WV needs this long-term certainty to ensure safety for travelers &amp; to create opportunities for economic growth.   https://t.co/fvy9k1mGJV,,,,,
625799802203279362,193794406,sencapito,TweetDeck,2015-07-27 22:47:54,1,0,Met w/ Brentney Steele from @CF_Foundation’s #WV chapter in Charleston &amp; learned more about their work to find a cure http://t.co/RpNMbU1adG,,,,,
625774243343638532,193794406,sencapito,TweetDeck,2015-07-27 21:06:20,1,0,"#RT to spread the word about our #CapitoConnect Sessions tomorrow in Tucker, Jefferson &amp; Brooke Counties. More here: http://t.co/gLbRtpcCBp",,,,,
625654396085387264,193794406,sencapito,TweetDeck,2015-07-27 13:10:06,1,1,The Appropriations Committee recently met a major milestone. Read more about what this means for #WV: http://t.co/OMmx2liRlQ,,,,,
625349901065412608,193794406,sencapito,TweetDeck,2015-07-26 17:00:09,3,3,Joined several of my female colleagues for an interview with @CBSThisMorning. Stay tuned for more details! http://t.co/YBgt89S69w,,,,,
625289537908899844,193794406,sencapito,TweetDeck,2015-07-26 13:00:17,4,1,Enjoyed meeting #WV military officers Bill Winnick &amp; Robert Hall while they were in DC this week for training. http://t.co/fzAKKG6TgS,,,,,
624987518128107520,193794406,sencapito,TweetDeck,2015-07-25 17:00:10,5,0,Discussed the benefits of a long-term #transportation bill with @WVNS59News. Watch the interview below. #DRIVEAct https://t.co/cJoc6299d4,,,,,
624927121383649282,193794406,sencapito,TweetDeck,2015-07-25 13:00:10,6,1,Read my e-newsletter for highlights from this week in Washington: http://t.co/ArkSN8lXtk http://t.co/w6aZmCCn0Z,,,,,
624663470668169216,193794406,sencapito,TweetDeck,2015-07-24 19:32:31,1,1,"Watch my weekly video message for an update on the long-term #transportation bill, #IranDeal and more: https://t.co/njupp8ZoDA",,,,,
624594033826893824,193794406,sencapito,TweetDeck,2015-07-24 14:56:36,3,2,These rising @wvboysstate state delegates are going places. Keep up the good work! http://t.co/uOCeMcka4i,,,,,
624360894751834112,193794406,sencapito,TweetDeck,2015-07-23 23:30:12,2,1,Last #CapitoConnect session of the week tomorrow in Charleston at 11 AM. Learn more here: http://t.co/gLbRtoV1cP http://t.co/hc6SjRrgXH,,,,,
624332397623005184,193794406,sencapito,TweetDeck,2015-07-23 21:36:57,3,3,ICYMI: Spoke on the @SenateFloor about the need for a long-term #transportation bill. Watch the full speech here: https://t.co/wp2nH05yhg,,,,,
624315621736460289,193794406,sencapito,TweetDeck,2015-07-23 20:30:18,2,4,Had lunch with our summer interns to thank them for all of their hard work. http://t.co/jTk0y3HEVH,,,,,
624296953900331008,193794406,sencapito,TweetDeck,2015-07-23 19:16:07,2,2,Happening now: I’m speaking on the @SenateFloor urging support for the #DRIVEAct. Watch live http://t.co/Z6aSCEIkPg,,,,,
624227841283108864,193794406,sencapito,TweetDeck,2015-07-23 14:41:29,3,5,"Saddened by the news of this morning’s fire in Harpers Ferry that destroyed local businesses, homes &amp; apartments.",,,,,
624179687669903360,193794406,sencapito,TweetDeck,2015-07-23 11:30:08,3,0,Stop by one of our #CapitoConnect sessions &amp; speak w/ my staff about improving #broadband: http://t.co/gLbRtoV1cP http://t.co/nTTAyKrrtj,,,,,
624014912935854080,193794406,sencapito,Twitter for iPhone,2015-07-23 00:35:23,7,6,Pleased that with tonight's vote we will soon begin debate on a long-term highway bill. A needed step in the right direction. #DriveAct,,,,,
623971759772069892,193794406,sencapito,TweetDeck,2015-07-22 21:43:55,2,7,Additional observation time at #GreenBankTelescope being used for #SETI research. Great news for #WV! http://t.co/aBXkgENjWT,,,,,
623933012087074817,193794406,sencapito,TweetDeck,2015-07-22 19:09:56,9,1,Sent a letter urging OIRA to examine the economic &amp; legal burdens of @EPA’s proposed rule: http://t.co/Lb3s8NlTbI,,,,,
623877736872816640,193794406,sencapito,TweetDeck,2015-07-22 15:30:18,1,0,Would you like to intern in DC just like Marcus Wooling? Apply to intern in my DC office: http://t.co/XDG1ND4YUX http://t.co/XoQ2PlNvAj,,,,,
623862590406438912,193794406,sencapito,TweetDeck,2015-07-22 14:30:07,1,0,Getting ready to talk to @HoppyKercheval about a long-term transportation fix on @WVMetroNews at 10:45. Tune in here: http://t.co/FlG6wf77YI,,,,,
623824872045572099,193794406,sencapito,TweetDeck,2015-07-22 12:00:14,2,0,TODAY: #CapitoConnect listening sessions in Jackson &amp; Mineral Counties. Learn more here: http://t.co/gLbRtoV1cP http://t.co/tMk8fjTBeD,,,,,
623567045347672064,193794406,sencapito,TweetDeck,2015-07-21 18:55:43,2,8,"Had an inspiring talk on women’s leadership with @sherylsandberg, @KellyAyotte, @joniernst, &amp; @SenatorFischer today. http://t.co/O8AxVTZBdB",,,,,
623533824299941888,193794406,sencapito,TweetDeck,2015-07-21 16:43:43,7,9,My prayers are with #Chattanooga today as the flags at the @uscapitol are lowered in honor of those killed. http://t.co/XWtpLQJe9q,,,,,
623454910122582016,193794406,sencapito,TweetDeck,2015-07-21 11:30:08,4,1,"Spread the word: #CapitoConnect sessions today in Upshur, Wetzel, Wirt &amp; Doddridge Counties. More details here: http://t.co/gLbRtoV1cP",,,,,
623190725019054080,193794406,sencapito,TweetDeck,2015-07-20 18:00:21,4,3,Honored to present Jackson County resident Russell Brown with his father’s #WWII medals this AM in Charleston. http://t.co/KRRXCHZn2L,,,,,
623156367747117056,193794406,sencapito,TweetDeck,2015-07-20 15:43:50,5,1,"ICYMI: Spoke w/ @wvstatejournal’s Decision Makers about #ISIS, #IranDeal &amp; @EPA regulations: http://t.co/7PAWVGZvpA http://t.co/S1S8E8QESr",,,,,
622813201835536384,193794406,sencapito,TweetDeck,2015-07-19 17:00:13,1,3,Enjoyed seeing Noelle Ward from @JDRF in D.C. this week. Thanks for stopping by #WestVirginiaWednesday! http://t.co/PtKZU7noJY,,,,,
622730116372631552,193794406,sencapito,TweetDeck,2015-07-19 11:30:04,5,4,"Watch my interview on Decision Makers at 8 a.m. where I’ll be discussing topics including the #IranDeal, the #DRIVEAct, &amp; the @EPA.",,,,,
622457682402750464,193794406,sencapito,Twitter Web Client,2015-07-18 17:27:30,10,19,Spoke at the @boyscouts WV #Veterans Appreciation Day Opening Ceremony. Always grateful for those who have served. http://t.co/FXpuJvihAg,,,,,
622390419632951299,193794406,sencapito,TweetDeck,2015-07-18 13:00:14,4,3,Read my e-newsletter for highlights from this week in Washington: http://t.co/UEdhbptRxp http://t.co/MNgDRaEmZ2,,,,,
622157202028105728,193794406,sencapito,TweetDeck,2015-07-17 21:33:30,3,0,"Here’s the latest from the Senate: improving WV schools, a long-term fix for our roads &amp; my take on the #IranDeal: https://t.co/qTUxhh1KjE",,,,,
622126182150987776,193794406,sencapito,TweetDeck,2015-07-17 19:30:15,2,6,Glad to see Nat'l Youth Correspondent Kaitlin Snyder who will represent WV at the #WJMC2015 this year. http://t.co/9DSXXJzLDE,,,,,
622103544041095169,193794406,sencapito,TweetDeck,2015-07-17 18:00:17,1,1,Spoke with @DeptVetAffairs Secretary McDonald about reopening the Greenbrier CBOC facility: http://t.co/zxZRdwBUqr,,,,,
622075297370931201,193794406,sencapito,TweetDeck,2015-07-17 16:08:03,1,3,#CapitoConnect update: Secured funding for WV priorities like rural broadband access in the ag appropriations bill: http://t.co/UeJG4rHg85,,,,,
622034817841012736,193794406,sencapito,TweetDeck,2015-07-17 13:27:12,2,5,Thank you to the WVians who stopped by to see me in DC this week! View the album: http://t.co/DhavA0rgUa #WVWednesday http://t.co/pi5yGiaKJ4,,,,,
621778883105284096,193794406,sencapito,TweetDeck,2015-07-16 20:30:12,0,0,The proposed stream rule would increase regulatory burdens &amp; eliminate more mining jobs. I’ll continue pushing back http://t.co/QoXwYBEvHJ,,,,,
621771087555231744,193794406,sencapito,TweetDeck,2015-07-16 19:59:13,4,3,"Pleased #ECAA passed w/ several key provisions that benefit WV students, teachers &amp; parents: http://t.co/Ndk4pGhPDZ http://t.co/UYeBeC4WWn",,,,,
621700727493148672,193794406,sencapito,TweetDeck,2015-07-16 15:19:38,0,3,TRIO programs like Upward Bound help students succeed. Glad to announce new TRIO grants for WV http://t.co/iAOmDObFOf http://t.co/pFnaYoPXMe,,,,,
621650553127342080,193794406,sencapito,TweetDeck,2015-07-16 12:00:16,3,1,Reminder: #CapitoConnect listening sessions today in Grant &amp; Hancock Counties. More details: http://t.co/gLbRtoV1cP http://t.co/t7ohjaEpRH,,,,,
621469353385394178,193794406,sencapito,TweetDeck,2015-07-16 00:00:14,3,0,Two #CapitoConnect listening sessions happening tomorrow. Stop by one of our locations: http://t.co/gLbRtoV1cP http://t.co/Ltwpae1kYJ,,,,,
621450594855878656,193794406,sencapito,TweetDeck,2015-07-15 22:45:42,2,3,Read to @americorps #EnergyExpress students in Flemington: http://t.co/zAOxEoH1S7 What’s on your summer reading list? http://t.co/IHPhSVxIT8,,,,,
621411477115772928,193794406,sencapito,TweetDeck,2015-07-15 20:10:16,15,23,What’s one of my favorite parts of the week? Visiting with constituents like these from Cross Lanes Christian School. http://t.co/QTlSjEvyZJ,,,,,
621375146188795904,193794406,sencapito,TweetDeck,2015-07-15 17:45:54,2,2,Considered nominations for @chemsafetyboard &amp; @USDOTFHWA at the @EPWRepublicans hearing this morning. http://t.co/cyJxxVLhiD,,,,,
621339300588875777,193794406,sencapito,TweetDeck,2015-07-15 15:23:27,1,4,Met with folks from @RIFWEB to discuss improving summer learning for WV children who live in poverty. http://t.co/S2miHTb0FD,,,,,
621280591934152704,193794406,sencapito,TweetDeck,2015-07-15 11:30:10,3,3,"#CapitoConnect listening sessions today in Romney, Parkersburg, &amp; St. Marys. More details here: http://t.co/gLbRtoV1cP",,,,,
621040936160784384,193794406,sencapito,TweetDeck,2015-07-14 19:37:52,0,1,Glad to be there. Congratulations!  https://t.co/FswmzNrCHW,,,,,
621018569141321728,193794406,sencapito,TweetDeck,2015-07-14 18:08:59,0,2,"Check out @wvstatejournal's #55GoodThingsAboutWV to learn about the people, places &amp; things that make WV great: http://t.co/k89nscsXwN",,,,,
620980281386901504,193794406,sencapito,TweetDeck,2015-07-14 15:36:50,2,0,Happening now: speaking with @HoppyKercheval on @WVMetroNews about the #IranDeal. Listen live here: http://t.co/jehbgFxtmI,,,,,
620979109519360000,193794406,sencapito,TweetDeck,2015-07-14 15:32:11,4,5,Any agreement that risks the security of the US &amp; our allies won’t advance our goal of ending #Iran’s nuclear program http://t.co/RuKX1ucFuA,,,,,
620942936780374020,193794406,sencapito,TweetDeck,2015-07-14 13:08:27,2,0,RT to spread the word: Hosting a #CapitoConnect listening session in Marshall Co. today at 11. More details here: http://t.co/gLbRtoV1cP,,,,,
620918198959931392,193794406,sencapito,TweetDeck,2015-07-14 11:30:09,2,0,.@WV_DHHR will receive grant funding to improve mental health &amp; substance abuse services for WV youth. Learn more: http://t.co/3ia8w01P9P,,,,,
620775760937271296,193794406,sencapito,Twitter for iPhone,2015-07-14 02:04:09,10,8,"Sadden by the passing of Helen Holt. As WV's 1st female Secretary of State, she was a true inspiration. Honored to serve w/ her son Rush.",,,,,
620737006750949376,193794406,sencapito,TweetDeck,2015-07-13 23:30:09,3,1,VIDEO: Bipartisan #EveryChildAchieves Act puts decisions about education back in the hands of those who know best https://t.co/YxvShUWrOY,,,,,
620707328124325888,193794406,sencapito,TweetDeck,2015-07-13 21:32:13,6,0,.@GovTomblin has declared State of Emergency in 3 counties &amp; more storms expected tonight. Use caution &amp; follow @WV511 for road closures.,,,,,
620682662877859840,193794406,sencapito,TweetDeck,2015-07-13 19:54:13,4,0,Speaking on the Senate floor now about the #EveryChildAchieves Act. Watch here: http://t.co/aOx3n6K5Tm,,,,,
620638889225535488,193794406,sencapito,TweetDeck,2015-07-13 17:00:16,2,2,ICYMI: @IntelligencerWV editorial features highlights from my first six months in the Senate: http://t.co/XoBMcCsahv,,,,,
620608035443097600,193794406,sencapito,Twitter Web Client,2015-07-13 14:57:40,1,9,Heading back to DC with Charlie and Celia after a fun weekend in WV. Nothing beats spending time with our grandkids! http://t.co/5qDHyG5RWF,,,,,
620276479268515840,193794406,sencapito,TweetDeck,2015-07-12 17:00:11,3,1,Don’t miss my #CapitoConnect listening session in Calhoun County tomorrow at 11 am. More details here http://t.co/gLbRtoV1cP,,,,,
620223622842486785,193794406,sencapito,TweetDeck,2015-07-12 13:30:09,3,2,ICYMI: Spoke with Gray TV about my #CapitoConnect plan to bridge the #broadband gap in WV. Watch below: https://t.co/lAwhBQJrmU,,,,,
619981149385961473,193794406,sencapito,Twitter for iPhone,2015-07-11 21:26:39,6,3,Must-read in today's @IntelligencerWV:  Capito Off to Good Start in U.S. Senate: http://t.co/U0NNNrq6jT,,,,,
619898993909170176,193794406,sencapito,TweetDeck,2015-07-11 16:00:11,2,4,Enjoyed hearing an update on the progress of the new Shepherdstown Public Library. Thanks for stopping by! http://t.co/9PSbIK72cq,,,,,
619853737280999424,193794406,sencapito,TweetDeck,2015-07-11 13:00:21,3,1,Read my e-newsletter for highlights from this week in Washington: http://t.co/FWWupA0FQO http://t.co/FEofHqdCgS,,,,,
619657422626406400,193794406,sencapito,TweetDeck,2015-07-11 00:00:16,4,2,"Announced funding for WV Volunteer Fire Depts &amp; Emergency Medical Services in Putnam, Wood &amp; Greenbrier Counties: http://t.co/ypMSofceFl",,,,,
619612122004111360,193794406,sencapito,TweetDeck,2015-07-10 21:00:16,1,0,ICYMI: Discussed my first 6 months in the Senate &amp; the progress we’ve made for WV with @wtaptelevision. https://t.co/KFzGczKK69,,,,,
619576679296598016,193794406,sencapito,TweetDeck,2015-07-10 18:39:26,1,1,Productive week marking my six months in the Senate! Watch my weekly video address for all the details: https://t.co/p21UhdGvup,,,,,
619541280293523456,193794406,sencapito,TweetDeck,2015-07-10 16:18:46,1,4,Sat down with @DEANews Acting Administrator Chuck Rosenberg to discuss curbing WV’s devastating drug epidemic. http://t.co/cXGcJ1qtvH,,,,,
619500551999520768,193794406,sencapito,TweetDeck,2015-07-10 13:36:56,2,1,Thank you to the WVians who stopped by to see me in DC this week! View the album: http://t.co/DHh0IKVbWM #WVWednesday http://t.co/maQ1mKOEfi,,,,,
619253481732333568,193794406,sencapito,TweetDeck,2015-07-09 21:15:09,1,4,A behind the scenes look at my interview yesterday with @TeamCavuto on @FoxNews. #tbt http://t.co/Ow2hdK5AgJ,,,,,
619236830303637504,193794406,sencapito,TweetDeck,2015-07-09 20:08:59,2,2,Supported 2 bipartisan measures today to improve community schools and protect WV students. Read more here: http://t.co/2VIkBxkI6R #ECAA,,,,,
619208214618353664,193794406,sencapito,TweetDeck,2015-07-09 18:15:17,1,1,Pleased to support new @CommerceGov designation that will boost #manufacturing in northern WV. Learn more: http://t.co/fdkOTg9guq,,,,,
619185995561443328,193794406,sencapito,TweetDeck,2015-07-09 16:46:59,3,2,Had a blast being interviewed by 11-year-old Christian Deiss for his sports column. Read here: http://t.co/TXKMjEEEzN http://t.co/Ks8Y5MPzrH,,,,,
619107674563694592,193794406,sencapito,TweetDeck,2015-07-09 11:35:46,14,0,RT @SenateMajLdr: #backtowork -&gt; Editorial: US Senate returns as a deliberative body. @charleywest cc:@SenCapito http://t.co/ByJnzNgVqU htt…,,,618826680346521601,1249982359,SenateMajLdr
618925078877634561,193794406,sencapito,TweetDeck,2015-07-08 23:30:12,1,1,Don’t miss tomorrow’s #CapitoConnect listening sessions in Braxton &amp; Ritchie Counties. More details: http://t.co/gLbRtoV1cP,,,,,
618913368796217345,193794406,sencapito,TweetDeck,2015-07-08 22:43:40,9,1,Spoke with @TeamCavuto on @FoxNews about @EPA overreach &amp; the recent #SCOTUS ruling. Watch here: https://t.co/9Qn77il2eU,,,,,
618857143677030402,193794406,sencapito,TweetDeck,2015-07-08 19:00:15,4,1,A behind the scenes look at @EPWRepublicans hearing this AM on @POTUS International Climate Agenda. http://t.co/wwEiSZgOuk,,,,,
618842032405000192,193794406,sencapito,TweetDeck,2015-07-08 18:00:12,4,7,Honored to be with West Virginia’s own #MoH recipient @WoodyWilliams45 at @USMC's Sunset Parade last night. http://t.co/qgzOlKvQnP,,,,,
618796319021379584,193794406,sencapito,TweetDeck,2015-07-08 14:58:33,8,3,Today’s @charleywest editorial highlights how we’re getting the Senate #backtowork. Read it here: http://t.co/Zc24XinYgq,,,,,
618756444511342593,193794406,sencapito,TweetDeck,2015-07-08 12:20:06,2,0,Joining @Talkradiowrnr at 8:40 AM to talk about #SCOTUS MATS ruling. Listen live here: http://t.co/gqSEJvpTdK,,,,,
618546678379999232,193794406,sencapito,TweetDeck,2015-07-07 22:26:34,2,2,Don’t miss tomorrow’s #CapitoConnect listening session at the Randolph Co. Senior Center at 10 am. Learn more: http://t.co/gLbRtpcCBp,,,,,
618520958190661632,193794406,sencapito,TweetDeck,2015-07-07 20:44:22,1,1,Hosted a roundtable w/ @DeptVetAffairs officials on enhancing access to care for our #veterans http://t.co/otGMiSHSvP http://t.co/4nA6Ep8jhl,,,,,
618418939262050304,193794406,sencapito,TweetDeck,2015-07-07 13:58:59,3,3,Introduced bipartisan legislation to safeguard hard-earned benefits for WV miners &amp; their families today. Learn more: http://t.co/3sr1Ulu6Zj,,,,,
618135180360974336,193794406,sencapito,TweetDeck,2015-07-06 19:11:26,4,1,ICYMI: Check out my op-ed in @charleywest highlighting the importance of #internet access for students http://t.co/xFILdGyGyS #CapitoConnect,,,,,
618086253561561089,193794406,sencapito,TweetDeck,2015-07-06 15:57:00,2,2,Congrats to @wvuwomenssoccer's Kadeisha Buchanan on winning the prestigious @FIFAWWC Best Young Player Award: http://t.co/CCxPEnZDaT,,,,,
617754893982437377,193794406,sencapito,TweetDeck,2015-07-05 18:00:18,6,4,Took a trip down memory lane with @WTRF7News' @TBlanchardWTRF at my childhood home in Glen Dale. – https://t.co/dg39lYlsJS,,,,,
617679348548526080,193794406,sencapito,TweetDeck,2015-07-05 13:00:07,4,3,"Spoke w/ @USArmy NCO’s about #NotInMySquad, which aims to establish a safer &amp; more inclusive culture. http://t.co/zySMSASzSK",,,,,
617363647782875136,193794406,sencapito,Twitter for iPhone,2015-07-04 16:05:38,8,13,Enjoyed celebrating America's birthday and seeing @RepEvanJenkins at the 54th Annual Alderson #July4th Parade. http://t.co/ax27zCgi6S,,,,,
617326530994302976,193794406,sencapito,Twitter Web Client,2015-07-04 13:38:09,4,12,Wishing all West Virginians a happy and safe #July4th: http://t.co/98XEpnj3h1 http://t.co/wAVNBy4veV,,,,,
617052637016494080,193794406,sencapito,Twitter for iPhone,2015-07-03 19:29:47,8,3,Read my op-ed in today’s @charleywest about the importance of digital learning tools outside of the classroom: http://t.co/N58ge5rD69,,,,,
617030109011181569,193794406,sencapito,TweetDeck,2015-07-03 18:00:16,7,13,WV FFA’s Sydney Hudson stopped by my office recently to discuss the importance of agricultural education. http://t.co/1lslrqWSmg,,,,,
616954590085300224,193794406,sencapito,TweetDeck,2015-07-03 13:00:11,5,1,Spoke w/ Gray TV about legislation aimed at providing safer &amp; more effective pain management services for veterans: https://t.co/q9pId4PVg3,,,,,
616682822640623616,193794406,sencapito,TweetDeck,2015-07-02 19:00:16,6,5,Don’t miss my interview w/ @WTRF7News' @TBlanchardWTRF tonight at 6 PM. We’ll be revisiting my hometown of Glen Dale. http://t.co/EshUZHArcS,,,,,
616622190935584769,193794406,sencapito,TweetDeck,2015-07-02 14:59:21,3,4,Appreciate all the hard work @hospicewv does to provide comfort for #hospice patients &amp; their families. http://t.co/57zzkSTSPK,,,,,
616350633709318144,193794406,sencapito,TweetDeck,2015-07-01 21:00:16,5,4,"School is out for the summer, but my offices are now accepting applications for Fall internships. Learn more: http://t.co/XDG1ND4YUX",,,,,
616312863418769408,193794406,sencapito,TweetDeck,2015-07-01 18:30:11,1,3,40 bipartisan bills + 1 balanced budget = getting #backtowork. Proud to be a part of restoring the Senate. http://t.co/FFFhiK3ZgZ,,,,,
616282683870568448,193794406,sencapito,TweetDeck,2015-07-01 16:30:16,1,1,Good news for Tucker County: @NYSF has finalized purchase of @Canaanvi facility for a new #STEM education center: http://t.co/6PyMx97Vh4,,,,,
616240200101036032,193794406,sencapito,TweetDeck,2015-07-01 13:41:27,2,2,Discussed efforts to close the #HomeworkGap by improving access to the #Internet on @SenAngusKing's radio show: http://t.co/TZxTufH5Ek,,,,,
615992419016962050,193794406,sencapito,Twitter Web Client,2015-06-30 21:16:51,2,4,.@USDOL funding for WorkForce WV will help spur job creation &amp; assist communities harmed by recent severe weather: http://t.co/HL7ABpdHOC,,,,,
