id,user_id,screen_name,source,created_at,retweet_count,favorite_count,text,in_reply_to_screen_name,in_reply_to_status_id,retweeted_status_id,retweeted_status_user_id,retweeted_status_screen_name
279653069896159232,193794406,sencapito,TweetDeck,2012-12-14 18:24:22,11,0,My thoughts and prayers are with the victims of the #Newton school shootings.  This is a devastating tragedy.,,,,,
279343609390710784,193794406,sencapito,TweetDeck,2012-12-13 21:54:41,5,0,"Happy 376th Anniversary to the United States National Guard, the oldest component of the Armed Forces!",,,,,
279296116703522816,193794406,sencapito,TweetDeck,2012-12-13 18:45:58,0,0,I met w/ reps from the #WV Farm Bureau in my DC office. I was honored to be awarded “Friend of the Farm Bureau” in Oct http://t.co/vEw5WviZ,,,,,
278949097409478656,193794406,sencapito,TweetDeck,2012-12-12 19:47:02,3,0,You can view my remarks from today's Press Conference here:  http://t.co/8Vavdc2b,,,,,
278603757388955649,193794406,sencapito,TweetDeck,2012-12-11 20:54:46,5,0,Thinking and praying for those affected by #KanCoBlast   Following news updates closely #WV,,,,,
278585061190799360,193794406,sencapito,TweetDeck,2012-12-11 19:40:29,0,1,Looking forward to continuing on as Subcommittee Chairman on Fin Serv. Talked about goals today at #P2012 @politico,,,,,
278579315208241152,193794406,sencapito,TweetDeck,2012-12-11 19:17:39,0,1,Thanks to @POLITICO for inviting me to talk about future of financial serv. at #P2012 today,,,,,
277161972431204352,193794406,sencapito,TweetDeck,2012-12-07 21:25:38,4,0,Today we remember those who perished on this day 71 years ago in the attack on Pearl Harbor.  http://t.co/OikbSyh4,,,,,
277094630749773824,193794406,sencapito,TweetDeck,2012-12-07 16:58:02,0,0,My statement on today's Jobs Numbers: http://t.co/2XCt3dkC,,,,,
276433702156894210,193794406,sencapito,TweetDeck,2012-12-05 21:11:45,0,0,"I welcomed ""Bugs"" in my DC office last week at the end of his 300 mile walk from West Virginia!  http://t.co/c1eWuTnn",,,,,
276390836084805632,193794406,sencapito,TweetDeck,2012-12-05 18:21:25,1,0,ICYMI: @charleywest Bipartisan support to speed up disaster assistance decisions after storms in #WV  http://t.co/ISLyXEQS,,,,,
275986057361768448,193794406,sencapito,TweetDeck,2012-12-04 15:32:58,1,0,Tune into @HoppyKercheval today at 11:30am.  Will discuss solutions to fiscal cliff.,,,,,
273919188853223424,193794406,sencapito,TweetDeck,2012-11-28 22:39:59,1,3,Recording a Holiday message to send to our troops overseas http://t.co/hgp3mEwZ,,,,,
272427594413129728,193794406,sencapito,Twitter for iPhone,2012-11-24 19:52:54,3,1,@PlayStation,PlayStation,272156833685307392,,,
271307226952654848,193794406,sencapito,TweetDeck,2012-11-21 17:40:58,1,0,"RT @taykuy: @RepShelley: ""When I say ""all-of-the-above"" energy plan, I mean it."" http://t.co/3T6tu8ee",,,270914927177383936,15714370,taykuy
271295558017236994,193794406,sencapito,TweetDeck,2012-11-21 16:54:36,2,1,Happy Thanksgiving to you and your family! http://t.co/b6k87CLI,,,,,
268077911066693632,193794406,sencapito,Twitter Web Client,2012-11-12 19:48:49,3,0,"This Veteran’s Day, thank you to Americans who risk their lives every day, all over the world, to defend freedom &amp; opportunity back home.",,,,,
266939330193403905,193794406,sencapito,TweetDeck,2012-11-09 16:24:30,6,1,I am forever grateful to the men and women who serve in the military for their selfless service #VeteransDay,,,,,
264765011480678402,193794406,sencapito,Twitter Web Client,2012-11-03 16:24:32,3,0,"(2 of 2) around the clock to keep constituents updated and safe before, during and after Hurricane Sandy #WV",,,,,
264764902294568960,193794406,sencapito,Twitter Web Client,2012-11-03 16:24:06,3,0,"V. Grateful to the first responders, utility workers, division of highway workers, volunteers and members of the media who worked (1 of 2)",,,,,
264762639547240449,193794406,sencapito,Twitter Web Client,2012-11-03 16:15:06,1,0,Today I met with Secretary Napolitano in West Virginia to discuss storm damage caused by Hurricane Sandy,,,,,
264761869972144128,193794406,sencapito,Twitter Web Client,2012-11-03 16:12:04,3,0,http://t.co/RGvpbW9t,,,,,
264487223100059648,193794406,sencapito,Twitter Web Client,2012-11-02 22:00:42,7,0,"ICYMI ----&gt; Mining lost 9,000 jobs in October.  http://t.co/J84LTIDB",,,,,
264485780402077696,193794406,sencapito,Twitter Web Client,2012-11-02 21:54:58,2,0,RT @HouseVetAffairs Here is a list of the resources available to veterans affected by #HurricaneSandy: http://t.co/ZTTOPQxy,,,,,
263729470987452416,193794406,sencapito,TweetDeck,2012-10-31 19:49:40,0,0,FYI RT @wvgov: UPDATE #8 - 3:25pm: Storm Shelters are open &amp; available for WV residents.The full list of shelters here: http://t.co/Ii3sQdv7,,,,,
263351126265569280,193794406,sencapito,Twitter Web Client,2012-10-30 18:46:15,3,0,My offices in West Virginia are open and ready to help.  Contact info here:  http://t.co/UPewzlrP,,,,,
263350834094563328,193794406,sencapito,Twitter Web Client,2012-10-30 18:45:06,10,0,"RT @KanawhaCoAlerts: AEP is reporting that 45,316 people are without power in Kanawha County.",,,263347933284556800,237741677,KanawhaCoAlerts
263283110853095424,193794406,sencapito,Twitter Web Client,2012-10-30 14:15:59,5,0,---&gt; Click here for updated road conditions.  Please share this &amp; other safety info with those without power. http://t.co/sd9i9gCs,,,,,
263281323051986945,193794406,sencapito,Twitter Web Client,2012-10-30 14:08:53,11,0,RT @KanawhaCoAlerts: The National Weather Service has issued a winter storm warning for Kanawha County until 5:00 p.m.,,,263279537062834176,237741677,KanawhaCoAlerts
263281109440294912,193794406,sencapito,Twitter Web Client,2012-10-30 14:08:02,1,0,"Hoping West Virginians are staying safe.  And to those without power, I hope it returns soon!",,,,,
263110326185250816,193794406,sencapito,Twitter Web Client,2012-10-30 02:49:24,3,0,Keeping all West Virginians affected by #Sandy in my thoughts &amp; prayers.  Please stay safe. More info: http://t.co/mwxqZmvI,,,,,
263045559714197504,193794406,sencapito,Twitter Web Client,2012-10-29 22:32:03,0,0,ATTN: Click here to track Hurricane Sandy's progress and to find tips on preparedness:  http://t.co/ycfgryu2,,,,,
261890848176881665,193794406,sencapito,TweetDeck,2012-10-26 18:03:38,0,0,Congrats! #WV 1 of 6 states to earn top honors in 2012 Digital States Survey of tech practices of state governments http://t.co/YZPQiuje,,,,,
261526563235983361,193794406,sencapito,TweetDeck,2012-10-25 17:56:06,0,0,Enjoyed attending yesterday ---&gt; Officials break ground on new guard center - http://t.co/RsqCLxqS http://t.co/MIOYgUKo,,,,,
261510075020095488,193794406,sencapito,TweetDeck,2012-10-25 16:50:35,1,1,Visited the #WV National Guard tire rebuild center in Kanawha City today http://t.co/xHgrQpLk,,,,,
261187870256140288,193794406,sencapito,TweetDeck,2012-10-24 19:30:15,0,1,Great time at the Groundbreaking of the Buckhannon Armed Forces Readiness Center this morning!  #WV http://t.co/7H0LIUFZ,,,,,
258296449496928256,193794406,sencapito,TweetDeck,2012-10-16 20:00:47,0,0,PHOTO: At the Lights Out After School Open House at The King Center http://t.co/tiX7hTRv,,,,,
257948442763091968,193794406,sencapito,TweetDeck,2012-10-15 20:57:56,0,0,Enjoyed meeting with Thomas Johnson &amp; Tim Gooch while touring construction site of new Sissonville Fire Department. http://t.co/lCeG6uUD,,,,,
257937549388034050,193794406,sencapito,TweetDeck,2012-10-15 20:14:38,0,0,@charleywest PHOTO of the Gestamp Plant dedication today: http://t.co/9cDUlsVW,charleywest,,,,
257921893418541056,193794406,sencapito,TweetDeck,2012-10-15 19:12:26,0,0,Looking forward to touring construction of the new Sissonville fire department today! #WV,,,,,
255980585032482816,193794406,sencapito,Twitter for iPhone,2012-10-10 10:38:22,1,0,Tune in! Getting ready to go on @CNBC  to talk about new rules affecting community banks,,,,,
255860649094180864,193794406,sencapito,Twitter Web Client,2012-10-10 02:41:47,2,1,Disappointed Ravenswood Century Aluminum plant is not yet ready to open. Hope this is resolved soon so we can get #WV back to work,,,,,
255798913389428738,193794406,sencapito,Twitter Web Client,2012-10-09 22:36:28,3,0,PHOTO: Catch me on @TeamCavuto on @FoxBusiness around 8pm &amp; 11pm Eastern tonight! http://t.co/rIdBcfU4,,,,,
254225554033766400,193794406,sencapito,TweetDeck,2012-10-05 14:24:30,1,0,Working w/ @RepCleaver to promote #CapitolCivility --&gt; Gene A. Budig &amp; Alan Heaps: Civility missing in U.S. politics: http://t.co/VETK1eZV,,,,,
253583690792321025,193794406,sencapito,TweetDeck,2012-10-03 19:53:57,1,0,ICYMI: @WVMetroNews Daughter Happy To Get Her Dad's Medals http://t.co/RcBkYEps,,,,,
253481143163305984,193794406,sencapito,TweetDeck,2012-10-03 13:06:29,3,0,Pic from Saturday: Great mountaineer and great game! http://t.co/3X80DcoY,,,,,
252081469063847936,193794406,sencapito,Twitter Web Client,2012-09-29 16:24:40,3,0,GAME DAY! Cheering on the @Mountaineers in Morgantown #WV today.  Beat Baylor!,,,,,
251709115032825856,193794406,sencapito,TweetDeck,2012-09-28 15:45:04,0,0,Don’t forget! Academy day this Sunday in Hedgesville. All #WV middle/high school students are invited. More info here: http://t.co/4pUQ5tnC,,,,,
251701806848151552,193794406,sencapito,TweetDeck,2012-09-28 15:16:01,1,0,Enjoyed speaking at the #WV Wellness Conference this morning.  Healthy employees = healthy workforce.,,,,,
251414686942248961,193794406,sencapito,TweetDeck,2012-09-27 20:15:07,0,0,"Congrats to Petty Officer Justin Faison, Almost Heaven Habitat for Humanity’s September Volunteer of the month! #WV",,,,,
251408832729870338,193794406,sencapito,TweetDeck,2012-09-27 19:51:51,2,0,Today I’m met local farmers in Pendleton to discuss how the EPA’s overregulation is affecting them #WV,,,,,
251335157200613376,193794406,sencapito,TweetDeck,2012-09-27 14:59:05,0,0,Looking forward to touring the Pendleton County Community Care Center today #WV,,,,,
249199801055465472,193794406,sencapito,TweetDeck,2012-09-21 17:33:57,28,0,Coal miners from #WV joined us in DC to share stories about how War on Coal is hurting families and communities. http://t.co/lJFAGMT7,,,,,
249198501827866624,193794406,sencapito,TweetDeck,2012-09-21 17:28:47,3,1,Retweet/Share if you believe we need more civility in Congress &amp; Politics #CapitolCivility,,,,,
249169492167516160,193794406,sencapito,TweetDeck,2012-09-21 15:33:30,3,2,Last day of session for a while. Not a day goes by that I’m not honored and humbled to represent #WV in this Capitol,,,,,
249154495043469312,193794406,sencapito,TweetDeck,2012-09-21 14:33:55,287,0,"RT @SamsPressShop: As a former POW in Vietnam for 7 years, I consider myself lucky. I returned home. To those who haven't returned, you  ...",,,249148175900884992,249288197,SamsPressShop
249153150072811521,193794406,sencapito,TweetDeck,2012-09-21 14:28:34,0,0,#CapitolCivility  --  POLITICO Huddle - http://t.co/3J4ZFn7t: GIVE CIVILITY A CHANCE http://t.co/jMxcJHBv via @politico,,,,,
249140791434436609,193794406,sencapito,TweetDeck,2012-09-21 13:39:28,3,0,Lawmakers re-launch civility caucus in time for Election Day - The Hill's Twitter Room http://t.co/B5BUhzH0 @thehill @thehilltweets,,,,,
249138189577641984,193794406,sencapito,TweetDeck,2012-09-21 13:29:07,0,0,Guess: How many of the 435 Members in the U.S. House of Representatives belong to the Civility Caucus?  #CapitolCivility,,,,,
249137837822324736,193794406,sencapito,TweetDeck,2012-09-21 13:27:43,2,0,Launched! Congressional Civility Caucus Facebook Page w/ @RepCleaver https://t.co/uGfVNPoG,,,,,
249137026350333952,193794406,sencapito,TweetDeck,2012-09-21 13:24:30,1,0,Thx! MT @ibleedgreen417: Great to hear @RepShelley on @foxnewsradio this AM. Thanks for representing our state so well and for all you...,,,,,
249136668433588227,193794406,sencapito,TweetDeck,2012-09-21 13:23:05,0,0,"RT @wsj: Since 2011, hundreds thousands of stay-at-home spouses may have been denied credit. That is changing: http://t.co/yLg1ZMJR",,,,,
248876098803355648,193794406,sencapito,TweetDeck,2012-09-20 20:07:40,6,0,Good cause ----&gt; Civility Caucus In Congress Turns To Facebook To Boost Membership http://t.co/GpgtO1Oa via @allfacebook #CapitolCivility,,,,,
248515743405182976,193794406,sencapito,TweetDeck,2012-09-19 20:15:45,0,0,RT @gopconference: VIDEO: The president's #WarOnCoal: http://t.co/Yxdvmxm1 | House #GOP has a plan: http://t.co/YWpH5926 #4jobs,,,,,
248510378278010880,193794406,sencapito,TweetDeck,2012-09-19 19:54:25,16,1,"Must Read: Obama policies hammered following coal-mine closings, layoffs http://t.co/EdhnRwJn",,,,,
248419331547987968,193794406,sencapito,TweetDeck,2012-09-19 13:52:38,0,0,"Join me for an ""Academy Day"" this Sunday in Charleston #WV.  http://t.co/oGRwfL2c",,,,,
248151827965689857,193794406,sencapito,TweetDeck,2012-09-18 20:09:40,8,0,"The President's ""War On Coal"" is Destroying Jobs #WV: http://t.co/hbxe6Fqd",,,,,
245541711634378754,193794406,sencapito,TweetDeck,2012-09-11 15:18:00,5,0,"RT @repcleaver: We remember those we lost, those who saved lives, and those who serve our country and keep us safe. #neverforget",,,245536712363761667,163570705,repcleaver
245529097952976897,193794406,sencapito,TweetDeck,2012-09-11 14:27:53,1,0,... and the men and women in our Armed Forces who protect us at home and abroad #911,,,,,
245528833464356866,193794406,sencapito,TweetDeck,2012-09-11 14:26:50,1,0,"Terrorists may attack our buildings but they can't wound our spirit. We will never forget the victims of 9/11, the brave first responders...",,,,,
245227815967002625,193794406,sencapito,TweetDeck,2012-09-10 18:30:42,3,0,"We need commonsense, bipartisan solutions to fix our debt problem -- $16 Trillion and counting",,,,,
245222059301556224,193794406,sencapito,TweetDeck,2012-09-10 18:07:50,1,0,"former Senator Alan Simpson, former Clinton Chief of Staff Erskine Bowles &amp; myself in #WV http://t.co/L7iliKlR",,,,,
245220727119282177,193794406,sencapito,TweetDeck,2012-09-10 18:02:31,0,0,Enjoyed discussing our country’s financial future at today’s Fiscal Summit in #WV,,,,,
245147149044678657,193794406,sencapito,TweetDeck,2012-09-10 13:10:09,1,0,RT @wburdette_SJ: Covering @Sen_JoeManchin's fiscal summit today. Several state/local political leaders in attendance as well. @RepShell ...,,,245146345059532801,251724335,wburdette_SJ
244147982428143616,193794406,sencapito,TweetDeck,2012-09-07 18:59:49,3,0,My statement on today’s disappointing job numbers: http://t.co/WmgOwwQl,,,,,
243416452521156608,193794406,sencapito,TweetDeck,2012-09-05 18:32:59,6,0,My thoughts and prayers are with State Trooper Eric Workman and State Police Cpl. Marshall Bailey’s families on this very sad day.,,,,,
243403645926924290,193794406,sencapito,TweetDeck,2012-09-05 17:42:06,4,0,"Attending State Police Trooper Eric Workman’s funeral today, one of two brave victims of last Tuesday’s senseless attack.",,,,,
243387171598385152,193794406,sencapito,TweetDeck,2012-09-05 16:36:38,3,0,(2 of 2) and I look forward to hearing from the amazing caregivers who assist  Alzheimers patients and their families,,,,,
243387119245070336,193794406,sencapito,TweetDeck,2012-09-05 16:36:25,4,2,Today I’m meeting with the Alzheimers Association Family Member Support Group.  This is a cause close to my heart (1 of 2),,,,,
243092033709961217,193794406,sencapito,TweetDeck,2012-09-04 21:03:51,3,2,Nat’l debt @ $16 TRILLION today.  Are you better off?  It’s time for policies that create jobs and shrink our debt.,,,,,
237987285386276865,193794406,sencapito,TweetDeck,2012-08-21 18:59:25,5,1,Check out my statement on U.S. Appeals Court Striking Down Excessive EPA Regulation http://t.co/QPpfmiYx,,,,,
237949791542329344,193794406,sencapito,TweetDeck,2012-08-21 16:30:25,7,0,RT @FinancialCmte: Link to story on yesterday's field hearing in W.Va. from @wvstatejournal http://t.co/Y1R0RX35 #DoddFrank,,,237948556898627584,42924141,FinancialCmte
237947436675514368,193794406,sencapito,TweetDeck,2012-08-21 16:21:05,0,0,At the Woodlands Development groundbreaking in Elkins. New LEED homes for lower-income families #WV http://t.co/Fh0igDFB,,,,,
237554518932455424,193794406,sencapito,TweetDeck,2012-08-20 14:19:45,0,0,"@FinancialCmte field hearing on how #redtape is hurting small, community financial institutions about to start in #WV http://t.co/BuQx8wBa",FinancialCmte,,,,
236190315034329088,193794406,sencapito,TweetDeck,2012-08-16 19:58:53,2,0,RT @FinancialCmte: .@RepShelley chairs field hearing in #WV on Monday. Get the details: http://t.co/et8ZHDGq,,,236163704239058944,42924141,FinancialCmte
235833537817890818,193794406,sencapito,TweetDeck,2012-08-15 20:21:17,3,3,Thrilled to be at the Kanawha CTC ribbon cutting today! #WV #Jobs http://t.co/BA6uKWfk,,,,,
235830838644834305,193794406,sencapito,TweetDeck,2012-08-15 20:10:28,1,0,Speaking at Kanawha Valley Community and Technical College http://t.co/MLP1ZX3q,,,,,
235818318458654720,193794406,sencapito,TweetDeck,2012-08-15 19:20:43,2,0,Heading to Kanawha CTC Ribbon Cutting now,,,,,
235813550591967232,193794406,sencapito,TweetDeck,2012-08-15 19:01:46,1,1,Great day in #WV. Spent this morning with DRs and Hospitals to talk about #healthcare,,,,,
235455550857543680,193794406,sencapito,TweetDeck,2012-08-14 19:19:13,0,1,Touring Kanawha Scales and Systems #WV http://t.co/N99E4MjE,,,,,
235451066819424256,193794406,sencapito,TweetDeck,2012-08-14 19:01:23,0,0,Spending the afternoon touring 2 export businesses in #WV,,,,,
235442957317193728,193794406,sencapito,TweetDeck,2012-08-14 18:29:10,2,0,Award presentation at US Export Assistance Center #WV merchandise exports up 31% in first 1/2 2012. Good 4 communities http://t.co/tWw4P6Bd,,,,,
235407842809618432,193794406,sencapito,TweetDeck,2012-08-14 16:09:39,2,1,Speaking @ Kanawha Valley Senior Services; discussing importance of helping seniors live more independent lives http://t.co/F9KCNrte,,,,,
232497641735475200,193794406,sencapito,TweetDeck,2012-08-06 15:25:32,2,0,ICYMI: My op-ed in this weekend's Gazette http://t.co/qa6Fwrfp,,,,,
231406103584456705,193794406,sencapito,TweetDeck,2012-08-03 15:08:09,2,1,Tune into @SeanHannity tonight @ 9pm!  http://t.co/Sppx7VQR,,,,,
231102209272733696,193794406,sencapito,TweetDeck,2012-08-02 19:00:35,3,0,MT @gopconference: How many jobs were created under President Obama? Grab your magnifying glass: http://t.co/XOJplde1 (via @washingtonpost),,,,,
231022283001569280,193794406,sencapito,TweetDeck,2012-08-02 13:42:59,0,0,Tune In! I will be live with @HoppyKercheval at 10:06am to discuss extending tax breaks &amp; tax reform,,,,,
230778575949807616,193794406,sencapito,TweetDeck,2012-08-01 21:34:34,0,0,Today my bill to limit EPA from conducting unnecessary aerial surveillance of farms advanced in the House. More here: http://t.co/h7DUdUWL,,,,,
230767047943012354,193794406,sencapito,TweetDeck,2012-08-01 20:48:46,4,0,If Congress doesn’t act Americans will ring in the New Year w/ New Taxes.  Tweet #StopTheTaxHike to share comments  http://t.co/REgOzegT,,,,,
230737009696702464,193794406,sencapito,TweetDeck,2012-08-01 18:49:24,1,0,RT @gopconference: We're working to #StopTheTaxHike on every hardworking American taxpayer and small business. VIDEO: http://t.co/GJ5AG4yr,,,,,
230433516570157057,193794406,sencapito,TweetDeck,2012-07-31 22:43:26,8,1,Today DC Courts—once again—ruled against overactive EPA.  Win for #WV,,,,,
230428470197485570,193794406,sencapito,TweetDeck,2012-07-31 22:23:23,2,0,I’ve been rooting for #TeamUSA all week!  What has been your favorite event?,,,,,
228934000977264641,193794406,sencapito,TweetDeck,2012-07-27 19:24:53,3,0,My thoughts and prayers are with the family and friends of the miner killed in Boone County this morning,,,,,
228907826947428353,193794406,sencapito,TweetDeck,2012-07-27 17:40:53,6,1,"2 years ago our state witnessed great tragedy, loosing 29 of our fellow West Virginians in a heartbreaking mining disaster @ubbmemorial",,,,,
228876014657343488,193794406,sencapito,TweetDeck,2012-07-27 15:34:28,2,2,Attending @ubbmemorial memorial to honor fallen miners and their families,,,,,
228260946144014337,193794406,sencapito,TweetDeck,2012-07-25 22:50:25,5,1,Today I voted to #AuditTheFed - Passed w/ bipartisan support.  What are your thoughts on this issue?,,,,,
228255853424291841,193794406,sencapito,TweetDeck,2012-07-25 22:30:10,11,0,"Disappointed the Senate voted to raise taxes on nearly 1 million small business owners today—could destroy nearly 700,000 American jobs",,,,,
228120519722020865,193794406,sencapito,TweetDeck,2012-07-25 13:32:24,1,0,Another unintended consequence: @WSJ Affordable Care Act could cost McDonald’s &amp; its franchisees +$400 million a year http://t.co/urxu18lz,,,,,
228105373637296128,193794406,sencapito,TweetDeck,2012-07-25 12:32:13,4,0,Did you see @CharleyWest Editorial on how Medicaid expansion may strain already struggling State budgets?  http://t.co/Q5rrMBoH,,,,,
226322197696897024,193794406,sencapito,TweetDeck,2012-07-20 14:26:31,3,0,Praying for the victims of the senseless tragedy in Colorado last night.,,,,,
226061167548829696,193794406,sencapito,TweetDeck,2012-07-19 21:09:17,1,0,Tune In! Tomorrow at 8:10am EST I'll be on @SquawkCNBC to discuss how Dodd-Frank is hurting the economy and #Jobs,,,,,
226055361008914432,193794406,sencapito,TweetDeck,2012-07-19 20:46:12,2,0,ICYMI: My speech in #Congress supporting an efficient permitting process for clean water act permits #WV http://t.co/cXDP1K9J,,,,,
225654948359180290,193794406,sencapito,Twitter for iPhone,2012-07-18 18:15:07,1,0,Thank you to @macys CEO terry lundgren for joining us in #wv for the dedication of new fulfillment center http://t.co/DPP0Tpgh,,,,,
225650873999687680,193794406,sencapito,Twitter for iPhone,2012-07-18 17:58:56,2,0,Next time I buy a pair of shoes from @Macys I'll know they passed through the eastern panhandle! #WV http://t.co/Z71w7K4p,,,,,
225591806606315521,193794406,sencapito,Twitter for iPhone,2012-07-18 14:04:13,0,0,@Macys fulfillment center in Martinsburg brings hundreds of jobs to the community! #WV is a great place to do business http://t.co/xbCrY6gV,Macys,,,,
225387022737604608,193794406,sencapito,Twitter Web Client,2012-07-18 00:30:28,1,0,Thrilled to go to Berkeley County #WV tomorrow morning for the dedication ceremony of the new @Macys fulfillment center,,,,,
225386550760972288,193794406,sencapito,Twitter Web Client,2012-07-18 00:28:35,0,0,Happy Jon could be home w/ his wife for his son’s birth. Prayers are w/ his family and for baby Jaxon’s full recovery http://t.co/50MAoICh,,,,,
223825852499116032,193794406,sencapito,TweetDeck,2012-07-13 17:06:56,2,1,Live on @CNBC from the @WSAZnews studios in #WV http://t.co/qmJTx6n0,,,,,
223823835735134208,193794406,sencapito,TweetDeck,2012-07-13 16:58:55,2,0,Tune into @CNBC @PowerLunch at 1:05 EST I’ll be discussing the looming fiscal cliff &amp; why it’s a bad idea to increase taxes on job creators,,,,,
223523855979905025,193794406,sencapito,TweetDeck,2012-07-12 21:06:54,1,0,On my way back to #WV today. Busy week in Washington --it’s good to be heading home!,,,,,
223061600754614272,193794406,sencapito,TweetDeck,2012-07-11 14:30:04,1,0,Send pics of storm &amp; of how much we came together as a community last week 2 WVStorm@mail.house.gov Want 2 share w/ colleagues in DC,,,,,
223048050665463808,193794406,sencapito,TweetDeck,2012-07-11 13:36:13,2,0,Wow! Great telephone townhall with #WV02 last night. Enjoyed hearing thoughts &amp; concerns. Will host more soon. Thanks for participating!,,,,,
220566625336836097,193794406,sencapito,Twitter Web Client,2012-07-04 17:15:56,3,0,Happy 4th of July!,,,,,
220251068267900928,193794406,sencapito,TweetDeck,2012-07-03 20:22:02,0,0,Cooling Station in Kanawha City http://t.co/P57QOdOC,,,,,
220250620496584704,193794406,sencapito,TweetDeck,2012-07-03 20:20:14,1,0,Info about food drive at #WV Capitol today: http://t.co/mtXMwHlr,,,,,
220241994621005825,193794406,sencapito,TweetDeck,2012-07-03 19:45:58,1,0,Touring Kanawha Emergency Services Metro 911 Center in #WV,,,,,
220240131385339904,193794406,sencapito,TweetDeck,2012-07-03 19:38:33,3,0,RT @jaredwv: .@RepShelley announces $4.1 million grant from US Dept of Transportation to help with cleanup efforts in WV.,,,220236126491918337,204540648,jaredwv
220228738837790720,193794406,sencapito,TweetDeck,2012-07-03 18:53:18,0,0,Getting briefed by FEMA in #WV http://t.co/4x9scnYj,,,,,
220213533793730561,193794406,sencapito,TweetDeck,2012-07-03 17:52:54,1,1,Visiting the National Guard Command Center that tracks and dispenses emergency information http://t.co/obFnSKZA,,,,,
220171521912614913,193794406,sencapito,TweetDeck,2012-07-03 15:05:56,1,0,"RT @charleywest: To report damage to property (Kanawha County), call 304-357-0570. This will help determine the total damage to the coun ...",,,220170186781753344,16259734,charleywest
219895725729914880,193794406,sencapito,TweetDeck,2012-07-02 20:50:01,8,0,Additional info from FEMA about state of emergency in #WV: http://t.co/K766OvLm,,,,,
219886914927460352,193794406,sencapito,TweetDeck,2012-07-02 20:15:00,0,0,Click here for outage safety tips: https://t.co/8x5BWWKL,,,,,
219881938272518144,193794406,sencapito,TweetDeck,2012-07-02 19:55:13,12,0,"For constituents who need special attention related to the power outages (inc emergency access to medication, oxygen) call 304-558-2000",,,,,
219491273097232384,193794406,sencapito,Twitter Web Client,2012-07-01 18:02:52,6,0,"ATTN: list of cooling stations: http://t.co/cK2PWvT9  If you have power, please share with family and neighbors who don't.",,,,,
219490629242191873,193794406,sencapito,Twitter Web Client,2012-07-01 18:00:18,3,0,For emergency information and resources contact your local county Emergency Operations Center http://t.co/OMBHbP7C,,,,,
