id,user_id,screen_name,source,created_at,retweet_count,favorite_count,text,in_reply_to_screen_name,in_reply_to_status_id,retweeted_status_id,retweeted_status_user_id,retweeted_status_screen_name
578967747880742912,193794406,sencapito,Twitter Web Client,2015-03-20 17:14:02,10,5,Good luck to @WVUhoops in today’s game against Buffalo. We’ve got this #Mountaineers! RT if you’re cheering for #WVU,,,,,
578676782624333824,193794406,sencapito,Twitter Web Client,2015-03-19 21:57:50,4,4,The Robert C. Byrd Corridor H Authority &amp; I share a commitment to completing #CorridorH: http://t.co/jIVOmVGsr5 http://t.co/rbi8pv6cYz,,,,,
578574124831887360,193794406,sencapito,TweetDeck,2015-03-19 15:09:55,0,0,Read my full statement here: http://t.co/zrBFrs8y6M (2/2),,,,,
578574085833297920,193794406,sencapito,TweetDeck,2015-03-19 15:09:46,2,3,"Sadden to learn of Gus Douglass’ death. He was a tireless advocate for WV farmers, agriculture &amp; rural communities (1/2)",,,,,
578316676678184960,193794406,sencapito,Twitter for iPhone,2015-03-18 22:06:54,25,27,"Filling out my @marchmadness bracket. #Mountaineers, it’s time to show the @POTUS he’s wrong about WV. Go @WVU! http://t.co/8VO9bXcZm3",,,,,
578277326766637056,193794406,sencapito,Twitter Web Client,2015-03-18 19:30:33,1,3,Amanda Smith from Kearneysville stopped by my office for #NationalAgricultureDay. Always enjoy meeting young WVians! http://t.co/uYNT7EB6Fb,,,,,
578239749804036096,193794406,sencapito,TweetDeck,2015-03-18 17:01:14,2,2,Encouraged that senators in both parties have recognized the importance of providing continued funding for #ExtendCHIP,,,,,
578207066864689152,193794406,sencapito,Twitter Web Client,2015-03-18 14:51:21,2,1,The @EPA’s ozone rule would cost WV more than $800 million per year. I’ve co-sponsored the #CASEact to fight back: http://t.co/jzyWHaXnEU,,,,,
578192817182367744,193794406,sencapito,Twitter Web Client,2015-03-18 13:54:44,7,0,#TSCA reform will aid response to situations like the Elk River spill. That’s why I co-sponsored the bill being considered. @EPWRepublicans,,,,,
578192629512474624,193794406,sencapito,Twitter Web Client,2015-03-18 13:53:59,0,0,Watch the @EPWRepublicans #TSCA hearing live here: http://t.co/qxE1YSRAxU,,,,,
577967045968560128,193794406,sencapito,Twitter Web Client,2015-03-17 22:57:36,12,11,It’s time to break through the partisan gridlock and #EndTrafficking: http://t.co/cXPXiW1Bry,,,,,
577931835457581056,193794406,sencapito,Twitter Web Client,2015-03-17 20:37:41,5,4,"Honored to have the oldest living #WWII veteran, Charles P. Clark, at @MartinsburgVAMC in West Virginia: http://t.co/Sb4OsVpYNv.",,,,,
577909278994014209,193794406,sencapito,Twitter Web Client,2015-03-17 19:08:03,4,6,Too many families are impacted by breast cancer. @Deadline2020 aims to end this disease: http://t.co/FbtcRqFb6l http://t.co/vTUxmBJQuN,,,,,
577908431237066752,193794406,sencapito,Twitter Web Client,2015-03-17 19:04:41,3,0,"RT @SenThadCochran: At 3:00 ET, @SenCapito will chair a Senate Approps hearing on the @librarycongress and @uscapitol budgets. Watch: http:…",,,577906079658590208,555474658,SenThadCochran
577822830538158080,193794406,sencapito,Twitter Web Client,2015-03-17 13:24:32,3,4,Spoke w @DeptVetAffairs Sec. McDonald today &amp; urged him to improve implementation of the #VA Choice Card Program &amp; rural access for #WV vets,,,,,
577540976488632320,193794406,sencapito,Twitter Web Client,2015-03-16 18:44:33,5,2,"Today, @Sen_JoeManchin &amp; I announced $1.5 million in @NHTSAgov grants for West Virginia highway safety programs: http://t.co/JgrqMnYmBq",,,,,
577479331896827904,193794406,sencapito,Twitter Web Client,2015-03-16 14:39:36,3,1,Interested in interning in my DC or Charleston office? Find the application for a summer internship here: http://t.co/XDG1NCNo3p,,,,,
577276539664015360,193794406,sencapito,Twitter for iPhone,2015-03-16 01:13:46,6,19,Congratulations @WVUhoops &amp; @CoachHuggs for making the NCAA Tournament. Can't wait to cheer on the #Mountaineers Friday!,,,,,
577091961074511873,193794406,sencapito,TweetDeck,2015-03-15 13:00:20,2,2,Enjoyed hearing from U.S. Capitol Police Chief Kim Dine at a Legislative Branch Subcommittee hearing this week. http://t.co/UfHz4EQGWR,,,,,
576805043006930944,193794406,sencapito,TweetDeck,2015-03-14 18:00:13,1,6,ICYMI: @RollCall reported on my first Legislative Branch Subcommittee hearing this week: http://t.co/SS9reViTVZ. http://t.co/fgZ2QMrYT2,,,,,
576737061325017088,193794406,sencapito,TweetDeck,2015-03-14 13:30:05,8,4,Please READ &amp; RETWEET my e-newsletter for highlights from this week in Washington: http://t.co/tlHS6JL6Xy http://t.co/jcu1N8Cg5G,,,,,
576446519034908672,193794406,sencapito,Twitter Web Client,2015-03-13 18:15:34,7,1,My weekly video address to West Virginians is now live. Please WATCH &amp; RT to spread the word! http://t.co/6DrVQssiWO,,,,,
576420290567258112,193794406,sencapito,Twitter Web Client,2015-03-13 16:31:21,0,0,Statement on my visit to the @YeagerAirport landslide site w/ @GovTomblin &amp; @Sen_JoeManchin http://t.co/r4efVMmtkw http://t.co/A0KEwUwvbh,,,,,
576398746700877824,193794406,sencapito,Twitter Web Client,2015-03-13 15:05:44,3,2,"Director Rick Atkinson leads briefing about the @YeagerAirport landslide with @GovTomblin, @Sen_JoeManchin and I. http://t.co/2wzoKEQuf5",,,,,
576396029328814080,193794406,sencapito,TweetDeck,2015-03-13 14:54:56,8,0,RT @GovTomblin: PHOTO: Gov. Tomblin joins @SenCapito and @Sen_JoeManchin for briefing on the @YeagerAirport mudslide. http://t.co/XdYCK9fKdg,,,576395619004198912,607332953,GovTomblin
576148238585044994,193794406,sencapito,TweetDeck,2015-03-12 22:30:19,9,11,".@JohnKerry calls fossil fuels outdated, but coal provides 95% of WV’s power &amp; pays the bills for tens of thousands of WV’s families.",,,,,
576125653130424320,193794406,sencapito,TweetDeck,2015-03-12 21:00:34,2,1,Happy @GirlScouts Week! Proud to be a co-chair of the Honorary Girl Scout Troop Capitol Hill. #girlscoutsrock,,,,,
576116578984599553,193794406,sencapito,Twitter Web Client,2015-03-12 20:24:30,3,5,Today I spoke in favor of the Justice for Victims of Trafficking Act. Read my remarks here: http://t.co/sE1YwK5vEu http://t.co/AQZ8fxudYO,,,,,
576087391150166016,193794406,sencapito,Twitter Web Client,2015-03-12 18:28:31,3,3,Speaking on the @SenateFloor shortly in support of the Justice for Victims of Trafficking Act. Watch: http://t.co/HW7lyAPMGe #EndTrafficking,,,,,
576045665425473536,193794406,sencapito,TweetDeck,2015-03-12 15:42:43,1,0,Speaking w/ @HoppyKercheval at 11:45 about yesterday’s @EPWRepublicans hearing &amp; @EPA’s anti-coal regs. Listen live: http://t.co/AbhXF03IZU,,,,,
576015616064286720,193794406,sencapito,Twitter Web Client,2015-03-12 13:43:19,1,0,"RT @SenThadCochran: At 9:45 ET, @SenCapito will chair a hearing of the Legislative Branch Appropriations Subcommittee. Watch live --&gt; http:…",,,576014735847600128,555474658,SenThadCochran
576014936452816897,193794406,sencapito,Twitter Web Client,2015-03-12 13:40:37,3,0,"Watch today’s Leg. Branch Subcmte hearing on the @SenateSAA, Secretary of the Senate &amp; Capitol Police budget here: http://t.co/h20tFSKFe3",,,,,
575772536895631360,193794406,sencapito,Twitter Web Client,2015-03-11 21:37:24,5,15,"Enjoyed meeting Gene Bailey &amp; Yihang Liu, West Virginia’s @SenateYouth #USSYP2015 delegates. Keep up the great work! http://t.co/4CTCOE9OhJ",,,,,
575758464615604224,193794406,sencapito,Twitter Web Client,2015-03-11 20:41:29,2,0,RT @rbschaffer: @SenCapito Thnx for meeting with WV credit union staff and volunteers 2 day. #CUNAGAC #stopthedatabreaches http://t.co/2aph…,,,575751774167920640,178772539,rbschaffer
575710944388644867,193794406,sencapito,Twitter Web Client,2015-03-11 17:32:39,2,2,Good @charleywest editorial highlighting my agenda for a prosperous West Virginia: http://t.co/3ICtHDMVge,,,,,
575694396651364352,193794406,sencapito,Twitter Web Client,2015-03-11 16:26:54,11,10,Today I questioned state regulators about the threat of @EPA’s overreaching carbon rules for existing power plants. http://t.co/BOUgkswIMp,,,,,
575422209969250304,193794406,sencapito,Twitter Web Client,2015-03-10 22:25:20,4,3,The #TSCA reform bill will help protect our families and communities. Proud to be a co-sponsor: http://t.co/m4nPTTpDC1.,,,,,
575412954281050113,193794406,sencapito,Twitter Web Client,2015-03-10 21:48:33,1,2,Dr. Suzanne Shipley has done a terrific job as president of @ShepherdU. Wishing her the best of luck on her next endeavor.,,,,,
575398453154611200,193794406,sencapito,Twitter Web Client,2015-03-10 20:50:56,8,7,ICYMI: I delivered my maiden speech on the @SenateFloor today. Watch the video here: http://t.co/uFBXAFrb8r.,,,,,
575372176066547712,193794406,sencapito,TweetDeck,2015-03-10 19:06:31,6,0,RT @SenThadCochran: Webcast starts soon: @SenCapito leads Senate Approps hearing on FY16 budget requests for @USCBO &amp; @USGAO: http://t.co/K…,,,575370317721399299,555474658,SenThadCochran
575368877959430144,193794406,sencapito,TweetDeck,2015-03-10 18:53:24,8,6,"After receiving many comments from Congress &amp; others on its proposal, @ATFHQ does the right thing for American sportsmen &amp; pulls ammo ban",,,,,
575326329790402560,193794406,sencapito,Twitter Web Client,2015-03-10 16:04:20,11,7,Fighting for West Virginians always has and always will be my top priority.,,,,,
575326152841117697,193794406,sencapito,Twitter Web Client,2015-03-10 16:03:38,1,2,"There will be differences of opinion and philosophy along the way, but Americans expect that we bridge those gaps.",,,,,
575326115209871360,193794406,sencapito,Twitter Web Client,2015-03-10 16:03:29,3,0,I am optimistic that we can find solutions that move our country forward.,,,,,
575325880525930497,193794406,sencapito,Twitter Web Client,2015-03-10 16:02:33,0,0,We need improved energy infrastructure in order to make full use of these gas reserves.,,,,,
575325829204471808,193794406,sencapito,Twitter Web Client,2015-03-10 16:02:21,0,2,"As a child of Marshall Co., the heart of Marcellus Shale development in WV, I’m delighted to see this community come alive with opportunity",,,,,
575325735054917632,193794406,sencapito,Twitter Web Client,2015-03-10 16:01:58,3,2,We must continue to support important research at Morgantown’s National Energy Technology Lab.,,,,,
575325695506780160,193794406,sencapito,Twitter Web Client,2015-03-10 16:01:49,3,0,"While @EPA’s proposed GHG standards are misguided, we should continue to make the use of fossil fuel cleaner and more efficient.",,,,,
575325648262164480,193794406,sencapito,Twitter Web Client,2015-03-10 16:01:38,3,2,"As Chair of the Subcmte on Clean Air &amp; Nuclear Safety, I will lead the fight against excessive regs that have been devastating to my state.",,,,,
575325533774483458,193794406,sencapito,Twitter Web Client,2015-03-10 16:01:10,7,2,"In WV, the attack on coal mines reduces revenues for education programs, roads &amp; other public services.",,,,,
575325495635673091,193794406,sencapito,Twitter Web Client,2015-03-10 16:01:01,3,1,Anti-coal policies impact more than miners &amp; their families.,,,,,
575325353130004482,193794406,sencapito,Twitter Web Client,2015-03-10 16:00:27,2,0,The administration’s overreach has contributed to thousands of coal miners losing their jobs in WV &amp; our neighboring states.,,,,,
575325234183667712,193794406,sencapito,Twitter Web Client,2015-03-10 15:59:59,2,1,"Finally, and of critical importance to West Virginia and the country, we need to work together to implement a commonsense #energy policy.",,,,,
575325178294628355,193794406,sencapito,Twitter Web Client,2015-03-10 15:59:46,2,0,I am encouraged that senators in both parties have recognized the importance of funding for the bipartisan S-CHIP program.,,,,,
575325076645670912,193794406,sencapito,Twitter Web Client,2015-03-10 15:59:21,2,0,"I started my legislative career in the WV House of Delegates, where I served on the committee that first implemented S-CHIP in our state.",,,,,
575324939051483136,193794406,sencapito,Twitter Web Client,2015-03-10 15:58:49,2,0,Expanded access to private medical providers will help improve the quality of care that we offer to our veterans.,,,,,
575324904922439680,193794406,sencapito,Twitter Web Client,2015-03-10 15:58:41,3,1,"While we have made strides to improve access for our veterans, the current program is not working as well as it should. More must be done.",,,,,
575324619273543680,193794406,sencapito,Twitter Web Client,2015-03-10 15:57:32,2,1,But we have to recognize that there is a role for government in helping broadband reach hard-to-serve communities.,,,,,
575324570971934720,193794406,sencapito,Twitter Web Client,2015-03-10 15:57:21,2,0,"Too much government control will be counterproductive, choking off private sector expansion projects and hindering new technologies.",,,,,
575324325454155777,193794406,sencapito,Twitter Web Client,2015-03-10 15:56:22,2,2,High-speed internet access is a pillar of our 21st Century infrastructure and a gateway to economic growth in rural America.,,,,,
575324289232166912,193794406,sencapito,Twitter Web Client,2015-03-10 15:56:14,3,4,I am committed to expanding access to broadband in communities across West Virginia and will be a champion for connecting our state.,,,,,
575324209146105857,193794406,sencapito,Twitter Web Client,2015-03-10 15:55:55,3,1,Our states need certainty to invest in their transportation infrastructure.  That certainty comes from a long-term transportation bill.,,,,,
575323797059928064,193794406,sencapito,Twitter Web Client,2015-03-10 15:54:16,4,1,Addressing our country's crumbling infrastructure is an area that can bridge the partisan divide and further economic growth.,,,,,
575323642277531648,193794406,sencapito,Twitter Web Client,2015-03-10 15:53:39,3,2,"Today I will outline how I plan to produce bipartisan, commonsense solutions in the United States Senate to make WV communities stronger.",,,,,
575323588477206528,193794406,sencapito,Twitter Web Client,2015-03-10 15:53:27,0,1,"As @SenateMajLdr Mitch McConnell has stated, to do this the Senate must work more, have an open amendment process and take tough votes (2/2)",,,,,
575323530801324033,193794406,sencapito,Twitter Web Client,2015-03-10 15:53:13,1,7,"I have heard a clear message from WVians: improve economic opportunities for our state, stop the bickering &amp; fight for our jobs. (1/2)",,,,,
575323425432010752,193794406,sencapito,Twitter Web Client,2015-03-10 15:52:48,0,1,I look forward to continuing to work with my friend @Sen_JoeManchin in the months ahead.,,,,,
575323356347633664,193794406,sencapito,Twitter Web Client,2015-03-10 15:52:31,1,0,West Virginians expect the United States Senate to find pragmatic solutions to the momentous problems confronting our country.,,,,,
575322815383138304,193794406,sencapito,Twitter Web Client,2015-03-10 15:50:22,7,7,To serve as West Virginia’s first female Senator is a true honor and one that comes with great responsibility.,,,,,
575320092344459264,193794406,sencapito,Twitter Web Client,2015-03-10 15:39:33,2,0,HAPPENING NOW: Tune in now to watch my maiden speech on the @SenateFloor http://t.co/VB4yKPZBUN,,,,,
575301258199896064,193794406,sencapito,Twitter Web Client,2015-03-10 14:24:43,2,1,"Good preview piece by @charleywest on my maiden speech: “Capito to focus on infrastructure, energy in first speech” http://t.co/RACMBsEssd",,,,,
575297457141190658,193794406,sencapito,Twitter Web Client,2015-03-10 14:09:36,11,13,This morning I will deliver my maiden speech on the @SenateFloor. Watch live here at approx. 11:30 AM: http://t.co/VB4yKPZBUN,,,,,
575295071857295361,193794406,sencapito,Twitter Web Client,2015-03-10 14:00:08,1,0,"RT @charleywest: .@SenCapito to focus on infrastructure, energy in first speech http://t.co/XSfwCJn8Gu",,,575278302891479040,16259734,charleywest
575089703902396417,193794406,sencapito,Twitter for iPhone,2015-03-10 00:24:04,7,11,Congratulations to West Virginia’s @SenateYouth delegates: http://t.co/vyubcWW4Ob  #USSYP2015 http://t.co/bASrSkPNBd,,,,,
575045835379073024,193794406,sencapito,Twitter Web Client,2015-03-09 21:29:45,5,6,.@NOAA approving @NYSCdotORG’s proposal for a #STEM education center in Tucker County is great news. Read more here: http://t.co/zQS2rPGC19,,,,,
574985897390837760,193794406,sencapito,Twitter Web Client,2015-03-09 17:31:35,3,1,My full statement on the fatal mine collapse in Marshall County last night: http://t.co/tVPKKf56EI.,,,,,
574952222720720897,193794406,sencapito,Twitter Web Client,2015-03-09 15:17:46,4,7,My prayers are with the family of the miner who lost his life in the Marshall County mine collapse &amp; those injured http://t.co/DtCXgN9gY8.,,,,,
574926581342289920,193794406,sencapito,Twitter Web Client,2015-03-09 13:35:53,1,2,Speaking with Hans Fogle on 1340 WEPM’s Panhandle Live now. Listen here: http://t.co/ECtGP2zfLL,,,,,
574660934930579457,193794406,sencapito,TweetDeck,2015-03-08 20:00:18,11,5,Good meeting with WV @VFWHQ members this week. RT if you agree: we must ensure our vets receive the care they deserve http://t.co/rydT2KOW9b,,,,,
574555232811663360,193794406,sencapito,TweetDeck,2015-03-08 13:00:16,6,10,Met with @Team4WVchildren this week to discussing preventing child abuse &amp; strengthening families. http://t.co/LjP5vAuCzj,,,,,
574207981853650944,193794406,sencapito,TweetDeck,2015-03-07 14:00:25,12,4,Please READ &amp; RETWEET my e-newletter for highlights from this week in Washington: http://t.co/lgQE33chdN http://t.co/iXNnBLjRwI,,,,,
573957803850743808,193794406,sencapito,Twitter Web Client,2015-03-06 21:26:18,5,20,Great to see @wvusga members in Washington this week! http://t.co/AuQ36WxHUU,,,,,
573906845095559169,193794406,sencapito,Twitter Web Client,2015-03-06 18:03:49,4,2,.@MonPowerWV is providing useful updates for customers in West Virginia experiencing power outages due to #WinterStormThor.,,,,,
573884744741617665,193794406,sencapito,Twitter Web Client,2015-03-06 16:36:00,2,2,ICYMI: I spoke with @HoppyKercheval about #KeystoneXL &amp; the need for a long-term transportation bill. Read more here: http://t.co/UQI6LywVAA,,,,,
573545592158314496,193794406,sencapito,Twitter for iPhone,2015-03-05 18:08:19,8,0,"For the latest on #WinterStormThor and a list of shelters &amp; warming stations around West Virginia, visit http://t.co/CFYjcoAmPu.",,,,,
573513401923588096,193794406,sencapito,TweetDeck,2015-03-05 16:00:25,2,0,Joining @HoppyKercheval on @WVMetroNews at 11:45 to share the latest from the U.S. Senate. Listen live here: http://t.co/jehbgFfRY8,,,,,
573220389419134976,193794406,sencapito,Twitter Web Client,2015-03-04 20:36:05,30,15,"Today, I voted to override the president’s #Keystone veto. Read my statement &amp; RT if you agree http://t.co/vfr4qekUo1 http://t.co/cwiPbQssjO",,,,,
573167242109693952,193794406,sencapito,Twitter Web Client,2015-03-04 17:04:54,5,2,Urging all West Virginians impacted by flooding to follow @WVDHSEM for updates on road closures &amp; flooding reports. Please stay safe.,,,,,
573142715967414272,193794406,sencapito,Twitter Web Client,2015-03-04 15:27:26,5,5,Happening soon: I’ll question @GinaEPA on the @EPA’s carbon &amp; ozone regs that threaten WV’s economy. Watch here: http://t.co/QBGDbuUMCD.,,,,,
573133093638443009,193794406,sencapito,Twitter Web Client,2015-03-04 14:49:12,5,0,RT @CharlestonRabbi: Thank you @SenCapito for meeting with and joining us for the @AIPAC PC! Appreciate your strong support of Israel! http…,,,572956657459826688,17621419,CharlestonRabbi
573120979557203968,193794406,sencapito,TweetDeck,2015-03-04 14:01:04,5,9,I hope the court will rule in favor of the millions harmed by #ObamaCare. (2/2),,,,,
573120752506945536,193794406,sencapito,TweetDeck,2015-03-04 14:00:10,2,2,"Today, the #SupremeCourt hears oral arguments in #KingvsBurwell about #ObamaCare, which was the wrong approach to healthcare reform. (1/2)",,,,,
572877791605080064,193794406,sencapito,Twitter Web Client,2015-03-03 21:54:43,10,17,I was honored to meet with fellow West Virginians representing @AIPAC in Washington today. We stand with Israel. http://t.co/QbGUR5l3gc,,,,,
572818972581617665,193794406,sencapito,TweetDeck,2015-03-03 18:01:00,2,1,New legislation to expedite the federal approval process for #LNG exports highlighted in today’s @charleywest: http://t.co/dnGFeQOV5u.,,,,,
572772565976023041,193794406,sencapito,Twitter Web Client,2015-03-03 14:56:35,22,28,Looking forward to PM @netanyahu’s speech before Congress today. The U.S.-Israel relationship must remain strong. http://t.co/GHRtpxP1A9,,,,,
572562510567628801,193794406,sencapito,Twitter for iPhone,2015-03-03 01:01:54,1,3,Toured the Capitol complex in preparation for my 1st hearing as Chair of Appropriations’ Legislative Branch subcmte. http://t.co/Z6EtvSXnKq,,,,,
572491779850801154,193794406,sencapito,Twitter Web Client,2015-03-02 20:20:51,5,7,The @washingtonpost gives President Obama’s untrue #KeystoneXL statements four Pinocchios: http://t.co/gbp9QSSzdp,,,,,
572456751796236288,193794406,sencapito,Twitter Web Client,2015-03-02 18:01:40,4,2,"Pipelines, like #KeystoneXL, create jobs &amp; allow states with vast shale gas reserves to prosper from #natgas boom: http://t.co/Ft03dvFxY7",,,,,
572436004352761856,193794406,sencapito,Twitter Web Client,2015-03-02 16:39:13,3,10,"Implications of the #KeystoneXL veto are far reaching, especially in WV where our energy resources, infrastructure &amp; jobs are linked.",,,,,
572435095019257858,193794406,sencapito,Twitter Web Client,2015-03-02 16:35:36,10,4,My op-ed in the @wvgazette urges President Obama to reconsider #KeystoneXL. Read it here: http://t.co/Ft03dvFxY7 http://t.co/iirzmepHT9,,,,,
572409433285918720,193794406,sencapito,Twitter Web Client,2015-03-02 14:53:38,4,1,Important editorial by @heralddispatch about the #CASAct &amp; protecting students: http://t.co/7FpJmIh6zD http://t.co/xPas9nT3RE,,,,,
572109117726175233,193794406,sencapito,TweetDeck,2015-03-01 19:00:17,3,8,"Spoke with Rick Thompson, WV’s Sec. of Veterans Assistance, about ensuring our vets receive the care they deserve. http://t.co/6e4s1ofYhe",,,,,
572033629221625858,193794406,sencapito,TweetDeck,2015-03-01 14:00:19,5,14,Enjoyed meeting cadets from @CivilAirPatrol’s West Virginia Wing this week. http://t.co/YUZG4yyi9F,,,,,
571799578703339520,193794406,sencapito,TweetDeck,2015-02-28 22:30:17,7,2,.@Your4State reports on the #StopDrugsAtTheBorderAct - my legislation to combat WV's drug epidemic. Watch here: http://t.co/Sr8ZnLXeJ2,,,,,
571776966484881408,193794406,sencapito,TweetDeck,2015-02-28 21:00:26,3,5,"This week, I met with the @WVFarmBureau about protecting our farming and ag communities from federal overreach. http://t.co/orLutTXvBl",,,,,
571750401155969026,193794406,sencapito,TweetDeck,2015-02-28 19:14:52,10,6,Please check out my e-newsletter for highlights from this busy week in Washington: http://t.co/MavKiCvv7F http://t.co/41c3wgk19J,,,,,
571738720128409600,193794406,sencapito,Twitter Web Client,2015-02-28 18:28:27,4,0,RT @Your4State: Sen. Capito Working to Stop Growing Drug Problem in Eastern Panhandle. #DC via @NicholasRMunson http://t.co/xWluiEGoy2,,,571460544214908928,15844989,Your4State
571406227244244993,193794406,sencapito,Twitter Web Client,2015-02-27 20:27:15,6,1,WATCH my weekly video address to West Virginians for an update from the Senate. RT to spread the word! https://t.co/sKlArTfdrr,,,,,
571386522991247360,193794406,sencapito,Twitter Web Client,2015-02-27 19:08:57,2,2,Full statement on my vote to fund DHS. UPDATED LINK --&gt; http://t.co/NDLvg6buST,,,,,
571381579513237504,193794406,sencapito,Twitter Web Client,2015-02-27 18:49:18,2,2,"While I ardently oppose President Obama’s executive amnesty, funding DHS must be our top priority. More here: http://t.co/BhzptjvlDn",,,,,
571380055974268928,193794406,sencapito,Twitter Web Client,2015-02-27 18:43:15,1,0,RT @ENR_GOP: .@SenCapito questions @forestservice #FSChief Tidwell on the dept's budget priorities at #Senate #Energy hearing http://t.co/A…,,,571357903040290816,82657929,ENR_GOP
571286154470776832,193794406,sencapito,TweetDeck,2015-02-27 12:30:07,2,1,"At 8:07 AM, I’ll be joining Radio Active with Craig Hammond on WHIS 1440 in Bluefield. Listen here: http://t.co/HRS0RPOii1",,,,,
571100346174574592,193794406,sencapito,Twitter Web Client,2015-02-27 00:11:47,4,1,I proudly joined 11 of my colleagues to reintroduce the #CASAct today. Read the recap here: http://t.co/PtMJmKKfyL http://t.co/Abrn9QOILz,,,,,
571031112333598723,193794406,sencapito,Twitter Web Client,2015-02-26 19:36:41,1,1,The need for congressional action is clear. #passCASAct #CASAct,,,,,
571030972570976258,193794406,sencapito,Twitter Web Client,2015-02-26 19:36:07,3,9,No student on a college campus should live in fear of being attacked or feel as though they cannot report sexual assault incidents. #CASAct,,,,,
571030675580698624,193794406,sencapito,Twitter Web Client,2015-02-26 19:34:56,0,3,I am proud to join this bipartisan coalition and take clear steps to help those affected by sexual assault. #CASAct,,,,,
571021430890098688,193794406,sencapito,Twitter Web Client,2015-02-26 18:58:12,2,2,Joining a bipartisan group of Senators to reintroduce the Campus Accountability &amp; Safety Act. Watch live --&gt; https://t.co/ZfuzOnaXvP #CASAct,,,,,
571012843321077760,193794406,sencapito,Twitter Web Client,2015-02-26 18:24:05,0,1,Excited to join my colleagues as we reintroduce the #CASAct. Watch the press conference live at 2 PM here: http://t.co/cpXpd2MTHX,,,,,
571002570690465793,193794406,sencapito,Twitter Web Client,2015-02-26 17:43:16,3,4,Enjoyed speaking with @WVExecMag about my commitment to serving West Virginians. Store here: http://t.co/1x8NlTPFiI. https://t.co/BHhzeGTU3p,,,,,
