Title,Artist,ArtistBio,Date,Medium,Dimensions,CreditLine,MoMANumber,Classification,Department,DateAcquired,CuratorApproved,ObjectID,URL
Artist 2000 from the portfolio Art,Rosemarie Trockel,"(German, born 1952)",1999,Etching,"composition  31 5/8 x 22 3/8"" (80.3 x 56.9 cm)sheet  31 5/8 x 22 3/8"" (80 x 56.9 cm)",Acquired through the generosity of Edward and Evanne Gargiulo,178.2000,Print,Prints & Illustrated Books,2000-03-02,Y,63758,http://www.moma.org/collection/works/63758
Assaver,"Various Artists, Hans Weigand, Raymond Pettibon, Jason Rhoades","(Various) (Austrian, born 1954) (American, born 1957) (American, 1965–2006)",1999,"Multiple of plastic, rubber, foam, paper, nylon, and motor",,Linda Barth Goldstein Fund,179.2000,Print,Prints & Illustrated Books,2000-03-02,Y,63775,http://www.moma.org/collection/works/63775
"Recycle, it's the law! from Exit 99",David Byrne,"(American, born 1952)",1999,Screenprint on fabric from a portfolio of seven screenprints and one etching and aquatint,"composition and sheet: 29 1/2 x 21 5/8"" (75 x 55cm)",Jacqueline Brody Fund,180.2000.1,Print,Prints & Illustrated Books,2000-03-02,Y,63798,http://www.moma.org/collection/works/63798
Exit 99,"Various Artists, Lisa Yuskavage, Nari Ward, Richard Tuttle, Tony Oursler, Leon Golub, Inka Essenhigh, Bruce Pearson, David Byrne","(American) (American, born 1962) (American, born 1963) (American, born 1941) (American, born 1957) (American, 1922–2004) (American, born 1969) (American) (American, born 1952)",1999,Portfolio of seven screenprints and one etching and aquatint,dimensions vary,Jacqueline Brody Fund,180.2000.1-8,Print,Prints & Illustrated Books,2000-03-02,Y,63799,http://www.moma.org/collection/works/63799
Flush & Aqua from Exit 99,Inka Essenhigh,"(American, born 1969)",1999,Screenprint from a portfolio of seven screenprints and one etching and aquatint,"composition: 26 15/16 x 19 7/8"" (68.5 x 50.5cm); sheet: 29 15/16 x 21 7/8"" (76 x 55.6cm)",Jacqueline Brody Fund,180.2000.2,Print,Prints & Illustrated Books,2000-03-02,Y,63800,http://www.moma.org/collection/works/63800
Why Me! from Exit 99,Leon Golub,"(American, 1922–2004)",1999,Screenprint from a portfolio of seven screenprints and one etching and aquatint,"composition: 27 1/2 x 20 3/4"" (69.8 x 52.7cm); sheet: 29 15/16 x 22 1/16"" (76 x 56cm)",Jacqueline Brody Fund,180.2000.3,Print,Prints & Illustrated Books,2000-03-02,Y,63801,http://www.moma.org/collection/works/63801
Surveillance; Alien/Houston St. Deli from Exit 99,Tony Oursler,"(American, born 1957)",1999,Screenprint from a portfolio of seven screenprints and one etching and aquatint,"composition: 25 x 16 3/4"" (63.5 x 42.5cm); sheet: 29 15/16 x 21 15/16"" (76 x 55.8cm)",Jacqueline Brody Fund,180.2000.4,Print,Prints & Illustrated Books,2000-03-02,Y,63802,http://www.moma.org/collection/works/63802
Clearly Its Closer to Rising from Exit 99,Bruce Pearson,(American),1999,Screenprint from a portfolio of seven screenprints and one etching and aquatint,"composition and sheet: 29 15/16 x 22"" (76 x 55.9cm)",Jacqueline Brody Fund,180.2000.5,Print,Prints & Illustrated Books,2000-03-02,Y,63803,http://www.moma.org/collection/works/63803
Flip from Exit 99,Richard Tuttle,"(American, born 1941)",(1999),"Screenprint, die cutting, and wool","irreg composition  30 x 21 15/16"" (76.2 x 55.7 cm)sheet  30 x 21 15/16"" (76 x 55.7 cm)",Jacqueline Brody Fund,180.2000.6,Print,Prints & Illustrated Books,2000-03-02,N,63804,
Lorraine from Exit 99,Nari Ward,"(American, born 1963)",1999,"Screenprint, thermography, and photography","composition  27 1/2 x 20 7/8"" (69.8 x 53 cm)sheet  30 1/16 x 21 7/8"" (76 x 55.6 cm)",Jacqueline Brody Fund,180.2000.7,Print,Prints & Illustrated Books,2000-03-02,N,63805,
Night Flowers from Exit 99,Lisa Yuskavage,"(American, born 1962)",1999,Etching and aquatint from a portfolio of seven screenprints and one etching and aquatint,"plate: 17 13/16 x 21 7/8"" (45.3 x 55.6cm); sheet: 21 5/8 x 26 15/16"" (55 x 68.5cm)",Jacqueline Brody Fund,180.2000.8,Print,Prints & Illustrated Books,2000-03-02,Y,63806,http://www.moma.org/collection/works/63806
Camouflage,Andy Warhol,"(American, 1928–1987)",1987,Portfolio of eight screenprints,"composition and sheet (each): 38 x 38"" (96.5 x 96.5 cm)",John B. Turner Fund,181.2000.1-8,Print,Prints & Illustrated Books,2000-03-02,Y,63822,http://www.moma.org/collection/works/63822
"EYES, DARK",Lynne Yamamoto,(Nationality unknown),1999-2000,Portfolio of 16 photogravures,,Monroe Wheeler Fund,182.2000.1-16,Print,Prints & Illustrated Books,2000-03-02,N,63856,
Decrease the Mass and Run Like Hell (for Parkett 57),Doug Aitken,"(American, born 1968)",1999,"Multiple of mylar, wood, plastic, and fabric kite; and commercially-printed poster","composition (Kite): 34 1/4 x 32 11/16"" (87 x 83 cm); sheet (poster): 20 1/16 x 15 9/16"" (51 x 39.5 cm)",Roxanne H. Frank Fund,1331.2000.1-2,Print,Prints & Illustrated Books,2000-11-09,Y,76378,http://www.moma.org/collection/works/76378
The Man in Black/Drone Harness,Matthew Barney,"(American, born 1967)",2000,Multiple of vinyl record and folio jacket,"Sheet (cover): 12 3/8 x 12 5/16"" (31.4 x 31.3 cm)",Monroe Wheeler Fund,1332.2000.1-2,Print,Prints & Illustrated Books,2000-11-09,Y,76381,http://www.moma.org/collection/works/76381
Untitled (for Parkett no. 56),Vanessa Beecroft,"(Italian, born 1969)",1999,Series of five screenprints,"composition (each): 19 13/16 x 27 5/8"" (50.4 x 70.2 cm); sheet (each): 19 11/16 x 27 5/8"" (50 x 70.2 cm)",Roxanne H. Frank Fund,1333.2000.1-5,Print,Prints & Illustrated Books,2000-11-09,Y,76384,http://www.moma.org/collection/works/76384
Exquisite Corpse,"Jake Chapman, Dinos Chapman","(British, born 1966) (British, born 1962)",2000,Portfolio of twenty etchings,"plate (each): 9 1/16 x 7 1/16"" (23 x 18 cm); sheet (each): 18 1/8 x 14 15/16"" (46 x 38 cm)",Roxanne H. Frank Fund,1334.2000.1-20,Print,Prints & Illustrated Books,2000-11-09,Y,76387,http://www.moma.org/collection/works/76387
Self-Portrait Manipulated,Chuck Close,"(American, born 1940)",1982,Handmade paper,"Composition: 29 5/16 x 20 7/8"" (74.5 x 53 cm); sheet: 38 3/16 x 27 15/16"" (97 x 71 cm)","John B. Tuner Fund and Eugene Mercy, Jr. Fund",1335.2000,Print,Prints & Illustrated Books,2000-11-09,Y,76390,http://www.moma.org/collection/works/76390
Self-Portrait/Spitbite/White on Black,Chuck Close,"(American, born 1940)",1997,Aquatint,"Plate: 13 1/2 x 9 5/8"" (34.3 x 24.4 cm); sheet: 21 x 15 3/4"" (53.3 x 40 cm)",Gift of the artist,1336.2000,Print,Prints & Illustrated Books,2000-11-09,Y,76393,http://www.moma.org/collection/works/76393
Self-Portrait No. 1,Chuck Close,"(American, born 1940)",1997,Linoleum cut,"Composition: 11 11/16 x 8 7/8"" (29.7 x 22.5 cm); sheet: 23 5/8 x 17 15/16"" (60 x 45.5 cm)","John B. Turner Fund and Eugene Mercy, Jr. Fund",1337.2000,Print,Prints & Illustrated Books,2000-11-09,Y,76396,http://www.moma.org/collection/works/76396
Self-Portrait,Chuck Close,"(American, born 1940)",2000,Screenprint,"Composition: 58 7/8 x 47 7/16"" (149.5 x 120.5 cm); sheet: 65 3/4 x 54 1/8"" (167 x 137.5 cm)",Gift of the artist,1338.2000,Print,Prints & Illustrated Books,2000-11-09,Y,76399,http://www.moma.org/collection/works/76399
Self-Portrait/Scribble/Etching,Chuck Close,"(American, born 1940)",2000,Soft-ground etching,"Composition: 9 13/16 x 8 1/16"" (25 x 20.5 cm); sheet: 18 1/8 x 15 3/8"" (46 x 39 cm)",Gift of the artist,1339.2000,Print,Prints & Illustrated Books,2000-11-09,Y,76402,http://www.moma.org/collection/works/76402
Self-Portrait/Squibble/Etching Box Set,Chuck Close,"(American, born 1940)",2000,12 plate proofs and 12 progressive proofs,"Plate: 11 7/8 x 10"" (30.1 x 25.4 cm); sheet: 18 1/8 x 15 3/8"" (46 x 39 cm)",Gift of the artist,1340.2000.1-25,Print,Prints & Illustrated Books,2000-11-09,Y,76405,http://www.moma.org/collection/works/76405
Self-Portrait/Pulp/Pochoir,Chuck Close,"(American, born 1940)",2000,Paper pulp and pochoir,"composition and sheet: 25 3/16 x 19 5/16"" (64 x 49 cm)",Gift of the artist,1341.2000,Print,Prints & Illustrated Books,2000-11-09,Y,76408,http://www.moma.org/collection/works/76408
"Human Furrier, Nipple Corset",Nicola Constantino,"(Argentine, born 1964)",(1999),Multiple of silicone and fabric,"overall (irreg.): 13 3/8 x 32 1/16 x 9 1/16"" (34 x 81.5 x 23 cm)",Gift of Juan Vergez,1342.2000,Print,Prints & Illustrated Books,2000-11-09,Y,76412,http://www.moma.org/collection/works/76412
His Mistress' Toy (for Parkett no. 58),Sylvie Fleury,"(Swiss, born 1961)",2000,Multiple of polyurethane shoe with integrated noisemaker,"Overall: 4 7/16 x 3 3/4 x 7 11/16"" (11.2 x 9.5 x 19.5 cm)",Roxanne H. Frank Fund,1343.2000,Multiple,Prints & Illustrated Books,2000-11-09,Y,76422,http://www.moma.org/collection/works/76422
Ssblak! Ssblak!! SSblakallblak! Wonder #9,Ellen Gallagher,"(American, born 1965)",2000,Portfolio of ten mixed media prints,see child records,Virginia Cowles Schroth Fund,1344.2000.1-10,Print,Prints & Illustrated Books,2000-11-09,Y,76426,http://www.moma.org/collection/works/76426
Lambs Ears (for Parkett no. 57),Nan Goldin,"(American, born 1953)",1999,Chromogenic color print,"composition: 15 7/8 x 23 7/16"" (40.3 x 59.6 cm); sheet: 19 11/16 x 24 1/16"" (50 x 61.1 cm)",Roxanne H. Frank Fund,1345.2000,Print,Prints & Illustrated Books,2000-11-09,Y,76430,http://www.moma.org/collection/works/76430
Swiss Made (for Parkett no. 57),Thomas Hirschhorn,"(Swiss, born 1957)",1999,"Multiple of cardboard, aluminum foil, felt, wood, and plastic","composition: 93 11/16 x 20 9/16 x 2 3/8"" (238 x 52.2 x 6 cm)",Roxanne H. Frank Fund,1346.2000,Print,Prints & Illustrated Books,2000-11-09,Y,76434,http://www.moma.org/collection/works/76434
Blowing Up the Brandenburg Gate. Proposal for the 1994-95 Competition for Berlin Memorial for the Murdered Jews of Europe,Horst Hoheisel,"(German, born 1944)",1995,Two lithographs with oil crayon and pencil additions,,Gift of the artist,1347.2000.1-2,Print,Prints & Illustrated Books,2000-11-09,Y,76438,http://www.moma.org/collection/works/76438
Untitled,Jasper Johns,"(American, born 1930)",2000,Linoleum cut,"Composition: 16 1/8 x 10 5/8"" (41 x 27 cm); sheet: 22 13/16 x 16 3/4"" (58 x 42.5 cm)","Acquired through the generosity of Nelson Blitz, Jr. with Catherine Woodard and Perri and Allison Blitz in honor of Riva Castleman",1348.2000,Print,Prints & Illustrated Books,2000-11-09,Y,76442,http://www.moma.org/collection/works/76442
Small Vitrine,Michael Joo,"(American, born 1966)",2000,Multiple of plastic anatomical model,"overall: 4 3/4 x 8 1/4 x 7 5/16"" (12 x 21 x 18.5 cm)",Gift of Agnes Gund and Daniel Shapiro,1349.2000,Multiple,Prints & Illustrated Books,2000-11-09,Y,76446,http://www.moma.org/collection/works/76446
Encounter with an Angel,Ilya Kabakov,"(American, born Russia 1933)",2000,Lithograph,"Composition: 24 13/16 x 35 1/4"" (63 x 89.5 cm); sheet: 33 7/8 x 43 1/2"" (86 x 110.5 cm)",Gift of Agnes Gund and Daniel Shapiro,1350.2000,Print,Prints & Illustrated Books,2000-11-09,Y,76450,http://www.moma.org/collection/works/76450
How Can One Change One's Self?,Ilya Kabakov,"(American, born Russia 1933)",2000,Lithograph,"Composition: 24 13/16 x 35 1/4"" (63 x 89.5 cm); sheet: 33 7/8 x 43 7/16"" (86 x 110.3 cm)",Gift of Agnes Gund and Daniel Shapiro,1351.2000,Print,Prints & Illustrated Books,2000-11-09,Y,76454,http://www.moma.org/collection/works/76454
Untitled,Julian Lethbridge,"(British, born 1947)",1999,Lithograph,"Composition: 20 1/16 x 20 1/16"" (51 x 51 cm); sheet: 34 1/4 x 28 1/4"" (87 x 71.7 cm)",Gift of Emily Fisher Landau,1352.2000,Print,Prints & Illustrated Books,2000-11-09,Y,76457,http://www.moma.org/collection/works/76457
Rythm Mastr: Every Beat of My Heart; Rythm Mastr: Bulletin!; and Rythm Mastr: Tower of Power,Kerry James Marshall,"(American, born 1955)",1999-2000,Double-sided photolithographs,"Composition (each): 16 1/8 x 9 11/16"" (41 x 24.6 cm)Sheet (each): 22 7/16 x 16 7/8"" (57 x 42.8 cm)",Monroe Wheeler Fund,1353.2000.1-3,Print,Prints & Illustrated Books,2000-11-09,Y,76461,http://www.moma.org/collection/works/76461
Or (Red Rover),Suzanne McClelland,"(American, born 1959)",2000,"Etching, drypoint and aquatint on chine colle","Composition: 7 7/8 x 7 3/4"" (20 x 19.7 cm)Sheet: 14 9/16 x 13 5/8"" (37 x 34.6 cm)",Gift of Emily Fisher Landau,1354.2000,Print,Prints & Illustrated Books,2000-11-09,Y,76465,http://www.moma.org/collection/works/76465
Elephant Women from the series Personal Articles,Vik Muniz,"(Brazilian, born 1961)",2000,Photolithograph,"Composition (irreg.): 9 5/16 x 6"" (23.6 x 15.2 cm)Sheet (irreg.): 9 5/16 x 6"" (23.6 x 15.2 cm)Mat: 20 x 16"" (50.8 x 40.6 cm)",Frances Keech Fund,1355.2000.1,Print,Prints & Illustrated Books,2000-11-09,Y,76470,http://www.moma.org/collection/works/76470
"""Hey If You're So Damn Smart, Why Can't You Ever Get a Date?"" from the series Personal Articles",Vik Muniz,"(Brazilian, born 1961)",2000,Photolithograph,"Composition (irreg.): 12 1/8 x 5 1/4"" (30.8 x 13.3 cm)Sheet (irreg.): 12 1/8 x 5 1/4"" (30.8 x 13.3 cm)Mat: 20 x 16"" (50.8 x 40.6 cm)",Frances Keech Fund,1355.2000.2,Print,Prints & Illustrated Books,2000-11-09,Y,76471,http://www.moma.org/collection/works/76471
Hundreds Die by Own Hand from the series Personal Articles,Vik Muniz,"(Brazilian, born 1961)",2000,Photolithograph,"Composition (irreg.): 12 1/16 x 4 1/2"" (30.7 x 11.4 cm)Sheet (irreg.): 12 1/16 x 4 1/2"" (30.7 x 11.4 cm)Mat: 20 x 16"" (50.8 x 40.6 cm)",Frances Keech Fund,1355.2000.3,Print,Prints & Illustrated Books,2000-11-09,Y,76472,http://www.moma.org/collection/works/76472
Never Before Released Cassavetes Thriller Is a Joy Ride from the series Personal Articles,Vik Muniz,"(Brazilian, born 1961)",2000,Photolithograph,"Composition (irreg.): 12 7/8 x 6"" (32.7 x 15.2 cm)Sheet (irreg.): 6 x 6 1/2"" (15.2 x 16.5 cm)Mat: 20 x 16"" (50.8 x 40.6 cm)",Frances Keech Fund,1355.2000.4,Print,Prints & Illustrated Books,2000-11-09,Y,76473,http://www.moma.org/collection/works/76473
New Lascaux Amusement Park to bring renewed wealth and lost of excitement to Vazére valley from the series Personal Articles,Vik Muniz,"(Brazilian, born 1961)",2000,Photolithograph,"Composition (irreg.): 10 11/16 x 6 7/8"" (27.1 x 17.5 cm)Sheet (irreg.): 10 11/16 x 6 7/8"" (27.1 x 17.5 cm)Mat: 20 x 16"" (50.8 x 40.6 cm)",Frances Keech Fund,1355.2000.5,Print,Prints & Illustrated Books,2000-11-09,Y,76474,http://www.moma.org/collection/works/76474
Dalai Lama Introduces Meditation Software from the series Personal Articles,Vik Muniz,"(Brazilian, born 1961)",2000,Photolithograph,"Composition: 6 5/16 x 11 1/4"" (16 x 28.6 cm)Sheet: 6 5/16 x 11 1/4"" (16 x 28.6 cm)Mat: 16 x 20"" (40.6 x 50.8 cm)",Frances Keech Fund,1355.2000.6,Print,Prints & Illustrated Books,2000-11-09,Y,76475,http://www.moma.org/collection/works/76475
"""Hey! Never Mind the Content - Look at the Context!"" from the series Personal Articles",Vik Muniz,"(Brazilian, born 1961)",2000,Photolithograph,"Composition (irreg.): 10 1/8 x 4 3/16"" (25.7 x 10.6 cm)Sheet (irreg.): 10 1/8 x 4 3/16"" (25.7 x 10.6 cm)Mat: 20 x 16"" (50.8 x 40.6 cm)",Frances Keech Fund,1355.2000.7,Print,Prints & Illustrated Books,2000-11-09,Y,76476,http://www.moma.org/collection/works/76476
John & Jackie,Elizabeth Peyton,"(American, born 1965)",2000,Lithograph,"Composition: 24 x 19"" (61 x 48.2 cm)Sheet: 24 x 19"" (61 x 48.2 cm)",Acquired through the generosity of Marian and James H. Cohen in memory of Andrew Golkin,1356.2000,Print,Prints & Illustrated Books,2000-11-09,Y,76480,http://www.moma.org/collection/works/76480
Prince Harry and Prince William,Elizabeth Peyton,"(American, born 1965)",2000,Lithograph,"composition: 24 1/8 x 18 7/8"" (61.2 x 48cm); sheet: 24 x 18 7/8"" (61 x 48cm)",Howard B. Johnson Fund,1357.2000,Print,Prints & Illustrated Books,2000-11-09,Y,76485,http://www.moma.org/collection/works/76485
Ace from the series Ruminations,Robert Rauschenberg,"(American, 1925–2008)",1999,Photolithograph,"Composition (irreg.): 28 3/4 x 45 11/16"" (73 x 116 cm)Sheet: 30 5/16 x 45 3/4"" (77 x 116.2 cm)",Gift of Emily Fisher Landau,1358.2000,Print,Prints & Illustrated Books,2000-11-09,Y,76490,http://www.moma.org/collection/works/76490
Big and Little Bullys from the series Ruminations,Robert Rauschenberg,"(American, 1925–2008)",1999,Photolithograph,"Composition (irreg.): 48 13/16 x 57 1/16"" (124 x 145 cm)Sheet: 46 1/16 x 58 1/8"" (117 x 147.6 cm)",Gift of Emily Fisher Landau,1359.2000,Print,Prints & Illustrated Books,2000-11-09,Y,76507,http://www.moma.org/collection/works/76507
Eagle Eye from the series Ruminations,Robert Rauschenberg,"(American, 1925–2008)",1999,Photolithograph,"Composition (irreg.): 48 13/16 x 37"" (124 x 94 cm)Sheet: 49 5/8 x 37 15/16"" (126 x 96.3 cm)",Gift of Emily Fisher Landau,1360.2000,Print,Prints & Illustrated Books,2000-11-09,Y,76512,http://www.moma.org/collection/works/76512
Jap from the series Ruminations,Robert Rauschenberg,"(American, 1925–2008)",1999,Photolithograph,"Composition: 18 1/2 x 18 1/8"" (47 x 46 cm)Sheet: 19 11/16 x 25 13/16"" (50 x 65.5 cm)",Gift of Emily Fisher Landau,1361.2000,Print,Prints & Illustrated Books,2000-11-09,Y,76527,http://www.moma.org/collection/works/76527
John from the series Ruminations,Robert Rauschenberg,"(American, 1925–2008)",1999,Photolithograph,"Composition (irreg.): 25 3/16 x 33 7/8"" (64 x 86 cm)Sheet: 29 1/2 x 38 13/16"" (75 x 98.6 cm)",Gift of Emily Fisher Landau,1362.2000,Print,Prints & Illustrated Books,2000-11-09,Y,76531,http://www.moma.org/collection/works/76531
'Topher from the series Ruminations,Robert Rauschenberg,"(American, 1925–2008)",1999,Photolithograph,"Composition (irreg.): 37 13/16 x 25 9/16"" (96 x 65 cm)Sheet: 39 x 27 1/2"" (99 x 69.8 cm)",Gift of Emily Fisher Landau,1363.2000,Print,Prints & Illustrated Books,2000-11-09,Y,76535,http://www.moma.org/collection/works/76535
Democratic Presidential Campaign Print,Robert Rauschenberg,"(American, 1925–2008)",2000,Digital print,"Composition: 44 7/8 x 25 3/16"" (114 x 64 cm)Sheet: 47 1/4 x 29 9/16"" (120 x 75.1 cm)",Gift of Emily Fisher Landau,1364.2000,Print,Prints & Illustrated Books,2000-11-09,Y,76539,http://www.moma.org/collection/works/76539
Bottle pumpkin from perfect world (for Parkett no. 58),Jason Rhoades,"(American, 1965–2006)",2000,"Multiple of hand-painted gourd, backpack, chromogenic color prints, and round cardboard container","gourd: 7 7/8 x 7 7/8 x 13 3/4"" (20 x 20 x 35 cm)backpack: 9 1/16 x 11 13/16 x 16 1/8"" (23 x 30 x 41 cm)",Roxanne H. Frank Fund,1365.2000.1-4a-k,Print,Prints & Illustrated Books,2000-11-09,Y,76543,http://www.moma.org/collection/works/76543
"Ra 2 (21 Reds, 21 Blues, 24 Turquoises, 24 Yellows, 9 Blacks, 8 Whites)",Bridget Riley,"(British, born 1931)",1981,Screenprint,"Composition: 33 1/16 x 30 1/16"" (84 x 76.4 cm)Sheet: 41 3/4 x 36 9/16"" (106 x 92.9 cm)",Gift of Karsten Schubert,1366.2000,Print,Prints & Illustrated Books,2000-11-09,Y,76547,http://www.moma.org/collection/works/76547
"Silvered 2 (21 Reds, 21 Blues, 24 Turquoises, 24 Yellows, 9 Blacks, 8 Whites)",Bridget Riley,"(British, born 1931)",1981,Screenprint,"Composition: 34 3/16 x 29 15/16"" (86.8 x 76 cm)Sheet: 41 5/16 x 36 7/16"" (105 x 92.6 cm)",Gift of Karsten Schubert,1367.2000,Print,Prints & Illustrated Books,2000-11-09,Y,76551,http://www.moma.org/collection/works/76551
Hitchhiker - Speed of Light,James Rosenquist,"(American, born 1933)",1999,Lithograph,"Composition: 31 1/8 x 36 5/8"" (79 x 93 cm)Sheet: 36 1/4 x 42 1/2"" (92 x 108 cm)",Gift of Emily Fisher Landau,1368.2000,Print,Prints & Illustrated Books,2000-11-09,Y,76555,http://www.moma.org/collection/works/76555
Navigator - Speed of Light,James Rosenquist,"(American, born 1933)",1999,Lithograph,"Composition: 44 1/4 x 34 13/16"" (112.4 x 88.5 cm)Sheet: 44 1/8 x 34 13/16"" (112 x 88.5 cm)",Gift of Emily Fisher Landau,1369.2000,Print,Prints & Illustrated Books,2000-11-09,Y,76559,http://www.moma.org/collection/works/76559
Passenger - Speed of Light,James Rosenquist,"(American, born 1933)",1999,Lithograph,"Composition: 29 1/16 x 34 7/16"" (73.8 x 87.5 cm)Sheet: 35 13/16 x 39"" (91 x 99 cm)",Gift of Emily Fisher Landau,1370.2000,Print,Prints & Illustrated Books,2000-11-09,Y,76563,http://www.moma.org/collection/works/76563
Pilot - Speed of Light,James Rosenquist,"(American, born 1933)",1999,Lithograph,"Composition: 38 9/16 x 32 13/16"" (98 x 83.4 cm)Sheet: 38 9/16 x 32 13/16"" (98 x 83.4 cm)",Gift of Emily Fisher Landau,1371.2000,Print,Prints & Illustrated Books,2000-11-09,Y,76567,http://www.moma.org/collection/works/76567
Rider - Speed of Light,James Rosenquist,"(American, born 1933)",1999,Lithograph,"Composition: 34 15/16 x 45 7/16"" (88.8 x 115.4 cm)Sheet: 34 5/8 x 45 7/16"" (88 x 115.4 cm)",Gift of Emily Fisher Landau,1372.2000,Print,Prints & Illustrated Books,2000-11-09,Y,76571,http://www.moma.org/collection/works/76571
Sailor - Speed of Light,James Rosenquist,"(American, born 1933)",1999,Lithograph,"Composition: 27 1/2 x 23 11/16"" (69.9 x 60.2 cm)Sheet: 27 3/16 x 23 11/16"" (69 x 60.2 cm)",Gift of Emily Fisher Landau,1373.2000,Print,Prints & Illustrated Books,2000-11-09,Y,76575,http://www.moma.org/collection/works/76575
The Meteor Hits Picasso's Bed,James Rosenquist,"(American, born 1933)",1999,Photogravure,"Composition: 23 9/16 x 19"" (59.8 x 48.3 cm)Sheet: 22 1/16 x 27 1/4"" (56 x 69.2 cm)",Gift of Emily Fisher Landau,1374.2000,Print,Prints & Illustrated Books,2000-11-09,Y,76589,http://www.moma.org/collection/works/76589
Drifter: Speed of Light (for Parkett no. 58),James Rosenquist,"(American, born 1933)",2000,Lithograph,"Composition: 17 3/16 x 14 9/16"" (43.6 x 37 cm)Sheet: 16 15/16 x 14 9/16"" (43 x 37 cm)",Roxanne H. Frank Fund,1375.2000,Print,Prints & Illustrated Books,2000-11-09,Y,76593,http://www.moma.org/collection/works/76593
PECKINPAH,Lisa Ruyter,"(American, born 1968)",1999,Screenprint,"Composition: 22 5/16 x 35 11/16"" (56.6 x 90.7 cm)Sheet: 29 15/16 x 42 1/2"" (76 x 108 cm)",Gift of the artist,1376.2000,Print,Prints & Illustrated Books,2000-11-09,Y,76597,http://www.moma.org/collection/works/76597
Open Carefully,Richard Tuttle,"(American, born 1941)",2000,"Multiple of paper, plastic, stones, ink, and scotch tape","Composition: 3 15/16 x 9 1/16 x 1 3/16"" (10 x 23 x 3 cm)",Monroe Wheeler Fund,1378.2000,Print,Prints & Illustrated Books,2000-11-09,Y,76605,http://www.moma.org/collection/works/76605
Boo-Hoo (for Parkett no. 59),Kara Walker,"(American, born 1969)",2000,Linoleum cut,"Composition: 36 5/8 x 18 1/4"" (93 x 46.3 cm)Sheet: 39 3/4 x 20 1/2"" (101 x 52 cm)",The Ralph E. Shikes Fund,1379.2000,Print,Prints & Illustrated Books,2000-11-09,Y,76609,http://www.moma.org/collection/works/76609
Linking Graphics,Terry Winters,"(American, born 1949)",2000,Aquatint,"Composition: 33 11/16 x 42 1/2"" (85.6 x 108 cm)Sheet: 40 3/16 x 48 3/4"" (102 x 123.9 cm)",Gift of Emily Fisher Landau,1380.2000,Print,Prints & Illustrated Books,2000-11-09,Y,76613,http://www.moma.org/collection/works/76613
Untitled (Trisha Brown Dance Co.),Terry Winters,"(American, born 1949)",2000,Lithograph,"Composition: 20 11/16 x 29 5/16"" (52.5 x 74.5 cm)Sheet: 22 13/16 x 30 15/16"" (58 x 78.6 cm)",Gift of Emily Fisher Landau,1381.2000,Print,Prints & Illustrated Books,2000-11-09,Y,76617,http://www.moma.org/collection/works/76617
Amplitude,Terry Winters,"(American, born 1949)",2000,Aquatint,"Composition: 42 3/8 x 33 5/16"" (107.6 x 84.6 cm)Sheet: 53 1/8 x 43 1/8"" (135 x 109.6 cm)",Gift of Emily Fisher Landau,1382.2000,Print,Prints & Illustrated Books,2000-11-09,Y,76621,http://www.moma.org/collection/works/76621
Location Plan,Terry Winters,"(American, born 1949)",2000,Screenprint,"Composition: 21 5/8 x 35 7/16"" (55 x 90 cm)Sheet: 29 1/8 x 42 1/8"" (74 x 107 cm)",Gift of Agnes Gund and Daniel Shapiro,1383.2000,Print,Prints & Illustrated Books,2000-11-09,Y,76625,http://www.moma.org/collection/works/76625
Untitled,Francis Alÿs,"(Belgian, born 1959)",2000,Multiple of stencil and chalk,"composition (irreg.):  15 3/4 x 12 15/16"" (40 x 33 cm); sheet  12 x 23 7/8"" (30 x 60.7 cm)",Purchased with funds given by Francesca Danieli and Gary Gensler,1436.2001,Multiple,Prints & Illustrated Books,2000-05-24,Y,76798,http://www.moma.org/collection/works/76798
Jake at the New Viet Huong,Elizabeth Peyton,"(American, born 1965)",1995,Oil on masonite,"16 x 12"" (40.6 x 30.5 cm)",Gift of the Peter Norton Family Foundation,15.2000,Painting,Painting & Sculpture,2000-01-01,Y,78446,http://www.moma.org/collection/works/78446
Studio V,Georges Braque,"(French, 1882–1963)",1949-50,Oil on canvas,"57 7/8 x 69 1/2"" (147 x 176.5 cm)",Acquired through the Lillie P. Bliss Bequest,123.2000,Painting,Painting & Sculpture,2000-02-07,Y,78900,http://www.moma.org/collection/works/78900
Self-Portrait,Chuck Close,"(American, born 1940)",1997,Oil on canvas,"8' 6"" x 7' (259.1 x 213.4 cm)","Gift of Agnes Gund, Jo Carole and Ronald S. Lauder, Donald L. Bryant, Jr., Leon Black, Michael and Judy Ovitz, Anna Marie and Robert F. Shapiro, Leila and Melville Straus, Doris and Donald Fisher, and purchase",215.2000,Painting,Painting & Sculpture,2000-04-10,Y,79170,http://www.moma.org/collection/works/79170
Apache (Man on Horseback),Odilon Redon,"(French, 1840–1916)",c. 1875,Oil over traces of black chalk on tan cardstock mounted on canvas,"9 7/8 x 12 3/4"" (25.1 x 32.4 cm)",Gift of The Ian Woodner Family Collection,217.2000,Painting,Painting & Sculpture,2000-04-10,Y,79173,http://www.moma.org/collection/works/79173
Apache (Man on Horseback II),Odilon Redon,"(French, 1840–1916)",(c. 1875),Oil on tan wove paper mounted on tan board,"9 1/8 x 12 3/4"" (23.2 x 32.4 cm)",Gift of The Ian Woodner Family Collection,218.2000,Painting,Painting & Sculpture,2000-04-10,Y,79175,http://www.moma.org/collection/works/79175
